97;CITE GRENADE, AJOUPA BOUILLON
97;LOT DESCHAMPS, AJOUPA BOUILLON
97;LOT GRENADE 1, AJOUPA BOUILLON
97;LOT GRENADE 2, AJOUPA BOUILLON
97;LOT LA FALAISE, AJOUPA BOUILLON
97;QUA LA RACINE, AJOUPA BOUILLON
97;VC D'ABANDONNE, AJOUPA BOUILLON
97;VC DE ADINET, AJOUPA BOUILLON
97;VC DE DERRIERE CIMETIERE, AJOUPA BOUILLON
97;VC DE DESCHAMPS, AJOUPA BOUILLON
97;VC DE DUFAILLY, AJOUPA BOUILLON
97;VC DE LA FALAISE, AJOUPA BOUILLON
97;VC DE GRANDE SAVANE, AJOUPA BOUILLON
97;RUE HILMANY ET MARIE LOUISE, AJOUPA BOUILLON
97;CR DIT DE LISIERE GALBA, AJOUPA BOUILLON
97;VC DE MILLE PAS, AJOUPA BOUILLON
97;CR DE MONDZI, AJOUPA BOUILLON
97;CR OMER JOACHIM, AJOUPA BOUILLON
97;VC DE RAVINE DES SAINTS, AJOUPA BOUILLON
97;CR DE SEMAINE, AJOUPA BOUILLON
97;VC DE VIEUX CACAO, AJOUPA BOUILLON
97;LOT LA BATTERIE, ANSES D'ARLET
97;LOT BAIE DES ANSES -BS CASSAVE, ANSES D'ARLET
97;RES BALAOU - SUCRERIE II, ANSES D'ARLET
97;CITE BONNE BRISE, ANSES D'ARLET
97;LOT LA SUCRERIE, ANSES D'ARLET
97;CASR DE GENDARMERIE, ANSES D'ARLET
97;LOT GRAND ANSE, ANSES D'ARLET
97;CITE QUENTIN, ANSES D'ARLET
97;LOT OXYGENE, ANSES D'ARLET
97;RES OXYGENE 2, ANSES D'ARLET
97;RES LA SUCRERIE, ANSES D'ARLET
97;RES TCHA TCHA, ANSES D'ARLET
97;RUE DU CIMETIERE, ANSES D'ARLET
97;ALL DES BANANIERS, ANSES D'ARLET
97;COUR D'EAU, ANSES D'ARLET
97;RUE DU BORD DE MER, ANSES D'ARLET
97;RUE DU CALVAIRE, ANSES D'ARLET
97;RUE CASE  TOTO, ANSES D'ARLET
97;RUE DE LA CHAPELLE, ANSES D'ARLET
97;ALL DES COCOTIERS, ANSES D'ARLET
97;RUE DU COROSSOL, ANSES D'ARLET
97;ALL DE LA COUR D'EAU, ANSES D'ARLET
97;IMP DES FILAOS, ANSES D'ARLET
97;RUE DES FLAMBOYANTS, ANSES D'ARLET
97;RUE DES ALIZES, ANSES D'ARLET
97;RUE DONATIEN COLOMBE, ANSES D'ARLET
97;RUE DU 12 JANVIER 1762, ANSES D'ARLET
97;CR DE BAS MORNE, ANSES D'ARLET
97;ALL DES LAURIERS, ANSES D'ARLET
97;RUE DU MORNE CHAMPAGNE, ANSES D'ARLET
97;CR DE CASSIERE, ANSES D'ARLET
97;ALL DES RAISINIERS, ANSES D'ARLET
97;RUE DE L'EAU FERREE, ANSES D'ARLET
97;RUE FELIX EBOUE, ANSES D'ARLET
97;RUE FRANCOIS PAVILLA, ANSES D'ARLET
97;VC DE FONDS FLEURY, ANSES D'ARLET
97;RUE DES GESTRAMS, ANSES D'ARLET
97;BD DES GLYCERIDIAS, ANSES D'ARLET
97;RUE GENERAL DE GAULLE, ANSES D'ARLET
97;RUE DES GOMMIERS, ANSES D'ARLET
97;RUE DES HIBISCUS, ANSES D'ARLET
97;RUE DES IXORAS, ANSES D'ARLET
97;RUE DU JUJUBIER, ANSES D'ARLET
97;IMP DES LAURIERS, ANSES D'ARLET
97;ALL DES MANCENILLIERS, ANSES D'ARLET
97;RUE DE L ABBE GREGOIRE, ANSES D'ARLET
97;CR DE L ANSE DUFOUR, ANSES D'ARLET
97;RLE DE L ARBRE A PAIN, ANSES D'ARLET
97;ALL DES ARLESIENS, ANSES D'ARLET
97;RUE DE LA BATTERIE, ANSES D'ARLET
97;RUE DE LA SOURCE, ANSES D'ARLET
97;RUE DR HENRI MORESTIN, ANSES D'ARLET
97;IMP DES ALAMANDAS, ANSES D'ARLET
97;RUE DES ALYSES, ANSES D'ARLET
97;RUE DES AMANDIERS, ANSES D'ARLET
97;IMP DES BOUGAINVILLIERS, ANSES D'ARLET
97;RLE DU BOULANGER, ANSES D'ARLET
97;CR DE LA PLAINE, ANSES D'ARLET
97;RUE PRESIDENT KENNEDY, ANSES D'ARLET
97;RUE DU MORNE VENTE, ANSES D'ARLET
97;RUE DES PECHEURS, ANSES D'ARLET
97;RUE DES PRUNIERS, ANSES D'ARLET
97;ALL DU QUENETTIER, ANSES D'ARLET
97;AV ROBERT DELOY, ANSES D'ARLET
97;RUE SCHOELCHER, ANSES D'ARLET
97;ALL SPELISANNE, ANSES D'ARLET
97;ALL DU TAMARINIER, ANSES D'ARLET
97;ALL DES TI - BAUMES, ANSES D'ARLET
97;RUE DES YOLES, ANSES D'ARLET
97;ALL ZEPHIRINE, ANSES D'ARLET
97;RUE EUGENE LARCHER, ANSES D'ARLET
97;RES HYBRIDE, BASSE POINTE
97;LOT ANTHURIUM, BASSE POINTE
97;LOT DEMARE, BASSE POINTE
97;LOT EYMA, BASSE POINTE
97;CITE MADELONNETTE VOIE N.1, BASSE POINTE
97;CASR DE GENDARMERIE, BASSE POINTE
97;LOT HACKAERT, BASSE POINTE
97;CITE LACROIX, BASSE POINTE
97;RES EYMA LA PLANTATION, BASSE POINTE
97;LOT LES MOUBINS, BASSE POINTE
97;LOT TAPIS VERT, BASSE POINTE
97;RUE ALBERT CRETINOIR, BASSE POINTE
97;RUE BATA, BASSE POINTE
97;RUE DU BALISIER, BASSE POINTE
97;RUE DU BORD DE MER, BASSE POINTE
97;RUE DU COURBARIL, BASSE POINTE
97;RUE DE LA CRECHE, BASSE POINTE
97;RUE DU CACAOYER, BASSE POINTE
97;CR CHEMIN RURAL DIT DE DEMARE, BASSE POINTE
97;RUE DE LA FREGATE, BASSE POINTE
97;RUE DE L'ABRICOTIER, BASSE POINTE
97;RUE DU CAIALI, BASSE POINTE
97;RUE DE LA FALAISE, BASSE POINTE
97;RUE DU 22 MAI, BASSE POINTE
97;RUE DU FOND BOURG, BASSE POINTE
97;RUE EMILE RAMIN, BASSE POINTE
97;RTE DE GRADIS, BASSE POINTE
97;RUE DE LA GARE, BASSE POINTE
97;VC DITE DE HAUTEURS BOURDON, BASSE POINTE
97;VC DE HAUTEURS DUMAS, BASSE POINTE
97;RUE DU COLIBRI, BASSE POINTE
97;RUE DE DERRIERE, BASSE POINTE
97;RUE JOSEPH ZEPHIR, BASSE POINTE
97;RUE DE L'ACOMAT, BASSE POINTE
97;RUE DE L ECOLE, BASSE POINTE
97;RUE DE L ETOILE, BASSE POINTE
97;RUE DU MAPOU, BASSE POINTE
97;RUE MARCE BEDOUIN, BASSE POINTE
97;VC DITE DE MADELONNETTE, BASSE POINTE
97;RUE DU MARCHE, BASSE POINTE
97;VC DITE DE MORNE BALAI, BASSE POINTE
97;CR DE MORNE JACQUES, BASSE POINTE
97;RUE DOCTEUR MORESTIN, BASSE POINTE
97;RUE JULES ROUSSEL, BASSE POINTE
97;VC DITE DE MADELONNETTE VOIE1, BASSE POINTE
97;RUE DE L'ORTOLAN, BASSE POINTE
97;RUE DU SIFFLEUR DES MONTAGNES, BASSE POINTE
97;RUE DU MALFINI, BASSE POINTE
97;IMP NOEL AUGUSTIN, BASSE POINTE
97;RUE DE L'ORCHIDEE, BASSE POINTE
97;RUE DES PALMIERS, BASSE POINTE
97;PL DE L'ARBRE DE LA LIBERTE, BASSE POINTE
97;RUE DU PIPIRI, BASSE POINTE
97;RUE DU RAMIER, BASSE POINTE
97;RUE SCHOELCHER, BASSE POINTE
97;RUE DU STADE, BASSE POINTE
97;RUE DU SUCRIER, BASSE POINTE
97;RUE DU STADE VOIE NO 1, BASSE POINTE
97;RUE DU STADE VOIE 2, BASSE POINTE
97;VC TAPIS VERT, BASSE POINTE
97;RUE DU VANILLIER, BASSE POINTE
97;PL FELIX EBOUE, BASSE POINTE
97;RLE GROSSES ROCHES, BASSE POINTE
97;RLE SAINT JEAN, BASSE POINTE
97;IMP DE L'AZALEE, BASSE POINTE
97;IMP DE L'HIBISCUS, BASSE POINTE
97;IMP DU JASMIN, BASSE POINTE
97;IMP BONVEL, BASSE POINTE
97;IMP DU RAISINIER, BASSE POINTE
97;IMP ROUCOUYER, BASSE POINTE
97;VC DITE DE MADELONNETTE VOIE5, BASSE POINTE
97;CITE MADELONNETTE VOIE N.2, BASSE POINTE
97;VC DITE MADELONNETTE VOIE N.3, BASSE POINTE
97;VC DITE DE MADELONNETTE VOIE4, BASSE POINTE
97;CHE DE LA CHAPELLE, BASSE POINTE
97;CHE DURY, BASSE POINTE
97;CHE DE L'ILET, BASSE POINTE
97;CHE DU MAHOGANY, BASSE POINTE
97;CHE DU MAHOGANY VOIE N.1, BASSE POINTE
97;CHE DU MAHOGANY VOIE N.3, BASSE POINTE
97;CR DEMARE VOIE N.1, BASSE POINTE
97;VC DITE DE MORNE BALAI VOIE 1, BASSE POINTE
97;VC DE MORNE BALAI VOIE 3, BASSE POINTE
97;VC DITE DE MORNE BALAI VOIE 5, BASSE POINTE
97;VC DITE DE MORNE BALAI VOIE 7, BASSE POINTE
97;VC HAUTEURS BOURDON VOIE N.1, BASSE POINTE
97;VC HAUTEURS BOURDON VOIE N.5, BASSE POINTE
97;VC HAUTEURS BOURDON VOIE N.7, BASSE POINTE
97;VC HAUTEURS BOURDON VOIE N.9, BASSE POINTE
97;VC HAUTEURS BOURDON VOIE N.10, BASSE POINTE
97;VC HAUTEURS BOURDON VOIE N.12, BASSE POINTE
97;VC HAUTEURS BOURDON VOIE N.14, BASSE POINTE
97;VC DE HAUTEURS BOURDON VOIE 3, BASSE POINTE
97;VC HAUTEURS BOURDON VOIE N.2, BASSE POINTE
97;VC HAUTEURS BOURDON VOIE N.4, BASSE POINTE
97;VC HAUTEURS BOURDON VOIE N.6, BASSE POINTE
97;VC HAUTEURS BOURDON VOIE N.8, BASSE POINTE
97;LOT LA BATTERIE, CARBET
97;LOT BEL AZUR, CARBET
97;LOT CORALITA, CARBET
97;LOT LA CROIX, CARBET
97;LOT LES BERGES DE LA RIVIERE, CARBET
97;RES LES BOUGAINVILLIERS, CARBET
97;RES LES CARBETS DE MADININA, CARBET
97;LOT LES FLAMBOYANTS, CARBET
97;LOT FLEURS DE ROCAILLE, CARBET
97;RES LES FLORALES, CARBET
97;CITE LACROIX, CARBET
97;RES LES TROPIQUES, CARBET
97;LOT GROS COULIROU, CARBET
97;CITE FOND CAPOT, CARBET
97;CASR DE GENDARMERIE, CARBET
97;LOT LA COCOTERAIE, CARBET
97;RES LAJUS, CARBET
97;LOT FOND SAVANE, CARBET
97;LOT LE FROMAGER, CARBET
97;LOT LE FROMAGER II, CARBET
97;LOT MORNE SAVANE, CARBET
97;LOT VALENTIN, CARBET
97;RES RESIDENCE COTE PLAGE, CARBET
97;RUE DOUME, CARBET
97;RUE A. HUBERVIC, CARBET
97;RTE DE BOUT BOIS, CARBET
97;RTE DES PITONS, CARBET
97;PL JULES GREVY, CARBET
97;IMP DES ACACIAS, CARBET
97;ALL DES AGRUMES, CARBET
97;RUE DES ALLAMANDAS, CARBET
97;CITE LA RENAISSANCE, CARBET
97;RUE PERRINON, CARBET
97;RUE PHILIPPE PARACLET, CARBET
97;PL DES ALIZEES, CARBET
97;RUE DES ALPINIAS, CARBET
97;ALL DES AMANDIERS, CARBET
97;RUE PORY PAPY, CARBET
97;RUE DES AMOURS, CARBET
97;RUE ANDRE BOUTRIN, CARBET
97;RUE ANDRE CHAPIN, CARBET
97;CHE DES AUBERGINES, CARBET
97;RUE SCHOELCHER, CARBET
97;RUE JUDE TURIAF, CARBET
97;RTE DES AVENTS, CARBET
97;RUE DES AVIRONS, CARBET
97;IMP AZALEE, CARBET
97;IMP DES BALAROUS, CARBET
97;RUE DES ALAMANDAS, CARBET
97;CHE DES BAUMES, CARBET
97;RUE DES BEGONIAS, CARBET
97;RTE DE BELFOND, CARBET
97;RUE FRANCO BELIZAIRE, CARBET
97;RTE DES BENEDICTINS, CARBET
97;IMP DES BLEUETS, CARBET
97;RUE BOB NORDEY, CARBET
97;CHE BOIS D INDE, CARBET
97;ALL DES BONITES, CARBET
97;BD DU BORD DE MER, CARBET
97;IMP DU BOUQUET, CARBET
97;ALL DES CACTUS, CARBET
97;CHE DU CALEBASSIER, CARBET
97;RUE DES CAMELIAS, CARBET
97;CHE DU CANAL DES ESCLAVES, CARBET
97;RUE DES CANNELIERS, CARBET
97;RUE DES CAPUCINES, CARBET
97;PL DES CARAIBES, CARBET
97;RUE DE LA CASCADE, CARBET
97;ALL CELIN, CARBET
97;IMP DES CERISIERS, CARBET
97;RTE DE CHOISY, CARBET
97;ALL COCO, CARBET
97;IMP DES COLIBRIS, CARBET
97;RUE DU COLLIER CHOU, CARBET
97;RUE DES COLOMBES, CARBET
97;RUE DES COQUELICOTS, CARBET
97;IMP DU CORAIL, CARBET
97;RUE DE LA CORNICHE, CARBET
97;IMP DU COTON, CARBET
97;RUE DE LA CROIX, CARBET
97;CHE DES CYCAS, CARBET
97;RUE DU DAHLIA, CARBET
97;RUE DES DAMES ROC, CARBET
97;ALL DU DEBARCADERE, CARBET
97;RTE DE LA DECOUVERTE, CARBET
97;RUE DES DELICES, CARBET
97;AV DES DROITS DE L ENFANT, CARBET
97;BD DUVALLON, CARBET
97;RUE EDMOND GRAMBIN, CARBET
97;RUE EDOUARD ROSINE, CARBET
97;PAS ERNEST MICHEL, CARBET
97;RUE DES ETOILES, CARBET
97;RTE DE LA FESSALE, CARBET
97;IMP DU FEUILLAGE, CARBET
97;CHE DU FIGUIER, CARBET
97;CHE DES FILAOS, CARBET
97;IMP DES FLEURS, CARBET
97;ALL DES FOUGERES, CARBET
97;PAS FREMCOURT, CARBET
97;AV DU GENERAL DE GAULLE, CARBET
97;RUE DU GERBERA, CARBET
97;CHE DES GLYCERIAS, CARBET
97;RUE DU GOMMIER, CARBET
97;CHE DES GOYAVIERS, CARBET
97;RUE DES HIBISCUS, CARBET
97;RUE J DORMIER, CARBET
97;IMP DU JASMIN, CARBET
97;RTE DU KAYALI, CARBET
97;CHE LAFAYETTE, CARBET
97;IMP DES LAURIERS, CARBET
97;RUE LEONARD SERBIN, CARBET
97;RUE LOULOU BOILAVILLE, CARBET
97;RUE MADKAUD, CARBET
97;ALL DES MANGUIERS, CARBET
97;ALL DU MARLIN, CARBET
97;RUE MAURICE MACARI, CARBET
97;RUE DU MORNE CHARLOTTE, CARBET
97;CHE DU MORNE TABLE, CARBET
97;CHE DU MOUBIN, CARBET
97;IMP DU MUGUET, CARBET
97;ALL ODELIE, CARBET
97;RUE DES ORCHIDEES, CARBET
97;CHE DES PAVILLONS, CARBET
97;IMP DU PERE DIONISI, CARBET
97;RUE DES PERVENCHES, CARBET
97;ALL DES PIPIRIS, CARBET
97;CHE POMME CANNELLE, CARBET
97;IMP DES PRUNIERS, CARBET
97;CHE DE LA RANDONNEE, CARBET
97;IMP DE LA RAVINE, CARBET
97;IMP DU RIVAGE, CARBET
97;CHE DU RONCE, CARBET
97;IMP DES ROSIERS, CARBET
97;PAS DES SABLIERES, CARBET
97;IMP DE LA SAGESSE, CARBET
97;VOIE SAINT-ANGE LORIOL, CARBET
97;IMP SAINT JEAN THERESE, CARBET
97;IMP DU SANATORIUM, CARBET
97;RUE DES SICRIERS, CARBET
97;IMP DES TAMARINIERS, CARBET
97;PL TI-JO TURIAF, CARBET
97;RTE TROU CARAIBE, CARBET
97;CHE VARIN DE LA BRUNELIERE, CARBET
97;CHE VIE MAZIE, CARBET
97;ALL DES VIOLETTES, CARBET
97;LOT KAI BOIS, CASE PILOTE
97;LOT LA BATTERIE, CASE PILOTE
97;LOT EUCALYPTUS, CASE PILOTE
97;LOT LA CARAIBE, CASE PILOTE
97;RES DE CHOISEUL, CASE PILOTE
97;LOT LES CITRONNELLES, CASE PILOTE
97;LOT DELTA, CASE PILOTE
97;RES DE FOND BOUCHER, CASE PILOTE
97;CASR DE GENDARMERIE, CASE PILOTE
97;LOT MADKAUD, CASE PILOTE
97;LOT MANIBA, CASE PILOTE
97;LOT LE PARC CHOISEUL, CASE PILOTE
97;LOT PETIT FOURNEAU, CASE PILOTE
97;LOT PLATE FORME, CASE PILOTE
97;LOT LA SERENITE, CASE PILOTE
97;RUE ALLEGRE, CASE PILOTE
97;RUE DE LA BATTERIE, CASE PILOTE
97;ALL BIGUINE, CASE PILOTE
97;VC DITE DE FOND BOUCHER, CASE PILOTE
97;VC DE FOND BOURLET, CASE PILOTE
97;PL GASTON MONNERVILLE, CASE PILOTE
97;RUE GAMBETTA, CASE PILOTE
97;VC NO 1 DE GRAND FOND, CASE PILOTE
97;CHE NO 1 DE MANIBA PITON, CASE PILOTE
97;VC NO 2 DE NICOLO ABYMES, CASE PILOTE
97;RUE DE L'ENCLOS, CASE PILOTE
97;RUE PERRINON, CASE PILOTE
97;RUE DE LA PLAGE, CASE PILOTE
97;RUE SCHOELCHER, CASE PILOTE
97;RUE VICTOR SEVERE, CASE PILOTE
97;RES LES ALOES, DIAMANT
97;LOT ANSE BLEUE, DIAMANT
97;LOT LES AZALEES, DIAMANT
97;LOT CHERY, DIAMANT
97;RES DIZAC, DIAMANT
97;RES CHERRY O, DIAMANT
97;RES LA CANONNIERE, DIAMANT
97;RES LA CHERY, DIAMANT
97;CITE SIMAR LA CHERY, DIAMANT
97;LOT LE LUCITO, DIAMANT
97;RES LA CARRIERE, DIAMANT
97;RES LES PLAGES DE DIZAC, DIAMANT
97;RES GLORIA, DIAMANT
97;LOT LES HAUTS DIAMANT, DIAMANT
97;RES LES SAPOTILLIERS, DIAMANT
97;RES LES TAMARINS, DIAMANT
97;LOT LA MICHELE, DIAMANT
97;LOT O'MULLANE, DIAMANT
97;LOT PLEIN SUD, DIAMANT
97;LOT PETITE SAVANE, DIAMANT
97;RES ULTRAMARINE, DIAMANT
97;LOT LES ACACIAS  -  LA MICHELE, DIAMANT
97;RUE A ET T DUVILLE, DIAMANT
97;ALL ACACIAS, DIAMANT
97;CD NO 37 DE PETITE ANSE, DIAMANT
97;ALL DE L'AZUR, DIAMANT
97;ALL DU CALVAIRE, DIAMANT
97;ALL DU GAIAC, DIAMANT
97;ALL DU GINGEMBRE, DIAMANT
97;RUE DU GANGAN, DIAMANT
97;ALL DU SAFRAN, DIAMANT
97;RUE HILARION GISCON, DIAMANT
97;RUE BARACK OBAMA, DIAMANT
97;ALL DU ROCHER, DIAMANT
97;RUE JUSTIN ROC, DIAMANT
97;ALL DES MONBINS, DIAMANT
97;ALL DE LA MUSCADE, DIAMANT
97;PL DU GENERAL DE GAULLE, DIAMANT
97;RUE DES ARAWAKS, DIAMANT
97;RUE DES ALIZES, DIAMANT
97;RUE DES CARAIBES, DIAMANT
97;IMP DES CHADEKS, DIAMANT
97;ALL DES CITRINES, DIAMANT
97;RUE DES MANDARINES, DIAMANT
97;RUE DES COTONNIERS, DIAMANT
97;RUE DES CAMPECHES, DIAMANT
97;ALL DES EMERAUDES, DIAMANT
97;RUE DES FALES JAUNES, DIAMANT
97;RUE DES MAKARIS, DIAMANT
97;RUE DES ORTOLANS, DIAMANT
97;RUE DES PIPIRIS, DIAMANT
97;ALL DES RUBIS, DIAMANT
97;ALL DES SAPHIRS, DIAMANT
97;PL DES SIFFLEURS, DIAMANT
97;RUE DES TOURTERELLES, DIAMANT
97;ALL DES TURQUOISES, DIAMANT
97;ALL DES AMANDES, DIAMANT
97;ALL DES LAURIERS, DIAMANT
97;RUE DES ORANGERS, DIAMANT
97;RUE DES ORPHIES, DIAMANT
97;ALL DES POMMES CANNELLE, DIAMANT
97;RUE DES TAZARS, DIAMANT
97;RUE DES WALIWAS, DIAMANT
97;RUE DES WATALIBIS, DIAMANT
97;ALL DE L'AIGUE MARINE, DIAMANT
97;RUE ANDRE ALIKER, DIAMANT
97;ALL DES AMETHYSTES, DIAMANT
97;ALL ALPINIA, DIAMANT
97;RUE DE L'AMITIE, DIAMANT
97;RUE EMILE AMPIGNY, DIAMANT
97;ALL AN DIRI, DIAMANT
97;RUE LOUIS ANDRIEU, DIAMANT
97;ALL BELLE DE NUIT, DIAMANT
97;ALL DU BEL AIR, DIAMANT
97;ALL BELLE VUE, DIAMANT
97;ALL BASSIN SALE, DIAMANT
97;ALL DU BOIS DRESSE, DIAMANT
97;ALL BOIS D'INDE, DIAMANT
97;ALL DU BOIS LELE, DIAMANT
97;ALL DU BOIS MABI, DIAMANT
97;ALL DU BOIS TI BAUME, DIAMANT
97;ALL DE LA BONNE HUMEUR, DIAMANT
97;ALL DES BOUGAINVILLIERS, DIAMANT
97;ALL CALLIANDRA, DIAMANT
97;ALL DES CARAMBOLES, DIAMANT
97;AV AIME CESAIRE, DIAMANT
97;ALL DE LA COCOTERAIE, DIAMANT
97;ALL DES COLIBRIS, DIAMANT
97;ALL DES COROSSOLS, DIAMANT
97;RUE DU PERE BERNARD DAVID, DIAMANT
97;RUE OSMAN DURAND, DIAMANT
97;RUE FRANTZ FANON, DIAMANT
97;ALL FLEURI NOEL, DIAMANT
97;RUE LEON GALLET DE SAINT AURIN, DIAMANT
97;RUE EDOUARD GLISSANT, DIAMANT
97;ALL DU GOMMIER, DIAMANT
97;ALL DES GOMMIERS, DIAMANT
97;ALL DES GRENATS, DIAMANT
97;ALL DES GRIVES, DIAMANT
97;ALL HELICONIA, DIAMANT
97;ALL DES ICAQUES, DIAMANT
97;RUE DE L'ILE AUX FLEURS, DIAMANT
97;ALL DES JADES, DIAMANT
97;ALL DU JASPE ROUGE, DIAMANT
97;ALL JACYNTHE D'EAU, DIAMANT
97;ALL MAN JOUANELLE, DIAMANT
97;ALL MARE JANVILLE, DIAMANT
97;ALL MARE KAKOLI, DIAMANT
97;RUE MARTIN LUTHER KING, DIAMANT
97;ALL DES OISEAUX DU PARADIS, DIAMANT
97;ALL DU MORNE LARCHER, DIAMANT
97;RUE MABOUYA, DIAMANT
97;ALL MAPOU, DIAMANT
97;AV NELSON MANDELA, DIAMANT
97;ALL DES PALETUVIERS, DIAMANT
97;ALL PANACHE D'OFFICIER, DIAMANT
97;ALL DE LA PAPAYE, DIAMANT
97;ALL PLUIE D'OR, DIAMANT
97;ALL DES RAISINIERS, DIAMANT
97;RUE MAN HIPPOLYTE RAVIN, DIAMANT
97;ALL DE LA ROSE DE PORCELAINE, DIAMANT
97;ALL SABOT DE VENUS, DIAMANT
97;ALL DE LA SYMPATHIE, DIAMANT
97;ALL DES TOPAZES, DIAMANT
97;RUE DEREK WALCOTT, DIAMANT
97;ALL MANGOT BASSIGNAC, DIAMANT
97;ALL MANGOT CASSE COU, DIAMANT
97;ALL MANGOT VE, DIAMANT
97;RUE FRANCOIS MITTERAND, DIAMANT
97;ALL DES MOMBINS, DIAMANT
97;RUE GASTON MONNERVILLE, DIAMANT
97;LOT PANORAMA, DUCOS
97;LOT LES ABEILLES, DUCOS
97;LOT LES ABRICOTS, DUCOS
97;RES LES ABRICOTS I, DUCOS
97;RES LES ABRICOTS II, DUCOS
97;RES BARINGTHON - LA CHASSAING, DUCOS
97;RES BAUHINIA - SYNDIC, DUCOS
97;LOT BOIS ROUGE, DUCOS
97;RES CANNE NOUVELLE, DUCOS
97;RES LA BONTEMPS, DUCOS
97;LOT BOURBON, DUCOS
97;LOT LA CADEAU, DUCOS
97;LOT CANAL, DUCOS
97;LOT CHAMP FLEURY, DUCOS
97;LOT COCOTTE, DUCOS
97;LOT CHATROU, DUCOS
97;RES CECILLON, DUCOS
97;RES LA CANNAIE, DUCOS
97;LOT COTE D'OR, DUCOS
97;CTRE CCIAL LA SOURCE, DUCOS
97;ZI ZI DE CHAMPIGNY, DUCOS
97;LOT LA CLAIRIERE, DUCOS
97;LOT LES CANNELIERS, DUCOS
97;RES GRAN KOUBARI, DUCOS
97;CITE LE DESTIN, DUCOS
97;RES ELISA, DUCOS
97;RES LES FLAMBOYANTS, DUCOS
97;ZI DE LA FABRIQUE, DUCOS
97;LOT LES HAUTS DE BARINGTHON, DUCOS
97;RES HORIZON LOURDES, DUCOS
97;LOT FONDS PANIER, DUCOS
97;RES LE FROMAGER, DUCOS
97;LOT GENIPA, DUCOS
97;RES MIRABELLE I, DUCOS
97;RES MIRABELLE II, DUCOS
97;LOT LE JARDIN DE PAULINE, DUCOS
97;RES LES JARDINS D EMERAUDE, DUCOS
97;RES MAJORELIA, DUCOS
97;LOT LE LAGON DE FLORIDA, DUCOS
97;LOT LES ORANGERS, DUCOS
97;LOT LES ORANGERS 2000, DUCOS
97;LOT QUITMAN, DUCOS
97;RES LES TERRASSES DE MADININA, DUCOS
97;CITE ARTISANALE LA MARIE, DUCOS
97;CITE LA MARIE II, DUCOS
97;LOT LA RETRAITE, DUCOS
97;LOT LES FILAOS, DUCOS
97;CASR DE GENDARMERIE, DUCOS
97;LOT LES GOYAVIERS, DUCOS
97;LOT HAMEAUX DES COTEAUX, DUCOS
97;CITE LAZARET, DUCOS
97;RES DU LEVANT, DUCOS
97;ZI DE MORNE PAVILLON, DUCOS
97;LOT MORNE LA VALEUR, DUCOS
97;LOT LA MARIE, DUCOS
97;CITE LA MARIE, DUCOS
97;LOT LA PIGNOL, DUCOS
97;LOT RIVIERE LA MANCHE, DUCOS
97;ZI ZONE INDUSTRIELLE, DUCOS
97;LOT VAUDRANCOURT, DUCOS
97;ZI COCOTTE CANAL, DUCOS
97;ZI DE LA MARIE, DUCOS
97;ZI DE PETITE COCOTTE, DUCOS
97;LOT LA SERENITE, DUCOS
97;RES LA MARINELLE, DUCOS
97;LOT LES MAKATAS, DUCOS
97;RES LES GENS HEUREUX VAUDRANCO, DUCOS
97;RES LES OREADES, DUCOS
97;RES VALLON DU BAC - MN CARETTE, DUCOS
97;PL ANDRE ALIKER, DUCOS
97;RUE DES ABRICOTIERS, DUCOS
97;RUE DES ALAMANDAS, DUCOS
97;IMP DE L'ABREUVOIR, DUCOS
97;RUE DE L'ABBE DUMAUZE, DUCOS
97;IMP DES ACACIAS, DUCOS
97;ALL DE L'ORGANISTE, DUCOS
97;ALL DE L'OISEAU COHE, DUCOS
97;ALL DE LA COTONNERIE, DUCOS
97;CR DE LA BAFOND, DUCOS
97;RUE DES MANGUIERS, DUCOS
97;RUE DES BAMBOUS, DUCOS
97;RUE DES BALISIERS, DUCOS
97;ALL DES SUCRIERS, DUCOS
97;RUE DES LAVANDIERES, DUCOS
97;CR DE BARINGTHON, DUCOS
97;ALL DE LA POTERIE, DUCOS
97;IMP DE LA CASE A VENT, DUCOS
97;IMP DE LA CASSAVE, DUCOS
97;ALL DU CRABIER, DUCOS
97;IMP DES COROSSOLS, DUCOS
97;CR DE LA BEAUVILLE, DUCOS
97;RUE DE L'AROMAN, DUCOS
97;ALL DE LA SERENADE, DUCOS
97;RUE RAYMOND BERGER, DUCOS
97;RUE BOHEME, DUCOS
97;CR DE BOHEME, DUCOS
97;VC DE BOIS NEUF, DUCOS
97;CR DE BOIS NEUF VERS LORI, DUCOS
97;RUE TOUSSAINT LOUVERTURE, DUCOS
97;IMP DES COCCINELLES, DUCOS
97;IMP DES DELICES - GDE SAVANE, DUCOS
97;RUE DES VANNIERS, DUCOS
97;RUE DES BOUGAINVILLIERS, DUCOS
97;RUE DES SENTEURS, DUCOS
97;RUE DES ALIZES, DUCOS
97;ALL DES BASSIGNACS, DUCOS
97;ALL DES SAPOTILLES, DUCOS
97;RUE DES CAMPECHIERS, DUCOS
97;RUE DES AMARREUSES, DUCOS
97;CR DES 3 AVE - HAB GENIPA, DUCOS
97;CR DE LA CECILIE, DUCOS
97;VC NO 6 DE LA CHASSAING, DUCOS
97;CR DE LA CHENEAUX, DUCOS
97;RUE DU CIMETIERE, DUCOS
97;RUE DU TUNNEL, DUCOS
97;ALL DU CHAMP FLEURY, DUCOS
97;RUE DU COURBARIL, DUCOS
97;VC NO 2 DE CHEMIN CANAL, DUCOS
97;RUE DU PANIER CARAIBE, DUCOS
97;IMP DU MANIOC, DUCOS
97;RUE DU VETIVER, DUCOS
97;ALL DU CACHIBOU, DUCOS
97;RUE DU BAKOUA, DUCOS
97;RTE DU BAC, DUCOS
97;RUE DE DERRIERE, DUCOS
97;ALL DES COLOMBES, DUCOS
97;IMP DES GRIVES, DUCOS
97;ALL DES HIBISCUS, DUCOS
97;ALL DES ROSEAUX, DUCOS
97;ALL DES TOURTERELLES, DUCOS
97;ALL DES CAIMITES, DUCOS
97;RUE DES GOMMIERS, DUCOS
97;AV MARC ANDRE, DUCOS
97;RUE SIMEON DUFRESNE, DUCOS
97;VC NO 8 DE DURIVAGE, DUCOS
97;CR DE DURIVAGE, DUCOS
97;RUE DU DESTIN, DUCOS
97;RUE DE L'AFRIQUE, DUCOS
97;RUE DE L'ECOLE, DUCOS
97;CR DE L'ARMAND, DUCOS
97;PL DE L'EGLISE, DUCOS
97;RUE DE L'EGLISE, DUCOS
97;CR DE L'EPINE, DUCOS
97;CR DE L'ESPERANCE, DUCOS
97;ALL DU GINGEMBRE, DUCOS
97;PL ELOI VIRGINIE, DUCOS
97;IMP EUDARIC, DUCOS
97;IMP FAUCIGNY, DUCOS
97;AV FRANTZ FANON, DUCOS
97;AV FELIX EBOUE, DUCOS
97;RUE GABRIEL PERI, DUCOS
97;RUE DES FLAMBOYANTS, DUCOS
97;ALL DES POMMES LIANES, DUCOS
97;VC DE FOND BRULE, DUCOS
97;RTE DE FOND BRULE, DUCOS
97;CR DE FONDS MARIE ROSE, DUCOS
97;PL FRANCOIS MITTERAND, DUCOS
97;CR DE FOND PANIER, DUCOS
97;RUE FLECH' KANN, DUCOS
97;VC DE FOND SAVANE, DUCOS
97;RUE DE LA FORGE, DUCOS
97;IMP LES PLUMBAGOS, DUCOS
97;IMP LES LAURIERS, DUCOS
97;IMP LES COQUELICOTS, DUCOS
97;IMP LES IXORAS, DUCOS
97;IMP LES ROSIERS, DUCOS
97;RUE DES GLYCERIDIAS, DUCOS
97;RUE DES TAMBOUYERS, DUCOS
97;RUE DES LATANIERS, DUCOS
97;RUE DES ORANGERS, DUCOS
97;VC DE GRANDE SAVANE, DUCOS
97;VC NO 4 DE GRANDE SAVANE, DUCOS
97;RUE DES HIBISCUS, DUCOS
97;AV FRANCOIS MITTERAND, DUCOS
97;RUE P. DE KERGOMARD, DUCOS
97;RUE HONORE QUITMAN, DUCOS
97;RUE JOSEPH AMANT, DUCOS
97;RUE JOINVILLE SAINT PRIX, DUCOS
97;RUE JULES FERRY, DUCOS
97;AV JEAN JAURES, DUCOS
97;RUE JOSEPH LAGROSILLIERE, DUCOS
97;PL LAURENT ASSELIN DE BEAUV, DUCOS
97;RUE DE L'ABATTOIR, DUCOS
97;RUE DU LAZARET, DUCOS
97;RUE LEON BLUM, DUCOS
97;AV LA MAURICE, DUCOS
97;CR DE LA LINDOR, DUCOS
97;CHEM DU MUGUET, DUCOS
97;ALL DU CAROUGE, DUCOS
97;RUE DU 22 MAI 1848, DUCOS
97;ALL DU CAYALI, DUCOS
97;ALL DU COLIBRI, DUCOS
97;IMP DU PIPIRI, DUCOS
97;IMP DU SIFFLEUR, DUCOS
97;RUE DU MARCHE, DUCOS
97;CR DE MONDESIR, DUCOS
97;CR DU MORNE ADRIEN, DUCOS
97;CR DU MORNE CABRIT, DUCOS
97;VC NO 1 DE MORNE CARETTE, DUCOS
97;CR DU MORNE LUDGER, DUCOS
97;CR DU MORNE PRIVAT, DUCOS
97;CR DE MORNE LAVALEUR, DUCOS
97;RUE DES ORCHIDEES, DUCOS
97;RUE DES PALETUVIERS, DUCOS
97;RUE PERRINON, DUCOS
97;RUE DES POINSETTIAS, DUCOS
97;CR LA REGIS, DUCOS
97;VC DE RIVIERE LA MANCHE, DUCOS
97;RUE DE LA ROCHELLE, DUCOS
97;RUE DES ROSIERS, DUCOS
97;IMP DE LA SABLIERE, DUCOS
97;CR DE LA SAINT PIERRE, DUCOS
97;RUE DE LA SOURCE, DUCOS
97;RUE DES TAMARINIERS, DUCOS
97;RUE VICTOR HUGO, DUCOS
97;RUE VICTOR SCHOELCHER, DUCOS
97;RUE ZIZINE ET DES ETAGES, DUCOS
97;RTE DE TROU VENT, FONDS SAINT DENIS
97;RES ASTORIA, FORT DE FRANCE
97;RES LES ABEILLES, FORT DE FRANCE
97;LOT BARDINET  DILLON, FORT DE FRANCE
97;RES LES ALAMANDAS, FORT DE FRANCE
97;LOT LES ABRICOTS, FORT DE FRANCE
97;RES AIGRETTE, FORT DE FRANCE
97;RES ALLENDE MORNE DILLON, FORT DE FRANCE
97;LOT LES ALIZES DE REDOUTE, FORT DE FRANCE
97;RES IMM ABOLO, FORT DE FRANCE
97;RES IMM ANOLI, FORT DE FRANCE
97;LOT LES AMANDIERS, FORT DE FRANCE
97;RES AROUMAN, FORT DE FRANCE
97;CITE DE L'AMITIE, FORT DE FRANCE
97;CITE DILLON NORD, FORT DE FRANCE
97;CITE DILLON NORD-EST, FORT DE FRANCE
97;CITE DILLON SUD, FORT DE FRANCE
97;QUA LEP CHATEAU BOEUF, FORT DE FRANCE
97;CITE ARTISANALE DE DILLON, FORT DE FRANCE
97;LOT ATHANASE, FORT DE FRANCE
97;RES LES BAMBOUS, FORT DE FRANCE
97;CITE BAIE DES TOURELLES NORD, FORT DE FRANCE
97;LOT LA BARRIERE, FORT DE FRANCE
97;RES BELLE POULE, FORT DE FRANCE
97;CITE BON AIR, FORT DE FRANCE
97;LOT BERNY, FORT DE FRANCE
97;CITE DE BRIAND FLOREAL, FORT DE FRANCE
97;CITE BERTE, FORT DE FRANCE
97;CITE CALEBASSE 2, FORT DE FRANCE
97;CITE CALEBASSE SIMAR, FORT DE FRANCE
97;LOT BLERARD, FORT DE FRANCE
97;LOT LA CARRIERE, FORT DE FRANCE
97;LOT CASTEL DES ROCHERS, FORT DE FRANCE
97;CITE DE BRIAND, FORT DE FRANCE
97;LOT CLUNY, FORT DE FRANCE
97;CITE CLARAC, FORT DE FRANCE
97;CITE DILLON, FORT DE FRANCE
97;CITE CAZALE, FORT DE FRANCE
97;LOT LES CERISIERS, FORT DE FRANCE
97;RES LES CHARMETTES, FORT DE FRANCE
97;RES LES CHARMILLES, FORT DE FRANCE
97;CITE FLOREAL ALIZE, FORT DE FRANCE
97;CITE FLOREAL ORCHIDEE, FORT DE FRANCE
97;CITE FLOREAL TIVOLI, FORT DE FRANCE
97;CTRE COMMERCIAL DE DILLON, FORT DE FRANCE
97;CITE GODISSARD, FORT DE FRANCE
97;LOT DORMOY, FORT DE FRANCE
97;LOT DUPLAN, FORT DE FRANCE
97;LOT DUPLESSIS, FORT DE FRANCE
97;CITE DUQUESNE, FORT DE FRANCE
97;LOT L'EVENTEE, FORT DE FRANCE
97;LOT FONTAINE GOUYE, FORT DE FRANCE
97;CITE GIRARD, FORT DE FRANCE
97;LOT GOUYE COTE DROIT, FORT DE FRANCE
97;RES MARLY, FORT DE FRANCE
97;RES LES HAUTS DE BALATA, FORT DE FRANCE
97;LOT LES HIBISCUS, FORT DE FRANCE
97;LOT LA LIOT, FORT DE FRANCE
97;LOT LUNA - ROCK, FORT DE FRANCE
97;CTRE HOSPITAL LA MEYNARD, FORT DE FRANCE
97;LOT MASSON, FORT DE FRANCE
97;LOT LES MIMOSAS, FORT DE FRANCE
97;LOT MIRAMAR, FORT DE FRANCE
97;LOT MODESTE, FORT DE FRANCE
97;RES LES MANGUIERS MOUTTE, FORT DE FRANCE
97;LOT MIGEREL, FORT DE FRANCE
97;LOT GOUYE COTE GAUCHE, FORT DE FRANCE
97;LOT MONPLAISIR, FORT DE FRANCE
97;LOT MONTGERALD, FORT DE FRANCE
97;CITE MORNE COCO, FORT DE FRANCE
97;RES KALISTA, FORT DE FRANCE
97;RES DES ILES, FORT DE FRANCE
97;RES IMM MABOUYA, FORT DE FRANCE
97;LOT LES MAHOGANYS, FORT DE FRANCE
97;LOT LES MERVEILLES, FORT DE FRANCE
97;RES LES TERRASSES DE BALATA, FORT DE FRANCE
97;CITE MORNE A L EAU, FORT DE FRANCE
97;RES NID D'AIGLE, FORT DE FRANCE
97;LOT GRANT, FORT DE FRANCE
97;LOT MOYSE, FORT DE FRANCE
97;RES MUSSARD, FORT DE FRANCE
97;LOT LA NORVILLE, FORT DE FRANCE
97;CITE OZANAM PONT DE CHAINE, FORT DE FRANCE
97;CITE OZANAM REDOUTE, FORT DE FRANCE
97;PARC FLORAL, FORT DE FRANCE
97;LOT PESLAGE, FORT DE FRANCE
97;LOT LE QUARTIER, FORT DE FRANCE
97;RES LES QUATRE VENTS, FORT DE FRANCE
97;LOT ROCHERS UNION, FORT DE FRANCE
97;LOT LES PITONS, FORT DE FRANCE
97;ZAC DE RIVIERE ROCHE, FORT DE FRANCE
97;LOT SAINT ANTOINE, FORT DE FRANCE
97;RES SAINT DIDIER, FORT DE FRANCE
97;ESPA JOSE DOUTONE, FORT DE FRANCE
97;ESPA JOUANACAERA, FORT DE FRANCE
97;CTRE MARCEL PLACIDE, FORT DE FRANCE
97;ESPA TI-EMILE CASERUS, FORT DE FRANCE
97;CITE LE VAL FLOREAL, FORT DE FRANCE
97;RES HARMONIA, FORT DE FRANCE
97;LOT SAINT HENRI, FORT DE FRANCE
97;LOT LA SYLVE RUE DU GARDENIA, FORT DE FRANCE
97;LOT LES OISEAUX, FORT DE FRANCE
97;RES LALIN KLE LA MEYNARD, FORT DE FRANCE
97;RES PICHEVIN 2, FORT DE FRANCE
97;RES DUO, FORT DE FRANCE
97;RES COPES, FORT DE FRANCE
97;RES TRILLE, FORT DE FRANCE
97;RES ALOCASIA CHATEAUBEUF, FORT DE FRANCE
97;RES SAINTE CATHERINE, FORT DE FRANCE
97;RES LES OPALINES, FORT DE FRANCE
97;LOT SAINTE MARIE, FORT DE FRANCE
97;LOT SYLVESTRE, FORT DE FRANCE
