97;RUE DES GLOUGLOUS, FORT DE FRANCE
97;CHEM DES GOMMIERS BLANCS, FORT DE FRANCE
97;RUE DU GRAIN D'OR, FORT DE FRANCE
97;PAS GUERI TOUT, FORT DE FRANCE
97;RUE GUILLAUME PERMAL, FORT DE FRANCE
97;RUE DE L INGENIEUR COULOMB, FORT DE FRANCE
97;RUE GENERAL MANGIN, FORT DE FRANCE
97;RTE DU GENERAL MANGIN, FORT DE FRANCE
97;RUE ALFRED MELON DEGRAS, FORT DE FRANCE
97;AV GEORGES PLISSONNEAU, FORT DE FRANCE
97;RUE GERARD NOUVET VOIE 2A, FORT DE FRANCE
97;RUE GERARD NOUVET, FORT DE FRANCE
97;RUE DE LA GLACIERE, FORT DE FRANCE
97;CHE DE LA GLACIERE, FORT DE FRANCE
97;PL GILBERT GRATIANT, FORT DE FRANCE
97;RUE DU GROS KA, FORT DE FRANCE
97;RUE DU GROS MOMBIN, FORT DE FRANCE
97;CD NO 58 ENTREE GODISSARD, FORT DE FRANCE
97;IMP LUCIEN GOLIOT, FORT DE FRANCE
97;RUE GEORGES GRATIANT, FORT DE FRANCE
97;RUE DU GOUVERNEUR FOUREAU, FORT DE FRANCE
97;RUE GOUVERNEUR GEN FELIX EBOUE, FORT DE FRANCE
97;RUE DU GOUVERNEUR PONTON, FORT DE FRANCE
97;RUE DE LA GUYANE, FORT DE FRANCE
97;IMP DE LA GUYANE, FORT DE FRANCE
97;RUE DE LA FLUTE DES MORNES, FORT DE FRANCE
97;RUE DES GOYAVIERS, FORT DE FRANCE
97;IMP DES GOYAVIERS, FORT DE FRANCE
97;RUE DU GRAND CARAIBE, FORT DE FRANCE
97;RUE DU GROS CONSOUL, FORT DE FRANCE
97;VC ENTREE GROS DUBOIS, FORT DE FRANCE
97;RUE GROSSE ROCHE VOIE NO 1, FORT DE FRANCE
97;RUE GROSSE ROCHE AV A VOIE 1B, FORT DE FRANCE
97;AV B VOIE 2 GROSSE ROCHE, FORT DE FRANCE
97;AV B VOIE 4 GROSSE ROCHE, FORT DE FRANCE
97;AV A ET B ENTREE GROSSE ROCHE, FORT DE FRANCE
97;RTE DU GROS ROCHER, FORT DE FRANCE
97;RUE DE LA GROSSE GOUTTIERE, FORT DE FRANCE
97;RTE DE GROSSE-ROCHE-CITRON, FORT DE FRANCE
97;VC GROSSE ROCHE AV A VOIE 1, FORT DE FRANCE
97;VC GROSSE ROCHE AV A VOIE 2, FORT DE FRANCE
97;VC GROSSE ROCHE VOIE NO 5, FORT DE FRANCE
97;VC GROSSE ROCHE VOIE NO 6, FORT DE FRANCE
97;VC GROSSE ROCHE VOIE NO 8, FORT DE FRANCE
97;VC GROSSE ROCHE VOIE NO 10, FORT DE FRANCE
97;RUE DE LA GUINEE, FORT DE FRANCE
97;IMP DE LA GUINEE, FORT DE FRANCE
97;AV NICOLAS GUILLEN, FORT DE FRANCE
97;IMP DU HAMEAU FLEURI, FORT DE FRANCE
97;AV DES HAMEAUX MONTGERALDE, FORT DE FRANCE
97;RUE HAMID DIB, FORT DE FRANCE
97;RUE HENRI BARBUSSE, FORT DE FRANCE
97;RUE HENRICK VILETTE, FORT DE FRANCE
97;RUE DES HIBISCUS, FORT DE FRANCE
97;RUE DES HELICONIAS, FORT DE FRANCE
97;PAS DE LA HUTTE, FORT DE FRANCE
97;RUE GUSTAVE MICHEL, FORT DE FRANCE
97;RTE HYDROBASE, FORT DE FRANCE
97;CHEM DE LA HOUSSAYE, FORT DE FRANCE
97;RUE DE L INGENIEUR COLOMB, FORT DE FRANCE
97;RUE DES ILES, FORT DE FRANCE
97;PASS DES HABITUES, FORT DE FRANCE
97;IMP 113, FORT DE FRANCE
97;IMP 107, FORT DE FRANCE
97;RUE IQBAL MASSIH, FORT DE FRANCE
97;RUE HENRI LERO, FORT DE FRANCE
97;ALL DES HIBISCUS REDOUTE, FORT DE FRANCE
97;RUE DU HERON BLANC, FORT DE FRANCE
97;IMP DE L HARMONIE, FORT DE FRANCE
97;RUE ISAMBERT, FORT DE FRANCE
97;RUE DU JASPE, FORT DE FRANCE
97;BD HUYGUES DESPOINTES, FORT DE FRANCE
97;RUE JACQUES CAZOTTE, FORT DE FRANCE
97;RTE DE LA JAMBETTE, FORT DE FRANCE
97;RUE DE LA JAMBETTE, FORT DE FRANCE
97;RUE KAN MALAVOI, FORT DE FRANCE
97;RUE KAN SIKDOJ, FORT DE FRANCE
97;RUE LORRAINE HANSBERRY, FORT DE FRANCE
97;RUE KANN RIBANNE, FORT DE FRANCE
97;RUE KANN KRISTALINE, FORT DE FRANCE
97;RUE SOLITUDE LA MULATRESSE, FORT DE FRANCE
97;RUE LUMINA SOPHIE, FORT DE FRANCE
97;IMP DU JASMIN, FORT DE FRANCE
97;RUE THEODORE TALLY, FORT DE FRANCE
97;RUE ROSALIE SOLEIL, FORT DE FRANCE
97;RUE KANN ROZO, FORT DE FRANCE
97;RUE JEAN BAPTISTE ROUAM SIM, FORT DE FRANCE
97;RUE JEAN JACQUES ROUSSEAU, FORT DE FRANCE
97;RUE JEAN DUFEAL, FORT DE FRANCE
97;RUE JOSEPH ANGELIQUE, FORT DE FRANCE
97;RUE JOSEPH GAILLARD, FORT DE FRANCE
97;RUE JOU OUVE, FORT DE FRANCE
97;RUE KANN GWO MAFRAME, FORT DE FRANCE
97;RUE DU JUJUBIER, FORT DE FRANCE
97;RUE DU LEP CHATEAUBOEUF, FORT DE FRANCE
97;RUE ERNEST HEMINGWAY, FORT DE FRANCE
97;AV JEAN JAURES, FORT DE FRANCE
97;RUE EDOUARD JEANNE, FORT DE FRANCE
97;RUE DE LA JEUNESSE, FORT DE FRANCE
97;RUE JOSE MARTI, FORT DE FRANCE
97;RUE JOSEPH COMPERE, FORT DE FRANCE
97;RUE JOSEPH DEL, FORT DE FRANCE
97;RUE DU JOSTROPHAS, FORT DE FRANCE
97;RUE JULES BEAUNES, FORT DE FRANCE
97;CHE JULES BEAUNES, FORT DE FRANCE
97;RUE DE LA LAMPE D'ALADIN, FORT DE FRANCE
97;RUE JULES MONNEROT, FORT DE FRANCE
97;RUE KARUKERA, FORT DE FRANCE
97;RUE DE KERLYS, FORT DE FRANCE
97;ESP KONN'LAMBI, FORT DE FRANCE
97;RUE RAYMOND LABAT, FORT DE FRANCE
97;RTE LAFAYETTE, FORT DE FRANCE
97;PL LAFCADIO HEARN, FORT DE FRANCE
97;IMP LATANIER, FORT DE FRANCE
97;PAS LAKOUTOMAREN, FORT DE FRANCE
97;IMP LALIN KLE, FORT DE FRANCE
97;RUE LAMARTINE, FORT DE FRANCE
97;PONT LIENAFA, FORT DE FRANCE
97;AV VICTOR LAMON, FORT DE FRANCE
97;PASS CASIMIR LASCO, FORT DE FRANCE
97;RTE DU LAMENTIN COTE DROIT, FORT DE FRANCE
97;RTE DU LAMENTIN COTE GAUCHE, FORT DE FRANCE
97;IMP LA LANTERNE, FORT DE FRANCE
97;RTE DU LAMENTIN, FORT DE FRANCE
97;CHE LARLANE CIMPER, FORT DE FRANCE
97;PL LANGUEDOC ROUSSILLON, FORT DE FRANCE
97;RUE DES LAURIERS, FORT DE FRANCE
97;RUE DES LAVANDIERES, FORT DE FRANCE
97;RUE DU LATANIER, FORT DE FRANCE
97;RUE LAZARE CARNOT, FORT DE FRANCE
97;RUE LEDRU ROLLIN BETZY, FORT DE FRANCE
97;CHE LEGER, FORT DE FRANCE
97;AV LEON GONTRAN DAMAS, FORT DE FRANCE
97;RUE LEONTINE POULLET, FORT DE FRANCE
97;BD LEOPOLD BISSOL, FORT DE FRANCE
97;RUE DU BOIS GRILLE, FORT DE FRANCE
97;RUE DU LT JEAN MARIE QUIBERT, FORT DE FRANCE
97;RUE DE LA LIBERATION, FORT DE FRANCE
97;RLE AUGUSTE LIHAIRE, FORT DE FRANCE
97;RUE LIEUTENANT LACOSTE, FORT DE FRANCE
97;IMP DU LIEUTENANT LAPEYRE, FORT DE FRANCE
97;RUE DES LILAS, FORT DE FRANCE
97;RUE DE LA LIBERTE, FORT DE FRANCE
97;RUE CAPITAINE LOCA, FORT DE FRANCE
97;RUE DU LOTISSEMENT DORE, FORT DE FRANCE
97;VOIE DU LOTISSEMENT S M I, FORT DE FRANCE
97;IMP DANIEL LONDAS, FORT DE FRANCE
97;IMP LOUIS BLANC, FORT DE FRANCE
97;PAS MACHAN MELE, FORT DE FRANCE
97;PAS DE LA MADELEINE, FORT DE FRANCE
97;RUE DU MAGNOLIA, FORT DE FRANCE
97;CHEM DU MAPOU, FORT DE FRANCE
97;IMP DES MANGOTS VERTS, FORT DE FRANCE
97;RUE DU MARIN, FORT DE FRANCE
97;RUE MARIUS PERROA, FORT DE FRANCE
97;RUE MERITE ARTISANAL, FORT DE FRANCE
97;RUE MARIE THERESE LUNG FOU, FORT DE FRANCE
97;ALL DE LA LOUISIANE, FORT DE FRANCE
97;RUE LOUIS BLANC, FORT DE FRANCE
97;RUE DU MORNE, FORT DE FRANCE
97;IMP DU MORNE, FORT DE FRANCE
97;RUE DU MORNE ESCARPE, FORT DE FRANCE
97;RUE DES LUCIOLES, FORT DE FRANCE
97;RUE LUCIEN MAY REINE, FORT DE FRANCE
97;RUE DE LA LUMIERE, FORT DE FRANCE
97;RUE DES LUTINS, FORT DE FRANCE
97;RUE DES LYS   REDOUTE, FORT DE FRANCE
97;RUE CHRISTIAN MARAJO, FORT DE FRANCE
97;IMP MADERE, FORT DE FRANCE
97;RUE DES MAHOGANY, FORT DE FRANCE
97;RUE DU MANCENILLIER COUPE, FORT DE FRANCE
97;RUE DES MANGUIERS, FORT DE FRANCE
97;RUE DU MANOIR, FORT DE FRANCE
97;RUE MARAT, FORT DE FRANCE
97;RUE MARCEL WILTOR, FORT DE FRANCE
97;RUE MADININA, FORT DE FRANCE
97;RUE DE LA MESANGE, FORT DE FRANCE
97;RUE DU MARIGOT DE BELLEVUE, FORT DE FRANCE
97;BD DU MARECHAL DE LATTRE, FORT DE FRANCE
97;RUE DU MARECHAL LECLERC, FORT DE FRANCE
97;RUE DE MORNE MORISSOT, FORT DE FRANCE
97;RUE DU MORNE PICHEVIN, FORT DE FRANCE
97;IMP DES MALANGAS, FORT DE FRANCE
97;IMP DES MANGOTINES, FORT DE FRANCE
97;PASS DE LA MAUVE, FORT DE FRANCE
97;IMP ARNAUD MARIE, FORT DE FRANCE
97;PASS DU 22 MAI, FORT DE FRANCE
97;RUE MARIE THERESE GERTRUDE, FORT DE FRANCE
97;RUE MARIUS LACY, FORT DE FRANCE
97;RUE MARTIN LUTHER KING VOIE 1, FORT DE FRANCE
97;RUE MARTIN LUTHER KING VOIE 11, FORT DE FRANCE
97;RUE DU MARTEAU, FORT DE FRANCE
97;RUE MARTIN L KING COTE DROIT, FORT DE FRANCE
97;RUE MARTIN L KING COTE GAUCHE, FORT DE FRANCE
97;RUE MARTIN LUTHER KING, FORT DE FRANCE
97;AV MAURICE BISHOP, FORT DE FRANCE
97;AV MAURICE BISHOP COTE DROIT, FORT DE FRANCE
97;AV MAURICE BISHOP COTE GAUCHE, FORT DE FRANCE
97;AV MAURICE BISHOP VOIE 5, FORT DE FRANCE
97;AV MAURICE BISHOP VOIE 7, FORT DE FRANCE
97;AV MAURICE BISHOP VOIE 10, FORT DE FRANCE
97;IMP MIDONNET, FORT DE FRANCE
97;AV MAURICE BISHOP VOIE 22, FORT DE FRANCE
97;AV DOCTEUR MAURICE MONROSE, FORT DE FRANCE
97;IMP DU MERISIER, FORT DE FRANCE
97;RUE A. MONTLOUIS FELICITE, FORT DE FRANCE
97;RUE MONSEIGNEUR LEQUIN, FORT DE FRANCE
97;PL MONSEIGNEUR ROMERO, FORT DE FRANCE
97;RUE MONSIEUR, FORT DE FRANCE
97;RUE DE LA MAZURKA, FORT DE FRANCE
97;PAS DU MORNE ESCARPE, FORT DE FRANCE
97;RUE MONTESQUIEU, FORT DE FRANCE
97;IMP MATEBIS, FORT DE FRANCE
97;IMP DES MERISIERS, FORT DE FRANCE
97;RUE MOREAU DE JONNES, FORT DE FRANCE
97;PAS MORNE GRAGE, FORT DE FRANCE
97;PAS MORNE TABLE, FORT DE FRANCE
97;CR MORNE BAPTISTE, FORT DE FRANCE
97;IMP MORNE BAPTISTE, FORT DE FRANCE
97;AV B MORNE CALEBASSE, FORT DE FRANCE
97;RTE DU MORNE DESAIX, FORT DE FRANCE
97;VC DE MORNE LAURENT, FORT DE FRANCE
97;ALL DES MUSSEAENDAS, FORT DE FRANCE
97;IMP FERNAND NESTORET, FORT DE FRANCE
97;RUE PAUL ROBERT NIRENNOLD, FORT DE FRANCE
97;RLE OCTAVIE NICOLAYOU-DIRIGENT, FORT DE FRANCE
97;BD NELSON MANDELA, FORT DE FRANCE
97;RUE DU MORNE VANIER, FORT DE FRANCE
97;CHE MORNE VENTE, FORT DE FRANCE
97;ALL DES MUSCADIERS, FORT DE FRANCE
97;IMP DE MOUTTE, FORT DE FRANCE
97;RTE DE MOUTTE, FORT DE FRANCE
97;RUE DES MUGUETS, FORT DE FRANCE
97;IMP NICOLAS GUILEN, FORT DE FRANCE
97;RUE DE LA MUTUALITE, FORT DE FRANCE
97;RUE OMER CESAIRE, FORT DE FRANCE
97;BD DE LA MARNE, FORT DE FRANCE
97;RUE DES ORCHIDEES, FORT DE FRANCE
97;BD DU NORD CITE DE BRIANT, FORT DE FRANCE
97;RUE DES OISEAUX DU PARADIS, FORT DE FRANCE
97;RUE DES OLIVIERS TARTENSON, FORT DE FRANCE
97;RUE OSMAN NADEAU, FORT DE FRANCE
97;BD DE L OUEST GODISSARD, FORT DE FRANCE
97;RUE DE L OUVRIER ALBERT, FORT DE FRANCE
97;VC ENTREE CITE OZANAM, FORT DE FRANCE
97;AV L'OREE DU PARC  MONTGERALD, FORT DE FRANCE
97;RUE DE LA PAIX, FORT DE FRANCE
97;RUE DES PAMPILLES, FORT DE FRANCE
97;RUE DES PALMIERS, FORT DE FRANCE
97;PAS HENRI TITINA PERE, FORT DE FRANCE
97;RUE DU PHOTOGRAPHE, FORT DE FRANCE
97;RUE POMME CANELLE, FORT DE FRANCE
97;RUE PAPIN DUPONT, FORT DE FRANCE
97;AV DU PARC  MONTGERALDE, FORT DE FRANCE
97;RUE DE LA PASSERELLE, FORT DE FRANCE
97;RUE PASCAL ELISABETH-MESNAGER, FORT DE FRANCE
97;RUE DE L'ORGUEIL DE CHINE, FORT DE FRANCE
97;RUE DE LA PAGODE, FORT DE FRANCE
97;RUE DU PENDULA, FORT DE FRANCE
97;CHEM DE LA PETANQUE, FORT DE FRANCE
97;RUE PROFESSEUR R. ROY CAMILLE, FORT DE FRANCE
97;RUE DE LA ROSE PORCELAINE, FORT DE FRANCE
97;AV PASTEUR, FORT DE FRANCE
97;AV PASTEUR VOIE 2, FORT DE FRANCE
97;AV PASTEUR VOIE 3, FORT DE FRANCE
97;AV PASTEUR VOIE 4, FORT DE FRANCE
97;AV PASTEUR VOIE 8, FORT DE FRANCE
97;RUE PATRICE LUMUMBA, FORT DE FRANCE
97;RUE DU PATAGON, FORT DE FRANCE
97;RUE PATTE D OIE, FORT DE FRANCE
97;RUE PAUL DOUMER, FORT DE FRANCE
97;RUE DU PATCHOULI, FORT DE FRANCE
97;RUE PAUL LANGEVIN, FORT DE FRANCE
97;RUE PAUL MARIE VALERE, FORT DE FRANCE
97;RUE PAULO ROSINE, FORT DE FRANCE
97;RUE DU PAIN D'EPICE, FORT DE FRANCE
97;PAS DE LA PAGODE, FORT DE FRANCE
97;AV PAUL NARDAL, FORT DE FRANCE
97;RUE DES DEUX OIES, FORT DE FRANCE
97;RUE XAVIER ORVILLE, FORT DE FRANCE
97;ALL DE LA PAIX, FORT DE FRANCE
97;IMP JEAN-CLAUDE PERASTE, FORT DE FRANCE
97;RUE DU PANIER BASSIN, FORT DE FRANCE
97;ALL ROSA PARKS, FORT DE FRANCE
97;RUE DU PAVE, FORT DE FRANCE
97;RLE FRANCOIS PAVILLA, FORT DE FRANCE
97;RUE DES PECHEURS, FORT DE FRANCE
97;PL DU PERE LABAT, FORT DE FRANCE
97;RUE PERE DOM, FORT DE FRANCE
97;RUE DU REVEREND PERE PINCHON, FORT DE FRANCE
97;RUE DU PERE BAUMAN, FORT DE FRANCE
97;PAS PERE DOM, FORT DE FRANCE
97;RUE PERRINON, FORT DE FRANCE
97;RUE DU PERROQUET VERT, FORT DE FRANCE
97;RUE DES PERRUCHES, FORT DE FRANCE
97;ALL DES PERRUCHES, FORT DE FRANCE
97;RUE DE LA PERSEVERANCE, FORT DE FRANCE
97;IMP PETIT MORNE, FORT DE FRANCE
97;RUE DU PETIT PAVOIS, FORT DE FRANCE
97;RUE PETITION OUVRIERS DE PARIS, FORT DE FRANCE
97;RLE DU PETIT PASSAGE, FORT DE FRANCE
97;RUE PETIT THYM, FORT DE FRANCE
97;RTE DU PHARE, FORT DE FRANCE
97;RUE PIERRE BRICE, FORT DE FRANCE
97;RUE PIERRE BRICE AVE C, FORT DE FRANCE
97;IMP LE PIC, FORT DE FRANCE
97;RUE DE PETITE ANSE, FORT DE FRANCE
97;RUE PIERRE ET MARIE CURIE, FORT DE FRANCE
97;RUE DE LA PIERRE NOIRE, FORT DE FRANCE
97;RUE PIERRE PLESDIN, FORT DE FRANCE
97;RUE DU PILOTE, FORT DE FRANCE
97;RUE PIERRE LYAUDET, FORT DE FRANCE
97;RUE DU PLATEAU, FORT DE FRANCE
97;RUE DE LA PIETE, FORT DE FRANCE
97;RUE DE LA ROCADE, FORT DE FRANCE
97;RUE DU PLATEAU FABRE, FORT DE FRANCE
97;RUE PIERRE SEMAR, FORT DE FRANCE
97;RUE DES PIONNIERS, FORT DE FRANCE
97;RUE DU PIPIRI, FORT DE FRANCE
97;AV DE LA PLAINE  MONTGERALDE, FORT DE FRANCE
97;RUE VINCENT PLACOLY, FORT DE FRANCE
97;IMP DES PIONNIERS, FORT DE FRANCE
97;RTE DE LA POINTE DES CARRIERES, FORT DE FRANCE
97;RTE DE LA POINTE DES GRIVES, FORT DE FRANCE
97;BD DE LA POINTE DES NEGRES, FORT DE FRANCE
97;RTE DE LA POINTE DES SABLES, FORT DE FRANCE
97;IMP POMME ROSE, FORT DE FRANCE
97;RUE DES POIS DOUX, FORT DE FRANCE
97;RUE DES REMPARTS, FORT DE FRANCE
97;RUE DU POMPON SOLDAT, FORT DE FRANCE
97;RUE DES ROSEAUX, FORT DE FRANCE
97;RUE DU RENDEZ VOUS, FORT DE FRANCE
97;RUE DES ROSIERS, FORT DE FRANCE
97;PONT DE LA RIVIERE MADAME, FORT DE FRANCE
97;RUE DE LA REVOLUTION, FORT DE FRANCE
97;ALL DES POIRIERS, FORT DE FRANCE
97;ALL DES ACALIPHAS, FORT DE FRANCE
97;ALL DES IXORAS, FORT DE FRANCE
97;PONT DE CHAINE COTE DROIT, FORT DE FRANCE
97;PONT DE CHAINE COTE GAUCHE, FORT DE FRANCE
97;PAS DU PONT VIARD, FORT DE FRANCE
97;VC POPULO VOIE NO 2, FORT DE FRANCE
97;VC POPULO VOIE NO 4, FORT DE FRANCE
97;RUE DU MORNE SUREY, FORT DE FRANCE
97;VC DE POSTE COLON, FORT DE FRANCE
97;RUE DE LA POSTE DE STE-THERESE, FORT DE FRANCE
97;RLE DES P T T, FORT DE FRANCE
97;RUE SEXTUS MONNELY, FORT DE FRANCE
97;RUE DES PRES, FORT DE FRANCE
97;RUE DES PALETUVIERS, FORT DE FRANCE
97;IMP DU PREVENTORIUM, FORT DE FRANCE
97;RUE PROFESSEUR RAYMOND GARCIN, FORT DE FRANCE
97;RUE DU TONNELIER, FORT DE FRANCE
97;RUE DES PROPHETES, FORT DE FRANCE
97;RUE DES PROPHETES VOIE 3, FORT DE FRANCE
97;RUE DES PROPHETES VOIE 5, FORT DE FRANCE
97;RUE DES PROPHETES VOIE 7, FORT DE FRANCE
97;BD THELUS LERO, FORT DE FRANCE
97;RUE HENRI FIDAT, FORT DE FRANCE
97;IMP ALBERT MOSCOU, FORT DE FRANCE
97;RUE DES QUADRILLES, FORT DE FRANCE
97;AV ZOBDA QUITMAN, FORT DE FRANCE
97;RUE DE LA RENOVATION, FORT DE FRANCE
97;RUE DU RAIDILLON, FORT DE FRANCE
97;RUE DU PETIT CHEMIN, FORT DE FRANCE
97;RUE DES RAMEAUX, FORT DE FRANCE
97;IMP DES RAMIERS, FORT DE FRANCE
97;CD NO 47 RTE RAVINE VILAINE, FORT DE FRANCE
97;RTE DE LA RAVINE, FORT DE FRANCE
97;RUE DE LA RAVINE BLANCHE, FORT DE FRANCE
97;IMP DE LA RAVINE, FORT DE FRANCE
97;RUE DE LA RAVINE MOREAU, FORT DE FRANCE
97;RTE DE RAVINE VILAINE ENT BOCH, FORT DE FRANCE
97;RTE DE RAVINE VILAINE GDE TERR, FORT DE FRANCE
97;RTE DE RAVINE VILAINE, FORT DE FRANCE
97;RTE DE REDOUTE VOIE NO 13, FORT DE FRANCE
97;RTE DE REDOUTE VOIE NO 14, FORT DE FRANCE
97;RUE RAYMOND GARCIN, FORT DE FRANCE
97;RTE DE REDOUTE VOIE NO 15, FORT DE FRANCE
97;RTE DE REDOUTE COTE DROIT, FORT DE FRANCE
97;RTE DE REDOUTE COTE GAUCHE, FORT DE FRANCE
97;RTE DE REDOUTE, FORT DE FRANCE
97;RUE REDOUTE DE MATOUBA, FORT DE FRANCE
97;RTE DES RELIGIEUSES, FORT DE FRANCE
97;RTE DES RELIGIEUSES VOIE 23, FORT DE FRANCE
97;RTE DES RELIGIEUSES VOIE 27, FORT DE FRANCE
97;RUE RENE MARAN, FORT DE FRANCE
97;RTE DES RELIGIEUSES VOIE 8, FORT DE FRANCE
97;RUE DE LA REPUBLIQUE, FORT DE FRANCE
97;RTE DE REDOUTE VOIE NO 17, FORT DE FRANCE
97;RTE DE REDOUTE VOIE NO 20, FORT DE FRANCE
97;RTE DE REDOUTE VOIE NO 21, FORT DE FRANCE
97;RUE DES AVENTS, FORT DE FRANCE
97;RTE DE REDOUTE VOIE NO 30, FORT DE FRANCE
97;RTE DE REDOUTE VOIE NO 32, FORT DE FRANCE
97;AV A RENEVILLE, FORT DE FRANCE
97;RUE DES RESERVOIRS, FORT DE FRANCE
97;VC RIVIERE L'OR VOIE NO 1, FORT DE FRANCE
97;RUE DE LA RESISTANCE, FORT DE FRANCE
97;RUE DE LA RETRAITE, FORT DE FRANCE
97;RTE DE REDOUTE VOIE 18, FORT DE FRANCE
97;RTE DES RELIGIEUSES VOIE 19 R, FORT DE FRANCE
97;AV RICHARD GRANVORKA, FORT DE FRANCE
97;RTE DES RELIGIEUSES VOIE NO 2, FORT DE FRANCE
97;BD ROBERT ATTULY COTE DROIT, FORT DE FRANCE
97;BD ROBERT ATTULY COTE GAUCHE, FORT DE FRANCE
97;BD ROBERT ATTULY, FORT DE FRANCE
97;RTE DES RELIGIEUSES VOIE NO 4, FORT DE FRANCE
97;RUE RENEVILLE VOIE NO 7, FORT DE FRANCE
97;RTE DES RELIGIEUSES VOIE 10, FORT DE FRANCE
97;RTE DES RELIGIEUSES VOIE 12, FORT DE FRANCE
97;RTE RELIGIEUSES VOIE 25 AV A, FORT DE FRANCE
97;RUE ROBESPIERRE, FORT DE FRANCE
97;RTE RELIGIEUSES VOIE 25 AV B, FORT DE FRANCE
97;RTE RELIGIEUSES VOIE 25 AV C, FORT DE FRANCE
97;RTE RELIGIEUSES VOIE 25 AV D, FORT DE FRANCE
97;RTE RELIGIEUSES VOIE 19 AV B, FORT DE FRANCE
97;CD LA ROCADE CD NO 41, FORT DE FRANCE
97;RTE DES ROCHERS, FORT DE FRANCE
97;RTE DES ROCHERS VOIE NO 1, FORT DE FRANCE
97;RTE DES ROCHERS VOIE NO 3, FORT DE FRANCE
97;RTE DES ROCHERS VOIE NO 4, FORT DE FRANCE
97;RTE DES ROCHERS VOIE NO 5, FORT DE FRANCE
97;RTE DES ROCHERS VOIE NO 7, FORT DE FRANCE
97;VC DE RODATE, FORT DE FRANCE
97;RUE ROLAND LOZON, FORT DE FRANCE
97;RUE DU ROUTOUTOU, FORT DE FRANCE
97;RUE FAUSTIN ROUIL, FORT DE FRANCE
97;AV JACQUES ROUMAIN, FORT DE FRANCE
97;RUE NICOLAS RONOT, FORT DE FRANCE
97;RUE DE ROYAN, FORT DE FRANCE
97;RUE DE LA REJANE, FORT DE FRANCE
97;RUE DE LA RUMBA, FORT DE FRANCE
97;RUE DE LA RAVINE BOUILLE, FORT DE FRANCE
97;RUE DE LA RAVINE SAINT BENOIT, FORT DE FRANCE
97;RUE SAINT CHRISTOPHE, FORT DE FRANCE
97;IMP SAINT CHRISTOPHE, FORT DE FRANCE
97;RUE DES RETROUVAILLES, FORT DE FRANCE
97;RUE ROBERT JULIENNE, FORT DE FRANCE
97;RUE ROGER DORSINVILLE, FORT DE FRANCE
97;RUE DU ROSAIRE, FORT DE FRANCE
97;RUE RUBAN MARTYR, FORT DE FRANCE
97;RUE DE SAINT PIERRE, FORT DE FRANCE
97;BD SAINTE CATHERINE, FORT DE FRANCE
97;RUE DE SAINTE LUCIE, FORT DE FRANCE
97;RUE SAM CASTANDET, FORT DE FRANCE
97;RUE DE LA SOLIDARITE, FORT DE FRANCE
97;AV DE LA SOLIDARITE, FORT DE FRANCE
97;RUE ROBERT MONTOUT, FORT DE FRANCE
97;PAS DU ROUTOUTOU, FORT DE FRANCE
97;IMP ROGES, FORT DE FRANCE
97;RUE DE LA SAGESSE, FORT DE FRANCE
97;AV SAINT JOHN PERSE, FORT DE FRANCE
97;CHE SAINT FELICIEN AMANT, FORT DE FRANCE
97;RUE SAINT JUST, FORT DE FRANCE
97;RUE SAINTE THERESE, FORT DE FRANCE
97;RUE DU SAVONNETTE RIVIERE, FORT DE FRANCE
97;AV SALVADOR ALLENDE, FORT DE FRANCE
97;RUE SANS SOUCIS, FORT DE FRANCE
97;RUE SAINT ELOI, FORT DE FRANCE
97;AV LEOPOLD SEDAR SENGOR, FORT DE FRANCE
97;IMP SCHOELCHERY, FORT DE FRANCE
97;RTE DE SCHOELCHER, FORT DE FRANCE
97;RTE DE SCHOELCHER VOIE NO 1, FORT DE FRANCE
97;RTE DE SCHOELCHER VOIE NO 3, FORT DE FRANCE
97;RTE DE SCHOELCHER VOIE NO 5, FORT DE FRANCE
97;RTE DE SCHOELCHER VOIE NO 7, FORT DE FRANCE
97;RTE DE SCHOELCHER VOIE NO 10, FORT DE FRANCE
97;RTE ANCIENNE RTE DE SCHOELCHER, FORT DE FRANCE
97;IMP BEAU SOLEIL, FORT DE FRANCE
97;RLE DE LA SECURITE, FORT DE FRANCE
97;RUE DE LA SECURITE SOCIALE, FORT DE FRANCE
97;RUE DU SENTIER, FORT DE FRANCE
97;IMP DU SERGENT BOBILLOT, FORT DE FRANCE
97;RUE SIMON BOLIVAR, FORT DE FRANCE
97;AV JEAN MARIE SERRAULT, FORT DE FRANCE
97;RUE DU SOUTENEMENT, FORT DE FRANCE
97;IMP SIANO, FORT DE FRANCE
97;IMP DE LA BONNE SOUPE, FORT DE FRANCE
97;ALL DES SISI, FORT DE FRANCE
97;RUE DES SIX PONCHEVINS, FORT DE FRANCE
97;BD SOWETO, FORT DE FRANCE
97;RTE DU STADE, FORT DE FRANCE
97;RUE DU SURIAU, FORT DE FRANCE
97;PL STALINGRAD, FORT DE FRANCE
97;RUE DU SUCRIER, FORT DE FRANCE
97;RTE STRATEGIQUE DU FORT DESAIX, FORT DE FRANCE
97;RUE DU TAILLIS, FORT DE FRANCE
97;RUE DE LA TANNERIE, FORT DE FRANCE
97;RUE DES TAMARINIERS, FORT DE FRANCE
97;RUE DES TAMARINS DES INDES, FORT DE FRANCE
97;RUE TCHE BAMBOU, FORT DE FRANCE
97;RUE MANON ET RAPHAEL TARDON, FORT DE FRANCE
97;RUE DU TERRAIN FANTAISIE, FORT DE FRANCE
97;PAS DU THE PAYS, FORT DE FRANCE
97;PAS THEVENARD, FORT DE FRANCE
97;RUE GEORGES THEODORE, FORT DE FRANCE
97;IMP TIRE D AILE, FORT DE FRANCE
97;IMP TI-EMILE CASERUS, FORT DE FRANCE
97;AV TI-EMILE CASERUS, FORT DE FRANCE
97;AV PAULIUS TRAQUE, FORT DE FRANCE
97;RUE THEODORE BAUDE, FORT DE FRANCE
97;RUE DE LA SAPOTILLE, FORT DE FRANCE
97;RUE THUMERVILLE EMILIEN, FORT DE FRANCE
97;RUE VINTAR EMMANUEL, FORT DE FRANCE
97;RUE TI BOULIQUI, FORT DE FRANCE
97;RUE TI COLIBRI, FORT DE FRANCE
97;RUE TI DOUDOU, FORT DE FRANCE
97;ALL TIRE D AILE, FORT DE FRANCE
97;PAS DES TITIRIS, FORT DE FRANCE
97;RTE DE TIVOLI, FORT DE FRANCE
97;AV JEAN MARIE TJIBAOU, FORT DE FRANCE
97;RUE DES TOURTERELLES, FORT DE FRANCE
97;RUE DU TOBOGGAN, FORT DE FRANCE
97;AV DES TOURELLES, FORT DE FRANCE
97;RUE DU TOLOMAN, FORT DE FRANCE
97;IMP DU TONNELIER, FORT DE FRANCE
97;RUE DE LA TROMPETTE DES ANGES, FORT DE FRANCE
97;RUE TON RENE, FORT DE FRANCE
97;RUE TOUSSAINT LOUVERTURE, FORT DE FRANCE
97;RUE DU PROGRES, FORT DE FRANCE
97;RTE DU TRABAUD, FORT DE FRANCE
97;IMP EMILE TRAMIS, FORT DE FRANCE
97;RUE DE LA TRANQUILLITE, FORT DE FRANCE
97;AV PROFESSEUR JUDES TURIAF, FORT DE FRANCE
97;RUE DU TULIPIER, FORT DE FRANCE
97;RUE DU 13 MAI 1977, FORT DE FRANCE
97;VC TRENELLE VOIE 2, FORT DE FRANCE
97;VC TRENELLE VOIE 4, FORT DE FRANCE
97;VC TRENELLE VOIE 18, FORT DE FRANCE
97;VC TRENELLE VOIE 20, FORT DE FRANCE
97;VC TRENELLE VOIE 22, FORT DE FRANCE
97;PAS TROMPETTE DES ANGES, FORT DE FRANCE
97;BD DE LA T.S.F., FORT DE FRANCE
97;RTE DE T.S.F. CD NO 59, FORT DE FRANCE
97;RTE DE T.S.F. VOIE N 3, FORT DE FRANCE
97;RTE DE T.S.F. VOIE N 2, FORT DE FRANCE
97;RUE TUFF  A, FORT DE FRANCE
97;RUE TUFF B, FORT DE FRANCE
97;IMP URBAIN REMINY, FORT DE FRANCE
97;AV EUGENE MONA, FORT DE FRANCE
97;RUE DES URSULINES, FORT DE FRANCE
97;RUE DE LA TUMA, FORT DE FRANCE
97;RTE DE L'UNION, FORT DE FRANCE
97;CHE DU VAL FLOREAL, FORT DE FRANCE
97;AV DE LA VALLEE MONTGERALDE, FORT DE FRANCE
97;RUE DE LA VALMENIERE, FORT DE FRANCE
97;RUE VAUBAN, FORT DE FRANCE
97;RUE HENRI VALERY, FORT DE FRANCE
97;IMP DE LA VENELLE, FORT DE FRANCE
97;RUE DE LA VALSE CREOLE, FORT DE FRANCE
97;RUE DU VETIVER, FORT DE FRANCE
97;RUE DE LA ROSE DES VENTS, FORT DE FRANCE
97;IMP RAPHAEL VETURY, FORT DE FRANCE
97;BD DE VERDUN, FORT DE FRANCE
97;IMP DE VERDUN, FORT DE FRANCE
97;IMP DU VERGER, FORT DE FRANCE
97;RUE DU VERSANT FLEURI, FORT DE FRANCE
97;AV DES VERSANTS  MONTGERALDE, FORT DE FRANCE
97;RUE DE LA VERVEINE, FORT DE FRANCE
97;IMP VICTOIRE, FORT DE FRANCE
97;RUE VICTOR HUGO, FORT DE FRANCE
97;RUE VICTOR SCHOELCHER, FORT DE FRANCE
97;RUE VICTOR SEVERE, FORT DE FRANCE
97;RPT DU VIET NAM HEROIQUE, FORT DE FRANCE
97;RUE DU VIEUX CHEMIN, FORT DE FRANCE
97;RUE EMILE GROS DUBOIS, FORT DE FRANCE
97;RUE DE LA POINTE DES GRIVES, FORT DE FRANCE
97;AV ANTOINE VITEZ, FORT DE FRANCE
97;RLE DE LA PLACE DU 22 MAI, FORT DE FRANCE
97;PL DU 22 MAI 1848, FORT DE FRANCE
97;RUE DU 23 MAI 1848, FORT DE FRANCE
97;PL VOLNY-MARAJO, FORT DE FRANCE
97;RUE VOLTAIRE, FORT DE FRANCE
97;RUE GERARD WATELLO, FORT DE FRANCE
97;RUE WILLIAM RAMIN, FORT DE FRANCE
97;IMP WILLIAM RAMIN, FORT DE FRANCE
97;RUE YVES GOUSSARD, FORT DE FRANCE
97;RUE DU ZAMANA, FORT DE FRANCE
97;RUE ZAMEO ZEPHIR, FORT DE FRANCE
97;CHE ZICAK, FORT DE FRANCE
97;RPT JOSEPH ZOBEL, FORT DE FRANCE
97;CHEM DE CRETE, FORT DE FRANCE
97;RUE DE LA BUTTE VOIE 2, FORT DE FRANCE
97;RES ARAGO, FRANCOIS
97;LOT CALONNE VOUSTAD, FRANCOIS
97;RES LES LAURIERS, FRANCOIS
97;LOT LA COTONNERIE, FRANCOIS
97;RES LE MOLE POINTE COURCHET, FRANCOIS
97;LOT POINTE COURCHET, FRANCOIS
97;LOT ALLEE COCO, FRANCOIS
97;RES DELGRES, FRANCOIS
97;CITE ESPERANCE, FRANCOIS
97;CITE EUCALYPTUS, FRANCOIS
97;RES FLEUR D'EAU, FRANCOIS
97;RES FLORENT HOLO, FRANCOIS
97;CASR DE GENDARMERIE, FRANCOIS
97;RES MAKADE - RUE SCHOELCHER, FRANCOIS
97;RES LES ZICAKS, FRANCOIS
97;CITE LA JETEE, FRANCOIS
97;LOT LA MARTIENNE, FRANCOIS
97;LOT DU SIMON, FRANCOIS
97;LOT SOLEIL LEVANT, FRANCOIS
97;RES SOMMET DE LA BAIE - PRESQU, FRANCOIS
97;LOT THALEMONT, FRANCOIS
97;CITE NOUVELLE, FRANCOIS
97;CITE SCOLAIRE, FRANCOIS
97;ALL DES AIGRETTES, FRANCOIS
97;RUE BANIDOL, FRANCOIS
97;ALL BALE DOU, FRANCOIS
97;VC DE BOIS NEUF, FRANCOIS
97;CR DE BOIS SERAPHIN CALONNE, FRANCOIS
97;CHEM CAP EST, FRANCOIS
97;RUE DU CENTRE DE SECOURS, FRANCOIS
97;ALL CHADWON BENI 3, FRANCOIS
97;RUE COUTURIER, FRANCOIS
97;VC DES ROSES, FRANCOIS
97;VC DE MORNE SERPENT, FRANCOIS
97;VC DE BOIS SOLDAT, FRANCOIS
97;CC DE JAHAM DOS D ANE, FRANCOIS
97;CR DE MORNE MULATRE, FRANCOIS
97;VC DE PERRIOLAT, FRANCOIS
97;CHE DIT DE BALISIER, FRANCOIS
97;CR DE CAPULO, FRANCOIS
97;CR DE DUCHENE, FRANCOIS
97;CR MORNE PAVILLON, FRANCOIS
97;CR DE MORNE SAVON, FRANCOIS
97;CR DE GRANDE RAVINE, FRANCOIS
97;CR DE SAINT ROCH, FRANCOIS
97;CR DE MORNE VENT, FRANCOIS
97;CR DE RETORY, FRANCOIS
97;CR DE DOS D ANE, FRANCOIS
97;CR DE GROSSE ROCHE, FRANCOIS
97;CR DE DUQUESNE, FRANCOIS
97;CR DE FARELLE, FRANCOIS
97;RUE DE L ECOLE MATERNELLE, FRANCOIS
97;RUE ELPHEGE MELAN, FRANCOIS
97;RUE ERNEST DEPROGE, FRANCOIS
97;CR DE FOND LAMY, FRANCOIS
97;VC DE FONTANE, FRANCOIS
97;RUE FRANCOIS ARAGO, FRANCOIS
97;RUE FRANTZ FANON, FRANCOIS
97;BD DES FUSILLES, FRANCOIS
97;CR DIT DE GABOURIN, FRANCOIS
97;PL GENERAL DE GAULLE, FRANCOIS
97;CR DE LA GILLOT, FRANCOIS
97;CR DE GOURRE, FRANCOIS
97;ALL GWO KONSOUL, FRANCOIS
97;RUE DELGRES, FRANCOIS
97;RUE FLORENT HOLO, FRANCOIS
97;ALL DES GOMMIERS, FRANCOIS
97;RUE HOMERE CLEMENT, FRANCOIS
97;PL HURRARD, FRANCOIS
97;RUE JEAN JAURES, FRANCOIS
97;RUE JOSEPH LAGROSILLIERE, FRANCOIS
97;RUE DE LA LIBERTE, FRANCOIS
97;ALL KAYALI, FRANCOIS
97;RUE LEOPOLD BISSOL, FRANCOIS
97;ALL DES LITUITES, FRANCOIS
97;RUE LUBIN, FRANCOIS
97;PL DU MARCHE, FRANCOIS
97;RUE MAURICE DES ETAGES, FRANCOIS
97;CHEM MAYO, FRANCOIS
97;CR DIT DE MONTAOU, FRANCOIS
97;VC DE MORNE COURBARIL, FRANCOIS
97;RUE MONGIN, FRANCOIS
97;RUE NEUVE, FRANCOIS
97;ALL PAT JON, FRANCOIS
97;ALL PATJOULI, FRANCOIS
97;RUE PERRINON, FRANCOIS
97;CHEM PINTE CERISIER, FRANCOIS
97;CR DIT DE PRONZOLA, FRANCOIS
97;CD DE REUNION, FRANCOIS
97;RUE SAINT MICHEL, FRANCOIS
97;ALL DES SARCELLES, FRANCOIS
97;RUE SCHOELCHER, FRANCOIS
97;RUE SERAPHIN CALONNE, FRANCOIS
97;BD DU SOLEIL LEVANT, FRANCOIS
97;RUE VINCENT ALLEGRE, FRANCOIS
97;RUE VOITIER, FRANCOIS
97;LOT LES KOULIROUS, GRAND RIVIERE
97;LOT MALAKOFF, GRAND RIVIERE
97;RUE AFRICA TIQUANT, GRAND RIVIERE
97;RUE ASIE ET ADA, GRAND RIVIERE
97;RUE BAGASSE, GRAND RIVIERE
97;RUE DU 8 MAI 1902, GRAND RIVIERE
97;RUE DE BELLEVUE, GRAND RIVIERE
97;RUE DU 22 MAI 1948, GRAND RIVIERE
97;RUE A. TAVERNY, GRAND RIVIERE
97;RUE ADOU, GRAND RIVIERE
