97;RES OPALE MANSARDE CATALOGNE, ROBERT
97;LOT EMERAUDE CARAIBE, ROBERT
97;LOT BETANIA, ROBERT
97;CITE PAUL SYMPHOR, ROBERT
97;RES POINTE ROYALE, ROBERT
97;CITE POINTE LYNCH, ROBERT
97;LOT POINTE HYACINTHE, ROBERT
97;LOT POINTE SAVANE NORD, ROBERT
97;LOT POINTE SAVANE, ROBERT
97;LOT POINTE SAVANE SUD, ROBERT
97;LOT AUX QUATRE VENTS, ROBERT
97;LOT SNC BORD DE MER, ROBERT
97;LOT SAINT CHRISTOPHE, ROBERT
97;LOT LES HAUTS DE SABLE BLANC, ROBERT
97;LOT SEMAPHORE, ROBERT
97;PARC DE LA SEMAIR, ROBERT
97;RES TCHATCHA, ROBERT
97;RES THAZARD, ROBERT
97;RUE DE L'ABATTOIR, ROBERT
97;ALL DES AMANDIERS, ROBERT
97;IMP DES AMANDIERS, ROBERT
97;IMP DES ANANAS, ROBERT
97;VC DE ALLEE COCO, ROBERT
97;ALL DES COCOTIERS BOURG, ROBERT
97;VC DE AUGRAIN, ROBERT
97;VC DE AUGRAIN VIVIES, ROBERT
97;ALL DU 12 MARS, ROBERT
97;RUE DE L AMANDIER, ROBERT
97;CHE AN BAS KAKO, ROBERT
97;CHE AN DE KA CI, ROBERT
97;CHE AN MIBI, ROBERT
97;RUE DE L ARBRE A PAIN, ROBERT
97;RUE DE L ARCHE, ROBERT
97;RUE DE L ARTISANAT, ROBERT
97;CHE BAS BRISSE, ROBERT
97;CHE BASE BOUTAUD, ROBERT
97;CHE BEAUSEJOUR 1, ROBERT
97;CHE BEAUSEJOUR 2, ROBERT
97;VOIE SUR BERGE, ROBERT
97;CHE BERTHOU 1, ROBERT
97;CHE BERTHOU 2, ROBERT
97;CHE BODJI, ROBERT
97;CHE BOIS ZOMBI, ROBERT
97;VC DE BERTHOU, ROBERT
97;CHE LA BOISSEULLE, ROBERT
97;RUE CALE DES MARCHES, ROBERT
97;RUE DES CAMPECHERS, ROBERT
97;RUE CAN CREOL, ROBERT
97;CHE CANELLE, ROBERT
97;RUE DES CAYALIS, ROBERT
97;IMP CE MA FOT, ROBERT
97;RUE CHABIN, ROBERT
97;VC DE BOIS DESIR, ROBERT
97;IMP CHARLES LOUISOR, ROBERT
97;IMP DU CHATEAU - VERT-PRE, ROBERT
97;RUE CHEMIN DE FER, ROBERT
97;RUE DE CHERE EPICE - VERT-PRE, ROBERT
97;RUE DU CIMETIERE - VERT-PRE, ROBERT
97;VC DE BOIS LANCY, ROBERT
97;CR DE BOIS NEUF, ROBERT
97;VC DE BOIS NEUF, ROBERT
97;RUE DE LA CITE, ROBERT
97;RUE CITE DES BRAVES, ROBERT
97;CR DE BOIS POTTEAU, ROBERT
97;VC DE BOIS POTTEAU, ROBERT
97;RUE CLAUDE LADOUR, ROBERT
97;RUE CLEMENT BARBARA, ROBERT
97;CHE CLERCIN, ROBERT
97;ALL DES COCOTIERS, ROBERT
97;CR DE BONNEAU, ROBERT
97;RUE DU COMMERCE, ROBERT
97;AV CONSTANT LERAY - VERT-PRE, ROBERT
97;CHE LA CORBON, ROBERT
97;CHE COULIS N 1, ROBERT
97;CHE COULIS N 2, ROBERT
97;CHE COULIS N 3, ROBERT
97;RUE COURBARIL, ROBERT
97;RUE DELBLOND, ROBERT
97;CR DE BONNY, ROBERT
97;RUE DE LA DIROZZO, ROBERT
97;RUE DES ECOLES - VERT-PRE, ROBERT
97;RUE EDOUARD PIDERY, ROBERT
97;RUE EDGARD LABOUR, ROBERT
97;ALL DES EPINEUX, ROBERT
97;CHE ERMITAGE, ROBERT
97;PL DES FETES - VERT-PRE, ROBERT
97;CHE DU FIGUIER, ROBERT
97;RUE DES FILAOS, ROBERT
97;RUE DES FILAOS VOIE 1, ROBERT
97;RUE DES FILAOS VOIE 2, ROBERT
97;RUE DES FILAOS VOIE 3, ROBERT
97;RUE DES FILAOS VOIE 4, ROBERT
97;AV DES BOUGAINVILLIERS, ROBERT
97;IMP DES BOUGAINVILLIERS, ROBERT
97;IMP BACOUNA, ROBERT
97;VC DE BOUTEAUD, ROBERT
97;CR DE BOUTEAUD I, ROBERT
97;CR DE BOUTEAUD II, ROBERT
97;RUE DES FILAOS VOIE 5, ROBERT
97;CHE FOND CORE, ROBERT
97;CHE FOND NICOLAS N 1, ROBERT
97;CHE FOND NICOLAS N 2, ROBERT
97;CHE FOND NICOLAS N 3, ROBERT
97;CHE FOND NICOLAS N 4, ROBERT
97;CHE FOND NICOLAS N 5, ROBERT
97;CR DE BRESSON, ROBERT
97;CHE FOND NICOLAS N 6, ROBERT
97;CHE FOND NICOLAS N 7, ROBERT
97;CHE FOND NICOLAS N 8, ROBERT
97;IMP DU FROMAGER, ROBERT
97;RUE GENDARMERIE, ROBERT
97;RUE GERARD NOUVET, ROBERT
97;RUE DES GOYAVIERS, ROBERT
97;RUE DES GOYAVIERS VOIE 1, ROBERT
97;RUE DES GOYAVIERS VOIE 2, ROBERT
97;CHE GRAND BLEU, ROBERT
97;IMP DE L HABITATION, ROBERT
97;RUE HONORE CELINO, ROBERT
97;RTE DES ICAQUES - VERT-PRE, ROBERT
97;RTE DES ILETS, ROBERT
97;RUE DE L INDUSTRIE, ROBERT
97;CHE KAY BEA, ROBERT
97;RUE JULES PLANCEL, ROBERT
97;CR DE CADET NO 1, ROBERT
97;CHE KAY VERONIQUE, ROBERT
97;RUE LAGIN, ROBERT
97;CHE MAN GEORGES, ROBERT
97;CHE DES MANGLES, ROBERT
97;CHE MANGOTIN, ROBERT
97;RUE DE LA MANGROVE, ROBERT
97;VC DE CAFE, ROBERT
97;RUE DE LA MARE, ROBERT
97;AV MARIUS STEPHANIE-VICTOIRE, ROBERT
97;IMP DU MARRONNAGE, ROBERT
97;RUE MAUVAISE PAYE - VERT-PRE, ROBERT
97;CHE MENA N 1, ROBERT
97;AV CALE DES MARCHES, ROBERT
97;TRA DU CASSIER JAUNE, ROBERT
97;AV DES CAYALIS, ROBERT
97;IMP DES POIRIERS, ROBERT
97;AV NELSON MANDELA, ROBERT
97;VC LA CHARLES, ROBERT
97;CHE MENA N 2, ROBERT
97;CHE MENA N 3, ROBERT
97;CHE MENA N 4, ROBERT
97;CHE MIGNOT, ROBERT
97;CHE MIGNOT EST, ROBERT
97;CHE MON LABE, ROBERT
97;CHE LA MONROSE, ROBERT
97;CHE MON LADJE, ROBERT
97;CR DE CHERE EPICE, ROBERT
97;ALL DES COCOTIERS PTE SAVANE, ROBERT
97;MTE MONTEE DU CLAPOTAGE, ROBERT
97;RUE DES COLIBRIS, ROBERT
97;IMP DES COLIBRIS, ROBERT
97;RUE DU COURBARIL, ROBERT
97;RUE DU COURBARIL VOIE 1, ROBERT
97;RUE DU COURBARIL VOIE 2, ROBERT
97;RUE DU COURBARIL VOIE 4, ROBERT
97;RUE DU COURBARIL VOIE 5, ROBERT
97;RUE DU COURBARIL VOIE 6, ROBERT
97;CHE MORNE GALBAS N 1, ROBERT
97;CHE MORNE GALBAS N 2, ROBERT
97;CHE MORNE GALBAS N 3, ROBERT
97;CHE MORNE GALBAS N 4, ROBERT
97;CHE CHARLERY CROCHERAY, ROBERT
97;CHE MORNE LA CROIX, ROBERT
97;ALL DES MOUBINS, ROBERT
97;IMP MUTUALITE, ROBERT
97;AV NELSON MANDELA, ROBERT
97;CHE ONESIME, ROBERT
97;IMP DU PALETUVIER, ROBERT
97;RUE DES PALETUVIERS, ROBERT
97;IMP PAUL GROS, ROBERT
97;VC DE DERRIERE BOURG, ROBERT
97;RUE PAUL SYMPHOR - VERT-PRE, ROBERT
97;IMP DES PECHEURS, ROBERT
97;RTE DE POINTE FORT, ROBERT
97;RTE DE POINTE FORT VOIE 1, ROBERT
97;CHE POINTE HYACINTHE, ROBERT
97;CHE POINTE LA ROSE SUD, ROBERT
97;CHE LA DIGUE, ROBERT
97;CHE DE POINTE MELON, ROBERT
97;CHE POINTE ROYALE, ROBERT
97;RUE POIS DOUX, ROBERT
97;CHE PONTALERY N 1, ROBERT
97;CHE PONTALERY N 2, ROBERT
97;RUE DES PURS SANGS, ROBERT
97;CHE RAISIN, ROBERT
97;VOIE RIVE GAUCHE, ROBERT
97;RUE RODOLPHE ET AGNES MAIGNAN, ROBERT
97;CHE DE LA ROSERAIE, ROBERT
97;CHE LA ROULETTE, ROBERT
97;CHE SAINT JUSTIN, ROBERT
97;CHE SAINTE CROIX N 1, ROBERT
97;CHE SAINTE CROIX N 2, ROBERT
97;CHE DOUDOU, ROBERT
97;RUE SEMAPHORE, ROBERT
97;CHE SEREIN, ROBERT
97;CHE SOLEIL LEVANT, ROBERT
97;VC DE DUCHENE, ROBERT
97;RUE DES ECOLES, ROBERT
97;ALL DES EPINEUSES, ROBERT
97;VC DE L'ERMITAGE, ROBERT
97;RUE FELIX FAURE, ROBERT
97;RUE DU STADE - VERT-PRE, ROBERT
97;CHE DU STADE, ROBERT
97;RUE DES TAMARINIERS, ROBERT
97;CHE TI AUGRAIN, ROBERT
97;RUE TITOYE, ROBERT
97;RUE DES TOULOULOUS, ROBERT
97;AV DU FLAMBOYANT, ROBERT
97;IMP DU FLAMBOYANT, ROBERT
97;VC DE FONDS BRULE I, ROBERT
97;CR DE FONDS BRULE II, ROBERT
97;CR DE FONDS D'OR, ROBERT
97;RUE FRANTZ FERJUL, ROBERT
97;VC DE FONDS NICOLAS, ROBERT
97;CHE TROU LIFRIDE, ROBERT
97;CHE TROU TERRE, ROBERT
97;CHE LA VERMEILLE, ROBERT
97;RUE DE LA YOLE, ROBERT
97;IMP ZAGAYAS, ROBERT
97;IMP DES ZICAQS, ROBERT
97;RUE ZOGRON, ROBERT
97;RUE BERTIN SAINTE-CROIX, ROBERT
97;VC DE FOUR A CHAUX, ROBERT
97;PLA L'ABBE MORLAND, ROBERT
97;PLA CHRISTIAN MARAJO, ROBERT
97;CHE DE LA FRATERNITE, ROBERT
97;VC DE GALETTE, ROBERT
97;RUE GIBRALTAR, ROBERT
97;RUE GOMMIER ROUGE, ROBERT
97;CITE LACROIX VOIE NO 1, ROBERT
97;CITE LACROIX VOIE NO 2, ROBERT
97;CITE LACROIX VOIE NO 3, ROBERT
97;VC DE LA HAUT, ROBERT
97;CR DE HAUTEUR PONTALERY NO 1, ROBERT
97;BD HENRI AUZE, ROBERT
97;VC DE L'HEUREUX, ROBERT
97;ALL DES HIBISCUS, ROBERT
97;CR DE HUBERT, ROBERT
97;IMP DES ICAQUES, ROBERT
97;RUE DU PONT DORE, ROBERT
97;RUE ISAMBERT, ROBERT
97;CHE MORNE LABBE, ROBERT
97;CHE ABEL LABONNE, ROBERT
97;CR DE LAZARET, ROBERT
97;ALL DES LATANIERS, ROBERT
97;ALL DES LAURIERS, ROBERT
97;VC DE LESTRADE, ROBERT
97;RUE DE L'ECOLE, ROBERT
97;CHE DE L'ILET (VC), ROBERT
97;RUE LOUIS BLANC, ROBERT
97;RUE LUCIEN BELUS, ROBERT
97;CHE TROU MAN LIC, ROBERT
97;TRA DES MANGUIERS, ROBERT
97;IMP DU MANGUIER, ROBERT
97;VC DE MENA, ROBERT
97;CHE MIBI, ROBERT
97;VC DE MOISE, ROBERT
97;CR DE MONNE, ROBERT
97;VC DE MONNEROT, ROBERT
97;IMP DES OLIVIERS, ROBERT
97;MTE DES PALMIERS, ROBERT
97;ALL DES PALMISTES, ROBERT
97;RUE PAUL SYMPHOR, ROBERT
97;AV PAUL SYMPHOR -CENTRE BOURG, ROBERT
97;RUE PERE ATI, ROBERT
97;RUE DU PERE LABAT VOIE 1, ROBERT
97;RUE DU PERE LABAT VOIE 2, ROBERT
97;RUE DU PERE LABAT  VOIE 3, ROBERT
97;RUE PERE LABAT, ROBERT
97;CR DE PETITE RIVIERE, ROBERT
97;RUE DES PIPIRIS, ROBERT
97;IMP DES PIPIRIS, ROBERT
97;VC DE POINTE LA ROSE, ROBERT
97;AV DES POIRIERS, ROBERT
97;RTE DU PORT, ROBERT
97;RUE DU PONT DORE, ROBERT
97;RUE DU RAISINIER, ROBERT
97;CHE LA RAYA, ROBERT
97;CR DE RIVIERE POMME, ROBERT
97;ALL DES ROSEAUX, ROBERT
97;RUE SCHOELCHER, ROBERT
97;RUE SCHOELCHER VOIE NO 1, ROBERT
97;RUE SCHOELCHER VOIE NO 2, ROBERT
97;RUE SCHOELCHER VOIE NO 3, ROBERT
97;RUE SCHOELCHER VOIE NO 4, ROBERT
97;RUE SCHOELCHER VOIE NO 5, ROBERT
97;RUE SCHOELCHER VOIE NO 6, ROBERT
97;RUE SCHOELCHER VOIE NO 7, ROBERT
97;RUE SCHOELCHER VOIE NO 8, ROBERT
97;RUE SCHOELCHER VOIE NO 9, ROBERT
97;RUE DES SUCRIERS, ROBERT
97;IMP DES TOURTERELLES, ROBERT
97;CR DE VERT PRE I, ROBERT
97;RUE VINCENT ALLEGRE, ROBERT
97;CR DE VOLTAIRE, ROBERT
97;RUE CITE DES BRAVES, ROBERT
97;LOT LES AMANDIERS, SAINT ESPRIT
97;RES AVENIR, SAINT ESPRIT
97;LOT BOCALY, SAINT ESPRIT
97;RES DLO - ZAC AVENIR, SAINT ESPRIT
97;CITE LA CARREAU, SAINT ESPRIT
97;LOT LA CARREAU, SAINT ESPRIT
97;RES CASSIEN SAINTE CLAIRE, SAINT ESPRIT
97;RES CHAUDIERE, SAINT ESPRIT
97;RES LES COULISSES GRAND-BASSIN, SAINT ESPRIT
97;CITE LES COCOTIERS, SAINT ESPRIT
97;CASR DE GENDARMERIE, SAINT ESPRIT
97;CITE LES GOMMIERS, SAINT ESPRIT
97;RES GUEYDON, SAINT ESPRIT
97;RES GUEYDON KANNIK, SAINT ESPRIT
97;LOT LES OISEAUX - ZAC AVENIR, SAINT ESPRIT
97;RES TI JACQUES, SAINT ESPRIT
97;IMP DE L ABRICOTIER, SAINT ESPRIT
97;RUE DE L ABRICOTIER, SAINT ESPRIT
97;RUE DES ACCACIAS, SAINT ESPRIT
97;CHE ALBERT QUIFOUMA, SAINT ESPRIT
97;IMP DE L AMANDIER, SAINT ESPRIT
97;RUE DE L AMANDIER, SAINT ESPRIT
97;RUE DE L ANACARDIER, SAINT ESPRIT
97;AV ANATOLE FRANCE, SAINT ESPRIT
97;RUE ANDRE ALIKER, SAINT ESPRIT
97;RUE DES ANTHURIUMS, SAINT ESPRIT
97;IMP DU BANANIER, SAINT ESPRIT
97;RUE DU BANANIER, SAINT ESPRIT
97;CR DE BOIS BLANC, SAINT ESPRIT
97;CHEM BOIS MICHEL, SAINT ESPRIT
97;CR DE BONTEMPS LACOUR, SAINT ESPRIT
97;CHEM DU CAIMITIER, SAINT ESPRIT
97;RUE CAPITAINE PIERRE ROSE, SAINT ESPRIT
97;RUE CASSIEN SAINTE CLAIRE, SAINT ESPRIT
97;RUE CENTRE POST SCOLAIRE, SAINT ESPRIT
97;CHEM DU CERISIER, SAINT ESPRIT
97;IMP DU CERISIER, SAINT ESPRIT
97;RUE DU COLIBRI, SAINT ESPRIT
97;RUE COLONEL DELGRES, SAINT ESPRIT
97;RUE DE LA CRECHE, SAINT ESPRIT
97;IMP DE LA CRECHE, SAINT ESPRIT
97;RUE DES COQUELICOTS, SAINT ESPRIT
97;CHE DAMIEN BENOIT, SAINT ESPRIT
97;CD N0 5 DE DUCOS A VAUCLIN, SAINT ESPRIT
97;CD 6 DE R SALEE A FRANCOIS, SAINT ESPRIT
97;CHEM PETIT PARADIS, SAINT ESPRIT
97;CD 17 DE STE LUCE A ST ESPRIT, SAINT ESPRIT
97;CD 35A PAR FONDS MASSON, SAINT ESPRIT
97;CHE DESIRE FINOLY, SAINT ESPRIT
97;CHE DOLORES BEUZE, SAINT ESPRIT
97;CHEM DURIVAGE, SAINT ESPRIT
97;RUE DE L EBENISTERIE, SAINT ESPRIT
97;RUE DE L ECOLE DE GARCONS, SAINT ESPRIT
97;RUE DE L EGLISE, SAINT ESPRIT
97;RUE EUPHRATE CELMA, SAINT ESPRIT
97;RLE DU MARECHAL FERRANT, SAINT ESPRIT
97;CR DE FIRMIN, SAINT ESPRIT
97;CR DE FONDS COULISSES, SAINT ESPRIT
97;CHEM DES 3 GARES, SAINT ESPRIT
97;CHE GOLBERT ARNOLIN, SAINT ESPRIT
97;CHEM DU GOYAVIER, SAINT ESPRIT
97;VC DE GRAND BASSIN, SAINT ESPRIT
97;RUE GUEYDON, SAINT ESPRIT
97;RUE GUINGUETTE, SAINT ESPRIT
97;RUE DES HIBISCUS, SAINT ESPRIT
97;RUE DES JASTRAMS, SAINT ESPRIT
97;AV JEAN JAURES, SAINT ESPRIT
97;CHEM DES ICAQUIERS, SAINT ESPRIT
97;IMP DES ICAQUIERS, SAINT ESPRIT
97;RUE JOLIOT CURIE, SAINT ESPRIT
97;RUE JULES FERRY, SAINT ESPRIT
97;CR DE LA NAU, SAINT ESPRIT
97;CR DE LA SUIN, SAINT ESPRIT
97;IMP DU MANDARINIER, SAINT ESPRIT
97;CHEM DU MANGUIER, SAINT ESPRIT
97;RUE MARC LARCHER, SAINT ESPRIT
97;AV MAURICE THOREZ, SAINT ESPRIT
97;CHEM MONTENOR, SAINT ESPRIT
97;CR DE MORNE BABET, SAINT ESPRIT
97;CR DE MORNE DEGRAS, SAINT ESPRIT
97;CR DE MORNE MAGDELONNETTE, SAINT ESPRIT
97;CR DE MORNE RAIDI, SAINT ESPRIT
97;PAS DU MORNE ROUGE, SAINT ESPRIT
97;RUE DU MORNE ROUGE, SAINT ESPRIT
97;VC DE MORNE LAVALEUR, SAINT ESPRIT
97;CR DE MORNE VENT, SAINT ESPRIT
97;IMP DU MUGUET, SAINT ESPRIT
97;RUE DU MUGUET, SAINT ESPRIT
97;RTE NEUVE, SAINT ESPRIT
97;IMP DE L ORANGER, SAINT ESPRIT
97;CHEM DE L ORANGER, SAINT ESPRIT
97;IMP DU PETIT PARADIS, SAINT ESPRIT
97;AV PASTEUR, SAINT ESPRIT
97;AV PAUL ELUARD, SAINT ESPRIT
97;AV PAUL LANGEVIN, SAINT ESPRIT
97;RUE PERRIOLAT, SAINT ESPRIT
97;CR DE PETIT PARADIS, SAINT ESPRIT
97;RLE DES POINSETTIAS, SAINT ESPRIT
97;RUE DES POINSETTIAS, SAINT ESPRIT
97;RUE DE LA PROVIDENCE, SAINT ESPRIT
97;AV ROBESPIERRE, SAINT ESPRIT
97;AV SALVADOR ALLENDE, SAINT ESPRIT
97;CHEM DU SAPOTILLIER, SAINT ESPRIT
97;RUE SCHOELCHER, SAINT ESPRIT
97;IMP DES 2 SOURCES, SAINT ESPRIT
97;RUE DES 2 SOURCES, SAINT ESPRIT
97;RUE STALINGRAD, SAINT ESPRIT
97;RUE DU SUCRE D ORGE, SAINT ESPRIT
97;CHEM DU TAMARINIER, SAINT ESPRIT
97;IMP DU TAMARINIER, SAINT ESPRIT
97;PAS TERRES GUEYDON, SAINT ESPRIT
97;RUE TOURTERELLE, SAINT ESPRIT
97;RUE TOUSSAINT LOUVERTURE, SAINT ESPRIT
97;IMP DU VETIVER, SAINT ESPRIT
97;AV VICTOR HUGO, SAINT ESPRIT
97;CR DE VIEILLE CITERNE, SAINT ESPRIT
97;AV VOLTAIRE, SAINT ESPRIT
97;RES RESIDENCE FLECH'KANN, SAINT JOSEPH
97;RES LES FOUGERES, SAINT JOSEPH
97;RES CLOS DE CHOISY, SAINT JOSEPH
97;CASR DE GENDARMERIE, SAINT JOSEPH
97;CITE GOUREAU, SAINT JOSEPH
97;CITE LUCO, SAINT JOSEPH
97;RES LES ALAMANDAS I, SAINT JOSEPH
97;RES LES ALAMANDAS II, SAINT JOSEPH
97;LOT ANTILLA, SAINT JOSEPH
97;LOT BALLEU, SAINT JOSEPH
97;LOT CAYOL, SAINT JOSEPH
97;LOT CHOISY, SAINT JOSEPH
97;LOT BAMBOU DU CHAMP, SAINT JOSEPH
97;RES CHOISY - LOT CHOISY, SAINT JOSEPH
97;LOT LES CANNELIERS, SAINT JOSEPH
97;LOT DU VERGER, SAINT JOSEPH
97;LOT GONDEAU, SAINT JOSEPH
97;LOT GONDEAU JAMBETTE, SAINT JOSEPH
97;LOT LE HAMEAU, SAINT JOSEPH
97;LOT GONDEAU MONROSE, SAINT JOSEPH
97;RES PAUL FORT, SAINT JOSEPH
97;LOT PETIT BERRY, SAINT JOSEPH
97;LOT RIVIERE BLANCHE, SAINT JOSEPH
97;LOT SALUBRE, SAINT JOSEPH
97;LOT ANTHONY SAUVEUR, SAINT JOSEPH
97;RES SEPHORA, SAINT JOSEPH
97;LOT DU STADE, SAINT JOSEPH
97;LOT VALLEE HEUREUSE, SAINT JOSEPH
97;LOT LES ZICAQUES, SAINT JOSEPH
97;CHE ADJUTOR, SAINT JOSEPH
97;VC DITE DE L ALLEE, SAINT JOSEPH
97;VC DITE DE BAHUAUT, SAINT JOSEPH
97;CHE BALATA, SAINT JOSEPH
97;CRS DIT DE BELLE ETOILE, SAINT JOSEPH
97;CR DE BIDAUH, SAINT JOSEPH
97;VC NO 3 DE BOIS NEUF, SAINT JOSEPH
97;CHE DIT DU BOIS DU PARC, SAINT JOSEPH
97;IMP DES BOUGAINVILLIERS, SAINT JOSEPH
97;CHE CHARLES-ANGELE, SAINT JOSEPH
97;VC DITE DE CHOCO, SAINT JOSEPH
97;RUE DU CIMETIERE, SAINT JOSEPH
97;CHE DIT DE COULEE BOIS, SAINT JOSEPH
97;CHE DERAINVILLE 1, SAINT JOSEPH
97;CHE DERRIERE BOIS, SAINT JOSEPH
97;CHE DESGATTE, SAINT JOSEPH
97;RLE DE L EGLISE, SAINT JOSEPH
97;CHE DIT DE L ERMITAGE, SAINT JOSEPH
97;RUE ERNEST DESPROGES, SAINT JOSEPH
97;CHE LA HAUT, SAINT JOSEPH
97;CHE L ETANG, SAINT JOSEPH
97;RUE EUGENE MAILLARD, SAINT JOSEPH
97;RTE ROUTE DES GUES, SAINT JOSEPH
97;CHE FANTAISIE 1, SAINT JOSEPH
97;CHE FOND CACAO, SAINT JOSEPH
97;CHE DESTREILLES, SAINT JOSEPH
97;CHE FOND EPINGLES, SAINT JOSEPH
97;RUE GEORGES CLEMENCEAU, SAINT JOSEPH
97;RUE HENRI MAURICE, SAINT JOSEPH
97;ALL DES IBISCUS, SAINT JOSEPH
97;ALL IXORAS, SAINT JOSEPH
97;RUE JEAN JAURES, SAINT JOSEPH
97;RUE LAMARTINIERE, SAINT JOSEPH
97;CR DE LAMENTIN DERRIERE BOIS, SAINT JOSEPH
97;VC DE LONG BOIS, SAINT JOSEPH
97;RUE MARIUS HURARD, SAINT JOSEPH
97;CHE MORNE BAPTISTE, SAINT JOSEPH
97;CHE DE MORNE BASSET, SAINT JOSEPH
97;CHE MORNE BOSSU, SAINT JOSEPH
97;CHE DIT DE MORNE MARC, SAINT JOSEPH
97;CHE MORNE MOUBIN, SAINT JOSEPH
97;CHE MORNE DES OLIVES, SAINT JOSEPH
97;CHE MORNE POIRIER, SAINT JOSEPH
97;CHE EN NERIUS, SAINT JOSEPH
97;RUE ORBASSAN THALY, SAINT JOSEPH
97;ALL DES ORCHIDEES, SAINT JOSEPH
97;RUE OSMAN DUQUESNAY, SAINT JOSEPH
97;ALL DES PALMIERS, SAINT JOSEPH
97;PL PUBLIQUE, SAINT JOSEPH
97;CHE DE PROSPERITE, SAINT JOSEPH
97;VC DE RABUCHON, SAINT JOSEPH
97;RTE DE REDOUTE REGALE, SAINT JOSEPH
97;RUE DE LA REPUBLIQUE, SAINT JOSEPH
97;RUE PAUL FRANC, SAINT JOSEPH
97;CHE RIVIERE MONSIEUR, SAINT JOSEPH
97;RUE BLONDET, SAINT JOSEPH
97;VC DE SALUBRE, SAINT JOSEPH
97;RTE DE SAINT JOSEPH, SAINT JOSEPH
97;RUE SCHOELCHER, SAINT JOSEPH
97;CHE SEAILLES, SAINT JOSEPH
97;CHE ENDORVAL, SAINT JOSEPH
97;RUE SEPHORA LOUIS FELIX, SAINT JOSEPH
97;CHE SERAIL, SAINT JOSEPH
97;CHE THEMISTA, SAINT JOSEPH
97;CHE ROUAM SIM, SAINT JOSEPH
97;RUE VICTOR HUGO, SAINT JOSEPH
97;RUE VINCENT ALLEGRE, SAINT JOSEPH
97;RES CALDEIRA SAINT-JAMES, SAINT PIERRE
97;CASR DE GENDARMERIE, SAINT PIERRE
97;CITE CLAVIUS MARIUS, SAINT PIERRE
97;LOT KAT'SAND PERINELLE, SAINT PIERRE
97;RES FONDS CORRE, SAINT PIERRE
97;LOT LE FROMAGER, SAINT PIERRE
97;LOT PERINELLE, SAINT PIERRE
97;LOT LA MONTAGNE, SAINT PIERRE
97;LOT SAINT JAMES, SAINT PIERRE
97;CITE VIEUX LYCEE, SAINT PIERRE
97;RUE ABBE GOSSE, SAINT PIERRE
97;RUE DE L ABBE GREGOIRE, SAINT PIERRE
97;RUE DES ACCORDS, SAINT PIERRE
97;RUE ALFRED LACROIX, SAINT PIERRE
97;RUE DE L ALLEE PECOUL, SAINT PIERRE
97;RUE DES AMITIES, SAINT PIERRE
97;RUE D ANJOU, SAINT PIERRE
97;RUE DE LA BANQUE, SAINT PIERRE
97;PL BERTIN, SAINT PIERRE
97;RUE BOIS MORIN, SAINT PIERRE
97;RUE DE LA BONNE FOI, SAINT PIERRE
97;RUE DES BONS ENFANTS, SAINT PIERRE
97;RUE DES BOUCHERS, SAINT PIERRE
97;RUE BOUILLE, SAINT PIERRE
97;CALL DES MARCHES, SAINT PIERRE
97;RUE DU CAPRICE, SAINT PIERRE
97;RUE CASTELNAU, SAINT PIERRE
97;RUE CAYLUS, SAINT PIERRE
97;RUE DES CHAMPS, SAINT PIERRE
97;RUE DU DOCTEUR DES CHIENS, SAINT PIERRE
97;RUE DU CIMETIERE, SAINT PIERRE
97;RUE CLAVIUS MARIUS, SAINT PIERRE
97;RUE COMAIRAS, SAINT PIERRE
97;RUE DAMAS, SAINT PIERRE
97;RUE DAUPHINE, SAINT PIERRE
97;RUE DES DOMAINES, SAINT PIERRE
97;RUE DUPUY, SAINT PIERRE
97;RUE DE L ECOLE, SAINT PIERRE
97;RUE DE L EGLISE, SAINT PIERRE
97;RUE DE L'EQUERRE, SAINT PIERRE
97;RUE D ENFER, SAINT PIERRE
97;PL D ESNAMBUC, SAINT PIERRE
97;PL F A PERRET, SAINT PIERRE
97;PL FELIX BOISSON, SAINT PIERRE
97;RUE DU FORT, SAINT PIERRE
97;RUE GABRIEL PERI, SAINT PIERRE
97;RUE DU GENERAL DE GAULLE, SAINT PIERRE
97;RUE DU GOUVERNEUR PONTON, SAINT PIERRE
97;RUE HURTAULT, SAINT PIERRE
97;RUE DE L IMPERATRICE, SAINT PIERRE
97;RLE DE L INTENDANCE, SAINT PIERRE
97;RUE ISAMBERT, SAINT PIERRE
97;RUE JUSTINE, SAINT PIERRE
97;RLE LABADIE, SAINT PIERRE
97;BD LAIGRET, SAINT PIERRE
97;RUE LAMARTINIERE, SAINT PIERRE
97;RUE LANDAIS, SAINT PIERRE
97;RUE LEVASSOR, SAINT PIERRE
97;RUE LONGCHAMP, SAINT PIERRE
97;RUE MACARY, SAINT PIERRE
97;RUE DE LA MADELEINE, SAINT PIERRE
97;PL DU MARCHE DU FORT, SAINT PIERRE
97;RUE MARIE, SAINT PIERRE
97;RUE MONT AU CIEL, SAINT PIERRE
97;RUE MONT NOEL, SAINT PIERRE
97;RUE DE MONTMIRAIL, SAINT PIERRE
97;VC DE MORNE DES CADETS, SAINT PIERRE
97;RUE DU MORNE D ORANGE, SAINT PIERRE
97;RUE D ORANGE, SAINT PIERRE
97;RUE D ORLEANS, SAINT PIERRE
97;RUE PERCE, SAINT PIERRE
97;RUE PERRINON, SAINT PIERRE
97;RUE PESSET, SAINT PIERRE
97;RUE DU PETIT VERSAILLES, SAINT PIERRE
97;RUE DU PONT MILITAIRE, SAINT PIERRE
97;RUE DU PRECIPICE, SAINT PIERRE
97;RUE PRES DU CIMETIERE, SAINT PIERRE
97;RUE DE LA PRINCESSE, SAINT PIERRE
97;RUE DE LA PRISON, SAINT PIERRE
97;QUAI PEYNIER, SAINT PIERRE
97;RUE DE LA RAFFINERIE, SAINT PIERRE
97;RUE DES RAQUETTES, SAINT PIERRE
97;RUE DE LA REINE, SAINT PIERRE
97;RUE ROYALE, SAINT PIERRE
97;RUE SAINT JEAN DE DIEU, SAINT PIERRE
97;BD SAINT LEGER LALUNG, SAINT PIERRE
97;RUE SAINT LOUIS, SAINT PIERRE
97;RUE SAINTE MARGUERITE, SAINT PIERRE
97;RUE SAINTE ROSE, SAINT PIERRE
97;RUE SAVANE DU FORT (RN2), SAINT PIERRE
97;RUE SCHOELCHER, SAINT PIERRE
97;RLE DU SEMINAIRE, SAINT PIERRE
97;IMP SORBET, SAINT PIERRE
97;RUE DE LA SOURCE, SAINT PIERRE
97;RUE T M BAUDE, SAINT PIERRE
97;RUE DU THEATRE, SAINT PIERRE
97;RUE THOMASINE, SAINT PIERRE
97;RUE DES URSULINES, SAINT PIERRE
97;RUE VICTOR HUGO, SAINT PIERRE
97;RUE DE LA VIEILLE HALLE, SAINT PIERRE
97;CITE BARETO, SAINTE ANNE
97;LOT LE DOMAINE DE BELFOND, SAINTE ANNE
97;CITE FLAMBOYANTS, SAINTE ANNE
97;LOT LES FLAMBOYANTS, SAINTE ANNE
97;RES ANSE TONNOIR, SAINTE ANNE
97;LOT LES HAUTS DE BEAUREGARD, SAINTE ANNE
97;RES L'HERBIER, SAINTE ANNE
97;LOT CHAMPFLEURY, SAINTE ANNE
97;RES CARAIBE, SAINTE ANNE
97;RES LES JARDINS DE STE ANNE, SAINTE ANNE
97;LOT MARILOU, SAINTE ANNE
97;CITE POINTE MARIN, SAINTE ANNE
97;LOT LES OISEAUX, SAINTE ANNE
97;LOT PETIT VERSAILLES, SAINTE ANNE
97;LOT THEOLINE, SAINTE ANNE
97;RES LA MARBRIERE, SAINTE ANNE
97;RES MELODIE, SAINTE ANNE
97;RES LES OLIVIERS, SAINTE ANNE
97;LOT VIAUVY, SAINTE ANNE
97;LOT ZAIRE, SAINTE ANNE
97;RUE DU BORD DE MER, SAINTE ANNE
97;CR DIT DE BOIS NEUF, SAINTE ANNE
97;RUE ABBE HURARD, SAINTE ANNE
97;RUE ANASTHASE POLUX, SAINTE ANNE
97;RUE DU CALVAIRE, SAINTE ANNE
97;RUE CARITAN, SAINTE ANNE
97;VC DE CAP CABARET, SAINTE ANNE
97;VC DU CAP CHEVALIER, SAINTE ANNE
97;VC DE CREVE COEUR, SAINTE ANNE
97;RUE DE LA CROIX, SAINTE ANNE
97;IMP DA MARGUERITE, SAINTE ANNE
97;CR DE DERRIERE MORNE, SAINTE ANNE
97;RUE DE L ESCLAVE HEROIQUE, SAINTE ANNE
97;RUE ABBE SAFFACHE, SAINTE ANNE
97;RUE PAILLE, SAINTE ANNE
97;RUE ANASTASE POLLUX, SAINTE ANNE
97;AV NELSON MANDELA, SAINTE ANNE
97;RUE MUSSIDAN, SAINTE ANNE
97;RUE MANO GERME, SAINTE ANNE
97;PL DU 22 MAI, SAINTE ANNE
97;PL DE L ABBE MORLAND, SAINTE ANNE
97;AV FRANTZ FANON, SAINTE ANNE
97;RUE LUDOVIC VERSE, SAINTE ANNE
97;RUE JEAN MARIE TJIBAOU, SAINTE ANNE
97;RUE DU CAPITAINE CONSTANT, SAINTE ANNE
97;RUE CAPITAINE ROMAIN, SAINTE ANNE
97;RTE DES CARAIBES, SAINTE ANNE
97;VOIE NO 1, SAINTE ANNE
97;VOIE NO 2, SAINTE ANNE
97;VOIE NO 3, SAINTE ANNE
97;VOIE NO 4, SAINTE ANNE
97;VOIE DE LA POTIERE, SAINTE ANNE
97;RUE GONTRAND THOMAS, SAINTE ANNE
97;RUE DE GOREE, SAINTE ANNE
97;RUE ROSALIE SOLEIL, SAINTE ANNE
97;RUE DU 21 SEPTEMBRE, SAINTE ANNE
97;RUE STEPHANIE GERTRUDE, SAINTE ANNE
97;ESP VINCENT PLACOLY, SAINTE ANNE
97;ZAC DE PONT CAFE, SAINTE LUCE
97;CITE BON AIR, SAINTE LUCE
97;RES LADOUR, SAINTE LUCE
97;RES LES COTEAUX, SAINTE LUCE
97;RES EOLIA, SAINTE LUCE
97;RES DES FRANGIPANIERS, SAINTE LUCE
97;LOT FILAO, SAINTE LUCE
97;RES LES JARDINS DE MABOUYAS, SAINTE LUCE
97;RES LES HAMEAUX DE DEVILLE, SAINTE LUCE
97;RES LE HAMEAU DE SAINTE-LUCE, SAINTE LUCE
97;RES LE BOUNTY, SAINTE LUCE
97;LOT IXORA, SAINTE LUCE
97;LOT LES FRANGIPANIERS, SAINTE LUCE
97;LOT MAPOU, SAINTE LUCE
97;RES MAEVA BEACH, SAINTE LUCE
97;LOT LES MOUBINS, SAINTE LUCE
97;LOT ANSE GROS RAISIN, SAINTE LUCE
97;RES LES OLYMPIADES, SAINTE LUCE
97;LOT LES PALMIERS NO 2, SAINTE LUCE
97;LOT PANORAMIQUE VOIE 1, SAINTE LUCE
97;RES LES PAVONIAS, SAINTE LUCE
97;RES LES OISEAUX DES ILES, SAINTE LUCE
97;RES PAVILLON, SAINTE LUCE
97;ZA DEVILLE, SAINTE LUCE
97;CITE DU PERE NOVION, SAINTE LUCE
97;RES PIES KANN, SAINTE LUCE
97;RES SANTA LUCIA, SAINTE LUCE
97;LOT SAPOTILLE - BELLEVUE, SAINTE LUCE
97;LOT TROIS RIVIERES, SAINTE LUCE
97;ZAC DES COTEAUX, SAINTE LUCE
97;RES LES COTTAGES, SAINTE LUCE
97;RES EVERGREEN, SAINTE LUCE
97;RES ROCAILLES 1 22 LES COTEAUX, SAINTE LUCE
97;RES ROCAILLES 2 18 LES COTEAUX, SAINTE LUCE
97;RES LES COTEAUX PLANTATION, SAINTE LUCE
97;RUE CAPITAINE PIERRE ROSE, SAINTE LUCE
97;CR DE BELLAY, SAINTE LUCE
97;VC DITE DES BAMBOUS, SAINTE LUCE
97;RTE DE BELLEVUE, SAINTE LUCE
97;RUE CHARLEMAGNE, SAINTE LUCE
97;CHEM BOIS GRILLE, SAINTE LUCE
97;RTE DE CORP DE GARDE, SAINTE LUCE
97;RUE DU COMMANDANT TOURTET, SAINTE LUCE
97;RUE DES FRANGIPANIERS, SAINTE LUCE
97;RUE JEAN JACQUES ROUSSEAU, SAINTE LUCE
97;CHEM DE LA CANNE, SAINTE LUCE
97;RUE JEAN JAURES, SAINTE LUCE
97;AV DES HIBISCUS, SAINTE LUCE
97;RUE JOLIOT CURIE, SAINTE LUCE
97;RUE JOSEPH LAGROSILIERE, SAINTE LUCE
97;RUE JULES FERRY, SAINTE LUCE
97;BD KENNEDY, SAINTE LUCE
97;RUE LAMARTINE, SAINTE LUCE
97;RTE MAPOU, SAINTE LUCE
97;RUE MONSEIGNEUR DUWEZ, SAINTE LUCE
97;VOIE NO 1 LOT TROIS RIVIERES, SAINTE LUCE
97;RUE PAUL LANGEVIN, SAINTE LUCE
97;VOIE NO 6 LOT LES PALMIERS, SAINTE LUCE
97;VOIE NO 7 LOT LES PALMIERS, SAINTE LUCE
97;RUE SCHOELCHER, SAINTE LUCE
97;ALL DU STADE, SAINTE LUCE
97;VOIE NO 2 LOT TROIS RIVIERES, SAINTE LUCE
97;CR DE TROU AU DIABLE, SAINTE LUCE
97;RUE VICTOR HUGO, SAINTE LUCE
97;RUE ANATOLE FRANCE, SAINTE LUCE
97;VOIE ARTISANALE, SAINTE LUCE
97;VOIE NO 5 LOT LES CERISIERS, SAINTE LUCE
97;PL DE LA MAIRIE, SAINTE LUCE
97;ALL DES CAMPECHES, SAINTE LUCE
97;VOIE NO 3 LOT LES COCOTIERS, SAINTE LUCE
97;PL DES COCOTIERS, SAINTE LUCE
97;RTE DE DELIVRY, SAINTE LUCE
97;CHEM DES EAUX DECOUPEES, SAINTE LUCE
97;CHEM DES POIRIERS, SAINTE LUCE
97;RUE DU PERE NOVION, SAINTE LUCE
97;RUE DES PECHEURS, SAINTE LUCE
97;IMP POPO, SAINTE LUCE
97;RUE DU PRESBYTERE, SAINTE LUCE
97;RTE DE LA PLAGE, SAINTE LUCE
97;RUE EMILE ZOLA, SAINTE LUCE
97;VOIE NO 4 LOT LES FLAMBOYANTS, SAINTE LUCE
97;RUE LOUIS BLANC, SAINTE LUCE
97;ALL DU PRECIPICE, SAINTE LUCE
97;ALL TI MARE, SAINTE LUCE
97;RUE VOLTAIRE, SAINTE LUCE
97;RUE DE GROS RAISIN, SAINTE LUCE
97;RUE DES PALETUVIERS, SAINTE LUCE
97;ALL DES PALMIERS, SAINTE LUCE
97;RUE DE LA PLAGE, SAINTE LUCE
97;CTRE COMMERCIAL LASALLE, SAINTE MARIE
97;CITE ETOILE NO 1, SAINTE MARIE
97;CITE ETOILE NO 2, SAINTE MARIE
97;RES HIBISCUS, SAINTE MARIE
97;CASR DE GENDARMERIE, SAINTE MARIE
97;RES TI CASE, SAINTE MARIE
97;CITE UNION, SAINTE MARIE
97;RES RESIDENCE VATON, SAINTE MARIE
97;CITE VILLENEUVE, SAINTE MARIE
97;HAM DE VILLENEUVE, SAINTE MARIE
97;LOT VILLENEUVE, SAINTE MARIE
97;LOT POIDEVAIN, SAINTE MARIE
97;LOT MORNE DANIEL, SAINTE MARIE
97;LOT LA ROSE DES VENTS, SAINTE MARIE
97;LOT LES HAUTS DE VILLENEUVE, SAINTE MARIE
97;ZONE ARTISANALE BELLE ETOILE, SAINTE MARIE
97;RUE DE L ABATTOIR, SAINTE MARIE
97;IMP DU BON ACCUEIL, SAINTE MARIE
97;ALL DES ABRICOTS, SAINTE MARIE
97;PASS ABRICOT, SAINTE MARIE
97;ALL DE L'ALLIANCE, SAINTE MARIE
97;RUE DE L'ALIZE, SAINTE MARIE
97;CR DE L'ALLIANCE, SAINTE MARIE
97;ALL DES ALLIES, SAINTE MARIE
97;IMP DES AMAREUSES, SAINTE MARIE
97;ALL DE L'AMITIE, SAINTE MARIE
97;RUE AMEDEE KNIGHT, SAINTE MARIE
97;RUE DES BONS AMIS, SAINTE MARIE
97;ALL DES AMOURS, SAINTE MARIE
97;PASS DES ANCIENS, SAINTE MARIE
97;IMP DE L'AFFABILITE, SAINTE MARIE
97;RUE DES ARAWAKS, SAINTE MARIE
97;PASS DES AUBERGINES, SAINTE MARIE
97;ALL DES AUBERGINES, SAINTE MARIE
97;RUE DE SAINT AROMAN, SAINTE MARIE
97;RUE DES ATELIERS, SAINTE MARIE
97;IMP DU BAC, SAINTE MARIE
97;IMP DU BAMBOU, SAINTE MARIE
97;RUE DU BELE, SAINTE MARIE
97;CR DE BELLE ETOILE, SAINTE MARIE
97;RUE DE BEAUFORT, SAINTE MARIE
97;VC DE BEZAUDIN, SAINTE MARIE
97;ALL DE LA BIENFAISANCE, SAINTE MARIE
