97;IMP CADARE, LE LAMENTIN
97;CHE CADENAT, LE LAMENTIN
97;IMP CAFEIERE, LE LAMENTIN
97;IMP CAIMITE, LE LAMENTIN
97;IMP CAMELIA, LE LAMENTIN
97;IMP CANNE BLEUE, LE LAMENTIN
97;IMP CANNE VERTE, LE LAMENTIN
97;CHE CANNELLE, LE LAMENTIN
97;IMP CAPUCINE, LE LAMENTIN
97;CHE CAROUGE, LE LAMENTIN
97;CHE CARRERE, LE LAMENTIN
97;ESC CARRIERE, LE LAMENTIN
97;IMP CASSE, LE LAMENTIN
97;IMP CATOL, LE LAMENTIN
97;IMP JOBY CAUMARTIN, LE LAMENTIN
97;CHE CHAPELLE, LE LAMENTIN
97;IMP CHARLOTTE, LE LAMENTIN
97;IMP CHAUDEAU, LE LAMENTIN
97;IMP CIDOLIT, LE LAMENTIN
97;CHE CLEMENCIN VOIE 1, LE LAMENTIN
97;IMP CLEMENCIN VOIE 2, LE LAMENTIN
97;IMP CLOSE, LE LAMENTIN
97;IMP CLOTAIL, LE LAMENTIN
97;IMP CLOVIS, LE LAMENTIN
97;IMP COCOTIER, LE LAMENTIN
97;IMP COLIBRI, LE LAMENTIN
97;IMP COLOMBE, LE LAMENTIN
97;IMP COQUELICOTS, LE LAMENTIN
97;IMP CORAIN, LE LAMENTIN
97;IMP CORSANE, LE LAMENTIN
97;IMP COUPE VENT, LE LAMENTIN
97;IMP CREOLE, LE LAMENTIN
97;IMP CRETINOIR, LE LAMENTIN
97;IMP DEBRAILLES, LE LAMENTIN
97;IMP DEBROSIL, LE LAMENTIN
97;IMP DINGEVAL, LE LAMENTIN
97;CHE DIQUAN, LE LAMENTIN
97;CHE DJOBO, LE LAMENTIN
97;IMP DOLMEN, LE LAMENTIN
97;IMP DOUCELETTE, LE LAMENTIN
97;IMP DUNON, LE LAMENTIN
97;CHE DUROCHER, LE LAMENTIN
97;IMP DUROCHER VOIE 1, LE LAMENTIN
97;IMP ELISA, LE LAMENTIN
97;CHE FRAYCINETTE, LE LAMENTIN
97;IMP FREGATE, LE LAMENTIN
97;CHE FRUIT A PAIN, LE LAMENTIN
97;IMP GAIGNERON, LE LAMENTIN
97;CHE GINA, LE LAMENTIN
97;IMP GIROFLEE, LE LAMENTIN
97;IMP GOVINDORAZOO, LE LAMENTIN
97;CHE GRAND, LE LAMENTIN
97;CHE GRAND CASE, LE LAMENTIN
97;CHE GRAND CHAMP, LE LAMENTIN
97;IMP GRAND ECAILLE, LE LAMENTIN
97;IMP GROSEILLE, LE LAMENTIN
97;IMP HARDEL, LE LAMENTIN
97;CHE HENRI BOURGEOIS, LE LAMENTIN
97;IMP HODEBAR, LE LAMENTIN
97;CHE HORTENSIA, LE LAMENTIN
97;IMP IRIS, LE LAMENTIN
97;CHE JEAN BAPTISTE, LE LAMENTIN
97;IMP JEANVILLE, LE LAMENTIN
97;IMP JUJUBIER, LE LAMENTIN
97;IMP KANJI, LE LAMENTIN
97;IMP KIBIR, LE LAMENTIN
97;RUE LA FLAMME, LE LAMENTIN
97;IMP L'ABACA, LE LAMENTIN
97;IMP LABEJOF, LE LAMENTIN
97;IMP LAGRAND, LE LAMENTIN
97;IMP LAIC, LE LAMENTIN
97;IMP LAREINTY, LE LAMENTIN
97;IMP LAREINTY 1, LE LAMENTIN
97;CHE L'ARGENTE, LE LAMENTIN
97;IMP LATANIA, LE LAMENTIN
97;IMP LEFEL, LE LAMENTIN
97;IMP LEGINER, LE LAMENTIN
97;IMP LELIN, LE LAMENTIN
97;RUE LEONCE BOICOULIN, LE LAMENTIN
97;IMP LEPINI, LE LAMENTIN
97;IMP LILAS, LE LAMENTIN
97;IMP LONG BOIS 1, LE LAMENTIN
97;CHE LONG PRE, LE LAMENTIN
97;IMP LONG PRE VOIE 2, LE LAMENTIN
97;CHE LONG BOIS, LE LAMENTIN
97;IMP LORY, LE LAMENTIN
97;VOIE LOT LA FAVORITE, LE LAMENTIN
97;IMP LOTCHIOS, LE LAMENTIN
97;IMP LOUISABETH, LE LAMENTIN
97;CHE LUILET, LE LAMENTIN
97;IMP MABI, LE LAMENTIN
97;IMP MACARONS, LE LAMENTIN
97;IMP MADOU, LE LAMENTIN
97;CHE MADUVA, LE LAMENTIN
97;IMP MAJESTE, LE LAMENTIN
97;IMP MAKANDJA, LE LAMENTIN
97;IMP MANGOT KAROT, LE LAMENTIN
97;IMP MANGOT VERT, LE LAMENTIN
97;IMP MANGUIERS, LE LAMENTIN
97;IMP MAPOU, LE LAMENTIN
97;IMP MARGOTE, LE LAMENTIN
97;IMP MARIE MAGDELEINE, LE LAMENTIN
97;IMP MELONGENE, LE LAMENTIN
97;IMP LA MICHELLE, LE LAMENTIN
97;CHE MILOCK, LE LAMENTIN
97;IMP MISAINE, LE LAMENTIN
97;IMP MONTEOL, LE LAMENTIN
97;IMP LA MONTHAN, LE LAMENTIN
97;CHE MORENCY, LE LAMENTIN
97;IMP MORNE CABRIT, LE LAMENTIN
97;CHE MORNE BELAIR, LE LAMENTIN
97;IMP LA MOTTE, LE LAMENTIN
97;IMP LA MOTTE VOIE NO 2, LE LAMENTIN
97;CHE MOUSSACHE, LE LAMENTIN
97;IMP MOUSSACHE 1, LE LAMENTIN
97;IMP MOUSSACHE 2, LE LAMENTIN
97;IMP MOUSSACHE 3, LE LAMENTIN
97;IMP MURESE, LE LAMENTIN
97;IMP MYRTILLE, LE LAMENTIN
97;VOIE DUROCHER VOIE 4, LE LAMENTIN
97;IMP ROBINSON, LE LAMENTIN
97;IMP LOT LES BAMBOUS, LE LAMENTIN
97;IMP LOT LES BOUGAINVILLIERS, LE LAMENTIN
97;VOIE LOT LES TERRASSES VOIE 2, LE LAMENTIN
97;CHE MANGOT VULCIN, LE LAMENTIN
97;IMP NELIEN, LE LAMENTIN
97;AV NELSON MANDELA, LE LAMENTIN
97;IMP NOTTE, LE LAMENTIN
97;IMP NOUGAT PISTACHE, LE LAMENTIN
97;CHE OLINY, LE LAMENTIN
97;IMP ORANGERS, LE LAMENTIN
97;CHE OREL, LE LAMENTIN
97;CHE PAIN DOUX, LE LAMENTIN
97;CHE PALME, LE LAMENTIN
97;IMP PALMIER ROYAL, LE LAMENTIN
97;IMP PARQUERETTE, LE LAMENTIN
97;IMP PENELOPE, LE LAMENTIN
97;IMP PERVENCHE, LE LAMENTIN
97;IMP PETIT PRE, LE LAMENTIN
97;IMP PETITOT, LE LAMENTIN
97;CHE PHILIBO, LE LAMENTIN
97;CHE PHOENIX, LE LAMENTIN
97;CHE BASSE GONDEAU, LE LAMENTIN
97;CITE GUIMAUVE, LE LAMENTIN
97;IMP ALTAMIRA, LE LAMENTIN
97;CHE PIERRE CRASPAG, LE LAMENTIN
97;IMP PIPIRI, LE LAMENTIN
97;IMP PITON, LE LAMENTIN
97;IMP PLANCEL, LE LAMENTIN
97;IMP PONPON, LE LAMENTIN
97;IMP POPOTE, LE LAMENTIN
97;IMP POSTDAM, LE LAMENTIN
97;IMP POURPOINT, LE LAMENTIN
97;IMP POYO, LE LAMENTIN
97;CHE PRATA, LE LAMENTIN
97;VOIE PRIVE, LE LAMENTIN
97;CHE PRUNIER, LE LAMENTIN
97;IMP PY, LE LAMENTIN
97;IMP QUINQUINA, LE LAMENTIN
97;IMP REMPHOR, LE LAMENTIN
97;CHE RETARDATO, LE LAMENTIN
97;IMP RILOS, LE LAMENTIN
97;CHE RIVAIL ANNEXE, LE LAMENTIN
97;IMP RIVES CHANCEL, LE LAMENTIN
97;CHE RIVIERE CALECON 3, LE LAMENTIN
97;IMP RIVIERE ROCHES, LE LAMENTIN
97;IMP ROMAIN, LE LAMENTIN
97;IMP ROYALE, LE LAMENTIN
97;RUE SABLIERS, LE LAMENTIN
97;CHE SAINT MAURICE, LE LAMENTIN
97;IMP SAINT - JAMES, LE LAMENTIN
97;IMP SAINT CYR DARIBO, LE LAMENTIN
97;IMP SALVADOR, LE LAMENTIN
97;IMP SAPOTILLE, LE LAMENTIN
97;CHE SARRAULT, LE LAMENTIN
97;IMP SAVANE DEDE 2, LE LAMENTIN
97;IMP SIMAX, LE LAMENTIN
97;IMP SIMAX 1, LE LAMENTIN
97;IMP SIMAX 2, LE LAMENTIN
97;CHE SODO, LE LAMENTIN
97;CHE SOUDON, LE LAMENTIN
97;IMP SOURCE JULIENNE, LE LAMENTIN
97;IMP SURETTE, LE LAMENTIN
97;IMP SURIAU, LE LAMENTIN
97;IMP SYLVESTRE, LE LAMENTIN
97;IMP TAMARIN, LE LAMENTIN
97;IMP TECOMA, LE LAMENTIN
97;IMP TI LAPIA, LE LAMENTIN
97;IMP TIRNAN, LE LAMENTIN
97;IMP TOURTEAU, LE LAMENTIN
97;CHE TOURTERELLE, LE LAMENTIN
97;CHE TREFLE, LE LAMENTIN
97;CHE TULIPE, LE LAMENTIN
97;IMP VAILLANT, LE LAMENTIN
97;ESC VICTOR, LE LAMENTIN
97;IMP DE VERDUN, LE LAMENTIN
97;IMP VICTOR, LE LAMENTIN
97;IMP VALVERDE 1, LE LAMENTIN
97;RUE VICTOR LAMON, LE LAMENTIN
97;IMP VALVERDE 2, LE LAMENTIN
97;IMP VILATA, LE LAMENTIN
97;IMP VINASSE, LE LAMENTIN
97;CHE VIOLETTE, LE LAMENTIN
97;IMP ZEPHIR 1, LE LAMENTIN
97;IMP ZEPHIR 2, LE LAMENTIN
97;IMP ZEPHIR 3, LE LAMENTIN
97;IMP ZEPHIR 4, LE LAMENTIN
97;IMP RIVIERE, LE LAMENTIN
97;IMP BALAI DOUX 2, LE LAMENTIN
97;LOT LE PARADISIER, LORRAIN
97;CTRE HOSPITALIER, LORRAIN
97;LOT PREBOURG, LORRAIN
97;LOT SOUS BOIS, LORRAIN
97;CITE SCOLAIRE J PERNOCK, LORRAIN
97;CITE BORD DE MER, LORRAIN
97;CITE LE VALLON, LORRAIN
97;LOT LE VALLON 1, LORRAIN
97;LOT LE VALLON 2, LORRAIN
97;RES VICTORIA, LORRAIN
97;ALL DU LEP LORRAIN, LORRAIN
97;PL DE L ALIZE, LORRAIN
97;VC DITE D'ASSIER, LORRAIN
97;VC DE BON REPOS, LORRAIN
97;RUE CAPITAINE LAINE, LORRAIN
97;CHE CASSIUS MOREAU, LORRAIN
97;CHE CAFE SEGUINEAU MOREAU, LORRAIN
97;CHE DIT DE CARABIN, LORRAIN
97;CHE DE CARABIN NO 1, LORRAIN
97;CHE DE CARABIN NO 2, LORRAIN
97;RUE CHARLES EDMOND, LORRAIN
97;RUE CHIVAL BWA, LORRAIN
97;RUE G. CHOMEREAU LAMOTTE, LORRAIN
97;RUE CROCHEMORT VOIE N.1, LORRAIN
97;RUE CROCHEMORT VOIE N.2, LORRAIN
97;RUE CHENEAUX VOIE N.2, LORRAIN
97;RUE DES COLIBRIS, LORRAIN
97;RUE DORIVAL VOIE N.1, LORRAIN
97;CR DE CROCHEMORT, LORRAIN
97;CHE DIT DE DELAISSE, LORRAIN
97;RUE FELIX EBOUE VOIE N.1, LORRAIN
97;CHE DIT DE FONDS LORRAIN, LORRAIN
97;RUE FELIX EBOUE, LORRAIN
97;RUE PROLONGEMENT FELIX EBOUE, LORRAIN
97;RUE CAPITAINE LAINE VOIE N.1, LORRAIN
97;VC DE FONDS CANI, LORRAIN
97;VC DU QUARTIER GENS, LORRAIN
97;CHE DE FONDS GRAND ANSE, LORRAIN
97;RUE GAMBETTA, LORRAIN
97;RUE GENERAL DE GAULLE, LORRAIN
97;CR DIT DE GUERIN, LORRAIN
97;RUE DU GOUVERNEUR LOUIS PONTON, LORRAIN
97;RUE DU GOUV.LOUIS PONTON PROL., LORRAIN
97;RUE ISIDORE PIERRE LOUIS, LORRAIN
97;RUE JACOB REMIR, LORRAIN
97;RUE JOSEPH CLERC, LORRAIN
97;RUE JOSEPH LAGROSILLIERE, LORRAIN
97;RUE JULES FERRY, LORRAIN
97;CHE DIT DE LANGE, LORRAIN
97;PL DE LA LIBERTE, LORRAIN
97;CR DE HAUT MACEDOINE, LORRAIN
97;CRS DE MACEDOINE, LORRAIN
97;VC DE MORNE CAPOT PLATEAU, LORRAIN
97;CR DE MORNE CERON, LORRAIN
97;CHE DIT DE MORNE DEGRAS, LORRAIN
97;CHE MORNE ICAQUE, LORRAIN
97;CHE MORNE LANDEAU, LORRAIN
97;CR DIT MORNE BOIS, LORRAIN
97;VC DE MORNE SAVON, LORRAIN
97;CR DIT DE VALLON, LORRAIN
97;CHE PAMPHILE, LORRAIN
97;CHE DE PASSAGE CAVALIER, LORRAIN
97;CR DE POSTE D EAU, LORRAIN
97;VOIE 1 LOT PREBOURG, LORRAIN
97;VOIE 2 LOT PREBOURG, LORRAIN
97;VOIE 3 LOT PREBOURG, LORRAIN
97;PL DE LA REPUBLIQUE, LORRAIN
97;RUE DES SAPOTILLES, LORRAIN
97;RUE DES SAPOTILLES VOIE N.1, LORRAIN
97;RUE DES SAPOTILLES VOIE N.2, LORRAIN
97;RUE DES SAPOTILLES VOIE N.3, LORRAIN
97;RUE DES SAPOTILLES VOIE N.4, LORRAIN
97;RUE DES FLAMBOYANTS, LORRAIN
97;RUE J. PERNOCK, LORRAIN
97;RUE J.PERNOCK, LORRAIN
97;RUE NERO PROLONGE, LORRAIN
97;RUE DES CHENEAUX, LORRAIN
97;RUE CHENEAU VOIE N.1, LORRAIN
97;RUE CHENEAU VOIE N. 2, LORRAIN
97;RUE DES CAIMITES, LORRAIN
97;RUE DU TABAC, LORRAIN
97;RUE DES HIBISCUS, LORRAIN
97;RUE DES ORTOLANS, LORRAIN
97;RUE DES PERDRIX, LORRAIN
97;RUE DES RAMIERS, LORRAIN
97;RUE DES TOURTERELLES, LORRAIN
97;RUE SCHOELCHER, LORRAIN
97;RTE DU STADE, LORRAIN
97;RUE VICTOR HUGO, LORRAIN
97;RUE VICTOR SCHOELCHER, LORRAIN
97;RUE VICTOR REMIR, LORRAIN
97;VOIE 1 LOT LE VALLON, LORRAIN
97;VOIE 2 LOT LE VALLON, LORRAIN
97;VOIE 3 LOT LE VALLON, LORRAIN
97;VOIE 4 LOT LE VALLON, LORRAIN
97;VOIE 5 CITE LE VALLON, LORRAIN
97;VOIE 6 CITE LE VALLON, LORRAIN
97;VOIE 7 CITE LE VALLON, LORRAIN
97;VOIE 8 CITE LE VALLON, LORRAIN
97;RTE DE L HOPITAL, LORRAIN
97;VC DE MORNE SEM, LORRAIN
97;VC DE CASTEL BRANDO, LORRAIN
97;ALL DES AMANDIERS, LORRAIN
97;VC DE PLATEAU ECOLE, LORRAIN
97;IMP GENERAL DE GAULLE, LORRAIN
97;VOIE 9 CITE LE VALLON, LORRAIN
97;VOIE 10 CITE LE VALLON, LORRAIN
97;VOIE 11 CITE LE VALLON, LORRAIN
97;IMP DU MARIN, LORRAIN
97;RUE GOUVERNEUR L. PONTON PROLO, LORRAIN
97;LOT CASE PAUL, MACOUBA
97;RUE DE L ABBE GREGOIRE, MACOUBA
97;RUE ISAMBERT, MACOUBA
97;RUE PERRINON, MACOUBA
97;RUE SCHOELCHER, MACOUBA
97;RUE VICTOR HUGO, MACOUBA
97;VC DE DESILES, MACOUBA
97;CR ROUTE DESILES, MACOUBA
97;CR DE RIVIERE ROCHES, MACOUBA
97;LOT LES FILAOS, MARIGOT
97;LOT GRAND CHEMIN, MARIGOT
97;LOT LA MARIE, MARIGOT
97;LOT POINTEMAR, MARIGOT
97;LOT BELLEVUE, MARIGOT
97;RLE PAVE MONSEIGNEUR, MARIGOT
97;RUE DE LA BAIGNOIRE, MARIGOT
97;RUE BELLEVUE, MARIGOT
97;RUE DE LA CHAPELLE, MARIGOT
97;RUE CHARPENTIER, MARIGOT
97;RUE DEBITE, MARIGOT
97;RUE DEHAUMONT, MARIGOT
97;RUE DOMINANTE, MARIGOT
97;CR DOMINANTE A PAIN DE SUCRE, MARIGOT
97;RUE DUHAMELIN, MARIGOT
97;RUE DUVALLON, MARIGOT
97;RUE DUSSAUT, MARIGOT
97;RUE FONDS DOMINIQUE, MARIGOT
97;RUE DUHAUMONT, MARIGOT
97;RUE FONDS D'OR, MARIGOT
97;RUE LES FILAOS DE BELLEVUE, MARIGOT
97;RUE FLEURY, MARIGOT
97;RUE FONDS PAPIN, MARIGOT
97;RUE CITE FONDS D'OR, MARIGOT
97;RUE GARANNE, MARIGOT
97;RUE GRAND DEGRAS, MARIGOT
97;RUE HAUT DE DOMINANTE, MARIGOT
97;RUE MADELON, MARIGOT
97;RUE LA MARIE, MARIGOT
97;RUE MAZURE, MARIGOT
97;RUE MORNE ELIE, MARIGOT
97;RUE PAPIN, MARIGOT
97;RUE PLATEFORME, MARIGOT
97;RUE LA POINTE, MARIGOT
97;RUE PRINCIPALE, MARIGOT
97;RUE DUROCHER, MARIGOT
97;RUE SENECHAL, MARIGOT
97;RUE BAS DU TEMPLE, MARIGOT
97;RUE TERRES SAINVILLE, MARIGOT
97;PL DE L'EGLISE, MARIGOT
97;RUE DURAND, MARIGOT
97;ZAC ARTIMER, MARIN
97;LOT CAP MACRE, MARIN
97;RES ALLAMANDA, MARIN
97;RES LA AGNES REGINA, MARIN
97;RES LA AGNES NINON, MARIN
97;RES LA AGNES EULALIE, MARIN
97;RES LA AGNES IDA, MARIN
97;RES LA AGNES LUTIMA, MARIN
97;RES LA AGNES EDAMISE, MARIN
97;RES LA AGNES, MARIN
97;LOT ESPADON, MARIN
97;RES ARAWAKS DIAKA, MARIN
97;RES DE LA BAIE, MARIN
97;CITE DIAKA, MARIN
97;RES LES EPICES, MARIN
97;RES GARIFUNA MONGERALD, MARIN
97;RES KALINAGO, MARIN
97;LOT HABITATION BAIE DU MARIN, MARIN
97;CASR DE GENDARMERIE, MARIN
97;RES LA MICHELE, MARIN
97;LOT MONDESIR, MARIN
97;CITE MONGERALD, MARIN
97;LOT MONGERALD, MARIN
97;LOT DES QUATRE CHEMINS, MARIN
97;RES ODYSSEE, MARIN
97;RES RACINES, MARIN
97;RES LES RIVAGES D ULYSSE, MARIN
97;LOT LES EMBRUNS, MARIN
97;RES LES EMBRUNS, MARIN
97;RES DES ILES, MARIN
97;CITE SCOLAIRE, MARIN
97;RES L OCEANE, MARIN
97;RES LES TERRASSES DE LA MARINA, MARIN
97;BD ALLEGRE, MARIN
97;RUE ANATOLE FRANCE, MARIN
97;CR DE BEAUREGARD, MARIN
97;VC NO 1 DE BELLE ETOILE, MARIN
97;VC NO 2 DE BELLE ETOILE, MARIN
97;CR DE LA BERRY, MARIN
97;VC NO 1 DES CAPS, MARIN
97;CR DU CAP, MARIN
97;RUE CHARLES SAINT CYR, MARIN
97;RUE DIAKA, MARIN
97;VC NO 3 DE LA DUPREY, MARIN
97;RUE EMILE ZOLA, MARIN
97;CR DE FONDS DEBASSE, MARIN
97;VC DE FONDS GENS LIBRES, MARIN
97;RLE DU FORT, MARIN
97;CR HTS ETAGES A CAP BOIS NEUF, MARIN
97;RUE JEAN JAURES, MARIN
97;PL JOFFRE, MARIN
97;RUE DE LA LIBERTE, MARIN
97;CR DE LA CARRIERE, MARIN
97;VC NO 5 DE MORNE COURBARIL, MARIN
97;CR NO 1 DE MORNE GOMMIER, MARIN
97;CR NO 3 DU MORNE ROUGE, MARIN
97;RUE NELSON MANDELA, MARIN
97;RUE DOCTEUR OSMAN DUQUESNAY, MARIN
97;AV FRANCOIS MITTERAND, MARIN
97;RUE PASTEUR, MARIN
97;CR DE ROBIN, MARIN
97;RUE VICTOR SCHOELCHER, MARIN
97;CR NO 2 DE LA SUFRIN, MARIN
97;CR NO 4 DU MORNE SULPICE, MARIN
97;CR NO 9 DE LA TOCNAY, MARIN
97;RUE VICTOR DUQUESNAY, MARIN
97;RUE VICTOR LAMON, MARIN
97;LOT LES BAMBOUS, MORNE ROUGE
97;RES RESIDENCE BARBADINE, MORNE ROUGE
97;LOT CAMP CHAZEAU  B, MORNE ROUGE
97;LOT CHAMPFLORE, MORNE ROUGE
97;LOT CAMP CHAZEAU  A, MORNE ROUGE
97;RES CLAUDE BOYE, MORNE ROUGE
97;LOT FOND ROSE, MORNE ROUGE
97;CASR DE GENDARMERIE, MORNE ROUGE
97;LOT HAUT MORNE, MORNE ROUGE
97;LOT MESPONT, MORNE ROUGE
97;LOT NAZARETH, MORNE ROUGE
97;LOT PARNASSE, MORNE ROUGE
97;LOT SAVANE HUBERT, MORNE ROUGE
97;LOT ANANAS, MORNE ROUGE
97;RUE ANDRE ALIKER, MORNE ROUGE
97;RTE DE L AILERON, MORNE ROUGE
97;RUE DES ANTHURIUMS, MORNE ROUGE
97;CR DE BALISIER PARNASSE, MORNE ROUGE
97;RUE LEOPOLD BISSOL, MORNE ROUGE
97;RUE MARCEL BOUQUETY, MORNE ROUGE
97;RUE EMILE BYLON, MORNE ROUGE
97;RTE DU CALVAIRE, MORNE ROUGE
97;IMP DU CALVAIRE, MORNE ROUGE
97;IMP DESMATHIAS, MORNE ROUGE
97;RUE HENRI CLEOSTRATE, MORNE ROUGE
97;RUE DU CIMETIERE, MORNE ROUGE
97;RUE DESILIA COLLAT, MORNE ROUGE
97;RUE CITE LA FALAISE, MORNE ROUGE
97;RUE COLLAT, MORNE ROUGE
97;RUE EDOUARD COLLAT, MORNE ROUGE
97;RUE ELOI CONCY, MORNE ROUGE
97;RUE DELGRES, MORNE ROUGE
97;IMP DESMATHIAS, MORNE ROUGE
97;RUE DU DISPENSAIRE, MORNE ROUGE
97;RUE DES ECOLES, MORNE ROUGE
97;RUE DES ECOLES PROLONGEE, MORNE ROUGE
97;RUE EMILE BILON, MORNE ROUGE
97;RUE ERNEST HYPPOLITTE, MORNE ROUGE
97;RUE DE FOND ABATTOIR, MORNE ROUGE
97;CR DE FONDS CACAO, MORNE ROUGE
97;CR DE FONDS GUILLET, MORNE ROUGE
97;CR DE FONDS ROSE, MORNE ROUGE
97;VC DE FONDS ROSE, MORNE ROUGE
97;RTE DE FOND ROSE, MORNE ROUGE
97;RUE L ABBE GREGOIRE, MORNE ROUGE
97;RUE DE LA GUINEE, MORNE ROUGE
97;RUE ILMANY, MORNE ROUGE
97;RUE LIBERTE, MORNE ROUGE
97;RUE JEAN JAURES, MORNE ROUGE
97;RUE DES SOEURS L. ET H.SABES, MORNE ROUGE
97;RUE VICTOR HUGO, MORNE ROUGE
97;RUE JOSEPH LABARDE, MORNE ROUGE
97;RUE LONGCHAMPS, MORNE ROUGE
97;RUE RUE DE LA LIBERTE, MORNE ROUGE
97;RUE EMILE MAURICE, MORNE ROUGE
97;CR DE LOURDES, MORNE ROUGE
97;RUE LUCIE, MORNE ROUGE
97;RUE DU PERE MARIE, MORNE ROUGE
97;RUE MARIE LOUISE, MORNE ROUGE
97;RUE JOSE MARTY, MORNE ROUGE
97;BD GENERAL DE GAULLE, MORNE ROUGE
97;RUE JULES MONNEROT, MORNE ROUGE
97;RUE LOUIS MURATET, MORNE ROUGE
97;RUE NAZARETH, MORNE ROUGE
97;AV EDGARD NESTORET, MORNE ROUGE
97;RUE ND DE LA DELIVRANDE, MORNE ROUGE
97;RUE DE LA GROTTE DE LOURDES, MORNE ROUGE
97;RUE DE LA PAIX, MORNE ROUGE
97;RUE DE LA PILORIE, MORNE ROUGE
97;RUE ADRIEN PAQUES, MORNE ROUGE
97;CR DE PARNASSE CHAMPFLORE, MORNE ROUGE
97;RUE PIERRE LEGRAND, MORNE ROUGE
97;RUE PIERRE MOULY, MORNE ROUGE
97;RUE PRINCIPALE, MORNE ROUGE
97;RUE DE LA REPUBLIQUE, MORNE ROUGE
97;RUE DE LA REPUBLIQUE PROLONGEE, MORNE ROUGE
97;RUE DE SAVANE HUBERT, MORNE ROUGE
97;RUE SCHOELCHER, MORNE ROUGE
97;RTE DE SAVANE PETIT, MORNE ROUGE
97;RUE DE LA SOLITUDE, MORNE ROUGE
97;IMP SOLITUDE, MORNE ROUGE
97;RUE CAMILLE SYLVESTRE, MORNE ROUGE
97;LOT LA CHARMEUSE 1, PRECHEUR
97;LOT LA CHARMEUSE 2, PRECHEUR
97;LOT LA CHARMEUSE 3, PRECHEUR
97;LOT LA CHARMEUSE 4, PRECHEUR
97;LOT LA COQUETTE, PRECHEUR
97;RES PAUL GRASSELY, PRECHEUR
97;LOT LES MANGUIERS, PRECHEUR
97;RES LA PERLE PREVILLE, PRECHEUR
97;CITE RAYMOND POHIE, PRECHEUR
97;RTE AIME CESAIRE, PRECHEUR
97;RUE NO 1, PRECHEUR
97;RUE NO 2, PRECHEUR
97;RUE DU DEBARCADERE, PRECHEUR
97;RTE DES FUSILLES DU PRECHEUR, PRECHEUR
97;RUE FOND DE LA SALETTE, PRECHEUR
97;RUE PERRINON, PRECHEUR
97;RUE DE LA POSTE, PRECHEUR
97;CITE EN CAMEE, RIVIERE PILOTE
97;LOT EN CAMEE, RIVIERE PILOTE
97;RES EN CAMEE, RIVIERE PILOTE
97;LOT DENISE, RIVIERE PILOTE
97;RES LA GAMMEE, RIVIERE PILOTE
97;CASR DE GENDARMERIE, RIVIERE PILOTE
97;RES LUMINA LA JOSSEAUD, RIVIERE PILOTE
97;RES MANIKOU  DESFARGES, RIVIERE PILOTE
97;RES MANIKOU 2  DESFARGES, RIVIERE PILOTE
97;RES MALVINA - QRT JOSSEAUD, RIVIERE PILOTE
97;CITE POMPONNE, RIVIERE PILOTE
97;RUE DE L ABBE GREGOIRE, RIVIERE PILOTE
97;VC DE L'ABONDANCE, RIVIERE PILOTE
97;RUE DES ARAWAKS, RIVIERE PILOTE
97;CR DE BELLAY, RIVIERE PILOTE
97;CR DE CANARI CASSE, RIVIERE PILOTE
97;RUE CHE GUEVARA, RIVIERE PILOTE
97;CR DE CHEMIN LES MORTS, RIVIERE PILOTE
97;CR DE CONCORDE A MORNE ROCHES, RIVIERE PILOTE
97;RUE DECEMBRE 59, RIVIERE PILOTE
97;RUE DELGRES ET IGNACE, RIVIERE PILOTE
97;RLE DESORMEAUX, RIVIERE PILOTE
97;CR DE DEBAT A RIVIERE ACAJOU, RIVIERE PILOTE
97;VC DE DESMARTINIERE, RIVIERE PILOTE
97;AV FRANTZ FANON, RIVIERE PILOTE
97;RUE GABRIEL LEONA, RIVIERE PILOTE
97;AV INSURRECTIONS ANTI ESCLAVA, RIVIERE PILOTE
97;AV JUANAKAERA, RIVIERE PILOTE
97;RUE DU MARCHE, RIVIERE PILOTE
97;RUE DU MARRONNAGE, RIVIERE PILOTE
97;CR DE MASSONVILLE, RIVIERE PILOTE
97;VC DE MORNE ESCARPE, RIVIERE PILOTE
97;VC DE MORNE HONORE, RIVIERE PILOTE
97;VC DE MORNE ROCHES, RIVIERE PILOTE
97;VC DE MORNE VENT, RIVIERE PILOTE
97;VC DE PASSIE, RIVIERE PILOTE
97;VC DE PERRINE, RIVIERE PILOTE
97;CR DE PREFONTAINE, RIVIERE PILOTE
97;CR DE RAVINE BRAIE, RIVIERE PILOTE
97;RUE DE LA REPUBLIQUE, RIVIERE PILOTE
97;RUE DES RESISTANTS CARAIBES, RIVIERE PILOTE
97;CR DE SAINT VINCENT, RIVIERE PILOTE
97;VC DE SAINT VINCENT, RIVIERE PILOTE
97;BD SEPTEMBRE 70, RIVIERE PILOTE
97;VC DE SOURCE MACONNE, RIVIERE PILOTE
97;RUE TOUSSAINT LOUVERTURE, RIVIERE PILOTE
97;PL DU 22 MAI, RIVIERE PILOTE
97;CITE BAZEILLES, RIVIERE SALEE
97;LOT EN CAMPECHE, RIVIERE SALEE
97;RES LA CARRIERE, RIVIERE SALEE
97;LOT CITE NOUVELLE, RIVIERE SALEE
97;LOT NOUVELLE CITE, RIVIERE SALEE
97;LOT LA COLLINE, RIVIERE SALEE
97;LOT LES ALIZES, RIVIERE SALEE
97;LOT LES IBIS, RIVIERE SALEE
97;LOT CONCORDE, RIVIERE SALEE
97;LOT LES FIGUIERS, RIVIERE SALEE
97;CASR DE GENDARMERIE, RIVIERE SALEE
97;LOT HAUT DU MORNE, RIVIERE SALEE
97;LOT LA HAUT, RIVIERE SALEE
97;LOT KANEL, RIVIERE SALEE
97;LOT LA LAUGIER, RIVIERE SALEE
97;CITE LAFAYETTE, RIVIERE SALEE
97;RES MATOUBA  FONDS MASSON, RIVIERE SALEE
97;RES RESIDENCE LES PALMIERS, RIVIERE SALEE
97;RES LA PALMERAIE, RIVIERE SALEE
97;LOT LAPALUN, RIVIERE SALEE
97;LOT LES OREADES, RIVIERE SALEE
97;LOT LES MIMOSAS, RIVIERE SALEE
97;LOT PEPIN, RIVIERE SALEE
97;RES PERCINETTE, RIVIERE SALEE
97;LOT PETIT BOURG, RIVIERE SALEE
97;LOT PLAISANCE, RIVIERE SALEE
97;LOT POIS DOUX, RIVIERE SALEE
97;LOT LA SAGESSE, RIVIERE SALEE
97;CITE THORAILLE, RIVIERE SALEE
97;CITE TRANQUILLE, RIVIERE SALEE
97;CITE TRENELLE, RIVIERE SALEE
97;QUA ZONE ARTISANALE DE LAUGIER, RIVIERE SALEE
97;CHEM ADEMAR, RIVIERE SALEE
97;CHEM AGESILAS, RIVIERE SALEE
97;CHEM APPOL, RIVIERE SALEE
97;RUE ALPHONSE JEAN JOSEPH, RIVIERE SALEE
97;ALL ANDRE JOSEPH EUGENE, RIVIERE SALEE
97;CHEM ATHANASE RABORD, RIVIERE SALEE
97;CHEM BERNARD CAYOL, RIVIERE SALEE
97;VC DE BRAFFIN, RIVIERE SALEE
97;RUE BRIERE DE LISLE, RIVIERE SALEE
97;IMP DES ROIS BOIS, RIVIERE SALEE
97;IMP DU CAIALI, RIVIERE SALEE
97;RUE CAMPECHE, RIVIERE SALEE
97;CHEM DES CHACHAS, RIVIERE SALEE
97;CHEM DE LA CANNERAIE, RIVIERE SALEE
97;CHEM BELVEDERE, RIVIERE SALEE
97;RUE CHARLES ZIZINE, RIVIERE SALEE
97;RUE DU CIMETIERE, RIVIERE SALEE
97;CHEM DE LA CAFEIRE, RIVIERE SALEE
97;RUE DU MORNE COSTET, RIVIERE SALEE
97;RUE COMMANDANT VARASSE, RIVIERE SALEE
97;CHEM CHAMPETRE, RIVIERE SALEE
97;CHEM BALMELLE, RIVIERE SALEE
97;VOIE DU DAMIER, RIVIERE SALEE
97;RUE CITE BAZEILLES VOIE NO 1, RIVIERE SALEE
97;RUE CITE BAZEILLES VOIE NO 2, RIVIERE SALEE
97;RUE CITE BAZEILLES VOIE NO 3, RIVIERE SALEE
97;RUE CITE BAZEILLES VOIE NO 4, RIVIERE SALEE
97;VOIE DES AIGRETTES, RIVIERE SALEE
97;VOIE DES GRIVES, RIVIERE SALEE
97;VOIE DES RAMIERS, RIVIERE SALEE
97;VOIE DE LA FELICITE, RIVIERE SALEE
97;RUE DU COURBARIL, RIVIERE SALEE
97;VOIE DU MALFINI, RIVIERE SALEE
97;VOIE DE LA FRATERNITE, RIVIERE SALEE
97;VOIE DE LA PAIX, RIVIERE SALEE
97;VOIE DE L'ENTENTE, RIVIERE SALEE
97;VOIE DE L'UNION, RIVIERE SALEE
97;IMP DE LA MARINE, RIVIERE SALEE
97;VOIE DU BEL AIR, RIVIERE SALEE
97;CHEM COURBARIL LOUISY, RIVIERE SALEE
97;CHEM DE FONDS MASSON, RIVIERE SALEE
97;CHEM DAMIS, RIVIERE SALEE
97;RUE DELGRES, RIVIERE SALEE
97;RUE DE LA CALENDA, RIVIERE SALEE
97;RUE DU DOCTEUR JEAN SAINT PRIX, RIVIERE SALEE
97;CHEM DUHAROC MASSY, RIVIERE SALEE
97;AV DES ECOLES, RIVIERE SALEE
97;CHEM EDVARD BONHEUR, RIVIERE SALEE
97;RUE DES ETAGES, RIVIERE SALEE
97;VOIE DES MAHOGANYS, RIVIERE SALEE
97;CHEM LA FELIX, RIVIERE SALEE
97;CHEM LA FLEURY, RIVIERE SALEE
97;RUE GENERAL FELIX EBOUE, RIVIERE SALEE
97;RUE GEORGE GERMANY, RIVIERE SALEE
97;CHEM GRAND COULISSE, RIVIERE SALEE
97;CHEM GOMA, RIVIERE SALEE
97;CHEM DE FIGUIER, RIVIERE SALEE
97;VC DE FIGUIER, RIVIERE SALEE
97;CHEM DE BELLEVUE, RIVIERE SALEE
97;CHEM DES TAMARINIERS, RIVIERE SALEE
97;CHEM DE SAGESSE, RIVIERE SALEE
97;CHEM DES FLAMBOYANTS, RIVIERE SALEE
97;CHEM DES FOUGERES, RIVIERE SALEE
97;CHEM DES FRANGIPANIERS, RIVIERE SALEE
97;CHEM DES GOYAVIERS, RIVIERE SALEE
97;CHEM DES GUATEMALAS, RIVIERE SALEE
97;VC DE FONDS MASSON, RIVIERE SALEE
97;CHEM DE COURBARIL, RIVIERE SALEE
97;CHEM DE DERRIERE BOIS, RIVIERE SALEE
97;CHEM DE REPRISE, RIVIERE SALEE
97;CHEM DES MANGUES, RIVIERE SALEE
97;CHEM DES SOURCES, RIVIERE SALEE
97;CHEM FARNEUS, RIVIERE SALEE
97;RUE GENERAL DE GAULLE, RIVIERE SALEE
97;RUE GENERAL DE VASSOIGNE, RIVIERE SALEE
97;RUE LA GUILLAUD, RIVIERE SALEE
97;CR DE GUIMBE, RIVIERE SALEE
97;CR DE GUINEE FLEURY, RIVIERE SALEE
97;VC GUINEE FLEURY, RIVIERE SALEE
97;VOIE DE LA HAUTE TAILLE, RIVIERE SALEE
97;VOIE DE L'ESPERANCE, RIVIERE SALEE
97;PL DE L HOTEL DE VILLE, RIVIERE SALEE
97;CHEM DE TI COIN, RIVIERE SALEE
97;CHEM BEL BOIS, RIVIERE SALEE
97;RUE IRENE SURENA, RIVIERE SALEE
97;VOIE ISOLE NORBERT, RIVIERE SALEE
97;RUE JEAN JAURES, RIVIERE SALEE
97;RUE JEAN JOSEPH, RIVIERE SALEE
97;RUE JOINVILLE SAINT PRIX, RIVIERE SALEE
97;RUE JOSEPH LAGROSILLIERE, RIVIERE SALEE
97;CHEM JOSEPH LOUIS, RIVIERE SALEE
97;RUE JOSEPH ZOBEL, RIVIERE SALEE
97;CHEM DE LA JOUBARDIERE, RIVIERE SALEE
97;VOIE DE LA KALENDA, RIVIERE SALEE
97;VOIE DU LADJA, RIVIERE SALEE
97;CR DE LAMBERTON, RIVIERE SALEE
97;CHEM LAURENT, RIVIERE SALEE
97;RUE LAFAYETTE, RIVIERE SALEE
97;CHEM LA LAUGIER, RIVIERE SALEE
97;CHEM LEBRETON, RIVIERE SALEE
97;CHEM DES LIBELLULES, RIVIERE SALEE
97;CHEM LOURI, RIVIERE SALEE
97;RUE DE LA LIBERTE, RIVIERE SALEE
97;RUE DE LA LIBERTE PROLONGEE, RIVIERE SALEE
97;RUE LIEUTENANT SAINT FELIX, RIVIERE SALEE
97;ALL LOUIS TOTO BOUTRIN, RIVIERE SALEE
97;RUE DU 22 MAI 1848, RIVIERE SALEE
97;PL DU MARCHE, RIVIERE SALEE
97;PL MARTIN LUTHER KING, RIVIERE SALEE
97;RTE MORNE GLOUGLOU, RIVIERE SALEE
97;VC DE LA MASSY, RIVIERE SALEE
97;CHEM DE MASSONVILLE, RIVIERE SALEE
97;VC LA MAUNY, RIVIERE SALEE
97;CHEM LA MAUNY, RIVIERE SALEE
97;CHEM DE LA MONFORT, RIVIERE SALEE
97;CHEM CASE NEGRES, RIVIERE SALEE
97;CR DE LA MONFORT, RIVIERE SALEE
97;CHEM MONTABORD, RIVIERE SALEE
97;RUE DOCTEUR MORESTIN, RIVIERE SALEE
97;CHEM LA TRENELLE, RIVIERE SALEE
97;CHEM LOUIS ANDRIEUX, RIVIERE SALEE
97;CHEM DE L ORATOIRE, RIVIERE SALEE
97;CHEM DE NOUVELLE GUINEE, RIVIERE SALEE
97;CHEM MACOUDA, RIVIERE SALEE
97;CHEM MALANGA, RIVIERE SALEE
97;RUE MARIUS CULTIER, RIVIERE SALEE
97;CHEM LEOTURE, RIVIERE SALEE
97;RUE NELSON MANDELA, RIVIERE SALEE
97;RUE NERE PERIA, RIVIERE SALEE
97;CHEM PADERNA, RIVIERE SALEE
97;RUE PASTEUR, RIVIERE SALEE
97;RUE PAUL RANO, RIVIERE SALEE
97;CHEM PERDAF, RIVIERE SALEE
97;CR DE PETIT COIN, RIVIERE SALEE
97;ALL DE LA PRISE, RIVIERE SALEE
97;CHEM POIS DOUX, RIVIERE SALEE
97;RUE DE LA REPUBLIQUE, RIVIERE SALEE
97;CHEM DE LA RIVIERE OMAN, RIVIERE SALEE
97;CR DE LA RIVIERE OMAN, RIVIERE SALEE
97;RTE DE RIVIERE PILOTE, RIVIERE SALEE
97;CHEM DE LA ROCHE ASSISE, RIVIERE SALEE
97;CHEM SAINVILLE, RIVIERE SALEE
97;CHEM REMI MINOT, RIVIERE SALEE
97;RUE SALVADOR ALLENDE, RIVIERE SALEE
97;CHEM SEVERE OZEE, RIVIERE SALEE
97;RUE SCHOELCHER, RIVIERE SALEE
97;CHEM DE LA SIMON, RIVIERE SALEE
97;RUE DE LA SOURCE, RIVIERE SALEE
97;RUE DU STADE, RIVIERE SALEE
97;ALL STEPHANIE DARON, RIVIERE SALEE
97;RUE STEPHEN ROSE, RIVIERE SALEE
97;VOIE TERTULLIEN MONTA, RIVIERE SALEE
97;VOIE TIBURCE MONGIS, RIVIERE SALEE
97;VOIE TUILLIER, RIVIERE SALEE
97;CR DE THORAILLE, RIVIERE SALEE
97;RUE TOLE, RIVIERE SALEE
97;RUE VICTOR HUGO, RIVIERE SALEE
97;CHEM VICTOR MOUSSALA, RIVIERE SALEE
97;CHEM DE VIGUIER, RIVIERE SALEE
97;RUE ALEXANDRE ZONZON, RIVIERE SALEE
97;CHEM BOULEVARD, RIVIERE SALEE
97;PL DU 14 MARS 1971, RIVIERE SALEE
97;CHEM ZICAQUES, RIVIERE SALEE
97;CHE DES PIPIRIS, RIVIERE SALEE
97;CITE AJOUPA, ROBERT
97;RES GROUPE AJOUPA LATANIER, ROBERT
97;RES GROUPE AJOUPA PALMISTE, ROBERT
97;RES GROUPE AJOUPA ROSEAU, ROBERT
97;RES GROUPE AJOUPA FIGUIER, ROBERT
97;RES GROUPE AJOUPA PALETUVIER, ROBERT
97;RES GROUPE AJOUPA EPINEUX, ROBERT
97;RES GROUPE AJOUPA BALATA, ROBERT
97;RES GROUPE AJOUPA GOMIER, ROBERT
97;RES GROUPE POINTE LYNCH, ROBERT
97;RES BALAHOU, ROBERT
97;LOT ANANAS, ROBERT
97;RES CADENCE MANSARDE CATALOGNE, ROBERT
97;RES MOULIN A VENT, ROBERT
97;LOT LES CAMPECHERS, ROBERT
97;RES COULIROU, ROBERT
97;CASR DE GENDARMERIE, ROBERT
97;RES DORADE, ROBERT
97;LOT LA DIROZO, ROBERT
97;LOT BEAU SITE, ROBERT
97;LOT PLAVONIL VOIE 1, ROBERT
97;LOT MONT VERT, ROBERT
97;LOT LA MONTLOUIS, ROBERT
97;CITE LACROIX, ROBERT
97;CITE LACROIX NORD, ROBERT
97;LOT LA HAUT, ROBERT
97;LOT LES EAUX VIVES, ROBERT
97;CITE MANSARDE CATALOGNE, ROBERT
97;ZAC MANSARDE CATALOGNE, ROBERT
97;ZAC MOULIN A VENT, ROBERT
97;LOT MOULIN A VENT, ROBERT
