29;LOT DE PENGUEL, CONFORT MEILARS
29;RUE DE CROAS VAD, CONFORT MEILARS
29;RTE DE DOUARNENEZ, CONFORT MEILARS
29;RUE DE LA FONTAINE, CONFORT MEILARS
29;RUE DE LA FORGE, CONFORT MEILARS
29;RUE PEN AR BED, CONFORT MEILARS
29;RUE DU PRESBYTERE, CONFORT MEILARS
29;LOT COMMUNAL DE CADOL, MELGVEN
29;LOT DES CINQ CHEMINS, MELGVEN
29;LOT CROAS MEN, MELGVEN
29;LOT DE ROUGE, MELGVEN
29;LOT HERLEDAN, MELGVEN
29;HAM DE KERALLE, MELGVEN
29;ZA DE KERAMPAOU, MELGVEN
29;LOT DE KERANCALLOC H, MELGVEN
29;LOT LE NOACH, MELGVEN
29;HAM DE PARK AN AVAL TRENK, MELGVEN
29;RES PARK LEUR, MELGVEN
29;HAM PARK MEILH 2, MELGVEN
29;HAM PARK MEILH 1, MELGVEN
29;LOT DU VERGER, MELGVEN
29;IMP DES ABEILLES, MELGVEN
29;IMP DES ACACIAS, MELGVEN
29;RUE DE LA BOISSIERE, MELGVEN
29;IMP DE BONNE NOUVELLE, MELGVEN
29;RUE DES BRUYERES, MELGVEN
29;RUE DU BUDOU, MELGVEN
29;RTE DE CADOL, MELGVEN
29;RUE DES CERISIERS, MELGVEN
29;RUE DES CAMELIAS, MELGVEN
29;RUE DU CHANT DES OISEAUX, MELGVEN
29;RUE DU CHAMP DES MOULINS, MELGVEN
29;RUE CHARLES LINDBERGH, MELGVEN
29;RUE DES CHATAIGNIERS, MELGVEN
29;RUE DES CHENES, MELGVEN
29;ALL DES CINQ CHEMINS, MELGVEN
29;RUE DE LA CITERNE, MELGVEN
29;IMP DU CHEVAL D ORGUEIL, MELGVEN
29;RUE CLAUDE MONET, MELGVEN
29;CHEM DE COAT COUBREN, MELGVEN
29;RUE DE COAT PIN, MELGVEN
29;RTE DE CONCARNEAU, MELGVEN
29;CHE DE CROAS KERDAIC, MELGVEN
29;IMP DE CROAS MEN, MELGVEN
29;CHE DE CROAS KERDAIC, MELGVEN
29;IMP DE CROAS NEVEZ-KERLIGOAR, MELGVEN
29;RTE DE DROGANT, MELGVEN
29;RUE DE L ECOLE DES FILLES, MELGVEN
29;PL DE L EGLISE, MELGVEN
29;RUE DE L EGLISE, MELGVEN
29;ALL DES FRENES, MELGVEN
29;IMP DES GENETS, MELGVEN
29;RTE DE GOAREM DOUR BRAS, MELGVEN
29;RUE DES HARAS, MELGVEN
29;ALL DES HETRES, MELGVEN
29;RUE JACQUES CARTIER, MELGVEN
29;RUE JEAN BART, MELGVEN
29;RUE JEAN JAURES, MELGVEN
29;RTE DE KERLIGOAR, MELGVEN
29;IMP DE KERLIGOAR NORD, MELGVEN
29;RUE JEAN MERMOZ, MELGVEN
29;RUE JULES FERRY, MELGVEN
29;RUE JULES VERNE, MELGVEN
29;RUE DE KERANCALLOCH, MELGVEN
29;ESP DE LAROQUE D OLMES, MELGVEN
29;IMP DE KERMANCHEC, MELGVEN
29;VEN DE KERMANCHEC, MELGVEN
29;IMP DU LAVOIR, MELGVEN
29;IMP DES LIBELLULES, MELGVEN
29;IMP DES LUCIOLES, MELGVEN
29;RUE LOUIS BLERIOT, MELGVEN
29;RUE DES MAGNOLIAS, MELGVEN
29;IMP DES MARRONNIERS, MELGVEN
29;RUE DES MESANGES, MELGVEN
29;IMP DES MIMOSAS, MELGVEN
29;CHEM DE MINUELLOU, MELGVEN
29;RUE DU MOULIN KERANGOC, MELGVEN
29;CHEM DU MOULIN KERANGOC, MELGVEN
29;N 165, MELGVEN
29;RUE NEUVE, MELGVEN
29;ALL DES NOISETIERS, MELGVEN
29;CHEM DE PARC AN PICARD, MELGVEN
29;CHE DE PARK AR C'HEZEC, MELGVEN
29;CHE DE PARK LANN-KERLIGOAR, MELGVEN
29;RUE PAUL CEZANNE, MELGVEN
29;IMP DE PENHER HUEL, MELGVEN
29;RUE PER JAKEZ HELIAS, MELGVEN
29;RUE DU PARC, MELGVEN
29;RUE DES PINSONS, MELGVEN
29;IMP DES POMMIERS, MELGVEN
29;IMP DU QUESTEL, MELGVEN
29;RUE DES ROITELETS, MELGVEN
29;IMP DES ROSES, MELGVEN
29;CHEM DE SAINT ANTOINE, MELGVEN
29;RUE ST EXUPERY, MELGVEN
29;RUE DU STADE, MELGVEN
29;IMP DU STADE, MELGVEN
29;RUE DE LA TRINITE, MELGVEN
29;RTE DE LA TRINITE, MELGVEN
29;RUE VALORY, MELGVEN
29;RUE DU VERGER, MELGVEN
29;ALL VOULEZ, MELGVEN
29;RTE DE LA VALLEE, MELGVEN
29;IMP DE KERAUTER, MELGVEN
29;IMP DE PARC AR GLOAN, MELGVEN
29;IMP DU COTE COUR, MELGVEN
29;IMP DE KERVEZ PELL, MELGVEN
29;RTE DE CROISSANT BOUILLET, MELGVEN
29;CHE DE FRESQ COZ, MELGVEN
29;RTE DE LA BOISSIERE, MELGVEN
29;RTE DE BONNE NOUVELLE, MELGVEN
29;LOT BODEL NEVEZ, MELLAC
29;LOT COMMUNAL DU BOURG, MELLAC
29;LOT LES COTEAUX DE TY LANN, MELLAC
29;CITE D IRLANDE, MELLAC
29;RES D IRLANDE, MELLAC
29;LOT KERNEC, MELLAC
29;CITE LESSARD, MELLAC
29;LOT DE KERGARIOU, MELLAC
29;CLOS DES CHATAIGNIERS, MELLAC
29;HAM DE LEUR VIHAN, MELLAC
29;HAM DE KERFELES, MELLAC
29;HAM DU COSQUER, MELLAC
29;HAM DES ACACIAS - KERFELES, MELLAC
29;HAM DE PENAMPRAT, MELLAC
29;HAM DE KERGROAS, MELLAC
29;CLOS DE KERNOURS, MELLAC
29;CLOS DE KERBARZOU, MELLAC
29;RES PARK AL LEUR, MELLAC
29;CITE DE PENAMPRAT, MELLAC
29;LOT DE ROSGLAZ, MELLAC
29;LOT DE ROZ AR GROES, MELLAC
29;RES DE ROZ GLAS, MELLAC
29;CITE DE TY BODEL, MELLAC
29;CITE TY LANN, MELLAC
29;RUE ALBERT SCHWEITZER, MELLAC
29;RTE DE BANNALEC, MELLAC
29;IMP DE BEG AR ROZ, MELLAC
29;RUE DU BOURG, MELLAC
29;RUE FERDINAND BUISSON, MELLAC
29;CHE DES CHATAIGNIERS, MELLAC
29;RUE DU CHATEAU D'EAU, MELLAC
29;RUE COLETTE, MELLAC
29;RUE LA FONTAINE SAINT PIERRE, MELLAC
29;RPT IRENE JOLIOT-CURIE, MELLAC
29;SQ JOB SAUX, MELLAC
29;RTE DE KERGROES, MELLAC
29;RTE DE KERNAOUR, MELLAC
29;CHE DE KERIOUANT, MELLAC
29;CHE DE KERFEUNTEUN, MELLAC
29;RTE DE KERNOURS, MELLAC
29;RUE LOUISE MICHEL, MELLAC
29;RUE MARGUERITE YOURCENAR, MELLAC
29;RUE JACQUES MONOD, MELLAC
29;N 165, MELLAC
29;RUE NELSON MANDELA, MELLAC
29;RUE PIERRE-GILLES DE GENNES, MELLAC
29;RTE DE QUIMPERLE, MELLAC
29;CHE DE ROZ BEG, MELLAC
29;RTE DU TREVOUX, MELLAC
29;CHEM DE TY GROES, MELLAC
29;RUE FRANCOISE ELIE, MELLAC
29;RES CORENTIN PRIGENT, MESPAUL
29;RES DES ACACIAS, MESPAUL
29;RES CROAS AR VILIEN, MESPAUL
29;HAM DES SAULES, MESPAUL
29;RES DES SOURCES, MESPAUL
29;RUE D ARMOR, MESPAUL
29;PL CALVAIRE, MESPAUL
29;RUE DES CAMELIAS, MESPAUL
29;ALL DU CHATAIGNIER, MESPAUL
29;RUE DE COAT PIN, MESPAUL
29;RTE DE CREACH AR GLAS, MESPAUL
29;RUE DE CREACH HUELLEN, MESPAUL
29;ALL DE HOAS LEORET, MESPAUL
29;PL DE L EGLISE, MESPAUL
29;RUE DE KERGUDON, MESPAUL
29;VEN DU LAVOIR, MESPAUL
29;RUE DES MAGNOLIAS, MESPAUL
29;RUE DE LA MAIRIE, MESPAUL
29;RUE DU MENEZ, MESPAUL
29;RTE DE PLOUENAN, MESPAUL
29;RUE DU VIEUX BOURG, MESPAUL
29;RUE CORENTIN PRIGENT, MESPAUL
29;CITE LE CROIZIOU, MOELAN SUR MER
29;RES DOMAINE DES AVENS, MOELAN SUR MER
29;LOT LE CLOS DES CHENES, MOELAN SUR MER
29;LOT LE CLOS DU GARZON, MOELAN SUR MER
29;RES LE CROIZIOU, MOELAN SUR MER
29;HAM DE GUEOTEC, MOELAN SUR MER
29;HAM DE KERANCALVEZ, MOELAN SUR MER
29;HAM DE KERCADORET, MOELAN SUR MER
29;CITE DE KERDOUSSAL, MOELAN SUR MER
29;LOT DE KERFANY LES PINS, MOELAN SUR MER
29;LOT DE KERVAZIOU, MOELAN SUR MER
29;CITE DES PINS, MOELAN SUR MER
29;CITE DE PORZ MOELAN, MOELAN SUR MER
29;RES DE PORZ MOELAN, MOELAN SUR MER
29;HAM SAINT MELAINE, MOELAN SUR MER
29;RES SAINT ROCH, MOELAN SUR MER
29;CITE RUE DES HETRES, MOELAN SUR MER
29;CITE TY RU, MOELAN SUR MER
29;RUE AR WAZH, MOELAN SUR MER
29;RUE DES ACACIAS, MOELAN SUR MER
29;RUE DES AZALEES, MOELAN SUR MER
29;RUE BEL AIR, MOELAN SUR MER
29;CHEM DES BOSQUETS, MOELAN SUR MER
29;RTE DU BELON, MOELAN SUR MER
29;RUE DU BELON, MOELAN SUR MER
29;RUE BERNARD DE MOELAN, MOELAN SUR MER
29;RTE DE BRIGNEAU, MOELAN SUR MER
29;RUE DES CAMELIAS, MOELAN SUR MER
29;ALL DE LA CHAPELLE, MOELAN SUR MER
29;RUE CECILE RAVALLEC, MOELAN SUR MER
29;ALL DES CHENES, MOELAN SUR MER
29;RUE DES EGLANTIERS, MOELAN SUR MER
29;CHEM DE LA FONTAINE, MOELAN SUR MER
29;RUE DU GUILLY, MOELAN SUR MER
29;CHEM DE LA GARENNE, MOELAN SUR MER
29;RUE CORN PARCOU, MOELAN SUR MER
29;CHEM DU GORGEN, MOELAN SUR MER
29;RUE DES GRANDES LANDES, MOELAN SUR MER
29;RUE DES HAUTS DE PRAD BERN, MOELAN SUR MER
29;RUE DES HETRES, MOELAN SUR MER
29;RUE DES HORTENSIAS, MOELAN SUR MER
29;RUE DES IRIS, MOELAN SUR MER
29;RTE DU GUILLY, MOELAN SUR MER
29;RUE JAKES RIOU, MOELAN SUR MER
29;RUE DE KERGUIPP, MOELAN SUR MER
29;RUE DE KERBREZILLIC, MOELAN SUR MER
29;RUE DE KERDIAOULIG, MOELAN SUR MER
29;RUE DE KERVELIGEN, MOELAN SUR MER
29;RUE DE KERLAGAT, MOELAN SUR MER
29;RUE DE KERVIGODES, MOELAN SUR MER
29;IMP DE KERVILIN, MOELAN SUR MER
29;RUE KREIZ KER, MOELAN SUR MER
29;CHEM DE LANBEURNOU COZ, MOELAN SUR MER
29;CHEM DE LANN AR PARC, MOELAN SUR MER
29;RTE DE LANN KERGUIPP, MOELAN SUR MER
29;IMP KERDIANOU, MOELAN SUR MER
29;RUE DE BRASPART, MOELAN SUR MER
29;RUE DE LOUISBURGH, MOELAN SUR MER
29;RUE LOUIS LE GUENNEC, MOELAN SUR MER
29;CHE DES LYS, MOELAN SUR MER
29;RTE DES MOULINS, MOELAN SUR MER
29;RUE DES CHATAIGNIERS, MOELAN SUR MER
29;ALL DES CHAUMIERES, MOELAN SUR MER
29;ALL DES CHEVREFEUILLES, MOELAN SUR MER
29;RUE DES COUTURIERES, MOELAN SUR MER
29;RUE DES MARINS, MOELAN SUR MER
29;RTE DE MERRIEN, MOELAN SUR MER
29;RTE DE MILRIDEN, MOELAN SUR MER
29;RUE DES MOULINS, MOELAN SUR MER
29;RUE LOUIS ORVOEN, MOELAN SUR MER
29;CHE DU PARIOU, MOELAN SUR MER
29;CHEM DU PASSEUR, MOELAN SUR MER
29;RUE DE PENANPRAT, MOELAN SUR MER
29;ALL DE PENFRET, MOELAN SUR MER
29;RUE DES PECHEURS, MOELAN SUR MER
29;RUE DES PETITES SALLES, MOELAN SUR MER
29;CHEM DE PONT CORN, MOELAN SUR MER
29;RUE DU PONT, MOELAN SUR MER
29;RUE DES PRIMEVERES, MOELAN SUR MER
29;CHEM DES PRES, MOELAN SUR MER
29;RTE DE QUILIMAR, MOELAN SUR MER
29;RUE DE QUIMPERLE, MOELAN SUR MER
29;RTE DE RIEC, MOELAN SUR MER
29;RUE ST MELAINE, MOELAN SUR MER
29;RTE DE SAINTE THUMETTE, MOELAN SUR MER
29;RUE DES THUYAS, MOELAN SUR MER
29;RUE TRAVERSE, MOELAN SUR MER
29;RTE DE TRENEZ KERSOLF, MOELAN SUR MER
29;IMP DES TROIS PUITS, MOELAN SUR MER
29;IMP DE LA VERES, MOELAN SUR MER
29;PL DU VIEUX MARCHE, MOELAN SUR MER
29;RUE DES ECOLES, MOELAN SUR MER
29;PL DE L EGLISE, MOELAN SUR MER
29;ALL DES ALBATROS, MOELAN SUR MER
29;CHEM D'ARGOAT, MOELAN SUR MER
29;CHEM D'ARMOR, MOELAN SUR MER
29;RUE DE BADELL, MOELAN SUR MER
29;RTE DES BOIS, MOELAN SUR MER
29;RUE DE BAYE, MOELAN SUR MER
29;RUE DE BEG TAL GWARD, MOELAN SUR MER
29;RTE DE BEG AR LAND, MOELAN SUR MER
29;RUE DE BELLE VUE, MOELAN SUR MER
29;CHEM DE BOT GUELEN, MOELAN SUR MER
29;RUE DE BRUNEC, MOELAN SUR MER
29;ALL DES CAMELIAS, MOELAN SUR MER
29;RUE CENTRE, MOELAN SUR MER
29;ALL DES CHALOUPES, MOELAN SUR MER
29;RUE CHEF DU BOIS, MOELAN SUR MER
29;ALL DES CORMORANS, MOELAN SUR MER
29;RTE DE CLOHARS, MOELAN SUR MER
29;ALL DES CORVETTES, MOELAN SUR MER
29;PL DE DACHEN, MOELAN SUR MER
29;RUE DE LA DIGUE, MOELAN SUR MER
29;RUE DU DOCTEUR ROGER PINEL, MOELAN SUR MER
29;ALL DES DORADES, MOELAN SUR MER
29;RUE DES ECUREUILS, MOELAN SUR MER
29;RUE DES EMBRUNS, MOELAN SUR MER
29;RUE FEUNTEUN VAT, MOELAN SUR MER
29;ALL DES FREGATES, MOELAN SUR MER
29;ALL DU GALION, MOELAN SUR MER
29;CHEM DU GARZON, MOELAN SUR MER
29;ALL DES GOELANDS, MOELAN SUR MER
29;ALL DES GOELETTES, MOELAN SUR MER
29;CHE DES GRANDES SALLES, MOELAN SUR MER
29;IMP HENRI MATHURIN TANGUY, MOELAN SUR MER
29;ALL DE HORTENSIAS, MOELAN SUR MER
29;ALL DES ILES DE GLENAN, MOELAN SUR MER
29;ALL DE L'ILE DE GROIX, MOELAN SUR MER
29;IMP DE L'ILE DE MOLENE, MOELAN SUR MER
29;RUE DE L'ILE D'OUESSANT, MOELAN SUR MER
29;RTE DE L'ILE PERCEE, MOELAN SUR MER
29;ALL DE L'ILE PERCEE, MOELAN SUR MER
29;ALL DE L'ILE VERTE, MOELAN SUR MER
29;IMP DE L'ILE DE SEIN, MOELAN SUR MER
29;CHE DE KERANDREO, MOELAN SUR MER
29;RUE DE KERCADORET, MOELAN SUR MER
29;RUE DE KERANDOZE, MOELAN SUR MER
29;RUE DE KERDORET, MOELAN SUR MER
29;IMP DE KEREL, MOELAN SUR MER
29;RTE DE KERFANY, MOELAN SUR MER
29;ALL DE KERFLEURY, MOELAN SUR MER
29;ALL DE KERGUILLAOUET, MOELAN SUR MER
29;RTE DE KERIMEL, MOELAN SUR MER
29;RTE DE KERJEGOU - LANN AR HOAT, MOELAN SUR MER
29;IMP DE KER ROCHERS, MOELAN SUR MER
29;RUE DE KERSECOL, MOELAN SUR MER
29;RTE DE KERLASSET, MOELAN SUR MER
29;RTE DE KERSOLF, MOELAN SUR MER
29;IMP DE KERVEGANT, MOELAN SUR MER
29;IMP DE KERVIGNES, MOELAN SUR MER
29;RUE KREIZ KER BIHAN, MOELAN SUR MER
29;CHE DE LAN AR C HOAT, MOELAN SUR MER
29;IMP DE LAND KERGUIPP, MOELAN SUR MER
29;IMP DE LANN PARKOU, MOELAN SUR MER
29;IMP DE LANN VIHAN, MOELAN SUR MER
29;CHEM DU LAVOIR, MOELAN SUR MER
29;CHEM DES LILAS, MOELAN SUR MER
29;ALL DES LISETTES, MOELAN SUR MER
29;IMP LOUARNIG, MOELAN SUR MER
29;RUE MARCEL GANNAT, MOELAN SUR MER
29;RUE DE MALACHAPPE, MOELAN SUR MER
29;RUE MENEMARZIN, MOELAN SUR MER
29;RUE OCEANE, MOELAN SUR MER
29;RTE DE PENANSTER, MOELAN SUR MER
29;ALL DES PETRELS, MOELAN SUR MER
29;RUE PEN AN OAD, MOELAN SUR MER
29;RUE DE PARC AR HOAT, MOELAN SUR MER
29;RUE PARKOU PEK, MOELAN SUR MER
29;CHEM DE PARK ROZ, MOELAN SUR MER
29;RUE PENN AN HENT, MOELAN SUR MER
29;IMP DU PETIT PUITS, MOELAN SUR MER
29;IMP DE LA PETITE LANDE, MOELAN SUR MER
29;CHEM DE LA PLAGE GRISE, MOELAN SUR MER
29;RUE DES PLAGES, MOELAN SUR MER
29;RUE DE LA PLAINE, MOELAN SUR MER
29;RUE PONT AR LAER, MOELAN SUR MER
29;RTE DE PONT VIL, MOELAN SUR MER
29;CHEM DE PONTI, MOELAN SUR MER
29;RUE DU PETIT PORZ MOELAN, MOELAN SUR MER
29;RUE DU PORT, MOELAN SUR MER
29;RTE DE PORZ MOELAN, MOELAN SUR MER
29;RUE DE PORZ MOELAN, MOELAN SUR MER
29;RUE DU PORT DU BELON, MOELAN SUR MER
29;CHEM DE POULL AL LENN, MOELAN SUR MER
29;RTE DE POULDOUR, MOELAN SUR MER
29;CHEM DE POULL FANK, MOELAN SUR MER
29;RTE DE POULL GWENN, MOELAN SUR MER
29;RTE DE POULVEZ, MOELAN SUR MER
29;CHEM DE LA RIVIERE, MOELAN SUR MER
29;IMP DE ROZ AR VILIN, MOELAN SUR MER
29;CHE DE TOUL AR C HOAT, MOELAN SUR MER
29;RUE DE TRENOGOAT, MOELAN SUR MER
29;CHEM DE TRELAZEC, MOELAN SUR MER
29;RUE SAINT THAMEC, MOELAN SUR MER
29;CHE DES SAULES, MOELAN SUR MER
29;ALL DES STERNES, MOELAN SUR MER
29;RUE TAL ALENN, MOELAN SUR MER
29;RUE ST PHILIBERT, MOELAN SUR MER
29;RUE DE LA VALLEE, MOELAN SUR MER
29;VTE VIEILLE RTE DE MERRIEN, MOELAN SUR MER
29;CHE DU VERN, MOELAN SUR MER
29;RUE LA VILLENEUVE, MOELAN SUR MER
29;RUE DES 3 FERMES, MOELAN SUR MER
29;RUE DE BAZEN HUEN, MOELAN SUR MER
29;CHEM DE BEG AR ROUZIC, MOELAN SUR MER
29;RUE DE KERGUEN, MOELAN SUR MER
29;RTE DE KERASCOET, MOELAN SUR MER
29;RTE DE KERAMPELLAN, MOELAN SUR MER
29;RTE DE KERAMBELLEC, MOELAN SUR MER
29;RTE DE KERCANET, MOELAN SUR MER
29;RTE DE KERGOULOUET, MOELAN SUR MER
29;IMP DE KERDANIOU, MOELAN SUR MER
29;IMP DE KER GOUIEG, MOELAN SUR MER
29;RUE DE KERGOTTER, MOELAN SUR MER
29;IMP DE KERGUEVELLIC, MOELAN SUR MER
29;RTE DE KEROUZE, MOELAN SUR MER
29;RUE DE KERCHIMINER, MOELAN SUR MER
29;RUE DE KERGOSTIOU, MOELAN SUR MER
29;RTE DE KERSAUX, MOELAN SUR MER
29;RUE DE KERVAZIOU, MOELAN SUR MER
29;RTE DE KERVIGNAC, MOELAN SUR MER
29;IMP LOUIS LAURENT, MOELAN SUR MER
29;IMP MOULIN JAOUEN, MOELAN SUR MER
29;IMP DES PETITES SALLES, MOELAN SUR MER
29;RTE DE PONT MEN, MOELAN SUR MER
29;RTE DE PORTEC, MOELAN SUR MER
29;RUE PORTZ TAEG, MOELAN SUR MER
29;RUE PORZ GWENN, MOELAN SUR MER
29;IMP DE LA PRAIRIE, MOELAN SUR MER
29;RES BEL AIR, MORLAIX
29;CITE BREHAT, MORLAIX
29;HAM DU CHAMP BRETON, MORLAIX
29;HAM DU CLOS DES FUTAIES, MORLAIX
29;LOT COAT MENGUY, MORLAIX
29;LOT KEROC HIOU, MORLAIX
29;CITE COLBERT, MORLAIX
29;CITE D AUMONT, MORLAIX
29;CITE LAENNEC, MORLAIX
29;LOT DE KEREDERN, MORLAIX
29;LOT KERJOIC, MORLAIX
29;RES DE KERNEGUES, MORLAIX
29;LOT LEBON, MORLAIX
29;CITE DES MARRONNIERS, MORLAIX
29;RES POAN BEN, MORLAIX
29;RES DU PONT BELLEC, MORLAIX
29;CITE POULFANC, MORLAIX
29;LOT ROCH GLAZ, MORLAIX
29;CITE DE ROSCOAT, MORLAIX
29;RES SERUSIER, MORLAIX
29;RES ST FIACRE, MORLAIX
29;LOT STE MARTHE, MORLAIX
29;CITE ST NICOLAS, MORLAIX
29;LOT DU STERIOU, MORLAIX
29;RES TAL AR GROAS, MORLAIX
29;LOT TY DOUR, MORLAIX
29;LOT URIEN, MORLAIX
29;LOT PICART, MORLAIX
29;CITE DU VERGER, MORLAIX
29;LOT WEYGAND, MORLAIX
29;CHE DE FER DE PARIS A BRE, MORLAIX
29;RTE N 786 MORLAIX A DINARD, MORLAIX
29;RUIS RUISSEAU, MORLAIX
29;RTE N 169, MORLAIX
29;RUIS DU MENGUEN, MORLAIX
29;RUE DE TY DOUR, MORLAIX
29;VC N 152, MORLAIX
29;CD CHE DEPARTEMENTAL, MORLAIX
29;VC N 18 DE KEROC'HIOU, MORLAIX
29;CHV N 15 DE COAT AR FA, MORLAIX
29;PONT ROUGE, MORLAIX
29;RUE DES ABEILLES, MORLAIX
29;VOIE D ACCES AU PORT, MORLAIX
29;RUE ADOLPHE ASSI, MORLAIX
29;RUE DE L AERODROME, MORLAIX
29;RUE D AIGUILLON, MORLAIX
29;RUE ALBERT CAMUS, MORLAIX
29;RUE ALBERT LE GRAND, MORLAIX
29;RUE ALFRED LE BARS, MORLAIX
29;PL ALLENDE, MORLAIX
29;RUE DES ALOUETTES, MORLAIX
29;IMP DES ALOUETTES, MORLAIX
29;IMP AMADEO MODIGLIANI, MORLAIX
29;RUE AMPERE, MORLAIX
29;RUE DES AMANDIERS, MORLAIX
29;RUE ANATOLE FRANCE, MORLAIX
29;RUE ANATOLE LE BRAZ, MORLAIX
29;RUE ANGE DE GUERNISAC, MORLAIX
29;RUE ANGELE MARIAGE, MORLAIX
29;IMP ANTOINE WATTEAU, MORLAIX
29;RUE ARAGO, MORLAIX
29;VEN AUX ARCHERS, MORLAIX
29;RUE ARISTIDE BRIAND, MORLAIX
29;PL ARMAND CLOAREC, MORLAIX
29;RUE ARMAND ROUSSEAU, MORLAIX
29;RUE DES AUBEPINES, MORLAIX
29;RUE DE L AUDITOIRE, MORLAIX
29;IMP AUGUSTE RENOIR, MORLAIX
29;VEN AUGUSTE ROPARS, MORLAIX
29;RUE AUGUSTE VERMOREL, MORLAIX
29;RUE AUGUSTIN AVRIAL, MORLAIX
29;RUE DES AULNES, MORLAIX
29;RUE DE LA BAIE, MORLAIX
29;PL DE L'AVANT SCENE, MORLAIX
29;CRS BEAUMONT, MORLAIX
29;IMP DE LA BARRIERE, MORLAIX
29;RUE DE LA BARRIERE, MORLAIX
29;RTE DU BAS DE LA RIVIERE, MORLAIX
29;RUE BASSE, MORLAIX
29;RUE DE BELIZAL, MORLAIX
29;IMP BELLEVUE DE LA MADELEINE, MORLAIX
29;RUE BENOIT MALON, MORLAIX
29;VEN DE LA BERGERIE, MORLAIX
29;VEN AU BEURRE, MORLAIX
29;RUE BOBBY SANDS, MORLAIX
29;RUE DE LA BOISSIERE, MORLAIX
29;IMP BORIS VIAN, MORLAIX
29;RUE DE BOTLORE, MORLAIX
29;RUE DES BOUCHERS, MORLAIX
29;RUE BOUESTARD DE LA TOUCHE, MORLAIX
29;RUE DES BOULEAUX, MORLAIX
29;RUE DES BREBIS, MORLAIX
29;RUE DE BREHAT, MORLAIX
29;RTE DE BREST, MORLAIX
29;RUE DE BREST, MORLAIX
29;RUE DE BREST PROLONGEE, MORLAIX
29;ALL DES BRUYERES, MORLAIX
29;RUE DES BRUYERES, MORLAIX
29;RUE (PTE) DE CALLAC, MORLAIX
29;PL DE CALLAC, MORLAIX
29;RTE DE CALLAC, MORLAIX
29;RUE DE CALLAC, MORLAIX
29;VEN DU CALVAIRE, MORLAIX
29;PL DU CALVAIRE, MORLAIX
29;RUE DU CALVAIRE, MORLAIX
29;IMP CAMILLE COROT, MORLAIX
29;RUE CAMILLE LANGEVIN, MORLAIX
29;RUE DES CAMELIAS, MORLAIX
29;CHE DES CAPUCINS, MORLAIX
29;RUE DES CAPUCINS, MORLAIX
29;RTE DE CARHAIX, MORLAIX
29;VEN DES CARMELITES, MORLAIX
29;RUE CARNOT, MORLAIX
29;RUE CAROLINE AIGLE, MORLAIX
29;RUE DE LA CARRIERE, MORLAIX
29;VEN DU CASSE COU, MORLAIX
29;RUE DES CEDRES, MORLAIX
29;RUE DES CERISIERS, MORLAIX
29;RUE DU CHAMP BRETON, MORLAIX
29;RUE CHAMP LE GOFF, MORLAIX
29;RUE DU CHAMP MORVAN, MORLAIX
29;RUE DES CHAMPS, MORLAIX
29;IMP DES CHARDONNERETS, MORLAIX
29;PL CHARLES DE GAULLE, MORLAIX
29;RUE CHARLES GAMBON, MORLAIX
29;RUE CHARLES GERARDIN, MORLAIX
29;IMP CHARLES LE GOFFIC, MORLAIX
29;RUE CHARLES LE GOFFIC, MORLAIX
29;RUE CHARLES LONGUET, MORLAIX
29;IMP CHARLIE PARKER, MORLAIX
29;PL DU CHATEAU, MORLAIX
29;RUE DU CHATEAU, MORLAIX
29;IMP DES CHEVREUILS, MORLAIX
29;RUE CHRISTINE CLEMENT, MORLAIX
29;IMP CLAUDE MONET, MORLAIX
29;RUE JEAN MONNET, MORLAIX
29;RUE COAT AR FAOU, MORLAIX
29;CHE DE COAT COUGAR, MORLAIX
29;RTE DE COAT CONGAR, MORLAIX
29;IMP DE COAT-MENGUY, MORLAIX
29;VC N 5, MORLAIX
29;VC N 6, MORLAIX
29;VC N 7, MORLAIX
29;VC N 13, MORLAIX
29;VC N 14, MORLAIX
29;VC N 53, MORLAIX
29;VC N 151, MORLAIX
29;VC N 218, MORLAIX
29;CITE COLBERT, MORLAIX
29;VC COLLOBERT, MORLAIX
29;VEN COLLOBERT, MORLAIX
29;IMP DES COLVERTS, MORLAIX
29;RUE DU CDT L HERMINIER, MORLAIX
29;IMP CDT NOEL, MORLAIX
29;RUE DE LA CORDELIERE, MORLAIX
29;RUE DES CORDIERS, MORLAIX
29;ALL DES CORMIERS, MORLAIX
29;PL CORNIC, MORLAIX
29;CHE DE COSQUEROU, MORLAIX
29;RUE COURS BEAUMONT, MORLAIX
29;RUE COURTE, MORLAIX
29;RUE DU CREACH JOLY, MORLAIX
29;RPE DU CREOU, MORLAIX
29;VEN DU CREOU, MORLAIX
29;RUE DU CROISSANT, MORLAIX
29;RTE DU CROISSANT, MORLAIX
29;PL DAUMESNIL, MORLAIX
29;RUE DAUMESNIL, MORLAIX
29;CD N 48, MORLAIX
29;CD N 712, MORLAIX
29;RUE DOCTEUR LE STIR, MORLAIX
29;IMP DOCTEUR LEFEBVRE, MORLAIX
29;RUE DOCTEUR LEFEBVRE, MORLAIX
29;RUE DU DOCTEUR PROUFF, MORLAIX
29;IMP DU DOCTEUR QUERNEAU, MORLAIX
29;PL DU DOSSEN, MORLAIX
29;RUE DUPLEIX, MORLAIX
29;IMP DUKE ELLINGTON, MORLAIX
29;RUE DES ECUREUILS, MORLAIX
29;VEN AUX EAUX, MORLAIX
29;PL EDMOND PUYO, MORLAIX
29;RUE EDOUARD CORBIERE, MORLAIX
29;VEN EDOUARD CORBIERE, MORLAIX
29;RUE EDOUARD VAILLANT, MORLAIX
29;RUE DE L EGLISE, MORLAIX
29;RUE EMILE CLOAREC, MORLAIX
29;PL EMILE SOUVESTRE, MORLAIX
29;RUE DES ERABLES, MORLAIX
29;VOIE EXPRESS R N 12, MORLAIX
29;ESC DU CHATEAU, MORLAIX
29;RUE EUGENE POTTIER, MORLAIX
29;RUE FELIX PYAT, MORLAIX
29;RUE DE FEUNTEUN IZELLA, MORLAIX
29;IMP FELIX PYAT, MORLAIX
29;IMP FANCH GOURVIL, MORLAIX
29;IMP DES FAUVETTES, MORLAIX
29;RUE AU FIL, MORLAIX
29;IMP FONTAINE AU LAIT, MORLAIX
29;RUE FONTAINE AU LAIT, MORLAIX
29;VEN DES FONTAINES, MORLAIX
29;RUE DES FONTAINES, MORLAIX
29;RUE DE LA FOUASSERIE, MORLAIX
29;VEN DE LA FOUASSERIE, MORLAIX
29;VEN DU FOUR DU MUR, MORLAIX
29;RLE DU FOUR SAINTE MELAINE, MORLAIX
29;VEN FOUR SAINTE MELAINE, MORLAIX
29;RUE FRANCOIS-MARIE LUZEL, MORLAIX
29;RUE FRANCOIS MEL, MORLAIX
29;RUE FRANCOIS LE GUEN, MORLAIX
29;RUE FRANCOIS JOURDE, MORLAIX
29;RUE FRANCOIS VILLON, MORLAIX
29;PL FRANCOIS SCORNET, MORLAIX
29;RUE FREDERIC THEISZ, MORLAIX
29;RUE GABRIEL PIERNE, MORLAIX
29;IMP GAMBETTA, MORLAIX
29;RUE GAMBETTA, MORLAIX
29;PL DE LA GARE, MORLAIX
29;RTE DE GARLAN, MORLAIX
29;RUE GAL BORGNIS DESBORDES, MORLAIX
29;RUE GAL DE TROMELIN, MORLAIX
29;RUE GENERAL LE FLO, MORLAIX
29;IMP DES GENETTES, MORLAIX
29;RUE GEORGES BOULLET, MORLAIX
29;RUE GEORGES CLEMENCEAU, MORLAIX
29;RUE GERMAIN MARTIN, MORLAIX
29;IMP GEORGES BRASSENS, MORLAIX
29;RUE GEORGES BRASSENS, MORLAIX
29;RUE DES GLYCINES, MORLAIX
29;IMP DES TANNERIES, MORLAIX
29;RUE DE GOTTINGEN, MORLAIX
29;RUE GRAND RUE, MORLAIX
29;IMP GDE VENELLE, MORLAIX
29;RUE GUILLAUME BALAY, MORLAIX
29;RUE GUILLAUME CHATEL, MORLAIX
29;RUE GUILLAUME LE JEAN, MORLAIX
29;RUE GUY LE NORMAND, MORLAIX
29;RUE GUSTAVE CLUZERET, MORLAIX
29;RUE GUSTAVE COURBET, MORLAIX
29;RUE GUSTAVE LEFRANCAIS, MORLAIX
29;PL DES HALLES, MORLAIX
29;VEN DES HALLES, MORLAIX
29;RUE HAUTE, MORLAIX
29;IMP HENRI DE TOULOUSE LAUTREC, MORLAIX
29;RUE HENRI MATISSE, MORLAIX
29;RUE HENT AR HOAT, MORLAIX
29;RUE DU HENT COZ, MORLAIX
29;RUE DES HERMINES, MORLAIX
29;RUE HIPPOLYTE VIOLEAU, MORLAIX
29;CHE DE L HOSPICE, MORLAIX
29;RUE DE L HOSPICE, MORLAIX
29;RUE DE L'ILE AUX DAMES, MORLAIX
29;IMP ILE AR BEG LEMM, MORLAIX
29;RUE DE L'ILE CALLOT, MORLAIX
29;IMP DE L'ILE LOUET, MORLAIX
29;IMP DE L'ILE NOIRE, MORLAIX
29;RUE DE L'ILE STEREC, MORLAIX
29;RUE INGENIEUR FENOUX, MORLAIX
29;RUE DE L'ILE VERTE, MORLAIX
29;PL DES JACOBINS, MORLAIX
29;RUE JACQUELINE AURIOL, MORLAIX
29;IMP JACQUES BREL, MORLAIX
29;RUE DES JARDINS, MORLAIX
29;RUE JEAN BAPTISTE CLEMENT, MORLAIX
29;IMP JEAN BART, MORLAIX
29;RUE JEAN BART, MORLAIX
29;RUE JEAN CAEROU, MORLAIX
29;RUE JEAN DE TRIGON, MORLAIX
29;IMP JEAN GIONO, MORLAIX
29;RUE JEAN JAURES, MORLAIX
29;RUE JEAN FRANCOIS PERIOU, MORLAIX
29;RUE JEAN LOUIS PINDY, MORLAIX
29;RUE JEAN MOULIN, MORLAIX
29;RUE JEAN RIOU, MORLAIX
29;RUE JEAN YVES GUILLARD, MORLAIX
29;RUE JEANNE BOHEC, MORLAIX
29;RUE JOSEPH FAUCHEUR, MORLAIX
29;RUE JULES MIOT, MORLAIX
29;RUE JULES VALLES, MORLAIX
29;CHE DE KERAMPUS, MORLAIX
29;IMP DE KERAUDY, MORLAIX
29;CHE DE KERDANIEL, MORLAIX
29;RUE KERDANIEL, MORLAIX
29;RUE DE KEREDERN, MORLAIX
29;RUE DE KERFRAVAL, MORLAIX
29;RUE DE KERGARIOU, MORLAIX
29;AV DE KERHUEL, MORLAIX
29;IMP KERJEAN, MORLAIX
29;PL DE KERJOAIC, MORLAIX
29;RUE DE KERJOAIC, MORLAIX
29;RUE DE KERMADIOU, MORLAIX
29;IMP DE KERMAHOTOU, MORLAIX
29;ALL DE KERMARIA, MORLAIX
29;RUE DE KERMARIA, MORLAIX
29;AV DE KERNEGUEZ, MORLAIX
29;RUE DE KEROC'HIOU, MORLAIX
29;RUE DE KERSAINT GILLY, MORLAIX
29;IMP DE KERSCOFF, MORLAIX
29;RUE DE KERSCOFF, MORLAIX
29;RUE DE KERVEGUEN, MORLAIX
29;CHE DE KERVOAL, MORLAIX
29;RUE LAENNEC, MORLAIX
29;PL AU LAIT, MORLAIX
29;RTE DE LANMEUR, MORLAIX
29;RUE DE LANMEUR, MORLAIX
29;CHE DE LANNIDY, MORLAIX
29;RTE DE LANNION, MORLAIX
29;RUE DES LAVOIRS, MORLAIX
29;VEN DU LAVOIRS, MORLAIX
29;RUE LENINE, MORLAIX
29;QUAI DE LEON, MORLAIX
29;RUE LEONARD DE VINCI, MORLAIX
29;RUE LONGUE, MORLAIX
29;RUE LOUIS AMSTRONG, MORLAIX
29;RUE LOUIS BLANQUI, MORLAIX
29;RUE LOUIS CHALAIN, MORLAIX
29;RUE LOUIS DELESCLUZE, MORLAIX
29;RUE LOUIS DUPOUX, MORLAIX
29;RUE LOUISE MICHEL, MORLAIX
29;RUE LOUIS EUGENE VARLIN, MORLAIX
29;RUE LOUIS LE GUENNEC, MORLAIX
29;RUE LOUIS LE JEUNE, MORLAIX
29;RUE LOUIS PASTEUR, MORLAIX
29;AV DU LYCEE, MORLAIX
29;PL DU LYCEE, MORLAIX
29;PL DE LA MADELEINE, MORLAIX
29;RUE DE LA MADELEINE, MORLAIX
29;VEN DE LA MADELEINE, MORLAIX
29;RUE DES MAGNOLIAS, MORLAIX
29;IMP MAHALIA JACKSON, MORLAIX
29;RUE LA MAISON DE PAILLE, MORLAIX
29;PARC MARCHAD, MORLAIX
29;RUE DU MARECHAL FOCH, MORLAIX
29;RUE DU MARECHAL LECLERC, MORLAIX
29;PL DU MARHALLACH, MORLAIX
29;RPE DU MARC HALLAC H, MORLAIX
29;RUE MAURICE DENIS, MORLAIX
29;RUE MAURICE LE LUC, MORLAIX
29;CHE DU MEN GUEN, MORLAIX
29;VEN DU MEN GUEN, MORLAIX
29;IMP DES MESANGES, MORLAIX
29;RUE MICHEL BAKOUNINE, MORLAIX
29;RUE MICHEL BEHIC, MORLAIX
29;RUE MICHELET, MORLAIX
29;RUE DES MIMOSAS, MORLAIX
29;IMP DES MOUETTES, MORLAIX
29;RUE MOULIN DE LA CHEVRE, MORLAIX
29;RUE DU MUR, MORLAIX
29;RUE NATHALIE LE MEL, MORLAIX
29;ROC NORD EST, MORLAIX
29;RUE NOTRE DAME, MORLAIX
29;RUE DES OISEAUX, MORLAIX
29;RUE OLYMPE DE GOUGES, MORLAIX
29;RUE DE L OREE DU BOIS, MORLAIX
29;PL DES OTAGES, MORLAIX
29;IMP PABLO PICASSO, MORLAIX
29;RUE DE LA PAIX, MORLAIX
29;RUE DU PALAIS, MORLAIX
29;AV DU PARC, MORLAIX
29;RTE DE PARC AN BERT, MORLAIX
29;IMP PARC AN ABAT, MORLAIX
29;RUE DE PARC AN BERT, MORLAIX
29;RUE DU PARC AU DUC, MORLAIX
29;VEN DU PARC AU DUC, MORLAIX
29;RTE DE PARC HAMON, MORLAIX
29;RTE DE PARIS, MORLAIX
29;RUE DE PARIS, MORLAIX
29;RUE PAUL CEZANNE, MORLAIX
29;RUE PAUL GAUGUIN, MORLAIX
29;IMP PAUL LEAUTAUD, MORLAIX
29;RUE PAUL SERUSIER, MORLAIX
29;RUE DE PEN AN TRAON, MORLAIX
29;ALL DE PEN AR GUER, MORLAIX
29;RUE DE PEN AN RU, MORLAIX
29;RUE DES PERDRIX, MORLAIX
29;IMP PERROT, MORLAIX
29;RUE DES PERVENCHES, MORLAIX
29;RUE DU PETIT ROBINSON, MORLAIX
29;RUE PICHODOU, MORLAIX
29;IMP PIERRE CORLE, MORLAIX
29;RUE PIERRE CORLE, MORLAIX
29;RUE PIERRE DANTEC, MORLAIX
29;RUE PIERRE SEMARD, MORLAIX
29;RUE PILLOT, MORLAIX
29;VEN AUX PIPES, MORLAIX
29;RUE DES PLATANES, MORLAIX
29;RTE DE PLOUGASNOU, MORLAIX
29;RUE DE PLOUGASNOU, MORLAIX
29;RUE DE PLOUJEAN, MORLAIX
29;RTE DE PLOURIN, MORLAIX
29;RUE DE PLOURIN, MORLAIX
29;ALL DU POAN BEN, MORLAIX
29;IMP DES POIRIERS, MORLAIX
29;RUE DES POMMIERS, MORLAIX
29;RUE DU PONT COZ, MORLAIX
29;RUE DU PONT NOTRE DAME, MORLAIX
29;RUE DU PONT SAINTE MARTHE, MORLAIX
29;RUE DE PORS AN TREZ, MORLAIX
29;RUE DE PORS AR BAYEC, MORLAIX
29;RUE DE PORS LAND, MORLAIX
29;RUE DU PORSMEUR, MORLAIX
29;RPE SAINT MELAINE, MORLAIX
29;RUE PORSMOGUER, MORLAIX
29;PARC POTIC, MORLAIX
29;CITE DU POULFANC, MORLAIX
29;RUE POULFANC, MORLAIX
29;PL DU POULIET, MORLAIX
29;VEN DES PRAIRIES, MORLAIX
29;VEN AUX PRETRES, MORLAIX
29;VEN DU QUEFFLEUTH, MORLAIX
29;ESC QUIVIGER, MORLAIX
29;PL RENE CASSIN, MORLAIX
29;IMP RPE SAINT NICOLAS, MORLAIX
29;RUE DES RENARDS, MORLAIX
29;RUE DE REO, MORLAIX
29;AV DE LA REPUBLIQUE, MORLAIX
29;IMP DES RESERVOIRS, MORLAIX
29;RUE DES RESERVOIRS, MORLAIX
