29;RES DES CHENES, ARGOL
29;LOT AR FEUNTEUN, ARGOL
29;LOT KOAD BIZOUDARD, ARGOL
29;LOT GOAREM VANEL 1, ARGOL
29;ZA KROAZ AR MAO, ARGOL
29;LOT GOAREM VANEL 2, ARGOL
29;RES KERVILAR, ARGOL
29;LOT DE KER YS, ARGOL
29;LOT PARK KAOLENN, ARGOL
29;LOT PARK PHILIPP, ARGOL
29;RES DE PONT LORBIC, ARGOL
29;LOT DU ROI GRADLON, ARGOL
29;CITE DU ROI GRADLON, ARGOL
29;CITE KERVILAR, ARGOL
29;LOT LES HAUTS DE KERNERON, ARGOL
29;RES DE KERNERON, ARGOL
29;PL DES ANCIENS COMBATTANTS, ARGOL
29;RUE DES CAMELIAS, ARGOL
29;RUE DES CERISIERS, ARGOL
29;RUE DES CHATAIGNIERS, ARGOL
29;RUE DE L'ECOLE, ARGOL
29;PL DE L EGLISE, ARGOL
29;RTE DE LA FONTAINE BLANCHE, ARGOL
29;VC GARENNE URBEN, ARGOL
29;RTE DE LA GARE, ARGOL
29;RTE DE GOAREM AN ABAT, ARGOL
29;RUE DE GOAREM VANEL, ARGOL
29;RUE DES HORTENSIAS, ARGOL
29;RTE DE KERNEYET, ARGOL
29;RTE DE KERNERON, ARGOL
29;RTE DE KERSPRIGENT, ARGOL
29;RUE DE LA MAIRIE, ARGOL
29;RTE DU MOULIN, ARGOL
29;ALL DES NOISETIERS, ARGOL
29;RTE DE PEN AR ROZ, ARGOL
29;RTE DE PENTREZ, ARGOL
29;RTE DE PONT LORBIC, ARGOL
29;RUE DES POMMIERS, ARGOL
29;RTE DU PONT DE TERENEZ, ARGOL
29;RUE DU ROI GRADLON, ARGOL
29;RUE SAINT GUENOLE, ARGOL
29;RTE DE TREGARVAN, ARGOL
29;PL DU VIEUX FOUR, ARGOL
29;PL BOURGOGNE, ARGOL
29;CITE DE LA FONTAINE ST PIERRE, ARZANO
29;LOT LA LANDE ST LAURENT, ARZANO
29;CITE DE PARK BRAZ, ARZANO
29;CITE DES SAULES, ARZANO
29;CITE DU SOLEIL LEVANT, ARZANO
29;CITE DE TY FEUNTEUN, ARZANO
29;RUE AUGUSTE BRIZEUX, ARZANO
29;PL DE L EGLISE, ARZANO
29;CHE DU PRE, ARZANO
29;RUE DE L ELLE, ARZANO
29;RUE DES FIGUIERS, ARZANO
29;RUE DE LA FONTAINE, ARZANO
29;RUE DE GRIMINEL, ARZANO
29;VEN DE GRIMINEL, ARZANO
29;RUE DE KERALVE, ARZANO
29;RUE DE KERAVEL, ARZANO
29;PL DE LA MAIRIE, ARZANO
29;ALL MARIE PELLAN, ARZANO
29;RUE DE PARK BRAZ, ARZANO
29;RUE DES PINS, ARZANO
29;RTE DE PLOUAY, ARZANO
29;RUE DE LA GARENNE, ARZANO
29;RUE DES GENETS, ARZANO
29;RUE DE ROZENDERO, ARZANO
29;RUE SAINT PIERRE, ARZANO
29;RUE DE TREUSCOAT, ARZANO
29;RUE DES TROIS FERMES, ARZANO
29;VIA DI ARZANO, ARZANO
29;HLM KERIVOAS, AUDIERNE
29;LOT DE KERIVOAS, AUDIERNE
29;LOT COMMUNAL DE KERSUDAL, AUDIERNE
29;RES DU GOYEN, AUDIERNE
29;RES DE KERISTUM, AUDIERNE
29;HAM DE LESNOAL, AUDIERNE
29;CITE TOULEMONDE, AUDIERNE
29;LOT DE LA FONTAINE, AUDIERNE
29;HAM DE PARK LANN, AUDIERNE
29;LOT PAROU DE KERMAVIOU, AUDIERNE
29;LOT TAL AR VEIL, AUDIERNE
29;RUE DE L ABBAYE, AUDIERNE
29;RUE ALFRED DE MUSSET, AUDIERNE
29;RUE ALPHONSE DAUDET, AUDIERNE
29;RUE AMBROISE THOMAS, AUDIERNE
29;RUE AMIRAL COURBET, AUDIERNE
29;RUE AMIRAL GUEPRATTE, AUDIERNE
29;RUE AMPERE, AUDIERNE
29;QUAI ANATOLE FRANCE, AUDIERNE
29;IMP ANATOLE LE BRAZ, AUDIERNE
29;RUE ARISTIDE BRIAND, AUDIERNE
29;IMP BEAUMARCHAIS, AUDIERNE
29;RUE BERLIOZ, AUDIERNE
29;RUE DE BIR HAKEIM, AUDIERNE
29;RUE BOILEAU, AUDIERNE
29;IMP DE LA BRUYERE, AUDIERNE
29;RUE CALMETTE, AUDIERNE
29;RUE CAMILLE DESMOULINS, AUDIERNE
29;RTE DU CAP, AUDIERNE
29;RUE DES CAPUCINS, AUDIERNE
29;RUE CARNOT, AUDIERNE
29;VEN CASTEL, AUDIERNE
29;RUE DU CHANOINE LE CORRE, AUDIERNE
29;RUE CHARLES LE GOFFIC, AUDIERNE
29;RUE CHARCOT, AUDIERNE
29;RUE CHARLES PEGUY, AUDIERNE
29;QUAI CAMILLE PELLETAN, AUDIERNE
29;RUE DE CHATEAUBRIAND, AUDIERNE
29;PL CHEVALIER DE LA BARRE, AUDIERNE
29;ALL CORENTIN KERSUAL, AUDIERNE
29;IMP CLAUDE MONET, AUDIERNE
29;RUE COROT, AUDIERNE
29;RUE CONDORCET, AUDIERNE
29;RUE CURIE, AUDIERNE
29;RUE CORNEILLE, AUDIERNE
29;IMP DANIEL BERNARD, AUDIERNE
29;RUE DANIEL GUEZINGAR, AUDIERNE
29;RUE DANTON, AUDIERNE
29;IMP DU 19 MARS 1962, AUDIERNE
29;RUE CLAUDE DEBUSSY, AUDIERNE
29;IMP DES DEPORTES, AUDIERNE
29;RUE D ESTIENNES D ORVES, AUDIERNE
29;RUE DIXMUDE, AUDIERNE
29;RUE DOC FRADET, AUDIERNE
29;RUE DES DROITS DE L HOMME, AUDIERNE
29;PL DE L EGLISE, AUDIERNE
29;RUE EMILE COMBES, AUDIERNE
29;VEN STE ANNE, AUDIERNE
29;RUE EMILE ZOLA, AUDIERNE
29;AV MANU BRUSQ, AUDIERNE
29;RUE ERIC TABARLY, AUDIERNE
29;RUE ERNEST RENAN, AUDIERNE
29;QUAI DE L'EUROPE, AUDIERNE
29;VEN FENELON, AUDIERNE
29;RUE GALLIENI, AUDIERNE
29;RUE DE LA GARENNE, AUDIERNE
29;PL DU GEN DE GAULLE, AUDIERNE
29;RUE GEORGE SAND, AUDIERNE
29;RUE GEORGES BIZET, AUDIERNE
29;RUE GEORGES CLEMENCEAU, AUDIERNE
29;IMP GEORGE SAND, AUDIERNE
29;VEN GOUNOD, AUDIERNE
29;RUE DU GOYEN, AUDIERNE
29;RUE GUYNEMER, AUDIERNE
29;RUE GUEZNO, AUDIERNE
29;RUE GUSTAVE CHARPENTIER, AUDIERNE
29;RUE GAY LUSSAC, AUDIERNE
29;RUE HENRI ROYER, AUDIERNE
29;RUE HOCHE, AUDIERNE
29;RUE DE LA HAIE, AUDIERNE
29;QUAI JACQUES DE THEZAC, AUDIERNE
29;VEN JEAN BAPTISTE LULLY, AUDIERNE
29;RUE HENRI DUNANT, AUDIERNE
29;RUE JACQUES CARTIER, AUDIERNE
29;IMP JEAN BART, AUDIERNE
29;RUE JEAN JACQUES ROUSSEAU, AUDIERNE
29;VEN JEAN JADE, AUDIERNE
29;QUAI JEAN JAURES, AUDIERNE
29;RUE JEAN MOULIN, AUDIERNE
29;RUE JEAN PRIOL, AUDIERNE
29;PL JEAN SIMON, AUDIERNE
29;RUE JULES FERRY, AUDIERNE
29;IMP JULES VERNE, AUDIERNE
29;RUE DE KERGADEC, AUDIERNE
29;RUE DE KERGUELEN, AUDIERNE
29;RUE DE KERHUON, AUDIERNE
29;RUE DE KERYDREUFF, AUDIERNE
29;VEN DE KERIDREUFF, AUDIERNE
29;RUE DE KERIVOAS, AUDIERNE
29;RUE DE KERMABON, AUDIERNE
29;RTE DE KERMAVIOU, AUDIERNE
29;RUE DE KERSUDAL, AUDIERNE
29;RUE KLEBER, AUDIERNE
29;RUE LAENNEC, AUDIERNE
29;IMP DE LA HAIE, AUDIERNE
29;RUE LAISNE, AUDIERNE
29;RUE LAMARTINE, AUDIERNE
29;RUE LAVOISIER, AUDIERNE
29;RUE LEDRU ROLLIN, AUDIERNE
29;PAS DE LA LEGION D'HONNEUR, AUDIERNE
29;RUE LEO DELIBES, AUDIERNE
29;RUE LEON GAMBETTA, AUDIERNE
29;PL LEON GAMBETTA, AUDIERNE
29;IMP LE VERRIER, AUDIERNE
29;PL DE LA LIBERTE, AUDIERNE
29;RUE DE LA LIBERTE, AUDIERNE
29;RUE LOUIS PASTEUR, AUDIERNE
29;IMP LT FRANCOIS LE MEUR, AUDIERNE
29;VEN LULLY, AUDIERNE
29;RUE MARCEAU, AUDIERNE
29;RUE MARCEL PAUL, AUDIERNE
29;RUE MARCELIN BERTHELOT, AUDIERNE
29;RUE MARECHAL LECLERC, AUDIERNE
29;VEN MASSENET, AUDIERNE
29;RUE MAURICE RAVEL, AUDIERNE
29;RUE MAX JACOB, AUDIERNE
29;RUE MERMOZ, AUDIERNE
29;RUE MICHEL LE BARS, AUDIERNE
29;RUE DU MOLE, AUDIERNE
29;RUE MOLIERE, AUDIERNE
29;RUE MONGE, AUDIERNE
29;RUE DES MONTAGNARDS, AUDIERNE
29;RUE DU ONZE NOVEMBRE, AUDIERNE
29;RUE PASCAL, AUDIERNE
29;RUE DU PHARE, AUDIERNE
29;RUE PER JAKEZ HELIAS, AUDIERNE
29;RUE PIERRE BROSSOLETTE, AUDIERNE
29;RUE PIERRE LOTI, AUDIERNE
29;RUE DU 14 JUILLET, AUDIERNE
29;RUE RACINE, AUDIERNE
29;RUE RAMEAU, AUDIERNE
29;RUE RAYMOND COUILLANDRE, AUDIERNE
29;RUE RENE AUTRET, AUDIERNE
29;RUE RENOIR, AUDIERNE
29;PL DE LA REPUBLIQUE, AUDIERNE
29;RUE DE LA RESISTANCE, AUDIERNE
29;RUE ROZ AN DOUR, AUDIERNE
29;RUE ROY, AUDIERNE
29;RUE SAINT SAENS, AUDIERNE
29;RUE DE LA SIRENE, AUDIERNE
29;RUE DE LA SOURCE, AUDIERNE
29;RUE STALINGRAD, AUDIERNE
29;RUE SURCOUF, AUDIERNE
29;RUE THEODORE BOTREL, AUDIERNE
29;RUE VAN PARYS, AUDIERNE
29;RUE DE VERDUN, AUDIERNE
29;RUE VICTOR HUGO, AUDIERNE
29;RUE DU VIEUX MOLE, AUDIERNE
29;RUE VOLTAIRE, AUDIERNE
29;RUE WALDECK ROUSSEAU, AUDIERNE
29;RUE DES ABEILLES, AUDIERNE
29;RUE DES ACACIAS, AUDIERNE
29;RUE DES ALBATROS, AUDIERNE
29;RUE DES ANEMONES, AUDIERNE
29;CHE DE BRIGNEOCH, AUDIERNE
29;RUE DU CABESTAN, AUDIERNE
29;RUE DE LA CALE, AUDIERNE
29;RUE DU CALVAIRE, AUDIERNE
29;RUE DES CAMELIAS, AUDIERNE
29;RUE DES COURLIS, AUDIERNE
29;RUE DU 19 MARS 1962  ESQUIBIEN, AUDIERNE
29;CHE DES DOUANIERS, AUDIERNE
29;RUE DUGUAY TROUIN, AUDIERNE
29;PL DE L EGLISE - ESQUIBIEN, AUDIERNE
29;RUE DES EMBRUNS, AUDIERNE
29;RUE DE LA FONTAINE, AUDIERNE
29;RUE DE LA FRANCE LIBRE, AUDIERNE
29;RUE HENRI ROE, AUDIERNE
29;RUE HENRI SERGENT, AUDIERNE
29;PL DU 8 MAI 1945, AUDIERNE
29;RUE JEAN BART - ESQUIBIEN, AUDIERNE
29;PL JEAN KERAVEC, AUDIERNE
29;BD JEAN MOULIN - ESQUIBIEN, AUDIERNE
29;PL JEAN PERROT, AUDIERNE
29;RUE JEAN PICHAVANT, AUDIERNE
29;IMP JULES FERRY, AUDIERNE
29;RTE DE KERBOUL, AUDIERNE
29;CHE DE KERHUON - ESQUIBIEN, AUDIERNE
29;RUE DE KEROUNOUS, AUDIERNE
29;RUE RENE LAENNEC, AUDIERNE
29;RUE DE LERVILY, AUDIERNE
29;PL DE LA LIBERTE - ESQUIBIEN, AUDIERNE
29;RUE DES MOUETTES, AUDIERNE
29;PL DE L OCEAN, AUDIERNE
29;RUE DU PARC ALEC, AUDIERNE
29;RUE DES PARTISANS, AUDIERNE
29;RTE DE PEULVEN, AUDIERNE
29;RUE PIERRE VELLY, AUDIERNE
29;RTE DE LA PLAGE, AUDIERNE
29;IMP PORS BIHAN, AUDIERNE
29;CHE DE PORSFEUNTEUN, AUDIERNE
29;RUE RAYMOND STEPHAN, AUDIERNE
29;RUE DE LA REPUBLIQUE ESQUIBIE, AUDIERNE
29;PL DE LA RESISTANCE ESQUIBI, AUDIERNE
29;VEN DU REUNIOU, AUDIERNE
29;RUE DE SAINTE EVETTE, AUDIERNE
29;RTE DU SEMAPHORE, AUDIERNE
29;CHE DES SERINGAS, AUDIERNE
29;RUE DU STADE, AUDIERNE
29;ALL SURCOUF - ESQUIBIEN, AUDIERNE
29;RUE SURCOUF - ESQUIBIEN, AUDIERNE
29;RUE TRAVERSE, AUDIERNE
29;RUE VAN PARYS - ESQUIBIEN, AUDIERNE
29;RUE YVES JADE, AUDIERNE
29;BD YVES NORMAND, AUDIERNE
29;CHE DE PEN AN ENEZ, AUDIERNE
29;PLA CHARLES DE GAULLE ESQUIBIE, AUDIERNE
29;IMP DU RENARD, AUDIERNE
29;IMP DE KERGUELEN - ESQUIBIEN, AUDIERNE
29;RUE DE LA CROIX ROUGE, AUDIERNE
29;RTE DE LA POINTE DU RAZ, AUDIERNE
29;IMP DU LANNOU, AUDIERNE
29;IMP DE TOULEMONDE, AUDIERNE
29;IMP DE LA CROIX ROUGE, AUDIERNE
29;RUE JEAN ANSQUER, AUDIERNE
29;IMP DES CAMELIAS, AUDIERNE
29;IMP FEUNTEUN VERO, AUDIERNE
29;IMP KERYOC'H, AUDIERNE
29;VEN DE LANDREVETTE, AUDIERNE
29;RTE DE LEGUERRIOU, AUDIERNE
29;IMP DE LERVILY, AUDIERNE
29;ALL DE LEZONGAR, AUDIERNE
29;RUE DU MOULIN DE KERAUDIERNE, AUDIERNE
29;IMP DE SAINTE EDWETT, AUDIERNE
29;IMP DES MOUETTES, AUDIERNE
29;ALL JEAN MOULIN - ESQUIBIEN, AUDIERNE
29;IMP DU POULDU, AUDIERNE
29;RUE DE SAINT ONNEAU, AUDIERNE
29;RUE DES MIMOSAS, AUDIERNE
29;RTE DU PAROU DE KERMAVIOU, AUDIERNE
29;RUE TAL AR GROAZ, AUDIERNE
29;RTE DE PORSFEUNTEUN, AUDIERNE
29;IMP DES ANEMONES, AUDIERNE
29;CHEM DE FEUNTEUN NOEL, AUDIERNE
29;IMP DE STANG HIR, AUDIERNE
29;RUE DES GRILLONS, AUDIERNE
29;VC HENT PORSFEUNTEUN VIAN, AUDIERNE
29;RTE DE BRIGNEOC'H, AUDIERNE
29;RUE ANNA SAOUZANET, AUDIERNE
29;IMP DES BRISANTS, AUDIERNE
29;IMP PARC ROZ EDERN, AUDIERNE
29;IMP HENT KOZH, AUDIERNE
29;CHE DES DUNES, AUDIERNE
29;RUE EDMOND LARDIC, AUDIERNE
29;PL DE L EMBARCADERE, AUDIERNE
29;IMP FEUNTEUN WARECH, AUDIERNE
29;RTE DE GANNAEG, AUDIERNE
29;PL DE GANNAEG, AUDIERNE
29;RUE DES HORTENSIAS, AUDIERNE
29;RTE DE KERANDRAON, AUDIERNE
29;RUE KREIZ KER, AUDIERNE
29;CHE DE KERSEN, AUDIERNE
29;IMP DU LAVOIR, AUDIERNE
29;IMP DU LEUKAR, AUDIERNE
29;CHE DES MILLEPERTUIS, AUDIERNE
29;IMP PARC ROZ EDERN, AUDIERNE
29;PL RENE LAENNEC, AUDIERNE
29;IMP ROZ AR PREFED, AUDIERNE
29;IMP DU PAROU DU REUNIOU, AUDIERNE
29;IMP DU PEULVEN, AUDIERNE
29;RTE DE PONT CROIX, AUDIERNE
29;IMP DES QUATRE VENTS, AUDIERNE
29;IMP SIMONE VEIL, AUDIERNE
29;IMP DE TREVENOUEN, AUDIERNE
29;IMP DES FREGATES, AUDIERNE
29;IMP DE ROZ KERBOUL, AUDIERNE
29;RES DU BEL AIR, BANNALEC
29;RES EUGENE CADIC, BANNALEC
29;RES MEN GUEN, BANNALEC
29;RES DE LA METAIRIE, BANNALEC
29;RUE DES AJONCS, BANNALEC
29;RUE ANDRE CADIOU, BANNALEC
29;IMP ANJELA DUVAL, BANNALEC
29;ALL DE L ARGOAT, BANNALEC
29;RUE AUGUSTE BAFFET, BANNALEC
29;PAS AUGUSTE BRIZEUX, BANNALEC
29;RUE DU BELOMBRA, BANNALEC
29;RUE ANATOLE LE BRAZ, BANNALEC
29;RUE DE BEL AIR, BANNALEC
29;RUE BELLEVUE, BANNALEC
29;CHE DU BOIS, BANNALEC
29;IMP DES CAMELIAS, BANNALEC
29;RUE CAMILLE BERNIER, BANNALEC
29;CHE DE LA CARRIERE, BANNALEC
29;PL CHARLES DE GAULLE, BANNALEC
29;PL DE LA CHAPELLE, BANNALEC
29;IMP DES CHATAIGNIERS, BANNALEC
29;RUE DU CHATEAU D EAU, BANNALEC
29;RUE DES CHENES, BANNALEC
29;RUE CIMETIERE, BANNALEC
29;RUE DEMI QUART, BANNALEC
29;RUE DUCHESSE ANNE, BANNALEC
29;RUE DE L'ECOLE, BANNALEC
29;PL EMMANUEL ROBIN, BANNALEC
29;VEN DE L ETANG, BANNALEC
29;RUE EUGENE CADIC, BANNALEC
29;RUE EUGENE LOREC, BANNALEC
29;RUE DE LA FARANDOLE, BANNALEC
29;RUE DES FRERES LE GAC, BANNALEC
29;PL DES FUSILLES, BANNALEC
29;RUE DE LA GARE, BANNALEC
29;IMP DES GENETS, BANNALEC
29;RUE GLENMOR, BANNALEC
29;IMP DES GLYCINES, BANNALEC
29;RTE DE LA GRANGE, BANNALEC
29;PL GUY LE GOAPPER, BANNALEC
29;ALL DES HORTENSIAS, BANNALEC
29;RUE DU 8 MAI 1945, BANNALEC
29;RUE ISIDORE COLAS, BANNALEC
29;IMP JEAN BOURHIS, BANNALEC
29;RUE JEAN JAURES, BANNALEC
29;RUE JEAN MOULIN, BANNALEC
29;RUE JOSEPH COTONNEC, BANNALEC
29;RUE JULES FERRY, BANNALEC
29;RUE DE KERBINIOU, BANNALEC
29;IMP DE KERGOALABRE, BANNALEC
29;RUE DE KERGUYADER, BANNALEC
29;RUE DE KERLAGADIC, BANNALEC
29;RUE DE KERLIVER, BANNALEC
29;RUE DE KERVINIC, BANNALEC
29;RUE DES KORRIGANS, BANNALEC
29;RUE DES LANDIERS, BANNALEC
29;PL DE LA LIBERATION, BANNALEC
29;PL DE LA LIBERTE, BANNALEC
29;PL LOUIS LAVAT, BANNALEC
29;RUE LOUISE MICHEL, BANNALEC
29;PAS LUCIEN PICARD, BANNALEC
29;RUE DES LUTINS, BANNALEC
29;RTE DU MANOIR, BANNALEC
29;PL DE LA MARE, BANNALEC
29;RUE MEN GUEN, BANNALEC
29;CHE DES MESANGES, BANNALEC
29;RUE MICHEL YVONNOU, BANNALEC
29;IMP DES MIMOSAS, BANNALEC
29;RTE DE MOULIN NEUF, BANNALEC
29;RUE DU MOULIN ROZHUEL, BANNALEC
29;IMP NATHALIE LE MEL, BANNALEC
29;RUE NATIONALE, BANNALEC
29;IMP DES OLIVIERS, BANNALEC
29;RUE DU ONZE NOVEMBRE 1918, BANNALEC
29;RUE DE L ORATOIRE, BANNALEC
29;PL DE LA PAIX, BANNALEC
29;RUE DE LA PAIX, BANNALEC
29;RUE DE PARC MAR, BANNALEC
29;RUE AUGUSTE SALAUN, BANNALEC
29;RUE PIERRE JAKEZ HELIAS, BANNALEC
29;RUE PIERRE PENDELIO, BANNALEC
29;RUE DES PINSONS, BANNALEC
29;RTE DE PONT AVEN, BANNALEC
29;VEN DE POULGAST, BANNALEC
29;RUE DES PRAIRIES, BANNALEC
29;RUE DU PUITS, BANNALEC
29;RUE DE QUIMPERLE, BANNALEC
29;ALL DU QUINQUIS, BANNALEC
29;IMP RENE LAENNEC, BANNALEC
29;RUE DES ROITELETS, BANNALEC
29;IMP DES ROSES, BANNALEC
29;RUE DES ROSIERS, BANNALEC
29;RUE DE ROSPORDEN, BANNALEC
29;RUE SAINT-JEAN-BOSCO, BANNALEC
29;RUE SAINT LUCAS, BANNALEC
29;RUE DE ST THURIEN, BANNALEC
29;RUE DE SCAER, BANNALEC
29;VEN DE LA SCIERIE, BANNALEC
29;IMP DES SOURCES, BANNALEC
29;RUE DE STANG TREMEUR, BANNALEC
29;RUE THEODORE BOTREL, BANNALEC
29;RUE DE TREMEUR, BANNALEC
29;RUE DU TREVOUX, BANNALEC
29;RUE DE VERDUN, BANNALEC
29;IMP DU VERGER, BANNALEC
29;IMP DU VERGER FERREC, BANNALEC
29;CHE DE LA VILLENEUVE, BANNALEC
29;RUE VINCENT VIDAL, BANNALEC
29;RUE XAVIER GRALL, BANNALEC
29;RUE YVES LOUARN, BANNALEC
29;PL YVES TANGUY, BANNALEC
29;RUE YVES TANGUY, BANNALEC
29;CITE DE KERNEVEZ, BAYE
29;LOT PARC AR GROASSANT, BAYE
29;HAM DE PRAT MARC H, BAYE
29;CITE DE RUMERIOU, BAYE
29;LOT DE TI BLEUENN, BAYE
29;LOT TY ARMOR -  RTE DE L ISLE, BAYE
29;RES DU VERGER DU PRESBYTERE, BAYE
29;RUE JEAN MARIE CARER, BAYE
29;IMP AN DRISKI, BAYE
29;RUE AN DRISKI, BAYE
29;RUE AN PENNDUIGED, BAYE
29;RUE AR BEUFIGED, BAYE
29;RUE AR FILIPED, BAYE
29;IMP AR GLAOUERED, BAYE
29;RTE DE L'ISLE, BAYE
29;IMP DE L'ISLE, BAYE
29;IMP DE LA FONTAINE, BAYE
29;CHE DES LAVOIRS, BAYE
29;RTE DE KERBRIS, BAYE
29;RTE DE KERHUEL, BAYE
29;IMP DE KERHUEL, BAYE
29;RTE DE LA MADELEINE, BAYE
29;IMP PARK FORN, BAYE
29;RTE DE MOELAN, BAYE
29;RTE DE PARK FLOUREN, BAYE
29;IMP PARK MENHIR, BAYE
29;RTE DE POULTREO, BAYE
29;RTE DE LOCQUILLEC, BAYE
29;IMP DE KERNEVEZ, BAYE
29;RTE DE QUIMPERLE, BAYE
29;RTE DE RIEC, BAYE
29;IMP SAINT ELOI, BAYE
29;RTE DE SAINT GILLES, BAYE
29;RTE DE SAINT ILEC, BAYE
29;RUE DE TALBOTEC, BAYE
29;ZA KERGAOUEN, BENODET
29;RES DE LA MER BLANCHE, BENODET
29;RUE DES ACACIAS, BENODET
29;IMP DES ACACIAS, BENODET
29;RUE DES AJONCS, BENODET
29;IMP ALAVOINE, BENODET
29;RUE ALAVOINE, BENODET
29;RUE ANATOLE LE BRAZ, BENODET
29;AV DE L ANSE DE PENFOUL, BENODET
29;ALL AR GALL, BENODET
29;IMP DE L'AUBEPINE, BENODET
29;RUE DES AZALEES, BENODET
29;RUE DE BELLE ILE, BENODET
29;RUE BOUGAINVILLE, BENODET
29;IMP DE BOUILLENOU, BENODET
29;AV BOUILLOUX LAFONT, BENODET
29;RUE BRIZEUX, BENODET
29;RUE DES BRUYERES, BENODET
29;RUE DES CAMELIAS, BENODET
29;IMP DE CARN PALUD, BENODET
29;RUE DU CANVEZ, BENODET
29;RTE DE CLOHARS FOUESNANT, BENODET
29;PL CHARLES DE GAULLE, BENODET
29;RUE COAT FAO, BENODET
29;QUAI DU CDT L HERMINIER, BENODET
29;COR DE LA PLAGE, BENODET
29;RUE DE CORNOUAILLE, BENODET
29;IMP DE CREAC H CONARD, BENODET
29;RUE DES DEUX AVIATEURS, BENODET
29;RUE DUGUAY TROUIN, BENODET
29;IMP DUMONT D URVILLE, BENODET
29;RUE DUQUESNE, BENODET
29;RUE DE L EGLISE, BENODET
29;IMP DES EGLANTINES, BENODET
29;RUE EMILE SIMON, BENODET
29;RUE EMILE ZOLA, BENODET
29;RUE D ESTIENNE D ORVES, BENODET
29;COR DE L'ESTUAIRE, BENODET
29;AV DU FORT, BENODET
29;RUE DE FORT CIGOGNE, BENODET
29;AV DE FOUESNANT, BENODET
29;RTE DE FOUESNANT, BENODET
29;ALL FREDERIC LE GUYADER, BENODET
29;ALL DES FRERES CLEMENT, BENODET
29;PL GAUGUIN, BENODET
29;RUE DES GENETS, BENODET
29;RUE DES GLENAN, BENODET
29;ALL GUILLAUTEC, BENODET
29;IMP DE CREISENGUER, BENODET
29;CHE DE GREISENGUER, BENODET
29;RUE DES GREBES, BENODET
29;RUE DES GRIVES, BENODET
29;COR DE GROASGUEN, BENODET
29;RTE DE GUENODOU, BENODET
29;RTE DE GUERVEUR, BENODET
29;IMP GWEZ KIGNEZ, BENODET
29;ALL GUIAUTEC, BENODET
29;RUE HAUTE FONTAINE, BENODET
29;RUE DE GUIRIDEN, BENODET
29;RUE DE KERAMBECHENNEC, BENODET
29;AV HENT GLAZ, BENODET
29;IMP DU HENT GLAZ, BENODET
29;ALL DES HORTENSIAS, BENODET
29;RUE JACQUES CARTIER, BENODET
29;IMP JAOUEN, BENODET
29;RUE JEAN BART, BENODET
29;RUE JEAN CHARCOT, BENODET
29;AV JEAN MARIE DANIEL, BENODET
29;RUE JOACHIM DU BELLAY, BENODET
29;RTE DE JOUALIS, BENODET
29;RUE JULES VERNE, BENODET
29;CHE DE KERANGALES, BENODET
29;IMP DE KERANGALES, BENODET
29;RUE KAZ KOAD, BENODET
29;RTE DE KERANGALES, BENODET
29;RUE DE KERANGUYON, BENODET
29;IMP DE KERANGUYON VIHAN, BENODET
29;IMP DE KERCONAN BIHAN, BENODET
29;RTE DE KER C HEN, BENODET
29;AV DE KERCREVEN, BENODET
29;RTE DE KERAVEN VRAZ, BENODET
29;RTE DE KERGARIOU, BENODET
29;RUE DE KERGAOUEN, BENODET
29;RTE DE KERGUELL, BENODET
29;RUE DE KERGUELEN, BENODET
29;RTE DE KERMINE, BENODET
29;IMP DE KERMADEC, BENODET
29;ALL DE KERLIDOU, BENODET
29;VEN DE KERLOCH, BENODET
29;IMP KERLOCH, BENODET
29;RUE DE KERLOCH, BENODET
29;ALL DE KERMOOR, BENODET
29;RTE DE KERNEOST, BENODET
29;CHE DE KERHOS, BENODET
29;CHE DE KERSALE, BENODET
29;CHE DE KERNILIS, BENODET
29;RUE DE KERSALE, BENODET
29;RTE DE KERLENAR, BENODET
29;IMP DE KERLIEZEC VIHAN, BENODET
29;RUE RODOLPHE KOECHLIN, BENODET
29;AV DE KERSALE, BENODET
29;RUE DES KORRIGANS, BENODET
29;RUE DES LABBES, BENODET
29;RUE LAENNEC, BENODET
29;RUE DES LAURIERS, BENODET
29;RUE LE MORDANT, BENODET
29;IMP DU LETTY, BENODET
29;RTE DU LETTY, BENODET
29;ALL DE LICHAVEN, BENODET
29;RUE DES LILAS, BENODET
29;RUE DES MAGNOLIAS, BENODET
29;RUE MARIE PASTEUR, BENODET
29;RUE DE MENEZ BRAS, BENODET
29;RTE DE MENEZ KERHOLVEN, BENODET
29;PL DU MENEYER, BENODET
29;RUE DU MENEYER, BENODET
29;RUE DE MENEZ FROST, BENODET
29;IMP DE MENEZ KERNUN, BENODET
29;CHE DE MENEZ LAE, BENODET
29;IMP DE MENEZ GROAS, BENODET
29;AV DE LA MER, BENODET
29;COR DE LA MER, BENODET
29;RUE DES MIMOSAS, BENODET
29;RUE MOLENE, BENODET
29;RUE DES MOUETTES, BENODET
29;RUE DES MOUTONS, BENODET
29;ALL DES NAVIGATEURS, BENODET
29;VEN NOTRE DAME DE LA MER, BENODET
29;AV DE L ODET, BENODET
29;RUE DES OLIVIERS, BENODET
29;VEN DES ORMEAUX, BENODET
29;IMP DE PARK LANN, BENODET
29;RUE PARK PELLA, BENODET
29;IMP DE PEN AR CREAC'H, BENODET
29;RTE PEN AR CREACH, BENODET
29;RUE DE PENFOUL, BENODET
29;IMP DE PENFOUL HUELLA, BENODET
29;RUE DES PETRELS, BENODET
29;RUE DES PEUPLIERS, BENODET
29;RTE DE PERGUET, BENODET
29;RUE DU PHARE, BENODET
29;RUE DE PENFRET, BENODET
29;AV DE LA PLAGE, BENODET
29;RUE DES PLUVIERS, BENODET
29;RTE DE POULMIC, BENODET
29;RTE DE POULPRY, BENODET
29;RUE DU POULQUER, BENODET
29;IMP DE POUL RANIKET, BENODET
29;RUE DU PRE BAS, BENODET
29;RUE DES PRIMEVERES, BENODET
29;RTE DE QUIMPER, BENODET
29;RUE DES RHODODENDRONS, BENODET
29;IMP DU ROND POINT DU PHARE, BENODET
29;AV DES ROSEAUX, BENODET
29;RUE DE RUZ CONAN, BENODET
29;ALL SAINT GILDAS, BENODET
29;VEN DE ST MICHEL, BENODET
29;RTE DE ST THOMAS, BENODET
29;ALL SAINTE THERESE, BENODET
29;RUE SIMONE VEIL, BENODET
29;IMP DU SONNEUR, BENODET
29;RUE DES STERNES, BENODET
29;RUE SURCOUF, BENODET
29;IMP THEODORE BOTREL, BENODET
29;IMP TI BANAL, BENODET
29;RTE DE TY COAT, BENODET
29;IMP DE TI TRAON, BENODET
29;RUE DU TOURIGOU, BENODET
29;IMP TY VEN DERO, BENODET
29;RTE DU VOAZEL, BENODET
29;ALL TOURIGOU HUELLA, BENODET
29;RTE DE TOURIGOU, BENODET
29;RTE DE TY PIN, BENODET
29;RUE DE TOURVILLE, BENODET
29;RTE DE TREVOURDA, BENODET
29;RUE DU TREZ, BENODET
29;VEN DE TY MEN, BENODET
29;VEN DE TY SABLE, BENODET
29;RUE VEN DERO, BENODET
29;IMP XAVIER GRALL, BENODET
29;ZONE ARTISANALE, BERRIEN
29;CITE DE BELLEVUE, BERRIEN
29;LOT DE KERMARIA, BERRIEN
29;CITE DES LAURIERS, BERRIEN
29;LOT MENEZ MOLVE, BERRIEN
29;RUE DE L'ANCIENNE FORGE, BERRIEN
29;RTE DE BELLEVUE, BERRIEN
29;VEN CARN AR VERGER, BERRIEN
29;RUE DU CHATEAU D'EAU, BERRIEN
29;PL DU 19 MARS 1962, BERRIEN
29;RUE DES ECOLIERS, BERRIEN
29;RTE DE GOASTANG, BERRIEN
29;IMP DU GOUREN, BERRIEN
29;RTE DE HUELGOAT, BERRIEN
29;VC HENT MEN ZAO, BERRIEN
29;RTE DE LA FEUILLEE, BERRIEN
29;RUE DU LAVOIR, BERRIEN
29;RUE DES MAQUISARDS, BERRIEN
29;RUE DES MONTS D'ARREE, BERRIEN
29;RTE DU POULIC, BERRIEN
29;RUE SAINTE BARBE, BERRIEN
29;RTE DE SCRIGNAC, BERRIEN
29;RUE TI FORN, BERRIEN
29;RUE DES TOURBIERES, BERRIEN
29;IMP DES TOURTERELLES, BERRIEN
29;RTE DE LA MONTAGNE, BERRIEN
29;RUE DU FORGERON, BERRIEN
29;RUE DE LA FONTAINE, BERRIEN
29;ALL FLEURIE, BERRIEN
29;ALL DES SOURCES, BERRIEN
29;CITE DES BRUYERES, BEUZEC CAP SIZUN
29;CITE DE ROSCO, BEUZEC CAP SIZUN
29;CITE DE TY GLAZ, BEUZEC CAP SIZUN
29;RUE DES AJONCS, BEUZEC CAP SIZUN
29;VC HENT AN AOD, BEUZEC CAP SIZUN
29;RUE AN AVEL MOR, BEUZEC CAP SIZUN
29;VC HENT BEG AR VAN, BEUZEC CAP SIZUN
29;RUE DES BRUYERES, BEUZEC CAP SIZUN
29;VC HENT CASTEL DOUR, BEUZEC CAP SIZUN
29;RUE DU CORDONNIER, BEUZEC CAP SIZUN
29;PL YVES DALM, BEUZEC CAP SIZUN
29;RUE DE L'ECOLE, BEUZEC CAP SIZUN
29;RUE HENRI MATISSE, BEUZEC CAP SIZUN
29;RTE DE LA FONTAINE, BEUZEC CAP SIZUN
29;RUE DE LA FONTAINE, BEUZEC CAP SIZUN
29;PL DE LA FORGE, BEUZEC CAP SIZUN
29;RTE DU GARDE F COTONEA, BEUZEC CAP SIZUN
29;RUE DE LA GARE, BEUZEC CAP SIZUN
29;VC HENT GARREG TOUL, BEUZEC CAP SIZUN
29;IMP DES GLYCINES, BEUZEC CAP SIZUN
29;ALL DES GRIVES, BEUZEC CAP SIZUN
29;IMP DES HAIES, BEUZEC CAP SIZUN
29;VC HENT BEG NIVOT, BEUZEC CAP SIZUN
29;RTE DE KASTEL KOZ, BEUZEC CAP SIZUN
29;RTE DE KERANNOU, BEUZEC CAP SIZUN
29;RTE DE KERBALANNEC, BEUZEC CAP SIZUN
29;VC HENT KERBEUZEC, BEUZEC CAP SIZUN
29;VC HENT KERERGANT, BEUZEC CAP SIZUN
29;VC HENT KERGONAN, BEUZEC CAP SIZUN
29;RTE DE KERLOM, BEUZEC CAP SIZUN
29;RTE DE KERODORET, BEUZEC CAP SIZUN
29;RTE DE KEROUANT VIAN, BEUZEC CAP SIZUN
29;VC BOIS DE KERSUDAL, BEUZEC CAP SIZUN
29;RTE DE KERVEN, BEUZEC CAP SIZUN
29;RUE KREIZ KER, BEUZEC CAP SIZUN
29;VC KROAZ AL LAN, BEUZEC CAP SIZUN
29;CHE DE LEZUGARD, BEUZEC CAP SIZUN
29;RTE DE LUGUENEZ, BEUZEC CAP SIZUN
29;PL DE LA MAIRIE, BEUZEC CAP SIZUN
29;VC HENT AR MELENNEC, BEUZEC CAP SIZUN
29;VC MENEZ KERLAY, BEUZEC CAP SIZUN
29;VC HENT MESMEUR, BEUZEC CAP SIZUN
29;RTE DU MILLIER, BEUZEC CAP SIZUN
29;VC HENT MISTRIZIG, BEUZEC CAP SIZUN
29;ALL DES MOUETTES, BEUZEC CAP SIZUN
29;ALL DES PECHEURS, BEUZEC CAP SIZUN
29;VC HENT PEN BIHAN, BEUZEC CAP SIZUN
29;RTE DU PHARE, BEUZEC CAP SIZUN
29;IMP DES PINS, BEUZEC CAP SIZUN
29;VC HENT AR PON, BEUZEC CAP SIZUN
29;VC HENT PORS KIOL, BEUZEC CAP SIZUN
29;RTE DE PORS PERON, BEUZEC CAP SIZUN
29;VC HENT PORS PIRON, BEUZEC CAP SIZUN
29;ALL DU POURQUOI PAS, BEUZEC CAP SIZUN
29;VC HENT AR PUNS, BEUZEC CAP SIZUN
29;ALL DES ROSEAUX, BEUZEC CAP SIZUN
29;VC ROZ AR ROCH, BEUZEC CAP SIZUN
29;ALL ROZ AVEL, BEUZEC CAP SIZUN
29;RTE DE SAINT BUDOC, BEUZEC CAP SIZUN
29;RTE DE SANSPEZ, BEUZEC CAP SIZUN
29;RTE DU STADE, BEUZEC CAP SIZUN
29;RUE DU STADE, BEUZEC CAP SIZUN
29;VC HENT TREMOAN, BEUZEC CAP SIZUN
29;VC HENT AR VEIL COZ, BEUZEC CAP SIZUN
29;VC HENT AR VILIEN, BEUZEC CAP SIZUN
29;CHEM DU VRETIN, BEUZEC CAP SIZUN
29;HAM DU CANARDIC, BODILIS
29;HAM DE COAT REUN, BODILIS
29;LOT COMMUNAL, BODILIS
29;HAM DE CREAC'H GUIAL, BODILIS
29;HAM DE CROAS AR SANT, BODILIS
29;HAM DU GUERNEVEZ, BODILIS
29;HAM DE KERANDIVEZ, BODILIS
29;HAM DE MESSIOU AR GUERENT, BODILIS
29;HAM DE MOUSTER PAUL, BODILIS
29;LOT DU PETIT BOIS, BODILIS
29;HAM DES QUATRE VENTS, BODILIS
29;HAM DES 4 BARRIERES MANER SOUL, BODILIS
29;HAM DU QUINQUIS, BODILIS
29;RUE DE L ANCIENNE FORGE, BODILIS
29;RUE DE LA BAN, BODILIS
29;RUE DU BUGN, BODILIS
29;ALL DES CALVAIRES, BODILIS
29;RUE DES CAPUCINES, BODILIS
29;RUE DES CHATAIGNIERS, BODILIS
29;RUE DES CHENES, BODILIS
29;RTE DE CROAS AR SANT, BODILIS
29;RUE DE L'ECOLE, BODILIS
29;IMP DE LA GARENNE MANER SOUL, BODILIS
29;PL D HOLBETON, BODILIS
29;RUE DES HORTENSIAS, BODILIS
29;RUE DE LOIEZ AR FLOCH, BODILIS
29;RTE DE MANER SOUL, BODILIS
29;IMP DE MESSIOU AR GUERENT, BODILIS
29;RUE DES NOISETIERS, BODILIS
29;RUE NOTRE DAME, BODILIS
29;RUE DES PEUPLIERS, BODILIS
29;IMP DES 4 VENTS MANER SOUL, BODILIS
29;RUE DES TILLEULS, BODILIS
29;RTE DU VILLARS, BODILIS
29;IMP DE KEROURIEN, BODILIS
29;CLOS DU BOIS, BOHARS
29;LOT LES MEUNIERES, BOHARS
29;HAM DE KERGUILLO, BOHARS
29;HAM DU PONCHOU, BOHARS
29;RES LA VALLEE, BOHARS
29;RES DU COTEAU, BOHARS
29;LOT MOULIN DU RUFA, BOHARS
29;LOT DE PENFELD IZELLA, BOHARS
29;RTE DEPARTEMENTALE 5, BOHARS
29;RTE DEPARTEMENTALE 67, BOHARS
29;RTE DEPARTEMENTALE 3, BOHARS
29;VC 1, BOHARS
29;VC 2, BOHARS
29;VC 3, BOHARS
29;VC 5, BOHARS
29;VC 6, BOHARS
29;VC 7, BOHARS
29;VC 8, BOHARS
29;VC 9, BOHARS
29;VC 10, BOHARS
29;VC 11, BOHARS
29;IMP DES ALOUETTES, BOHARS
29;RUE ANGELA DUVAL, BOHARS
29;RUE AR FEUNTEUN, BOHARS
29;IMP AR FOENNOG, BOHARS
29;PAS ARMAND SEGUIN, BOHARS
29;RUE DE BOHARS AR COAT, BOHARS
29;IMP AR ROZIG, BOHARS
29;IMP DES BOUVREUILS, BOHARS
29;RUE BRIZEUX, BOHARS
29;RTE DU BOURG, BOHARS
29;IMP DU BEUZIT, BOHARS
29;RUE DU BEUZIT HUELLA, BOHARS
29;RUE DU BEUZIT IZELLA, BOHARS
29;IMP DES CHARDONNERETS, BOHARS
29;ALL DES CHATAIGNIERS, BOHARS
29;PL DES CHENES, BOHARS
29;ALL CLAUDE MONET, BOHARS
29;VEN DU COLOMBIER, BOHARS
29;ALL DU COMMANDANT KIEFFER, BOHARS
29;CHEM DES COQUELICOTS, BOHARS
29;IMP DE CREAC H BELLEC, BOHARS
29;RUE EMILE BERNARD, BOHARS
29;IMP DES FAUVETTES, BOHARS
29;RUE FRANCOIS DROGOU, BOHARS
29;IMP DE LA GARENNE, BOHARS
29;IMP DES GENETS, BOHARS
29;RTE DE GUILLERMIT, BOHARS
29;IMP GUSTAVE LOISEAU, BOHARS
29;IMP GWAREMM AR PONT, BOHARS
29;PL DES HETRES, BOHARS
29;ALL DES IRIS, BOHARS
29;ALL DES JARDINS DE TALARN, BOHARS
29;RUE J MICHEL HUON DE KERMADEC, BOHARS
29;CHEM DES JONQUILLES, BOHARS
29;RTE DE KERAMEZEC, BOHARS
29;IMP DE KERAMEZEC, BOHARS
29;ALL DE KERAMPIR COZ, BOHARS
29;CHE DE KERANGALL, BOHARS
29;RTE DE KERDONVAL, BOHARS
