29;RUE JACQUES PARIS DE BOLLARDIE, PLUGUFFAN
29;RUE JACQUES ANDRIEUX, PLUGUFFAN
29;RUE JEAN CAM, PLUGUFFAN
29;RUE JACQUES BREL, PLUGUFFAN
29;RUE JEAN MERMOZ, PLUGUFFAN
29;RUE JACQUELINE AURIOL, PLUGUFFAN
29;RUE JEAN MOULIN, PLUGUFFAN
29;ALL JEANNE MALIVEL, PLUGUFFAN
29;RUE JEFF LE PENVEN, PLUGUFFAN
29;RUE JEAN VICTOR RIOU, PLUGUFFAN
29;IMP DE KERANGWEN, PLUGUFFAN
29;RUE DE KERANGWEN, PLUGUFFAN
29;CHE DE KERFENEG, PLUGUFFAN
29;CHE DE KERGANOU, PLUGUFFAN
29;CHE DE KERJOZ, PLUGUFFAN
29;ALL DE KERMARK, PLUGUFFAN
29;CHE DE KERMARIA, PLUGUFFAN
29;ALL DE KERSALE, PLUGUFFAN
29;ALL DE KERSALE D'EN HAUT, PLUGUFFAN
29;CHE DE KERZERVAN, PLUGUFFAN
29;RUE JOSEPHINE PENCALET, PLUGUFFAN
29;RUE DE KERVENOUEL, PLUGUFFAN
29;CHE HENT KERVENOUEL, PLUGUFFAN
29;CHE DE KERVIHAN, PLUGUFFAN
29;CHE DE KOAD LESKIDIG, PLUGUFFAN
29;RUE KREISKER, PLUGUFFAN
29;IMP DES KORRIGANS, PLUGUFFAN
29;RUE DES KORRIGANS, PLUGUFFAN
29;PL KROAZ AR BLEUNV, PLUGUFFAN
29;RUE LEO FERRE, PLUGUFFAN
29;RUE DU LAVOIR, PLUGUFFAN
29;RUE LEO LAGRANGE, PLUGUFFAN
29;CHE DE LESKONAN, PLUGUFFAN
29;ALL LIONEL FLOCH, PLUGUFFAN
29;RUE DE LLANDOVERY, PLUGUFFAN
29;RUE LOUIS BLERIOT, PLUGUFFAN
29;ALL DE LLANDOVERY, PLUGUFFAN
29;ALL MADELEINE FIE-FIEUX, PLUGUFFAN
29;CHE MANER TREGER, PLUGUFFAN
29;RUE MARYSE BASTIE, PLUGUFFAN
29;RUE MATHURIN MEHEUT, PLUGUFFAN
29;IMP MARYSE HILSZ, PLUGUFFAN
29;RUE MAURICE BON, PLUGUFFAN
29;RUE MENEZ HUELLA, PLUGUFFAN
29;RUE MENEZ IZELLA, PLUGUFFAN
29;ALL MICHEL TONNERRE, PLUGUFFAN
29;RUE DES ORCHIDEES, PLUGUFFAN
29;IMP DE PARK AR FORN, PLUGUFFAN
29;RUE PAUL BOROSSI, PLUGUFFAN
29;RUE PARC AR ROZ, PLUGUFFAN
29;VC ALEZ PARK AL LEUR, PLUGUFFAN
29;RUE DE PEN AR CREAC H, PLUGUFFAN
29;RUE PARK BRAS, PLUGUFFAN
29;CHE DE PEN ALLE KERINER, PLUGUFFAN
29;ALL PENN AN C'HREC'H, PLUGUFFAN
29;RUE DE PENKER, PLUGUFFAN
29;ALL PENN AR C'HREC'H, PLUGUFFAN
29;RUE DE LA BOISSIERE, PLUGUFFAN
29;ALL PIERRE DE BELAY, PLUGUFFAN
29;RUE PIERRE BRELIVET, PLUGUFFAN
29;RUE PIERRE GUEGUIN, PLUGUFFAN
29;RUE PIERRE MENDES FRANCE, PLUGUFFAN
29;ALL DE PORZ AN TRAON, PLUGUFFAN
29;RTE PORZHMOALIG, PLUGUFFAN
29;RTE DE POULDREUZIC, PLUGUFFAN
29;RUE DE POULDREUZIC, PLUGUFFAN
29;PL AR POULDU, PLUGUFFAN
29;RUE DU PRESBYTERE, PLUGUFFAN
29;ALL DES PRIMEVERES, PLUGUFFAN
29;RTE DE QUIMPER, PLUGUFFAN
29;RUE DE QUIMPER, PLUGUFFAN
29;RUE RENE COADOU, PLUGUFFAN
29;ALL RENE-YVES CRESTON, PLUGUFFAN
29;ALL SIMONE SIGNORET, PLUGUFFAN
29;ALL SOEURS GOADEC, PLUGUFFAN
29;RUE DE LA SOURCE, PLUGUFFAN
29;IMP DU STADE, PLUGUFFAN
29;RUE DU STADE, PLUGUFFAN
29;RUE AR STANK, PLUGUFFAN
29;RUE DU STANK, PLUGUFFAN
29;RUE STIVELL, PLUGUFFAN
29;CHE DE STANK ROHAN, PLUGUFFAN
29;RUE THEODORE BOTREL, PLUGUFFAN
29;ALL DE TI LIPIG, PLUGUFFAN
29;CHE DE TI LIPIG, PLUGUFFAN
29;ALL TI SOUBEN, PLUGUFFAN
29;CHE DE TI NEVEZ KERLAGATHU, PLUGUFFAN
29;RUE DE LA VILLEMARQUE, PLUGUFFAN
29;RUE DU VIEUX MOULIN, PLUGUFFAN
29;RUE VORC H LAE, PLUGUFFAN
29;CHE DE VUJID VIHAN, PLUGUFFAN
29;PL AR WEZENN DERO, PLUGUFFAN
29;ALL XAVIER DE LANGLAIS, PLUGUFFAN
29;ALL YANN LOEIZ, PLUGUFFAN
29;ALL YVES MONTAND, PLUGUFFAN
29;RUE KERSKAO, PLUGUFFAN
29;RUE MARGUERITE GOURLAOUEN, PLUGUFFAN
29;HAM DE LA CHATAIGNERAIE, PONT AVEN
29;CITE DES EGLANTIERS, PONT AVEN
29;HAM EMILE JOURDAN, PONT AVEN
29;CITE JULIA, PONT AVEN
29;CITE DE KER ANNA, PONT AVEN
29;CITE DE KERENTRECH, PONT AVEN
29;LOT LIMBOUR, PONT AVEN
29;CITE DES QUATRE VENTS, PONT AVEN
29;DOM DES QUATRE VENTS, PONT AVEN
29;CITE DE ROZ VOEN, PONT AVEN
29;RUE DE L ABBE QUEAU, PONT AVEN
29;RUE DES ABBES TANGUY, PONT AVEN
29;RUE DES AJONCS D OR, PONT AVEN
29;RUE AUGUSTE BRIZEUX, PONT AVEN
29;RUE DU BARZAZ BREIZ, PONT AVEN
29;RUE BEL AIR, PONT AVEN
29;RUE DE LA BELLE ANGELE, PONT AVEN
29;RUE DU BOIS D AMOUR, PONT AVEN
29;SQ BOTREL, PONT AVEN
29;RUE DU BOURGNEUF, PONT AVEN
29;PL DU CALVAIRE, PONT AVEN
29;IMP CHAMAILLARD, PONT AVEN
29;RUE DE CONCARNEAU-CROAZ SAYE, PONT AVEN
29;VEN CORRELLEAU, PONT AVEN
29;VC COTEAU DE KERAMPERCHEC, PONT AVEN
29;IMP DES CYPRES, PONT AVEN
29;IMP DE KERMORVAN, PONT AVEN
29;PL DE L EGLISE, PONT AVEN
29;PL DE L'EGLISE NIZON, PONT AVEN
29;RUE EMILE BERNARD, PONT AVEN
29;RUE DES FLEURS, PONT AVEN
29;IMP DES FLEURS, PONT AVEN
29;RUE DU GENERAL DE GAULLE, PONT AVEN
29;RUE DES GENETS, PONT AVEN
29;IMP MARIE JEANNE GLOANEC, PONT AVEN
29;PL DES GRANDS CHENES, PONT AVEN
29;RUE DES GRANDS CHENES, PONT AVEN
29;PAS DU HENAN, PONT AVEN
29;RUE DU HENAN, PONT AVEN
29;PL HENRI DELAVALLEE, PONT AVEN
29;RUE HENRY MORET, PONT AVEN
29;RUE HENT KOZ NEO, PONT AVEN
29;RUE DE L HERMINE, PONT AVEN
29;ALL DES HORTENSIAS, PONT AVEN
29;PL DE L HOTEL DE VILLE, PONT AVEN
29;RUE JOB PHILIPPE, PONT AVEN
29;IMP DES JONQUILLES, PONT AVEN
29;PL JULIA, PONT AVEN
29;RUE DE KERAMPERCHEC, PONT AVEN
29;RUE DE KERANDISTRO, PONT AVEN
29;RUE DE KERENTREC'H, PONT AVEN
29;RTE DE KERGOADIC, PONT AVEN
29;CHE DE KERGOZ, PONT AVEN
29;RTE DE KERGUERAL, PONT AVEN
29;RUE DE KERLAOUEN, PONT AVEN
29;RUE DE KERVANDALEN, PONT AVEN
29;RTE LANN ROSTED, PONT AVEN
29;RUE DES LAVANDIERES, PONT AVEN
29;CHE DE LESDOMINI, PONT AVEN
29;IMP DES LILAS, PONT AVEN
29;RUE LOUIS LOMENECH, PONT AVEN
29;VEN DES ABBES TANGUY, PONT AVEN
29;IMP LOZACHMEUR, PONT AVEN
29;RUE DES MEUNIERES, PONT AVEN
29;IMP DES MIMOSAS, PONT AVEN
29;RUE DES MOULINS, PONT AVEN
29;RUE DE NIZON, PONT AVEN
29;RUE ANDRE EVEN, PONT AVEN
29;RUE DE L OCEAN, PONT AVEN
29;IMP PARC POUDOU, PONT AVEN
29;PL PAUL GAUGUIN, PONT AVEN
29;RUE PAUL SERUSIER, PONT AVEN
29;CHEM DES PEINTRES, PONT AVEN
29;RUE DE PENANROS, PONT AVEN
29;RUE DE LA PETITE TOURTE, PONT AVEN
29;CHE DE PONT AR BLEIZ, PONT AVEN
29;RUE DU PORT, PONT AVEN
29;IMP DES PRIMEVERES, PONT AVEN
29;RUE DES PRIMEVERES, PONT AVEN
29;RUE DES QUATRE VENTS, PONT AVEN
29;RTE DES RIVIERES, PONT AVEN
29;IMP DES RIVIERES, PONT AVEN
29;VEN DE ROSMADEC, PONT AVEN
29;RUE DE ROZAMBIDOU, PONT AVEN
29;IMP ROZ VOEN, PONT AVEN
29;RUE DE RUSTEPHAN, PONT AVEN
29;RTE DE SAINT ANDRE, PONT AVEN
29;RUE DE STE MARGUERITE, PONT AVEN
29;RUE SAINT GUENOLE, PONT AVEN
29;IMP SAINTE MARGUERITE, PONT AVEN
29;RUE SAINT SEBASTIEN, PONT AVEN
29;RUE ST YVES, PONT AVEN
29;CHEM DES SALAMANDRES, PONT AVEN
29;QUAI THEODORE BOTREL, PONT AVEN
29;ALL TOULIFO, PONT AVEN
29;IMP DES TOURTERELLES, PONT AVEN
29;RUE DE TREGUNC, PONT AVEN
29;RUE DE LA VILLEMARQUE, PONT AVEN
29;VEN YOUNICK VELLY, PONT AVEN
29;PROM XAVIER GRALL, PONT AVEN
29;IMP GUSTAVE LOISEAU, PONT AVEN
29;CITE DES ALOUETTES, PONT CROIX
29;LOT KER TYMEN, PONT CROIX
29;LOT COMMUNAL DE LANEON, PONT CROIX
29;CITE DES MESANGES, PONT CROIX
29;CITE DU NOUVEAU LOGIS, PONT CROIX
29;CITE DES RAMIERS, PONT CROIX
29;RUE ADOLPHE ALAVOINE, PONT CROIX
29;RUE DES AJONCS, PONT CROIX
29;RUE ARSENE KERSAUDY, PONT CROIX
29;RUE DES AUBEPINES, PONT CROIX
29;RUE DES BLES D OR, PONT CROIX
29;RUE DES BOUCHERIES, PONT CROIX
29;ALL BOULOU, PONT CROIX
29;IMP DES BOUVREUILS, PONT CROIX
29;RUE DES BRUYERES, PONT CROIX
29;RUE DES CAMELIAS, PONT CROIX
29;ALL DES MARRONNIERS, PONT CROIX
29;RUE DES COURTILS, PONT CROIX
29;RUE DU 19 MARS 1962, PONT CROIX
29;RUE DU DOC CALMETTE, PONT CROIX
29;RUE DU DOCTEUR NEIS, PONT CROIX
29;PL DE L EGLISE, PONT CROIX
29;RUE EMILE ZOLA, PONT CROIX
29;RUE DU FINISTERE, PONT CROIX
29;VEN DES FLEURS, PONT CROIX
29;RUE DE LA FONTAINE, PONT CROIX
29;PL DE LA GARE, PONT CROIX
29;BD GENERAL DE GAULLE, PONT CROIX
29;RUE DES GENETS, PONT CROIX
29;RUE DU GOYEN, PONT CROIX
29;GR GDE RUE CHERE, PONT CROIX
29;RUE DES GRILLONS, PONT CROIX
29;RTE DE GUIZEC, PONT CROIX
29;RUE HECTOR AUDREN, PONT CROIX
29;RUE ILLE, PONT CROIX
29;RUE DES JARDINS, PONT CROIX
29;RUE JEAN LOUIS LE GOFF, PONT CROIX
29;RUE JEAN MOULIN, PONT CROIX
29;RTE DE KERGADEL, PONT CROIX
29;IMP KERHUEL, PONT CROIX
29;RTE DE KERVILLOU, PONT CROIX
29;RUE LAENNEC, PONT CROIX
29;RUE DES LAURIERS, PONT CROIX
29;RUE DE LEURVEN, PONT CROIX
29;RUE DE LA LIBERATION, PONT CROIX
29;RUE DE LA LIBERTE, PONT CROIX
29;IMP DES LILAS, PONT CROIX
29;RTE DE LOCHRIST, PONT CROIX
29;RUE LOUIS PASTEUR, PONT CROIX
29;PL 8 MAI 1945, PONT CROIX
29;RTE DE MAHALON, PONT CROIX
29;RUE MARCEL PELLAY, PONT CROIX
29;IMP DES MESANGES, PONT CROIX
29;RUE DE LA METAIRIE, PONT CROIX
29;RUE DU MOULIN, PONT CROIX
29;VEN NOIRE, PONT CROIX
29;RUE AUX OEUFS, PONT CROIX
29;RUE OLIVIER MORVAN, PONT CROIX
29;RUE DES PARTISANS, PONT CROIX
29;ALL PEN AR HAN, PONT CROIX
29;PTR PETITE RUE CHERE, PONT CROIX
29;VEN DES POMMIERS, PONT CROIX
29;IMP DES PRES, PONT CROIX
29;RUE DES PRIMEVERES, PONT CROIX
29;RUE DE LA PRISON, PONT CROIX
29;RUE DU QUAI, PONT CROIX
29;PL DE LA REPUBLIQUE, PONT CROIX
29;ALL DES RHODODENDRONS, PONT CROIX
29;RUE DES ROIS, PONT CROIX
29;IMP DES ROSES, PONT CROIX
29;RUE DE ROSMADEC, PONT CROIX
29;CHE DE SAINT GUENOLE, PONT CROIX
29;RUE DU STADE, PONT CROIX
29;RUE DU STANG, PONT CROIX
29;RUE DE STANG GALON, PONT CROIX
29;RUE SURCOUF, PONT CROIX
29;RUE THEODORE BOTREL, PONT CROIX
29;RUE TREHOT DE CLERMONT, PONT CROIX
29;RUE VICTOR HUGO, PONT CROIX
29;RUE VOLTAIRE, PONT CROIX
29;CITE BRINGALL HUELLA, PONT L ABBE
29;CITE BRINGALL IZELLA, PONT L ABBE
29;RES CHARLES LE BASTARD, PONT L ABBE
29;CITE DU DOURIC COUZ, PONT L ABBE
29;RES DE L ETANG, PONT L ABBE
29;VGE DE GOAREM GUEON, PONT L ABBE
29;LOT DE KERAMBLEIS, PONT L ABBE
29;CITE DE KER ARTHUR, PONT L ABBE
29;LOT KERDUAL PONT, PONT L ABBE
29;HAM DE KERLAOUARN, PONT L ABBE
29;RES DE KREISKER, PONT L ABBE
29;RES LOUIS HEMON, PONT L ABBE
29;RES DE LA MINOTERIE, PONT L ABBE
29;LOT PARK NEVEZ, PONT L ABBE
29;RES LES PINS, PONT L ABBE
29;CITE DU PONT NEUF, PONT L ABBE
29;RES PORS MORO, PONT L ABBE
29;LOT DE POULLEACH, PONT L ABBE
29;LOT DE PRAT KERLOT, PONT L ABBE
29;RES DE LA RIVIERE, PONT L ABBE
29;LOT ROSVEIGN, PONT L ABBE
29;RES DU STEVEN, PONT L ABBE
29;LOT TOUZE, PONT L ABBE
29;LOT DE TREBEHORET, PONT L ABBE
29;LOT TREBEHORET NEVEZ, PONT L ABBE
29;CITE DE TREBEHORET, PONT L ABBE
29;HAM DE TREOUGUY, PONT L ABBE
29;HAM DE TROLIGUER, PONT L ABBE
29;QUA VALLOU, PONT L ABBE
29;PL DES AGAPANTHES, PONT L ABBE
29;ALL DES ALBIZIAS, PONT L ABBE
29;VEN DES AJONCS, PONT L ABBE
29;RUE ALFRED LE DILOSQUER, PONT L ABBE
29;RUE ALAIN SIGNOR, PONT L ABBE
29;RUE ANNE DE BRETAGNE, PONT L ABBE
29;RUE ANJELA DUVAL, PONT L ABBE
29;RUE ARNOULT, PONT L ABBE
29;RUE AR SONER DU, PONT L ABBE
29;RUE AUGUSTE DUPOUY, PONT L ABBE
29;AV DE BANTRY, PONT L ABBE
29;RUE COLONEL ARNAUD BELTRAME, PONT L ABBE
29;PL BENJAMIN DELESSERT, PONT L ABBE
29;RUE BIENHEUREUX VINC L'HENORET, PONT L ABBE
29;ALL BLAISE PASCAL, PONT L ABBE
29;RUE DE BRINGALL, PONT L ABBE
29;RUE DE BRINGALL HUELLA, PONT L ABBE
29;PL BRIZEUX, PONT L ABBE
29;RUE BRIZEUX, PONT L ABBE
29;RUE DES BRODEUSES, PONT L ABBE
29;IMP DES BRUYERES, PONT L ABBE
29;RUE BURDEAU, PONT L ABBE
29;RUE DU CALVAIRE, PONT L ABBE
29;IMP DE CANAPE, PONT L ABBE
29;RUE CADOUDAL, PONT L ABBE
29;PL DES CARMES, PONT L ABBE
29;RUE DES CARMES, PONT L ABBE
29;RUE CARNOT, PONT L ABBE
29;RUE DE LA CARRIERE, PONT L ABBE
29;RUE CHARLES DARWIN, PONT L ABBE
29;IMP CHARLES LE BASTARD, PONT L ABBE
29;RUE CHARLES LE BASTARD, PONT L ABBE
29;RUE CHARLES LE GOFFIC, PONT L ABBE
29;RUE CHARLES DU QUELENNEC, PONT L ABBE
29;ALL DE LA CHATAIGNERAIE, PONT L ABBE
29;ALL DES CHATAIGNIERS, PONT L ABBE
29;RUE DU CHATEAU, PONT L ABBE
29;RUE CHATEAUBRIAND, PONT L ABBE
29;RUE DES CHEVALIERS, PONT L ABBE
29;AV JACQUES CHIRAC, PONT L ABBE
29;RUE DU COLONEL ROL TANGUY, PONT L ABBE
29;CHE DE COMBRIT, PONT L ABBE
29;RTE DE COMBRIT, PONT L ABBE
29;RUE CONDORCET, PONT L ABBE
29;VEN DES CORMES, PONT L ABBE
29;RUE CORN LAN, PONT L ABBE
29;CHE DU COSQUER, PONT L ABBE
29;RUE RENE COTY, PONT L ABBE
29;RUE DES CYPRES DE PROVENCE, PONT L ABBE
29;ALL DESCARTES, PONT L ABBE
29;RUE DANTON, PONT L ABBE
29;RUE DU 19 MARS 1962, PONT L ABBE
29;RUE DU DOCTEUR GUIAS, PONT L ABBE
29;VEN DOREE, PONT L ABBE
29;RUE DES DEPORTES, PONT L ABBE
29;RUE DOUARLINEC, PONT L ABBE
29;ALL DIDEROT, PONT L ABBE
29;RUE DUGUAY TROUIN, PONT L ABBE
29;RUE DUGUESCLIN, PONT L ABBE
29;AV DU DOURIC, PONT L ABBE
29;RUE DREON AN ILIS, PONT L ABBE
29;PAS DU DOURIC COZ, PONT L ABBE
29;RUE DOURIC AR MENEZ, PONT L ABBE
29;PL DU DOURIC COZ, PONT L ABBE
29;RUE DU DOURIC COZ, PONT L ABBE
29;PL DES ECHAUDES, PONT L ABBE
29;PL DE L EGLISE, PONT L ABBE
29;RUE DE L EGLISE, PONT L ABBE
29;RUE ELIE FRERON, PONT L ABBE
29;AV ERIC TABARLY, PONT L ABBE
29;RUE ERNEST RENAN, PONT L ABBE
29;ALL DE L ETANG, PONT L ABBE
29;CHE DE L ETANG, PONT L ABBE
29;SQ DE L'EUROPE, PONT L ABBE
29;IMP FLOQUET, PONT L ABBE
29;RUE FLOQUET, PONT L ABBE
29;RUE FRANCOIS BAZIN, PONT L ABBE
29;PL GAMBETTA, PONT L ABBE
29;RUE DE LA GARE, PONT L ABBE
29;RUE DU GEN DE GAULLE, PONT L ABBE
29;RUE DU GENERAL LECLERC, PONT L ABBE
29;ALL DES GENETS, PONT L ABBE
29;RUE GEORGES CLEMENCEAU, PONT L ABBE
29;RUE GEORGES GEO FOURRIER, PONT L ABBE
29;IMP GEORGES MONOT, PONT L ABBE
29;RUE GEORGE SAND, PONT L ABBE
29;VEN DES GLENAN, PONT L ABBE
29;RUE DE GOAREM GUEON, PONT L ABBE
29;CHE DE LA GROTTE, PONT L ABBE
29;CHE DU GUERDY, PONT L ABBE
29;AV DU GUERDY, PONT L ABBE
29;PL DU GUERDY, PONT L ABBE
29;RUE DE GUILVINEC, PONT L ABBE
29;AV DU GUIRIC, PONT L ABBE
29;RUE GUY ROPARTZ, PONT L ABBE
29;RUE DU GUIRIC, PONT L ABBE
29;VEN DE GWEL KAER, PONT L ABBE
29;RUE GUY LE GARREC, PONT L ABBE
29;RUE DE LA HALLE, PONT L ABBE
29;QUAI HENRY MAURICE BENARD, PONT L ABBE
29;RUE AN HENT COZ, PONT L ABBE
29;RUE HERVE BAZIN, PONT L ABBE
29;RUE HELENE BOUCHER, PONT L ABBE
29;RUE HOCHE, PONT L ABBE
29;IMP DES HORTENSIAS, PONT L ABBE
29;RUE DU 8 MAI 1945, PONT L ABBE
29;IMP DES HULOTTES, PONT L ABBE
29;RUE HYACINTHE LE BLEIS, PONT L ABBE
29;RTE DE L ILE CHEVALIER, PONT L ABBE
29;RUE JEAN JULIEN LEMORDANT, PONT L ABBE
29;RUE JEAN JACQUES ROUSSEAU, PONT L ABBE
29;RUE JEAN JAURES, PONT L ABBE
29;RUE JEAN LAUTREDOU, PONT L ABBE
29;ALL JEAN DE LA FONTAINE, PONT L ABBE
29;RUE JEAN LE BERRE, PONT L ABBE
29;RUE JEAN MOULIN, PONT L ABBE
29;RUE JEAN RACINE, PONT L ABBE
29;RUE JEANNE BOHER, PONT L ABBE
29;IMP JEANNE D ARC, PONT L ABBE
29;RUE JEANNE D ARC, PONT L ABBE
29;RUE JULES FERRY, PONT L ABBE
29;RUE JULES SIMON, PONT L ABBE
29;ALL JULIEN GRACQ, PONT L ABBE
29;CHE DE KERARGONT, PONT L ABBE
29;CHE DE KERALIO, PONT L ABBE
29;RUE DE KERALIO, PONT L ABBE
29;RUE DE KEREMBLEIS, PONT L ABBE
29;VEN DE KEREMBLEIS, PONT L ABBE
29;AV DE KERARTHUR, PONT L ABBE
29;CHE DE KERDALEC, PONT L ABBE
29;RTE DE KERDALEC, PONT L ABBE
29;RUE DE KERENTREE, PONT L ABBE
29;RTE DE KERGUEVELEN, PONT L ABBE
29;RTE DE KERGUZ, PONT L ABBE
29;IMP DE KERGUZ, PONT L ABBE
29;RTE DE KERMARIA, PONT L ABBE
29;CHE DE KERNUZ, PONT L ABBE
29;CHE DE KERONDO, PONT L ABBE
29;CHE DE KERONDO VRAS, PONT L ABBE
29;RTE DE KEROUANT, PONT L ABBE
29;RUE KREIS AR PIN, PONT L ABBE
29;PAS LAENNEC, PONT L ABBE
29;RUE LAENNEC, PONT L ABBE
29;IMP LAMARTINE, PONT L ABBE
29;RUE LAMARTINE, PONT L ABBE
29;CHEM DE LAMBOUR, PONT L ABBE
29;RUE DE LAMBOUR, PONT L ABBE
29;RUE DES LAVANDIERES, PONT L ABBE
29;SQ LEMUNIER, PONT L ABBE
29;RUE LE NORMANT DES VARANNES, PONT L ABBE
29;RUE LEUGUER GUEOR, PONT L ABBE
29;RUE LEUQUER LAMBOUR, PONT L ABBE
29;PAS DE LA LEVEE, PONT L ABBE
29;PL DE LA LEVEE, PONT L ABBE
29;RTE DE LOCTUDY, PONT L ABBE
29;RUE LOUIS BRAILLE, PONT L ABBE
29;RUE LOUIS HEMON, PONT L ABBE
29;RUE LOUIS LAGADIC, PONT L ABBE
29;RUE LUCIEN SIMON, PONT L ABBE
29;RUE DU LYCEE, PONT L ABBE
29;RUE DE LA MADELEINE, PONT L ABBE
29;SQ DE LA MADELEINE, PONT L ABBE
29;RUE MADAME DE POMPERY, PONT L ABBE
29;ALL DES MANDARINS, PONT L ABBE
29;RUE DU MANOIR, PONT L ABBE
29;RUE MARCEAU, PONT L ABBE
29;RUE MARIE CURIE, PONT L ABBE
29;RUE MARIE ANNE LE MINOR, PONT L ABBE
29;RUE MARCEL CARIOU, PONT L ABBE
29;VC MARCHANDE, PONT L ABBE
29;RUE MATHURIN MEHEUT, PONT L ABBE
29;ALL MARIE DE KERSTRAT, PONT L ABBE
29;IMP DE KERDUAL, PONT L ABBE
29;RUE DU MEJOU, PONT L ABBE
29;RUE MENEZ AR PIQUET, PONT L ABBE
29;AV DE MENEZ BIHAN, PONT L ABBE
29;IMP DE MENEZ BIJIGOU, PONT L ABBE
29;IMP MENEZ ROZ, PONT L ABBE
29;RUE DE MENEZ ROUZ, PONT L ABBE
29;RUE DU MENHIR, PONT L ABBE
29;RUE DE MERVILLE, PONT L ABBE
29;ALL DES MESANGES, PONT L ABBE
29;RUE MICHELET, PONT L ABBE
29;RUE DU MENEZ, PONT L ABBE
29;RUE FRANCOIS MITTERRAND, PONT L ABBE
29;RUE DE MOGUERIOU, PONT L ABBE
29;RUE MOLIERE, PONT L ABBE
29;RUE MONSEIGNEUR JOLIVET, PONT L ABBE
29;RUE DES MORTS, PONT L ABBE
29;CHE DU MOULIN A VENT, PONT L ABBE
29;RUE MSTISLAV ROSTROPOVITCH, PONT L ABBE
29;RUE NEUVE, PONT L ABBE
29;RUE NICOLAS, PONT L ABBE
29;RUE NICOLAS LAINE, PONT L ABBE
29;RUE NOIRE, PONT L ABBE
29;RUE NOMINOE, PONT L ABBE
29;RUE DU 11 NOVEMBRE 1918, PONT L ABBE
29;IMP DES OLIVIERS, PONT L ABBE
29;ALL OLYMPE DE GOUGES, PONT L ABBE
29;RUE PARC BOREDEN, PONT L ABBE
29;IMP PARC MEL, PONT L ABBE
29;IMP PARC TYRIEN, PONT L ABBE
29;RUE PASTEUR, PONT L ABBE
29;RUE PAUL VERLAINE, PONT L ABBE
29;RUE PEN ENEZ, PONT L ABBE
29;RTE DE PENMARC H, PONT L ABBE
29;RUE DU PENQUER, PONT L ABBE
29;CHE DU PENKER COZ, PONT L ABBE
29;RUE DU PENQUER NEVEZ, PONT L ABBE
29;RUE PER JAKEZ HELIAS, PONT L ABBE
29;PAS PERONELLE DE ROCHEFORT, PONT L ABBE
29;RUE PERONELLE DE ROCHEFORT, PONT L ABBE
29;RUE DU PETIT TRAIN, PONT L ABBE
29;VEN DES PEUPLIERS, PONT L ABBE
29;RUE PIERRE LOTI, PONT L ABBE
29;RUE PIERRE DE BELAY, PONT L ABBE
29;IMP PIERRE VOLANT, PONT L ABBE
29;RUE PIERRE CORNEILLE, PONT L ABBE
29;RUE PIERRE VOLANT, PONT L ABBE
29;RUE PIERRE THEILARD DE CHARDIN, PONT L ABBE
29;RUE DES PINS, PONT L ABBE
29;VEN DES PINS, PONT L ABBE
29;RTE DE PLOBANNALEC, PONT L ABBE
29;RUE DE PLOBANNALEC, PONT L ABBE
29;RTE DE PLOMEUR, PONT L ABBE
29;RUE DE PLOMEUR, PONT L ABBE
29;RTE DE PLONEOUR LANVERN, PONT L ABBE
29;BD DES POILUS, PONT L ABBE
29;RUE GEORGES POMPIDOU, PONT L ABBE
29;PL DU PONT GUERN, PONT L ABBE
29;CHE DE PORS MORO, PONT L ABBE
29;QUAI DE PORS MORO, PONT L ABBE
29;RUE DE POULLEACH, PONT L ABBE
29;RUE DU PRAT, PONT L ABBE
29;ALL DU PRAT GUEN, PONT L ABBE
29;RUE DU PRAT GUEN, PONT L ABBE
29;RUE PUIG DE RITALONGI, PONT L ABBE
29;RTE DE QUEFFEN, PONT L ABBE
29;RUE QUILLIVIC, PONT L ABBE
29;RUE RABELAIS, PONT L ABBE
29;RUE RAYMOND GUENET, PONT L ABBE
29;RUE RAYMONDE FOLGOAS GUILLOU, PONT L ABBE
29;PL DE LA REPUBLIQUE, PONT L ABBE
29;RUE ROGER SIGNOR, PONT L ABBE
29;IMP DES ROMAINS, PONT L ABBE
29;CHE DE ROSQUERNO, PONT L ABBE
29;ALL DU RUISSEAU, PONT L ABBE
29;RUE SAINT JACQUES, PONT L ABBE
29;RTE DE SAINT JEAN, PONT L ABBE
29;RUE DE ST JEAN, PONT L ABBE
29;QUAI SAINT LAURENT, PONT L ABBE
29;RUE SAINT LAURENT, PONT L ABBE
29;CHE DE ST SERVAIS, PONT L ABBE
29;RTE DE ST SERVAIS, PONT L ABBE
29;AV DE SCHLEIDEN, PONT L ABBE
29;RUE SEBASTIEN JOLIVET, PONT L ABBE
29;CHE DU SEQUER NEVEZ, PONT L ABBE
29;RUE DU SEQUER, PONT L ABBE
29;ESP SIMONE VEIL, PONT L ABBE
29;RUE DE LA SOURCE, PONT L ABBE
29;RUE DU STADE, PONT L ABBE
29;RUE DE STER VAD, PONT L ABBE
29;RUE DU STEVEN, PONT L ABBE
29;RUE SURCOUF, PONT L ABBE
29;PL TOUSSAINT LOUVERTURE, PONT L ABBE
29;IMP THEODORE, PONT L ABBE
29;RUE THEODORE, PONT L ABBE
29;RUE THEODORE BOTREL, PONT L ABBE
29;RUE TRAVERSE, PONT L ABBE
29;AV DE TREBEHORET, PONT L ABBE
29;IMP DE TREBEHORET, PONT L ABBE
29;PL DE TREBEHORET, PONT L ABBE
29;RTE DE TREMEOC, PONT L ABBE
29;RUE TREOUGUY, PONT L ABBE
29;VEN DE TREOUGUY, PONT L ABBE
29;CHE DE TREVANNEC, PONT L ABBE
29;RTE DE TROLIGUER, PONT L ABBE
29;VEN DE TROLIGUER, PONT L ABBE
29;PL VICTOR HUGO, PONT L ABBE
29;RUE VICTOR HUGO, PONT L ABBE
29;PL VOLTAIRE, PONT L ABBE
29;RUE VOLTAIRE, PONT L ABBE
29;RUE XAVIER GRALL, PONT L ABBE
29;RUE YOUENN DREZEN, PONT L ABBE
29;LOT DE MEZOU VOURCH, PORSPODER
29;RUE DE L'ANCIENNE VOIE FERREE, PORSPODER
29;CHE DE BELLEVUE, PORSPODER
29;RUE CAWSAND KINGSAND, PORSPODER
29;RTE DU COSQUER, PORSPODER
29;IMP DE COAT EOZEN, PORSPODER
29;CHE DU COMPERE, PORSPODER
29;RUE DU COSQUER, PORSPODER
29;IMP CREACH GUEN, PORSPODER
29;RTE DU CREACH, PORSPODER
29;RUE DU CRUGUEL, PORSPODER
29;PL DE L'EGLISE, PORSPODER
29;IMP CREACH, PORSPODER
29;RUE DE L'EUROPE, PORSPODER
29;CHE DE LA FONTAINE, PORSPODER
29;RUE DES ILES, PORSPODER
29;IMP DU FROMVEUR, PORSPODER
29;RTE DE GARD SIGN, PORSPODER
29;RUE RUE GORRE VRAS, PORSPODER
29;CHE DU GOUGON, PORSPODER
29;RUE DE KERAVEL, PORSPODER
29;RUE DE KERMERRIEN, PORSPODER
29;RTE DE KERNIOUAL, PORSPODER
29;RTE DE KEROUSTAD, PORSPODER
29;RUE DE KERDELVAS, PORSPODER
29;RTE DE KERGOZ, PORSPODER
29;RUE DE KERHARAN, PORSPODER
29;RTE DE KERIZELLA, PORSPODER
29;RTE DE LARRET, PORSPODER
29;IMP KERSCAO, PORSPODER
29;RUE DU LEHOU, PORSPODER
29;CHE DES LINIOUS, PORSPODER
29;RTE DE MELON, PORSPODER
29;RUE DE LA MAIRIE, PORSPODER
29;RTE DE MESCADOROC, PORSPODER
29;RTE DE LEURVEAN, PORSPODER
29;RUE DE MEZOU SEVERN, PORSPODER
29;CHE DE MESLAN, PORSPODER
29;CHE DE MESSOUDALC'H, PORSPODER
29;CHE DE MEZOU VOURCH, PORSPODER
29;RTE DE MESCREN, PORSPODER
29;IMP DU LEHOU, PORSPODER
29;RUE DU PORT, PORSPODER
29;RUE DU PORSPORIDOU, PORSPODER
29;IMP DES PEUPLIERS, PORSPODER
29;IMP DES PINS, PORSPODER
29;RTE DE PRAT AR MEN, PORSPODER
29;RUE DU RADENOC, PORSPODER
29;CHE DE LA RIVIERE, PORSPODER
29;RTE DE PRAT JOULOU, PORSPODER
29;RTE DE ST OURZAL, PORSPODER
29;RUE DE SEVERN, PORSPODER
29;CHE DE TY RUZ, PORSPODER
29;RUE DU SPERNOC, PORSPODER
29;RTE DE QUILVIT, PORSPODER
29;RUE STREAT MOUZON, PORSPODER
29;RUE STREAT ROZOC, PORSPODER
29;RUE MEZOU DOLVEZ, PORSPODER
29;RUE DU PORSPODIROU, PORSPODER
29;RTE DE PRAT PAUL, PORSPODER
29;IMP DU VIVIER, PORSPODER
29;RUE DE L OCEAN, PORSPODER
29;RES COMMANDANT GOURVES, PORT-LAUNAY
29;RES DU PORT, PORT-LAUNAY
29;RES DES ROSEAUX, PORT-LAUNAY
29;QUAI AMIRAL DOUGUET, PORT-LAUNAY
29;RTE DE BREST, PORT-LAUNAY
29;RUE DES COLVERTS, PORT-LAUNAY
29;RUE DES CYGNES, PORT-LAUNAY
29;RUE DU DOCTEUR COZANET, PORT-LAUNAY
29;RUE DES FRERES PENNEC, PORT-LAUNAY
29;RUE DES CHATAIGNIERS, PORT-LAUNAY
29;RUE DE LA GARE, PORT-LAUNAY
29;PL DU GENERAL DE GAULLE, PORT-LAUNAY
29;RUE DES GENETS, PORT-LAUNAY
29;RTE DE GUILY GLAS, PORT-LAUNAY
29;QUAI JACQUES POULIQUEN, PORT-LAUNAY
29;CHE DES LILAS, PORT-LAUNAY
29;QUAI LOUIS HAIS, PORT-LAUNAY
29;RTE DE LA MONTAGNE, PORT-LAUNAY
29;D 770, PORT-LAUNAY
29;RUE DE LA RES DU CT GOURVES, PORT-LAUNAY
29;RUE DE LA TRAVERSE DU CIMETIER, PORT-LAUNAY
29;RUE DE PLEYBEN, PORT-LAUNAY
29;LOT AR BAR VRAS, POULDERGAT
29;RES AVEL MAD, POULDERGAT
29;LOT DE FOENEC VEUR, POULDERGAT
29;LOT DE KERGUESTEN, POULDERGAT
29;LOT KERVOANNOU, POULDERGAT
29;LOT DE BEL AIR, POULDERGAT
29;LOT DE PRATANIROU, POULDERGAT
29;LOT TULASNE, POULDERGAT
29;LOT DU STADE, POULDERGAT
29;RUE AMIRAL DU COUEDIC, POULDERGAT
29;RUE AR BRIEC, POULDERGAT
29;RUE AR STEIR, POULDERGAT
29;RUE DE DOUARNENEZ, POULDERGAT
29;CHE DE DOURIGOU, POULDERGAT
29;RTE DE CLOAREC, POULDERGAT
29;VEN DE DINAOU, POULDERGAT
29;IMP DE L ECOLE, POULDERGAT
29;RUE CDT EDMOND CARON, POULDERGAT
29;RUE DE FOENNEC VEUR, POULDERGAT
29;RUE FRANCOIS GOUZIL, POULDERGAT
29;RUE GUILLAUME LE BRUN, POULDERGAT
29;RTE DU GUILY, POULDERGAT
29;CHE DE KERGUESTEN, POULDERGAT
29;CHE DE LISTRY VRAZ, POULDERGAT
29;CHE DE MENEZ PORS BIHAN, POULDERGAT
29;RTE DE KERDEO, POULDERGAT
29;IMP DES OISEAUX, POULDERGAT
29;RUE ALEXIS OLIVIER VERCHIN, POULDERGAT
29;PL DE L EGLISE, POULDERGAT
29;RTE DE PONT CROIX, POULDERGAT
29;RTE DE PONTOULLEC, POULDERGAT
29;RUE DE PRATANIROU, POULDERGAT
29;RUE PIERRE RIOU, POULDERGAT
29;RUE ST ERGAT, POULDERGAT
29;HAM DE CROAS VAO, POULDREUZIC
29;CITE DE KERSABILIC, POULDREUZIC
29;CITE DE KERVIZIGOU, POULDREUZIC
29;CITE DE MENEZ BIHAN, POULDREUZIC
29;CITE HLM DE MESMEUR, POULDREUZIC
29;CITE DE TREGONETER, POULDREUZIC
29;IMP DES AJONCS, POULDREUZIC
29;RUE DES ALBATROS, POULDREUZIC
29;RUE ANCIENNE VOIE DE CHEMIN FE, POULDREUZIC
29;RUE D ARMORIQUE, POULDREUZIC
29;IMP BELLE VUE, POULDREUZIC
29;RUE DES AUBEPINES, POULDREUZIC
29;RUE DES CAMELIAS, POULDREUZIC
29;RTE DE LA CHAPELLE, POULDREUZIC
29;IMP DES CHEMINOTS, POULDREUZIC
29;RUE DES CORMORANS, POULDREUZIC
29;RUE DE CROAS VAO, POULDREUZIC
29;RUE DU 19 MARS 1962, POULDREUZIC
29;RUE DE L ECOLE DES FILLES, POULDREUZIC
29;RUE ESTREVET DU, POULDREUZIC
29;RUE ESTREVET HASTEL, POULDREUZIC
29;RUE DE LA GARENNE, POULDREUZIC
29;CHE DE GROAS VER, POULDREUZIC
29;RUE DES GOELANDS, POULDREUZIC
29;VC HENT SANT FARON, POULDREUZIC
29;VC HENT SANT FIAKR, POULDREUZIC
29;RUE DES HIRONDELLES, POULDREUZIC
29;RUE DE KERFEUNTEUN, POULDREUZIC
29;RUE DE KERVIZIGOU, POULDREUZIC
29;IMP DE KERVIZIGOU, POULDREUZIC
29;VEN DE KERMARIA, POULDREUZIC
29;RUE HENT KREIZ KER, POULDREUZIC
29;RTE DE LARAON, POULDREUZIC
29;IMP DE LA MAIRIE, POULDREUZIC
29;RUE DE LA MAIRIE, POULDREUZIC
29;CHE DES MENDIANTS, POULDREUZIC
29;IMP DE MENEZ BIHAN, POULDREUZIC
29;RTE DE MEOT, POULDREUZIC
29;RUE DE LA MER, POULDREUZIC
29;RUE DES MESANGES, POULDREUZIC
29;RUE DES MIMOSAS, POULDREUZIC
29;RTE DE PALUD GOURINET, POULDREUZIC
29;RTE DE PENDREFF, POULDREUZIC
29;RTE DE PENHORS, POULDREUZIC
29;RUE DU PHARE D'ECKMUHL, POULDREUZIC
29;RUE DU PHARE DE KEREON, POULDREUZIC
29;RUE DU PHARE SAINT MATHIEU, POULDREUZIC
29;RUE DE PLOZEVET, POULDREUZIC
29;RUE DES POMMIERS, POULDREUZIC
29;RUE DE PONT L ABBE, POULDREUZIC
29;RUE DU PORT, POULDREUZIC
29;IMP DE POUL BOLIC, POULDREUZIC
29;RUE DES PRIMEVERES, POULDREUZIC
29;IMP DES 4 VENTS, POULDREUZIC
29;RUE DE QUIMPER, POULDREUZIC
29;RTE DE L USINE, POULDREUZIC
29;ALL DU STADE, POULDREUZIC
29;CHE DE TY KELES, POULDREUZIC
29;RUE DE TY CORN, POULDREUZIC
29;CHE DES MENHIRS, POULDREUZIC
29;RTE DE BEL AIR, POULDREUZIC
29;CHE DES GENETS, POULDREUZIC
29;CHE DES SOURCES, POULDREUZIC
29;CHE DES IRIS, POULDREUZIC
29;CHE DE LOGAN, POULDREUZIC
29;RES LES JONQUILLES, POULLAN SUR MER
29;RES MAEN GLAS, POULLAN SUR MER
29;RES PENN AR YEUN, POULLAN SUR MER
29;LOT PRAJOU GWENN, POULLAN SUR MER
29;LOT DU CENTRE BOURG, POULLAN SUR MER
29;RES PONT GWENN, POULLAN SUR MER
29;LOT DE QUILLOUARN, POULLAN SUR MER
29;RES ROZEN, POULLAN SUR MER
29;RUE ABBE CONAN, POULLAN SUR MER
29;RUE ALAIN TANGUY, POULLAN SUR MER
29;IMP DES ALOUETTES, POULLAN SUR MER
29;RTE DE L'ANCIENNE GARE, POULLAN SUR MER
29;RUE ANITA CONTI, POULLAN SUR MER
29;RUE ANJELA DUVAL, POULLAN SUR MER
29;PL BEL AIR, POULLAN SUR MER
29;RTE DE BEUZEC, POULLAN SUR MER
29;IMP DES BOUVREUILS, POULLAN SUR MER
29;RUE DU CAPITAINE BLANCHARD, POULLAN SUR MER
29;RUE DES CHARDONNERETS, POULLAN SUR MER
29;RTE DE CONFORT, POULLAN SUR MER
29;RTE DE LA COTE, POULLAN SUR MER
29;RUE DU 19 MARS 1962, POULLAN SUR MER
