29;IMP ALICE COUDOL, CROZON
29;RUE ANITA CONTI, CROZON
29;IMP AR VEZHINOG, CROZON
29;LOT LE CHAMP DU LOUP, DAOULAS
29;RES LE CLOS DU VERN, DAOULAS
29;RES DE LA DUCHESSE ANNE, DAOULAS
29;LOT LES HAUTS DE VEILLENEC, DAOULAS
29;LOT KERTANGUY, DAOULAS
29;LOT L OREE DU BOIS, DAOULAS
29;LOT PARC BARBA, DAOULAS
29;LOT CLOS DES PEUPLIERS, DAOULAS
29;LOT REUN AR MOAL, DAOULAS
29;LOT ROCH GWEN, DAOULAS
29;LOT SAINT ROCH, DAOULAS
29;LOT LE VALLON, DAOULAS
29;LOT LE VALLON DE L ESTACADE, DAOULAS
29;LOT DU VERN DEREDEC, DAOULAS
29;PL DE L ABBAYE, DAOULAS
29;RUE ANDREE CHEDID, DAOULAS
29;CHE DES AULNES, DAOULAS
29;CHEM BEL AIR, DAOULAS
29;RUE DE BEL AIR, DAOULAS
29;RTE DE BREST, DAOULAS
29;RUE DE BREST, DAOULAS
29;PL DU CALVAIRE, DAOULAS
29;RUE DE LA CITE, DAOULAS
29;CHE DU CLOS DU VERN, DAOULAS
29;IMP DU COTEAU DE KERANGLIEN, DAOULAS
29;RUE DU COTEAU DE KERANGLIEN, DAOULAS
29;PL DU DOCTEUR CASTEL, DAOULAS
29;RUE EDOUARD DANGUY DES DESERTS, DAOULAS
29;RUE DE L EGLISE, DAOULAS
29;CHEM DE L ESTACADE, DAOULAS
29;CHEM DES FONTAINES, DAOULAS
29;RTE DE LA GARE, DAOULAS
29;IMP DES HAUTS DE LA MIGNONNE, DAOULAS
29;IMP DU HERON, DAOULAS
29;RUE HIPPOLYTE VIOLEAU, DAOULAS
29;RUE JACQUES DUBOIS, DAOULAS
29;IMP JAOUA, DAOULAS
29;PL JEAN FRANCOIS LE GONIDEC, DAOULAS
29;PL JEAN PIERRE LE SCOUR, DAOULAS
29;RUE JOSEPH BIHAN, DAOULAS
29;RUE KARN AR MARCH, DAOULAS
29;RTE DE KERANGLIEN, DAOULAS
29;IMP DE LEUR AR HARDIS, DAOULAS
29;RTE DE LEUR AR HARDIS, DAOULAS
29;RTE DE LOGONNA, DAOULAS
29;RTE DE LOPERHET, DAOULAS
29;RUE MARIE JOSEE CHRISTIEN, DAOULAS
29;RUE MAX JACOB, DAOULAS
29;RUE MORVAN LEBESQUE, DAOULAS
29;IMP DU MOULIN DES SALLES, DAOULAS
29;VEN DES ORFEVRES, DAOULAS
29;RUE DU PARC, DAOULAS
29;RUE PEN AR GUER, DAOULAS
29;IMP DU PETIT MOULIN, DAOULAS
29;RUE PHILOMENE CADORET, DAOULAS
29;RUE DU PONT, DAOULAS
29;RUE DU POULIGOU, DAOULAS
29;RTE DE QUIMPER, DAOULAS
29;IMP REUN AR MOAL, DAOULAS
29;RUE DE LA RIVE, DAOULAS
29;IMP DE ROCH GWEN, DAOULAS
29;CHE SAINT NICOLAS, DAOULAS
29;RUE SAINT ROCH, DAOULAS
29;RTE DE SAINT URBAIN, DAOULAS
29;PL SAINT YVES, DAOULAS
29;CHEM DES SOURCES, DAOULAS
29;PL TANGUY MALMANCHE, DAOULAS
29;RUE DU TERRAIN DES SPORTS, DAOULAS
29;RUE TRAVERSE, DAOULAS
29;IMP DU VALLON, DAOULAS
29;QUAI DU VALY, DAOULAS
29;RUE DU VALY, DAOULAS
29;RUE DU VEILLENEC, DAOULAS
29;CHEM DU VIADUC, DAOULAS
29;IMP VOIE ROMAINE, DAOULAS
29;RUE VICTOR SEGALEN, DAOULAS
29;RUE XAVIER GRALL, DAOULAS
29;RES AR ROUZIGED, DINEAULT
29;CITE DE L'AULNE, DINEAULT
29;CITE DES CADRES, DINEAULT
29;CITE DU GARVAN, DINEAULT
29;LOT CADOUR, DINEAULT
29;CITE DU GUILLY, DINEAULT
29;CITE DE LA MADELEINE, DINEAULT
29;CITE DU MENEZ HOM, DINEAULT
29;RES PARK GARREC, DINEAULT
29;RES TY JAKES, DINEAULT
29;RES SANT DISPAR, DINEAULT
29;ZA DE TY VOUGERET, DINEAULT
29;QUA QUARTIER TY VOUGERET, DINEAULT
29;RES TY HURE, DINEAULT
29;LOT PARK GARREC, DINEAULT
29;RES DES VIOLETTES, DINEAULT
29;VEN DU CHAP, DINEAULT
29;PL DE L'EGLISE, DINEAULT
29;IMP MENEZ BRAS HUELLA, DINEAULT
29;IMP AR MEN, DINEAULT
29;PL DE LA MAIRIE, DINEAULT
29;VC QUARTIER DE POULTOUSSEC, DINEAULT
29;RTE DE ROSCONNEC, DINEAULT
29;RUE DE RULAND, DINEAULT
29;RTE DE STERADEN, DINEAULT
29;RUE DU TERRAIN DE SPORTS, DINEAULT
29;RTE DE TREGARVAN, DINEAULT
29;RUE DE TY ANGLAIS, DINEAULT
29;RUE DU YED, DINEAULT
29;RTE DE CROZON - TY ANGLAIS, DINEAULT
29;RTE DE CROZON, DINEAULT
29;RUE DU CHAP, DINEAULT
29;CHE DU GARVAN, DINEAULT
29;RUE DE MENEZ TY LOR, DINEAULT
29;VC QUARTIER DE TY HURE, DINEAULT
29;ALL DES PRIMEVERES, DINEAULT
29;RUE LA TOUR D'AUVERGNE, DINEAULT
29;RUE DE LA DEESSE BRIGITTE, DINEAULT
29;RTE DU ROUDOU HIR, DINEAULT
29;LOT BELLEVUE, DIRINON
29;CITE ROQUEFEUILLE, DIRINON
29;LOT DU PETIT BOIS, DIRINON
29;LOT MENEZIC, DIRINON
29;RES DE KERVALY, DIRINON
29;HAM DE ROZ AVEL, DIRINON
29;RUE ARTHUR DE LESGUERN, DIRINON
29;ALL DES GRILLONS, DIRINON
29;RUE DE BELLEVUE, DIRINON
29;RUE BEL AIR, DIRINON
29;RTE DE CROIX DE MISSION, DIRINON
29;RUE DE BREHAT, DIRINON
29;RUE DES ECOLES, DIRINON
29;PL FRANCOIS-MARIE COATALEM, DIRINON
29;PL DE L EGLISE, DIRINON
29;RUE DE L'EGLISE, DIRINON
29;RUE DE KERLIEZEC, DIRINON
29;RTE DE LA GARE, DIRINON
29;RUE DE KERLIEZEC BIHAN, DIRINON
29;RUE DE GOAREM BIAN, DIRINON
29;RUE JACQUES CARNE, DIRINON
29;IMP DE KERAVEL, DIRINON
29;RTE DE KERAVEL, DIRINON
29;RUE DE KERNEVEZ, DIRINON
29;RUE DE KERVALY, DIRINON
29;RUE KEREOL, DIRINON
29;RUE DE KERLOUIS, DIRINON
29;RUE JOSEPH MAZURIE, DIRINON
29;RUE CRAONENIC, DIRINON
29;RUE MENEZ AR C'HLAN, DIRINON
29;RUE DE MOLENE, DIRINON
29;RUE DE MENEZIC, DIRINON
29;RUE D'OUESSANT, DIRINON
29;IMP DU GOAREM, DIRINON
29;RUE DES PEUPLIERS, DIRINON
29;RUE DU PETIT BOIS, DIRINON
29;ALL DU PRESBYTERE, DIRINON
29;RUE DU RAIL, DIRINON
29;CHE DE REA, DIRINON
29;RUE DU ROZIC, DIRINON
29;RUE DE ROZILIO, DIRINON
29;RTE DE SAINT URBAIN, DIRINON
29;RUE ROQUEFEUIL, DIRINON
29;RUE DE RUN AR GROAS, DIRINON
29;RUE SAINT DOMINIQUE, DIRINON
29;RTE DU STADE, DIRINON
29;RUE DU STIVEL, DIRINON
29;RUE ROC'H VENN, DIRINON
29;CHE DE TORREYUN, DIRINON
29;RUE DU TRAON, DIRINON
29;RUE DE ROZ AVEL, DIRINON
29;TSSE DU MENEZ, DIRINON
29;LOT BOIS D ISIS, DOUARNENEZ
29;CITE BREHUEL, DOUARNENEZ
29;HLM DU CARBONT, DOUARNENEZ
29;RES DU GUERLOSQUET, DOUARNENEZ
29;ILOT BERNARD, DOUARNENEZ
29;CITE HENRI BARBUSSE, DOUARNENEZ
29;RES DE L IROISE, DOUARNENEZ
29;LOT DE KERBIGUET, DOUARNENEZ
29;CITE DE KERGUESTEN, DOUARNENEZ
29;CITE DE KERMABON, DOUARNENEZ
29;CITE DE POULDAVID, DOUARNENEZ
29;LOT COMMUNAL DE POULDAVID, DOUARNENEZ
29;LOT DE KERHARO, DOUARNENEZ
29;CITE DE KERVIGNAC, DOUARNENEZ
29;PARC D'ACT DE LANNUGAT NORD, DOUARNENEZ
29;CITE DE MENEZ BIROU, DOUARNENEZ
29;LOT DU MENHIR, DOUARNENEZ
29;LOT MORVAN, DOUARNENEZ
29;CITE RICHEPIN, DOUARNENEZ
29;RES ST MICHEL, DOUARNENEZ
29;LOT LE TREIZ, DOUARNENEZ
29;RUIS LE NEVET, DOUARNENEZ
29;RPT JEAN MOULIN, DOUARNENEZ
29;RUE DE L ABATTOIR, DOUARNENEZ
29;PL ABBE LE GALL, DOUARNENEZ
29;RUE ABBE LE GALL, DOUARNENEZ
29;CHE DES AIGRETTES, DOUARNENEZ
29;RUE DES AJONCS, DOUARNENEZ
29;RUE ALAIN GERBAULT, DOUARNENEZ
29;RUE ALBERT CAMUS, DOUARNENEZ
29;RUE ALEXANDRE BRETHEL, DOUARNENEZ
29;IMP AL LANN, DOUARNENEZ
29;VEN AMBROISE CARIOU, DOUARNENEZ
29;RUE AMIRAL COURBET, DOUARNENEZ
29;IMP AMIRAL COURBET, DOUARNENEZ
29;RUE AMIRAL RONARCH, DOUARNENEZ
29;SQ ANDRE PELLEN, DOUARNENEZ
29;RUE ANATOLE FRANCE, DOUARNENEZ
29;IMP AN AVEL VIZ NORDET, DOUARNENEZ
29;RUE ANATOLE LE BRAZ, DOUARNENEZ
29;IMP AN AVEL C HOUZI, DOUARNENEZ
29;RUE ANDRE TREVIDIC, DOUARNENEZ
29;IMP AN DIOU GER, DOUARNENEZ
29;RUE ANNE DE BRETAGNE, DOUARNENEZ
29;RUE ANTOINE PARMENTIER, DOUARNENEZ
29;RUE ANTOINE CARIOU, DOUARNENEZ
29;VEN ANTOINE CARIOU, DOUARNENEZ
29;RUE ANTOINE NAU, DOUARNENEZ
29;ALL AR FAOU, DOUARNENEZ
29;IMP AR FOENNEC, DOUARNENEZ
29;IMP AR C HOAT PIN, DOUARNENEZ
29;PAS DE L ARMEN, DOUARNENEZ
29;IMP AR ROZ BRAS, DOUARNENEZ
29;RUE AR VILIN GOZ, DOUARNENEZ
29;RUE AR VERET, DOUARNENEZ
29;RUE DE L AUBEPINE, DOUARNENEZ
29;IMP AR GOAREM VIHAN, DOUARNENEZ
29;RTE D AUDIERNE, DOUARNENEZ
29;IMP AR STIVELL, DOUARNENEZ
29;IMP AR STERENN, DOUARNENEZ
29;IMP AR WAREMM VANAL, DOUARNENEZ
29;IMP AR GOAREM NEVEZ, DOUARNENEZ
29;IMP D ARMORIQUE, DOUARNENEZ
29;RUE ANNE ET CHARLOTTE PENCALET, DOUARNENEZ
29;RUE AUGUSTE BRIZEUX, DOUARNENEZ
29;RUE AVIATEUR LE BRIX, DOUARNENEZ
29;RUE DES BAIGNEURS, DOUARNENEZ
29;PL BIR HAKEIM, DOUARNENEZ
29;RUE DU BERET, DOUARNENEZ
29;RUE BERNARD ANSQUER, DOUARNENEZ
29;RUE BERTHELOT, DOUARNENEZ
29;RTE DE BREST, DOUARNENEZ
29;PL DU BICENTENAIRE 1789 1989, DOUARNENEZ
29;IMP BODROCH, DOUARNENEZ
29;PAS BOBBY SANDS, DOUARNENEZ
29;RUE DU BIROU, DOUARNENEZ
29;VEN BLONDEL, DOUARNENEZ
29;RUE DU BOIS DE LESPERBE, DOUARNENEZ
29;AV DU BOIS D ISIS, DOUARNENEZ
29;IMP DU BOIS D ISIS, DOUARNENEZ
29;RUE BOURG LES BOURGS, DOUARNENEZ
29;RUE BOUDOULEC, DOUARNENEZ
29;AV DES BOUVREUILS, DOUARNENEZ
29;RTE DE BREHUEL, DOUARNENEZ
29;RUE DE BROCELIANDE, DOUARNENEZ
29;CHE DE BRUNGUEN, DOUARNENEZ
29;RUE DES BRUYERES, DOUARNENEZ
29;RUE CAMELINAT, DOUARNENEZ
29;BD CAMILLE REAUD, DOUARNENEZ
29;CHE DU CAMPING, DOUARNENEZ
29;IMP DU CARBONT, DOUARNENEZ
29;RUE DU CARREFOUR, DOUARNENEZ
29;RUE DES CASTORS, DOUARNENEZ
29;CHE LA CARRIERE DE PENNAROS, DOUARNENEZ
29;CHE DU CAP, DOUARNENEZ
29;IMP DU CAP COOK, DOUARNENEZ
29;RUE DES CARAVELLES, DOUARNENEZ
29;RUE DES CATAMARANS, DOUARNENEZ
29;RUE DU CENTRE, DOUARNENEZ
29;RUE DU CHAMP DE FOIRE, DOUARNENEZ
29;RUE DES CHARDONNERETS, DOUARNENEZ
29;PAS CHARLES DE FOUCAULD, DOUARNENEZ
29;RUE CHARLES DE FOUCAULD, DOUARNENEZ
29;RUE CHARLES LE GOFFIC, DOUARNENEZ
29;RUE CHARLES PEGUY, DOUARNENEZ
29;RUE CHATEAUBRIAND, DOUARNENEZ
29;ALL DES CHATAIGNIERS, DOUARNENEZ
29;IMP DES CHENES, DOUARNENEZ
29;RUE DU CHERCHE MIDI, DOUARNENEZ
29;IMP CHEVALIERS LA TABLE RONDE, DOUARNENEZ
29;CHE DE CLEMENTEC, DOUARNENEZ
29;RTE DE CLOAREC, DOUARNENEZ
29;RUE DE COATANER, DOUARNENEZ
29;CHE DE COATANER, DOUARNENEZ
29;RUE DU COLONEL DRIANT, DOUARNENEZ
29;IMP DU CDT CHARCOT, DOUARNENEZ
29;RUE DU COMMANDANT FERNAND, DOUARNENEZ
29;RUE CDT LE FRIANT, DOUARNENEZ
29;RUE DES COQUELICOTS, DOUARNENEZ
29;RUE DES CONSERVERIES, DOUARNENEZ
29;PAS CORENTIN CELTON, DOUARNENEZ
29;RUE CORENTIN CELTON, DOUARNENEZ
29;RUE CORENTIN PERENNES, DOUARNENEZ
29;IMP DES CORMORANS, DOUARNENEZ
29;PAS DE  CORNOUAILLE, DOUARNENEZ
29;RUE DE  CORNOUAILLE, DOUARNENEZ
29;CHE DE CORNIGOU, DOUARNENEZ
29;RUE DES CORSAIRES, DOUARNENEZ
29;RUE DU COTEAU, DOUARNENEZ
29;RUE DU COULINEC, DOUARNENEZ
29;RUE DU CROAS MEN, DOUARNENEZ
29;RUE CROAS TALUD, DOUARNENEZ
29;IMP DES CYPRES, DOUARNENEZ
29;RUE DANIEL  FLANCHEC, DOUARNENEZ
29;IMP DAHUT, DOUARNENEZ
29;IMP D ECOSSE, DOUARNENEZ
29;IMP DE GALICE, DOUARNENEZ
29;RUE DESIRE LUCAS, DOUARNENEZ
29;IMP D IRLANDE, DOUARNENEZ
29;RUE DU 19 MARS 1962, DOUARNENEZ
29;PL DU DOC MEVEL, DOUARNENEZ
29;RUE DU DOCTEUR MEVEL, DOUARNENEZ
29;RUE DU DOCTEUR MINET, DOUARNENEZ
29;RUE DU DOCTEUR PAUGAM, DOUARNENEZ
29;RUE DES DRAGONS, DOUARNENEZ
29;CHE DU DREVES, DOUARNENEZ
29;RUE DU COUEDIC, DOUARNENEZ
29;RUE DUGUAY TROUIN, DOUARNENEZ
29;RUE DUGUESCLIN, DOUARNENEZ
29;IMP DUMONT D URVILLE, DOUARNENEZ
29;RUE DU PETIT THOUARS, DOUARNENEZ
29;RUE DUQUESNE, DOUARNENEZ
29;RUE DUREST LE BRIS, DOUARNENEZ
29;AV DES ECUREUILS, DOUARNENEZ
29;RUE EDOUARD BRANLY, DOUARNENEZ
29;PL EDOUARD VAILLANT, DOUARNENEZ
29;RUE DES EGLANTIERS, DOUARNENEZ
29;PL DE L EGLISE, DOUARNENEZ
29;RUE EMILE CHEVE, DOUARNENEZ
29;RUE EMILE GIFFO, DOUARNENEZ
29;IMP EMILE SOUVESTRE, DOUARNENEZ
29;RUE EMILE ZOLA, DOUARNENEZ
29;PL DE L ENFER, DOUARNENEZ
29;IMP EOLE, DOUARNENEZ
29;RUE ERNEST RENAN, DOUARNENEZ
29;RUE D ESTIENNE D ORVES, DOUARNENEZ
29;RUE ETIENNE KERNOURS, DOUARNENEZ
29;IMP EUGENE BELLEGUIC, DOUARNENEZ
29;RUE EUGENE KERIVEL, DOUARNENEZ
29;IMP EUGENE GONIDEC, DOUARNENEZ
29;RUE EUGENE LUCAS, DOUARNENEZ
29;IMP EXCALIBUR, DOUARNENEZ
29;RUE EUGENE POTTIER, DOUARNENEZ
29;IMP DE LA FEE MORGANE, DOUARNENEZ
29;RUE DES FAUVETTES, DOUARNENEZ
29;IMP DE LA FEE VIVIANE, DOUARNENEZ
29;PAS DES FEUX FOLLETS, DOUARNENEZ
29;RUE FERNAND LE GOIC, DOUARNENEZ
29;RUE DES F F I, DOUARNENEZ
29;RUE DE FALMOUTH, DOUARNENEZ
29;IMP DES FILETS BLEUS, DOUARNENEZ
29;IMP FLIMIOU, DOUARNENEZ
29;VC FLORENCE ARTHAUD, DOUARNENEZ
29;BD DE LA FRANCE LIBRE, DOUARNENEZ
29;RUE FRANCOIS ANDRO, DOUARNENEZ
29;RUE FRANCOIS LE SAOUT, DOUARNENEZ
29;IMP FRANCOIS VILLON, DOUARNENEZ
29;RUE FREDERIC LE GUYADER, DOUARNENEZ
29;PAS DES FRENES, DOUARNENEZ
29;CHE DES FRERES LUCAS, DOUARNENEZ
29;RUE DES FRERES PENNAMEN, DOUARNENEZ
29;RUE GABRIEL CASTREC, DOUARNENEZ
29;IMP GABRIEL LE SIGNE, DOUARNENEZ
29;RUE GABRIEL LE SIGNE, DOUARNENEZ
29;PL GABRIEL PERI, DOUARNENEZ
29;IMP GALAAD, DOUARNENEZ
29;RTE DE GARANTEZ, DOUARNENEZ
29;AV DE LA GARE, DOUARNENEZ
29;RPT DE LA GARE, DOUARNENEZ
29;RUE GENDARME RIOU, DOUARNENEZ
29;RUE GENDARME RIOUALL, DOUARNENEZ
29;BD DU GEN DE GAULLE, DOUARNENEZ
29;IMP DES GENETS, DOUARNENEZ
29;RUE GEORGES LE MERDY, DOUARNENEZ
29;RUE DES GOELETTES, DOUARNENEZ
29;IMP DU GOLVEZ, DOUARNENEZ
29;IMP DU GRAAL, DOUARNENEZ
29;RUE GRADLON, DOUARNENEZ
29;VC DU GRAND PORT, DOUARNENEZ
29;PL DU GRAND PORT, DOUARNENEZ
29;QUAI DU GRAND PORT, DOUARNENEZ
29;RUE DU GRAND PORT, DOUARNENEZ
29;VEN DU GRAND PORT, DOUARNENEZ
29;RUE GRIVART, DOUARNENEZ
29;IMP DE GUERNESEY, DOUARNENEZ
29;RUE DU GUET, DOUARNENEZ
29;RUE DES GUETTEURS, DOUARNENEZ
29;RTE DU GUILLY, DOUARNENEZ
29;RUE GUY MOQUET, DOUARNENEZ
29;IMP GWALARN, DOUARNENEZ
29;PL DES HALLES, DOUARNENEZ
29;IMP HENT AR VEIL, DOUARNENEZ
29;RUE HENRI BARBUSSE, DOUARNENEZ
29;RUE HENRI CHEFFER, DOUARNENEZ
29;RUE HENRI GUEVEL, DOUARNENEZ
29;RUE HERVE JULIEN, DOUARNENEZ
29;RUE HERVE KERGOAT, DOUARNENEZ
29;RUE HERVE PELLE, DOUARNENEZ
29;RUE HERVE QUEMENER, DOUARNENEZ
29;RUE DE L HOPITAL, DOUARNENEZ
29;RUE DES IRIS, DOUARNENEZ
29;RUE IZ AR GER, DOUARNENEZ
29;RUE DE L IROISE, DOUARNENEZ
29;IMP JACQUES CARTIER, DOUARNENEZ
29;RUE JACQUES CARTIER, DOUARNENEZ
29;IMP JACQUES LE DU, DOUARNENEZ
29;IMP JACQUES GIOCONDI, DOUARNENEZ
29;RUE JEAN BAPTISTE FIACRE, DOUARNENEZ
29;RUE JB ET HENRI CROQ, DOUARNENEZ
29;RUE JAKEZ RIOU, DOUARNENEZ
29;IMP JEAN BARRE, DOUARNENEZ
29;PAS JEAN BART, DOUARNENEZ
29;RUE JEAN BARRE, DOUARNENEZ
29;PAS JEAN MARIN, DOUARNENEZ
29;ALL JEAN MOULIN, DOUARNENEZ
29;BD JEAN MOULIN, DOUARNENEZ
29;IMP JEAN QUERE, DOUARNENEZ
29;RUE JEAN TOTH, DOUARNENEZ
29;IMP DE JERSEY, DOUARNENEZ
29;RUE JEAN BART, DOUARNENEZ
29;RUE JEAN BRIAND, DOUARNENEZ
29;IMP JEAN CLOAREC, DOUARNENEZ
29;RUE JEAN GUELLEC, DOUARNENEZ
29;RUE JEAN JACQUES ROUSSEAU, DOUARNENEZ
29;SQ JEAN COLLE, DOUARNENEZ
29;RUE JEAN JAURES, DOUARNENEZ
29;PL JEAN GOUILL, DOUARNENEZ
29;RUE JEAN MOREAU, DOUARNENEZ
29;RUE JEAN CLOAREC, DOUARNENEZ
29;RUE JEANNE D ARC, DOUARNENEZ
29;IMP KORNOG, DOUARNENEZ
29;RUE JEAN PIERRE CALLOC'H, DOUARNENEZ
29;RTE DU JUCH, DOUARNENEZ
29;RUE JEAN TANGUY, DOUARNENEZ
29;RUE JOSEPH GRANIER, DOUARNENEZ
29;RUE JULES VERNE, DOUARNENEZ
29;RUE DE KERBIGUET, DOUARNENEZ
29;CHE DE KERALEC, DOUARNENEZ
29;RUE DE KERBERVET, DOUARNENEZ
29;RUE DE KERDANIEL, DOUARNENEZ
29;RUE DE KERLOUARNEC, DOUARNENEZ
29;PAS DE KERGUELEN, DOUARNENEZ
29;RUE DE KERIGUY, DOUARNENEZ
29;ALL DE KERLIEN, DOUARNENEZ
29;RUE DE KERMABON, DOUARNENEZ
29;RUE DE KERVIGNAC, DOUARNENEZ
29;IMP KER ROCH, DOUARNENEZ
29;RUE DES KORRIGANS, DOUARNENEZ
29;RUE KOSTEZ AN AOD, DOUARNENEZ
29;IMP LAENNEC, DOUARNENEZ
29;RUE LAENNEC, DOUARNENEZ
29;RUE LAMARTINE, DOUARNENEZ
29;QUAI DES LANGOUSTIERS, DOUARNENEZ
29;RUE LAMENNAIS, DOUARNENEZ
29;SQ LANSYER EMMANUEL, DOUARNENEZ
29;IMP LA PEROUSE, DOUARNENEZ
29;RUE LA TOUR D AUVERGNE, DOUARNENEZ
29;RUE LAURENT GONIDEC, DOUARNENEZ
29;PAS DES LAVANDIERES, DOUARNENEZ
29;RUE LEBRETON, DOUARNENEZ
29;RUE LEO LAGRANGE, DOUARNENEZ
29;IMP LEO LAGRANGE, DOUARNENEZ
29;RUE DE LISTROUARN, DOUARNENEZ
29;RUE LANCELOT DU LAC, DOUARNENEZ
29;CHE DE LANNUGAT, DOUARNENEZ
29;RTE DE LANNUGAT, DOUARNENEZ
29;CHE DE LANVIC, DOUARNENEZ
29;CHE DE LESLOHAN, DOUARNENEZ
29;CHE DE LESPERBE, DOUARNENEZ
29;AV DE LA LIBERATION, DOUARNENEZ
29;RUE DE LA LIBERATION, DOUARNENEZ
29;RUE LAEZ AR VOURC H, DOUARNENEZ
29;RUE DE LA LIBERTE, DOUARNENEZ
29;IMP DE KROAZ KERLOC H, DOUARNENEZ
29;IMP DES LILAS, DOUARNENEZ
29;RUE LEON BLUM, DOUARNENEZ
29;CHE DE LOPEREC, DOUARNENEZ
29;RUE LOUIS GUILLOUX, DOUARNENEZ
29;RUE LOUIS PASTEUR, DOUARNENEZ
29;RUE LUCIE AUBRAC, DOUARNENEZ
29;PL DU LYCEE J M LE BRIS, DOUARNENEZ
29;IMP MENEZ AR VEIL, DOUARNENEZ
29;IMP LOUIS BLERIOT, DOUARNENEZ
29;RUE DU LT MARCEL FLORC H - FTP, DOUARNENEZ
29;CHE DE MENEZ MEUR, DOUARNENEZ
29;RUE DE MENEZ BRAS, DOUARNENEZ
29;CHE DE MENEZ KER GUYOC H, DOUARNENEZ
29;RUE LOUISE MICHEL, DOUARNENEZ
29;IMP MENEZ KEREM, DOUARNENEZ
29;PAS DES LUTINS, DOUARNENEZ
29;CHE DE MENEZ ROUZ, DOUARNENEZ
29;IMP DE MERLIN L ENCHANTEUR, DOUARNENEZ
29;PL DE LA MAIRIE, DOUARNENEZ
29;IMP DE MANAR LAK, DOUARNENEZ
29;ALL DE MANAR LAK, DOUARNENEZ
29;RUE DU MOLE, DOUARNENEZ
29;IMP DU MARECHAL FOCH, DOUARNENEZ
29;RUE DU MARECHAL FOCH, DOUARNENEZ
29;RUE DU MARECHAL LECLERC, DOUARNENEZ
29;RUE DE LA MARINE, DOUARNENEZ
29;RUE DE LA MARNE, DOUARNENEZ
29;PAS DE LA MARNE, DOUARNENEZ
29;RUE DES MARSOUINS, DOUARNENEZ
29;IMP MAX JACOB, DOUARNENEZ
29;RUE MAX JACOB, DOUARNENEZ
29;RUE MARX DORMOY, DOUARNENEZ
29;RUE DU MENEZ, DOUARNENEZ
29;IMP DU MENHIR, DOUARNENEZ
29;RUE DU MENHIR, DOUARNENEZ
29;RUE MICHEL LE NOBLETZ, DOUARNENEZ
29;RUE DES MOINEAUX, DOUARNENEZ
29;RUE DE LA MONTAGNE, DOUARNENEZ
29;IMP MONTE AU CIEL, DOUARNENEZ
29;RUE MONTE AU CIEL, DOUARNENEZ
29;IMP DES MOUETTES, DOUARNENEZ
29;RUE DU MOULIN, DOUARNENEZ
29;ALL NEIZ KAOUEN, DOUARNENEZ
29;RUE NICOLAS APPERT, DOUARNENEZ
29;RUE MORVAN LEBESQUE, DOUARNENEZ
29;RUE OBSCURE, DOUARNENEZ
29;RUE DE L OBSERVATOIRE, DOUARNENEZ
29;RTE DE MENEZ PEULVEN, DOUARNENEZ
29;PAS DES ONDINES, DOUARNENEZ
29;AV PABLO NERUDA, DOUARNENEZ
29;RUE DE LA PAIX, DOUARNENEZ
29;IMP PALUD, DOUARNENEZ
29;RUE DU PARC, DOUARNENEZ
29;CHE DU MOULIN DE KERGUESTEN, DOUARNENEZ
29;IMP PARMENTIER, DOUARNENEZ
29;CHE DU MOULIN DE KERRU, DOUARNENEZ
29;RUE PAROU BRAZ, DOUARNENEZ
29;CHE DE PEN AN ALLEE, DOUARNENEZ
29;RUE DE PEN AR CREACH, DOUARNENEZ
29;ALL DE PEN AR MENEZ, DOUARNENEZ
29;CHE DE PEN AR STANG, DOUARNENEZ
29;RUE DU PATRONAGE, DOUARNENEZ
29;IMP PAUL ABRAM, DOUARNENEZ
29;QUAI DU PETIT PORT, DOUARNENEZ
29;CHE DE PENFOENNEC, DOUARNENEZ
29;CHE DE PENITY, DOUARNENEZ
29;CHE DE PENN AR CREACH, DOUARNENEZ
29;RUE PAUL STEPHAN, DOUARNENEZ
29;IMP DE PERCEVAL, DOUARNENEZ
29;ALL DES PIVERTS, DOUARNENEZ
29;SEN DES PLOMARCHS, DOUARNENEZ
29;CHE DE PONT COUSTANS, DOUARNENEZ
29;PL DES PECHEURS, DOUARNENEZ
29;RUE DU PONT DINOU, DOUARNENEZ
29;RUE PEN AR MENEZ, DOUARNENEZ
29;RTE DE PONTOULLEC, DOUARNENEZ
29;CHE DE PORS AR SONER, DOUARNENEZ
29;CHE DE POULHON, DOUARNENEZ
29;RTE DE POULLAN, DOUARNENEZ
29;CHE DE POUL LAPIC, DOUARNENEZ
29;CHE DES ROCHES BLANCHES, DOUARNENEZ
29;IMP DU ROI ARTHUR, DOUARNENEZ
29;RUE PEN AR VIR, DOUARNENEZ
29;RUE PEN DUICK, DOUARNENEZ
29;PL DU PERE MAUNOIR, DOUARNENEZ
29;RUE DU PERE MAUNOIR, DOUARNENEZ
29;RUE PIERRE BELBEOCH, DOUARNENEZ
29;RUE PIERRE BROSSOLETTE, DOUARNENEZ
29;IMP PIERRE BROSSOLETTE, DOUARNENEZ
29;RUE PIERRE LE DAUX, DOUARNENEZ
29;RUE DES PEUPLIERS, DOUARNENEZ
29;PL PIERRE LOTI, DOUARNENEZ
29;IMP PIERRE PERNES, DOUARNENEZ
29;RUE PIERRE ET DANIEL OLLIER, DOUARNENEZ
29;RUE PIERRE PERNES, DOUARNENEZ
29;RUE DES PIETONS, DOUARNENEZ
29;ALL DES PIGEONS, DOUARNENEZ
29;RUE DES PLOMARC H, DOUARNENEZ
29;RUE DU PONT ALLEN, DOUARNENEZ
29;RUE DU PONT NEUF, DOUARNENEZ
29;RUE PARK AL LEUR, DOUARNENEZ
29;RUE DES PARTISANS, DOUARNENEZ
29;RUE MARCEL LE BIHAN, DOUARNENEZ
29;RUE PORS LAOUEN, DOUARNENEZ
29;IMP DE PENN AR CREAC H, DOUARNENEZ
29;IMP PORS MELEN, DOUARNENEZ
29;QUAI DU PORT RHU, DOUARNENEZ
29;CHE DE PENNAROS, DOUARNENEZ
29;IMP DU PATRONAGE, DOUARNENEZ
29;RUE DU PONT, DOUARNENEZ
29;RUE DU PORT RHU, DOUARNENEZ
29;PL DU PORTZIC, DOUARNENEZ
29;RUE DU PORTZIC, DOUARNENEZ
29;PAS DE LA POSTE, DOUARNENEZ
29;IMP DU NEVET, DOUARNENEZ
29;PL DE POULMERRIEN, DOUARNENEZ
29;VEN POULMERRIEN, DOUARNENEZ
29;RUE PRAD AL LIN, DOUARNENEZ
29;RUE DU PDT SALVATORE ALLENDE, DOUARNENEZ
29;RUE DU PREFET COLLIGNON, DOUARNENEZ
29;IMP DES PRIMEVERES, DOUARNENEZ
29;IMP DES PROFESSEURS CURIE, DOUARNENEZ
29;RUE DES PROFESSEURS CURIE, DOUARNENEZ
29;PAS PRAD AR SANT, DOUARNENEZ
29;IMP NOMINOE, DOUARNENEZ
29;RUE DU PROFESSEUR MAZE, DOUARNENEZ
29;RUE DU MILLIER, DOUARNENEZ
29;RUE DU QUR MAITRE BALANEC, DOUARNENEZ
29;RUE DU MEN BRIAL, DOUARNENEZ
29;RUE DU PENFRET, DOUARNENEZ
29;RUE DU QUR MAITRE GUILLOU, DOUARNENEZ
29;IMP DU PAYS DE GALLES, DOUARNENEZ
29;PL DES 4 FRERES KERIVEL, DOUARNENEZ
29;IMP DES QUATRE VENTS, DOUARNENEZ
29;RUE DES QUATRE FRERES KERIVEL, DOUARNENEZ
29;RTE DE PORS AN EOSTIC, DOUARNENEZ
29;RTE DE QUIMPER, DOUARNENEZ
29;IMP RADENNEC, DOUARNENEZ
29;ALL NOEL ROQUEVERT, DOUARNENEZ
29;RUE DE LA RAMPE, DOUARNENEZ
29;RPE DU ROSMEUR, DOUARNENEZ
29;PROM PAUL EDOUARD PAULET, DOUARNENEZ
29;IMP DE LA REINE GUENIEVRE, DOUARNENEZ
29;RUE DE LA REPUBLIQUE, DOUARNENEZ
29;PL DE LA RESISTANCE, DOUARNENEZ
29;IMP DU REUNIAT, DOUARNENEZ
29;RUE DU REUNIAT, DOUARNENEZ
29;RUE DU RHEUN, DOUARNENEZ
29;BD RICHEPIN, DOUARNENEZ
29;RTE DU RIS, DOUARNENEZ
29;PL ROBERT LE GOFF, DOUARNENEZ
29;RTE DES ROCHES BLANCHES, DOUARNENEZ
29;CHE RUN AN ILIZ, DOUARNENEZ
29;IMP DU ROI MARC H, DOUARNENEZ
29;IMP DU ROHOU, DOUARNENEZ
29;RUE DU ROSMEUR, DOUARNENEZ
29;RUE DE ROZ AR GOFF, DOUARNENEZ
29;CHE DE RUBIERN, DOUARNENEZ
29;RUE RULAZ, DOUARNENEZ
29;RTE DES SABLES BLANCS, DOUARNENEZ
29;RUE DES SABLES BLANCS, DOUARNENEZ
29;CHE DE RUHORNEC, DOUARNENEZ
29;CHE DE STER CHLAON, DOUARNENEZ
29;ALL DE LA SAINTE CROIX, DOUARNENEZ
29;RUE SAINT GUENOLE, DOUARNENEZ
29;RUE SAINT EXUPERY, DOUARNENEZ
29;PAS ST HERLE, DOUARNENEZ
29;RUE SAINT JACQUES, DOUARNENEZ
29;IMP SAINT JEAN, DOUARNENEZ
29;PL ST JEAN, DOUARNENEZ
29;RUE SAINT JEAN, DOUARNENEZ
29;PL ST MICHEL, DOUARNENEZ
29;RUE SAINT MICHEL, DOUARNENEZ
29;RUE SAINT PIERRE, DOUARNENEZ
29;RUE SAINT POL ROUX, DOUARNENEZ
29;IMP SAINT YVES, DOUARNENEZ
29;RUE DES SAPINS, DOUARNENEZ
29;RUE SEBASTIEN VELLY, DOUARNENEZ
29;PL DU SEMAPHORE, DOUARNENEZ
29;VEN DU SEMAPHORE, DOUARNENEZ
29;RUE DU SEMAPHORE, DOUARNENEZ
29;PAS DES SIRENES, DOUARNENEZ
29;PL STALINGRAD, DOUARNENEZ
29;IMP DU STANG, DOUARNENEZ
29;RUE DU STANG, DOUARNENEZ
29;IMP SURCOUF, DOUARNENEZ
29;RUE DU TERMINIC, DOUARNENEZ
29;RUE DE TEVENNEC, DOUARNENEZ
29;IMP THEO DOARE, DOUARNENEZ
29;RUE THEODORE BOTREL, DOUARNENEZ
29;CHE DE TOUBALAN, DOUARNENEZ
29;RUE DE TOUBALAN, DOUARNENEZ
29;IMP DE TOUL AN DREZ, DOUARNENEZ
29;PAS TOUL AR PORS, DOUARNENEZ
29;IMP DE TOUL AR VILVIG, DOUARNENEZ
29;PL TOUL AR VESPEREN, DOUARNENEZ
29;AV DES TOURTERELLES, DOUARNENEZ
29;RUE TOURVILLE, DOUARNENEZ
29;ALL DE TREGOUZEL, DOUARNENEZ
29;RUE DU TREIZ, DOUARNENEZ
29;CHE DE TREGOUZEL, DOUARNENEZ
29;RUE TREIZ AN DOURIC, DOUARNENEZ
29;RTE DE TREZULIEN, DOUARNENEZ
29;IMP TRISTAN ET YSEULT, DOUARNENEZ
29;IMP DES TRITONS, DOUARNENEZ
29;RUE TRISTAN CORBIERE, DOUARNENEZ
29;CHE DE TROMANE, DOUARNENEZ
29;RUE DE VERDUN, DOUARNENEZ
29;RUE DU VERET, DOUARNENEZ
29;PL DU VEROURY, DOUARNENEZ
29;PAS DU VEROURY, DOUARNENEZ
29;IMP VICTOR HUGO, DOUARNENEZ
29;RUE VICTOR HUGO, DOUARNENEZ
29;PL VICTOR SALEZ, DOUARNENEZ
29;CHE DU VILLAGE DE KERLEYOU, DOUARNENEZ
29;RUE VOLTAIRE, DOUARNENEZ
29;RUE YAN DARGENT, DOUARNENEZ
29;RUE D YS, DOUARNENEZ
29;SQ YVES CAROFF, DOUARNENEZ
29;RUE YVONNE CHANCERELLE, DOUARNENEZ
29;RUE YVONNE KERVAREC, DOUARNENEZ
29;QUAI DE L YSER, DOUARNENEZ
29;RUE JEAN KERVOALEN, DOUARNENEZ
29;PROM JEAN CLAUDE DUBOURG, DOUARNENEZ
29;CHE DE KER ANNA, DOUARNENEZ
29;CHE DE KERATRY, DOUARNENEZ
29;CHE DE KERBELLAY, DOUARNENEZ
29;CHE DE KERBEOC H, DOUARNENEZ
29;CHE DE KERBIDEAU, DOUARNENEZ
29;CHE DE KERDANIEL, DOUARNENEZ
29;IMP DE KERDANIEL, DOUARNENEZ
29;CHE DE KERGOULINET, DOUARNENEZ
29;CHE DE KERGUESTEN, DOUARNENEZ
29;VC ROND POINT DE KERGUESTEN, DOUARNENEZ
29;CHE DE KERGUIMIGOU, DOUARNENEZ
29;RTE DE KERINEC, DOUARNENEZ
29;RTE DE KERIORET, DOUARNENEZ
29;CHE DE KERLEGUER, DOUARNENEZ
29;CHE DE KERLEGUER VIAN, DOUARNENEZ
29;CHE DE KERLEYOU, DOUARNENEZ
29;CHE DE KERLIEN, DOUARNENEZ
29;CHE DE KERLOCH, DOUARNENEZ
29;IMP DE KERMARRON, DOUARNENEZ
29;CHE DE KERMARRON HUELLA, DOUARNENEZ
29;CHE DE KERMARRON IZELLA, DOUARNENEZ
29;CHE DE KERMERRIEN, DOUARNENEZ
29;CHE DE KERNOTEN, DOUARNENEZ
29;CHE DE KEROUSTILLIC, DOUARNENEZ
29;CHE DE KERROUE, DOUARNENEZ
29;CHE DE KERSIGON, DOUARNENEZ
29;CHE DE KERSTRAT, DOUARNENEZ
29;CHE DE KERZUNOU, DOUARNENEZ
29;CHE DE KERVENNEC, DOUARNENEZ
29;CHE DE KERVENT, DOUARNENEZ
29;RTE DE KERVEOC H, DOUARNENEZ
29;ALL DE KERVERN, DOUARNENEZ
29;ALL DE KERVIGNAC, DOUARNENEZ
29;CHE DE KERVIGNAC, DOUARNENEZ
29;SEN DE KERVIGNAC AN AOD, DOUARNENEZ
29;CHE DE KERVILLERM, DOUARNENEZ
29;CHE DE KERVOURZEC, DOUARNENEZ
29;CHE DE KERVROAC H, DOUARNENEZ
29;CHE DE KEREM, DOUARNENEZ
29;CHE DE KERBIGUET, DOUARNENEZ
29;RTE DE KERANDRAON, DOUARNENEZ
29;IMP LANCELOT DU LAC, DOUARNENEZ
29;RUE MADELEINE GESTIN, DOUARNENEZ
29;SQ MARGUERITE SEZNEC, DOUARNENEZ
29;RUE MARIE JOSEPHE NOUY, DOUARNENEZ
29;CHE DE MESTRIJOU, DOUARNENEZ
29;RUE DES OPTIMISTS, DOUARNENEZ
29;PL PAUL STEPHAN, DOUARNENEZ
29;IMP DE PEN AR VIR, DOUARNENEZ
29;ALL DU MANOIR LAENNEC, DOUARNENEZ
29;RUE MARIE REOL, DOUARNENEZ
29;CHE DE MENEZ KERGUESTEN, DOUARNENEZ
29;IMP DE MENEZ KERGUESTEN, DOUARNENEZ
29;RUE MENEZ POAZH, DOUARNENEZ
29;VC ROND POINT DE TOUBALAN, DOUARNENEZ
29;ALL DES PINSONS, DOUARNENEZ
29;IMP POULIG AN AOD, DOUARNENEZ
29;RUE JOSEPHINE PENCALET, DOUARNENEZ
29;PL JEREMIE HEREIL, DOUARNENEZ
29;RUE BREIZ IZEL, DOUARNENEZ
29;RUE JEAN PEUZIAT, DOUARNENEZ
29;IMP DES NOISETIERS, DOUARNENEZ
29;PASS DE PARK AR MARC'H, DOUARNENEZ
29;IMP DES PIERRES NOIRES, DOUARNENEZ
29;ALL AR VAENEG, DOUARNENEZ
29;RUE DES PEINTRES VILLARD, DOUARNENEZ
29;RPT DE L OCTROI, DOUARNENEZ
29;RUE GERMAINE-YVES LE JONCOUR, DOUARNENEZ
29;CHE DU STANG DE KERIORET, DOUARNENEZ
29;CHE DE PEN FOENNEC, DOUARNENEZ
29;CITE DES AJONCS D'OR, LE DRENNEC
29;CITE PARK AL LOUARN, LE DRENNEC
29;CITE BEAUSEJOUR, LE DRENNEC
29;CITE BEL AIR, LE DRENNEC
29;RES CHARLES DE GAULLE, LE DRENNEC
29;LOT COMMUNAL, LE DRENNEC
29;LOT DU COAT, LE DRENNEC
29;LOT DE LA GARE, LE DRENNEC
29;CITE GORREKEAR, LE DRENNEC
29;ZA DE KERNEVEZ, LE DRENNEC
29;RES DU PETIT BOIS, LE DRENNEC
29;RES SAINT DRIEN, LE DRENNEC
29;RES DE LA SOURCE, LE DRENNEC
29;RES DU VALLON, LE DRENNEC
29;RES LA VENELLE, LE DRENNEC
29;RES XAVIER GRALL, LE DRENNEC
29;RUE DE L ABER WRACH, LE DRENNEC
29;RUE LOUIS ABHERVE, LE DRENNEC
29;RUE DES AJONCS D OR, LE DRENNEC
29;PL ANNE DE BRETAGNE, LE DRENNEC
29;ALL DES AUBEPINES, LE DRENNEC
29;RUE DE L ARGOAT, LE DRENNEC
29;RUE DE BREST, LE DRENNEC
29;RUE DE BEL-AIR, LE DRENNEC
29;RUE DE BENIGUET, LE DRENNEC
29;RUE DE BELLEVUE, LE DRENNEC
29;RUE DE BREHAT, LE DRENNEC
29;RUE DES CAPUCINES, LE DRENNEC
29;IMP DE BELLEVUE, LE DRENNEC
29;IMP DES CHARDONNERETS, LE DRENNEC
29;PL CHARLES DE GAULLE, LE DRENNEC
29;RUE DU CHATEAU D EAU, LE DRENNEC
29;RUE DU BOSQUET, LE DRENNEC
29;PL DU COADIC, LE DRENNEC
29;PL DU COAT, LE DRENNEC
29;RTE DU CREACH, LE DRENNEC
29;RUE DE PARK AL LOUARN, LE DRENNEC
29;RUE DES ECOLES, LE DRENNEC
29;RUE DES ECUREUILS, LE DRENNEC
29;IMP DES EPICEAS, LE DRENNEC
29;PL DE L EGLISE, LE DRENNEC
29;RUE DE LA GARENNE, LE DRENNEC
29;RUE DE KERFEUNTEUN, LE DRENNEC
