87;SQ PLANTADIS, LIMOGES
87;ALL PLANTAGENET, LIMOGES
87;ALL DES PLATANES, LIMOGES
87;RUE PLATON, LIMOGES
87;RUE DE LA PLIERE, LIMOGES
87;PL DU POIDS PUBLIC, LIMOGES
87;RUE DE POITIERS, LIMOGES
87;RUE DES POMMIERS, LIMOGES
87;AV DU PONTEIX, LIMOGES
87;RPE PONT NEUF, LIMOGES
87;RUE DU PONT ST ANDRE, LIMOGES
87;RUE DU PONT ST-ETIENNE, LIMOGES
87;RUE DU PONT ST-MARTIAL, LIMOGES
87;RUE DU PORTAIL IMBERT, LIMOGES
87;RUE PORTE-BONHEUR, LIMOGES
87;RUE PORTE PANET, LIMOGES
87;RUE PTE TOURNY, LIMOGES
87;RUE DU PORTEFAIX, LIMOGES
87;RUE DES PORTES FERREES, LIMOGES
87;RUE POTHIER, LIMOGES
87;ALL DU POUDRIER, LIMOGES
87;RUE POUSSIN, LIMOGES
87;RUE DES PRADES, LIMOGES
87;RUE PRADIER, LIMOGES
87;RUE DU PRADOU, LIMOGES
87;RTE DU PRE SAINT-YRIEIX, LIMOGES
87;PL DE LA PREFECTURE, LIMOGES
87;RUE DE LA PREFECTURE, LIMOGES
87;AV DU PDT JOHN KENNEDY, LIMOGES
87;AV DU PDT LEON BLUM, LIMOGES
87;AV DU PDT RENE COTY, LIMOGES
87;AV DU PRESIDENT RAMADIER, LIMOGES
87;AV DU PDT VINCENT AURIOL, LIMOGES
87;PL DU PRESIDIAL, LIMOGES
87;ALL PRIAM, LIMOGES
87;RUE DU PRIEUR, LIMOGES
87;ALL DES PRIMEVERES, LIMOGES
87;SQ DU PRINTEMPS, LIMOGES
87;RUE DES PRISONS, LIMOGES
87;RUE DU PROF BERNARD DESCOTTES, LIMOGES
87;RUE DU PROF J LEVEUF, LIMOGES
87;AV DU PROF JOSEPH DE LEOBARDY, LIMOGES
87;RUE DU PROF J FRANCOIS JOLIET, LIMOGES
87;AV DU PROF MARCEL FAURE, LIMOGES
87;RUE DU PROGRES, LIMOGES
87;RUE PROUDHON, LIMOGES
87;RUE DE PROVENCE, LIMOGES
87;RUE DE LA PROVIDENCE, LIMOGES
87;ALL DU PROVISEUR STORCK, LIMOGES
87;RUE DU PUY CHATU, LIMOGES
87;RUE DU PUY DU PIC, LIMOGES
87;RUE DU PUY IMBERT, LIMOGES
87;RUE DU PUY LANNAUD, LIMOGES
87;RUE DU PUY LAS RODAS, LIMOGES
87;CHE DU PUY MERY, LIMOGES
87;ALL DU PUY REJAUD, LIMOGES
87;RUE DU PUY REJAUD, LIMOGES
87;RUE PUY PONCHET, LIMOGES
87;RUE DU PUY VINCENT, LIMOGES
87;ALL PYTHAGORE, LIMOGES
87;RUE DU QUAI MILITAIRE, LIMOGES
87;RUE DU QUATRE SEPTEMBRE, LIMOGES
87;ALL DU QUERCY, LIMOGES
87;RUE QUESNAY, LIMOGES
87;RUE RABELAIS, LIMOGES
87;RUE RACINE, LIMOGES
87;RUE RAFILHOUX, LIMOGES
87;RUE DU RAJAT, LIMOGES
87;ALL RAMEAU, LIMOGES
87;IMP DE LA RAMPE, LIMOGES
87;ALL RAOUL HAUSMANN, LIMOGES
87;ALL RAOUL FOLLEREAU, LIMOGES
87;RUE RAOUL MONRIBOT, LIMOGES
87;ALL RAOUL PONCHON, LIMOGES
87;RUE RAPHAEL, LIMOGES
87;RUE DU RAUDOUX, LIMOGES
87;RUE DE LA RAUGE, LIMOGES
87;RUE RASPAIL, LIMOGES
87;RUE RAYMOND COUTY, LIMOGES
87;RUE RAYMOND COURAUD, LIMOGES
87;IMP REAUMUR, LIMOGES
87;RUE RAYMOND SOUPLEIX, LIMOGES
87;RUE REAUMUR, LIMOGES
87;ALL RAYMOND DEVOS, LIMOGES
87;AV RAYMOND POULIDOR, LIMOGES
87;RUE DES RECOLLETS, LIMOGES
87;RUE DE LA REFORME, LIMOGES
87;RUE RENE REGAUDIE, LIMOGES
87;RUE 20EME REGIMENT DE DRAGONS, LIMOGES
87;ALL REGINE DEFORGES, LIMOGES
87;RUE DE LA REGLE, LIMOGES
87;RUE REGNARD, LIMOGES
87;RUE REMBRANDT, LIMOGES
87;RUE RENE CAILLIE, LIMOGES
87;RUE RENE CHAR, LIMOGES
87;RUE RENE CASSIN, LIMOGES
87;RUE RENE LOUIS LAFFORGUE, LIMOGES
87;RUE RENE FARNIER, LIMOGES
87;RUE RENE PECHIERAS, LIMOGES
87;ALL RENEE ANTOINE, LIMOGES
87;PL DE LA REPUBLIQUE, LIMOGES
87;RUE DE LA RESISTANCE LIMOUSINE, LIMOGES
87;AV DE LA REVOLUTION, LIMOGES
87;PONT DE LA REVOLUTION, LIMOGES
87;RUE DE LA REYNIE, LIMOGES
87;RUE RHIN ET DANUBE, LIMOGES
87;IMP DE LA RIBIERE, LIMOGES
87;RUE DES RIBIERES, LIMOGES
87;RUE RIGAUD, LIMOGES
87;RUE RIMBAUD, LIMOGES
87;RUE ROBERT DESNOS, LIMOGES
87;ALL ROBERT SCHMIDT, LIMOGES
87;ALL ROBERT MARGERIT, LIMOGES
87;ALL ROBERT CHAPATTE, LIMOGES
87;BD ROBERT SCHUMAN, LIMOGES
87;RUE ROBERT DOISNEAU, LIMOGES
87;IMP DE LA ROCHE, LIMOGES
87;RUE DE LA ROCHE, LIMOGES
87;RUE DE LA ROCHE AU GO, LIMOGES
87;RUE DE ROCHECHOUART, LIMOGES
87;RUE DES ROCHES, LIMOGES
87;ALL DES ROCHES ROUGES, LIMOGES
87;RUE DES ROCHILLOUX, LIMOGES
87;RUE ROGER COUDERC, LIMOGES
87;ALL ROGER DUBAN, LIMOGES
87;RUE ROGER SALENGRO, LIMOGES
87;RUE ROGER SERVAUD, LIMOGES
87;ALL DES ROITELETS, LIMOGES
87;ESP ROGER GONTHIER, LIMOGES
87;AV ROLAND DORGELES, LIMOGES
87;ALL ROLAND GARROS, LIMOGES
87;RUE ROMAIN ROLLAND, LIMOGES
87;RUE DE ROMANET, LIMOGES
87;RUE ROMY SCHNEIDER, LIMOGES
87;RUE RONSARD, LIMOGES
87;ALL DE ROQUEBRUNE, LIMOGES
87;RUE DE LA ROSERAIE, LIMOGES
87;ALL ROUAULT, LIMOGES
87;ALL DES ROUGES GORGES, LIMOGES
87;RUE ROUGET DE L ISLE, LIMOGES
87;ALL ROSA BONHEUR, LIMOGES
87;ALL DES ROUVRES, LIMOGES
87;RUE DES ROSES, LIMOGES
87;ALL ROSSINI, LIMOGES
87;AV DU ROUSSILLON, LIMOGES
87;AV DES RUCHOUX, LIMOGES
87;IMP DES RUCHOUX, LIMOGES
87;RUE RUDE, LIMOGES
87;RUE DES SABINES, LIMOGES
87;PL SABINUS VALIERE, LIMOGES
87;AV DU SABLARD, LIMOGES
87;RUE DES SABLONS, LIMOGES
87;RUE SACHA GUITRY, LIMOGES
87;PL SADI CARNOT, LIMOGES
87;RUE DES SAGNES, LIMOGES
87;RUE SAINT-AFFRE, LIMOGES
87;ALL SAINT ALEXIS, LIMOGES
87;RUE SAINT AUGUSTIN, LIMOGES
87;RUE SAINT-AURELIEN, LIMOGES
87;PL SAINT AURELIEN, LIMOGES
87;RUE SAINT-BENOIT, LIMOGES
87;RUE SAINTE BEUVE, LIMOGES
87;IMP SAINT CHRISTOPHE, LIMOGES
87;RUE SAINT CHRISTOPHE, LIMOGES
87;IMP SAINTE CLAIRE, LIMOGES
87;PL SAINTE CLAIRE, LIMOGES
87;RUE SAINTE CLAIRE, LIMOGES
87;RUE SAINT-DOMNOLET, LIMOGES
87;AV SAINT-ELOI, LIMOGES
87;PL SAINT-ETIENNE, LIMOGES
87;IMP SAINT EXUPERY, LIMOGES
87;PL SAINTE FELICITE, LIMOGES
87;RUE SAINTE FELICITE, LIMOGES
87;RTE DE SAINT FLORENT, LIMOGES
87;RUE DE SAINT-GENCE, LIMOGES
87;RUE SAINT-GEORGES, LIMOGES
87;ALL ST JOHN PERSE, LIMOGES
87;RUE DE SAINT LAZARE, LIMOGES
87;RUE SAINT LEONARD, LIMOGES
87;RUE SAINT LOUIS, LIMOGES
87;RUE DE SAINTE MADELEINE, LIMOGES
87;PL SAINT-MARTIAL, LIMOGES
87;QUAI SAINT-MARTIAL, LIMOGES
87;RUE SAINT MARTIAL, LIMOGES
87;BD SAINT MAURICE, LIMOGES
87;PL SAINT MICHEL, LIMOGES
87;PAS SAINT NICOLAS, LIMOGES
87;IMP SAINT PAUL, LIMOGES
87;RUE SAINT-PAUL, LIMOGES
87;PL SAINT PIERRE, LIMOGES
87;RUE ST PIERRE, LIMOGES
87;RUE SAINT-SIMON, LIMOGES
87;AV SAINT SURIN, LIMOGES
87;IMP SAINT SURIN, LIMOGES
87;ALL DE SAINT TROPEZ, LIMOGES
87;RUE DE SAINTE ANNE, LIMOGES
87;ALL SALAMMBO, LIMOGES
87;ALL DE SAINTONGE, LIMOGES
87;QUAI SALVADOR ALLENDE, LIMOGES
87;RUE SALVADOR DALI, LIMOGES
87;RUE DE LA SANTAUDE, LIMOGES
87;RUE SANTOS DUMONT, LIMOGES
87;RUE DES SAPEURS, LIMOGES
87;RUE DES SAPINS, LIMOGES
87;RUE SARAH BERNHARDT, LIMOGES
87;ALL DES SAULES, LIMOGES
87;RUE SAUT DE BOEUF, LIMOGES
87;RUE DE SAUVIAT, LIMOGES
87;RUE DE SAVOIE, LIMOGES
87;ALL DU SEQUOIA, LIMOGES
87;RUE DU SERGENT MORANGE, LIMOGES
87;RUE SENEQUE, LIMOGES
87;ALL SEURAT, LIMOGES
87;ALL DE SETO, LIMOGES
87;RUE SEVERINE, LIMOGES
87;RUE DE SEVIGNE, LIMOGES
87;ALL SIMONE DE BEAUVOIR, LIMOGES
87;RUE SIMONE SIGNORET, LIMOGES
87;ALL SIMON BOLIVAR, LIMOGES
87;RUE SISLEY, LIMOGES
87;ALL SKYLAB, LIMOGES
87;RUE SISMONDI, LIMOGES
87;RUE SOEURS DE LA RIVIERE, LIMOGES
87;RUE DU 71E MOBILES, LIMOGES
87;PL DU 63 R I, LIMOGES
87;RUE DE SOLIGNAC, LIMOGES
87;RUE SONY LABOU TANSI, LIMOGES
87;RUE DES SORBIERS, LIMOGES
87;RUE DES SOUCIS, LIMOGES
87;RUE DE SOUDANAS, LIMOGES
87;RUE SOUFFLOT, LIMOGES
87;RUE DE LA SOUTERRAINE, LIMOGES
87;SQ DU SOUVENIR FRANCAIS, LIMOGES
87;RUE SOYOUZ, LIMOGES
87;ALL SPINOSA, LIMOGES
87;PL STALINGRAD, LIMOGES
87;RUE STENDHAL, LIMOGES
87;RUE STEPHENSON, LIMOGES
87;RUE DE STRASBOURG, LIMOGES
87;RUE STUART MILL, LIMOGES
87;RUE SUFFREN, LIMOGES
87;RUE SULLY, LIMOGES
87;RUE SURCOUF, LIMOGES
87;ALL DES SUREAUX, LIMOGES
87;RUE SUZANNE LACORRE, LIMOGES
87;RUE SUZANNE VALADON, LIMOGES
87;RUE TAINE, LIMOGES
87;RUE TALMA, LIMOGES
87;ALL DES TAMARIS, LIMOGES
87;RUE DES TANNERIES, LIMOGES
87;RUE DU TAURION, LIMOGES
87;RUE TAYLOR, LIMOGES
87;IMP DES TEINTURIERS, LIMOGES
87;ALL TEISSERENC DE BORT, LIMOGES
87;ALL TELEMAQUE, LIMOGES
87;RUE DU TEMPLE, LIMOGES
87;PTR PETITE RUE DU TEMPLE, LIMOGES
87;VEN DU TEMPLE, LIMOGES
87;RUE DE LA TERRASSE, LIMOGES
87;RUE THALES, LIMOGES
87;RUE THEODORE BAC, LIMOGES
87;RUE THEODORE BOTREL, LIMOGES
87;RUE THEODORE DE BANVILLE, LIMOGES
87;ALL THEODORE GERICAULT, LIMOGES
87;RUE THEOPHILE GAUTIER, LIMOGES
87;ALL THEOPHILE GRAMME, LIMOGES
87;IMP THIERS, LIMOGES
87;RUE THERESE MENOT, LIMOGES
87;RUE THIERS, LIMOGES
87;RUE DE TOCQUEVILLE, LIMOGES
87;IMP DE TOULOUSE, LIMOGES
87;RUE DE TOULOUSE, LIMOGES
87;RUE TOULOUSE LAUTREC, LIMOGES
87;RUE DE TOURCOING, LIMOGES
87;VC TOURNY, LIMOGES
87;ALL DES TOURTERELLES, LIMOGES
87;RUE TOURVILLE, LIMOGES
87;RUE DU TRANSVAAL, LIMOGES
87;RUE TRAVERSIERE DU VERDURIER, LIMOGES
87;RUE TRAV CLOS STE MARIE, LIMOGES
87;RUE TRESAGUET, LIMOGES
87;RUE DES TROIS CHALETS, LIMOGES
87;IMP DES TROIS CHATAINS, LIMOGES
87;RUE DES 3 MAISONS, LIMOGES
87;IMP DU TROU DU LOUP, LIMOGES
87;VC CASERNE DES TUILIERES, LIMOGES
87;RUE DES TUILIERES, LIMOGES
87;AV DE TURENNE, LIMOGES
87;RUE DES TULIPES, LIMOGES
87;ALL ALLEE DU TULIPIER, LIMOGES
87;RUE TURGOT, LIMOGES
87;RUE DE L UNIVERSITE, LIMOGES
87;RUE DES URSULINES, LIMOGES
87;AV D UZURAT, LIMOGES
87;RUE VALERY GISCARD D'ESTAING, LIMOGES
87;RUE DE VALPARAISO, LIMOGES
87;AV V ET G LEMOINE, LIMOGES
87;RUE DE LA VALOINE, LIMOGES
87;ALL VAN DYCK, LIMOGES
87;BD DE LA VALOINE, LIMOGES
87;ALL VAN GOGH, LIMOGES
87;ALL VAN LOO, LIMOGES
87;IMP DE VANTEAUX, LIMOGES
87;BD DE VANTEAUX, LIMOGES
87;BD VAUBAN, LIMOGES
87;RUE VAUCANSON, LIMOGES
87;RUE JULES VEDRINES, LIMOGES
87;RUE VELASQUEZ, LIMOGES
87;RUE DU VELODROME, LIMOGES
87;IMP VENASSIER, LIMOGES
87;RUE VENASSIER, LIMOGES
87;RUE DE VENDEMIAIRE, LIMOGES
87;RUE DES VENITIENS, LIMOGES
87;RUE VENTENAT, LIMOGES
87;RUE VERDI, LIMOGES
87;ALL DU VERDON, LIMOGES
87;RUE DE VERDUN, LIMOGES
87;ALL DES VERGNES, LIMOGES
87;CRS VERGNIAUD, LIMOGES
87;ALL VERONESE, LIMOGES
87;RUE DE VERSAILLES, LIMOGES
87;IMP DE VERTHAMONT, LIMOGES
87;RUE DE VEYRAC, LIMOGES
87;RUE DE LA VIALOUBE, LIMOGES
87;CHV 4, LIMOGES
87;CHV 6, LIMOGES
87;CHV 12 DU VIGEN, LIMOGES
87;RUE VICTOR CHABOT, LIMOGES
87;CHV 35, LIMOGES
87;CHV 232, LIMOGES
87;RUE VICTOR BASCH, LIMOGES
87;RUE VICTOR COUSIN, LIMOGES
87;RUE VICTOR DURUY, LIMOGES
87;ALL VICTOR GRIGNARD, LIMOGES
87;BD VICTOR HUGO, LIMOGES
87;RUE VICTORIEN SARDOU, LIMOGES
87;RUE VICTOR SCHOELCHER, LIMOGES
87;RUE VICTOR THUILLAT, LIMOGES
87;RUE DE LA VIEILLE POSTE, LIMOGES
87;RUE DE LA VIGE, LIMOGES
87;RTE DU VIGEN, LIMOGES
87;BD DU VIGENAL, LIMOGES
87;ALL DE LA VIGIE, LIMOGES
87;RUE VIGNE DE FER, LIMOGES
87;ALL DES VIGNES, LIMOGES
87;RUE DU VILLAGE DE LA FORET, LIMOGES
87;ALL VILLAGORY, LIMOGES
87;RUE VILLARIS, LIMOGES
87;RUE VILLEHARDOUIN, LIMOGES
87;BD DU 21 AOUT 1944, LIMOGES
87;RUE DU VINCOU, LIMOGES
87;RUE VIOLETTE SZABO, LIMOGES
87;PAS DES VIOLETTES, LIMOGES
87;RUE VIOLLET LE DUC, LIMOGES
87;RUE DES VIRADIS, LIMOGES
87;RUE VIRGILE, LIMOGES
87;RUE VOCHAVE, LIMOGES
87;RUE VOLTAIRE, LIMOGES
87;RUE WALDECK ROUSSEAU, LIMOGES
87;RUE WAGNER, LIMOGES
87;ALL DE WATTIGNIES, LIMOGES
87;RUE WATTEAU, LIMOGES
87;ALL WEBER, LIMOGES
87;RUE WEBER, LIMOGES
87;PL WILSON, LIMOGES
87;PL WINSTON CHURCHILL, LIMOGES
87;ALL XAVIER BICHAT, LIMOGES
87;ALL YVES MONTAND, LIMOGES
87;RUE ZAMENHOF, LIMOGES
87;ALL DE VEYRAC, LIMOGES
87;RUE COMMANDANT EUGENE PINTE, LIMOGES
87;ALL MARGUERITE PEREY, LIMOGES
87;RUE FLORENCE ARTHAUD, LIMOGES
87;RUE GERARD VANDENBROUCKE, LIMOGES
87;RUE GERMAINE RIBIERE, LIMOGES
87;ESP GILBERT FONT, LIMOGES
87;BD ROBERT MALOUBIER, LIMOGES
87;ALL HENRY DE MONFREID, LIMOGES
87;ALL DE L'HERMIONE, LIMOGES
87;SQ JACQUES CHIRAC, LIMOGES
87;RUE PAUL MADELINE, LIMOGES
87;ALL RAYMOND KOPA, LIMOGES
87;ESP RIO ET JOHANNESBURG, LIMOGES
87;ALL SUZANNE LEGER, LIMOGES
87;ALL DES CHENES, LINARDS
87;RTE CROIX DE MAZERMAUD, LINARDS
87;RUE DU CIMETIERE, LINARDS
87;RUE DU 19 MARS 1962, LINARDS
87;RUE DU DOC TOURAILLE, LINARDS
87;PAS DES ECURIES, LINARDS
87;IMP DES FLEURS, LINARDS
87;ALL DES ERABLES, LINARDS
87;CHEM DE LA FONT PEYRE, LINARDS
87;ESP FRANCOIS MITTERRAND, LINARDS
87;RUE HENRI LAGRANGE, LINARDS
87;RUE HENRI VERGNOLLE, LINARDS
87;RUE DE LA GALLIE, LINARDS
87;RTE DE LA GANE MAZERMAUD, LINARDS
87;CHE DE LA GARENNE, LINARDS
87;RUE DE LA GARENNE, LINARDS
87;PL DU HUIT MAI 1945, LINARDS
87;RUE DE GRAVELLONA, LINARDS
87;RUE DE LA FONT PEYRE, LINARDS
87;RUE DES INSURGES, LINARDS
87;RUE DU LAVOIR, LINARDS
87;CHE DES LONGES D'ORADOUR, LINARDS
87;CHEM DES NOISETIERS, LINARDS
87;RTE DE LA MAILLERIE, LINARDS
87;RTE DU MAZEAU ORADOUR, LINARDS
87;ALL DE MAZERMAUD, LINARDS
87;RTE DE MAZERMAUD, LINARDS
87;RTE ROUTE DE LIMOGES, LINARDS
87;PL DU ONZE NOVEMBRE 1918, LINARDS
87;CHE D'ORADOUR, LINARDS
87;IMP D'ORADOUR, LINARDS
87;RTE D'ORADOUR BAS, LINARDS
87;RTE D'ORADOUR HAUT, LINARDS
87;RTE D'ORADOUR - MAZERMAUD, LINARDS
87;ALL DE LA PORTE, LINARDS
87;RUE DU PUY LAROUSSE, LINARDS
87;RUE DES QUATRE CHEMINS, LINARDS
87;RUE DE SOUFFLENHEIM, LINARDS
87;RUE GRAVELLONA LOM, LINARDS
87;LOT BEL AIR, LUSSAC-LES-EGLISES
87;CITE BELLEVUE, LUSSAC-LES-EGLISES
87;RES LES OISEAUX, LUSSAC-LES-EGLISES
87;RUE DES ANCIENS FOSSES, LUSSAC-LES-EGLISES
87;PL DE L'ARCADE, LUSSAC-LES-EGLISES
87;RUE DE LA COTE DU MOULIN, LUSSAC-LES-EGLISES
87;PL DE FLEURY, LUSSAC-LES-EGLISES
87;RUE DE LA FONT, LUSSAC-LES-EGLISES
87;PL DE LA FONTAINE, LUSSAC-LES-EGLISES
87;RUE DU FOUR A BAN, LUSSAC-LES-EGLISES
87;AV FRANCOIS DE BOURDELLE, LUSSAC-LES-EGLISES
87;IMP HOSPICE SAINT JACQUES, LUSSAC-LES-EGLISES
87;RUE HOSPICE SAINT JACQUES, LUSSAC-LES-EGLISES
87;PL DE L'HOTEL DU NORD, LUSSAC-LES-EGLISES
87;RUE DES JARDINS, LUSSAC-LES-EGLISES
87;RUE JEAN BRAC, LUSSAC-LES-EGLISES
87;RUE PAULE DUBREUIL, LUSSAC-LES-EGLISES
87;RUE DU PIQUET, LUSSAC-LES-EGLISES
87;ALL DU PRE BATTANT, LUSSAC-LES-EGLISES
87;PL DE LA REPUBLIQUE, LUSSAC-LES-EGLISES
87;RUE SERPENTE, LUSSAC-LES-EGLISES
87;PL SAINT ETIENNE, LUSSAC-LES-EGLISES
87;RUE SAINT LOUIS, LUSSAC-LES-EGLISES
87;RTE DE SAINT SULPICE, LUSSAC-LES-EGLISES
87;RUE TRAVERSIERE, LUSSAC-LES-EGLISES
87;RUE DES TROIS PROVINCES, LUSSAC-LES-EGLISES
87;LOT DU GRAND CHENE, MAGNAC-BOURG
87;RUE DES ACACIAS, MAGNAC-BOURG
87;PL ALBERT PESTOUR, MAGNAC-BOURG
87;PL DE LA BASCULE, MAGNAC-BOURG
87;IMP MARIE BERTHE BLANCHARD, MAGNAC-BOURG
87;RTE DU BOIS D AMOUR, MAGNAC-BOURG
87;RUE DU CHANT DES OISEAUX, MAGNAC-BOURG
87;RTE DE CHATEAU CHERVIX, MAGNAC-BOURG
87;CHE DES DILIGENCES, MAGNAC-BOURG
87;PL DES DOCTEURS DONNET, MAGNAC-BOURG
87;IMP DE LA FABRIQUE, MAGNAC-BOURG
87;RTE DE LA GARE, MAGNAC-BOURG
87;IMP DES JARDINS, MAGNAC-BOURG
87;RUE JEAN BAPTISTE DESMAISON, MAGNAC-BOURG
87;RUE JEAN FAUCHER, MAGNAC-BOURG
87;RUE DE LA LIBERTE, MAGNAC-BOURG
87;RUE DES LILAS, MAGNAC-BOURG
87;RUE MADAME, MAGNAC-BOURG
87;RTE DE MEUZAC, MAGNAC-BOURG
87;VOIE DES MORTS, MAGNAC-BOURG
87;RTE DU MOULIN, MAGNAC-BOURG
87;RTE NATIONALE 20, MAGNAC-BOURG
87;RUE PAUL RENAUDIE, MAGNAC-BOURG
87;RUE DES PENSEES, MAGNAC-BOURG
87;RUE DE PLAISANCE, MAGNAC-BOURG
87;ALL DE LA PRADE, MAGNAC-BOURG
87;PAS SMIGIESKY, MAGNAC-BOURG
87;RUE DU STADE, MAGNAC-BOURG
87;ALL DES SYCOMORES, MAGNAC-BOURG
87;RTE DE LA TAMANIE, MAGNAC-BOURG
87;PL DE LA TOUR, MAGNAC-BOURG
87;IMP DES USINES, MAGNAC-BOURG
87;RUE DU VERGER, MAGNAC-BOURG
87;PAS CROIX BERTRAND, MAGNAC-BOURG
87;RTE DE BOS GRENIER, MAGNAC-BOURG
87;RTE DE BOURDELAS, MAGNAC-BOURG
87;RTE DE CHAMP LA VIGNE, MAGNAC-BOURG
87;RTE DE DURIS, MAGNAC-BOURG
87;IMP DE FONTBELLE, MAGNAC-BOURG
87;RTE DE GANDALONIE, MAGNAC-BOURG
87;PL DE L'EGLISE, MAGNAC-BOURG
87;IMP DE L'OCCITANE, MAGNAC-BOURG
87;RTE DE LA BOUCHEUSE, MAGNAC-BOURG
87;PL DE LA CHAPELLE, MAGNAC-BOURG
87;PAS DE LA FONTAINE, MAGNAC-BOURG
87;CHE DE LA GARENNE, MAGNAC-BOURG
87;SQ DE LA MEMOIRE, MAGNAC-BOURG
87;IMP DE LA PRADE, MAGNAC-BOURG
87;PAS DE LEYSSENNE, MAGNAC-BOURG
87;RTE DE PEYRONNET, MAGNAC-BOURG
87;RTE DE PUY DES GRIVES, MAGNAC-BOURG
87;ALL DES ACACIAS, MAGNAC-BOURG
87;RTE DES CARS, MAGNAC-BOURG
87;CHE DES CHARBONNIERES, MAGNAC-BOURG
87;IMP DES EPIS DE FAITAGE, MAGNAC-BOURG
87;RTE DES INTENDANTS, MAGNAC-BOURG
87;IMP DES MOULADES, MAGNAC-BOURG
87;IMP DES PALMIERS, MAGNAC-BOURG
87;IMP DES POTIERS, MAGNAC-BOURG
87;RTE DES PRADELLES, MAGNAC-BOURG
87;IMP DES PRES MARTY, MAGNAC-BOURG
87;CHE DES RIVAILLES, MAGNAC-BOURG
87;IMP DES SOURCES, MAGNAC-BOURG
87;IMP DES 3 FONTS, MAGNAC-BOURG
87;IMP DU BLANZOU, MAGNAC-BOURG
87;IMP DU BUISSON LAPLAUD, MAGNAC-BOURG
87;IMP DU CHANT DES OISEAUX, MAGNAC-BOURG
87;RTE DU CHATEAU D'EAU, MAGNAC-BOURG
87;IMP DU CLOS, MAGNAC-BOURG
87;CHE DU GOT, MAGNAC-BOURG
87;IMP DU GRAND BOS, MAGNAC-BOURG
87;RUE DU GRAND CHENE, MAGNAC-BOURG
87;RTE DU GRAND DROLE, MAGNAC-BOURG
87;RUE DU PRE LAFARGE, MAGNAC-BOURG
87;IMP DU PUY ROUDEAUX, MAGNAC-BOURG
87;IMP DU SQUARE, MAGNAC-BOURG
87;RTE DU THEILLAU, MAGNAC-BOURG
87;CHE DU TILLEUL, MAGNAC-BOURG
87;IMP GUILLAUME VERGNIAUD, MAGNAC-BOURG
87;PAS LA VILLEDIEU, MAGNAC-BOURG
87;RTE NATIONALE, MAGNAC-BOURG
87;LOT LA RENARDIERE, MAGNAC-LAVAL
87;CITE DES TOURETTES, MAGNAC-LAVAL
87;RUE DES ACACIAS, MAGNAC-LAVAL
87;RUE ALEXANDRE VIALATTE, MAGNAC-LAVAL
87;RUE DES ANCIENNES ECOLES, MAGNAC-LAVAL
87;FG BEAULIEU, MAGNAC-LAVAL
87;RUE DE BEAULIEU, MAGNAC-LAVAL
87;RUE BEL AIR, MAGNAC-LAVAL
87;RUE DE BELLAC, MAGNAC-LAVAL
87;RUE DE LA BUTTE, MAGNAC-LAVAL
87;IMP DES CANUS, MAGNAC-LAVAL
87;RUE CAMILLE GRELLIER, MAGNAC-LAVAL
87;CHE DES CANNAS, MAGNAC-LAVAL
87;RUE DE LA CASCADE, MAGNAC-LAVAL
87;AV DES CASERNES, MAGNAC-LAVAL
87;RUE CHANTECLAIR, MAGNAC-LAVAL
87;RUE DU 138 EME, MAGNAC-LAVAL
87;RTE DE CLERMONT, MAGNAC-LAVAL
87;RUE DU  CHALUMEAU, MAGNAC-LAVAL
87;RUE DU CENTRE, MAGNAC-LAVAL
87;CHE DE CHANTAREAUD, MAGNAC-LAVAL
87;PL DU COLLEGE, MAGNAC-LAVAL
87;RUE DES CHATAIGNIERS, MAGNAC-LAVAL
87;RUE DU CHATEAU D'EAU, MAGNAC-LAVAL
87;RTE DE LA CROIX, MAGNAC-LAVAL
87;AV CHARLES DE GAULLE, MAGNAC-LAVAL
87;RUE DU COLLEGE, MAGNAC-LAVAL
87;RUE DU COQ, MAGNAC-LAVAL
87;RUE COROT, MAGNAC-LAVAL
87;CHE DE CRESSAC, MAGNAC-LAVAL
87;RUE DE LA CROIX BILLARD, MAGNAC-LAVAL
87;RTE DE DINSAC, MAGNAC-LAVAL
87;IMP DES FLEURS, MAGNAC-LAVAL
87;RTE DU DOGNON, MAGNAC-LAVAL
87;RUE DU 19 MARS 1962, MAGNAC-LAVAL
87;RUE DES ECOLES, MAGNAC-LAVAL
87;IMP DES ECOLES, MAGNAC-LAVAL
87;RUE DE LA FONTAINE, MAGNAC-LAVAL
87;IMP DE LA FONTAINE, MAGNAC-LAVAL
87;RUE FENELON, MAGNAC-LAVAL
87;RUE DE LA FORGE, MAGNAC-LAVAL
87;RUE DES FOSSES, MAGNAC-LAVAL
87;AV FRANCOIS MITTERRAND, MAGNAC-LAVAL
87;AV GEORGE SAND, MAGNAC-LAVAL
87;RUE DES GERANIUMS, MAGNAC-LAVAL
87;RUE GRIVET, MAGNAC-LAVAL
87;RUE DU LTC GEORGES GUINGOUIN, MAGNAC-LAVAL
87;RUE GUTEMBERG, MAGNAC-LAVAL
87;ALL DES JARDINS, MAGNAC-LAVAL
87;PL JEAN FAYAUD, MAGNAC-LAVAL
87;SQ JEAN MOULIN, MAGNAC-LAVAL
87;AV JOLIOT CURIE, MAGNAC-LAVAL
87;RUE JULES COURIVAUD, MAGNAC-LAVAL
87;AV LA FONTAINE, MAGNAC-LAVAL
87;PL LAVAL, MAGNAC-LAVAL
87;RUE DU MAGISTER, MAGNAC-LAVAL
87;VOIE MALE, MAGNAC-LAVAL
87;RUE DES MARAIS, MAGNAC-LAVAL
87;PL DU MARCHE, MAGNAC-LAVAL
87;SQ MAUFRONT, MAGNAC-LAVAL
87;PL DU MIDI, MAGNAC-LAVAL
87;RUE DU MIDI, MAGNAC-LAVAL
87;RUE DU MOULIN, MAGNAC-LAVAL
87;RUE DES MURES, MAGNAC-LAVAL
87;BD PASTEUR, MAGNAC-LAVAL
87;CHE DU PAVE, MAGNAC-LAVAL
87;CHE PERICAUD, MAGNAC-LAVAL
87;PL PETITE PLACE DE BEAULIEU, MAGNAC-LAVAL
87;RTE DU PONT, MAGNAC-LAVAL
87;FG DU PONT DU GUE, MAGNAC-LAVAL
87;RUE DU PONT DU GUE, MAGNAC-LAVAL
87;RUE ROUTE DU PRADEAU, MAGNAC-LAVAL
87;RUE DU PUY MAUD, MAGNAC-LAVAL
87;IMP DE LA RENARDIERE, MAGNAC-LAVAL
87;PL DE LA REPUBLIQUE, MAGNAC-LAVAL
87;RUE DU ROCHER, MAGNAC-LAVAL
87;RUE SADI CARNOT, MAGNAC-LAVAL
87;RUE DU SAINFOIN, MAGNAC-LAVAL
87;IMP SAINT MARTIAL, MAGNAC-LAVAL
87;RUE SAINT MAXIMIN, MAGNAC-LAVAL
87;RUE SAINT SEBASTIEN, MAGNAC-LAVAL
87;RTE DE LA SOUTERRAINE, MAGNAC-LAVAL
87;RUE DE LA TOUR, MAGNAC-LAVAL
87;IMP DE LA TOUR, MAGNAC-LAVAL
87;RUE DES TOURETTES, MAGNAC-LAVAL
87;AV LE TRANSLOY, MAGNAC-LAVAL
87;RUE TRAVERSIERE, MAGNAC-LAVAL
87;RUE DU 338 EME, MAGNAC-LAVAL
87;AV VICTOR HUGO, MAGNAC-LAVAL
87;PL DE LA VIERGE, MAGNAC-LAVAL
87;RUE DE LA VIGNE, MAGNAC-LAVAL
87;IMP DE LA VIGNE, MAGNAC-LAVAL
87;RTE DE VILEUX, MAGNAC-LAVAL
87;RTE DE LA VILLATTE, MAGNAC-LAVAL
87;IMP DES VIOLETTES, MAGNAC-LAVAL
87;RUE DU 90 EME TERRITORIAL, MAGNAC-LAVAL
87;IMP DES TULIPES, MAGNAC-LAVAL
87;PL DE LA FONTAINE, MAILHAC-SUR-BENAIZE
87;IMP DE LA RIVIERE, MAILHAC-SUR-BENAIZE
87;RUE ST GERVAIS ST PROTAIS, MAILHAC-SUR-BENAIZE
87;RUE DE LA TERRE AUX FEUILLES, MAILHAC-SUR-BENAIZE
87;RUE DES ABEILLES, MAISONNAIS-SUR-TARDOIRE
87;ALL DE L'AMITIE, MAISONNAIS-SUR-TARDOIRE
87;RTE DE CHAMPNIERS, MAISONNAIS-SUR-TARDOIRE
87;RUE DES CHARMILLES, MAISONNAIS-SUR-TARDOIRE
87;RUE DES CHARRONS, MAISONNAIS-SUR-TARDOIRE
87;CHE DES COCCINELLES, MAISONNAIS-SUR-TARDOIRE
87;RUE DES ECOLES, MAISONNAIS-SUR-TARDOIRE
87;PL DE L'EGLISE, MAISONNAIS-SUR-TARDOIRE
87;RUE DES HIRONDELLES, MAISONNAIS-SUR-TARDOIRE
87;PL DE LA MAIRIE, MAISONNAIS-SUR-TARDOIRE
87;RUE DU MARRONNIER, MAISONNAIS-SUR-TARDOIRE
87;RTE DU PUY, MAISONNAIS-SUR-TARDOIRE
87;RUE DU RUCHER, MAISONNAIS-SUR-TARDOIRE
87;RUE DES TILLEULS, MAISONNAIS-SUR-TARDOIRE
87;LOT DE LA BARNIQUE, MASLEON
87;LOT DES MAS, MASLEON
87;CHE DE LA BASTIDE, MASLEON
87;RUE DES BATTENETS, MASLEON
87;RTE DES BAUX, MASLEON
87;RTE DU BOIS REDON, MASLEON
87;RTE DE BUJALEUF, MASLEON
87;CHE DES CHATAIGNIERS, MASLEON
87;RUE DES COTES, MASLEON
87;RUE DES DEPORTES, MASLEON
87;RUE DES ECOLES, MASLEON
87;RUE DE L'EGLISE, MASLEON
87;RTE D'EPIED, MASLEON
87;CHE DES JARDINS, MASLEON
87;RUE JEAN BRETON, MASLEON
87;RUE JEAN DELSOL, MASLEON
87;RTE DE LIMOGES, MASLEON
87;RTE DE LINARDS, MASLEON
87;RUE DES MARRONNIERS, MASLEON
87;CHE DES MAS, MASLEON
87;RUE DU MOULIN, MASLEON
87;CHE DU MULET, MASLEON
87;RUE DES NOISETIERS, MASLEON
87;CHE PERDU, MASLEON
87;RUE DU PEYRINAUD, MASLEON
87;RUE DU PONT DU THES, MASLEON
87;RUE DE LA REPUBLIQUE, MASLEON
87;PL ROBERT NICOT, MASLEON
87;RTE DE SOUMAGNAS, MASLEON
87;CHE DE LA SOURCE, MASLEON
87;RUE TRAVERSIERE, MASLEON
87;RUE DE L'USINE, MASLEON
87;IMP DE LA VALLEE, MASLEON
87;RTE DE VASSIVIERE, MASLEON
87;RTE DE BURGNAC, MEILHAC
87;PL DE L'EGLISE, MEILHAC
87;RUE DES HIRONDELLES, MEILHAC
87;RTE DE NEXON, MEILHAC
87;RUE SAINT FIACRE, MEILHAC
87;RUE DE LA VANELLE, MEILHAC
87;CHE DE LA BASSE ROCHE, MEUZAC
87;RTE DE LA CARRIERE, MEUZAC
87;ALL DU CHAMP DU VERT, MEUZAC
87;RUE DES CYPRES, MEUZAC
87;RUE DU 19 MARS 1962, MEUZAC
87;CHE DE L'EMPIERREE, MEUZAC
87;RUE DE L ETANG, MEUZAC
87;CHE DE LA FORGE, MEUZAC
87;PL DU 8 MAI 1945, MEUZAC
87;RUE DES JONQUILLES, MEUZAC
87;ALL DU LAC, MEUZAC
87;RTE DE MASSERET, MEUZAC
87;ALL DES PECHEURS, MEUZAC
87;RTE DU PONT, MEUZAC
87;RUE DU PRE COUDERT, MEUZAC
87;RTE DU PRE MARIN, MEUZAC
87;ALL DE LA ROUBARDIE, MEUZAC
87;PL SAINT ROCH, MEUZAC
87;RUE DU STADE, MEUZAC
87;RUE DES TILLEULS, MEUZAC
87;ALL DES VERGNES DE LA COMBE, MEUZAC
87;RUE DU 11 NOVEMBRE 1918, MEUZAC
87;LOT DE LA GARE, LA MEYZE
87;RUE BEAUSOLEIL, LA MEYZE
87;PL DU CHAMP DE FOIRE, LA MEYZE
87;RTE DE LA CHAPELLE DU ROCHER, LA MEYZE
87;PL DE L'EGLISE, LA MEYZE
87;RTE D'ENTREYGAS, LA MEYZE
87;RUE DE L'EUROPE, LA MEYZE
87;RUE GABRIEL DEBREGEAS, LA MEYZE
87;AV DE LA GARE, LA MEYZE
87;RUE JEAN RENAUDIE, LA MEYZE
87;RUE DU MOULIN DE LA TOUR, LA MEYZE
87;RUE DE LA PASSERELLE, LA MEYZE
87;SQ DE PITTEM, LA MEYZE
87;RUE DES PLATANES, LA MEYZE
87;IMP DU ROCHER, LA MEYZE
87;RUE SAINT MICHEL, LA MEYZE
87;RTE DU STADE, LA MEYZE
87;RUE DE THOMASSY, LA MEYZE
87;ALL D ENTREYGAS, LA MEYZE
87;IMP DE BORDE, LA MEYZE
87;RTE DE CHAMPSIAUX, LA MEYZE
87;IMP DE FRONTOIN, LA MEYZE
87;RTE DE FRONTOIN, LA MEYZE
87;RTE DE JANAILHAC, LA MEYZE
87;IMP DE LA BASTIDE, LA MEYZE
87;RTE DE LA BASTIDE, LA MEYZE
87;RTE DE LA BORDE, LA MEYZE
87;ALL DE LA BOUDONIE, LA MEYZE
87;RTE DE LA BOUDONIE, LA MEYZE
87;RTE DE LA FORET, LA MEYZE
87;IMP DE LA FORGE, LA MEYZE
87;RTE DE LA GARENNE, LA MEYZE
87;ALL DE LA GRANGERE, LA MEYZE
87;IMP DE LA GRANGERE, LA MEYZE
87;RTE DE LA JAUNIE, LA MEYZE
87;RTE DE LA PATACHE, LA MEYZE
87;IMP DE LA PETITE BOUDONIE, LA MEYZE
87;CHE DE LA PIERRE PLATE, LA MEYZE
87;IMP DE LA PUYTAVIGNE, LA MEYZE
87;RTE DE LA RIBIERE, LA MEYZE
87;RTE DE LA ROUSSEILLE, LA MEYZE
87;CHE DE LA SAPINIERE, LA MEYZE
87;IMP DE LA TOUR, LA MEYZE
87;CHE DE LA TRAVERSE, LA MEYZE
87;RTE DE LA TRAVERSE, LA MEYZE
87;RTE DE LADIGNAC, LA MEYZE
87;IMP DE LALET, LA MEYZE
87;IMP DE LASCAUX, LA MEYZE
87;IMP DE LEYSSARD, LA MEYZE
87;RTE DE MARNEIX, LA MEYZE
87;ALL DE MONTBESSIER, LA MEYZE
87;IMP DE MONTBESSIER, LA MEYZE
87;RTE DE MONTBESSIER, LA MEYZE
87;RTE DE NEXON, LA MEYZE
87;RTE DE PERBIN, LA MEYZE
87;IMP DE PLUVIERS, LA MEYZE
87;RTE DE PLUVIERS, LA MEYZE
87;CHE DE PUYCHENY, LA MEYZE
87;RTE DE PUYCHENY, LA MEYZE
87;CHE DE PUYRASSOU, LA MEYZE
87;RTE DE PUYRASSOU, LA MEYZE
87;RTE DE SAINT HILAIRE LES PLACE, LA MEYZE
87;RTE DE VEYRINAS, LA MEYZE
87;IMP DES BIES, LA MEYZE
87;RTE DES CEPES, LA MEYZE
87;RUE DES DEUX FONTAINES, LA MEYZE
87;RUE DES ECOLES, LA MEYZE
87;RTE DES ETANGS, LA MEYZE
87;RTE DES LANDES DE ROUVEIX, LA MEYZE
87;CHE DES PLANCHES, LA MEYZE
87;RTE DES PLANCHES, LA MEYZE
87;RTE DES ROCHERS, LA MEYZE
87;RTE DES SOURCES, LA MEYZE
87;ALL DU CHBTEAU D EAU, LA MEYZE
87;RTE DU MAS LONG, LA MEYZE
87;IMP DU MOULIN DE LA TOUR, LA MEYZE
87;IMP DU PUYNEGRIER, LA MEYZE
87;RTE 704, LA MEYZE
87;LOT SUZANNE LEGER, VAL D ISSOIRE
87;LOT DU GOT MARCHE, VAL D ISSOIRE
87;LOT DE LA GRANGE VIGNAUD, VAL D ISSOIRE
87;RES DU SOLEIL LEVANT, VAL D ISSOIRE
87;RUE AUGUSTE PAILLIER, VAL D ISSOIRE
87;RUE DES BARGES, VAL D ISSOIRE
87;AV DE BELLAC, VAL D ISSOIRE
87;RTE DE BLOND, VAL D ISSOIRE
87;IMP DES CHENES, VAL D ISSOIRE
87;AV DE CONFOLENS, VAL D ISSOIRE
87;RUE CONSTANCIN, VAL D ISSOIRE
87;RUE ANDRE DARDILLAC, VAL D ISSOIRE
87;PL DE L'EGLISE DE MEZIERES, VAL D ISSOIRE
87;IMP DE L'ETANG DE LA COTE, VAL D ISSOIRE
87;RUE DE LA FONTAINE, VAL D ISSOIRE
87;RUE DU GOT MARCHE, VAL D ISSOIRE
87;RLE DU LAVOIR, VAL D ISSOIRE
87;RUE DU MARCHE OVIN, VAL D ISSOIRE
87;RUE DU MOULIN DE LA GALETTE, VAL D ISSOIRE
87;PL NOTRE DAME, VAL D ISSOIRE
87;RUE DU PRESBYTERE, VAL D ISSOIRE
87;RUE PRINCIPALE, VAL D ISSOIRE
87;CHE DE CHEZ PROPIN, VAL D ISSOIRE
87;PL DE LA REPUBLIQUE, VAL D ISSOIRE
87;RUE ROBERT BERNARD, VAL D ISSOIRE
87;RUE JOSETTE ROY, VAL D ISSOIRE
87;RTE DE SAINTE ANNE, VAL D ISSOIRE
87;RUE SAINTE GENEVIEVE, VAL D ISSOIRE
87;RUE FERNAND SAVIGNAT, VAL D ISSOIRE
87;AV DE SELTZ, VAL D ISSOIRE
87;RUE DU STADE, VAL D ISSOIRE
87;RUE SUZANNE LEGER, VAL D ISSOIRE
87;RUE DU TRAM, VAL D ISSOIRE
87;CHE DE LA TUILIERE, VAL D ISSOIRE
87;RUE DE LA CHAPELLE SAINT JEAN, VAL D ISSOIRE
87;PL DU CHATEAU DE LA COURT, VAL D ISSOIRE
87;RUE DE L'ETANG LA PLANCHE, VAL D ISSOIRE
87;RUE DES FOSSES, VAL D ISSOIRE
87;RUE DE LA LANDE DE FROCHET, VAL D ISSOIRE
87;RUE DU MOULIN DU PONT, VAL D ISSOIRE
