87;PL DU 18 JUIN 1940, CROIX-SUR-GARTEMPE (LA)
87;RTE DU DORAT, CROIX-SUR-GARTEMPE (LA)
87;RUE DE LA GARTEMPE, CROIX-SUR-GARTEMPE (LA)
87;RUE PRINCIPALE, CROIX-SUR-GARTEMPE (LA)
87;PL DU COMMERCE, CROMAC
87;IMP DES COTES, CROMAC
87;IMP DES ECOLES, CROMAC
87;RUE DES FONTAINES, CROMAC
87;RUE GRAND RUE, CROMAC
87;PL DU HUIT MAI 1945, CROMAC
87;RUE DE LA POSTE, CROMAC
87;RUE DES ACACIAS, CUSSAC
87;CHE DES AMOUREUX, CUSSAC
87;RUE DE L'ARBORETUM, CUSSAC
87;ALL DU BREUIL, CUSSAC
87;ALL DE LA PETITE BERTHUSSIE, CUSSAC
87;RUE LA CHAPELLE MONTBRANDEIX, CUSSAC
87;COUR DES CALECHES, CUSSAC
87;CHE DES CARRIERES, CUSSAC
87;SQ DU CHAMPIONNAT DU MONDE, CUSSAC
87;RUE DE CHANTALOUETTE, CUSSAC
87;RUE DU CHAPITEAU, CUSSAC
87;RUE DU CHATAIGNIER, CUSSAC
87;RUE DES CHENES, CUSSAC
87;SEN LAYON  DES JARDINS, CUSSAC
87;ALL DU CLEDIER, CUSSAC
87;IMP DE LA PETITE BERTHUSSIE, CUSSAC
87;RUE DE SAINT MATHIEU, CUSSAC
87;RUE DES DAMES DE BOUBON, CUSSAC
87;VEN DE L'ECOURSOU, CUSSAC
87;PL DE L'EGLISE, CUSSAC
87;ALL DES FELIBRES, CUSSAC
87;IMP DE LA FERME, CUSSAC
87;RUE FEUILLARDINE, CUSSAC
87;RUE DE LIMOGES, CUSSAC
87;RUE DE LA FONTANELLE, CUSSAC
87;RUE DES FOUGERES, CUSSAC
87;RUE DES FRENES, CUSSAC
87;RUE DU FROMENTAL, CUSSAC
87;RUE DE GRAND RIEU, CUSSAC
87;RTE DE LA JALADE, CUSSAC
87;RLE DU JALLADEAU, CUSSAC
87;RUE DE LOU ENAS, CUSSAC
87;RUE DU 8 MAI 1945, CUSSAC
87;PL DE LA MAISON D'ANTAN, CUSSAC
87;IMP DU MAZA, CUSSAC
87;PL DU MAZA, CUSSAC
87;CHE DE LA MONTEE, CUSSAC
87;RTE DE NEGRELAT, CUSSAC
87;RUE DE LA PALENE, CUSSAC
87;RUE PASTOURELLE, CUSSAC
87;RUE DES PETITS PARCS, CUSSAC
87;ALL DES PRES VERTS, CUSSAC
87;RUE DE LA PLAINE, CUSSAC
87;PAS DU PRESSOIR, CUSSAC
87;RUE DES ROSEAUX, CUSSAC
87;PROM DES SERVES, CUSSAC
87;RUE DES SINTIERS, CUSSAC
87;RUE DES TAMARIS, CUSSAC
87;RUE DE LA TARDOIRE, CUSSAC
87;RUE DES TILLEULS, CUSSAC
87;RLE TRAVERSIERE, CUSSAC
87;RUE DES MESANGES, CUSSAC
87;PL FONTAINE DES FELIBRES, CUSSAC
87;PL DE LA MAIRIE, CUSSAC
87;ALL DE L'ABBAYE, CUSSAC
87;RUE DE L'ABREUVOIR, CUSSAC
87;RUE DES ANCIENNES ECOLES, CUSSAC
87;RUE DE L'AUBEPINE, CUSSAC
87;IMP DE LA BILLE, CUSSAC
87;ALL DES BOIS, CUSSAC
87;PL DU BOUERADOUR, CUSSAC
87;CHE DU BOUERADOUR, CUSSAC
87;RUE DU BRUNET, CUSSAC
87;IMP DES BUIS, CUSSAC
87;CHE DES CAILLOUX, CUSSAC
87;CHE DES CAVAILLES, CUSSAC
87;PL DES CAMELIAS, CUSSAC
87;RTE CHAMPETRE, CUSSAC
87;ALL DES CERISES, CUSSAC
87;CHE DES CHASSEURS, CUSSAC
87;ALL DU CHATEAU, CUSSAC
87;IMP DU CHATENET, CUSSAC
87;CHE DES CHENES DE LA BREGERE, CUSSAC
87;CHE DU CLEDIER DE CHAMBINAUD, CUSSAC
87;RUE DES CHOMES, CUSSAC
87;RUE DES CLEDIERS DE VERGNOLAS, CUSSAC
87;RTE DES CLEDIERS DES CHAMPS, CUSSAC
87;RTE DE CUSSAC, CUSSAC
87;RUE DES ECOLIERS, CUSSAC
87;CHE D'EN HAUT, CUSSAC
87;RUE DE L'ETANG, CUSSAC
87;RUE DES ERABLES, CUSSAC
87;CHE DU CLOUTIER, CUSSAC
87;ALL DES ETANGS, CUSSAC
87;RUE DE FARGETAS, CUSSAC
87;CHE DU FACTEUR, CUSSAC
87;RUE DE LA FERME, CUSSAC
87;RLE DES FILEUSES, CUSSAC
87;RUE DU FORGERON, CUSSAC
87;PL DES FONDEURS DE CLOCHES, CUSSAC
87;RUE DE LA FONTAINE DES PRES, CUSSAC
87;RUE DES FOURS A PAIN, CUSSAC
87;RTE DE GABOUREAU, CUSSAC
87;ALL DE LA GARENNE, CUSSAC
87;RTE DES GEAIS, CUSSAC
87;RUE DES GLYCINES, CUSSAC
87;RUE DU GRAND PRE, CUSSAC
87;ALL DES GRANDS BOS, CUSSAC
87;RUE DES GRANDS JARDINS, CUSSAC
87;RTE DE LA GENETTE, CUSSAC
87;ALL DU GROS TILLEUL, CUSSAC
87;RUE DES HETRES, CUSSAC
87;ALL DES HORTENSIAS, CUSSAC
87;ALL DES HOUX, CUSSAC
87;RUE DES IRIS, CUSSAC
87;ALL DES JARDINS, CUSSAC
87;RUE DES JONQUILLES, CUSSAC
87;IMP DU LAVOIR, CUSSAC
87;PAS DU LAVOIR, CUSSAC
87;RUE DES LILAS, CUSSAC
87;ALL DES LILAS BLANCS, CUSSAC
87;RUE DES MAGNOLIAS, CUSSAC
87;PASS DE LA MANIGNE, CUSSAC
87;RUE DU MAQUIS DE GABOUREAU, CUSSAC
87;RUE DES MIMOSAS, CUSSAC
87;RTE DES MARRONNIERS, CUSSAC
87;CHE DU MOULIN DE GRAFFEUIL, CUSSAC
87;RTE DU MOULIN DE LA BREGERE, CUSSAC
87;RUE DES MURETS, CUSSAC
87;RUE DES MURETS FLEURIS, CUSSAC
87;RUE DU MOULIN DE BOUBON, CUSSAC
87;CHE DU MOULIN DE BOUBON, CUSSAC
87;RUE DE LA GRANDE MAISON, CUSSAC
87;IMP DES OISEAUX, CUSSAC
87;RUE DES NOUGERIES, CUSSAC
87;CHE DES NEGRERIS, CUSSAC
87;RUE DE LA NOEMIE, CUSSAC
87;IMP DU PARC, CUSSAC
87;RUE DU PASSADOUR, CUSSAC
87;RUE DE LA PETITE FONTAINE, CUSSAC
87;CHE DES PINELOUS, CUSSAC
87;RUE DU PUITS DE FARGETAS, CUSSAC
87;PL DU PUITS DE CROMIERES, CUSSAC
87;ALL DU PUY DE CUSSAC, CUSSAC
87;PL DU PUITS FLEURI, CUSSAC
87;RUE DES PUITS DE FAYOLAS, CUSSAC
87;CHE DES REBEYRATES, CUSSAC
87;RUE DES REBEYROLLES, CUSSAC
87;RTE RICHARD COEUR DE LION, CUSSAC
87;RUE ROSIERS NEGRELAT, CUSSAC
87;IMP DES SAULES, CUSSAC
87;RUE DE SOUMAGNAT, CUSSAC
87;RUE DES SOURCES FRAICHES, CUSSAC
87;RUE DES SOURCES DES RIBIERES, CUSSAC
87;VEN DU TAPISSIER, CUSSAC
87;RUE DU VAL DE TARDOIRE, CUSSAC
87;CHE DE LA TARDOIRE, CUSSAC
87;IMP DU TEMPLE, CUSSAC
87;ALL DU TILLEUL, CUSSAC
87;PL DU TILLEUL, CUSSAC
87;IMP DU TRAVAIL, CUSSAC
87;RUE TRAVERSIERE, CUSSAC
87;RUE DES VANNIERS, CUSSAC
87;IMP DES VERGNES DU MAS, CUSSAC
87;PL DE LA VIEILLE FONTAINE, CUSSAC
87;RUE DE LA VIE, CUSSAC
87;RUE DU VIEUX PUITS, CUSSAC
87;RTE DE VIMPERE, CUSSAC
87;RUE DES VIGNES, CUSSAC
87;RUE DES VIGNES BLANCHES, CUSSAC
87;RTE DE VILLAJOU, CUSSAC
87;RUE DE VERGNES DU MAS, CUSSAC
87;RUE DU ZOUAVE, CUSSAC
87;RTE DE BOULLARY, CUSSAC
87;RUE DE LA MONNERIE, CUSSAC
87;PL DE FAYOLAS, CUSSAC
87;RTE DE BOUILLARY, CUSSAC
87;RUE DES ROSIERS PUYMOROUX, CUSSAC
87;RUE DU BRUNET, DINSAC
87;RUE DES CHENES, DINSAC
87;IMP DE LA FERME, DINSAC
87;RUE DE L'ANCIENNE FORGE, DINSAC
87;RUE DE LA FONTAINE, DINSAC
87;RUE DE LA MAIRIE, DINSAC
87;RUE FRANCOIS MITTERAND, DINSAC
87;RUE DE LA PIECE DES ROCHERS, DINSAC
87;PL DES TILLEULS, DINSAC
87;AV DE VERDUN, DINSAC
87;RUE DE LA BASCULE, DOMPIERRE-LES-EGLISES
87;RTE DU BEAUVERT, DOMPIERRE-LES-EGLISES
87;RUE DE L'EGLISE, DOMPIERRE-LES-EGLISES
87;RUE DU GITE, DOMPIERRE-LES-EGLISES
87;RTE DE MAGNAC LAVAL, DOMPIERRE-LES-EGLISES
87;RUE DE LA MAIRIE, DOMPIERRE-LES-EGLISES
87;RUE DU MONUMENT, DOMPIERRE-LES-EGLISES
87;RUE DE LA PETITE RUE, DOMPIERRE-LES-EGLISES
87;PL DES PLATANES, DOMPIERRE-LES-EGLISES
87;PL DE PUYBAUDET, DOMPIERRE-LES-EGLISES
87;RTE AUX AIGUILLONS, DOMPS
87;IMP AUX AIGUILLONS, DOMPS
87;IMP DE L'ANCIEN FOUR A PAIN, DOMPS
87;PL LE BOURG, DOMPS
87;IMP LA BORDERIE, DOMPS
87;IMP AU BOS, DOMPS
87;RTE DU GRAND BOUCHET, DOMPS
87;RTE DU PETIT BOUCHET, DOMPS
87;RTE DE CHAMBERET, DOMPS
87;IMP DE CHANTEPERDRIX, DOMPS
87;IMP AU CHATEAU, DOMPS
87;RTE DU CHEYROUX, DOMPS
87;IMP LES CLIDES, DOMPS
87;IMP DE COMBE DERRIERE, DOMPS
87;IMP LAS COTAS, DOMPS
87;RUE DE L'EGLISE, DOMPS
87;RUE DES ETANGS, DOMPS
87;RTE D'EYMOUTIERS, DOMPS
87;RTE DU FOSSE, DOMPS
87;RTE DE SAINT GILLES LES FORETS, DOMPS
87;RTE DE GRIGEAS, DOMPS
87;RTE DE LANDEIX, DOMPS
87;RUE DE LA MAIRIE, DOMPS
87;RTE DE MELZAT, DOMPS
87;RTE DU MOULIN DES FEUILLES, DOMPS
87;RTE DU MOULIN DE VAUX, DOMPS
87;RUE LAS PERIRAS, DOMPS
87;IMP DU POINT DU JOUR, DOMPS
87;PL SAINT PSALMET, DOMPS
87;RLE DU PUITS, DOMPS
87;RUE DU GRAND PUY, DOMPS
87;RTE DE REBEYROLLE, DOMPS
87;RTE DE LA RIBIERE, DOMPS
87;RTE DE SUSSAC, DOMPS
87;IMP LES TERMES, DOMPS
87;IMP DE TERRE NOIRE, DOMPS
87;IMP DE TRAYEUX, DOMPS
87;RTE DE VAUX, DOMPS
87;IMP DE VAUX, DOMPS
87;RTE DES VERGNASSES, DOMPS
87;BD DU ROCK, DOMPS
87;PL PLACE DE L EGLISE, DOMPS
87;LOT LES CHARRAUDS, LE DORAT
87;LOT DU COURTOISON, LE DORAT
87;SQ DE L ABBE ROUGERIE, LE DORAT
87;RTE DE LAMONT, LE DORAT
87;ALL DES CARRIERES, LE DORAT
87;RUE DU CHATEAU D'EAU, LE DORAT
87;IMP DES JARDINS, LE DORAT
87;IMP DES ROCHERS, LE DORAT
87;ALL DES CHENES, LE DORAT
87;FG DE L ANCIEN HOPITAL, LE DORAT
87;PL DE L'ANCIEN PRESBYTERE, LE DORAT
87;RUE DE L'ANCIENNE FORGE, LE DORAT
87;RUE AUBUGEOIS VILLE DU BOST, LE DORAT
87;RTE DE LA BARRE, LE DORAT
87;RTE DU BAS VOULONS, LE DORAT
87;RTE DE BELLAC, LE DORAT
87;RUE DES BOUCHERS, LE DORAT
87;RUE BOUCHEUL, LE DORAT
87;RTE DE LA BUSSIERE AUPIGNY, LE DORAT
87;ALL DU CEDRE, LE DORAT
87;PL DU CHAMP DE FOIRE, LE DORAT
87;RUE CHARLES BLANCHAUD, LE DORAT
87;PL CHARLES DE GAULLE, LE DORAT
87;AV DU CHATEAU, LE DORAT
87;FG DU CHATEAU, LE DORAT
87;PL BERTRAND CLISSON, LE DORAT
87;CHE DE SAINT CLOUD, LE DORAT
87;PL DE LA COLLEGIALE, LE DORAT
87;RUE COURBE, LE DORAT
87;RUE DE LA CROIX PAROT, LE DORAT
87;RTE DE DINSAC, LE DORAT
87;RUE DU 19 MARS 1962, LE DORAT
87;RUE DES ECOLIERS, LE DORAT
87;CHE DE LA FANTAISIE, LE DORAT
87;RUE DE LA FANTAISIE, LE DORAT
87;RUE DES FOURS, LE DORAT
87;AV FRANCOIS DE LA JOSNIERE, LE DORAT
87;RUE FRANCOIS MITTERRAND, LE DORAT
87;AV DE LA GARE, LE DORAT
87;RUE DES GAUDINOTTES, LE DORAT
87;RTE DE GRAND CHAMP, LE DORAT
87;RTE DU HAUT VOULONS, LE DORAT
87;RUE HENRY DUNANT, LE DORAT
87;RUE HENRI MOREAU, LE DORAT
87;PL DE L HOZANNE, LE DORAT
87;RUE DE L HOZANNE, LE DORAT
87;IMP DES JARDINIERS, LE DORAT
87;RUE JOSEPH GUILLEMOT, LE DORAT
87;RUE JULES SOTTA, LE DORAT
87;AV DE LATTRE DE TASSIGNY, LE DORAT
87;RUE LAURENT ROBERT, LE DORAT
87;CHE DE LA LIEUE, LE DORAT
87;AV LOUIS RICOUX, LE DORAT
87;AV LUCIEN LIORET, LE DORAT
87;PL DU MANEGE, LE DORAT
87;RLE DU MARCHE, LE DORAT
87;RUE MARECHAL LECLERC, LE DORAT
87;RTE DU MASSARD, LE DORAT
87;SQ MICHEL PORTAL, LE DORAT
87;RTE DE MONTMORILLON, LE DORAT
87;RTE DE MOUNISMES, LE DORAT
87;RTE DE LA PLANCHE DES DAMES, LE DORAT
87;FG DU PONT, LE DORAT
87;RUE DE LA PORTE BERGERE, LE DORAT
87;FG DE LA PORTE DE DINSAC, LE DORAT
87;AV DU PDT GEORGES POMPIDOU, LE DORAT
87;RUE DES PRETRES, LE DORAT
87;IMP DU PRINCE NOIR, LE DORAT
87;CHE DE LA PROCESSION, LE DORAT
87;RUE DE LA PSALETTE, LE DORAT
87;RUE DU PUITS CHATONNIER, LE DORAT
87;RUE DU PUYMONTEIL, LE DORAT
87;BD DES PYRENEES, LE DORAT
87;RUE RANCONNIERE, LE DORAT
87;RUE RAYMOND CHAMEAUX, LE DORAT
87;IMP DES REMPARTS, LE DORAT
87;RUE ROBERT LAPAYRIERE, LE DORAT
87;RLE DE LA ROCHE, LE DORAT
87;RUE ROUGE, LE DORAT
87;RUE ROULOTTE, LE DORAT
87;GR GRANDE RUE, LE DORAT
87;ALL SAINT ISRAEL, LE DORAT
87;PL SAINT JEAN, LE DORAT
87;RUE SAINT JEAN, LE DORAT
87;BD SAINT LOUIS, LE DORAT
87;RUE SAINT LOUIS, LE DORAT
87;RUE SAINT MICHEL, LE DORAT
87;RUE DE LA SENDILLE, LE DORAT
87;RUE DES TANNERIES, LE DORAT
87;FG DES TANNERIES, LE DORAT
87;PL DES TILLEULS, LE DORAT
87;RUE DES VAUDIEUX, LE DORAT
87;AV DE VERDUN, LE DORAT
87;AV DES VIGNES, LE DORAT
87;BD DU 8 MAI 1945, LE DORAT
87;LOT DES CHOMES, DOURNAZAC
87;HAM DU GRAND PUYCONIEUX, DOURNAZAC
87;HAM DU DESERT, DOURNAZAC
87;HAM DE LA PIERRE BLANCHE, DOURNAZAC
87;VGE DE LA COTE, DOURNAZAC
87;HAM DE BALLANGEAS, DOURNAZAC
87;HAM DE BUSSIERE L'EPINE, DOURNAZAC
87;VGE DE LA BUSSIERE MONTBRUN, DOURNAZAC
87;FRM DE VIGNERAS, DOURNAZAC
87;HAM DE VIGNERAS, DOURNAZAC
87;CHE D'ARRIVAUD, DOURNAZAC
87;PAS D'ARRIVAUD, DOURNAZAC
87;RUE D'ARRIVAUD, DOURNAZAC
87;RTE DE BALLANGEAS, DOURNAZAC
87;RTE BORD, DOURNAZAC
87;RTE DU PETIT BORD, DOURNAZAC
87;RTE DE BUSSIERE, DOURNAZAC
87;RTE DES CAPTAGES, DOURNAZAC
87;RUE DES CHATAIGNIERS, DOURNAZAC
87;RTE DU CHATEAU, DOURNAZAC
87;CHE DE CHAUMEIX, DOURNAZAC
87;RUE DES CHEVRETTES, DOURNAZAC
87;RUE DES CHOMES, DOURNAZAC
87;CHE DES CONGERIES, DOURNAZAC
87;CHE DE LA COTE, DOURNAZAC
87;RUE DE LA CROIX BLANCHE, DOURNAZAC
87;RUE DE LA CROIX DU BAC, DOURNAZAC
87;RUE DU 19 MARS, DOURNAZAC
87;CHE DU DOURNAUJOU, DOURNAZAC
87;RUE DE L'ECHANIE, DOURNAZAC
87;CHE DE L'ECHANIE, DOURNAZAC
87;CHE DE FERASSE, DOURNAZAC
87;PAS DE FERASSE, DOURNAZAC
87;RUE DES FEUILLARDIERS, DOURNAZAC
87;RUE DE LA FONTAINE, DOURNAZAC
87;RUE DE LA FONTAINE SAINT PIERR, DOURNAZAC
87;RUE DE LA FONTAINE ST SULPICE, DOURNAZAC
87;RUE DU FORT DU BOST, DOURNAZAC
87;CHE DES FOURS, DOURNAZAC
87;CHE DE LA GARNAUDIE, DOURNAZAC
87;RTE DU GRAND PUYCONNIEUX, DOURNAZAC
87;RUE GRAND PUYCONIEUX VILLAGE, DOURNAZAC
87;PAS DE LA GARNAUDIE, DOURNAZAC
87;RTE DE LA GARNAUDIE, DOURNAZAC
87;RTE DE LA GAUDONIE, DOURNAZAC
87;IMP DES HORTENSIAS, DOURNAZAC
87;RUE DU 8 MAI, DOURNAZAC
87;RTE DE LATTERIE, DOURNAZAC
87;RTE DE LONGEAIGUE, DOURNAZAC
87;PAS DE MAPPAS, DOURNAZAC
87;RUE DE MAPPAS, DOURNAZAC
87;RUE DE MONTBRUN, DOURNAZAC
87;RTE DE MONTBRUN, DOURNAZAC
87;CHE DE MONCHATY, DOURNAZAC
87;RUE DU 11 NOVEMBRE, DOURNAZAC
87;RUE DU PETIT CHATENET, DOURNAZAC
87;CHE DE LA PIERRE BLANCHE, DOURNAZAC
87;CHE DES POMPERIES, DOURNAZAC
87;RUE DE LA POSTE, DOURNAZAC
87;PAS DU PUYCONNIEUX, DOURNAZAC
87;IMP DU PUITS, DOURNAZAC
87;RUE DU PUITS, DOURNAZAC
87;RUE RAOUL MONRIBOT, DOURNAZAC
87;CHE DE LA REILLE, DOURNAZAC
87;SEN DU RELAIS, DOURNAZAC
87;CHE DE LA ROUGERIE, DOURNAZAC
87;RTE DE LA ROUGERIE, DOURNAZAC
87;CHE DES SERVES, DOURNAZAC
87;CHE DE LA SOUPEZE, DOURNAZAC
87;PAS DE LA SOUPEZE, DOURNAZAC
87;RUE DU STADE, DOURNAZAC
87;RTE DES VERGNES, DOURNAZAC
87;PAS DE VIALEBESOIN, DOURNAZAC
87;RTE DE VIALEBESOIN, DOURNAZAC
87;RTE DE VIGNERAS, DOURNAZAC
87;LOT RAYMOND POULIDOR, DROUX
87;PL ABBE PIERRE, DROUX
87;RUE AIME VALLAT, DROUX
87;PL ARISTIDE BRIAND, DROUX
87;IMP DE CHAMBORAND, DROUX
87;RUE DE LA CHAPELLE, DROUX
87;RUE DANIELE MITTERRAND, DROUX
87;RUE DU 19 MARS 62, DROUX
87;RUE FREDERIC CHOPIN, DROUX
87;RUE GEORGE SAND, DROUX
87;RUE GEORGES GUINGOUIN, DROUX
87;SQ GEORGES LAMOUSSE, DROUX
87;RUE DU 8 MAI 45, DROUX
87;RUE JEAN GIRAUDOUX, DROUX
87;PL JEAN JAURES, DROUX
87;RUE JEAN MOULIN, DROUX
87;RUE LA CHEBROLLE DE L'HUILERIE, DROUX
87;RUE JULES FERRY, DROUX
87;RUE LEMBACH, DROUX
87;RUE MARIE CURIE, DROUX
87;RUE MARTIN NADAUD, DROUX
87;PL DES TILLEULS, DROUX
87;IMP VICTOR HUGO, DROUX
87;CHE DES ACACIAS, EYBOULEUF
87;IMP DES BARRIERES, EYBOULEUF
87;RUE DES BETOULLES, EYBOULEUF
87;IMP DU BUREAU DE TABAC, EYBOULEUF
87;IMP DES CHARMILLES, EYBOULEUF
87;RTE DES COMBEAUX, EYBOULEUF
87;RUE DE LA CROIX, EYBOULEUF
87;SEN DE DANDALOU, EYBOULEUF
87;SEN DU DOLMEN, EYBOULEUF
87;RUE DE L'ETANG, EYBOULEUF
87;RUE DE LA GENEYTOUSE, EYBOULEUF
87;RUE DE LA LIBERTE, EYBOULEUF
87;SEN DES MAQUISARDS, EYBOULEUF
87;RTE DU MASBARET, EYBOULEUF
87;RTE DU PATURAL, EYBOULEUF
87;CHE DES PRUNIERS, EYBOULEUF
87;RUE DE SAINT LEONARD DE NOBLAT, EYBOULEUF
87;PL SAINT PIERRE ES LIENS, EYBOULEUF
87;RUE DE LA TUILERIE, EYBOULEUF
87;RTE DES VERGNES, EYBOULEUF
87;RTE DE VEYVIALLE, EYBOULEUF
87;RUE DES VIGNES, EYBOULEUF
87;RTE DES ALLOIS, EYJEAUX
87;PL DE L'ANCIEN LAVOIR, EYJEAUX
87;RTE DES AULNES, EYJEAUX
87;ALL DES AULIERES, EYJEAUX
87;ALL DU BAS GRIS, EYJEAUX
87;ALL DE LA BASSE COUR, EYJEAUX
87;ALL DU BESSAUD, EYJEAUX
87;RTE DE BELLEGARDE, EYJEAUX
87;IMP DES BOIS, EYJEAUX
87;ALL DU BOS VIEUX, EYJEAUX
87;IMP DES BOSQUETS, EYJEAUX
87;ALL DU BOUCHERON, EYJEAUX
87;RTE DE BOISSEUIL, EYJEAUX
87;RUE DU BOURG NEUF, EYJEAUX
87;ALL DES BRULADES, EYJEAUX
87;ALL DU BREUIL, EYJEAUX
87;ALL DES CAILLES, EYJEAUX
87;ALL DES CARDINAUX, EYJEAUX
87;ALL DE LA CHABANNE, EYJEAUX
87;ALL DE LA CHATAIGNERAIE, EYJEAUX
87;ALL DES CHENES, EYJEAUX
87;RTE DES CORNUDES, EYJEAUX
87;ALL DE LA CROIX DES RAMEAUX, EYJEAUX
87;RUE DES ECOLES, EYJEAUX
87;PL DE L'EGLISE, EYJEAUX
87;ALL D'ENGARENNE, EYJEAUX
87;RTE D'EYMOUTIERS, EYJEAUX
87;ALL DE FONTAINE CAILLAUD, EYJEAUX
87;RTE DE FEYTIAT, EYJEAUX
87;ALL DE LA FORET, EYJEAUX
87;RTE DE FRAISSEIX, EYJEAUX
87;RTE DU GRAND BOS, EYJEAUX
87;RTE DE LA JANTINE, EYJEAUX
87;RTE DE LAUBAUDIE, EYJEAUX
87;ALL DES LANDES, EYJEAUX
87;RUE DE LATHIERE, EYJEAUX
87;ALL DE LAUTERIE, EYJEAUX
87;RTE DES LIEVRES, EYJEAUX
87;RTE DE LEYRAOUT, EYJEAUX
87;ALL DU MAS BARETTE, EYJEAUX
87;ALL DU MAS NEUF, EYJEAUX
87;ALL DU MAS GAUTHIER, EYJEAUX
87;ALL DE LA MERE FONTAINE, EYJEAUX
87;ALL DES MINES, EYJEAUX
87;ALL DE MONTIGNAC, EYJEAUX
87;CHE DU MOUSSAN, EYJEAUX
87;RTE DU MOUSSAN, EYJEAUX
87;ALL DES MURETS, EYJEAUX
87;IMP DES NOISETIERS, EYJEAUX
87;RTE DES NOUAILLES, EYJEAUX
87;ALL DES PAPILLONS, EYJEAUX
87;ALL DE LA PECHERIE, EYJEAUX
87;ALL DES PERDRIX, EYJEAUX
87;ALL DES PETITS BOS, EYJEAUX
87;ALL DU PETIT BOS VIEUX, EYJEAUX
87;ALL DU PETIT RUISSEAU, EYJEAUX
87;ALL DE LA PETITE VALADE, EYJEAUX
87;CHE DES ESSARTROUX, EYJEAUX
87;ALL DU PLAINARD, EYJEAUX
87;ALL DES PLANCHETTES, EYJEAUX
87;RTE DE POULENAT, EYJEAUX
87;ALL DU PRADAUD, EYJEAUX
87;ALL DU PRE LA VIGNE, EYJEAUX
87;CHE DU PRIEURE, EYJEAUX
87;ALL DES PUITS, EYJEAUX
87;ALL DU PUY LA VIGNE, EYJEAUX
87;ALL DE LA RENARDIERE, EYJEAUX
87;ALL DE LA RESIDENCE L'EVEILLE, EYJEAUX
87;ALL DES RIVADES, EYJEAUX
87;RTE DE SAINT HILAIRE BONNEVAL, EYJEAUX
87;CHE ST JACQUES DE COMPOSTELLE, EYJEAUX
87;ALL DES SALLES, EYJEAUX
87;RTE DE SAINT HUBERT, EYJEAUX
87;RTE DES SECHERES, EYJEAUX
87;IMP DE LEYRAOUT BAS, EYJEAUX
87;RTE DE SAINT PAUL, EYJEAUX
87;ALL DES SOURCES, EYJEAUX
87;ALL DU TILLEUL, EYJEAUX
87;RUE DU VERGER, EYJEAUX
87;RTE DU VICQ, EYJEAUX
87;ALL DES VIEILLES MAISONS, EYJEAUX
87;ALL DE LA VILLATTE, EYJEAUX
87;IMP DU VIEUX POULENAT, EYJEAUX
87;RTE DES HAUTS DE GRIS, EYJEAUX
87;ALL DU PUY LA VIGNE, EYJEAUX
87;CITE NIEDERBRONN LES BAINS, EYMOUTIERS
87;AV DE L ABATTOIR, EYMOUTIERS
87;CHE DES AUBEPINES, EYMOUTIERS
87;BD AYGUES VIVES, EYMOUTIERS
87;ALL BARBARA, EYMOUTIERS
87;CHE DES BARRYS, EYMOUTIERS
87;PL DES BARRYS, EYMOUTIERS
87;AV BEL AIR, EYMOUTIERS
87;AV BELLEVUE, EYMOUTIERS
87;RUE DU BOIS CHALE, EYMOUTIERS
87;AV BOIS SAINT GILLES, EYMOUTIERS
87;CHE DU BUCHOU, EYMOUTIERS
87;RUE DES BUGES, EYMOUTIERS
87;CITE BOIS SAINT GILLES, EYMOUTIERS
87;CITE DES CASTORS, EYMOUTIERS
87;PL DU CHAMP DE FOIRE, EYMOUTIERS
87;PL DU CHAPITRE, EYMOUTIERS
87;RTE DE CHATEAU, EYMOUTIERS
87;RUE DES CLAIRETTES, EYMOUTIERS
87;ALL CLAUDE HENRI GORCEIX, EYMOUTIERS
87;CHE CLAUDE NOUGARO, EYMOUTIERS
87;RUE DES CLOITRES, EYMOUTIERS
87;RUE DE LA COLLEGIALE, EYMOUTIERS
87;RUE DE LA CONDAMINE, EYMOUTIERS
87;CHE DE LA COMBE AUX LOUPS, EYMOUTIERS
87;RUE DE TOULONDIT, EYMOUTIERS
87;CHE DU PRE LANAUT, EYMOUTIERS
87;RUE GERARD PHILIPPE, EYMOUTIERS
87;IMP JACQUES BREL, EYMOUTIERS
87;IMP AYGUES VIVES, EYMOUTIERS
87;RUE DE L EYCOUSSINERIE, EYMOUTIERS
87;CHE DIESPECK, EYMOUTIERS
87;CHE PIERRE CARIAUX, EYMOUTIERS
87;RUE DU PONT DE PEYRAT, EYMOUTIERS
87;CHE DE LA TOUR, EYMOUTIERS
87;CHE DE LA COTE DE CHATEAU, EYMOUTIERS
87;CHE DE LA FONT MACAIRE, EYMOUTIERS
87;CHE DE LA COTE L OR, EYMOUTIERS
87;RUE DU DIX HUIT JUIN 1940, EYMOUTIERS
87;RUE DE LA PISSAROTE, EYMOUTIERS
87;RUE DU VIEUX COLLEGE, EYMOUTIERS
87;AV JEAN MOULIN, EYMOUTIERS
87;CHE DU VERGER, EYMOUTIERS
87;RUE DE LA DELICIEUSE, EYMOUTIERS
87;IMP EDITH PIAF, EYMOUTIERS
87;BD EMILE ZOLA, EYMOUTIERS
87;RUE DES ETANCHOUX, EYMOUTIERS
87;RUE DE L EVEQUE, EYMOUTIERS
87;RUE FARGES, EYMOUTIERS
87;PL FONTAINE DES COOPERATEURS, EYMOUTIERS
87;RUE FRANCOIS RICHARD, EYMOUTIERS
87;RUE FREDERIC CHOPIN, EYMOUTIERS
87;IMP FREDERIC CHOPIN, EYMOUTIERS
87;CHE DE FRESSINGEAS, EYMOUTIERS
87;RUE GABRIEL PERI, EYMOUTIERS
87;AV DE LA GARE, EYMOUTIERS
87;AV GEORGES BRASSENS, EYMOUTIERS
87;IMP HENRI MATISSE, EYMOUTIERS
87;RUE DU HUIT MAI 1945, EYMOUTIERS
87;PL JEAN JAURES, EYMOUTIERS
87;AV JULES FRAISSEIX, EYMOUTIERS
87;BD JULES GUESDE, EYMOUTIERS
87;BD KARL MARX, EYMOUTIERS
87;RUE KARL MARX, EYMOUTIERS
87;RTE DU LAC, EYMOUTIERS
87;CHE LE PRE LANAUD, EYMOUTIERS
87;BD LENINE, EYMOUTIERS
87;BD DE LA LIBERATION, EYMOUTIERS
87;RUE DE LA LIBERTE, EYMOUTIERS
87;AV LOUISE MICHEL, EYMOUTIERS
87;FG DE MACAUD, EYMOUTIERS
87;PL DE LA MAIRIE, EYMOUTIERS
87;RUE DES MAQUISARDS, EYMOUTIERS
87;AV DU MARECHAL FOCH, EYMOUTIERS
87;AV DU 19 MARS 1962, EYMOUTIERS
87;RUE MAURICE RAVEL, EYMOUTIERS
87;CHE DU MIRABEAU, EYMOUTIERS
87;RUE MOLIERE, EYMOUTIERS
87;RUE MONTE A CHATEAU, EYMOUTIERS
87;PL DU MOULIN, EYMOUTIERS
87;RTE DE NEDDE, EYMOUTIERS
87;AV DE LA PAIX, EYMOUTIERS
87;RUE LOUIS PASTEUR, EYMOUTIERS
87;RUE NOTRE DAME, EYMOUTIERS
87;RUE DES PENITENTS, EYMOUTIERS
87;AV DE LA PEYRADE, EYMOUTIERS
87;AV PICASSO, EYMOUTIERS
87;RUE PIERRE CARRIAUX, EYMOUTIERS
87;RUE DE LA PISSARATE, EYMOUTIERS
87;RUE PIERRE ET MARIE CURIE, EYMOUTIERS
87;IMP DE LA PLANCHETTE, EYMOUTIERS
87;AV DU POINT DU JOUR, EYMOUTIERS
87;RUE DU PONT DE NEDDE, EYMOUTIERS
87;BD DES POROTS, EYMOUTIERS
87;RUE DU PRE CAPIROU, EYMOUTIERS
87;RUE DU PRE THIBAUD, EYMOUTIERS
87;RUE DE LA PREVOTE, EYMOUTIERS
87;RUE DU PUY D AYEN, EYMOUTIERS
87;VC QRTS DES BARRYS, EYMOUTIERS
87;RUE RABELAIS, EYMOUTIERS
87;RUE DE LA REPUBLIQUE, EYMOUTIERS
87;RUE DES RESISTANTS, EYMOUTIERS
87;VC PGE SAINT ETIENNE, EYMOUTIERS
87;FG DE SAINT GILLES, EYMOUTIERS
87;RUE SAINT PSALMET, EYMOUTIERS
87;AV DE SAINTE ANNE, EYMOUTIERS
87;RTE DE SAINTE ANNE, EYMOUTIERS
87;RUE DE SAINT-PIERRE CHATEAU, EYMOUTIERS
87;AV SALVADOR ALLENDE, EYMOUTIERS
87;RUE JEAN PAUL SARTRE, EYMOUTIERS
87;RUE DE SERPEILLERAS, EYMOUTIERS
87;CHE DES SOURCES, EYMOUTIERS
87;PROM DES SPORTS, EYMOUTIERS
87;IMP STALINGRAD, EYMOUTIERS
87;PL STALINGRAD, EYMOUTIERS
87;RUE DES TANNERIES, EYMOUTIERS
87;BD DE LA TOUR D AYEN, EYMOUTIERS
87;ALL DU TOURVILLE, EYMOUTIERS
87;RUE DES URSULINES, EYMOUTIERS
87;AV DE VERSAILLES, EYMOUTIERS
87;CHE DE VERSAILLES, EYMOUTIERS
87;BD VICTOR HUGO, EYMOUTIERS
87;RUE DE LA VIEILLE TOUR, EYMOUTIERS
87;CHE DE FREYSSINGEAS, EYMOUTIERS
87;RES CROIX DES RAMEAUX, FEYTIAT
87;LOT LES JARDINS D'OPALE, FEYTIAT
87;PAS DE L ABREUVOIR, FEYTIAT
87;SQ VOLTAIRE, FEYTIAT
87;SQ CHARLES PERRAULT, FEYTIAT
87;ALL MARCELLE DELPASTRE, FEYTIAT
87;ALL DE LA GRIVE, FEYTIAT
87;ALL DU CLOS, FEYTIAT
87;RUE ADRIEN PRESSEMANE, FEYTIAT
87;ALL DU CHATAIGNIER, FEYTIAT
87;IMP DE LESSART, FEYTIAT
87;ALL MONTESQUIEU, FEYTIAT
87;ALL MICKAEL FARADAY, FEYTIAT
87;BD ALBERT CAMUS, FEYTIAT
87;RUE D ALLEMAGNE, FEYTIAT
87;ALL CHATEAU D'EAU, FEYTIAT
87;RUE D ALSACE, FEYTIAT
87;ALL DES VIGNES, FEYTIAT
87;RUE ANATOLE FRANCE, FEYTIAT
87;ALL GRIVES, FEYTIAT
87;CHE DE L ANCIEN AEROPORT, FEYTIAT
87;RUE ANTOINE BOURNAZAUD, FEYTIAT
87;RUE ANDRE AMPERE, FEYTIAT
87;ALL D AQUITAINE, FEYTIAT
87;ALL D ARDENNES, FEYTIAT
87;RUE D'ANJOU, FEYTIAT
87;ALL DU HERISSON, FEYTIAT
87;RUE ARISTIDE BRIAND, FEYTIAT
87;ALL DES AUBEPINES, FEYTIAT
87;RUE ARSENE D ARSONVAL, FEYTIAT
87;RUE AUGUSTE RENOIR, FEYTIAT
87;ALL D ARTOIS, FEYTIAT
87;ALL AURELIEN LOUIS DENIS, FEYTIAT
87;ALL VICTOR BALTARD, FEYTIAT
87;ALL DE L'ARTISANAT, FEYTIAT
87;ALL D AUVERGNE, FEYTIAT
87;ALL DES BANNETTES, FEYTIAT
87;RUE DU BAS FARGEAS, FEYTIAT
87;ALL DE LA BASSE PLAGNE, FEYTIAT
87;RUE DE LA PLAGNE, FEYTIAT
87;IMP BEAU SITE, FEYTIAT
87;PL DE LA BASTILLE, FEYTIAT
87;ALL DES BICHES, FEYTIAT
87;SQ DE BELGIQUE, FEYTIAT
87;SQ DU BEARN, FEYTIAT
87;VC DE BELLEVUE, FEYTIAT
87;PL DES BIARDS, FEYTIAT
87;RUE DE BOURGOGNE, FEYTIAT
87;ALL DE BRETAGNE, FEYTIAT
87;IMP BOILEAU, FEYTIAT
87;ALL DU CANTOU, FEYTIAT
87;IMP DES CADETS, FEYTIAT
87;PAS DU CAROUSSEL, FEYTIAT
87;RUE DE LA CAVALERIE, FEYTIAT
87;IMP CLAUDE FRANCOIS, FEYTIAT
87;IMP DES CHARMILLES, FEYTIAT
87;RUE DES CLISSES, FEYTIAT
87;RUE DE LA COLLINE, FEYTIAT
87;RUE DE LA CARRIERE, FEYTIAT
87;RUE DU COMMANDANT CHARCOT, FEYTIAT
87;ALL DE LA CROIX DE FER, FEYTIAT
87;PL DU DOCTEUR SCHWEITZER, FEYTIAT
87;SQ DU 19 MARS 1962, FEYTIAT
87;ALL DU CHARDONNERET, FEYTIAT
87;ALL DES BOUTONS D OR, FEYTIAT
87;RTE DES BRUGES, FEYTIAT
87;ALL DES CEPES, FEYTIAT
87;RUE DES CHABANNES, FEYTIAT
87;ALL DU CHATENET, FEYTIAT
87;ALL DES COULEMELLES, FEYTIAT
87;IMP CLAIRE FONTAINE, FEYTIAT
87;RUE DE LESSART, FEYTIAT
87;ALL DES COQUELICOTS, FEYTIAT
87;ALL DE DION BOUTON, FEYTIAT
87;RUE DUPUYTREN, FEYTIAT
87;ALL DE L ECUREUIL, FEYTIAT
87;RUE DES ECOLES, FEYTIAT
87;IMP EDITH PIAF, FEYTIAT
87;AV EMILE ZOLA, FEYTIAT
87;ALL D ESPAGNE, FEYTIAT
87;ALL DE L'ETANG, FEYTIAT
87;RTE D'EYJEAUX, FEYTIAT
87;RUE D EYMOUTIERS, FEYTIAT
87;ALL DU FER A CHEVAL, FEYTIAT
87;RUE FERNAND MALINVAUD, FEYTIAT
87;RUE FRANCOIS MITTERRAND, FEYTIAT
87;RUE FRANCOIS MOURIOUX, FEYTIAT
87;RUE FREDERIC LEGRAND, FEYTIAT
87;SQ DE FINLANDE, FEYTIAT
87;RUE DES FRERES RIBIERE, FEYTIAT
87;ALL DES FAONS, FEYTIAT
87;AV G ET J MARTIN DU PUYTISON, FEYTIAT
87;RUE DE FONTGEAUDRANT, FEYTIAT
87;CHE DE LA FAUVETTE, FEYTIAT
87;RUE GABRIEL THAVENOT, FEYTIAT
87;ALL DES FOUGERES, FEYTIAT
87;RUE GAY LUSSAC, FEYTIAT
87;PL DE LA GAIETE, FEYTIAT
87;ALL GUY JACQUES SUIDUREAU, FEYTIAT
87;AV DU GENERAL DE GAULLE, FEYTIAT
87;RUE DES GENETS, FEYTIAT
87;PLA DES GENEVRIERS, FEYTIAT
87;RUE GEORGES CHABRIER, FEYTIAT
87;RUE GEORGES BRASSENS, FEYTIAT
87;AV GEORGES CLEMENCEAU, FEYTIAT
87;RUE GEORGES GUYNEMER, FEYTIAT
87;ALL GERARD SAUX, FEYTIAT
87;RUE DU GRAND BOIS, FEYTIAT
87;RUE DE LA GRANGE PATAUDE, FEYTIAT
87;RUE DE LA GROSSE PIERRE, FEYTIAT
87;ALL DES GIROLLES, FEYTIAT
87;PAS DE GUYENNE, FEYTIAT
87;RUE DU GUERAUDIER, FEYTIAT
87;PAS DES HARAS, FEYTIAT
87;VC DE L INDUSTRIE, FEYTIAT
87;RUE JACQUES BREL, FEYTIAT
87;ALL D ITALIE, FEYTIAT
87;ALL D IRLANDE, FEYTIAT
87;RUE JACQUELINE AURIOL, FEYTIAT
87;RUE DE L HIRONDELLE, FEYTIAT
87;ALL D IMBOURDEIX, FEYTIAT
87;AV JEAN BAPTISTE POUTARAUD, FEYTIAT
87;ALL DES HETRES, FEYTIAT
87;RUE JEAN BAYLE, FEYTIAT
87;ALL JEAN DARDANT, FEYTIAT
87;IMP JEAN DUBOIS, FEYTIAT
87;ALL JEAN GIRAUDOUX, FEYTIAT
87;RUE J J ROUSSEAU, FEYTIAT
87;RUE DE PLAISANCE, FEYTIAT
87;RUE JEAN JAURES, FEYTIAT
87;RUE JEAN MERMOZ, FEYTIAT
87;ALL JEAN MONNET, FEYTIAT
87;PL JEAN MOULIN, FEYTIAT
87;RUE JEAN REBIER, FEYTIAT
87;RUE DE BAMBOURNET, FEYTIAT
87;IMP JEAN SEGUREL, FEYTIAT
87;RUE JEAN ZAY, FEYTIAT
87;RUE JOE DASSIN, FEYTIAT
87;RUE JOLIOT CURIE, FEYTIAT
87;PL JOSEPH DOMINIQUE, FEYTIAT
87;IMP JOSEPHINE BAKER, FEYTIAT
87;RUE JULES VERNE, FEYTIAT
87;RUE LA BRUYERE, FEYTIAT
87;RUE DE LA LAICITE, FEYTIAT
87;RUE JEAN DE LA FONTAINE, FEYTIAT
87;ALL LAMARTINE, FEYTIAT
87;ALL DU LAPEREAU, FEYTIAT
87;RUE DES LATTES, FEYTIAT
87;PL LEO LAGRANGE, FEYTIAT
87;ALL DES LAURIERS, FEYTIAT
87;PL LEON BETOULLE, FEYTIAT
87;RTE DE BOISSEUIL, FEYTIAT
87;RUE LEON BLUM, FEYTIAT
87;IMP LEONARD DAURIAT, FEYTIAT
87;PL LEONARD ROUCHAUD, FEYTIAT
87;ALL LEONARD REGNIER, FEYTIAT
87;ALL TRICART LEONARD, FEYTIAT
87;RUE DE PRESSAC, FEYTIAT
87;ALL DU PUY ANDRAUD, FEYTIAT
87;ALL DE LA BELETTE, FEYTIAT
87;PL DE LEUN, FEYTIAT
87;ALL DE LA BERGERONNETTE, FEYTIAT
87;ALL LOUIS ET ROBERT VINOUR, FEYTIAT
87;ALL DE LA RESISTANCE, FEYTIAT
87;AV DE LA LIBERATION, FEYTIAT
87;ALL DU LIEVRE, FEYTIAT
87;RUE DE LA LIBERTE, FEYTIAT
87;AV DU LIMOUSIN, FEYTIAT
87;ALL DE LORRAINE, FEYTIAT
87;ALL DE LA LINGAINE, FEYTIAT
87;RUE LOUIS ARAGON, FEYTIAT
87;RUE LOUIS BLERIOT, FEYTIAT
87;RUE LOUIS ARMAND, FEYTIAT
87;RUE DU CANTOU, FEYTIAT
87;PL LOUIS TAILLEUR, FEYTIAT
87;ALL DE LA LOUTRE, FEYTIAT
87;IMP LUIS MARIANO, FEYTIAT
87;IMP DES LYS, FEYTIAT
87;SQ DU LUXEMBOURG, FEYTIAT
87;ALL DE LA MANUFACTURE, FEYTIAT
87;RUE DU MANEGE, FEYTIAT
