87;CITE SCOLAIRE PAUL ELLUARD, SAINT JUNIEN
87;ESPA BELLEVUE DE GLANE, SAINT JUNIEN
87;CD 20, SAINT JUNIEN
87;CD 21, SAINT JUNIEN
87;CD 32, SAINT JUNIEN
87;CD 32 A, SAINT JUNIEN
87;CD 37, SAINT JUNIEN
87;CD 86, SAINT JUNIEN
87;CD 116, SAINT JUNIEN
87;CD 675, SAINT JUNIEN
87;N 141, SAINT JUNIEN
87;CHE DU CABOT, SAINT JUNIEN
87;CHE DES MORTS, SAINT JUNIEN
87;CHE DE TONNISSERIE AU MN, SAINT JUNIEN
87;CR DES ABATTOIRS, SAINT JUNIEN
87;CR DU BAS CHATELARD, SAINT JUNIEN
87;CR DU BAS MOULIN AU CHALET, SAINT JUNIEN
87;CR DE BEAULIEU A CHEZ BEAU, SAINT JUNIEN
87;CR DE CHABANAS A SAINT JUNIEN, SAINT JUNIEN
87;CR DE CHAT TROMP A RENAISS, SAINT JUNIEN
87;CR DU CHATELARD AU CD 32 A, SAINT JUNIEN
87;CR DU CD 21 AU CHATELARD, SAINT JUNIEN
87;CR DU CD 32 A AU GD BOISSE, SAINT JUNIEN
87;CR DE CHEZ BEILLOU AU PUY, SAINT JUNIEN
87;CR DE CHEZ PENICAUD, SAINT JUNIEN
87;CR DE LA COTE DE CROYER, SAINT JUNIEN
87;CR DE CROYER A CERVALOZE, SAINT JUNIEN
87;CR DE CROYER A SAINT JUNIEN, SAINT JUNIEN
87;CR DES FAYEUX, SAINT JUNIEN
87;CR DE FAYOLAS A CHAT GAILL, SAINT JUNIEN
87;CR DE FONTCHABRIER, SAINT JUNIEN
87;CR DU FROMAGER, SAINT JUNIEN
87;CR DU GD PLAUD A SICIOREIX, SAINT JUNIEN
87;CR DES GOUTTES AU CHATELAR, SAINT JUNIEN
87;CR DE LA BRETAGNE, SAINT JUNIEN
87;CR DE LA LOGE, SAINT JUNIEN
87;CR DE LA RENAISSANCE, SAINT JUNIEN
87;CR DU MOULIN BRICE, SAINT JUNIEN
87;CR DU PAVILLON, SAINT JUNIEN
87;CR DU PERRIER BORD A BRETA, SAINT JUNIEN
87;CR DU PUY VALETTE A MONDAR, SAINT JUNIEN
87;CR DU PT GRANDMONT, SAINT JUNIEN
87;CR DU ROC CHENE AUX GOUTTE, SAINT JUNIEN
87;CR RTE DE SAULGOND A SICIO, SAINT JUNIEN
87;CR DE SAINT JUNIEN A BEAUL, SAINT JUNIEN
87;CR DE SAINT JUNIEN AUX CHA, SAINT JUNIEN
87;CR DE SICIOREIX A MOULIN B, SAINT JUNIEN
87;CR DU SITE COROT, SAINT JUNIEN
87;CR DU TIR A LA CROIX BLANC, SAINT JUNIEN
87;CR DE LA VC 37 A CHEZ BEIL, SAINT JUNIEN
87;VC 7, SAINT JUNIEN
87;VC 8, SAINT JUNIEN
87;VC 11, SAINT JUNIEN
87;VC 12, SAINT JUNIEN
87;VC 20, SAINT JUNIEN
87;VC 37, SAINT JUNIEN
87;VC 121, SAINT JUNIEN
87;VC 204, SAINT JUNIEN
87;VC DU CD 32 A GRANDMONT, SAINT JUNIEN
87;RUIS DE CHATEAU GAILLA, SAINT JUNIEN
87;CD 21 A, SAINT JUNIEN
87;CD 101, SAINT JUNIEN
87;CHE DE TONNISSERIE A PERI, SAINT JUNIEN
87;CR DE BEAULIEU A BARONEAU, SAINT JUNIEN
87;CR DES BOUCHETTES, SAINT JUNIEN
87;CR DES CHAMPS A ROCHE, SAINT JUNIEN
87;CR DU CD 21 AU BOUCHET, SAINT JUNIEN
87;CR DE CROYER A BRIGUEUIL, SAINT JUNIEN
87;CR DE FONTCHABRIER A BRETA, SAINT JUNIEN
87;CR DE FORGEIX A BRIGUEUIL, SAINT JUNIEN
87;CR DE HTE GARDE A L HOMME, SAINT JUNIEN
87;CR DES JOUBERTIES A ROCHE, SAINT JUNIEN
87;CR DES JOUBERTIES A LA VC, SAINT JUNIEN
87;CR DE LA BRETAGNE A BEAULI, SAINT JUNIEN
87;CR DU MAS A SAULGOND, SAINT JUNIEN
87;CR DE MAZIERAS A LA VC 7, SAINT JUNIEN
87;CR DE MONBEUGE A L HOMME D, SAINT JUNIEN
87;CR DE MONBEUGE A SICIOREX, SAINT JUNIEN
87;CR DU MONTEIL AUX BROSSES, SAINT JUNIEN
87;CR DE MONTROSIER A FAYOLAS, SAINT JUNIEN
87;CR DE PERISSAT A CODILLE, SAINT JUNIEN
87;CR DES PIEDS BOTS, SAINT JUNIEN
87;CR DE PLAUD A SICIOREX, SAINT JUNIEN
87;CR DE PRECOIN, SAINT JUNIEN
87;CR DE ST JUNIEN A MANON, SAINT JUNIEN
87;CR DE L AVE VOLTAIRE AU DE, SAINT JUNIEN
87;VC DE PRESSALEIX A PLAUD, SAINT JUNIEN
87;VC 6 DU CD 86 A MOISSUR, SAINT JUNIEN
87;VC 9, SAINT JUNIEN
87;VC 13, SAINT JUNIEN
87;VC 16, SAINT JUNIEN
87;VC 19, SAINT JUNIEN
87;VC 31, SAINT JUNIEN
87;VC 41, SAINT JUNIEN
87;VC 47, SAINT JUNIEN
87;VC 49 BIS, SAINT JUNIEN
87;VC 123, SAINT JUNIEN
87;VC 124, SAINT JUNIEN
87;VC 201, SAINT JUNIEN
87;VC 202, SAINT JUNIEN
87;VC 203, SAINT JUNIEN
87;VC 205, SAINT JUNIEN
87;CR DU VLG DU MAS AU MONTEI, SAINT JUNIEN
87;CR DE ST JUNIEN A GDE AUBI, SAINT JUNIEN
87;CR DU GD PAISSE, SAINT JUNIEN
87;CR DE LAVAUD AU GD PAISSE, SAINT JUNIEN
87;CR DE L HOMME DU B A LA FO, SAINT JUNIEN
87;VC 3, SAINT JUNIEN
87;CR DU PT BOISSE, SAINT JUNIEN
87;CR DU CD 675 AU BOIS AU BOEUF, SAINT JUNIEN
87;RUIS DE L AUBINERIE, SAINT JUNIEN
87;RUIS DU PONT A LA PLANCHE, SAINT JUNIEN
87;CR BETOULLES AUX HTS GENETS, SAINT JUNIEN
87;CR DES HT GENETS AUX ESSARTS, SAINT JUNIEN
87;CR DES BRULES, SAINT JUNIEN
87;CR DU GRAND BOS, SAINT JUNIEN
87;CR DES BOISSELETTES, SAINT JUNIEN
87;CR DE BOMISSETTE, SAINT JUNIEN
87;RUIS DE CHABANAS, SAINT JUNIEN
87;CR DES HAUTS PUYS, SAINT JUNIEN
87;RUIS DU SAUVARIN, SAINT JUNIEN
87;CR DU MONTEIL A FAYARD, SAINT JUNIEN
87;CR DU MONTEIL, SAINT JUNIEN
87;CR DU MAS, SAINT JUNIEN
87;CR DE LAVENOT, SAINT JUNIEN
87;CR DU PUY VERT, SAINT JUNIEN
87;CR DE ST JUNIEN AU BOUCHET, SAINT JUNIEN
87;CR DES BETOULLES A PERISSA, SAINT JUNIEN
87;CR DES ESSARTS, SAINT JUNIEN
87;CR DES HAUTS GENETS, SAINT JUNIEN
87;CR DU BOUCHET, SAINT JUNIEN
87;CR ST JUNIEN A BRIGUEUIL, SAINT JUNIEN
87;CR DE PERISSAT AUX ESSARTS, SAINT JUNIEN
87;CR ESSARTS A RIEUBARBY, SAINT JUNIEN
87;CR RIEUBAR AU MOUL MONJONC, SAINT JUNIEN
87;CR GD BOISSE A PIEC MOREAU, SAINT JUNIEN
87;CR DES LOGES, SAINT JUNIEN
87;CR RIEUBARBY A BRIGUEUIL, SAINT JUNIEN
87;RUIS DE BOULOMIE, SAINT JUNIEN
87;CR CHARLES AU MOUL MONJONC, SAINT JUNIEN
87;CD 711, SAINT JUNIEN
87;CR DE LA BRETAGNE A LAVAUD, SAINT JUNIEN
87;CR BRETAGNE A SAINT BRICE, SAINT JUNIEN
87;CR DE BEAULIEU A TERRASSON, SAINT JUNIEN
87;RUIS DE TERRASSON, SAINT JUNIEN
87;RTE DE BEAULIEU, SAINT JUNIEN
87;CHE DES ABATTOIRS, SAINT JUNIEN
87;CHE DE L ABREUVOIR, SAINT JUNIEN
87;RUE ALBERT CAMUS, SAINT JUNIEN
87;RUE ALBERT PESTOUR, SAINT JUNIEN
87;RUE ALEXANDRE DUMAS, SAINT JUNIEN
87;RUE ALFRED DE MUSSET, SAINT JUNIEN
87;IMP AMBROISE CROIZAT, SAINT JUNIEN
87;RUE AMBROISE CROIZAT, SAINT JUNIEN
87;RUE AMEDEE DESERCES, SAINT JUNIEN
87;RUE DE L'AMITIE, SAINT JUNIEN
87;IMP AMPERE, SAINT JUNIEN
87;AV ANATOLE FRANCE, SAINT JUNIEN
87;IMP DE L ANCIEN ABATTOIR, SAINT JUNIEN
87;RUE DE L ANCIENNE ECOLE LE MAS, SAINT JUNIEN
87;RUE ANDRE LE GENTILE, SAINT JUNIEN
87;RTE D ANGOULEME, SAINT JUNIEN
87;PL ARMAND BARBES, SAINT JUNIEN
87;RUE D ARSONVAL, SAINT JUNIEN
87;RUE ARTHUR RIMBAUD, SAINT JUNIEN
87;FG AUGUSTE BLANQUI, SAINT JUNIEN
87;IMP AUGUSTE GAGNE, SAINT JUNIEN
87;RUE AUGUSTE GAGNE, SAINT JUNIEN
87;PL AUGUSTE ROCHE, SAINT JUNIEN
87;CHE DES BAISSES, SAINT JUNIEN
87;RUE BAPTISTE MARCET, SAINT JUNIEN
87;RTE DE BARONEAU BEAULIEU, SAINT JUNIEN
87;RTE DU BAS MOULIN, SAINT JUNIEN
87;PL BEAUCLAIR, SAINT JUNIEN
87;RUE BEAUCLAIR, SAINT JUNIEN
87;IMP CHEZ BEAUGY, SAINT JUNIEN
87;RTE DE CHEZ BEAUGY BEAULIEU, SAINT JUNIEN
87;RUE BEAUMONT, SAINT JUNIEN
87;IMP BECQUEREL, SAINT JUNIEN
87;RTE DE BELLAC CHEZ VEVAUD, SAINT JUNIEN
87;RUE BELLEVUE, SAINT JUNIEN
87;IMP BELLEVUE DE GLANE, SAINT JUNIEN
87;RUE DES BIENFAITEURS, SAINT JUNIEN
87;RUE DES BINLAUDES, SAINT JUNIEN
87;RUE BOILEAU, SAINT JUNIEN
87;CHE DE BONNEFOND, SAINT JUNIEN
87;PL BONNEFOND, SAINT JUNIEN
87;RUE DU BOUIF, SAINT JUNIEN
87;RUE DE BRECHE, SAINT JUNIEN
87;RTE DE BRIGUEUIL, SAINT JUNIEN
87;RTE DE BRIGUEUIL-L'ETANG, SAINT JUNIEN
87;PL LA BRUYERE, SAINT JUNIEN
87;RUE CAMELINAT, SAINT JUNIEN
87;PL DES CARREAUX, SAINT JUNIEN
87;IMP DES CASERNES, SAINT JUNIEN
87;RTE DE CERVALOZE, SAINT JUNIEN
87;RUE DES CHAMBONS, SAINT JUNIEN
87;PL DU CHAMP DE FOIRE, SAINT JUNIEN
87;RTE DES CHAMPS LE MAS, SAINT JUNIEN
87;RUE DE CHANTEMERLE, SAINT JUNIEN
87;RUE DU CHAPELAIN, SAINT JUNIEN
87;AV DU GENERAL DE GAULLE, SAINT JUNIEN
87;CHE DE CHARANNAS LE MAS, SAINT JUNIEN
87;PL CHARLES MICHELS, SAINT JUNIEN
87;RUE CHARRETIERE, SAINT JUNIEN
87;RUE CHATEAUBRIAND, SAINT JUNIEN
87;AV DU CHATELARD, SAINT JUNIEN
87;CHE DU CHATELARD, SAINT JUNIEN
87;CHE DE CHEZ BEILLOU, SAINT JUNIEN
87;IMP CHEZ MOULINAUD, SAINT JUNIEN
87;IMP CITE DES GANTIERS, SAINT JUNIEN
87;RUE CITE LEONTINE VIGNERIE, SAINT JUNIEN
87;CHEM DE LA CLE DES CHAMPS, SAINT JUNIEN
87;RUE CLOS NOBERT, SAINT JUNIEN
87;IMP CODILLE, SAINT JUNIEN
87;RUE COLETTE, SAINT JUNIEN
87;IMP DES COOPERATEURS, SAINT JUNIEN
87;RUE CORNEBOEUF, SAINT JUNIEN
87;AV COROT, SAINT JUNIEN
87;IMP COROT, SAINT JUNIEN
87;RUE COURBET, SAINT JUNIEN
87;RUE COURTELINE, SAINT JUNIEN
87;RUE DE LA CROIX BLANCHE, SAINT JUNIEN
87;CHE CROIX BONNAUD, SAINT JUNIEN
87;RTE DE CROYER, SAINT JUNIEN
87;IMP DE CROYER, SAINT JUNIEN
87;PL DE CROYER, SAINT JUNIEN
87;SQ CURIE, SAINT JUNIEN
87;RUE DEFAYE, SAINT JUNIEN
87;PL DEFFUAS, SAINT JUNIEN
87;ALL DU DEROT, SAINT JUNIEN
87;RTE DU DEROT, SAINT JUNIEN
87;SQ DUPUYTREN, SAINT JUNIEN
87;IMP D ESTIENNE D ORVES, SAINT JUNIEN
87;AV D ESTIENNE D ORVES, SAINT JUNIEN
87;RUE DIOG BERTRAND, SAINT JUNIEN
87;RUE DU 19 MARS 1962, SAINT JUNIEN
87;RUE DU DOC ROUX, SAINT JUNIEN
87;RUE DU DOCTEUR ROUX PROLONGEE, SAINT JUNIEN
87;RUE DES DOUHATS, SAINT JUNIEN
87;RUE DUBOIS, SAINT JUNIEN
87;IMP DES ECUREUILS, SAINT JUNIEN
87;RUE EDISON, SAINT JUNIEN
87;RUE CLAUDE DEBUSSY, SAINT JUNIEN
87;IMP GABRIEL FAURE, SAINT JUNIEN
87;SQ JULES MASSENET, SAINT JUNIEN
87;RUE EDOU VAILLANT, SAINT JUNIEN
87;RUE CAMILLE SAINT SAENS, SAINT JUNIEN
87;RUE DES EGLANTIERS, SAINT JUNIEN
87;ALL DU BOIS AU BOEUF, SAINT JUNIEN
87;AV ELISEE RECLUS, SAINT JUNIEN
87;RTE DU BOIS AU BOEUF, SAINT JUNIEN
87;RTE DE LA BRETAGNE, SAINT JUNIEN
87;RTE DU CHATEAU D'EAU, SAINT JUNIEN
87;RTE DE CHEZ BEILLOU, SAINT JUNIEN
87;IMP DU MALUCHAT, SAINT JUNIEN
87;RTE DE SAINT LAURENT, SAINT JUNIEN
87;RUE EMILE ZOLA, SAINT JUNIEN
87;CHE DE L ERMITAGE, SAINT JUNIEN
87;ALL DU TERME ROUGE, SAINT JUNIEN
87;RUE ETIENNE MALEU, SAINT JUNIEN
87;ALL DE FONTCHABRIER, SAINT JUNIEN
87;IMP FONTCHABRIER, SAINT JUNIEN
87;RTE D'ETAGNAC LE MONTEIL, SAINT JUNIEN
87;RTE DE LA FORGE LE MONTEIL, SAINT JUNIEN
87;RTE DE FORGEIX CROYER, SAINT JUNIEN
87;RUE FRANCOISE DOLTO, SAINT JUNIEN
87;RUE FREDERIC MISTRAL, SAINT JUNIEN
87;RUE FRESNEL, SAINT JUNIEN
87;RUE GABRIEL PERI, SAINT JUNIEN
87;FG GAILLARD, SAINT JUNIEN
87;RUE GALOIS, SAINT JUNIEN
87;PL DE LA GARE, SAINT JUNIEN
87;RUE GAUGUIN, SAINT JUNIEN
87;IMP GAUGUIN, SAINT JUNIEN
87;AV GAY LUSSAC, SAINT JUNIEN
87;RUE DES GENETS, SAINT JUNIEN
87;RUE GEORGE SAND, SAINT JUNIEN
87;RUE GEORGES BIZET, SAINT JUNIEN
87;RUE GERARD, SAINT JUNIEN
87;BD DE GLANE, SAINT JUNIEN
87;CHE DU GOTH, SAINT JUNIEN
87;CHE DES GOUTTES, SAINT JUNIEN
87;RUE DES GOUTTES, SAINT JUNIEN
87;IMP DU GRAND BOISSE, SAINT JUNIEN
87;IMP DU GRAND BOIS AU BOEUF, SAINT JUNIEN
87;RUE GRANDE ECOLE, SAINT JUNIEN
87;IMP GROSSE BORNE OUEST, SAINT JUNIEN
87;RUE DU GUE GIRAUD, SAINT JUNIEN
87;IMP GUIZIER, SAINT JUNIEN
87;RUE GUIZIER, SAINT JUNIEN
87;AV GUSTAVE FLAUBERT, SAINT JUNIEN
87;PL GUY MOCQUET, SAINT JUNIEN
87;RUE DES HALLES, SAINT JUNIEN
87;IMP HECTOR BERLIOZ, SAINT JUNIEN
87;AV HENRI BARBUSSE, SAINT JUNIEN
87;RUE HENRIETTE PERUCAUD, SAINT JUNIEN
87;IMP L'HOMME DU BOST, SAINT JUNIEN
87;RUE HONORE ARNOUL, SAINT JUNIEN
87;RUE HORTENSE TEILLET, SAINT JUNIEN
87;RUE DU 8 MAI 1945, SAINT JUNIEN
87;RUE JACQUARD, SAINT JUNIEN
87;AV JACQUES BLENY, SAINT JUNIEN
87;IMP JACQUES BREL, SAINT JUNIEN
87;AV JACQUES PREVERT, SAINT JUNIEN
87;ALL DES JARDINIERS, SAINT JUNIEN
87;RUE JEAN COCTEAU, SAINT JUNIEN
87;RUE JEAN GIRAUDOUX, SAINT JUNIEN
87;RUE JJ ROUSSEAU, SAINT JUNIEN
87;AV JEAN JAURES, SAINT JUNIEN
87;IMP JEAN JAURES, SAINT JUNIEN
87;PL JEAN BAPTISTE BRACHET, SAINT JUNIEN
87;RUE JEAN MOULIN, SAINT JUNIEN
87;RUE JEAN PIERRE TIMBAUD, SAINT JUNIEN
87;RUE JEAN REBIER, SAINT JUNIEN
87;IMP JOLIOT CURIE, SAINT JUNIEN
87;RUE JEAN TEILLIET, SAINT JUNIEN
87;PL JOSEPH LASVERGNAS, SAINT JUNIEN
87;RUE DES JONQUILLES, SAINT JUNIEN
87;RUE JULES VERNE, SAINT JUNIEN
87;RUE JULIAN GRIMAUD, SAINT JUNIEN
87;PL JULIENNE PETIT, SAINT JUNIEN
87;SQ JUMET, SAINT JUNIEN
87;RUE JUNIEN RIGAUD, SAINT JUNIEN
87;RUE JUSTINE TEILLET, SAINT JUNIEN
87;RUE KARL MARX, SAINT JUNIEN
87;IMP LABRUNIE, SAINT JUNIEN
87;PL LACOTE, SAINT JUNIEN
87;RUE LACOTE, SAINT JUNIEN
87;RUE LA FONTAINE, SAINT JUNIEN
87;RUE LAGARDE, SAINT JUNIEN
87;RUE LAMARTINE, SAINT JUNIEN
87;CHEM DES LAVANDIERES, SAINT JUNIEN
87;RUE LAVEYSSIERE, SAINT JUNIEN
87;RTE DU LAVOIR LE MONTEIL, SAINT JUNIEN
87;RUE LAVOISIER, SAINT JUNIEN
87;RUE LEDRU ROLLIN, SAINT JUNIEN
87;PL LENINE, SAINT JUNIEN
87;RUE LEO LAGRANGE, SAINT JUNIEN
87;AV LEONTINE VIGNERIE, SAINT JUNIEN
87;FG LIEBKNECHT, SAINT JUNIEN
87;BD LOUIS BLANC, SAINT JUNIEN
87;RUE LOUIS BLERIOT, SAINT JUNIEN
87;RUE LOUIS CODET, SAINT JUNIEN
87;RUE LUCIEN DUMAS, SAINT JUNIEN
87;IMP LUCIEN DUMAS, SAINT JUNIEN
87;IMP MACE, SAINT JUNIEN
87;RUE DU MAINE DU BOST, SAINT JUNIEN
87;IMP DE LA MAISON DE VILLE, SAINT JUNIEN
87;IMP DU MAINE DU BOST, SAINT JUNIEN
87;RUE DE LA MAITRISE, SAINT JUNIEN
87;RTE DE MANOT, SAINT JUNIEN
87;BD MARCEL CACHIN, SAINT JUNIEN
87;RUE MARCEL PAGNOL, SAINT JUNIEN
87;AV MARYSE BASTIE, SAINT JUNIEN
87;RUE DES MAUMONTS, SAINT JUNIEN
87;RUE MAURICE RAVEL, SAINT JUNIEN
87;QUAI DES MEGISSERIES, SAINT JUNIEN
87;RUE DE MOISSUN, SAINT JUNIEN
87;CHEM DES MOINES, SAINT JUNIEN
87;RUE MOLIERE, SAINT JUNIEN
87;RUE MONTAIGNE, SAINT JUNIEN
87;RUE MONTGOLFIER, SAINT JUNIEN
87;RUE MONTROZIER, SAINT JUNIEN
87;RUE MOZART, SAINT JUNIEN
87;IMP NANCY, SAINT JUNIEN
87;CHE DE NANCY, SAINT JUNIEN
87;AV NELSON MANDELA, SAINT JUNIEN
87;RUE DE NONTRON, SAINT JUNIEN
87;CHE NOTRE DAME AU GOTH, SAINT JUNIEN
87;RUE DU 11 NOVEMBRE 1918, SAINT JUNIEN
87;AV ORADOUR GLANE, SAINT JUNIEN
87;RUE DE LA PAIX, SAINT JUNIEN
87;RUE DES PAPETERIES, SAINT JUNIEN
87;RUE DU PARC, SAINT JUNIEN
87;RUE PASTEUR, SAINT JUNIEN
87;RUE PAUL ELUARD, SAINT JUNIEN
87;RUE PAUL GAUDY, SAINT JUNIEN
87;AV PAUL VAILLANT COUTURIER, SAINT JUNIEN
87;ALL PEGASE, SAINT JUNIEN
87;IMP DU PAVILLON, SAINT JUNIEN
87;IMP PELGROS, SAINT JUNIEN
87;PL DE PERISSAT, SAINT JUNIEN
87;RUE PEYRUSSON, SAINT JUNIEN
87;RUE PICASSO, SAINT JUNIEN
87;AV PIERRE AUGUSTE MERLE, SAINT JUNIEN
87;BD PIERRE BROSSOLETTE, SAINT JUNIEN
87;RUE PIERRE LOTI, SAINT JUNIEN
87;IMP PINGAULT, SAINT JUNIEN
87;AV PINGAULT, SAINT JUNIEN
87;RUE POIS DU ROI, SAINT JUNIEN
87;RUE DU POINT DU JOUR, SAINT JUNIEN
87;ALL DES POMMIERS, SAINT JUNIEN
87;PONT NOTRE DAME, SAINT JUNIEN
87;CHE PONT N DAME A GRAMMONT, SAINT JUNIEN
87;RUE DU PONT STE ELISABETH, SAINT JUNIEN
87;RTE DU PONT A LA PLANCHE, SAINT JUNIEN
87;IMP DU PRADEAU, SAINT JUNIEN
87;RTE DES POULETTES LE MONTEIL, SAINT JUNIEN
87;RUE DE LA PRADE LE MAS, SAINT JUNIEN
87;CHE DES PRADELLES LE MAS, SAINT JUNIEN
87;AV DE PRECOIN, SAINT JUNIEN
87;IMP DE PRECOIN, SAINT JUNIEN
87;RTE DE PRESSALEIX LE MAS, SAINT JUNIEN
87;RUE DU PRINTEMPS, SAINT JUNIEN
87;RUE DES PUITS, SAINT JUNIEN
87;IMP DU PUY DE VALETTE, SAINT JUNIEN
87;RUE RABELAIS, SAINT JUNIEN
87;RUE RACINE, SAINT JUNIEN
87;CHE DE RAQUIAUD CROYER, SAINT JUNIEN
87;RUE DU RELAIS, SAINT JUNIEN
87;RUE RENAN, SAINT JUNIEN
87;CHE DU RE PICARD, SAINT JUNIEN
87;BD DE LA REPUBLIQUE, SAINT JUNIEN
87;RUE ROBERT DOISNEAU, SAINT JUNIEN
87;CHE DE ROC CHENE AUX GOUTTES, SAINT JUNIEN
87;IMP DE ROC CHENE, SAINT JUNIEN
87;RTE ROCHECHOUART, SAINT JUNIEN
87;AV ROMAIN ROLLAND, SAINT JUNIEN
87;RUE RORICE RIGAUD, SAINT JUNIEN
87;AV R LUXEMBOURG, SAINT JUNIEN
87;RUE DES ROSIERS, SAINT JUNIEN
87;RUE ROUGET DE L ISLE, SAINT JUNIEN
87;AV SADI CARNOT, SAINT JUNIEN
87;CHE DE SAINT AMAND, SAINT JUNIEN
87;RUE DE SAINT AMAND, SAINT JUNIEN
87;IMP ST FRANCOIS, SAINT JUNIEN
87;PAS SAINT FRANCOIS, SAINT JUNIEN
87;RTE SAINT MARTIN DE JUSSAC, SAINT JUNIEN
87;PAS SALER, SAINT JUNIEN
87;RUE SALVADOR ALLENDE, SAINT JUNIEN
87;RTE DE SAULGOND, SAINT JUNIEN
87;RUE SCHILTIGHEIM, SAINT JUNIEN
87;CHE DES SEILLES, SAINT JUNIEN
87;RTE DE SICIOREIX, SAINT JUNIEN
87;RTE DE LA SOURCE CHEZ VEVAUD, SAINT JUNIEN
87;RUE SUZANNE VALADON, SAINT JUNIEN
87;IMP TEILLET, SAINT JUNIEN
87;RUE MARTIAL THIPHONNET, SAINT JUNIEN
87;AV MARTIAL THIPHONNET, SAINT JUNIEN
87;RUE LA TOUR NEGRE, SAINT JUNIEN
87;RUE DES TROTTEURS, SAINT JUNIEN
87;RUE MAURICE UTRILLO, SAINT JUNIEN
87;RUE DES VALETS, SAINT JUNIEN
87;RUE VARLIN, SAINT JUNIEN
87;RUE VERMOREL, SAINT JUNIEN
87;CHE DES VERSANNES, SAINT JUNIEN
87;BD VICTOR HUGO, SAINT JUNIEN
87;AV VICTOR ROCHE, SAINT JUNIEN
87;IMP VICTOR ROCHE, SAINT JUNIEN
87;RUE DU VILLAGE DE FAYOLAS, SAINT JUNIEN
87;IMP VOLTAIRE, SAINT JUNIEN
87;AV VOLTAIRE, SAINT JUNIEN
87;AV VOLTAIRE PROLONGEE, SAINT JUNIEN
87;RUE YOURI GAGARINE, SAINT JUNIEN
87;RUE ZAMENHOF, SAINT JUNIEN
87;RTE DE PLAUD SICIOREIX, SAINT JUNIEN
87;IMP COTE DE SICIOREIX, SAINT JUNIEN
87;ALL COTE DE SICIOREIX, SAINT JUNIEN
87;RUE DES CERISIERS FORGEIX, SAINT JUNIEN
87;RUE DES CHATAIGNIERS FORGEIX, SAINT JUNIEN
87;RUE DES CHENES FORGEIX, SAINT JUNIEN
87;RUE DES NOISETIERS FORGEIX, SAINT JUNIEN
87;RUE DES PECHERS FORGEIX, SAINT JUNIEN
87;RUE DES PEUPLIERS FORGEIX, SAINT JUNIEN
87;RTE DE SICIOREIX-LA CILLETAU, SAINT JUNIEN
87;RTE DU MOULIN BRICE-LA CILLETA, SAINT JUNIEN
87;RTE DES ESSARTS- RIEUBARBY, SAINT JUNIEN
87;RTE DE LA FABRIQUE- RIEUBARBY, SAINT JUNIEN
87;IMP DE RIEUBARBY, SAINT JUNIEN
87;RTE DE RIEUBARBY- LES 3 BORNES, SAINT JUNIEN
87;RTE DU QUARTERON- LES 3 BORNES, SAINT JUNIEN
87;RTE DES BAISSES - LES 3 BORNES, SAINT JUNIEN
87;RTE DES 3 BORNES-LES CHARLES, SAINT JUNIEN
87;IMP DES CHARLES, SAINT JUNIEN
87;RTE 3 BORNES-PONT A LA PLANCHE, SAINT JUNIEN
87;RUE DE LA BAZINE, SAINT-JUNIEN-LES-COMBES
87;IMP DU BOURG, SAINT-JUNIEN-LES-COMBES
87;IMP DES ECOLES, SAINT-JUNIEN-LES-COMBES
87;PL DE L'EGLISE, SAINT-JUNIEN-LES-COMBES
87;RUE DE LA FORGE, SAINT-JUNIEN-LES-COMBES
87;RUE DU HUIT MAI 1945, SAINT-JUNIEN-LES-COMBES
87;PL DE LA LIBERTE, SAINT-JUNIEN-LES-COMBES
87;RUE DU MOULIN, SAINT-JUNIEN-LES-COMBES
87;RUE DU STADE, SAINT-JUNIEN-LES-COMBES
87;RUE DES TRAVERSES, SAINT-JUNIEN-LES-COMBES
87;LOT DU VERDEAU, SAINT-JUST-LE-MARTEL
87;RUE DE L'AGE, SAINT-JUST-LE-MARTEL
87;RUE ANTOINE DE SAINT EXUPERY, SAINT-JUST-LE-MARTEL
87;RTE D'AUREIL, SAINT-JUST-LE-MARTEL
87;ALL DE BAMBOURNET, SAINT-JUST-LE-MARTEL
87;RUE DES CHAUMETTES, SAINT-JUST-LE-MARTEL
87;RUE DU DIX NEUF MARS 1962, SAINT-JUST-LE-MARTEL
87;CHE LAS BARRIERAS, SAINT-JUST-LE-MARTEL
87;AV DU GENERAL DE GAULLE, SAINT-JUST-LE-MARTEL
87;RUE DU MARECHAL LECLERC, SAINT-JUST-LE-MARTEL
87;RUE DU HUIT MAI 1945, SAINT-JUST-LE-MARTEL
87;CHE BAS LAVAUD, SAINT-JUST-LE-MARTEL
87;RTE DE LATHONIE, SAINT-JUST-LE-MARTEL
87;RUE DE LAUTERBOURG, SAINT-JUST-LE-MARTEL
87;RUE DE LA MAIRIE, SAINT-JUST-LE-MARTEL
87;IMP DU BAS RAYNAUD, SAINT-JUST-LE-MARTEL
87;RUE MAL DE LATTRE DE TASSIGNY, SAINT-JUST-LE-MARTEL
87;RUE DU MARECHAL JUIN, SAINT-JUST-LE-MARTEL
87;RUE DU ONZE NOVEMBRE, SAINT-JUST-LE-MARTEL
87;RTE DE LASFONTS, SAINT-JUST-LE-MARTEL
87;RUE DES ECOLES, SAINT-JUST-LE-MARTEL
87;PL DE LA REPUBLIQUE, SAINT-JUST-LE-MARTEL
87;RTE D AUREIL LE PUY PARLIER, SAINT-JUST-LE-MARTEL
87;ALL DE BELLEFOND, SAINT-JUST-LE-MARTEL
87;CHE DE BEAUMANOIR, SAINT-JUST-LE-MARTEL
87;CHE BELLEVUE, SAINT-JUST-LE-MARTEL
87;CHE DES BIARDS, SAINT-JUST-LE-MARTEL
87;RUE BOSC, SAINT-JUST-LE-MARTEL
87;IMP DES CHABANNES, SAINT-JUST-LE-MARTEL
87;RTE DES CHABASSIERAS, SAINT-JUST-LE-MARTEL
87;CHE DE CHAMPLAGNE, SAINT-JUST-LE-MARTEL
87;RUE DE LA CHAROUFFERIE, SAINT-JUST-LE-MARTEL
87;RTE DE LA CHAROUFFERIE, SAINT-JUST-LE-MARTEL
87;CHE DE LA CHATAIGNE, SAINT-JUST-LE-MARTEL
87;ALL DE LA CHATAIGNERAIE, SAINT-JUST-LE-MARTEL
87;RTE DU CHATEAU D'EAU, SAINT-JUST-LE-MARTEL
87;RTE DE LA CHEZE, SAINT-JUST-LE-MARTEL
87;RTE DE CHAVAGNAC, SAINT-JUST-LE-MARTEL
87;CHE DE CINTRAT, SAINT-JUST-LE-MARTEL
87;RTE DES CLEDIERES, SAINT-JUST-LE-MARTEL
87;RTE DES COLOMBIERS, SAINT-JUST-LE-MARTEL
87;PAS ANTOINE COMBE, SAINT-JUST-LE-MARTEL
87;RUE DE LA COTTE, SAINT-JUST-LE-MARTEL
87;CHE DE LA CROIX BLANCHE, SAINT-JUST-LE-MARTEL
87;RTE DE LA CROIX DU TILLEUL, SAINT-JUST-LE-MARTEL
87;ALL DAUMIER, SAINT-JUST-LE-MARTEL
87;IMP DERO, SAINT-JUST-LE-MARTEL
87;IMP DUBOUT, SAINT-JUST-LE-MARTEL
87;CHE DU MOULIN DE L'ETANG, SAINT-JUST-LE-MARTEL
87;CHE DE FONTAGULY, SAINT-JUST-LE-MARTEL
87;RTE DE FONTAGULY, SAINT-JUST-LE-MARTEL
87;RUE DE LA FONTAINE, SAINT-JUST-LE-MARTEL
87;CHE DE FONTALICOURT, SAINT-JUST-LE-MARTEL
87;RTE DE LA FORET, SAINT-JUST-LE-MARTEL
87;CHE DU FORMANEIX, SAINT-JUST-LE-MARTEL
87;CHE DE FREGEFOND, SAINT-JUST-LE-MARTEL
87;RTE DE FREGEFOND, SAINT-JUST-LE-MARTEL
87;PL GEORGES WOLINSKI, SAINT-JUST-LE-MARTEL
87;RTE DE GOURLY, SAINT-JUST-LE-MARTEL
87;CHE DU GRAND BONNEFOND, SAINT-JUST-LE-MARTEL
87;CHE DU GRAND BOST, SAINT-JUST-LE-MARTEL
87;RUE DU GRAND COLOMBIER, SAINT-JUST-LE-MARTEL
87;RUE DES GRANDS RIEUX, SAINT-JUST-LE-MARTEL
87;RUE DE GRATTELOUBE, SAINT-JUST-LE-MARTEL
87;ESP GUS BOFA, SAINT-JUST-LE-MARTEL
87;RTE DE LA HAUTE RIPPE, SAINT-JUST-LE-MARTEL
87;RUE JORDI, SAINT-JUST-LE-MARTEL
87;RUE DE LA JOUVINERIE, SAINT-JUST-LE-MARTEL
87;RTE DE LASFOND, SAINT-JUST-LE-MARTEL
87;CHE DE LASFOND, SAINT-JUST-LE-MARTEL
87;IMP DE LASFOND, SAINT-JUST-LE-MARTEL
87;ALL DE LASFOND, SAINT-JUST-LE-MARTEL
87;ALL DU MENHIR, SAINT-JUST-LE-MARTEL
87;CHE DES MOLLETTERIES, SAINT-JUST-LE-MARTEL
87;RUE NICOULAUD, SAINT-JUST-LE-MARTEL
87;PAS PAUL GUYOT, SAINT-JUST-LE-MARTEL
87;CHE DU PETIT BONNEFONT, SAINT-JUST-LE-MARTEL
87;CHE DU PETIT COLOMBIER, SAINT-JUST-LE-MARTEL
87;CHE DE LA PETITE CHEZE, SAINT-JUST-LE-MARTEL
87;RTE DES PETITS RIEUX, SAINT-JUST-LE-MARTEL
87;RTE DE PIERRE BRUNE, SAINT-JUST-LE-MARTEL
87;CHEM DU POIRIER RENARD, SAINT-JUST-LE-MARTEL
87;RTE DE PIERREFICHE, SAINT-JUST-LE-MARTEL
87;RUE DU POURTOUR, SAINT-JUST-LE-MARTEL
87;RUE DU PRE DE L'OR, SAINT-JUST-LE-MARTEL
87;RUE POULBOT, SAINT-JUST-LE-MARTEL
87;RUE DES PUITS, SAINT-JUST-LE-MARTEL
87;CHE DU PUY DE BREIX, SAINT-JUST-LE-MARTEL
87;CHE DE PUYMARD, SAINT-JUST-LE-MARTEL
87;CHE DU PUY PARLIER, SAINT-JUST-LE-MARTEL
87;RTE DES RENARDIERES, SAINT-JUST-LE-MARTEL
87;RUE RENE CASSIN, SAINT-JUST-LE-MARTEL
87;RTE DE LA ROCHE, SAINT-JUST-LE-MARTEL
87;CHE DE LA ROCHE, SAINT-JUST-LE-MARTEL
87;RTE DE ROUVEIX, SAINT-JUST-LE-MARTEL
87;CHE DU ROUVEIX, SAINT-JUST-LE-MARTEL
87;RTE DE SAINT PRIEST, SAINT-JUST-LE-MARTEL
87;CHE DES SOURCES, SAINT-JUST-LE-MARTEL
87;RUE DU TEIX, SAINT-JUST-LE-MARTEL
87;RUE TIM, SAINT-JUST-LE-MARTEL
87;RTE DE LA TUILIERE, SAINT-JUST-LE-MARTEL
87;RUE DES VERGNES, SAINT-JUST-LE-MARTEL
87;CHE DU VERT, SAINT-JUST-LE-MARTEL
87;RTE DU VERT, SAINT-JUST-LE-MARTEL
87;ESPA POULBOT, SAINT-JUST-LE-MARTEL
87;ALL DU POIRIER RENARD, SAINT-JUST-LE-MARTEL
87;RUE DU VERDEAU, SAINT-JUST-LE-MARTEL
87;CHE DU VERDIER, SAINT-JUST-LE-MARTEL
87;RTE D'AMBAZAC, SAINT-LAURENT-LES-EGLISES
87;RTE D'AUZIAT, SAINT-LAURENT-LES-EGLISES
87;RTE DES BARRIERES, SAINT-LAURENT-LES-EGLISES
87;RUE DES BERGERONNETTES, SAINT-LAURENT-LES-EGLISES
87;RTE DE LA BETOULLE, SAINT-LAURENT-LES-EGLISES
87;IMP DES BLEUETS, SAINT-LAURENT-LES-EGLISES
87;RUE DU BOULEAU, SAINT-LAURENT-LES-EGLISES
87;RTE DES BOURNEIX, SAINT-LAURENT-LES-EGLISES
87;IMP DU BOUVIER, SAINT-LAURENT-LES-EGLISES
87;RTE DES BRUTINES, SAINT-LAURENT-LES-EGLISES
87;RTE DE BUSSIN, SAINT-LAURENT-LES-EGLISES
87;RTE DU CHAMBON, SAINT-LAURENT-LES-EGLISES
87;RTE DES CHAMPS, SAINT-LAURENT-LES-EGLISES
87;IMP DU CHARRON, SAINT-LAURENT-LES-EGLISES
87;RUE DES CHATAIGNIERS, SAINT-LAURENT-LES-EGLISES
87;RUE DU CHAUDRONNIER, SAINT-LAURENT-LES-EGLISES
87;IMP DU CHENE, SAINT-LAURENT-LES-EGLISES
87;RTE DE CHERANDIE, SAINT-LAURENT-LES-EGLISES
87;RUE DU COQ, SAINT-LAURENT-LES-EGLISES
87;RUE DES COQUELICOTS, SAINT-LAURENT-LES-EGLISES
87;RTE DU COURET, SAINT-LAURENT-LES-EGLISES
87;RUE DE LA DENTELLIERE, SAINT-LAURENT-LES-EGLISES
87;PL DE L'EGLISE, SAINT-LAURENT-LES-EGLISES
87;RUE DE L'EGLISE, SAINT-LAURENT-LES-EGLISES
87;IMP DES ERABLES, SAINT-LAURENT-LES-EGLISES
87;RUE DES FAUVETTES, SAINT-LAURENT-LES-EGLISES
87;RUE DU FEUILLARDIER, SAINT-LAURENT-LES-EGLISES
87;RTE DE LA FORET, SAINT-LAURENT-LES-EGLISES
87;IMP DU FORGERON, SAINT-LAURENT-LES-EGLISES
87;RTE DE LA FOSSE AUX BOEUFS, SAINT-LAURENT-LES-EGLISES
87;RUE DES HORTENSIAS, SAINT-LAURENT-LES-EGLISES
87;RUE DES IRIS, SAINT-LAURENT-LES-EGLISES
87;IMP DES JACINTHES, SAINT-LAURENT-LES-EGLISES
87;RTE DE LA JONCHERE, SAINT-LAURENT-LES-EGLISES
87;IMP DES JONQUILLES, SAINT-LAURENT-LES-EGLISES
87;RTE DE LASCAUX, SAINT-LAURENT-LES-EGLISES
87;IMP DU MACON, SAINT-LAURENT-LES-EGLISES
87;RTE DES MAISONS, SAINT-LAURENT-LES-EGLISES
87;RTE DU MAS, SAINT-LAURENT-LES-EGLISES
87;IMP DES MELEZES, SAINT-LAURENT-LES-EGLISES
87;RUE DES MERISIERS, SAINT-LAURENT-LES-EGLISES
87;RUE DES MESANGES, SAINT-LAURENT-LES-EGLISES
87;RUE DU MEUNIER, SAINT-LAURENT-LES-EGLISES
87;IMP DU MITRON, SAINT-LAURENT-LES-EGLISES
87;RTE DE MORANGE, SAINT-LAURENT-LES-EGLISES
87;IMP DE LA MORDOREE, SAINT-LAURENT-LES-EGLISES
87;CHE DE MORTEGOUTTE, SAINT-LAURENT-LES-EGLISES
87;RUE DES MYOSOTIS, SAINT-LAURENT-LES-EGLISES
87;RUE DES NOISETIERS, SAINT-LAURENT-LES-EGLISES
87;RTE DE NOUEIX, SAINT-LAURENT-LES-EGLISES
87;RTE DE LA PALISSE, SAINT-LAURENT-LES-EGLISES
87;RTE DU PETIT CHAVANAT, SAINT-LAURENT-LES-EGLISES
87;RUE DES PINSONS, SAINT-LAURENT-LES-EGLISES
87;RTE DU PONT DU DOGNON, SAINT-LAURENT-LES-EGLISES
87;IMP DU PUISATIER, SAINT-LAURENT-LES-EGLISES
87;IMP DU REISSEIX, SAINT-LAURENT-LES-EGLISES
87;RUE DES SABOTIERS, SAINT-LAURENT-LES-EGLISES
87;IMP DU SELLIER, SAINT-LAURENT-LES-EGLISES
87;IMP DU SOURCIER, SAINT-LAURENT-LES-EGLISES
87;RUE DES TILLEULS, SAINT-LAURENT-LES-EGLISES
87;IMP DU TONNELIER, SAINT-LAURENT-LES-EGLISES
87;RTE DE TRASPONT, SAINT-LAURENT-LES-EGLISES
87;IMP DU TUILLIER, SAINT-LAURENT-LES-EGLISES
87;PAS DU VANNIER, SAINT-LAURENT-LES-EGLISES
87;PAS DES VIOLETTES, SAINT-LAURENT-LES-EGLISES
87;DOM DE ROCHEFAYE, SAINT-LAURENT-SUR-GORRE
87;PAS DE L ABATTOIR, SAINT-LAURENT-SUR-GORRE
87;RTE DE L ABATTOIR, SAINT-LAURENT-SUR-GORRE
87;RUE DE L ANC MAIRIE, SAINT-LAURENT-SUR-GORRE
87;RTE DE BAYERIE, SAINT-LAURENT-SUR-GORRE
87;CHEM DE LA BAYERIE, SAINT-LAURENT-SUR-GORRE
87;CHEM DE BEAUVAIS, SAINT-LAURENT-SUR-GORRE
87;RTE DE BEAUVAIS, SAINT-LAURENT-SUR-GORRE
87;RTE DE BELLEVUE, SAINT-LAURENT-SUR-GORRE
87;RTE DES BELLUNIES, SAINT-LAURENT-SUR-GORRE
87;RTE DE LA BETOULLE, SAINT-LAURENT-SUR-GORRE
87;RTE DES BETOULLES, SAINT-LAURENT-SUR-GORRE
87;SEN DE CHEZ BILHAC, SAINT-LAURENT-SUR-GORRE
87;ALL DU BOS DE LA COTE, SAINT-LAURENT-SUR-GORRE
87;CHEM DU BOS DE LA COTE, SAINT-LAURENT-SUR-GORRE
87;RTE DU BOS DE LA COTE, SAINT-LAURENT-SUR-GORRE
87;CHEM DU BUR, SAINT-LAURENT-SUR-GORRE
87;RTE DU BUR, SAINT-LAURENT-SUR-GORRE
87;SEN DU BUR, SAINT-LAURENT-SUR-GORRE
87;ALL CAMILLE CLAUDEL, SAINT-LAURENT-SUR-GORRE
87;ALL DES CAPUCINES, SAINT-LAURENT-SUR-GORRE
87;CHEM DE LA CHAISE, SAINT-LAURENT-SUR-GORRE
87;RTE DE LA CHAISE, SAINT-LAURENT-SUR-GORRE
87;CHE DU CHAPELOT, SAINT-LAURENT-SUR-GORRE
