87;RES D ARLIQUET, AIXE-SUR-VIENNE
87;LOT LA CLE DU CIEL, AIXE-SUR-VIENNE
87;RES POMPADOUR, AIXE-SUR-VIENNE
87;ZA DU MOULIN CHEYROUX, AIXE-SUR-VIENNE
87;RUE DES ACACIAS, AIXE-SUR-VIENNE
87;RUE ALFRED SISLEY, AIXE-SUR-VIENNE
87;IMP ALEXANDRE DUMAS, AIXE-SUR-VIENNE
87;RUE ALPHONSE DAUDET, AIXE-SUR-VIENNE
87;RUE DE L ABREUVOIR, AIXE-SUR-VIENNE
87;PL DE L AIXETTE, AIXE-SUR-VIENNE
87;RUE ANDRE CHENIER, AIXE-SUR-VIENNE
87;RUE D ARLIQUET, AIXE-SUR-VIENNE
87;PL DE L AURENCE, AIXE-SUR-VIENNE
87;PL AYMARD FAYARD, AIXE-SUR-VIENNE
87;RUE AUGUSTE RENOIR, AIXE-SUR-VIENNE
87;RUE DE L ATELIER, AIXE-SUR-VIENNE
87;RUE DU BARRY, AIXE-SUR-VIENNE
87;IMP DU BARRY, AIXE-SUR-VIENNE
87;RUE DES BARBICHETS, AIXE-SUR-VIENNE
87;RUE DE BELAIR, AIXE-SUR-VIENNE
87;RUE DE BELLEVUE, AIXE-SUR-VIENNE
87;AV DE BORDEAUX, AIXE-SUR-VIENNE
87;RUE DE LA BRIANCE, AIXE-SUR-VIENNE
87;RUE DE LA CARAQUE, AIXE-SUR-VIENNE
87;RUE BERTHE MORIZOT, AIXE-SUR-VIENNE
87;RTE DE BEYNAC, AIXE-SUR-VIENNE
87;CHE DE L' AGE, AIXE-SUR-VIENNE
87;SQ DE BOUGAINVILLE, AIXE-SUR-VIENNE
87;IMP DES BOULEAUX, AIXE-SUR-VIENNE
87;RUE BRIGITTE GUITARD, AIXE-SUR-VIENNE
87;IMP DE LA CARAQUE, AIXE-SUR-VIENNE
87;AV DES CARS, AIXE-SUR-VIENNE
87;ALL DE LA GUERINIERE, AIXE-SUR-VIENNE
87;PLE ANDRE GLANDUS, AIXE-SUR-VIENNE
87;CHE DE CHANTEGROS, AIXE-SUR-VIENNE
87;RUE CHATEAUBRIAND, AIXE-SUR-VIENNE
87;RUE CHARLES PEGUY, AIXE-SUR-VIENNE
87;RUE DES CHATAIGNIERS, AIXE-SUR-VIENNE
87;RUE DES CHENES, AIXE-SUR-VIENNE
87;CHE LA CLE DU CIEL, AIXE-SUR-VIENNE
87;RUE MARTHE FRUGIER, AIXE-SUR-VIENNE
87;RUE DE CHANTILLY, AIXE-SUR-VIENNE
87;RUE DE COGNAC, AIXE-SUR-VIENNE
87;RUE DES MESANGES, AIXE-SUR-VIENNE
87;RUE DU COLOMBIER, AIXE-SUR-VIENNE
87;RUE DES BERGERONNETTES, AIXE-SUR-VIENNE
87;RUE DES BOUVREUILS, AIXE-SUR-VIENNE
87;RUE DES LORIOTS, AIXE-SUR-VIENNE
87;RUE DES HIRONDELLES, AIXE-SUR-VIENNE
87;ESP ALEXANDRE PICHENAUD, AIXE-SUR-VIENNE
87;RUE DE BEAUCHABROL, AIXE-SUR-VIENNE
87;ALL BELLE LIMOUSINE, AIXE-SUR-VIENNE
87;CHE DE BELLEVUE, AIXE-SUR-VIENNE
87;ALL DU BOUCHERON, AIXE-SUR-VIENNE
87;ALL DE BOUJARET, AIXE-SUR-VIENNE
87;PAS BOURDIER, AIXE-SUR-VIENNE
87;RTE DU BUISSON, AIXE-SUR-VIENNE
87;RUE DES DEUX PONTS, AIXE-SUR-VIENNE
87;RUE CHARLOTTE MAZOYER, AIXE-SUR-VIENNE
87;ALL DE DEAUVILLE, AIXE-SUR-VIENNE
87;AV DU 19 MARS 1962, AIXE-SUR-VIENNE
87;IMP GARRIGOU LAGRANGE, AIXE-SUR-VIENNE
87;RUE DU DOCTEUR DUVERGER, AIXE-SUR-VIENNE
87;RUE RENE DUMONT, AIXE-SUR-VIENNE
87;IMP EDGAR DEGAS, AIXE-SUR-VIENNE
87;RUE EDOUARD MANET, AIXE-SUR-VIENNE
87;PL DE L EGLISE, AIXE-SUR-VIENNE
87;RUE ERASME, AIXE-SUR-VIENNE
87;IMP DE L'ESTRE, AIXE-SUR-VIENNE
87;ALL DES ETANGS, AIXE-SUR-VIENNE
87;IMP D ETIQUET, AIXE-SUR-VIENNE
87;RUE EUGENE PINTE, AIXE-SUR-VIENNE
87;RUE DU FBG SAINT GEORGES, AIXE-SUR-VIENNE
87;ALL DE FARGEAS, AIXE-SUR-VIENNE
87;PL DE FARGEAS, AIXE-SUR-VIENNE
87;RTE DE FARGEAS, AIXE-SUR-VIENNE
87;RUE DE FENEROLLES, AIXE-SUR-VIENNE
87;RUE FERNAND LAPEYRE, AIXE-SUR-VIENNE
87;RUE DE LA FONDERIE, AIXE-SUR-VIENNE
87;RUE DES FOSSES, AIXE-SUR-VIENNE
87;RUE FRANCIS JAMMES, AIXE-SUR-VIENNE
87;ALL GEORGES GUINGOUIN, AIXE-SUR-VIENNE
87;AV FRANCOIS MITTERRAND, AIXE-SUR-VIENNE
87;RUE F STOCKMANN, AIXE-SUR-VIENNE
87;IMP FRANCOIS VILLON, AIXE-SUR-VIENNE
87;RUE GAMBETTA, AIXE-SUR-VIENNE
87;CHE DE LA GAUBERTIE, AIXE-SUR-VIENNE
87;AV DU GENERAL DE GAULLE, AIXE-SUR-VIENNE
87;RUE DU GENERAL DURAND, AIXE-SUR-VIENNE
87;RUE G EMMANUEL GLANCIER, AIXE-SUR-VIENNE
87;ALL GEORGES CUVIER, AIXE-SUR-VIENNE
87;IMP GOYA, AIXE-SUR-VIENNE
87;ALL DU GRAND RIEUX, AIXE-SUR-VIENNE
87;RTE DES GRANDES VIGNES, AIXE-SUR-VIENNE
87;RUE DES GRANGETTES, AIXE-SUR-VIENNE
87;RUE JEAN CLAUDE PAPON, AIXE-SUR-VIENNE
87;PROM DES GREVES, AIXE-SUR-VIENNE
87;PL GUILLAUME LEMAISTRE, AIXE-SUR-VIENNE
87;IMP GUSTAVE COURBET, AIXE-SUR-VIENNE
87;RUE DE LA GUERINIERE, AIXE-SUR-VIENNE
87;RUE GUYNEMER, AIXE-SUR-VIENNE
87;RUE HAROUN TAZIEFF, AIXE-SUR-VIENNE
87;ALL DU HAUT BOIS, AIXE-SUR-VIENNE
87;IMP DES HETRES, AIXE-SUR-VIENNE
87;IMP HONORE DE BALZAC, AIXE-SUR-VIENNE
87;RUE HORACE VERNET, AIXE-SUR-VIENNE
87;PL DES HORTEILS, AIXE-SUR-VIENNE
87;RUE DU 8 MAI 1945, AIXE-SUR-VIENNE
87;RUE D ISLY, AIXE-SUR-VIENNE
87;ALL DE JABALIE, AIXE-SUR-VIENNE
87;RUE JACQUES YVES COUSTEAU, AIXE-SUR-VIENNE
87;IMP JAMES COOK, AIXE-SUR-VIENNE
87;IMP DES JARDINS, AIXE-SUR-VIENNE
87;IMP JEAN BAPTISTE FRAGONARD, AIXE-SUR-VIENNE
87;IMP JEAN BAPTISTE GREUZE, AIXE-SUR-VIENNE
87;RUE JEAN BAPTISTE NANOT, AIXE-SUR-VIENNE
87;IMP JEAN CHARCOT, AIXE-SUR-VIENNE
87;ALL J CLAUDE SAVARY, AIXE-SUR-VIENNE
87;IMP JEAN FRANCOIS MILLET, AIXE-SUR-VIENNE
87;RUE JEAN BERNARD, AIXE-SUR-VIENNE
87;RUE JEAN MOULIN, AIXE-SUR-VIENNE
87;AV JEAN REBIER, AIXE-SUR-VIENNE
87;RUE JEANNE D ALBRET, AIXE-SUR-VIENNE
87;AV JEANNE PICHENAUD, AIXE-SUR-VIENNE
87;RUE JULES DUMONT D URVILLE, AIXE-SUR-VIENNE
87;IMP JULES MICHELET, AIXE-SUR-VIENNE
87;RTE DE LAGEAUD, AIXE-SUR-VIENNE
87;IMP LAMARTINE, AIXE-SUR-VIENNE
87;RUE LAVOISIER, AIXE-SUR-VIENNE
87;IMP LESAGE, AIXE-SUR-VIENNE
87;RTE DE LEYMARIE, AIXE-SUR-VIENNE
87;RUE DES LILAS, AIXE-SUR-VIENNE
87;RTE DE LIMOGES, AIXE-SUR-VIENNE
87;RTE DE LOSMONERIE, AIXE-SUR-VIENNE
87;RUE LOUIS LOUCHEUR, AIXE-SUR-VIENNE
87;AV DE MALASSERT, AIXE-SUR-VIENNE
87;RUE MARCEL BOURSET, AIXE-SUR-VIENNE
87;ALL DU MAS DU BOST, AIXE-SUR-VIENNE
87;CHE DU MAS DU BOST, AIXE-SUR-VIENNE
87;RTE DU MAS NEUF, AIXE-SUR-VIENNE
87;ALL MAURICE CABET, AIXE-SUR-VIENNE
87;RUE MERMOZ, AIXE-SUR-VIENNE
87;IMP MOLIERE, AIXE-SUR-VIENNE
87;RUE THEODORE MONOD, AIXE-SUR-VIENNE
87;RUE DU MOULIN DE FERT, AIXE-SUR-VIENNE
87;RUE DU MOULIN DE L OR, AIXE-SUR-VIENNE
87;RUE DU MOULIN CHEYROUX, AIXE-SUR-VIENNE
87;RUE DU MOULIN DE TARN, AIXE-SUR-VIENNE
87;ALL DU MOULIN DE VIENNE, AIXE-SUR-VIENNE
87;IMP MURILLO, AIXE-SUR-VIENNE
87;IMP DE LA NEPHLE, AIXE-SUR-VIENNE
87;CHEM DE LA NEPLE, AIXE-SUR-VIENNE
87;RUE DE LA NEPLE, AIXE-SUR-VIENNE
87;IMP NICOLAS POUSSIN, AIXE-SUR-VIENNE
87;RUE DU ONZE NOVEMBRE 1918, AIXE-SUR-VIENNE
87;RUE OUTRE VIENNE, AIXE-SUR-VIENNE
87;ALL DE LA PAGNADE, AIXE-SUR-VIENNE
87;CHE DE LA PAGNADE, AIXE-SUR-VIENNE
87;CHE DE PANGUET, AIXE-SUR-VIENNE
87;AV PASTEUR, AIXE-SUR-VIENNE
87;IMP PAUL EMILE VICTOR, AIXE-SUR-VIENNE
87;RUE DES PENSEES, AIXE-SUR-VIENNE
87;RTE DE PERIGUEUX, AIXE-SUR-VIENNE
87;RUE PIERRE GUYONNAUD, AIXE-SUR-VIENNE
87;RUE PIERRE MENDES FRANCE, AIXE-SUR-VIENNE
87;RUE PIERRE MOUSNIER, AIXE-SUR-VIENNE
87;RTE DE POMPADOUR, AIXE-SUR-VIENNE
87;RUE DU PORTAIL, AIXE-SUR-VIENNE
87;RUE DE LA POUGE, AIXE-SUR-VIENNE
87;AV DU PRESIDENT WILSON, AIXE-SUR-VIENNE
87;ALL DE PUY DE MONT, AIXE-SUR-VIENNE
87;RTE DE PUY DE MONT, AIXE-SUR-VIENNE
87;ALL DE PUY NEMARD, AIXE-SUR-VIENNE
87;RTE DE PUY NEMARD, AIXE-SUR-VIENNE
87;RUE DU PUY PANARD, AIXE-SUR-VIENNE
87;RTE DE PUY DE RIGNAC, AIXE-SUR-VIENNE
87;AV RAYMOND POINCARE, AIXE-SUR-VIENNE
87;RUE MAURICE RAVEL, AIXE-SUR-VIENNE
87;RUE DU RELAIS, AIXE-SUR-VIENNE
87;PL RENE GILLET, AIXE-SUR-VIENNE
87;ALL DES RESSAUDIS, AIXE-SUR-VIENNE
87;RUE REMBRANDT, AIXE-SUR-VIENNE
87;RUE DES RIVAUX, AIXE-SUR-VIENNE
87;RUE ROCHEFROIDE, AIXE-SUR-VIENNE
87;RUE DES ROCHES BLEUES, AIXE-SUR-VIENNE
87;RUE DES ROCHILLES, AIXE-SUR-VIENNE
87;RUE RENE VOISIN, AIXE-SUR-VIENNE
87;ALL DE RIEUX CROS, AIXE-SUR-VIENNE
87;RTE DE RIGNAC, AIXE-SUR-VIENNE
87;IMP RONSARD, AIXE-SUR-VIENNE
87;RUE DES ROSES, AIXE-SUR-VIENNE
87;RUE ROUGIER ET PARAT, AIXE-SUR-VIENNE
87;RUE SABOTERIE, AIXE-SUR-VIENNE
87;RUE SADI CARNOT, AIXE-SUR-VIENNE
87;AV SAINT AMAND, AIXE-SUR-VIENNE
87;PL SAINT GEORGES, AIXE-SUR-VIENNE
87;PL SAINT JACQUES, AIXE-SUR-VIENNE
87;RUE DE SAINT JACQUES, AIXE-SUR-VIENNE
87;CHE DE SAINT JACQUES, AIXE-SUR-VIENNE
87;ALL DU STADE, AIXE-SUR-VIENNE
87;RUE DE TARN, AIXE-SUR-VIENNE
87;RUE DES TUILIERES, AIXE-SUR-VIENNE
87;RUE TURGOT, AIXE-SUR-VIENNE
87;IMP UTRILLO, AIXE-SUR-VIENNE
87;IMP VAN DYCK, AIXE-SUR-VIENNE
87;RUE VELASQUEZ, AIXE-SUR-VIENNE
87;RUE DES VIATS, AIXE-SUR-VIENNE
87;RUE VICTOR HUGO, AIXE-SUR-VIENNE
87;AV DES VILLAS, AIXE-SUR-VIENNE
87;ALL DE VINCENNES, AIXE-SUR-VIENNE
87;RUE VOLTAIRE, AIXE-SUR-VIENNE
87;ALL DE LA VALLADE, AIXE-SUR-VIENNE
87;ALL DU VALLON DE RIGNAC, AIXE-SUR-VIENNE
87;ALL DE L'AIXETTE, AIXE-SUR-VIENNE
87;RUE JEAN BOULET, AIXE-SUR-VIENNE
87;ALL DES CHAMPS, AIXE-SUR-VIENNE
87;ALL DU COLOMBIER, AIXE-SUR-VIENNE
87;HLM CITE DES JUMEAUX, AMBAZAC
87;RES LE GERBASSOU, AMBAZAC
87;CITE MAISONGRANDE, AMBAZAC
87;ESPA MAVEST, AMBAZAC
87;CITE RAOUL DAUTRY, AMBAZAC
87;RUE ALPHONSE DAUDET, AMBAZAC
87;RUE ANATOLE FRANCE, AMBAZAC
87;ALL ANDRE MALRAUX, AMBAZAC
87;RUE ANNA BEILLOT, AMBAZAC
87;RUE DE LA BARRE, AMBAZAC
87;RUE ANDRE MARIE AMPERE, AMBAZAC
87;ALL GEORGES BIZET, AMBAZAC
87;RUE DE BEAUSEJOUR, AMBAZAC
87;RUE HECTOR BERLIOZ, AMBAZAC
87;RUE DE BELLEVUE, AMBAZAC
87;RUE DU BEUVREIX, AMBAZAC
87;PAS BUGEAUD, AMBAZAC
87;RUE DU BEYTOUR, AMBAZAC
87;CHE DES BOIS DE BRUGERAS, AMBAZAC
87;RUE DU BREUIL, AMBAZAC
87;ALL CAMILLE CLAUDEL, AMBAZAC
87;RUE DES CANTINES, AMBAZAC
87;ALL DES BOULEAUX, AMBAZAC
87;RUE CARNOT, AMBAZAC
87;IMP DES CANTINES, AMBAZAC
87;CITE CHANTEGROS, AMBAZAC
87;IMP CHANTEGROS, AMBAZAC
87;RUE CHANTEGROS, AMBAZAC
87;RUE DE CHANTELAUVE, AMBAZAC
87;ALL DES CHATAIGNIERS, AMBAZAC
87;ALL DES CHENES, AMBAZAC
87;CHE DE LA CHAPELLE, AMBAZAC
87;IMP DE LA CHENEVIERE, AMBAZAC
87;RUE DE COQUI, AMBAZAC
87;RUE DES CROUZILLAUDS, AMBAZAC
87;PL DU 19 MARS 1962, AMBAZAC
87;ALL CLAUDE DEBUSSY, AMBAZAC
87;RUE DESCARTES, AMBAZAC
87;RUE DES DOC BALLET, AMBAZAC
87;RUE DARIUS MILHAUD, AMBAZAC
87;RUE DU DR GIROU, AMBAZAC
87;RUE DU DOC POUQUET, AMBAZAC
87;RUE EMILIE FAURE, AMBAZAC
87;ALL DES FAUVETTES, AMBAZAC
87;PL DES FLEURS, AMBAZAC
87;RUE DE LA GARE, AMBAZAC
87;PL DE LA FONTAINE, AMBAZAC
87;ALL DES FORETS, AMBAZAC
87;IMP FRANCOIS CHATELUS, AMBAZAC
87;AV FRANCOIS MITTERRAND, AMBAZAC
87;RUE GAY LUSSAC, AMBAZAC
87;PL DE LA GARE, AMBAZAC
87;RUE DE LA GANE DE JUMEAU, AMBAZAC
87;CHE DES GRAVAIS, AMBAZAC
87;RUE GUSTAVE EIFFEL, AMBAZAC
87;AV GENERAL DE GAULLE, AMBAZAC
87;RUE GEORGES BRASSENS, AMBAZAC
87;ALL GEORGE SAND, AMBAZAC
87;CHEM DES GRANGES, AMBAZAC
87;RUE HENRI BECQUEREL, AMBAZAC
87;RUE DU GERBASSOU, AMBAZAC
87;AV DES HORTENSIAS, AMBAZAC
87;RUE JEAN BAPTISTE MARQUET, AMBAZAC
87;ALL DES HETRES, AMBAZAC
87;IMP JEAN GIRAUDOUX, AMBAZAC
87;PL DE L HOTEL DE VILLE, AMBAZAC
87;RUE JEAN BAPTISTE LANDON, AMBAZAC
87;RUE JEAN GAGNANT, AMBAZAC
87;RUE JEAN JAURES, AMBAZAC
87;RUE JEAN ET GABRIEL TEXIER, AMBAZAC
87;ALL DES JONQUILLES, AMBAZAC
87;RUE JULES FERRY, AMBAZAC
87;CHE DE LA LAITERIE, AMBAZAC
87;ALL LAMARTINE, AMBAZAC
87;IMP DU LAVOIR, AMBAZAC
87;RUE ANTOINE LAURENT LAVOISIER, AMBAZAC
87;RUE LEON BLUM, AMBAZAC
87;PAS LEO LAGRANGE, AMBAZAC
87;CHE DE LA LANDE DE NOUAILLAS, AMBAZAC
87;AV DE LA LIBERATION, AMBAZAC
87;IMP DE LA MAILLERIE, AMBAZAC
87;RUE MARCEL PAGNOL, AMBAZAC
87;AV MARKT ECKENTAL, AMBAZAC
87;RUE MARYSE BASTIE, AMBAZAC
87;CHE DES MARINES, AMBAZAC
87;ALL DU MASDOUMIER, AMBAZAC
87;ESP MAURICE BOITEL, AMBAZAC
87;RUE DE LA MAZAURIE, AMBAZAC
87;ALL DE LA METHODE, AMBAZAC
87;RUE MOLIERE, AMBAZAC
87;CHE MICHEL LHERITIER, AMBAZAC
87;RUE DE MONTHELY, AMBAZAC
87;ALL DE MONTMERY, AMBAZAC
87;RTE DE MONTMERY, AMBAZAC
87;ALL DE MURET, AMBAZAC
87;ALL ISAAC NEWTON, AMBAZAC
87;RUE D ORADOUR SUR GLANE, AMBAZAC
87;RUE BLAISE PASCAL, AMBAZAC
87;AV PASTEUR, AMBAZAC
87;IMP DE LA PERDRIX, AMBAZAC
87;CHE DE LA PEIRADE, AMBAZAC
87;CHE DU PUY DU BREUIL, AMBAZAC
87;RUE PIERRE ET MARIE CURIE, AMBAZAC
87;ALL DES PRIMEVERES, AMBAZAC
87;IMP DES 4 VENTS, AMBAZAC
87;PL DES 4 VENTS, AMBAZAC
87;ALL JEAN PHILIPPE RAMEAU, AMBAZAC
87;PL DE LA REPUBLIQUE, AMBAZAC
87;ALL MAURICE RAVEL, AMBAZAC
87;ALL ROGER COUDERC, AMBAZAC
87;AV DES ROSES, AMBAZAC
87;CHE DES RIVAILLES, AMBAZAC
87;RUE SAINT ANDRE, AMBAZAC
87;RUE SAINT ANTOINE, AMBAZAC
87;RUE SAINT JEAN, AMBAZAC
87;ALL DE SAINT ROCH, AMBAZAC
87;ALL ERIK SATIE, AMBAZAC
87;AV DE SOUFFLENHEIM, AMBAZAC
87;CHE DU TARIER, AMBAZAC
87;RUE DU TAURION, AMBAZAC
87;RTE DU TERME, AMBAZAC
87;RUE THEODORE HAVILAND, AMBAZAC
87;ALL DES TULIPES, AMBAZAC
87;RUE VINCENT VAN GOGH, AMBAZAC
87;ALL VICTOR HUGO, AMBAZAC
87;RUE DE LA PREVOTE, AMBAZAC
87;PTTE ESPACE MOSAIQUE, AMBAZAC
87;ALL SAINTE ANNE, AMBAZAC
87;ALL JEAN JACQUES ROUSSEAU, AMBAZAC
87;ALL DES RIVAILLES, AMBAZAC
87;RUE JOUANET, AMBAZAC
87;IMP DES ANCOLIES, AMBAZAC
87;CHE DE LA BERGERE, AMBAZAC
87;CHE DES BETOULLES, AMBAZAC
87;CHE DU BOIS BRULE, AMBAZAC
87;CHE DU BOIS DE MAUD, AMBAZAC
87;IMP DES BORDERIES, AMBAZAC
87;PAS DE BRUGERAS, AMBAZAC
87;CHE DES BRUYERES, AMBAZAC
87;IMP DU CLOS, AMBAZAC
87;IMP DE LA COMBE, AMBAZAC
87;PAS DES CORNADIS, AMBAZAC
87;IMP DES COUTURES, AMBAZAC
87;PAS DE L'ECHALIER, AMBAZAC
87;RTE DES ETANGS, AMBAZAC
87;CHE DES FAYERES, AMBAZAC
87;CHE DU GERMANET, AMBAZAC
87;RTE GEORGES GUINGOUIN, AMBAZAC
87;IMP DE LA GROSSE PIERRE, AMBAZAC
87;CHE DU HAMEAU, AMBAZAC
87;RUE HENRI DELAGE, AMBAZAC
87;RUE DU 8 MAI 1945, AMBAZAC
87;IMP DE MARAILLAT, AMBAZAC
87;RTE DES MINES, AMBAZAC
87;CHE DU MOULIN DE LABEYSSE, AMBAZAC
87;RTE DES MOULINS, AMBAZAC
87;CHE DU MUGUET, AMBAZAC
87;IMP DES PLANAUDS, AMBAZAC
87;CHE DES PLAINES, AMBAZAC
87;CHE DU PUY DU FOURNAUD, AMBAZAC
87;CHE DU PUY PAYAUD, AMBAZAC
87;CHE DU PUY VIOT, AMBAZAC
87;IMP DU PUY CHAVANAS, AMBAZAC
87;RTE DE L'ARTISANAT, AMBAZAC
87;CHE DE LA BARRE DE JUNIAT, AMBAZAC
87;CHE DE LAS BEINEIX, AMBAZAC
87;IMP DU BOIS DE LA DAME, AMBAZAC
87;CHE DU BOIS DE L'ETANG, AMBAZAC
87;IMP DU BOIS DE GALANT, AMBAZAC
87;RTE DE LA BOISSARDE, AMBAZAC
87;CHE DU BOIS DU RIVAUD, AMBAZAC
87;IMP DE BOURCEVET, AMBAZAC
87;CHE DE LA BRIQUETTERIE, AMBAZAC
87;IMP DE BUSSIGNET, AMBAZAC
87;PAS DU CHARRON, AMBAZAC
87;CHE DU CLOS, AMBAZAC
87;CHE DES COREES, AMBAZAC
87;IMP DU COUSSAT, AMBAZAC
87;CHE DE LA CRESSONNIERE, AMBAZAC
87;IMP DE LA CROIX DU MONT, AMBAZAC
87;CHE DES ECOLIERS, AMBAZAC
87;CHE DES ESSARTS, AMBAZAC
87;ALL DES FAGUS, AMBAZAC
87;IMP DES FAYES, AMBAZAC
87;ALL DE FONTAUBE, AMBAZAC
87;RTE DE LA GANNE, AMBAZAC
87;ALL DE LA FORGE, AMBAZAC
87;CHE DU GRAND JUNIAT, AMBAZAC
87;CHE DU GRAND PRE, AMBAZAC
87;CHE DU GRAND ROYERES, AMBAZAC
87;IMP DE L'HERMITTE, AMBAZAC
87;CHE DU HOUX, AMBAZAC
87;RTE DE JUNIAT, AMBAZAC
87;CHE DES LANVERS, AMBAZAC
87;ALL DES LATHIERES, AMBAZAC
87;IMP DE LESCURAS, AMBAZAC
87;IMP DU MAGRO, AMBAZAC
87;RTE MARTIN NADAUD, AMBAZAC
87;RTE DU MAS, AMBAZAC
87;RTE DU MAS MEYNARD, AMBAZAC
87;PAS DU MAS MEYNARD, AMBAZAC
87;CHE DU MAZOYER, AMBAZAC
87;RTE DE MAZURE, AMBAZAC
87;RTE DU MONT, AMBAZAC
87;CHE DU MOULIN DE LAVAUD, AMBAZAC
87;ALL PAUL GAUGUIN, AMBAZAC
87;CHE DES PATURAUDS, AMBAZAC
87;RTE DU PECHER, AMBAZAC
87;RTE DES PERRIERES, AMBAZAC
87;CHE DU PETIT JUNIAT, AMBAZAC
87;CHE DU PETIT MURET, AMBAZAC
87;CHE DU PEYROU, AMBAZAC
87;RTE DU PUY D'HENRIAT, AMBAZAC
87;CHE DU PONT DU REY, AMBAZAC
87;IMP DES POUGES, AMBAZAC
87;CHE DU PRE CARRE, AMBAZAC
87;RTE DU PRE DU RUISSEAU, AMBAZAC
87;PAS DU PUITS, AMBAZAC
87;IMP DU PUY DE LA NOIX, AMBAZAC
87;CHE DES RANTYS, AMBAZAC
87;RTE DES RAYERES, AMBAZAC
87;CHE DES RENGEAS, AMBAZAC
87;ALL DES RIBIERES, AMBAZAC
87;CHE DE ROYERES, AMBAZAC
87;CHE DE SAVAYAT, AMBAZAC
87;RUE DE LA SAVOIE, AMBAZAC
87;IMP DES SECHES, AMBAZAC
87;RTE SIMONE VEIL, AMBAZAC
87;IMP DE LA SEUVE, AMBAZAC
87;IMP DES TERRES DE LA CROIX, AMBAZAC
87;RTE DE LA TOURAILLE, AMBAZAC
87;RTE DE LA TUILERIE, AMBAZAC
87;RTE DE VEDRENNE, AMBAZAC
87;CHE DU VENT BARU, AMBAZAC
87;CHE DU VENT CHEVRIER, AMBAZAC
87;CHE DU VENT D'OUTO, AMBAZAC
87;CHE DE LA VERGNE, AMBAZAC
87;CHE DES VIATS, AMBAZAC
87;CHE DES VIGNES, AMBAZAC
87;RTE VIOLETTE SZABO, AMBAZAC
87;RTE ANDRE GAGNADRE, AMBAZAC
87;CHE DES CAILLOUX, AMBAZAC
87;CHE DU CAMP DE CESAR, AMBAZAC
87;CHE DU CHALARD, AMBAZAC
87;RTE DES CHAVERNEAUX, AMBAZAC
87;IMP DU CHENE ROUVRE, AMBAZAC
87;IMP DE LA COMBE AUX CLAIRS, AMBAZAC
87;RTE DE CROSSAS, AMBAZAC
87;CHE DE LA FONT, AMBAZAC
87;CHE DES FONTANILLES, AMBAZAC
87;IMP DE FORET VIEILLE, AMBAZAC
87;CHE DES FOUGERES, AMBAZAC
87;IMP DE GATTEBOURG, AMBAZAC
87;IMP DU MASSAUDOU, AMBAZAC
87;CHE DU PARLEUR, AMBAZAC
87;RTE PIERRE BROSSOLETTE, AMBAZAC
87;CHE DE LA PIERRE CREUSADE, AMBAZAC
87;RUE DU PONT DE JONAS, AMBAZAC
87;CHE DES PRADELLES, AMBAZAC
87;CHE DES TERRES NOIRES, AMBAZAC
87;RTE THERESE MENOT, AMBAZAC
87;CHE DES TUILIERES, AMBAZAC
87;CITE DU SOLEIL LEVANT, ARNAC-LA-POSTE
87;CITE LE CLOS TRANQUILLE, ARNAC-LA-POSTE
87;AV ALSACE LORRAINE, ARNAC-LA-POSTE
87;PL DU CHAMP DE FOIRE, ARNAC-LA-POSTE
87;ALL DES CHENES, ARNAC-LA-POSTE
87;RUE DE CLEEBOURG, ARNAC-LA-POSTE
87;RUE DU COUVENT, ARNAC-LA-POSTE
87;RTE DE LA COURUE, ARNAC-LA-POSTE
87;PL DU DIX NEUF MARS 1962, ARNAC-LA-POSTE
87;RUE DE L'ECOLE, ARNAC-LA-POSTE
87;PL DE L'EGLISE, ARNAC-LA-POSTE
87;RUE DES FLEURS, ARNAC-LA-POSTE
87;RUE DES FONTAINES, ARNAC-LA-POSTE
87;RUE DU HUIT MAI 1945, ARNAC-LA-POSTE
87;ALL DES JARDINS, ARNAC-LA-POSTE
87;RUE DES LAURIERS, ARNAC-LA-POSTE
87;RUE DE LA LIBERTE, ARNAC-LA-POSTE
87;RUE LE TRANSLOY, ARNAC-LA-POSTE
87;RPT DU MARRONNIER, ARNAC-LA-POSTE
87;RUE DE LA PISCINE, ARNAC-LA-POSTE
87;AV DE LA REPUBLIQUE, ARNAC-LA-POSTE
87;RUE DES ROSIERS, ARNAC-LA-POSTE
87;RUE SAINT MARTIAL, ARNAC-LA-POSTE
87;RUE DU TILLEUL, ARNAC-LA-POSTE
87;CHE DE LA TRAVERSADE, ARNAC-LA-POSTE
87;RUE DE BAMBOURNET, AUREIL
87;RUE DE BELLE VUE, AUREIL
87;IMP DES BELLES PIERRES, AUREIL
87;IMP DES BOULEAUX, AUREIL
87;IMP DES BOIS, AUREIL
87;CHE DU BOST, AUREIL
87;RTE DES CARRIERES, AUREIL
87;IMP DES CHARMES, AUREIL
87;IMP DES CHEVREFEUILLES, AUREIL
87;IMP DES CHEVREUILS, AUREIL
87;IMP DE LA CLAIRIERE, AUREIL
87;CHE DU CLUZEAU, AUREIL
87;RUE DES COLOMBES, AUREIL
87;RTE DE COMPOSTELLE, AUREIL
87;IMP DU COUDERCHOU, AUREIL
87;RUE DES ECOLES, AUREIL
87;CHE DES ECUREUILS, AUREIL
87;IMP DES EGLANTIERS, AUREIL
87;PL DE L'EGLISE, AUREIL
87;IMP DES ETANGS, AUREIL
87;RTE D'EYMOUTIERS, AUREIL
87;ALL DU FAURE, AUREIL
87;RTE DE LA FONTAINE, AUREIL
87;IMP DE FONTERNE, AUREIL
87;ALL DE LA GLACIERE, AUREIL
87;ALL DES IFS, AUREIL
87;IMP DE LA LANDE, AUREIL
87;RUE DE LA LANDE, AUREIL
87;RTE DE LATHONIE, AUREIL
87;RTE DE LAUBAUDIE, AUREIL
87;RUE DU LAVOIR, AUREIL
87;RTE DE LA MARE, AUREIL
87;IMP DU MISTRAL, AUREIL
87;IMP DU MONASTERE, AUREIL
87;CHE DU MOUSSAN, AUREIL
87;CHE DES NOYERS, AUREIL
87;RTE DU PETIT PONT, AUREIL
87;RTE DE PIERREFONTAINE, AUREIL
87;IMP DU PINIER, AUREIL
87;CHE DE LA PRAIRIE, AUREIL
87;RTE DE PRESSAC, AUREIL
87;CHE DU PUY D'AUREIL, AUREIL
87;CHE DES QUATRE SAISONS, AUREIL
87;RTE DE SAINT ANTOINE, AUREIL
87;CHE DE SAINT GAUCHER, AUREIL
87;RTE DE SAINT JUST LE MARTEL, AUREIL
87;RTE DE SAINT PAUL, AUREIL
87;IMP DES SAPINS, AUREIL
87;CHE DU SENATEUR, AUREIL
87;IMP DES SOURCES, AUREIL
87;ALL DU TILLEUL, AUREIL
87;IMP DES SAULES, AUREIL
87;RTE DE LA TUILIERE, AUREIL
87;RTE DE LA VALOINE, AUREIL
87;RUE DES ALIZES, AUREIL
87;RTE DE LA PORCELAINE, AUREIL
87;IMP DES CHARAILLAUX, AUREIL
87;ALL DES FRENES, AUREIL
87;PL DE L'EGLISE SAINT GENEST, AZAT-LE-RIS
87;RUE FONTAINE DES ROCHERS, AZAT-LE-RIS
87;RUE DE LA FORGETTE, AZAT-LE-RIS
87;IMP DE LA GRAND MAISON, AZAT-LE-RIS
87;RUE DU PRE MOULIN, AZAT-LE-RIS
87;RUE DU PRIEURE, AZAT-LE-RIS
87;RUE GRAND'RUE, BALLEDENT
87;RTE DE LAPRADE, BALLEDENT
87;RTE DU MONTILLON, BALLEDENT
87;RUE DES BRUYERES, BEAUMONT-DU-LAC
87;RUE DES CHENES, BEAUMONT-DU-LAC
87;RUE DES FOUGERES, BEAUMONT-DU-LAC
87;RUE DES GENEVRIERS, BEAUMONT-DU-LAC
87;RUE DES MELEZES, BEAUMONT-DU-LAC
87;RUE DE LA SAPINIERE, BEAUMONT-DU-LAC
87;RES GAI SEJOUR, BELLAC
87;LOT DES CHENES, BELLAC
87;RES LA LOGE, BELLAC
87;RTE DE L ANCIEN ABATTOIR, BELLAC
87;RUE JACQUES ANQUETIL, BELLAC
87;RUE ANDRE BRISSIAUD, BELLAC
87;IMP BRISSIAUD, BELLAC
87;RUE ARISTIDE BRIAND, BELLAC
87;RUE D ARSONVAL, BELLAC
87;RUE BARBES, BELLAC
87;RUE BAUDIN, BELLAC
87;RUE DE BELFORT, BELLAC
87;ALL DE LA BERGERE, BELLAC
87;RTE DE BLOND, BELLAC
87;RUE DE LA BORDERIE, BELLAC
87;RTE DE BORDESSOULE, BELLAC
87;IMP DES CAMINES, BELLAC
87;RUE DES CAMINES, BELLAC
87;PL CARNOT, BELLAC
87;IMP DES CHAINERIES, BELLAC
87;PL DU 138 EME R.I, BELLAC
87;PL DU 1382 RI, BELLAC
87;ALL CHANTEMERLE, BELLAC
87;RUE CHANZY, BELLAC
87;RUE DES CHAPELLES, BELLAC
87;FG CHAPTERIE AMBRETTE, BELLAC
87;FG CHAPTERIE CORRE, BELLAC
87;AV CHARLES DE GAULLE, BELLAC
87;RUE CHARLES TRENET, BELLAC
87;CHE DU CHATEAU D EAU, BELLAC
87;PL CHATEAUDUN, BELLAC
87;CHE DES CHAUMES, BELLAC
87;ALL DES CHENES, BELLAC
87;ESP ANDRE CLUZEAU, BELLAC
87;RUE HENRI COLOMBEAU, BELLAC
87;RUE DU COQ, BELLAC
87;CHE DES COTES, BELLAC
87;RTE DE CURZON, BELLAC
87;RUE PIERRE DELBARRY, BELLAC
87;AV DENFERT ROCHEREAU, BELLAC
87;RUE DU DOCTEUR VETELAY, BELLAC
87;RUE DES DOCTRINAIRES, BELLAC
87;RTE DU DORAT, BELLAC
87;CAR DE L'EUROPE, BELLAC
87;IMP EDITH PIAF, BELLAC
87;PL DE L'EGLISE, BELLAC
87;IMP DES ERABLES, BELLAC
87;RUE FELIX FAURE, BELLAC
87;RUE FERNAND FOUREAU, BELLAC
87;RUE DE LA FONTAINE, BELLAC
87;RUE DE LA FORGE A FER, BELLAC
87;RUE DU FORT, BELLAC
87;RUE DU PETIT FORT, BELLAC
87;RUE DU FOUR, BELLAC
87;RUE GAMBETTA, BELLAC
87;AV DE LA GARE, BELLAC
87;CHE DE LA GARENNE, BELLAC
87;RUE DU GENERAL ARBELLOT, BELLAC
87;RUE GEORGES BRASSENS, BELLAC
87;AV GEORGES POMPIDOU, BELLAC
87;CHE DES GERAUDS, BELLAC
87;ALL DES GERAUDS, BELLAC
87;CHE DE GEROUX, BELLAC
87;RUE DES GLAIEULS, BELLAC
87;FG DU GRAND CHAPTERIE, BELLAC
87;RUE DES GRANGES, BELLAC
87;RUE DES GRANGES VIGNAUD, BELLAC
87;RLE LE GRIPET, BELLAC
87;IMP DE L HOPITAL, BELLAC
87;PL DU HUIT MAI 1945, BELLAC
87;RUE DES IRIS, BELLAC
87;RUE JACQUES BREL, BELLAC
87;ALL JEAN BAPTISTE COROT, BELLAC
87;ALL JEAN BLANZAT, BELLAC
87;PL JEAN DE LA FONTAINE, BELLAC
87;RUE JEAN DE LA FONTAINE, BELLAC
87;ALL JEAN DINTRAS, BELLAC
87;AV JEAN JAURES, BELLAC
87;AV JEAN MOULIN, BELLAC
87;RUE LAFAYETTE, BELLAC
87;RUE LAMARTINE, BELLAC
87;IMP LAMIRANDE, BELLAC
87;RUE LEDRU ROLLIN, BELLAC
87;RUE LEO LAGRANGE, BELLAC
87;AV DE LA LIBERATION, BELLAC
87;AV DE LA LIBERTE, BELLAC
87;RUE DES LILAS, BELLAC
87;RTE DE LIMOGES, BELLAC
87;RUE DE LORETTE, BELLAC
87;RUE LOUIS JOUVET, BELLAC
87;AV LOUIS PASTEUR, BELLAC
87;IMP DES MAISONS NEUVES, BELLAC
87;RUE DES MAISONS NEUVES, BELLAC
87;AV DU MARECHAL FOCH, BELLAC
87;IMP MAREVERY, BELLAC
87;RUE DU 19 MARS 1962, BELLAC
87;RUE JEAN MERMOZ, BELLAC
87;RUE ALAIN MIMOUN, BELLAC
87;CHE DU MOULIN DES PERES, BELLAC
87;RUE DU MURIER, BELLAC
87;RUE NEUVE, BELLAC
87;PL DU PALAIS, BELLAC
87;IMP PANISSAT, BELLAC
87;RUE PAUL PAINLEVE, BELLAC
87;RUE DES PETITES MAISONS, BELLAC
87;CHE DES PETITES MEZIERES, BELLAC
87;RUE GERARD PHILIPPE, BELLAC
87;RUE PIERRE MERLIN, BELLAC
87;RTE DE POITIERS, BELLAC
87;RTE DE POMMIER, BELLAC
87;FG DU PONT DE LA PIERRE, BELLAC
87;RUE PORTE TRILLOUX, BELLAC
87;IMP PORTE TRILLOUX, BELLAC
87;RUE DE LA PROCESSION, BELLAC
87;RPE DU GAZ, BELLAC
87;RUE RASPAIL, BELLAC
87;AV RENE COTY, BELLAC
87;PL DE LA REPUBLIQUE, BELLAC
87;RUE DE LA REVOLUTION, BELLAC
87;CHEM DU MOULIN ROCHARD, BELLAC
87;CHE DE LA ROCHE CORBIERE, BELLAC
87;RUE DES ROCHETTES, BELLAC
87;ALL DES ROSEAUX, BELLAC
87;RUE DES ROSES, BELLAC
87;ALL DES ROSSIGNOLS, BELLAC
87;RUE SAINT-EXUPERY, BELLAC
87;AV DES SINGUELLES, BELLAC
87;ALL SUZANNE VALADON, BELLAC
87;RUE DES TANNERIES, BELLAC
87;RUE THEODORE BAC, BELLAC
87;RUE THIERS, BELLAC
87;RUE TRAVERSIERE, BELLAC
87;RUE DES TULIPES, BELLAC
87;RUE VERGNIAUD, BELLAC
87;BD VICTOR BUSSIERE, BELLAC
87;RUE DES VIEUX BLATS, BELLAC
87;AV VICTOR HUGO, BELLAC
87;RUE VINCENT AURIOL, BELLAC
87;ALL DU VINCOU, BELLAC
87;RUE DES VIOLETTES, BELLAC
87;RUE MARYSE BASTIE, BELLAC
87;SQ DE WASSERTRUDINGEN, BELLAC
87;CHE DES BEAUX, BERNEUIL
87;RUE DES BLANCHETS, BERNEUIL
87;RTE DE BLOND, BERNEUIL
87;RTE DES COMMUNAUX, BERNEUIL
87;CHE DES DEMOISELLES, BERNEUIL
87;CHE DU DOMAINE, BERNEUIL
87;PL DE L'EGLISE, BERNEUIL
87;CHE DES GOURGEAUX, BERNEUIL
87;SQ JACQUES NAVELET, BERNEUIL
87;RTE DE LIMOGES, BERNEUIL
87;CHE DES MAILS, BERNEUIL
87;RTE DE LA MARGELLE, BERNEUIL
87;CHE DES MEIZERIS, BERNEUIL
87;RUE DU PIGEONNIER, BERNEUIL
87;RTE DE POITIERS, BERNEUIL
87;PL DE LA POSTE, BERNEUIL
87;RUE DE LA PROCESSION, BERNEUIL
87;PL DU RELAIS, BERNEUIL
87;RTE DE ROUSSAC, BERNEUIL
87;IMP DU TAILLEUR, BERNEUIL
87;IMP DE LA TREILLE, BERNEUIL
87;RTE DE VAULRY, BERNEUIL
87;CHE DE L'AGE PONNET, BERSAC-SUR-RIVALIER
87;CHE DE L'ANCIEN COUVENT, BERSAC-SUR-RIVALIER
87;RTE DE LA CHAIZE, BERSAC-SUR-RIVALIER
87;RUE DU COMMERCE, BERSAC-SUR-RIVALIER
87;RUE DES COUTURES, BERSAC-SUR-RIVALIER
87;RUE DES ECOLES, BERSAC-SUR-RIVALIER
87;PL DE L'EGLISE, BERSAC-SUR-RIVALIER
87;IMP DE FEY, BERSAC-SUR-RIVALIER
87;RUE DE LA FONTAINE, BERSAC-SUR-RIVALIER
87;RUE DES FOSSES, BERSAC-SUR-RIVALIER
87;VC VOIE COMMUNALE 1, BERSAC-SUR-RIVALIER
87;VC VOIE COMMUNALE 2, BERSAC-SUR-RIVALIER
87;VC VOIE COMMUNALE 3, BERSAC-SUR-RIVALIER
87;VC VOIE COMMUNALE 4, BERSAC-SUR-RIVALIER
87;VC VOIE COMMUNALE 5, BERSAC-SUR-RIVALIER
87;VC VOIE COMMUNALE 5BIS, BERSAC-SUR-RIVALIER
87;VC VOIE COMMUNALE 6, BERSAC-SUR-RIVALIER
87;VC VOIE COMMUNALE 7, BERSAC-SUR-RIVALIER
87;VC VOIE COMMUNALE 8, BERSAC-SUR-RIVALIER
87;VC VOIE COMMUNALE 9, BERSAC-SUR-RIVALIER
87;VC VOIE COMMUNALE 10, BERSAC-SUR-RIVALIER
87;VC VOIE COMMUNALE 11, BERSAC-SUR-RIVALIER
87;VC VOIE COMMUNALE 12, BERSAC-SUR-RIVALIER
87;VC VOIE COMMUNALE 13, BERSAC-SUR-RIVALIER
87;VC VOIE COMMUNALE 14, BERSAC-SUR-RIVALIER
87;VC VOIE COMMUNALE 15, BERSAC-SUR-RIVALIER
87;VC VOIE COMMUNALE 15BIS, BERSAC-SUR-RIVALIER
87;VC VOIE COMMUNALE 16, BERSAC-SUR-RIVALIER
87;VC VOIE COMMUNALE 17, BERSAC-SUR-RIVALIER
87;RUE DE FONT ARDENT, BERSAC-SUR-RIVALIER
87;PL DES FOSSES, BERSAC-SUR-RIVALIER
87;RUE DE GALERNE, BERSAC-SUR-RIVALIER
87;RTE DE LA GARE, BERSAC-SUR-RIVALIER
87;RTE DE LEYCURAS, BERSAC-SUR-RIVALIER
87;RTE DE MAILLOFARGUEIX, BERSAC-SUR-RIVALIER
87;RUE DES MACONS, BERSAC-SUR-RIVALIER
87;RUE DE LA MAIRIE, BERSAC-SUR-RIVALIER
87;IMP DE LA POSTE, BERSAC-SUR-RIVALIER
87;PL DU TILLIEUL, BERSAC-SUR-RIVALIER
87;RUE DE L'ABBE DAYRAT, BESSINES SUR GARTEMPE
87;RUE ALBERT JACQUARD, BESSINES SUR GARTEMPE
87;RUE ALPHONSE DUCHASTEAU, BESSINES SUR GARTEMPE
87;RUE DE LA BORDERIE, BESSINES SUR GARTEMPE
87;IMP DE LA BORDERIE, BESSINES SUR GARTEMPE
87;IMP DES CHENEVIEVES, BESSINES SUR GARTEMPE
87;IMP H BECQUEREL, BESSINES SUR GARTEMPE
87;RUE DE CHEZ CANARD, BESSINES SUR GARTEMPE
87;ALL DES BEIGES, BESSINES SUR GARTEMPE
87;CHE DES BOIS, BESSINES SUR GARTEMPE
87;RUE DU FEU DE SAINT JEAN, BESSINES SUR GARTEMPE
87;CHE DES BONSHOMMES, BESSINES SUR GARTEMPE
