12;RUE DES MEJALIES, ST-AFFRIQUE
12;RUE MICHELET, ST-AFFRIQUE
12;RTE DE MILLAU, ST-AFFRIQUE
12;AV DE MILLAU, ST-AFFRIQUE
12;RUE DES MITRONS, ST-AFFRIQUE
12;RUE MONTAIGUT, ST-AFFRIQUE
12;IMP DU MOULIN DE MADAME, ST-AFFRIQUE
12;RUE DES MYRTHES, ST-AFFRIQUE
12;CHE NEUF BOURNAC, ST-AFFRIQUE
12;RUE NOBEL, ST-AFFRIQUE
12;RUE DES NOISETIERS, ST-AFFRIQUE
12;CHE DE NOUGAYROLLES, ST-AFFRIQUE
12;RUE DES NOYERS, ST-AFFRIQUE
12;PL CARREFOUR DE LA PAIX, ST-AFFRIQUE
12;RUE DU PARADIS, ST-AFFRIQUE
12;VOIE DE LA PASSERELLE, ST-AFFRIQUE
12;RUE PASTEUR, ST-AFFRIQUE
12;RUE DU PASTEUR BOREL, ST-AFFRIQUE
12;RUE PAUL BERT, ST-AFFRIQUE
12;RUE PAUL CLE, ST-AFFRIQUE
12;RUE DE LA PETANQUE, ST-AFFRIQUE
12;RUE DU PETIT MONTMARTRE, ST-AFFRIQUE
12;RUE DES PEUPLIERS, ST-AFFRIQUE
12;RUE PEYRE CADIAS, ST-AFFRIQUE
12;PL PAUL PAINLEVE, ST-AFFRIQUE
12;RUE PIERRE ET MARIE CURIE, ST-AFFRIQUE
12;VC LA PLACETTE BOURNAC, ST-AFFRIQUE
12;RTE DU PONT DE VENDELOVES, ST-AFFRIQUE
12;RUE DU PONT VIEUX, ST-AFFRIQUE
12;RUE DES POTIERS, ST-AFFRIQUE
12;RUE DU PRESSOIR MEDIEVAL, ST-AFFRIQUE
12;RUE DU PROGRES, ST-AFFRIQUE
12;RUE DE PROVENCE, ST-AFFRIQUE
12;CHE DU PRINTEMPS, ST-AFFRIQUE
12;RUE DE PUECH BOURILLOU, ST-AFFRIQUE
12;RUE RAYMOND GANTOU, ST-AFFRIQUE
12;RUE REAUMUR, ST-AFFRIQUE
12;RUE DE LA REDOUTE, ST-AFFRIQUE
12;CHE DES REMPARTS BOURNAC, ST-AFFRIQUE
12;IMP DES REMPARTS, ST-AFFRIQUE
12;RUE DES REMPARTS, ST-AFFRIQUE
12;RUE DE LA RENAISSANCE, ST-AFFRIQUE
12;BD DE LA REPUBLIQUE, ST-AFFRIQUE
12;RUE DE LA REPUBLIQUE, ST-AFFRIQUE
12;BD DE LA RESIDENCE, ST-AFFRIQUE
12;BD DE LA RESISTANCE, ST-AFFRIQUE
12;RUE RHIN ET DANUBE, ST-AFFRIQUE
12;CHE DE RIVALTES, ST-AFFRIQUE
12;RUE DES RIVES, ST-AFFRIQUE
12;RUE DE LA RIVIERE, ST-AFFRIQUE
12;RTE DU ROC BLANC, ST-AFFRIQUE
12;RUE DU ROCHER DE CAYLUS, ST-AFFRIQUE
12;RTE DE RODEZ, ST-AFFRIQUE
12;CHE DE RONDY, ST-AFFRIQUE
12;IMP DE LA ROSERAIE, ST-AFFRIQUE
12;RUE DES ROSES, ST-AFFRIQUE
12;IMP DE ROUBIAC, ST-AFFRIQUE
12;RUE DU ROUERGUE, ST-AFFRIQUE
12;RTE DE ST AFFRIQUE BOURNAC, ST-AFFRIQUE
12;CHE ST AMANS, ST-AFFRIQUE
12;CHE DE ST AMANS, ST-AFFRIQUE
12;PL ST GERAUD BOURNAC, ST-AFFRIQUE
12;RUE SAINT VINCENT, ST-AFFRIQUE
12;CHE DE ST VINCENT, ST-AFFRIQUE
12;RTE DE ST VICTOR, ST-AFFRIQUE
12;RUE DES SANS CULOTTES, ST-AFFRIQUE
12;RUE SARRUS, ST-AFFRIQUE
12;RUE DE SCOURDOIS, ST-AFFRIQUE
12;RUE DE LA SECURITE, ST-AFFRIQUE
12;RUE DU SOLDAT VAILHAUZY, ST-AFFRIQUE
12;IMP DE LA SORGUES, ST-AFFRIQUE
12;RUE DU SOUBAYROL, ST-AFFRIQUE
12;CHE DE LA STELE RAYMOND GANTOU, ST-AFFRIQUE
12;RUE DES TENDES, ST-AFFRIQUE
12;TSSE LA TERRASSE BOURNAC, ST-AFFRIQUE
12;RUE DU THERON, ST-AFFRIQUE
12;RUE DES TILLEULS, ST-AFFRIQUE
12;CHE DE TOULOUPY, ST-AFFRIQUE
12;RUE DE LA TOUR DE BAUME, ST-AFFRIQUE
12;RUE DU TRAUPONT, ST-AFFRIQUE
12;VC LA TRAVERSE  VAILHAUZY, ST-AFFRIQUE
12;RUE DE LA TURCIE, ST-AFFRIQUE
12;RUE DE L UNION, ST-AFFRIQUE
12;RUE DE L'USINE DUFEU, ST-AFFRIQUE
12;RUE VALERIE, ST-AFFRIQUE
12;RUE DE LA VALADE, ST-AFFRIQUE
12;CHE DE VAXERGUES, ST-AFFRIQUE
12;VOIE DE VAXERGUES LE HAUT, ST-AFFRIQUE
12;BD DE VERDUN, ST-AFFRIQUE
12;RUE DE LA VERNIERE, ST-AFFRIQUE
12;RTE DE LA VERNIERE, ST-AFFRIQUE
12;PL DE LA VERNIERE, ST-AFFRIQUE
12;BD VICTOR HUGO, ST-AFFRIQUE
12;RUE DE LA VIEILLE EGLISE, ST-AFFRIQUE
12;CAMI VIEL  BOURNAC, ST-AFFRIQUE
12;CHEM DE LA VIGNE, ST-AFFRIQUE
12;RUE VOLTAIRE, ST-AFFRIQUE
12;PL DE LA CROIX, SAINT-AMANS-DES-COTS
12;RUE DE L EGLISE, SAINT-AMANS-DES-COTS
12;RUE DE L HOSPICE, SAINT-AMANS-DES-COTS
12;RUE PRINCIPALE, SAINT-AMANS-DES-COTS
12;RTE DU NAYRAC, SAINT-AMANS-DES-COTS
12;RTE D ESPALION, SAINT-AMANS-DES-COTS
12;PL DU MONUMENT AUX MORTS, SAINT-AMANS-DES-COTS
12;RTE D ENTRAYGUES, SAINT-AMANS-DES-COTS
12;RTE DE LAGUIOLE, SAINT-AMANS-DES-COTS
12;PL DU FOIRAIL, SAINT-AMANS-DES-COTS
12;RUE DU FOIRAIL, SAINT-AMANS-DES-COTS
12;RTE DE MONTEZIC, SAINT-AMANS-DES-COTS
12;CHEM DES AIRES, SAINT-BEAUZELY
12;PL PLATEAU DES AIRES, SAINT-BEAUZELY
12;AV DEODAT ALAUS, SAINT-BEAUZELY
12;RUE SAINT ANTOINE, SAINT-BEAUZELY
12;RUE DU BARRY, SAINT-BEAUZELY
12;IMP DE LA BERTRANDE, SAINT-BEAUZELY
12;CHE DE LA CAMINADE, SAINT-BEAUZELY
12;CHE DES CAZELLES, SAINT-BEAUZELY
12;PL PIERRE COMBETTES, SAINT-BEAUZELY
12;TRA DE LA COSTE, SAINT-BEAUZELY
12;CHE DE LA DOUPLE, SAINT-BEAUZELY
12;CHE DE L'ECOLE, SAINT-BEAUZELY
12;PL DE L EGLISE, SAINT-BEAUZELY
12;CHE DU FOUR, SAINT-BEAUZELY
12;CHE DE LA GAGEA, SAINT-BEAUZELY
12;CHE DES GARDIES, SAINT-BEAUZELY
12;IMP PAUL GAUBERT, SAINT-BEAUZELY
12;RTE DES LACS DU LEVEZOU, SAINT-BEAUZELY
12;RUE DE LA MADELEINE, SAINT-BEAUZELY
12;PL DU MARRONNIER, SAINT-BEAUZELY
12;IMP DU MOULIN HAUT, SAINT-BEAUZELY
12;AV JULOU MERVIEL, SAINT-BEAUZELY
12;PL DE L ORATOIRE, SAINT-BEAUZELY
12;CHE DU PONT, SAINT-BEAUZELY
12;CHE DU PUECH, SAINT-BEAUZELY
12;CHE DU PUITS, SAINT-BEAUZELY
12;CHE DE RIBAUMES, SAINT-BEAUZELY
12;PL SAINT ROCH, SAINT-BEAUZELY
12;CHE ROYAL, SAINT-BEAUZELY
12;PL SOL DU SAOUTOU, SAINT-BEAUZELY
12;RUE SUBREMUR, SAINT-BEAUZELY
12;CHE DE LA VAYSSEDE, SAINT-BEAUZELY
12;RUE DE LA VIALE, SAINT-BEAUZELY
12;CHE DES VIGNOLS, SAINT-BEAUZELY
12;IMP DE LA VOLTE, SAINT-BEAUZELY
12;RUE DU VOULTRE, SAINT-BEAUZELY
12;LOT LA CROUX D ANTOINE, SAINT-CHELY-D AUBRAC
12;CHE DE LA VALLEE LIBRE, SAINT-CHELY-D AUBRAC
12;CITE LES POUZES, SAINT-CHRISTOPHE-VALLON
12;LOT LES COTEAUX DE ST CHRISTOP, SAINT-CHRISTOPHE-VALLON
12;LOT L'AURIAL, SAINT-CHRISTOPHE-VALLON
12;ZA ZONE ACTIVITES DU VALLON, SAINT-CHRISTOPHE-VALLON
12;RTE DE RODEZ, SAINT-CHRISTOPHE-VALLON
12;CHE DE LA BROUSSE, SAINT-CHRISTOPHE-VALLON
12;RTE DE GOUTRENS, SAINT-CHRISTOPHE-VALLON
12;CHE DE LA GARE, SAINT-CHRISTOPHE-VALLON
12;PL DE L EGLISE, SAINT-CHRISTOPHE-VALLON
12;RTE DU CAYLARET, SAINT-CHRISTOPHE-VALLON
12;RTE DE GLASSAC, SAINT-CHRISTOPHE-VALLON
12;RUE DE L EGLISE, SAINT-CHRISTOPHE-VALLON
12;PL DE LA MAIRIE, SAINT-CHRISTOPHE-VALLON
12;RTE DE CRANSAC, SAINT-CHRISTOPHE-VALLON
12;RTE DE DECAZEVILLE, SAINT-CHRISTOPHE-VALLON
12;RUE DES ECOLES, SAINT-CHRISTOPHE-VALLON
12;RUE DU CHAPITRE, SAINT-CHRISTOPHE-VALLON
12;CITE BEAU SOLEIL, SAINT-CHRISTOPHE-VALLON
12;RUE DES BOLTES, SAINT-CHRISTOPHE-VALLON
12;IMP DE LA BROUSSE, SAINT-CHRISTOPHE-VALLON
12;RTE DE LA BROUSSE, SAINT-CHRISTOPHE-VALLON
12;RUE DES BRUYERES, SAINT-CHRISTOPHE-VALLON
12;ALL CANTAGREL, SAINT-CHRISTOPHE-VALLON
12;IMP CANTAGREL, SAINT-CHRISTOPHE-VALLON
12;SQ CANTAGREL, SAINT-CHRISTOPHE-VALLON
12;RUE DE CANTAGREL, SAINT-CHRISTOPHE-VALLON
12;RTE DU CAYLA, SAINT-CHRISTOPHE-VALLON
12;RTE DE LA CAYREDE, SAINT-CHRISTOPHE-VALLON
12;RUE DU CENTRE, SAINT-CHRISTOPHE-VALLON
12;RLE DU CHAPITRE, SAINT-CHRISTOPHE-VALLON
12;RUE DES CHENES, SAINT-CHRISTOPHE-VALLON
12;RUE DES COMBETTES, SAINT-CHRISTOPHE-VALLON
12;RLE COMMUNALE, SAINT-CHRISTOPHE-VALLON
12;RUE DE LA COUFFIGNALE, SAINT-CHRISTOPHE-VALLON
12;RUE DES EGLANTIERS, SAINT-CHRISTOPHE-VALLON
12;RTE DE LA GARE, SAINT-CHRISTOPHE-VALLON
12;CITE LA LANDE, SAINT-CHRISTOPHE-VALLON
12;RTE DE MARCILLAC, SAINT-CHRISTOPHE-VALLON
12;RUE DES POUZES, SAINT-CHRISTOPHE-VALLON
12;CITE DES PRADES, SAINT-CHRISTOPHE-VALLON
12;RUE RESIDENCE, SAINT-CHRISTOPHE-VALLON
12;IMP DES TILLEULS, SAINT-CHRISTOPHE-VALLON
12;CITE VINZELLE, SAINT-CHRISTOPHE-VALLON
12;RUE DE LA VINZELLE, SAINT-CHRISTOPHE-VALLON
12;RES DE BRUGIERE, SAINT-COME-D OLT
12;RES DE CASTELNAU, SAINT-COME-D OLT
12;LOT LES GINESTES, SAINT-COME-D OLT
12;LOT LES PLACES, SAINT-COME-D OLT
12;LOT LE CLOS FROMENTAL, SAINT-COME-D OLT
12;LOT LES JARDINS DE LEVINHAC, SAINT-COME-D OLT
12;LOT DE LA POUJADE, SAINT-COME-D OLT
12;LOT DE TOULET, SAINT-COME-D OLT
12;VEN ENGONADO, SAINT-COME-D OLT
12;RTE D ARGENT, SAINT-COME-D OLT
12;AV D AUBRAC, SAINT-COME-D OLT
12;RUE BAPTISTE, SAINT-COME-D OLT
12;RUE BARBARIES, SAINT-COME-D OLT
12;PL DE LA BARRIEYRE, SAINT-COME-D OLT
12;PAS DU BARRIBERS, SAINT-COME-D OLT
12;RUE DU BARRIVERS, SAINT-COME-D OLT
12;RTE DE LABASTIDE, SAINT-COME-D OLT
12;RTE DE BORALDETTE, SAINT-COME-D OLT
12;RUE DE LA BOUISSE, SAINT-COME-D OLT
12;RUE BRULEE, SAINT-COME-D OLT
12;CHE DU CALVAIRE, SAINT-COME-D OLT
12;RTE DE CASTELNAU, SAINT-COME-D OLT
12;CHE DE COSTEFOLLES, SAINT-COME-D OLT
12;RUE DU COUVENT, SAINT-COME-D OLT
12;RUE CREMADE, SAINT-COME-D OLT
12;RUE DE LA DRAILLE, SAINT-COME-D OLT
12;PL DE L EGLISE, SAINT-COME-D OLT
12;RUE DE L EGLISE, SAINT-COME-D OLT
12;AV D ESPALION, SAINT-COME-D OLT
12;AV DU FOIRAIL, SAINT-COME-D OLT
12;RUE DE LA FONTAINE, SAINT-COME-D OLT
12;RUE DES FOSSES, SAINT-COME-D OLT
12;RUE DU FOUR, SAINT-COME-D OLT
12;CHE DU FROMENTAL, SAINT-COME-D OLT
12;RUE DES GINESTES, SAINT-COME-D OLT
12;SEN DU GOURC DU PICOU, SAINT-COME-D OLT
12;RUE DU GREFFE, SAINT-COME-D OLT
12;RUE JEAN BAPTISTE CLEDON, SAINT-COME-D OLT
12;PL DE LA MAIRIE, SAINT-COME-D OLT
12;PL MALIMANDE, SAINT-COME-D OLT
12;RUE MATHAT, SAINT-COME-D OLT
12;RUE DE L OURADOU, SAINT-COME-D OLT
12;RUE DES PENITENTS, SAINT-COME-D OLT
12;AV DE PIGUE, SAINT-COME-D OLT
12;CHE DES PLANTIERS, SAINT-COME-D OLT
12;PL DE LA PORTE NEUVE, SAINT-COME-D OLT
12;PL DE LA PORTE THERON, SAINT-COME-D OLT
12;RUE DE LA POTERNE, SAINT-COME-D OLT
12;RUE DU PRIEURE, SAINT-COME-D OLT
12;CHE DE LA RAME, SAINT-COME-D OLT
12;PL DU RELAIS, SAINT-COME-D OLT
12;PAS DES REMPARTS, SAINT-COME-D OLT
12;CHE DE LA RIGALDIE, SAINT-COME-D OLT
12;AV DE ST GENIEZ, SAINT-COME-D OLT
12;RTE DE SAINT GENIEZ, SAINT-COME-D OLT
12;RUE STE MARIE, SAINT-COME-D OLT
12;RTE DE SALGUES, SAINT-COME-D OLT
12;RUE DU TERRAL, SAINT-COME-D OLT
12;RUE DU THERON, SAINT-COME-D OLT
12;CHE DE TOULET, SAINT-COME-D OLT
12;TOUR DE VILLE, SAINT-COME-D OLT
12;IMP DES ALLEMANDS, SAINTE-CROIX
12;IMP DE BALARD, SAINTE-CROIX
12;RTE DE LA BARRIERE, SAINTE-CROIX
12;RTE DU BARRY, SAINTE-CROIX
12;RTE DE BERVIC, SAINTE-CROIX
12;RTE DE BIRAUSSEL, SAINTE-CROIX
12;IMP DE LA BORIE DE CABROL, SAINTE-CROIX
12;RTE DES BORIES, SAINTE-CROIX
12;IMP DE BOUQUIES, SAINTE-CROIX
12;RTE DU BOURG, SAINTE-CROIX
12;RTE DE BOURRAFIES, SAINTE-CROIX
12;RTE DE LA BOUYSSONIE, SAINTE-CROIX
12;CHEM BUISSONIER, SAINTE-CROIX
12;IMP DES CABANES, SAINTE-CROIX
12;RTE DE CAMBOUS, SAINTE-CROIX
12;RTE DU CAMP D AGREGOUS, SAINTE-CROIX
12;IMP DU CAMP GRAND, SAINTE-CROIX
12;IMP DE CANCERIS, SAINTE-CROIX
12;RTE DU CEDRE, SAINTE-CROIX
12;RUE DU CHASSE ROUE, SAINTE-CROIX
12;PL DU CLOCHER, SAINTE-CROIX
12;RTE DE COMBEFICAT, SAINTE-CROIX
12;RTE DE LA CONQUE, SAINTE-CROIX
12;RTE DES CROIX DE L HOM, SAINTE-CROIX
12;RTE DE LA CROIX DE SAUVETE, SAINTE-CROIX
12;RTE DU CROUZET, SAINTE-CROIX
12;RTE DES DEUX VALLEES, SAINTE-CROIX
12;IMP DE DORDOGNE, SAINTE-CROIX
12;RTE DE LA DRICHERIE, SAINTE-CROIX
12;CHEM DE L EAU, SAINTE-CROIX
12;RUE DE L EGLISE ST PAUL, SAINTE-CROIX
12;RUE DES ECOLIERS, SAINTE-CROIX
12;RTE DES FARGUES, SAINTE-CROIX
12;RTE DE FEJAVIOLE, SAINTE-CROIX
12;RUE DES FIGUIERS, SAINTE-CROIX
12;CHEM DES FOSSES, SAINTE-CROIX
12;RTE DE GAMETIS, SAINTE-CROIX
12;RTE DE LA GARRIGUE, SAINTE-CROIX
12;IMP DE LA GLASSADE, SAINTE-CROIX
12;RTE DU GOUZOU, SAINTE-CROIX
12;RTE DE LA GUIZONIE, SAINTE-CROIX
12;RTE DES JONCS, SAINTE-CROIX
12;RTE DE LAGARDE, SAINTE-CROIX
12;RTE DU MAS DE DARNE, SAINTE-CROIX
12;RTE DU MAS DE FOURNIER, SAINTE-CROIX
12;IMP DU MAS DE LACAN, SAINTE-CROIX
12;IMP DU MAS DU SOL, SAINTE-CROIX
12;RTE DE LA MARQUES, SAINTE-CROIX
12;RTE DE LA MASSEPIE, SAINTE-CROIX
12;RTE DE LA MAURENQUE, SAINTE-CROIX
12;IMP DU MAZET, SAINTE-CROIX
12;RTE DE MOLIERES, SAINTE-CROIX
12;IMP DU MOULIN, SAINTE-CROIX
12;RTE DU PARADIS, SAINTE-CROIX
12;RTE DE LA PAUZE, SAINTE-CROIX
12;IMP DE LA PAUZETTE, SAINTE-CROIX
12;RUE PAVEE, SAINTE-CROIX
12;IMP DU PIGEONNIER, SAINTE-CROIX
12;IMP DE POMIES, SAINTE-CROIX
12;RUE PORTE MEDIEVALE, SAINTE-CROIX
12;RTE DES PRADELLES, SAINTE-CROIX
12;RTE DU PUECH, SAINTE-CROIX
12;RTE DU PUECH DES VIGNES, SAINTE-CROIX
12;RTE DU PUECH PALAT, SAINTE-CROIX
12;CHEM DES RIVES, SAINTE-CROIX
12;RTE DE SABATIE, SAINTE-CROIX
12;RTE DE LA SARRETTE, SAINTE-CROIX
12;RTE DE SEMBEL, SAINTE-CROIX
12;RTE DE SERIOLS, SAINTE-CROIX
12;RUE SERPENTE, SAINTE-CROIX
12;IMP DE SEVENET, SAINTE-CROIX
12;RTE DU SOULIE, SAINTE-CROIX
12;RTE DU STADE, SAINTE-CROIX
12;IMP DE TEULE, SAINTE-CROIX
12;RUE DE LA TOUR, SAINTE-CROIX
12;RTE DE TOURIER, SAINTE-CROIX
12;RTE DE LA VALETTE, SAINTE-CROIX
12;LOT LA CROUX D'ANTOINE, SAINTE-EULALIE-D OLT
12;RUE D AUBULY, SAINTE-EULALIE-D OLT
12;CHE DES AVABRES, SAINTE-EULALIE-D OLT
12;RUE DU BARRY D AUBULY, SAINTE-EULALIE-D OLT
12;PASS DE BUDEL, SAINTE-EULALIE-D OLT
12;RUE DEL CAGAYROL, SAINTE-EULALIE-D OLT
12;CHE DE LA CALQUIERE, SAINTE-EULALIE-D OLT
12;CHE DE LA CANIBIERE, SAINTE-EULALIE-D OLT
12;RUE DE LA CAPELETTE, SAINTE-EULALIE-D OLT
12;CHE DES CLAUZETS, SAINTE-EULALIE-D OLT
12;RUE DE LA CROUX D ANTOINE, SAINTE-EULALIE-D OLT
12;RTE DES DEUX RIVES, SAINTE-EULALIE-D OLT
12;PL DE L EGLISE, SAINTE-EULALIE-D OLT
12;RUE DE LA FON DE STE ANNE, SAINTE-EULALIE-D OLT
12;PL DE LA FONTAINE, SAINTE-EULALIE-D OLT
12;RUE DE LA FONTAINE D AUBULY, SAINTE-EULALIE-D OLT
12;RUE DE LA GRAVE, SAINTE-EULALIE-D OLT
12;RUE DE MOYSSAC, SAINTE-EULALIE-D OLT
12;RTE DE LA PASSERELLE, SAINTE-EULALIE-D OLT
12;RUE DE LA PIOLE, SAINTE-EULALIE-D OLT
12;RUE DU PONT DE TRESQUE, SAINTE-EULALIE-D OLT
12;RUE DU PRESSOIR, SAINTE-EULALIE-D OLT
12;RUE DE LA RAYNALDIE, SAINTE-EULALIE-D OLT
12;RUE DE LA RIALLE, SAINTE-EULALIE-D OLT
12;PL DU SOL DE LA RENTE, SAINTE-EULALIE-D OLT
12;RUE DU TOMBAREL, SAINTE-EULALIE-D OLT
12;CHE DE TORTE SEDE, SAINTE-EULALIE-D OLT
12;RUE DE LA TRAVERSE, SAINTE-EULALIE-D OLT
12;PL DE L'AIRE DE LA COUR, SAINTE-EULALIE-DE-CERNON
12;RUE DE BANCELLE, SAINTE-EULALIE-DE-CERNON
12;PL DU BARRY, SAINTE-EULALIE-DE-CERNON
12;RUE DU BARRY, SAINTE-EULALIE-DE-CERNON
12;RUE BASSE, SAINTE-EULALIE-DE-CERNON
12;RUE BORIE, SAINTE-EULALIE-DE-CERNON
12;RUE DE LA CHAPELLE, SAINTE-EULALIE-DE-CERNON
12;RTE DE LA CAVALERIE, SAINTE-EULALIE-DE-CERNON
12;RUE COTE VIEILLE, SAINTE-EULALIE-DE-CERNON
12;PL DES CLAUZETS, SAINTE-EULALIE-DE-CERNON
12;RUE DES CLAUZETS, SAINTE-EULALIE-DE-CERNON
12;IMP DU COUVENT, SAINTE-EULALIE-DE-CERNON
12;PL DE L EGLISE, SAINTE-EULALIE-DE-CERNON
12;PL DE LA FONTAINE, SAINTE-EULALIE-DE-CERNON
12;RTE DE LA GARE, SAINTE-EULALIE-DE-CERNON
12;RUE GRAND RUE, SAINTE-EULALIE-DE-CERNON
12;RUE CAMILLE GRIMAL, SAINTE-EULALIE-DE-CERNON
12;RUE MARIA GRIMAL, SAINTE-EULALIE-DE-CERNON
12;RUE DE LADOUX, SAINTE-EULALIE-DE-CERNON
12;RUE DE LARJALAS, SAINTE-EULALIE-DE-CERNON
12;RUE DE LA MAIRIE, SAINTE-EULALIE-DE-CERNON
12;RUE DE MARINOU, SAINTE-EULALIE-DE-CERNON
12;RUE DE LA MAURINE, SAINTE-EULALIE-DE-CERNON
12;RUE OMER MAZERAN, SAINTE-EULALIE-DE-CERNON
12;CHE DE MILLAU, SAINTE-EULALIE-DE-CERNON
12;CHE DU MOULIN, SAINTE-EULALIE-DE-CERNON
12;RUE DU PORTAIL, SAINTE-EULALIE-DE-CERNON
12;PL POUSARANQUETTE, SAINTE-EULALIE-DE-CERNON
12;RUE DU PRESBYTERE, SAINTE-EULALIE-DE-CERNON
12;RUE DU PUECH DE LA VIGNE, SAINTE-EULALIE-DE-CERNON
12;RUE DE LA ROCHE, SAINTE-EULALIE-DE-CERNON
12;RTE DE ST ROME, SAINTE-EULALIE-DE-CERNON
12;PL DU SACRE COEUR, SAINTE-EULALIE-DE-CERNON
12;PL DU TOUAT DEL MARY, SAINTE-EULALIE-DE-CERNON
12;RUE DU TROU DU CHIEN, SAINTE-EULALIE-DE-CERNON
12;RUE MARIN VERNIERES, SAINTE-EULALIE-DE-CERNON
12;RUE DU BARRY, SAINT-FELIX-DE-SORGUES
12;RTE DE CORNUS, SAINT-FELIX-DE-SORGUES
12;RUE COSTEGRAVE, SAINT-FELIX-DE-SORGUES
12;PL DE L EGLISE, SAINT-FELIX-DE-SORGUES
12;RUE DU FOUR, SAINT-FELIX-DE-SORGUES
12;GR GRAND RUE, SAINT-FELIX-DE-SORGUES
12;RUE DU LAVOIR, SAINT-FELIX-DE-SORGUES
12;RUE NICOT, SAINT-FELIX-DE-SORGUES
12;RUE DU PORCHE, SAINT-FELIX-DE-SORGUES
12;PL DU REVELIN, SAINT-FELIX-DE-SORGUES
12;RUE DU REVELIN, SAINT-FELIX-DE-SORGUES
12;RES LA VIGNOTTE, ARGENCES EN AUBRAC
12;RUE NEUVE, ARGENCES EN AUBRAC
12;AV DU STADE, ARGENCES EN AUBRAC
12;RTE DES BESSIERES, ARGENCES EN AUBRAC
12;RUE DES JARDINS, ARGENCES EN AUBRAC
12;RUE DE THENIERES, ARGENCES EN AUBRAC
12;RUE DES BARRAGES, ARGENCES EN AUBRAC
12;RUE DU COUVENT, ARGENCES EN AUBRAC
12;RUE DU PONT DU PRE, ARGENCES EN AUBRAC
12;RUE DES FLEURS, ARGENCES EN AUBRAC
12;RUE DU PONT PEYRENQ, ARGENCES EN AUBRAC
12;RUE DE L ANGLADE, ARGENCES EN AUBRAC
12;PL DES TILLEULS, ARGENCES EN AUBRAC
12;PL DE L EGLISE, ARGENCES EN AUBRAC
12;RUE DE L ARGENCE, ARGENCES EN AUBRAC
12;PL DE LA CROIX, ARGENCES EN AUBRAC
12;RUE DU RIOLS, ARGENCES EN AUBRAC
12;AV DE LA MECANIQUE, ARGENCES EN AUBRAC
12;RUE DE NOUELLES, ARGENCES EN AUBRAC
12;RUE DU BARDIE, ARGENCES EN AUBRAC
12;RUE DE LA PEPINIERE, ARGENCES EN AUBRAC
12;AV DES MOLINIERES, ARGENCES EN AUBRAC
12;RUE DES ECOLES, ARGENCES EN AUBRAC
12;RUE DE LA MONTAGNE, ARGENCES EN AUBRAC
12;IMP DES FORGERONS, ARGENCES EN AUBRAC
12;RUE DU BARRY, ARGENCES EN AUBRAC
12;IMP DE LA POSTE, ARGENCES EN AUBRAC
12;RUE DES SOURCES, ARGENCES EN AUBRAC
12;RUE DES LAURIERES, ARGENCES EN AUBRAC
12;ALL DES TILLEULS, ARGENCES EN AUBRAC
12;RUE DES ROSIERS, ARGENCES EN AUBRAC
12;RUE DES GENETS, ARGENCES EN AUBRAC
12;IMP NICOLAS, ARGENCES EN AUBRAC
12;RUE DES THUYAS, ARGENCES EN AUBRAC
12;RUE DE LA VARENE, ARGENCES EN AUBRAC
12;RTE DES PRADAUX, ARGENCES EN AUBRAC
12;AV DE PARIS, ARGENCES EN AUBRAC
12;RUE DE LA CALMONTIE, ARGENCES EN AUBRAC
12;LOT DE LA COMMANDERIE, SAINT GENIEZ D'OLT ET D'AUBRAC
12;ZA DE LA FALQUE, SAINT GENIEZ D'OLT ET D'AUBRAC
12;RUE ALEXIS MONTEIL, SAINT GENIEZ D'OLT ET D'AUBRAC
12;RUE ANTOINE VILLIERS, SAINT GENIEZ D'OLT ET D'AUBRAC
12;RUE D AURONNE, SAINT GENIEZ D'OLT ET D'AUBRAC
12;RUE DU BARRIBES, SAINT GENIEZ D'OLT ET D'AUBRAC
12;CHE DE LA CARRIEIRETTE, SAINT GENIEZ D'OLT ET D'AUBRAC
12;RLE DU CHATEAU, SAINT GENIEZ D'OLT ET D'AUBRAC
12;CITE COMBACAU, SAINT GENIEZ D'OLT ET D'AUBRAC
12;RTE DE COMBE TALADE, SAINT GENIEZ D'OLT ET D'AUBRAC
12;RUE DE LA COMMANDERIE, SAINT GENIEZ D'OLT ET D'AUBRAC
12;RUE DU COMMERCE, SAINT GENIEZ D'OLT ET D'AUBRAC
12;RTE DE LA CASCADE, SAINT GENIEZ D'OLT ET D'AUBRAC
12;CHE DU COUDENAS, SAINT GENIEZ D'OLT ET D'AUBRAC
12;PL DU COURS, SAINT GENIEZ D'OLT ET D'AUBRAC
12;RUE DU COURS, SAINT GENIEZ D'OLT ET D'AUBRAC
12;AV D ESPALION, SAINT GENIEZ D'OLT ET D'AUBRAC
12;RUE FRAYSSINOUS, SAINT GENIEZ D'OLT ET D'AUBRAC
12;RLE DES FILEUSES, SAINT GENIEZ D'OLT ET D'AUBRAC
12;AV DE LA GARE, SAINT GENIEZ D'OLT ET D'AUBRAC
12;PL GENERAL DE GAULLE, SAINT GENIEZ D'OLT ET D'AUBRAC
12;PL DE LA HALLE, SAINT GENIEZ D'OLT ET D'AUBRAC
12;RLE DES HORTS, SAINT GENIEZ D'OLT ET D'AUBRAC
12;RUE DE L HOTEL DE VILLE, SAINT GENIEZ D'OLT ET D'AUBRAC
12;RUE HYGONNET, SAINT GENIEZ D'OLT ET D'AUBRAC
12;RUE DU LOTISSEMENT SERPENTIE, SAINT GENIEZ D'OLT ET D'AUBRAC
12;RLE DE MAGANHE, SAINT GENIEZ D'OLT ET D'AUBRAC
12;PL DU MARCHE, SAINT GENIEZ D'OLT ET D'AUBRAC
12;RTE DES MONTS D AUBRAC, SAINT GENIEZ D'OLT ET D'AUBRAC
12;RUE DU MOULIN, SAINT GENIEZ D'OLT ET D'AUBRAC
12;RUE NATIONALE, SAINT GENIEZ D'OLT ET D'AUBRAC
12;CHEM DE PATAGOU, SAINT GENIEZ D'OLT ET D'AUBRAC
12;RUE DE PLAISANCE, SAINT GENIEZ D'OLT ET D'AUBRAC
12;RTE DES PLANTIERS, SAINT GENIEZ D'OLT ET D'AUBRAC
12;RUE DES PLANHES, SAINT GENIEZ D'OLT ET D'AUBRAC
12;RUE DE LA POUJADE, SAINT GENIEZ D'OLT ET D'AUBRAC
12;RTE DE PRADES, SAINT GENIEZ D'OLT ET D'AUBRAC
12;PL DU QUAI, SAINT GENIEZ D'OLT ET D'AUBRAC
12;RUE DU RAVIEUX, SAINT GENIEZ D'OLT ET D'AUBRAC
12;RUE RAYNAL, SAINT GENIEZ D'OLT ET D'AUBRAC
12;RUE RIVIE, SAINT GENIEZ D'OLT ET D'AUBRAC
12;RUE DE LA RIVIERE, SAINT GENIEZ D'OLT ET D'AUBRAC
12;RUE ROGERY, SAINT GENIEZ D'OLT ET D'AUBRAC
12;RLE DE LA ROSERAIE, SAINT GENIEZ D'OLT ET D'AUBRAC
12;RLE DE LA SAGNE, SAINT GENIEZ D'OLT ET D'AUBRAC
12;RTE DE SAINT LAURENT, SAINT GENIEZ D'OLT ET D'AUBRAC
12;AV DE ST LAURENT, SAINT GENIEZ D'OLT ET D'AUBRAC
12;RTE DE SAINT MARTIN, SAINT GENIEZ D'OLT ET D'AUBRAC
12;AV DE ST MARTIN, SAINT GENIEZ D'OLT ET D'AUBRAC
12;AV DE SAINT PIERRE, SAINT GENIEZ D'OLT ET D'AUBRAC
12;RTE DE SAINTE EULALIE, SAINT GENIEZ D'OLT ET D'AUBRAC
12;RUE DE LA SALLE, SAINT GENIEZ D'OLT ET D'AUBRAC
12;RUE DU STADE, SAINT GENIEZ D'OLT ET D'AUBRAC
12;RUE SANNIE, SAINT GENIEZ D'OLT ET D'AUBRAC
12;CHE DU SEMINAIRE, SAINT GENIEZ D'OLT ET D'AUBRAC
12;RUE SERPENTIE, SAINT GENIEZ D'OLT ET D'AUBRAC
12;CITE SERPENTIER, SAINT GENIEZ D'OLT ET D'AUBRAC
12;RUE DE LA TUILIERE, SAINT GENIEZ D'OLT ET D'AUBRAC
12;RTE DE VERLAC, SAINT GENIEZ D'OLT ET D'AUBRAC
12;RTE DES VAYSSERIES, SAINT GENIEZ D'OLT ET D'AUBRAC
12;LOT LES TERRASSES DE MAYRES, SAINT-GEORGES-DE-LUZENCON
12;RUE DES AIRES, SAINT-GEORGES-DE-LUZENCON
12;PL DE L AIRETTE, SAINT-GEORGES-DE-LUZENCON
12;IMP DE L ALBARET, SAINT-GEORGES-DE-LUZENCON
12;RUE DES ARTISANS, SAINT-GEORGES-DE-LUZENCON
12;RUE DES ASSALISSES, SAINT-GEORGES-DE-LUZENCON
12;RUE BARBACANE, SAINT-GEORGES-DE-LUZENCON
12;RUE DES BALSES, SAINT-GEORGES-DE-LUZENCON
12;RTE DE LA BARQUE, SAINT-GEORGES-DE-LUZENCON
12;CHE DES BARRIAS, SAINT-GEORGES-DE-LUZENCON
12;RUE DU BARRY, SAINT-GEORGES-DE-LUZENCON
12;RUE DU BARRY DE COULOT, SAINT-GEORGES-DE-LUZENCON
12;RUE DU BARRY HAUT, SAINT-GEORGES-DE-LUZENCON
12;RUE DU BARRY DU TEMPLE, SAINT-GEORGES-DE-LUZENCON
12;RUE DU BELVEZE, SAINT-GEORGES-DE-LUZENCON
12;AV BERNARD POTTIER, SAINT-GEORGES-DE-LUZENCON
12;IMP BIMET, SAINT-GEORGES-DE-LUZENCON
12;PL DU BOUSCAILLOU, SAINT-GEORGES-DE-LUZENCON
12;RUE CABRIERE, SAINT-GEORGES-DE-LUZENCON
12;RUE DU CALADOU, SAINT-GEORGES-DE-LUZENCON
12;IMP DU CAUSSE, SAINT-GEORGES-DE-LUZENCON
12;RUE DU CHATEAU DE ST GENIEZ, SAINT-GEORGES-DE-LUZENCON
12;CHE DE LA CHAUSSEE HAUTE, SAINT-GEORGES-DE-LUZENCON
12;RUE DES COMBES, SAINT-GEORGES-DE-LUZENCON
12;PL DES COSTETTES, SAINT-GEORGES-DE-LUZENCON
12;RTE DE CRAYSSAGUET, SAINT-GEORGES-DE-LUZENCON
12;PL DE L EGLISE, SAINT-GEORGES-DE-LUZENCON
12;PL DE L EGLISE DE ST GENIEZ, SAINT-GEORGES-DE-LUZENCON
12;RUE DE LA FONTAINE DE S GENIEZ, SAINT-GEORGES-DE-LUZENCON
12;RUE DE LA FONTAINE VIEILLE, SAINT-GEORGES-DE-LUZENCON
12;BD DES LACOUZES, SAINT-GEORGES-DE-LUZENCON
12;RUE LEVERS, SAINT-GEORGES-DE-LUZENCON
12;PL DU LEVEZOU, SAINT-GEORGES-DE-LUZENCON
12;RTE DE LUZENCON, SAINT-GEORGES-DE-LUZENCON
12;IMP MALABANE, SAINT-GEORGES-DE-LUZENCON
12;RUE DU MAS DE CAMPELS, SAINT-GEORGES-DE-LUZENCON
12;RUE DU MAS DE GUILLOU, SAINT-GEORGES-DE-LUZENCON
12;CHE DE MAYRES, SAINT-GEORGES-DE-LUZENCON
12;RTE DE MAYRES, SAINT-GEORGES-DE-LUZENCON
12;RUE DE MENASCLE, SAINT-GEORGES-DE-LUZENCON
12;CHE DES MINES, SAINT-GEORGES-DE-LUZENCON
12;CHE DU MOULIN, SAINT-GEORGES-DE-LUZENCON
12;RUE DU MOULIN ST GENIEZ, SAINT-GEORGES-DE-LUZENCON
12;RUE DU MOULIN DES AIRES, SAINT-GEORGES-DE-LUZENCON
12;RUE DU MOULIN DE TALY, SAINT-GEORGES-DE-LUZENCON
12;RUE DES PALIERES, SAINT-GEORGES-DE-LUZENCON
12;VC LA PLACETTE, SAINT-GEORGES-DE-LUZENCON
12;CHEM DES PLANTADES, SAINT-GEORGES-DE-LUZENCON
12;RUE DES POTIERS, SAINT-GEORGES-DE-LUZENCON
12;RUE DU POURTALOU, SAINT-GEORGES-DE-LUZENCON
12;AV DES PRES DE VABRES, SAINT-GEORGES-DE-LUZENCON
12;IMP DU PUECH, SAINT-GEORGES-DE-LUZENCON
12;RUE DES REYLLOUS, SAINT-GEORGES-DE-LUZENCON
12;PLE DU REYLLOU, SAINT-GEORGES-DE-LUZENCON
12;CHE DES RIVIERES, SAINT-GEORGES-DE-LUZENCON
12;RUE DE ROQUE LONGUE, SAINT-GEORGES-DE-LUZENCON
12;PL DU ROUCAN, SAINT-GEORGES-DE-LUZENCON
12;RTE DE ST ROME DE CERNON, SAINT-GEORGES-DE-LUZENCON
12;RUE DU SOLEIROL, SAINT-GEORGES-DE-LUZENCON
12;PL DU SOLEIROL, SAINT-GEORGES-DE-LUZENCON
12;RUE DES TEMPLIERS, SAINT-GEORGES-DE-LUZENCON
12;RTE DE ST GEORGES, SAINT-GEORGES-DE-LUZENCON
12;IMP DU SURLOULOC, SAINT-GEORGES-DE-LUZENCON
12;RUE DE TERREFORT, SAINT-GEORGES-DE-LUZENCON
12;IMP DU TERROIR DE VERE, SAINT-GEORGES-DE-LUZENCON
12;RUE DE LA TOUR DE JACQUES, SAINT-GEORGES-DE-LUZENCON
12;PL DU TRESCOL, SAINT-GEORGES-DE-LUZENCON
12;AV DU VIADUC, SAINT-GEORGES-DE-LUZENCON
12;CHE DES VIGNES, SAINT-GEORGES-DE-LUZENCON
12;LOT LE MARQUIZAT, SAINT-HIPPOLYTE
12;LOT LA PLANQUE, SAINT-IZAIRE
12;RTE DE SAINT AFFRIQUE, SAINT-IZAIRE
12;PTTE D'AVIGNON, SAINT-IZAIRE
12;PL DE LA BASCULE, SAINT-IZAIRE
12;RUE BASSE, SAINT-IZAIRE
12;RUE BASSE FAVEYROLLES, SAINT-IZAIRE
12;RUE BOMBE CUL, SAINT-IZAIRE
12;RUE LA CALADE, SAINT-IZAIRE
12;RUE DU CHATEAU, SAINT-IZAIRE
12;CHE DU COLOMBIER, SAINT-IZAIRE
12;CHE NOTRE DAME DE GRACE, SAINT-IZAIRE
12;RUE DROITE, SAINT-IZAIRE
12;RUE DROITE FAVEYROLLES, SAINT-IZAIRE
12;PL DE L'ECOLE FAVEYROLLES, SAINT-IZAIRE
12;RUE DE L'ECOLE, SAINT-IZAIRE
12;IMP DE L'EGLISE FAVEYROLLES, SAINT-IZAIRE
12;PL DE L'EGLISE, SAINT-IZAIRE
12;RUE DE L'EGLISE FAVEYROLLES, SAINT-IZAIRE
12;RTE DE FAVEYROLLES, SAINT-IZAIRE
12;RUE LO BARRI DE LA FONT, SAINT-IZAIRE
12;RUE DES FOSSES, SAINT-IZAIRE
12;RUE DU FOYER FAVEYROLLES, SAINT-IZAIRE
12;RTE DU GOS FAVEYROLLES, SAINT-IZAIRE
12;RUE DU LAVOIR, SAINT-IZAIRE
12;RUE DU LAVOIR FAVEYROLLES, SAINT-IZAIRE
12;PL DU MONUMENT AUX MORTS, SAINT-IZAIRE
12;RUE DU MOULIN, SAINT-IZAIRE
12;RUE PAVE, SAINT-IZAIRE
12;RUE DU PONT, SAINT-IZAIRE
12;IMP DU BARRY, SAINT-JEAN-D ALCAPIES
12;RUE DE L'EGLISE, SAINT-JEAN-D ALCAPIES
12;IMP DU FERRADOU, SAINT-JEAN-D ALCAPIES
12;RUE JEAN MOULIN, SAINT-JEAN-D ALCAPIES
12;RUE JOSEPH MAZEL, SAINT-JEAN-D ALCAPIES
12;CHE DU MAS DE COUCUT, SAINT-JEAN-D ALCAPIES
12;PL LA PLACETTE, SAINT-JEAN-D ALCAPIES
12;PL DE LA RHODE, SAINT-JEAN-D ALCAPIES
12;LOT LE PRAT, SAINT-JEAN-DELNOUS
12;CHE DE LA CLAUZE, SAINT-JEAN-DELNOUS
12;RUE DU COUVENT, SAINT-JEAN-DELNOUS
12;RUE DE L EGLISE, SAINT-JEAN-DELNOUS
12;PL DE L EGLISE, SAINT-JEAN-DELNOUS
12;RUE DU FOURNIL, SAINT-JEAN-DELNOUS
12;RTE DE FRAYSSINET, SAINT-JEAN-DELNOUS
12;RUE DE LA GREZE, SAINT-JEAN-DELNOUS
12;RUE DE LA GREZE HAUTE, SAINT-JEAN-DELNOUS
12;PL DE LA MAIRIE, SAINT-JEAN-DELNOUS
12;PL ST JEAN, SAINT-JEAN-DELNOUS
12;PL SALLE DES FETES, SAINT-JEAN-DELNOUS
12;AV DU SEGALA, SAINT-JEAN-DELNOUS
12;RTE DU STADE, SAINT-JEAN-DELNOUS
12;CHE DU TENNIS, SAINT-JEAN-DELNOUS
12;PL DU TILLEUL, SAINT-JEAN-DELNOUS
12;LOT LA BORIE, SAINT-JEAN-DU-BRUEL
12;LOT LE CLOS DES VIGNALS, SAINT-JEAN-DU-BRUEL
12;LOT LES HAUTS DU COUSTEL, SAINT-JEAN-DU-BRUEL
12;LOT LA PARAU, SAINT-JEAN-DU-BRUEL
12;LOT PAS DU CAYLA, SAINT-JEAN-DU-BRUEL
12;LOT DE ROQUEBRUNE, SAINT-JEAN-DU-BRUEL
12;PL ALBIN LEMASSON, SAINT-JEAN-DU-BRUEL
12;PL DE L AIRE, SAINT-JEAN-DU-BRUEL
12;RUE DE L AIRE, SAINT-JEAN-DU-BRUEL
12;RUE D ALGUES, SAINT-JEAN-DU-BRUEL
12;PL DE LA BORIE, SAINT-JEAN-DU-BRUEL
12;CHE DE BRANTE, SAINT-JEAN-DU-BRUEL
12;CHE DE LA CABRUNE, SAINT-JEAN-DU-BRUEL
12;RUE DE LA CABRUNE, SAINT-JEAN-DU-BRUEL
12;RUE DU CACAO, SAINT-JEAN-DU-BRUEL
12;CHE DES CARBONIALS, SAINT-JEAN-DU-BRUEL
12;RUE DES CARBONIALS, SAINT-JEAN-DU-BRUEL
12;RUE DE LA COUTELLERIE, SAINT-JEAN-DU-BRUEL
