12;QUA DE L ABBAYE, AGEN-D AVEYRON
12;ZA CAYLUS II, AGEN-D AVEYRON
12;LOT LA CHATAIGNERAIE, AGEN-D AVEYRON
12;LOT LE CLOS DU MOULIN, AGEN-D AVEYRON
12;LOT LES GARENNES, AGEN-D AVEYRON
12;LOT L HORIZON 1, AGEN-D AVEYRON
12;LOT L HORIZON 2, AGEN-D AVEYRON
12;LOT LAYSSARELLE, AGEN-D AVEYRON
12;SEN DE L ABBAYE, AGEN-D AVEYRON
12;CHE DES BARENAS, AGEN-D AVEYRON
12;IMP BIOULAGUET, AGEN-D AVEYRON
12;RUE JEAN BOUDOU, AGEN-D AVEYRON
12;RTE DE BOULZAC, AGEN-D AVEYRON
12;CHE DU BOUYSSOU, AGEN-D AVEYRON
12;CHE DU BRUELH, AGEN-D AVEYRON
12;PL DE L'EGLISE, AGEN-D AVEYRON
12;IMP EMMA CALVE, AGEN-D AVEYRON
12;CHE DE CAMPAN, AGEN-D AVEYRON
12;CHE DE CANTASERP, AGEN-D AVEYRON
12;PL DU FREZENQ, AGEN-D AVEYRON
12;IMP DU CANTOU, AGEN-D AVEYRON
12;RUE DU C.E.F.I., AGEN-D AVEYRON
12;CHE DE LA COMBE, AGEN-D AVEYRON
12;CHE DES COMBES, AGEN-D AVEYRON
12;PL DE LA CROUX, AGEN-D AVEYRON
12;PL PIERRE CUSSAC, AGEN-D AVEYRON
12;CHE DE L ENGRANA, AGEN-D AVEYRON
12;PL DE LA FONTAINE, AGEN-D AVEYRON
12;RUE DU FREZENQ, AGEN-D AVEYRON
12;CHE DES GARRIGUES, AGEN-D AVEYRON
12;CHE DU JONCAS, AGEN-D AVEYRON
12;RUE MAL ALPHONSE JUIN, AGEN-D AVEYRON
12;CHE DES LIGNES, AGEN-D AVEYRON
12;CHE DE LA LOUBIERE, AGEN-D AVEYRON
12;PL DU 19 MARS 1962, AGEN-D AVEYRON
12;RUE DE LA MILHAU, AGEN-D AVEYRON
12;IMP FREDERIC MISTRAL, AGEN-D AVEYRON
12;CHE DE LA PARRO, AGEN-D AVEYRON
12;CHE DU PESQUIER, AGEN-D AVEYRON
12;RUE DE LA PRADELIE, AGEN-D AVEYRON
12;CHE DES PRADELS, AGEN-D AVEYRON
12;IMP DAUDE DE PRADES, AGEN-D AVEYRON
12;IMP GUILLAUME RAYNAL, AGEN-D AVEYRON
12;PL MARC ROBERT, AGEN-D AVEYRON
12;CHE DU ROC, AGEN-D AVEYRON
12;RTE DE SEGUR, AGEN-D AVEYRON
12;PL CITOYENNE SORGUE, AGEN-D AVEYRON
12;CHE DE LA ROQUE, AGEN-D AVEYRON
12;CHE DU TELH, AGEN-D AVEYRON
12;PL DU TELH, AGEN-D AVEYRON
12;CHE DES TERMES, AGEN-D AVEYRON
12;CHE PIERRE VERNHET, AGEN-D AVEYRON
12;IMP ADRIEN VEZINHET, AGEN-D AVEYRON
12;CHEM DES BARTABELLES, AGEN-D AVEYRON
12;CHEM CHEMIN DE LA CARRAL, AGEN-D AVEYRON
12;CHEM CHEMIN DE LA CASCADE, AGEN-D AVEYRON
12;CHEM CHEMIN DU CAUSSE, AGEN-D AVEYRON
12;CHEM CHEMIN DE LA CAVE, AGEN-D AVEYRON
12;CHEM CHEMIN DE LA FONTAINE, AGEN-D AVEYRON
12;CHEM CHEMIN DE LOUYNES, AGEN-D AVEYRON
12;CHEM CHEMIN DES PLAINES, AGEN-D AVEYRON
12;CHEM CHEMIN DU PLO, AGEN-D AVEYRON
12;CHEM CHEMIN DU PUECH, AGEN-D AVEYRON
12;CHEM CHEMIN DU ROC DE LA MILHAU, AGEN-D AVEYRON
12;CHEM CHEMIN DE SAINT ROC, AGEN-D AVEYRON
12;CHEM CHEMIN DE LA TYROLE, AGEN-D AVEYRON
12;IMP IMPASSE DU BOUYSSOU, AGEN-D AVEYRON
12;IMP IMPASSE DE LA CASCADE, AGEN-D AVEYRON
12;IMP IMPASSE DES CLAUZADES, AGEN-D AVEYRON
12;IMP IMPASSE DE LA CROUX, AGEN-D AVEYRON
12;IMP IMPASSE DES LIGNES, AGEN-D AVEYRON
12;IMP IMPASSE DES PALANGES, AGEN-D AVEYRON
12;IMP IMPASSE DE LA PARRO, AGEN-D AVEYRON
12;IMP IMPASSE DU ROC, AGEN-D AVEYRON
12;PLE PLACE DU 19 MARS 1962, AGEN-D AVEYRON
12;RUE RUE DE L'HORIZON, AGEN-D AVEYRON
12;RTE ROUTE D'AGEN, AGEN-D AVEYRON
12;RUE RUE DE LA CHATAIGNERAIE, AGEN-D AVEYRON
12;RUE RUE LE CLOS DU MOULIN, AGEN-D AVEYRON
12;RUE RUELLE DU FOUR, AGEN-D AVEYRON
12;RUE RUE DES LIGNES, AGEN-D AVEYRON
12;IMP DU CRES, AGEN-D AVEYRON
12;IMP DE LA BARAQUE BASSE, AGEN-D AVEYRON
12;CHEM DE MOUMBERTE, AGEN-D AVEYRON
12;CHEM DES PALANGES, AGEN-D AVEYRON
12;IMP DU MOULIN, AGEN-D AVEYRON
12;IMP LA PRADE, AGEN-D AVEYRON
12;RUE LE PAVE, AGEN-D AVEYRON
12;RUE DES ACACIAS, AGUESSAC
12;RUE DES AGRAVETTES, AGUESSAC
12;RUE DE L'ANCIENNE MAIRIE, AGUESSAC
12;RUE DES BALCONS, AGUESSAC
12;PL BASSE, AGUESSAC
12;IMP BELLEVUE, AGUESSAC
12;RUE DE BEZERIC, AGUESSAC
12;RUE DE LA BREZEGUE, AGUESSAC
12;RUE DU BOSQUET, AGUESSAC
12;RUE DE LA CALADE, AGUESSAC
12;RUE DES CAPOUNES, AGUESSAC
12;TRA DES CAPOUNES, AGUESSAC
12;AV DES CAUSSES, AGUESSAC
12;RUE DES CARLINES, AGUESSAC
12;RUE DES CHENES, AGUESSAC
12;IMP DU CLAPAS, AGUESSAC
12;RUE DES CLAPAS, AGUESSAC
12;RUE DU COLOMBIER, AGUESSAC
12;IMP DU COLOMBIER, AGUESSAC
12;RUE DES ECOLES, AGUESSAC
12;TRA DES ECOLES, AGUESSAC
12;RUE DE L EGLISE, AGUESSAC
12;RUE DU FLANGUIER, AGUESSAC
12;PL DU FOIRAIL, AGUESSAC
12;TRA DE FONLIANE, AGUESSAC
12;PL DE LA FONTAINE, AGUESSAC
12;RUE DE LA FONTAINE, AGUESSAC
12;PL DU FOUR, AGUESSAC
12;RTE DE LA GARE, AGUESSAC
12;RUE DE LA GARE, AGUESSAC
12;RUE DE LA GLYCINE, AGUESSAC
12;RUE DES GLYCINES, AGUESSAC
12;RTE DES GORGES DU TARN, AGUESSAC
12;RUE DES JARDINS, AGUESSAC
12;TRA DES JARDINS, AGUESSAC
12;RUE DE LESTRADE, AGUESSAC
12;RUE DES LIQUIERES, AGUESSAC
12;PL DE LA MAIRIE, AGUESSAC
12;RUE DU CAMPING, AGUESSAC
12;RTE DE MILLAU, AGUESSAC
12;RUE DU MONUMENT, AGUESSAC
12;PL DU MURIER, AGUESSAC
12;PL DE L ORMEAU, AGUESSAC
12;RUE DU PARC, AGUESSAC
12;RUE DE LA PLUME, AGUESSAC
12;RUE DU PORCHE, AGUESSAC
12;CHE DES PRADES, AGUESSAC
12;RUE DU PUECH D'ANDAN, AGUESSAC
12;N RTE NATIONALE 9, AGUESSAC
12;IMP DES QUATRE VENTS, AGUESSAC
12;RUE DES QUATRE VENTS, AGUESSAC
12;TRA DES QUATRE VENTS, AGUESSAC
12;IMP DU SOLEIL LEVANT, AGUESSAC
12;RUE DU SOLEIL LEVANT, AGUESSAC
12;RTE DE ST GERMAIN, AGUESSAC
12;RUE DE LA TANNERIE, AGUESSAC
12;QUAI DU TARN, AGUESSAC
12;RUE DU TARN, AGUESSAC
12;CHE DE LA TREILLE, AGUESSAC
12;RUE DE LA TREILLE, AGUESSAC
12;IMP VALAT GRAND, AGUESSAC
12;RUE DU VALAT PETIT, AGUESSAC
12;RUE DU VALET, AGUESSAC
12;RUE DU VALET ROSIERS, AGUESSAC
12;RUE DU VIADUC, AGUESSAC
12;RUE DES VILLAS, AGUESSAC
12;RUE DES VOLTE HAUTE, AGUESSAC
12;LOT A FLOTTES, LES ALBRES
12;PL CENTRES, ALMONT-LES-JUNIES
12;RTE DE LA MICALIE, ALMONT-LES-JUNIES
12;CITE EDF D'ALRANCE, ALRANCE
12;LOT LES GRANDS CHENES, ALRANCE
12;RTE DES ECOLES, ALRANCE
12;RTE DE L ALZOU, ANGLARS-SAINT-FELIX
12;RTE DE LA BADOQUE, ANGLARS-SAINT-FELIX
12;RUE DU BARRY, ANGLARS-SAINT-FELIX
12;RTE BARTHES, ANGLARS-SAINT-FELIX
12;IMP DU BOIS, ANGLARS-SAINT-FELIX
12;RTE DE LA BONAURIE, ANGLARS-SAINT-FELIX
12;CHE DES BOSQUETS, ANGLARS-SAINT-FELIX
12;CHEM DES CABANES, ANGLARS-SAINT-FELIX
12;RTE DES CALAZOUS, ANGLARS-SAINT-FELIX
12;CHE DE LA CARRIERE, ANGLARS-SAINT-FELIX
12;IMP DU CHENE, ANGLARS-SAINT-FELIX
12;RUE DU COUDERC, ANGLARS-SAINT-FELIX
12;IMP DES CYPRES, ANGLARS-SAINT-FELIX
12;RTE DE LA DRAYE, ANGLARS-SAINT-FELIX
12;RTE DES ECOLIERS, ANGLARS-SAINT-FELIX
12;CHE DE L ETANG, ANGLARS-SAINT-FELIX
12;CHEM DU FOUR A CHAUX, ANGLARS-SAINT-FELIX
12;IMP DU FOUR A PAIN, ANGLARS-SAINT-FELIX
12;RUE DU FRENE, ANGLARS-SAINT-FELIX
12;RUE DES HORTENSIAS, ANGLARS-SAINT-FELIX
12;IMP DU JARDIN, ANGLARS-SAINT-FELIX
12;IMP DU LAVOIR, ANGLARS-SAINT-FELIX
12;IMP DES LILAS, ANGLARS-SAINT-FELIX
12;RUE DE LA MAIRIE, ANGLARS-SAINT-FELIX
12;RUE DU MARECHAL FERRAND, ANGLARS-SAINT-FELIX
12;RUE DU MENUISIER, ANGLARS-SAINT-FELIX
12;RTE MOULIN DE JANTOU, ANGLARS-SAINT-FELIX
12;IMP DU PARC, ANGLARS-SAINT-FELIX
12;RTE DU PARC, ANGLARS-SAINT-FELIX
12;IMP DU PESQUIE, ANGLARS-SAINT-FELIX
12;RTE DE LA PEYRADE, ANGLARS-SAINT-FELIX
12;IMP DES POMMIERS, ANGLARS-SAINT-FELIX
12;RTE DU PONT DE LA MONNAIE, ANGLARS-SAINT-FELIX
12;IMP DES PRADES, ANGLARS-SAINT-FELIX
12;RUE DES PROMENEURS, ANGLARS-SAINT-FELIX
12;IMP DU PUECH, ANGLARS-SAINT-FELIX
12;RTE DU PUITS, ANGLARS-SAINT-FELIX
12;RTE DES RAMIERS, ANGLARS-SAINT-FELIX
12;RTE DE REVEL, ANGLARS-SAINT-FELIX
12;RTE DE RIGNAC, ANGLARS-SAINT-FELIX
12;RTE DES ROUGIERS, ANGLARS-SAINT-FELIX
12;RTE DE ROUSSENAC, ANGLARS-SAINT-FELIX
12;RUE DU SABOTIER, ANGLARS-SAINT-FELIX
12;PL SAINT CLAIR, ANGLARS-SAINT-FELIX
12;RTE DE SAINT PIERRE, ANGLARS-SAINT-FELIX
12;CHE DES SAPINS, ANGLARS-SAINT-FELIX
12;CHE DES VIGNES, ANGLARS-SAINT-FELIX
12;SEN DES VIGNES, ANGLARS-SAINT-FELIX
12;LOT DU BOSC, ARQUES
12;LOT LA PORRO, ARQUES
12;LOT LE CLOS, ARVIEU
12;LOT LA SOURCE, ARVIEU
12;PL DE L EGLISE, ARVIEU
12;CITE PARELOUP, ARVIEU
12;RTE CANET PARELOUP, ARVIEU
12;RTE NOTRE DAME D AURES, ARVIEU
12;RTE SALLES CURAN, ARVIEU
12;RTE DU CENTRE, ARVIEU
12;PL DU CENTRE, ARVIEU
12;RTE DE RODEZ, ARVIEU
12;RTE D'AURIFEUILLE, ARVIEU
12;RTE DE BONNEVIALE, ARVIEU
12;AV DES ANCIENS COMBATTANTS, ARVIEU
12;RTE D ARVIEU, ARVIEU
12;RUE DES BLEUETS, ARVIEU
12;IMP DES BROCHETS, ARVIEU
12;IMP DES CARPES, ARVIEU
12;RUE DES CARTABLES, ARVIEU
12;RUE DU CENTRE, ARVIEU
12;RUE DU COLOMBIER, ARVIEU
12;RUE DES CORDONNIERS, ARVIEU
12;RTE DE LA CREYSSIE, ARVIEU
12;CHE DE L ETANG, ARVIEU
12;RUE DE LA FORGE, ARVIEU
12;RTE DES FOULETIES, ARVIEU
12;RUE DES GARDONS, ARVIEU
12;RUE DES GENETS, ARVIEU
12;IMP DES IRIS, ARVIEU
12;RUE DES LAVANDIERES, ARVIEU
12;IMP DES LAVANDES, ARVIEU
12;PL DU MARCHE, ARVIEU
12;RTE DE MONTFRANC, ARVIEU
12;IMP DES NARCISSES, ARVIEU
12;AV DE PARELOUP, ARVIEU
12;IMP DES PERCHES, ARVIEU
12;CHE DE LA PLAGE, ARVIEU
12;AV DE LA POSTE, ARVIEU
12;RUE DU PRADEL, ARVIEU
12;RTE DE LA RIVIERE, ARVIEU
12;IMP DES ROSIERS, ARVIEU
12;RTE DE LA RETENUE, ARVIEU
12;IMP DES SANDRES, ARVIEU
12;CHE DE SANTA FE, ARVIEU
12;IMP DES TULIPES, ARVIEU
12;MAIS DE RETRAITE BEL AIR, ASPRIERES
12;LOT DES QUATRE ROUTES, ASPRIERES
12;RUE BELLE VUE, ASPRIERES
12;CHE DES BRUYERES, ASPRIERES
12;CHE DE LA CANAGUE, ASPRIERES
12;AV DES CAUSSES, ASPRIERES
12;PL DU CAZAL, ASPRIERES
12;RUE DU CENTRE, ASPRIERES
12;CHE DU CUZOUL, ASPRIERES
12;PL DE L'EGLISE, ASPRIERES
12;RUE DU FAUBOURG BAS, ASPRIERES
12;AV DU LOT, ASPRIERES
12;RUE DU MIDI, ASPRIERES
12;PL DE LA PORTE HAUTE, ASPRIERES
12;AV DU QUERCY, ASPRIERES
12;AV DE RODEZ, ASPRIERES
12;RUE DU ROUERGUE, ASPRIERES
12;RUE SADI CARNOT, ASPRIERES
12;CHE DE TARTABELLE, ASPRIERES
12;RES BEAUREGARD, AUBIN
12;RES BEAUSEJOUR, AUBIN
12;CITE DES CHATAIGNIERS, AUBIN
12;CITE DE LA CHENERAIE, AUBIN
12;CITE DELAURE, AUBIN
12;RES DES EGLANTINES, AUBIN
12;CITE DES FEUILLANTINES, AUBIN
12;RES LES JARDINS D'ALBIN, AUBIN
12;PARC DE LUNELLE, AUBIN
12;CITE NOUVELLE, AUBIN
12;ZI DU PLEGAT, AUBIN
12;LOT PONS, AUBIN
12;LOT DU PONT DE LABRO, AUBIN
12;CITE PUITS L ECLAIR, AUBIN
12;CITE DE RUAU, AUBIN
12;RES DES TULIPES, AUBIN
12;CR D AUBIN A LA FAGE, AUBIN
12;RUIS POANNES, AUBIN
12;VC 17, AUBIN
12;RUIS DE L ENNE, AUBIN
12;VC 2 D AUBIN A FIRMI, AUBIN
12;CD 221 DE DECAZEVILLE A AUBIN, AUBIN
12;CR DU FAU A SEVERAC, AUBIN
12;CR DIT DE SEVERAC, AUBIN
12;CR DIT DE PUECHMEJA, AUBIN
12;CHE DE FER DE RODEZ CAPDENAC, AUBIN
12;CD 5, AUBIN
12;CR DE LA PLANQUETTE, AUBIN
12;CHE DU VIADUC AUX COURTINES, AUBIN
12;CHE DE COURTINES AU BAC, AUBIN
12;VC 3 D AUBIN A GALGAN, AUBIN
12;CR D AUBIN AU CAMMAS, AUBIN
12;CHE CROIX DE LA LANDE BATTUT, AUBIN
12;CR DIT DE LA PEYRADE, AUBIN
12;RUIS LE BANEL, AUBIN
12;CD 513 DE VIVIEZ A FIRMI, AUBIN
12;CHE D'EXPLOITATION HOUILLERES, AUBIN
12;CR DIT DU BOIS NOIR, AUBIN
12;VC 11 DU MOULINOU AU GUA, AUBIN
12;CHE DIT DU BOIS DE LA FAYSSE, AUBIN
12;VC 15 DE COMBES A LA VALSEYRI, AUBIN
12;CR DE COMBES A PEYROLLES, AUBIN
12;CHE DU MOULINOU AUX ESCABRINS, AUBIN
12;CHE DU CIMETIERE DU GUA MONTET, AUBIN
12;VC 17 DE LABRO A LAVERNHE, AUBIN
12;CHE DIT DES BARAQUES DELAURE, AUBIN
12;VC 26 DU GUA AU BAC, AUBIN
12;CHE DIT DU RELAIS TELEVISION, AUBIN
12;CHE DUC AUX BARAQUES DELAURE, AUBIN
12;CR DE DUC AU PUECH SEC, AUBIN
12;CHE PLANCONIE A TRAMONT BAST, AUBIN
12;N 140 DE CAHORS A RODEZ, AUBIN
12;CHE COTE RUAU AU PUECH DE VOLF, AUBIN
12;VC DES ESCABRINS A TRAMONT BA, AUBIN
12;CHE DE TRAMONT BAS AU PLEGAT, AUBIN
12;CR DIT DE RUAU, AUBIN
12;CR DIT DES VIGNES, AUBIN
12;CHE BUSCALIE HAUTE A RUAU, AUBIN
12;CHE DE ST MICHEL A LA SEDALIE, AUBIN
12;RUIS DE ST MICHEL, AUBIN
12;CHE SEDALIE A TRAMONT HAUT, AUBIN
12;CHE TRAMONT BAS A TRAMONT, AUBIN
12;CHE DE LA FOREZIE BASSE, AUBIN
12;CHE DE LA GOUZINIE A FIRMI, AUBIN
12;CHE DE LA GOUZINIE AU BAC, AUBIN
12;RUE ALPHONSE DAUDET, AUBIN
12;RUE DES ACIERIES, AUBIN
12;RUE ALBERT MAURS, AUBIN
12;RUE ACIERIES LES CANTINES, AUBIN
12;RUE ACIERIES CTE NOUVELLE, AUBIN
12;RUE ALARY, AUBIN
12;RUE DES ANCIENNES FORGES, AUBIN
12;COTE DES AUBEPINES, AUBIN
12;RUE ANDRE CLOT, AUBIN
12;PL ANDRE JARLAN, AUBIN
12;AV ANTOINE DE SAINT-EXUPERY, AUBIN
12;RUE BESSIERE, AUBIN
12;RUE DES BLEUETS, AUBIN
12;RUE DU BOMBAREL, AUBIN
12;RTE DU BOIS NOIR, AUBIN
12;IMP DES BOUTONS D OR, AUBIN
12;RUE BRASSAT, AUBIN
12;RUE DES BRUYERES, AUBIN
12;RUE DE LA BUENNE COMBES, AUBIN
12;CITE DE LA BUSCALIE, AUBIN
12;RUE DE LA CAISSE DE SECOURS, AUBIN
12;CHE DE CANTARANNE, AUBIN
12;RUE DE LA CASTILLE, AUBIN
12;AV CHATEAUBRIAND, AUBIN
12;RUE DES CHENES, AUBIN
12;RUE DES CLAIES, AUBIN
12;RUE CLAUDE MONET, AUBIN
12;RUE DU COLONEL FABIEN, AUBIN
12;VOIE DES COQUELICOTS, AUBIN
12;COTE DE SAUREL, AUBIN
12;RUE DELSHENS, AUBIN
12;RUE DU 19 MARS 1962, AUBIN
12;AV EDMOND GINESTET, AUBIN
12;RUE EDOUARD VAILLANT, AUBIN
12;RUE D'ENTRAYGUETTE, AUBIN
12;RUE ETIENNE DOLET, AUBIN
12;RUE DES FLEURS, AUBIN
12;RUE FONDIEU, AUBIN
12;CHE DE FORCEFAVE, AUBIN
12;AV FRANCOIS COGNE, AUBIN
12;RUE FREDERIC MISTRAL, AUBIN
12;PL DE LA GARE, AUBIN
12;IMP DES GENETS, AUBIN
12;CHE GEORGE SAND, AUBIN
12;PLAN GEORGES BRASSENS, AUBIN
12;PL GEORGES MARTY, AUBIN
12;RUE HENRI BARBUSSE, AUBIN
12;RUE HENRI MATISSE, AUBIN
12;VC DES IRIS, AUBIN
12;IMP JACQUES PREVERT, AUBIN
12;RUE JEAN JACQUES ROUSSEAU, AUBIN
12;RUE JEAN COCTEAU, AUBIN
12;PL JEAN JAURES, AUBIN
12;RUE JEAN JAURES, AUBIN
12;CAE JEAN MARAIS, AUBIN
12;RUE JEAN MERMOZ, AUBIN
12;RUE JEAN MOULIN, AUBIN
12;RUE JEANNE SEPTFONDS, AUBIN
12;SQ JEAN SEGALAT, AUBIN
12;AV JULES CABROL, AUBIN
12;RUE JULES FERRY, AUBIN
12;RUE JULES GUESDE, AUBIN
12;RUE JULES VERNE, AUBIN
12;RUE LABRO, AUBIN
12;RTE DU LAC, AUBIN
12;RUE LAMOURIEZ, AUBIN
12;AV LAURENS, AUBIN
12;CAR DES LILAS, AUBIN
12;RUE LOUIS BLERIOT, AUBIN
12;RUE DE LUNELLE, AUBIN
12;AV DU LYCEE, AUBIN
12;RUE M PLEINECASSAGNE, AUBIN
12;PL MARCEL PAGNOL, AUBIN
12;AV MARIE CURIE, AUBIN
12;COTE DES MARGUERITES, AUBIN
12;ALL DES MARJOLAINES, AUBIN
12;PL MARUEJOULS, AUBIN
12;RUE DU MAS, AUBIN
12;PL MONTEILS, AUBIN
12;AV DU MONTET, AUBIN
12;RUE MURAT, AUBIN
12;ALL DU MUSEE, AUBIN
12;AV DU MYOSOTIS, AUBIN
12;RUE NEUVE, AUBIN
12;RUE PAUL CEZANNE, AUBIN
12;CHE PAUL GAUGUIN, AUBIN
12;RUE PAUL LAFARGUE, AUBIN
12;AV P VAILLANT COUTURIER, AUBIN
12;CLOS PAUL VALERY, AUBIN
12;BRE DE PERIE, AUBIN
12;AV DES PERVENCHES, AUBIN
12;RUE PIERRE DE COUBERTIN, AUBIN
12;RTE DE LA PISCINE, AUBIN
12;CHE DE LA PLANQUETTE, AUBIN
12;RUE DU POANNES, AUBIN
12;COTE DE LA POUDRIERE, AUBIN
12;IMP DES PRES, AUBIN
12;CHE DU PUECH GUILLET, AUBIN
12;RUE DU QUATORZE JUILLET, AUBIN
12;RUE DU QUATRE SEPTEMBRE, AUBIN
12;RUE RAYMOND D ALBIN, AUBIN
12;PL RAYMOND DU SOULIE, AUBIN
12;PL DE LA REPUBLIQUE, AUBIN
12;COTE DE LA REVELLE, AUBIN
12;RTE DE LA REVELLE, AUBIN
12;RUE ROBERT EROLES, AUBIN
12;TRA DES ROSES, AUBIN
12;RTE DE NAUQUIERES, AUBIN
12;RTE DE VIVIEZ, AUBIN
12;AV SERGE MESONES, AUBIN
12;CITE DU TABARIN, AUBIN
12;RTE DE TRAMONT, AUBIN
12;AV TOULOUSE LAUTREC, AUBIN
12;TRA DE SAUGUIERES, AUBIN
12;RUE TRAVERSIERE, AUBIN
12;RTE DE LA VAYSSE, AUBIN
12;RUE DU VIEUX MARCHE, AUBIN
12;IMP DU VIGNIER, AUBIN
12;AV DES VIOLETTES, AUBIN
12;AV VOLTAIRE, AUBIN
12;COTE YVES MONTAND, AUBIN
12;PL DE L'ACACIA, AUZITS
12;RTE DE LA BOURELIE, AUZITS
12;RTE DE BURGAYRETTE, AUZITS
12;CHE DE LA CALSEYRIE, AUZITS
12;IMP LA CAREYRE, AUZITS
12;VOIE DU CHEMIN DE FER, AUZITS
12;IMP DU CLAUX, AUZITS
12;ALL DU COUSTAL, AUZITS
12;IMP DU COUSTAL BAS, AUZITS
12;IMP DU COUSTAL HAUT, AUZITS
12;IMP DE LA COSTE PEYRE MARTY, AUZITS
12;RTE DELA CROIX DU FROMENTAL, AUZITS
12;PL DE L EGLISE, AUZITS
12;RUE DE L EGLISE, AUZITS
12;PL DE FIJAGOLS, AUZITS
12;RUE DE HYMES, AUZITS
12;RLE DU FOUR BANAL, AUZITS
12;SEN DU LAVOIR, AUZITS
12;RTE DU LEVANT, AUZITS
12;ALL DE LA MERIDIENNE VERTE, AUZITS
12;RUE DU PAIN BLANC, AUZITS
12;CHE DES PALENQUIERES, AUZITS
12;CHE DES PARGADES, AUZITS
12;CHE DU PESQUIE, AUZITS
12;RTE DU PLATEAU D'HYMES, AUZITS
12;IMP DE LA PRADALIE, AUZITS
12;CHE DU PUECH DES BALS, AUZITS
12;IMP DE REYROLS, AUZITS
12;RTE DE RODEZ, AUZITS
12;ALL DE LA ROUZIERE, AUZITS
12;RUE SENTEUL, AUZITS
12;IMP DE LA SERRE, AUZITS
12;PAS DE LA SERVELIE, AUZITS
12;IMP TREMOLET, AUZITS
12;PL DE LA MAIRIE, BALAGUIER-D OLT
12;PL DE L'EGLISE, BALAGUIER-SUR-RANCE
12;RUE EMMA CALVE, LA BASTIDE PRADINES
12;HLM LE CLAPEYROL, BELMONT-SUR-RANCE
12;RES LES ROSIERS, BELMONT-SUR-RANCE
12;HLM LES TRAVERSOUS, BELMONT-SUR-RANCE
12;LOT LES FOURQUES, BELMONT-SUR-RANCE
12;RUE BASSE, BELMONT-SUR-RANCE
12;RUE BOMBECUL, BELMONT-SUR-RANCE
12;CHE DES CAMBOUS, BELMONT-SUR-RANCE
12;PL DU CEG, BELMONT-SUR-RANCE
12;RUE CENTRALE, BELMONT-SUR-RANCE
12;PL DU CHRIST, BELMONT-SUR-RANCE
12;CHE DU CIMETIERE, BELMONT-SUR-RANCE
12;RTE DE COMBRET, BELMONT-SUR-RANCE
12;RUE DE LA COUR, BELMONT-SUR-RANCE
12;RUE DES ECOLES, BELMONT-SUR-RANCE
12;PL DE L EGLISE, BELMONT-SUR-RANCE
12;RUE DE L EGLISE, BELMONT-SUR-RANCE
12;RUE DE FONT NEUVE, BELMONT-SUR-RANCE
12;RUE DE LA GENDARMERIE, BELMONT-SUR-RANCE
12;PL GEORGES MOULS, BELMONT-SUR-RANCE
12;RUE DE LABRO, BELMONT-SUR-RANCE
12;RTE DE LACAUNE, BELMONT-SUR-RANCE
12;PL DE LA MAIRIE, BELMONT-SUR-RANCE
12;PL DU MONUMENT AUX MORTS, BELMONT-SUR-RANCE
12;RTE DE MOUNES, BELMONT-SUR-RANCE
12;RUE DU PEYRAL, BELMONT-SUR-RANCE
12;VC LA PLACETTE, BELMONT-SUR-RANCE
12;RUE DU PONT VIEUX, BELMONT-SUR-RANCE
12;RUE DE LA POSTE, BELMONT-SUR-RANCE
12;RUE PRINCIPALE, BELMONT-SUR-RANCE
12;RUE DE LA RIVIERE, BELMONT-SUR-RANCE
12;RTE DE ST AFFRIQUE, BELMONT-SUR-RANCE
12;RUE DU TRIVALOUS, BELMONT-SUR-RANCE
12;LOT BEAUSEJOUR, BERTHOLENE
12;LOT DE LA GARE, BERTHOLENE
12;LOT GUIBERT, BERTHOLENE
12;LOT LE MOULIN, BERTHOLENE
12;LOT LA PETITE DEVEZE, BERTHOLENE
12;RTE LARQUET, BERTHOLENE
12;RTE LA MINE, BERTHOLENE
12;RUE DE LA FONTAINE, BERTHOLENE
12;PL FONTAINE, BERTHOLENE
12;RUE DU MOULIN, BERTHOLENE
12;RUE RTE DE LA GARE, BERTHOLENE
12;RTE DE RODEZ, BERTHOLENE
12;RTE D AYRINHAC, BERTHOLENE
12;RTE NATIONALE, BERTHOLENE
12;RUE DES CAMINADES, BERTHOLENE
12;RUE DU CHATEAU, BERTHOLENE
12;RUE DU COUVENT, BERTHOLENE
12;RUE DES ECOLES, BERTHOLENE
12;RTE D'ESPALION, BERTHOLENE
12;RUE LATIEULE, BERTHOLENE
12;RUE DU PARC, BERTHOLENE
12;RUE DES BREBIS, BERTHOLENE
12;CHE DU CALZIER, BERTHOLENE
12;IMP DES CAMINADES, BERTHOLENE
12;CHE DES ACACIAS, BERTHOLENE
12;RTE DE CANTALAC, BERTHOLENE
12;IMP DE LA CARRIERE, BERTHOLENE
12;CHE DU CARRALIAS, BERTHOLENE
12;RUE DE L'AUBRAC, BERTHOLENE
12;RUE CARRIERE LONGUE, BERTHOLENE
12;RTE DES CARRIES, BERTHOLENE
12;RUE DE L'AVEYRON, BERTHOLENE
12;IMP DU CORDONNIER, BERTHOLENE
12;RLE DES CEDRES, BERTHOLENE
12;RUE DES BABISSOUS, BERTHOLENE
12;IMP DU CHENAL, BERTHOLENE
12;IMP DES CHENES, BERTHOLENE
12;RUE BEAUSEJOUR, BERTHOLENE
12;CHE DES CIBADIERES, BERTHOLENE
12;PL DU COUVENT, BERTHOLENE
12;IMP BELLEVUE, BERTHOLENE
12;RLE DU CRES, BERTHOLENE
12;IMP DE LA COMBE, BERTHOLENE
12;RUE DE LA BOYRE, BERTHOLENE
12;IMP DU COTEAU, BERTHOLENE
12;IMP DU COUDERC, BERTHOLENE
12;RUE DES COULOUBRIERS, BERTHOLENE
12;PL DE LA COURAL, BERTHOLENE
12;IMP CAMINADE, BERTHOLENE
12;RUE CRES AL PRIOU, BERTHOLENE
12;IMP DES CARDABELLES, BERTHOLENE
12;RUE DES CARRIERES, BERTHOLENE
12;CHE DE CRIOULET, BERTHOLENE
12;RUE DES CHATAIGNIERS, BERTHOLENE
12;CHE DE LA CROIX ROUGE, BERTHOLENE
12;RUE DES CHENES, BERTHOLENE
12;IMP DE LA DEVEZE, BERTHOLENE
12;RUE DU CIMETIERE, BERTHOLENE
12;IMP DES ECOLES, BERTHOLENE
12;IMP DE LA CITE, BERTHOLENE
12;IMP DU CLOS DES VIGNES, BERTHOLENE
12;PL DE L'EGLISE AINT AMANS, BERTHOLENE
12;RUE DE LA CROUX, BERTHOLENE
12;CHE DE LA CROIX DU JUBILE, BERTHOLENE
12;PL DU 19 MARS 1962, BERTHOLENE
12;RUE DE L'EGLISE, BERTHOLENE
12;RUE DES ERABLES, BERTHOLENE
12;RUE DU FAJO, BERTHOLENE
12;RUE DES FLEURS, BERTHOLENE
12;RUE EGLISE SAINT JULIEN, BERTHOLENE
12;IMP DE L'ESPINASSE, BERTHOLENE
12;IMP DES FOURQUES, BERTHOLENE
12;IMP DU FOURNIOL, BERTHOLENE
12;RUE DES FOURQUES, BERTHOLENE
12;PASS DE L'EUROPE, BERTHOLENE
12;IMP DES FRENES, BERTHOLENE
12;RUE DE LA GARE, BERTHOLENE
12;PL DE LA GARE, BERTHOLENE
12;IMP DU FOUR, BERTHOLENE
12;RUE DE LA GARRIGUE, BERTHOLENE
12;CHE DES GAZELLES, BERTHOLENE
12;CHE DE LACAN, BERTHOLENE
12;RTE DE LAISSAC, BERTHOLENE
12;IMP LOU GOZET, BERTHOLENE
12;RUE DU MAS, BERTHOLENE
12;RTE DE GABRIAC, BERTHOLENE
12;RUE DU LAVOIR, BERTHOLENE
12;RUE DE LA MINE, BERTHOLENE
12;CHE DE LUGAGNAC, BERTHOLENE
12;CHE DE MALACROUP, BERTHOLENE
12;IMP MARTY, BERTHOLENE
12;IMP DU MAS, BERTHOLENE
12;RTE DE LESTRADE, BERTHOLENE
12;RTE DE MONTROZIER, BERTHOLENE
12;IMP DU MAZET, BERTHOLENE
12;CHE DU MAZUC, BERTHOLENE
12;RTE DE MIGAYROU, BERTHOLENE
12;IMP DE LA MINE, BERTHOLENE
12;RUE DES PALANGES, BERTHOLENE
12;CHE DE LAUTARD, BERTHOLENE
12;CHE DES MOINES, BERTHOLENE
12;CHE DE MONTFERRIER, BERTHOLENE
12;RTE DES MAYNOLS, BERTHOLENE
12;IMP DES PLOS, BERTHOLENE
12;IMP PEYRELEVADE, BERTHOLENE
12;CHE LOU PUECH, BERTHOLENE
12;RTE DE LA PLANQUE, BERTHOLENE
12;CHE DU PAS, BERTHOLENE
12;RUE DES PONTS, BERTHOLENE
12;IMP DES PENSEES, BERTHOLENE
12;RTE DE LA PEYRADE, BERTHOLENE
12;RUE DU PUECH PALAT, BERTHOLENE
12;IMP DE LA PORRO, BERTHOLENE
12;RUE DE LA RANDE, BERTHOLENE
12;PL DU PRESBYTERE, BERTHOLENE
12;AV DU ROUERGUE, BERTHOLENE
12;RUE DU STADE, BERTHOLENE
12;RLE DU PUECH, BERTHOLENE
12;CHE DES VIGNES, BERTHOLENE
12;CHE DU PUECH PALAT, BERTHOLENE
12;CHE DES RAJALS, BERTHOLENE
12;CHE DU RAT, BERTHOLENE
12;RUE DE LA VIGNETTE, BERTHOLENE
12;CHE DU ROC, BERTHOLENE
12;RTE DE REILHAC, BERTHOLENE
12;IMP DE ROUCAS, BERTHOLENE
12;CHE DU BARTAS, BERTHOLENE
12;RTE D'AUJOLS, BERTHOLENE
12;CHE DE LA SAFRANIERE, BERTHOLENE
12;PL SAINT MAURICE, BERTHOLENE
12;AV CLAUDE SALLES, BERTHOLENE
12;IMP DES SOUCHES, BERTHOLENE
12;IMP BOUCAIS, BERTHOLENE
12;CHE DE VIEIL BANC, BERTHOLENE
12;IMP DES ARTISANS, BERTHOLENE
12;CHE DU VIOLON, BERTHOLENE
12;CHE DE LA VIGNETTE, BERTHOLENE
12;CHE DES BOURINES, BERTHOLENE
12;IMP DE LA VIERGE, BERTHOLENE
12;IMP DE LA BOYRE, BERTHOLENE
12;CHE DU LAC DES BRUYERES, BERTHOLENE
12;CHE DU BAYSSAS, BERTHOLENE
12;RTE DE L'AVEYRON, BERTHOLENE
12;IMP DES BOURINES, BERTHOLENE
12;IMP DES CHATAIGNIERS, BERTHOLENE
12;CHEM DU TOURIOL, BERTHOLENE
12;CHEM PRAT LACAZE, BERTHOLENE
12;RTE DE SARDONNE, BERTHOLENE
12;LOT DE BOISSE, BOISSE-PENCHOT
12;LOT COMBY, BOISSE-PENCHOT
12;QUA DE LA GARE, BOISSE-PENCHOT
12;LOT LES PLACETTES, BOISSE-PENCHOT
12;LOT SAINT GEORGES, BOISSE-PENCHOT
12;RTE DE BEAUREGARD, BOISSE-PENCHOT
12;RTE DE BOISSE, BOISSE-PENCHOT
12;IMP IMPASSE DE BOISSE, BOISSE-PENCHOT
12;RTE DU CHATEAU, BOISSE-PENCHOT
12;IMP DU CHATEAU, BOISSE-PENCHOT
12;RUE DU CHATEAU BAS, BOISSE-PENCHOT
12;IMP BOUDET, BOISSE-PENCHOT
12;RUE DES DEUX PONTS, BOISSE-PENCHOT
12;CHEM DE L ECLUSE, BOISSE-PENCHOT
12;AV DE LA GARE, BOISSE-PENCHOT
12;RUE DE LA GUIRALDIE, BOISSE-PENCHOT
12;CHEM DE LA GUIRALDIE, BOISSE-PENCHOT
12;RUE DES JOUTES, BOISSE-PENCHOT
12;IMP DE MALAVAL, BOISSE-PENCHOT
12;RTE DE PLANCAT, BOISSE-PENCHOT
12;CHEM DES RIVES DU LOT, BOISSE-PENCHOT
12;IMP DE LA RIVIERE, BOISSE-PENCHOT
12;RUE DE RUAU BAS, BOISSE-PENCHOT
12;IMP LA SOLE, BOISSE-PENCHOT
12;LOT DE LA GARENNE, BOUILLAC
12;RUE DES ACACIAS, BOUILLAC
12;RUE BASSE, BOUILLAC
12;RUE DU CALVAIRE, BOUILLAC
12;AV DES CAMBOUS, BOUILLAC
12;RTE DE LA COLLINE, BOUILLAC
12;RUE DES CHATAIGNIERS, BOUILLAC
12;RTE DE CONQUETTES, BOUILLAC
12;RUE DU COUVENT, BOUILLAC
12;RUE DES CYPRES, BOUILLAC
12;PL DE L'EGLISE, BOUILLAC
12;RUE ETROITE, BOUILLAC
12;PL DE LA GARE, BOUILLAC
12;RUE DE LA GARENNE, BOUILLAC
12;RUE HAUTE, BOUILLAC
12;RUE DU LOT, BOUILLAC
12;IMP DE LA MAIRIE, BOUILLAC
12;RUE DE LA MAIRIE, BOUILLAC
12;RUE DU MOULIN, BOUILLAC
12;RUE DE LA POSTE, BOUILLAC
12;RUE DU POUJOL, BOUILLAC
12;CHE DES RIVES, BOUILLAC
12;IMP DES SAPINS, BOUILLAC
12;RUE DU STADE, BOUILLAC
12;IMP DU PORT HAUT, BOUILLAC
12;RUE DU PORT HAUT, BOUILLAC
12;RTE DE LA VIDALE, BOUILLAC
12;RUE DES CHARPENTIERS, BOUILLAC
12;LOT DES CAUSSES, BOURNAZEL
12;RTE DE CRANSAC, BOURNAZEL
12;RUE DE L'ECOLE, BOURNAZEL
12;RTE DE ROUSSENNAC, BOURNAZEL
12;RTE D'ANTAGNAGUES, BOURNAZEL
12;RTE DE BEZANES, BOURNAZEL
12;RTE DE BOUYSSES, BOURNAZEL
12;RTE DE CALDECOSTE, BOURNAZEL
12;RTE DE CARABOLS, BOURNAZEL
12;CHEM DE FONTANILLES, BOURNAZEL
12;PLA DE L'EGLISE ST SEBASTIEN, BOURNAZEL
12;CHEM DE L'ETANG, BOURNAZEL
12;RTE DE LA BESSIERE, BOURNAZEL
12;CHEM DE LA COMBE, BOURNAZEL
12;PLA DE LA CROIX, BOURNAZEL
12;IMP DE LA MAIRIE, BOURNAZEL
12;RUE DE LA VAYSSE, BOURNAZEL
12;RTE DE LA VINSINIE, BOURNAZEL
12;RTE DE RIGNAC, BOURNAZEL
12;IMP DE BOUYSSES, BOURNAZEL
12;RTE DE RULHE, BOURNAZEL
12;RTE DES ALARIS, BOURNAZEL
12;IMP DE LA VAYSSE, BOURNAZEL
12;RTE DES COUSTALS, BOURNAZEL
12;CHEM DES DAMES, BOURNAZEL
12;CHEM DES TRAPELLES, BOURNAZEL
12;CHEM DES VIGNES, BOURNAZEL
12;CHEM DU BOURGNOUNET, BOURNAZEL
12;CHEM DU CANTOU, BOURNAZEL
12;RUE DU BROUAL, BOURNAZEL
12;CHEM DU CAUSSANEL, BOURNAZEL
12;RUE DU CAYROU, BOURNAZEL
12;CHEM DU CHATEAU D'EAU, BOURNAZEL
12;RUE DU COLOMBIER, BOURNAZEL
12;RTE DU FAU, BOURNAZEL
12;PLA DU FOIRAIL, BOURNAZEL
12;CHEM DU GARRIGUET, BOURNAZEL
12;RTE DU GARRIC, BOURNAZEL
12;PLA DU MENUISIER, BOURNAZEL
12;CHEM DU PERIER, BOURNAZEL
12;RUE DU PORTAIL HAUT, BOURNAZEL
12;RTE DU CAYROU, BOURNAZEL
12;RTE DU PUECH DE FAGE, BOURNAZEL
12;RTE DU RIOU NEGRE, BOURNAZEL
12;CHEM DU ROC, BOURNAZEL
12;RUE DU SABOTIER, BOURNAZEL
12;RUE HAUTE DU FAU, BOURNAZEL
12;RUE NOIRE, BOURNAZEL
12;RTE D'ESCANDOLIERES, BOURNAZEL
12;LOT LES PRADELS, BOUSSAC
12;LOT L EMINADE, BOUSSAC
12;LOT DE LA BESSE, BOUSSAC
12;RUE DU CENTRE, BOUSSAC
12;IMP DU CIBADAL, BOUSSAC
12;CHE DE LA CURADE, BOUSSAC
12;RUE DE LA CURADE, BOUSSAC
12;RTE DEPARTEMENTALE 130, BOUSSAC
12;RTE DEPARTEMENTALE 546, BOUSSAC
12;PL DE L EGLISE, BOUSSAC
12;RUE DE L EMINADE, BOUSSAC
12;RUE DE LA FONTAINE, BOUSSAC
12;RTE DE GRAMOND, BOUSSAC
12;RUE DE LA LANDETTE, BOUSSAC
12;IMP DU LEVANT, BOUSSAC
12;CHE DU LEZERT, BOUSSAC
12;RUE DE LA MAIRIE, BOUSSAC
12;RTE DU MAZET, BOUSSAC
12;RUE DU MOULIN, BOUSSAC
12;IMP DES PRADELS, BOUSSAC
12;PL DE LA TAVERNE, BOUSSAC
12;RUE DE LA TAVERNE, BOUSSAC
12;RUE DEL VIELH CASTEL, BOUSSAC
12;IMP BELLEVUE, BOUSSAC
12;RTE DE BOUSSAC, BOUSSAC
12;RTE DE BOUTESCUR, BOUSSAC
12;RTE DE BOUTESCUROU, BOUSSAC
12;ALL DE CAUFOUR, BOUSSAC
12;CHEM DE COMBELONGUE, BOUSSAC
12;RTE DE COURBENAC, BOUSSAC
12;RTE DE CUSSAN, BOUSSAC
12;RTE DE DRULHE, BOUSSAC
12;RTE DE FRAYSSE, BOUSSAC
12;RTE DE FRAYSSINET, BOUSSAC
12;IMP DE L'EMINADE, BOUSSAC
12;RTE DE L'ISSANCHOU, BOUSSAC
12;IMP DE L'ORT, BOUSSAC
12;IMP DE L'ISSART, BOUSSAC
12;CHEM DE LA CABANE, BOUSSAC
12;RTE DE LA CABANE, BOUSSAC
12;RTE DE LA CARMELIE, BOUSSAC
12;IMP DE LA CARRAL, BOUSSAC
12;RTE DE LA CAUMETTE, BOUSSAC
12;ALL DE LA COMBE DE CARRAL, BOUSSAC
12;RUE DE LA CROIX, BOUSSAC
12;RTE DE LA PASSERELLE, BOUSSAC
