25;IMP DU CHARRON, ABBANS DESSOUS
25;RUE DES COULETS, ABBANS DESSOUS
25;IMP DES CYPRES, ABBANS DESSOUS
25;RUE JOUFFROY D ABBANS, ABBANS DESSOUS
25;CHE DU LIEU DIEU, ABBANS DESSOUS
25;IMP DU MOTTIER, ABBANS DESSOUS
25;CHE DU MOULIN, ABBANS DESSOUS
25;IMP DU PUITS, ABBANS DESSOUS
25;RUE DES PERRIERES, ABBANS DESSOUS
25;CHE DU PORTAIL, ABBANS DESSOUS
25;IMP LES PIECES, ABBANS DESSOUS
25;CHE DE RECULOZ, ABBANS DESSOUS
25;CHE DE SOMBAVAL, ABBANS DESSOUS
25;IMP TISSERAND, ABBANS DESSOUS
25;IMP VIGNES DESSOUS, ABBANS DESSOUS
25;CHE DE VILLARS, ABBANS DESSOUS
25;LOT DE BELLEVUE, ABBANS DESSUS
25;LOT LES FAVORGES, ABBANS DESSUS
25;RUE ALBERT 1ER, ABBANS DESSUS
25;RUE DE BELLEVUE, ABBANS DESSUS
25;RUE DES CHAMPS LIMBAS, ABBANS DESSUS
25;RUE DU CHATELOT, ABBANS DESSUS
25;RUE DES COMBES, ABBANS DESSUS
25;RUE DES FAVORGES, ABBANS DESSUS
25;IMP DES GRANGES, ABBANS DESSUS
25;CHE DE LA GRANDE FIN, ABBANS DESSUS
25;RUE DES JARDINS, ABBANS DESSUS
25;RUE JOUFFROY D ABBANS, ABBANS DESSUS
25;IMP DU MONUMENT, ABBANS DESSUS
25;CHE DU POSTULANT, ABBANS DESSUS
25;RTE DE QUINGEY, ABBANS DESSUS
25;RUE DU RANCHOT, ABBANS DESSUS
25;RUE SAINT MARTIN, ABBANS DESSUS
25;RUE DU SIGNAL, ABBANS DESSUS
25;IMP DES VIGNES, ABBANS DESSUS
25;RUE BASSE, ABBENANS
25;RUE DE LA BOULANGERIE, ABBENANS
25;IMP BOIS BONNAL, ABBENANS
25;RUE DU BREUZAT, ABBENANS
25;RUE DE LA CABESSE, ABBENANS
25;RUE DE LA CROCHERE, ABBENANS
25;CHE DE BOULAN, ABBENANS
25;RUE DU CHANOIS, ABBENANS
25;IMP DERRIERE L EGLISE, ABBENANS
25;RUE DU CHATEAU, ABBENANS
25;IMP DES BRUYERES, ABBENANS
25;RUE DE CHASSEIGNE, ABBENANS
25;RUE DERRIERE CHEZ CHEVAL, ABBENANS
25;IMP FLEURIE, ABBENANS
25;CHE DE FRACUL, ABBENANS
25;IMP DES GLYCINES, ABBENANS
25;RUE DE GOISEY, ABBENANS
25;RUE DE LA LIBERTE, ABBENANS
25;RUE DU MOULIN CROMAY, ABBENANS
25;RUE DES NOYES, ABBENANS
25;RUE DE LA PAIX, ABBENANS
25;RUE LE PAQUIS, ABBENANS
25;IMP DES PRES D AUVELLES, ABBENANS
25;RUE DES RENCONTRES, ABBENANS
25;CHE DE RANTERCEY, ABBENANS
25;RUE ST CLAUDE, ABBENANS
25;RUE DES VERGERS, ABBENANS
25;RUE DES VITRES, ABBENANS
25;RUE DU ZELE, ABBENANS
25;RUE A LA VYE DE FAHY, ABBEVILLERS
25;IMP AUPRES DE LA CROIX, ABBEVILLERS
25;RUE DE BEAUCOURT, ABBEVILLERS
25;RUE DES BIEFS, ABBEVILLERS
25;IMP DES BUISSONS, ABBEVILLERS
25;RUE DES BUTTES, ABBEVILLERS
25;IMP CERISIERS, ABBEVILLERS
25;RUE DU CHAMP POUTHIER, ABBEVILLERS
25;RTE DE LA CHEFFERIE, ABBEVILLERS
25;IMP DE LA COMBE, ABBEVILLERS
25;RUE DE LA COMBE DES TOUT VITS, ABBEVILLERS
25;RUE COURTE, ABBEVILLERS
25;IMP DE LA CRAYE, ABBEVILLERS
25;RTE DE CROIX, ABBEVILLERS
25;RUE DE LA CROIX, ABBEVILLERS
25;IMP DERRIERE LES CHARMES, ABBEVILLERS
25;RUE DE LA DOUE, ABBEVILLERS
25;RTE DE FAHY, ABBEVILLERS
25;RUE DU FOUR, ABBEVILLERS
25;IMP DES JARDINS DE LA VILLE, ABBEVILLERS
25;RUE DE LA MAISON DE REPOS, ABBEVILLERS
25;IMP DU PRE MORLOT, ABBEVILLERS
25;RUE DES NESUS, ABBEVILLERS
25;IMP DU PELERIN, ABBEVILLERS
25;RUE DES POMMIERS, ABBEVILLERS
25;RUE DE LA PONGEVIE, ABBEVILLERS
25;RUE DES PRUNIERS, ABBEVILLERS
25;GR GRANDE RUE, ABBEVILLERS
25;IMP DU SENTIER, ABBEVILLERS
25;RUE DES SIX CHEMINS, ABBEVILLERS
25;IMP DU SUELOT, ABBEVILLERS
25;RUE SOUS LA VILLE, ABBEVILLERS
25;RUE DE LA TUILERIE, ABBEVILLERS
25;RUE DU VANNET, ABBEVILLERS
25;IMP DES VERGERS, ABBEVILLERS
25;RUE DU VESENAY, ABBEVILLERS
25;RUE DE LA VIEILLE FONTAINE, ABBEVILLERS
25;RUE DES CAMPAINES, ACCOLANS
25;RUE LE CHARME, ACCOLANS
25;RUE DE LA CHARRIERE, ACCOLANS
25;RUE SOUS LE FEILLY, ACCOLANS
25;RUE GRANDE RUE, ACCOLANS
25;RUE DE LA VELLE, ACCOLANS
25;RUE DE LA VIGNOTTE, ACCOLANS
25;RUE DE L EPINE, ADAM LES PASSAVANT
25;RUE DE LA FONTAINE, ADAM LES PASSAVANT
25;GR GRANDE RUE, ADAM LES PASSAVANT
25;RUE DE LA MAIRIE, ADAM LES PASSAVANT
25;CHE DE MILLERIN, ADAM LES PASSAVANT
25;RUE DE LA DISTILLERIE, ADAM LES VERCEL
25;CHEM DES CURTILS, ADAM LES VERCEL
25;RUE DE LA FONTAINE, ADAM LES VERCEL
25;RUE DE LA FONTENOTTE, ADAM LES VERCEL
25;RUE DU LAVOIR, ADAM LES VERCEL
25;RUE PRINCIPALE, ADAM LES VERCEL
25;CHE DU VERNOIS, ADAM LES VERCEL
25;CHE DE LA BARRE, AIBRE
25;CHE DE LA CHAPELLE, AIBRE
25;CHE DE CHESAL, AIBRE
25;CHE DE LA CHEVREUIL, AIBRE
25;RUE LE CLOS DE LA FONTAINE, AIBRE
25;CHE CHEMIN COMBE MIRALLE, AIBRE
25;CHEM DES COMBES DU BAS, AIBRE
25;RUE DE L EGLISE, AIBRE
25;CLOS DE LA FONTAINE, AIBRE
25;RTE D'HERICOURT, AIBRE
25;RUE DE LA MAIRIE, AIBRE
25;RUE DU MONT, AIBRE
25;RUE LE MOUCHOT ET LA PALE, AIBRE
25;RUE DE LA PALE, AIBRE
25;CHE DU PERIMETRE, AIBRE
25;CHE DU POUSSOT, AIBRE
25;RUE DES PRES, AIBRE
25;GR GRANDE RUE, AIBRE
25;RTE DE SEMONDANS, AIBRE
25;RUE DU TEMPLE, AIBRE
25;RTE DE LE VERNOY, AIBRE
25;IMP DES COURTS CHAMPS, AISSEY
25;CHE DE LA CHAPELLE, AISSEY
25;CHE DES COMBEAUX, AISSEY
25;RUE DE LA CORVEE, AISSEY
25;RUE DE LA COTE, AISSEY
25;RUE DU 18 JUIN 1940, AISSEY
25;RUE DE L EGLISE, AISSEY
25;GR GRANDE RUE, AISSEY
25;CHE DE LA CAVE AUX LIEVRES, AISSEY
25;RUE DU LOTISSEMENT AU VILLAGE, AISSEY
25;RUE DE LA MAIRIE, AISSEY
25;RUE DE LA PRAIRIE, AISSEY
25;CHE VIE AUX CHATS, AISSEY
25;CHE DE L ARGIGNEY, ALLENJOIE
25;RUE DE BEREAU, ALLENJOIE
25;RUE DU CHANOIT, ALLENJOIE
25;RUE DE BOUROGNE, ALLENJOIE
25;RUE DU BREUIL, ALLENJOIE
25;RUE DE BROGNARD, ALLENJOIE
25;RUE DU CANTON, ALLENJOIE
25;IMP DU CHATEAU, ALLENJOIE
25;RUE DU CHAUFFOUR, ALLENJOIE
25;RUE DE L ECLUSE, ALLENJOIE
25;RUE FONTENETTE, ALLENJOIE
25;GR GRANDE RUE, ALLENJOIE
25;RUE HENRI HUGONIOT, ALLENJOIE
25;IMP DU MARRONNIER, ALLENJOIE
25;RUE DE LA MOTTE, ALLENJOIE
25;RUE DES PEUPLIERS, ALLENJOIE
25;RUE DE LA PRUSSE, ALLENJOIE
25;RUE DU PUITS, ALLENJOIE
25;RUE DES ROCHES, ALLENJOIE
25;RUE DU TERTRE, ALLENJOIE
25;RUE TOURILLON, ALLENJOIE
25;RUE LES CHENEY, LES ALLIES
25;RUE LA CHEVRETTE, LES ALLIES
25;RUE ISABELLE DE NEUCHATEL, LES ALLIES
25;RUE DE LA LIBERATION, LES ALLIES
25;RUE LA PEROUSE, LES ALLIES
25;RUE RAYMOND POINCARE, LES ALLIES
25;PL MARC MOUGEY, LES ALLIES
25;RUE DU TILLEUL, LES ALLIES
25;RUE CENTRALE, ALLONDANS
25;RUE DES CERISIERS, ALLONDANS
25;RUE LES CHAPELLES, ALLONDANS
25;RUE DES COMBES, ALLONDANS
25;RUE DE LA CROSSE, ALLONDANS
25;RTE DE DUNG, ALLONDANS
25;PL DE LA FONTAINE, ALLONDANS
25;RUE DU FORT, ALLONDANS
25;RTE D ISSANS, ALLONDANS
25;RUE DU PUITS, ALLONDANS
25;RUE DU SAVOUT, ALLONDANS
25;RUE DU TEMPLE, ALLONDANS
25;LOT CARRON, AMAGNEY
25;RUE DE BESANCON, AMAGNEY
25;RUE CARRON, AMAGNEY
25;RUE DES CHAMPS VIEILLE, AMAGNEY
25;RUE DE CHAMPLIE, AMAGNEY
25;RUE DES CHAZEAUX, AMAGNEY
25;RTE DU CHAZOULOT, AMAGNEY
25;RUE DES CHEVRIOLES, AMAGNEY
25;RUE DE LA CHIRETTE, AMAGNEY
25;RUE DU CLOUSEY, AMAGNEY
25;RUE DE LA COMBOTTE, AMAGNEY
25;RUE DE L ECOLE, AMAGNEY
25;RUE DE L EGLISE, AMAGNEY
25;RUE DES GRANDS PRES, AMAGNEY
25;RUE DE LA LONGEAU, AMAGNEY
25;PL DE LA MAIRIE, AMAGNEY
25;RUE MARCEL TRONCIN, AMAGNEY
25;RUE DE LA MILLIERES, AMAGNEY
25;RUE DES MIRABELLES, AMAGNEY
25;RUE DE LA NOUE, AMAGNEY
25;CHE DE LA PLANTE, AMAGNEY
25;RUE DE LA POMPE, AMAGNEY
25;RUE DE LA PRAIRIE, AMAGNEY
25;RUE DES QUILLERY, AMAGNEY
25;RUE DU SAINT MARTIN, AMAGNEY
25;RUE DE LA SOURCE, AMAGNEY
25;CHE SUR LA VELLE, AMAGNEY
25;LOT JEDRY, AMANCEY
25;HAB Z I DU GRAND BOIS, AMANCEY
25;PL ALEXANDRE BESSON, AMANCEY
25;RUE DE LA BUCHAILLE, AMANCEY
25;RUE DES CERISIERS, AMANCEY
25;RUE DE LA CHENEVIERE, AMANCEY
25;RUE DU CLOS, AMANCEY
25;RUE DU COLLEGE, AMANCEY
25;CHE DE COULANS, AMANCEY
25;RUE DES CULTILS, AMANCEY
25;RTE DE DESERVILLERS, AMANCEY
25;RUE DU DOCTEUR COULON, AMANCEY
25;RUE DE L EGLISE, AMANCEY
25;RUE DU FOUR, AMANCEY
25;CHE DE LA FROMAGERIE, AMANCEY
25;RUE JEDRY, AMANCEY
25;IMP JEDRY, AMANCEY
25;RUE DE LA LAVIERE, AMANCEY
25;PL DE LA MAIRIE, AMANCEY
25;RUE PLANCHE SAINTE MARIE, AMANCEY
25;RUE DES PRES GRAS, AMANCEY
25;RUE DU REPOS, AMANCEY
25;RUE DES ROSIERS, AMANCEY
25;RUE DU ROUCHERET, AMANCEY
25;GR GRANDE RUE, AMANCEY
25;RUE SAINT CLAUDE, AMANCEY
25;RUE SAINT JEAN, AMANCEY
25;CHE DE LA RUELLE, AMANCEY
25;RUE SAINTE MARIE, AMANCEY
25;CHE DE LA SUISSE, AMANCEY
25;CHE DE SUR ROCHE, AMANCEY
25;IMP SUR ROCHE, AMANCEY
25;RUE DU TRAINEAU, AMANCEY
25;RUE DES VERGERS, AMANCEY
25;CHEM DES AMBIERGES, AMANCEY
25;PL BESSON, AMANCEY
25;RUE DU CLOS DES SELLES, AMANCEY
25;CHEM DES PERRIERES, AMANCEY
25;RUE DES ARBATRIERS, AMATHAY-VESIGNEUX
25;RUE DU CHATEAU D EAU, AMATHAY-VESIGNEUX
25;RUE DU CHATELET, AMATHAY-VESIGNEUX
25;RUE DU CHAZAL, AMATHAY-VESIGNEUX
25;RUE DU CRAI, AMATHAY-VESIGNEUX
25;RUE DE L EGLISE, AMATHAY-VESIGNEUX
25;RUE DES FRENES, AMATHAY-VESIGNEUX
25;GR GRANDE RUE, AMATHAY-VESIGNEUX
25;RUE DES MOULINS, AMATHAY-VESIGNEUX
25;RUE DE PRELE, AMATHAY-VESIGNEUX
25;RUE DES TILLEULS, AMATHAY-VESIGNEUX
25;RUE DES VERGERS, AMATHAY-VESIGNEUX
25;RUE DU VILLAGE, AMATHAY-VESIGNEUX
25;RUE CHOULET, AMONDANS
25;RUE DE LA FONTAINE, AMONDANS
25;GR GRANDE RUE, AMONDANS
25;RUE DES VERGERS, AMONDANS
25;RUE DE L ECOLE, AMONDANS
25;RUE DE LA FONTAINE DES SAGES, AMONDANS
25;RUE LOUISE POMMERY, AMONDANS
25;RUE DU REPOS, AMONDANS
25;PL DU VILLAGE, AMONDANS
25;LOT EN LA COVRE, ANTEUIL
25;LOT CLAIR SOLEIL, ANTEUIL
25;PL DU BASSOT, ANTEUIL
25;RUE DE CHAMP DOLENT, ANTEUIL
25;RUE DES CHAMPS, ANTEUIL
25;RUE DES CHAMPS ST BLAISE, ANTEUIL
25;IMP DES CHARMILLES, ANTEUIL
25;RUE DU CHATEAU, ANTEUIL
25;RUE DES CHAUCHEUX, ANTEUIL
25;RUE DE LA CIDRERIE, ANTEUIL
25;RUE CLAIR SOLEIL, ANTEUIL
25;RUE DES CHAUMES, ANTEUIL
25;RTE DU COL DE FERRIERE, ANTEUIL
25;PL DE LA CIDRERIE, ANTEUIL
25;RUE DE LA COTE D ARMONT, ANTEUIL
25;RUE DE L ECOLE, ANTEUIL
25;RUE DE LA COVRE, ANTEUIL
25;PL DE L EGLISE, ANTEUIL
25;RUE DE L EGLISE, ANTEUIL
25;CHEM DE L'EPINE, ANTEUIL
25;RUE DE FAGNOLLE, ANTEUIL
25;IMP DES FLEURS, ANTEUIL
25;RUE DE LA FONTAINE, ANTEUIL
25;RUE DE FONTENELLE, ANTEUIL
25;RUE DE FOUGEROT, ANTEUIL
25;GR GRANDE RUE, ANTEUIL
25;RTE DE L ISLE, ANTEUIL
25;PL DU LAVOIR, ANTEUIL
25;RUE DES LILAS, ANTEUIL
25;RUE DU LOMONT, ANTEUIL
25;PL DE LA MAIRIE, ANTEUIL
25;RUE DU MEMORIAL, ANTEUIL
25;RUE DU PRESBYTERE, ANTEUIL
25;RUE PRINCIPALE, ANTEUIL
25;RUE DE ROSSE, ANTEUIL
25;IMP SAINT BLAISE, ANTEUIL
25;RTE DE SAINT GEORGES, ANTEUIL
25;IMP DES SOURCES, ANTEUIL
25;RUE DU STADE, ANTEUIL
25;RUE EMILE STREIT, ANTEUIL
25;RUE DE LA TUILERIE, ANTEUIL
25;RUE DU CHANOIS, ANTEUIL
25;RUE DU VERSOUX, ANTEUIL
25;IMP SOUS LA VIERGE, ANTEUIL
25;RUE DE L ABBAYE, APPENANS
25;RUE BASSE, APPENANS
25;RUE DU CHAMP DU CHEMIN, APPENANS
25;RUE DU CHAMP DU FOUR, APPENANS
25;CHEM DES COMBEAUX, APPENANS
25;RUE COMBE TENARD, APPENANS
25;RUE DU CREPON, APPENANS
25;IMP DE LA CURE, APPENANS
25;RUE DE LA DISTILLERIE, APPENANS
25;PL DE LA DISTILLERIE, APPENANS
25;RUE DE L ECLUSE, APPENANS
25;RUE DES ECOLES, APPENANS
25;RUE DE L EGLISE, APPENANS
25;PL DE LA FONTAINE, APPENANS
25;IMP DU GELOT, APPENANS
25;RUE DU GELOT, APPENANS
25;RTE DE GENEY, APPENANS
25;GR GRANDE RUE, APPENANS
25;RUE DU MOULIN DE L ABBAYE, APPENANS
25;RUE DE LA COMBE MARTELOT, APPENANS
25;RUE DU REPLAIN, APPENANS
25;RUE DU VAUCHOUX, APPENANS
25;CHE VIE AUX MORTS, APPENANS
25;RUE D AUDINCOURT, ARBOUANS
25;CHE DE BELCHAMP, ARBOUANS
25;BRTL ROUTIERE, ARBOUANS
25;RUE DES CHAMPS DE PIERRES, ARBOUANS
25;RUE DU CHATEAU D EAU, ARBOUANS
25;RUE DE CHATILLON, ARBOUANS
25;CHE DU CIMETIERE, ARBOUANS
25;CITE KELLER, ARBOUANS
25;RUE DES CITES S M A, ARBOUANS
25;RUE DES COMBES, ARBOUANS
25;CHE COTE EMERY, ARBOUANS
25;RUE DE COURCELLES, ARBOUANS
25;RUE DES COURTS CHAMPS, ARBOUANS
25;RUE DES CURTILS, ARBOUANS
25;DEVI DU CD 472, ARBOUANS
25;RUE DES ECOLES, ARBOUANS
25;RUE DE L EPARGNE, ARBOUANS
25;IMP DES ESSARTS, ARBOUANS
25;RUE DES ESSARTS, ARBOUANS
25;AV DE L'EUROPE, ARBOUANS
25;RUE DES GRANDS CANTONS, ARBOUANS
25;RUE KELLER, ARBOUANS
25;RTE DE MONTBELIARD, ARBOUANS
25;PL DE LA MAIRIE, ARBOUANS
25;RUE DES POUGES, ARBOUANS
25;RUE DES ROCHES, ARBOUANS
25;IMP DU RUISSEAU, ARBOUANS
25;RUE DES SABLIERES, ARBOUANS
25;RUE DES SAMBLENIERES, ARBOUANS
25;ALL DES SAPINS, ARBOUANS
25;VC LE SENTIER, ARBOUANS
25;RUE DU STADE, ARBOUANS
25;CHE DU STADE, ARBOUANS
25;RUE SUR LA COTE, ARBOUANS
25;RUE DES VERGERS, ARBOUANS
25;RUE DES VIGNOTTES, ARBOUANS
25;LOT LES HAUTS DU DEFFOIS, ARC ET SENANS
25;IMP DE L AIGUILLE, ARC ET SENANS
25;RUE DE BESANCON, ARC ET SENANS
25;RUE DES CARRIERES, ARC ET SENANS
25;RUE DU CENTRE BOURG, ARC ET SENANS
25;RUE CHAILLOLET, ARC ET SENANS
25;RUE DU CHAMP DE FOIRE, ARC ET SENANS
25;IMP DU CHANOINE, ARC ET SENANS
25;RUE DES COMMUNAUX, ARC ET SENANS
25;RUE DU DEFFOIS, ARC ET SENANS
25;RUE DE DOLE, ARC ET SENANS
25;PAS DE L ECOLE, ARC ET SENANS
25;PL DE L EGLISE, ARC ET SENANS
25;RUE DE L ESPERANCE, ARC ET SENANS
25;RUE DU FER A CHEVAL, ARC ET SENANS
25;RUE DES FORGES, ARC ET SENANS
25;RUE DE LA FROMAGERIE, ARC ET SENANS
25;RUE DES GABELOUS, ARC ET SENANS
25;RUE DE LA GARE, ARC ET SENANS
25;RUE DES GRADUATIONS, ARC ET SENANS
25;GR GRANDE RUE, ARC ET SENANS
25;RUE DE LA GRANDE VYE, ARC ET SENANS
25;RUE DE LA GROTTE, ARC ET SENANS
25;RUE DU CANTON D AVAL, ARC ET SENANS
25;RUE DE LA LAITERIE, ARC ET SENANS
25;RUE LEDOUX, ARC ET SENANS
25;RUE DE LA LEVEE, ARC ET SENANS
25;PL DES MARRONNIERS, ARC ET SENANS
25;RUE MOUROLIN, ARC ET SENANS
25;RUE DE LA PEPINIERE, ARC ET SENANS
25;RUE DE LA PEROUSE, ARC ET SENANS
25;RUE DU PUITS, ARC ET SENANS
25;RTE DE RANS, ARC ET SENANS
25;SEN DE ROCHE, ARC ET SENANS
25;AV DE LA SALINE, ARC ET SENANS
25;RUE DU SAUMODUC, ARC ET SENANS
25;RUE DES SAUNIERS, ARC ET SENANS
25;RUE DES TERROUX, ARC ET SENANS
25;RUE DES TOPES, ARC ET SENANS
25;RUE DES TUILERIES, ARC ET SENANS
25;RUE DE LA VIEILLE BARQUE, ARC ET SENANS
25;RUE DE LA BURGONDE, ARC ET SENANS
25;CHE DU PIN, ARC ET SENANS
25;RUE DE L ISLE, ARC ET SENANS
25;IMP DU BOIS, ARCEY
25;IMP DES PRELOTS, ARCEY
25;VOIE DE L ISLE, ARCEY
25;CHE DES BARAQUES, ARCEY
25;PL DU CHAMP DE FOIRE, ARCEY
25;PL DU CHAPEAU ROUGE, ARCEY
25;RUE DE COMBARAND, ARCEY
25;IMP DES COQUELICOTS, ARCEY
25;PL DE NOTRE DAME DE LA GRELE, ARCEY
25;PL DE L EGLISE, ARCEY
25;PL DE LA MAIRIE, ARCEY
25;RUE DES ALOUETTES, ARCEY
25;RUE D ALENCOURT, ARCEY
25;RUE DES CAILLES, ARCEY
25;RUE CHARLES DE GAULLE, ARCEY
25;IMP DES CHAMPS DES PRES, ARCEY
25;RUE DES CHENES, ARCEY
25;RUE DES CHENEVIERES, ARCEY
25;IMP DE LA CHEVRU, ARCEY
25;RUE DES DAHLIAS, ARCEY
25;CHE DES EPESSES, ARCEY
25;RUE DE L'EPINE, ARCEY
25;RUE D'ECHENANS, ARCEY
25;RUE DE LA FOUGERE, ARCEY
25;RUE DU GROUPE SCOLAIRE, ARCEY
25;IMP DES HETRES, ARCEY
25;RUE DES JONQUILLES, ARCEY
25;RUE LATRON, ARCEY
25;RUE DES LILAS, ARCEY
25;RUE DES MESANGES, ARCEY
25;RUE DE MONTBELIARD, ARCEY
25;RUE DU MONT, ARCEY
25;IMP SOUS LE MONT, ARCEY
25;RUE DE NEUVELLE, ARCEY
25;IMP DES OEILLETS, ARCEY
25;RUE DES PINSONS, ARCEY
25;RUE DU PUITS, ARCEY
25;RUE DES PRELOTS, ARCEY
25;RUE DES ROSES, ARCEY
25;RUE DE SAINTE MARIE, ARCEY
25;RUE DU STADE, ARCEY
25;RUE DE LA STATION, ARCEY
25;RUE DES TILLEULS, ARCEY
25;RUE DES TULIPES, ARCEY
25;RUE DE LA 5EME DB, ARCEY
25;RUE DE LA VELLE, ARCEY
25;RUE DE VILLERSEXEL, ARCEY
25;RUE DES POMMIERS, ARCEY
25;RUE DE L AIGE, ARCON
25;RUE DES ARTISANS, ARCON
25;RUE BELLEVUE, ARCON
25;RUE DU BOIS DE L OIE, ARCON
25;RUE DU CANAL, ARCON
25;RUE DES COTES, ARCON
25;RUE DE CROSET, ARCON
25;RUE DU COTAY, ARCON
25;RUE DU DOVERNIER, ARCON
25;RUE DU CLAIR SOLEIL, ARCON
25;RUE DU CHAMP NEUF, ARCON
25;RUE DU CHATEAU D EAU, ARCON
25;RUE DES ECOLIERS, ARCON
25;RUE DU GEN MARGUET, ARCON
25;GR GRANDE RUE, ARCON
25;RUE DES MARINIERES, ARCON
25;RUE DU MONT GIROD, ARCON
25;RUE NAILLIN DESSOUS, ARCON
25;RUE DE NANGEIN, ARCON
25;RUE DE PADELOT, ARCON
25;RUE DU PONT ROUGE, ARCON
25;RUE DES TILLEULS, ARCON
25;RUE DU ROCHERA, ARCON
25;RUE DES RONDETS, ARCON
25;IMP DU SENTIER, ARCON
25;RUE DE SOUTET, ARCON
25;CHE DU SEQUOIA, ARCON
25;RUE DE LA SAUTERELLE, ARCON
25;IMP DE LA VOIE VERTE, ARCON
25;IMP DE LA VIGNE, ARCON
25;RUE DE LA PETITE ITALIE, ARCON
25;LOT CONDEMINE, ARC SOUS CICON
25;RUE DU BEUQUERU, ARC SOUS CICON
25;RUE DES COMBES, ARC SOUS CICON
25;RUE DES COQUELICOTS, ARC SOUS CICON
25;RUE DES CORDIERS, ARC SOUS CICON
25;RUE CONDEMINE, ARC SOUS CICON
25;RUE DU CRET, ARC SOUS CICON
25;RUE DU CRET MONNIOT, ARC SOUS CICON
25;RUE DE LA CITADELLE, ARC SOUS CICON
25;RUE DU CHATEAU, ARC SOUS CICON
25;RUE DE L ECOLE, ARC SOUS CICON
25;RUE DE L'EGLISE, ARC SOUS CICON
25;RUE DES ETAULES, ARC SOUS CICON
25;RUE DES FRENES, ARC SOUS CICON
25;RUE DES FRERES VUILLEMIN, ARC SOUS CICON
25;RUE DU GENERAL RAVIER, ARC SOUS CICON
25;GR GRANDE RUE, ARC SOUS CICON
25;RUE DES IRIS, ARC SOUS CICON
25;RUE DES JONQUILLES, ARC SOUS CICON
25;RUE DES LILAS, ARC SOUS CICON
25;RTE DE LONGEMAISON, ARC SOUS CICON
25;RUE DE LA LOUERE, ARC SOUS CICON
25;PL DE LA MAIRIE, ARC SOUS CICON
25;RUE DU MOULIN, ARC SOUS CICON
25;RUE DU PLAIMBOIS, ARC SOUS CICON
25;RUE DU PETIT CHATEAU D EAU, ARC SOUS CICON
25;RUE DE LA POSTE, ARC SOUS CICON
25;RUE DE LA RASSE, ARC SOUS CICON
25;RUE DES ROSES, ARC SOUS CICON
25;RUE DU TREMBLE, ARC SOUS CICON
25;RUE DE LA TUILERIE, ARC SOUS CICON
25;RUE DE LA VIE GRIMAUD, ARC SOUS CICON
25;RUE DU CAMP, ARC SOUS MONTENOT
25;RUE DU BOIS BRULE, ARC SOUS MONTENOT
25;RUE DU CALVAIRE, ARC SOUS MONTENOT
25;RUE DE LA CHAYERE, ARC SOUS MONTENOT
25;RUE DU CLOS, ARC SOUS MONTENOT
25;RUE DE FRASNE, ARC SOUS MONTENOT
25;RUE DU GERET, ARC SOUS MONTENOT
25;RUE ANATOLE MAILLARD, ARC SOUS MONTENOT
25;RUE DES LILAS, ARC SOUS MONTENOT
25;RUE DE L EGLISE, ARC SOUS MONTENOT
25;RUE DE SALINS, ARC SOUS MONTENOT
25;RUE DE VILLENEUVE, ARC SOUS MONTENOT
25;RTE D'ARC SOUS CICON, AUBONNE
25;CHEM DES BICHES, AUBONNE
25;RUE DES CHALETS, AUBONNE
25;RUE DU CHATEAU, AUBONNE
25;RTE DE LA CREUSE, AUBONNE
25;RUE DE L ECOLE, AUBONNE
25;RUE DE L EGLISE, AUBONNE
25;RUE DES ERABLES, AUBONNE
25;GR GRANDE RUE, AUBONNE
25;CHEM DES FRETES, AUBONNE
25;RUE DU FRENE, AUBONNE
25;RTE D HAUTEPIERRE, AUBONNE
25;RUE DE LA FORGE, AUBONNE
25;RUE DE LA FROMAGERIE, AUBONNE
25;RUE DU HAUT, AUBONNE
25;RUE DE LALLEBOIS, AUBONNE
25;RUE DU LOTISSEMENT, AUBONNE
25;RUE DU LOTISSEMENT DU PLAIN 1, AUBONNE
25;RUE DU LOTISSEMENT DU PLAIN 2, AUBONNE
25;RUE DE LA MAIRIE, AUBONNE
25;RTE DE NARMAUD, AUBONNE
25;RTE NATIONALE 57, AUBONNE
25;RUE DE TARTRE BUHIN, AUBONNE
25;RUE VIE JEAN BATON, AUBONNE
25;LOT LE VAL DES HAUTS PRES, AUDEUX
25;RUE DU BOIS MUSSOT, AUDEUX
25;RUE DU CENTRE, AUDEUX
25;RUE DU CHARMOT, AUDEUX
25;RUE DE LA CURE, AUDEUX
25;RUE DES COMMUNAUX, AUDEUX
25;RUE DE LA FONTAINE, AUDEUX
25;RUE ABBE GODIN, AUDEUX
25;GR GRANDE RUE, AUDEUX
25;RUE DE LA MAIRIE, AUDEUX
25;RTE DE MAZEROLLES, AUDEUX
25;RUE DE L OREE DU BOIS, AUDEUX
25;RUE DES TILLEULS, AUDEUX
25;RUE DES VIGNES, AUDEUX
25;CITE GAST, AUDINCOURT
25;CITE HUMANN, AUDINCOURT
25;CITE JOESSEL, AUDINCOURT
25;CITE KELLER, AUDINCOURT
25;CITE LEMUT, AUDINCOURT
25;CITE DU MAGASIN, AUDINCOURT
25;CITE MONTANOT, AUDINCOURT
25;CITE DE L OUVROIR, AUDINCOURT
25;CITE STEIB, AUDINCOURT
25;RES RUE BELFORT, AUDINCOURT
25;RUE DES ACACIAS, AUDINCOURT
25;RUE ALBERT PARROT, AUDINCOURT
25;IMP DES ARBLETIERS, AUDINCOURT
25;RUE DES ARBUES, AUDINCOURT
25;AV ARISTIDE BRIAND, AUDINCOURT
25;RUE ARRAS, AUDINCOURT
25;RUE DE L AUBEPINE, AUDINCOURT
25;CHE D'AUDINCOURT A VANDONCOURT, AUDINCOURT
25;CHE DE LA BAUME, AUDINCOURT
25;RUE DE LA BAUME, AUDINCOURT
25;RUE DES BECHOTS, AUDINCOURT
25;RUE DE BELFORT, AUDINCOURT
25;RUE DU BOIS JOLI, AUDINCOURT
25;IMP DU BOIS NOUVEAU, AUDINCOURT
25;IMP DE BONDEVAL, AUDINCOURT
25;RUE DE BONDEVAL, AUDINCOURT
25;ALL DE BOURGOGNE, AUDINCOURT
25;RUE CAMILLE STEIB, AUDINCOURT
25;RUE DES CAMPENOTTES, AUDINCOURT
25;RUE DU CANAL, AUDINCOURT
25;RUE DES CANTONS, AUDINCOURT
25;RUE DES CARRONS, AUDINCOURT
25;RUE DES CASTORS, AUDINCOURT
25;RUE DES CERISIERS, AUDINCOURT
25;RUE AIME CESAIRE, AUDINCOURT
25;RUE CHAINTRE DES PERDRIX, AUDINCOURT
25;RUE DES CHALETS, AUDINCOURT
25;RUE CHALETS DE CHAMPAGNE, AUDINCOURT
25;RUE DE CHAMPAGNE, AUDINCOURT
25;RUE CHAMPS DE L ESSART, AUDINCOURT
25;RUE DES CHAMPS AU LIEVRE, AUDINCOURT
25;RUE DES CHAMPS MONTANTS, AUDINCOURT
25;RUE DE LA CHAPELLE, AUDINCOURT
25;RUE DE LA CHARBONNIERE, AUDINCOURT
25;RUE DES CHARDONNERETS, AUDINCOURT
25;RUE CHARLES ALLEMAND, AUDINCOURT
25;RUE CHARLES ALLEMAND PROLONGEE, AUDINCOURT
25;RUE CHARLES PEUGEOT, AUDINCOURT
25;RUE DU CHATEAU, AUDINCOURT
25;RUE DU CHATEAU D EAU, AUDINCOURT
25;ALL DU CHENE, AUDINCOURT
25;RUE DES CITES ESCOMBAS, AUDINCOURT
25;RUE DE LA CITE HEUREUSE, AUDINCOURT
25;RUE DES CITES HUMANN, AUDINCOURT
25;RUE DES CITES DU PARC, AUDINCOURT
25;PL DE LA CITOYENNETE, AUDINCOURT
25;RUE DU CLAIR LOGIS, AUDINCOURT
25;RUE DU CLAIR SOLEIL, AUDINCOURT
25;RUE DU CLAIR VALLON, AUDINCOURT
25;RUE DU CLOS FLEURI, AUDINCOURT
25;RUE DES CLOVERAIS, AUDINCOURT
25;IMP DU CLOTRE, AUDINCOURT
25;RUE DE LA COMBE ES BREUX, AUDINCOURT
25;RUE DE LA COMBOTTE, AUDINCOURT
25;RUE DE LA COMBE MIREY, AUDINCOURT
25;RUE DU COTEAU, AUDINCOURT
25;RUE DE LA COTE, AUDINCOURT
25;RUE DE LA COTE MANCIN, AUDINCOURT
25;RUE DE LA COMBE SOUACHE, AUDINCOURT
25;IMP DE LA COMBE DE DASLE, AUDINCOURT
25;RUE GUSTAVE COURBET, AUDINCOURT
25;RUE DE DASLE, AUDINCOURT
25;RUE VICTOR DEMAISON, AUDINCOURT
25;RUE DU DOUBS, AUDINCOURT
25;RUE DUVERNOY, AUDINCOURT
25;RUE DES ECOLES, AUDINCOURT
25;RUE EDITH PIAF, AUDINCOURT
25;RUE DE L EPARGNE, AUDINCOURT
25;RUE DE L ESPERANCE, AUDINCOURT
25;AV DE L'EUROPE, AUDINCOURT
25;RUE LEO FERRE, AUDINCOURT
25;ALL DE LA FILATURE, AUDINCOURT
25;RUE DES FLANDRES, AUDINCOURT
25;AV MAL FOCH, AUDINCOURT
25;BD MOISE FOGLIA, AUDINCOURT
25;RUE RAOUL FOLLEREAU, AUDINCOURT
25;RUE DE LA FONTAINE, AUDINCOURT
25;PL DES FORGES, AUDINCOURT
25;RUE DU FOUR MARTIN, AUDINCOURT
25;RUE DE FRANCHE COMTE, AUDINCOURT
25;RUE FREDERIC BATAILLE, AUDINCOURT
25;RUE FREDERIC LOUYS, AUDINCOURT
25;RUE DES FRERES FRONTZACK, AUDINCOURT
25;AV DE LA GARE, AUDINCOURT
25;RUE GEORGES CUVIER, AUDINCOURT
25;RUE DE GERBEVILLERS, AUDINCOURT
25;RUE DE GERBEVILLERS PROLONGEE, AUDINCOURT
25;GR GRANDE RUE, AUDINCOURT
25;RUE DES GRANDS BOIS, AUDINCOURT
25;RUE DES GRANDES BRIERES, AUDINCOURT
25;RUE DES GRANDS CHAMPS, AUDINCOURT
25;IMP GRISEY, AUDINCOURT
25;AV DU HUIT MAI, AUDINCOURT
25;RUE DE L IMPRIMERIE, AUDINCOURT
25;RUE JACQUES BREL, AUDINCOURT
25;RUE DE LA JALESIE, AUDINCOURT
25;AV JEAN JAURES, AUDINCOURT
25;RUE JEANNE D ARC, AUDINCOURT
25;RUE DES JEANNETTES, AUDINCOURT
25;AV JOESSEL, AUDINCOURT
25;RUE LAZARE BICKART, AUDINCOURT
25;RUE DE LA LIBERTE, AUDINCOURT
25;RUE DES LILAS, AUDINCOURT
25;RUE DU LOMONT, AUDINCOURT
25;RUE LOUIS ARAGON, AUDINCOURT
25;RUE LOUIS BAINIER, AUDINCOURT
25;RUE LOUIS GARNIER, AUDINCOURT
25;RUE LOUIS PERGAUD, AUDINCOURT
25;RUE LOUISE MICHEL, AUDINCOURT
25;RUE DE LA MAIRIE, AUDINCOURT
25;IMP DES MARAIS, AUDINCOURT
25;RUE MARCEL PAUL, AUDINCOURT
25;RUE DU MARCHE, AUDINCOURT
25;PL DU MARCHE, AUDINCOURT
25;RUE DES MARECHAUX, AUDINCOURT
25;RUE DE LA MARNE, AUDINCOURT
25;PL DU 19 MARS 1962, AUDINCOURT
25;RUE DES MINES, AUDINCOURT
25;RUE YVES MONTAND, AUDINCOURT
25;IMP DU MONTANOT, AUDINCOURT
25;RUE DU MONTANOT, AUDINCOURT
25;RUE DU MONTANOT PROLONGEE, AUDINCOURT
25;RUE DE MONTBELIARD, AUDINCOURT
25;RUE DE LA MOTTE, AUDINCOURT
25;RUE DE LA MUSIQUE, AUDINCOURT
25;RUE DE LA NAILLE, AUDINCOURT
25;RUE NEUVE, AUDINCOURT
25;ALL DE NORMANDIE, AUDINCOURT
25;RUE CLAUDE NOUGARO, AUDINCOURT
25;RUE OEHMICHEN, AUDINCOURT
25;RUE DU ONZE NOVEMBRE, AUDINCOURT
25;RUE COUR DE L'ORANGERIE, AUDINCOURT
25;RUE DE LA PAIX, AUDINCOURT
25;RUE DES PAQUERETTES, AUDINCOURT
25;RUE PASTEUR, AUDINCOURT
25;RUE PIERRE POUTOT, AUDINCOURT
25;RUE DE PAUVREMENT, AUDINCOURT
25;IMP DES PEUPLIERS, AUDINCOURT
25;PL DU PRESIDENT ALLENDE, AUDINCOURT
25;RUE DU POINT DU JOUR, AUDINCOURT
25;RUE DES PRES, AUDINCOURT
25;RUE DU PRESBYTERE, AUDINCOURT
25;RUE DE LA PREVOYANCE, AUDINCOURT
25;RUE PROUD'HON, AUDINCOURT
25;PL DE PROVENCE, AUDINCOURT
25;RUE DU PUITS, AUDINCOURT
25;RUE DES RANCHOTS, AUDINCOURT
25;RUE JEAN RAVENT, AUDINCOURT
25;RUE DES RECILLES, AUDINCOURT
25;RUE DES REFROIDIERES, AUDINCOURT
25;RUE DE REIMS, AUDINCOURT
25;RUE RENAUD, AUDINCOURT
25;RUE RENE GIRARDOT, AUDINCOURT
25;RUE DES RENTOTTES, AUDINCOURT
25;RUE DU RESERVOIR, AUDINCOURT
25;RUE DE LA REVOLUTION DE 1789, AUDINCOURT
25;RUE RICHARD PERLINSKY, AUDINCOURT
25;IMP PIERRE RIZZI, AUDINCOURT
25;RUE ROMAINE, AUDINCOURT
25;IMP DU RUISSEAU, AUDINCOURT
25;RUE SAGLIO, AUDINCOURT
25;RUE DE LA SAPINIERE, AUDINCOURT
25;RUE DE SELONCOURT, AUDINCOURT
25;RUE DES SERRURIERS, AUDINCOURT
25;RUE SIMONE SIGNORET, AUDINCOURT
25;RUE SIMONE VEIL, AUDINCOURT
25;RUE DE SOISSONS, AUDINCOURT
25;RUE DE LA SOMME, AUDINCOURT
25;RUE DE LA SOMME PROLONGEE, AUDINCOURT
25;RUE SOUS FOSSOTTES, AUDINCOURT
25;RUE SOUS LES VIGNES, AUDINCOURT
25;RUE DU STAND, AUDINCOURT
25;IMP DES TAILLIS, AUDINCOURT
25;PL DU TEMPLE, AUDINCOURT
25;RUE CHARLES TRENET, AUDINCOURT
25;IMP DE LA TUILERIE, AUDINCOURT
25;RUE DE L UNION, AUDINCOURT
25;RUE DE VALENTIGNEY, AUDINCOURT
25;RUE DE VANDONCOURT, AUDINCOURT
25;RUE DE VERDUN, AUDINCOURT
25;RUE DES VERGERS, AUDINCOURT
25;RUE VICTOR HUGO, AUDINCOURT
25;RUE VICTOR KUENTZMANN, AUDINCOURT
25;RUE VIETTE, AUDINCOURT
25;RUE DE L YSER, AUDINCOURT
25;LOT LA COURBOTTE, AUTECHAUX
25;ZI LA CRAYE, AUTECHAUX
25;LOT LE PRAHIER, AUTECHAUX
25;RUE DES COLOMBES, AUTECHAUX
25;RUE LA COURBOTTE, AUTECHAUX
25;RUE DE LA CRAYE, AUTECHAUX
25;RUE DES ECOLES, AUTECHAUX
25;RUE DE L EGLISE, AUTECHAUX
25;RUE DE LA FONTAINE, AUTECHAUX
25;RUE GILBERT MAILLARD, AUTECHAUX
25;GR GRANDE RUE, AUTECHAUX
25;RTE DE LUXIOL, AUTECHAUX
25;CHE DE LA PLAINE FIN, AUTECHAUX
25;RUE LE PRAHIER, AUTECHAUX
25;CHE DE LA ROCHE, AUTECHAUX
25;RTE DE ROUGEMONT, AUTECHAUX
25;CHE DE SONLAVELLE, AUTECHAUX
25;IMP SONLAVELLE, AUTECHAUX
25;RTE DE VERNE, AUTECHAUX
25;RUE VIE DE BAUME, AUTECHAUX
25;RUE HENRY BEAUDROIT, AUTECHAUX-ROIDE
25;ALL DE BLAMONT, AUTECHAUX-ROIDE
25;IMP DES CERISIERS, AUTECHAUX-ROIDE
25;RUE DU CHAR, AUTECHAUX-ROIDE
25;RUE DES CHAMPS, AUTECHAUX-ROIDE
25;RUE DU CHATEAU D EAU, AUTECHAUX-ROIDE
25;RUE DE CHARMOILLE, AUTECHAUX-ROIDE
25;RUE DE LA COMBE AUX EAUX, AUTECHAUX-ROIDE
25;RUE DE LA CROCHERE, AUTECHAUX-ROIDE
25;RUE DE L EGLISE, AUTECHAUX-ROIDE
25;CHE DES FAILEY, AUTECHAUX-ROIDE
25;PL DE LA FONTAINE, AUTECHAUX-ROIDE
25;GR GRANDE RUE, AUTECHAUX-ROIDE
25;RUE DU GRAND CHAMP, AUTECHAUX-ROIDE
25;RUE D HERIMONCOURT, AUTECHAUX-ROIDE
25;IMP DES JARDINS, AUTECHAUX-ROIDE
25;RUE DE L HUILERIE, AUTECHAUX-ROIDE
25;RUE DU LOMONT, AUTECHAUX-ROIDE
25;RUE DU LANDRY, AUTECHAUX-ROIDE
25;PL DU 19 MARS 1962, AUTECHAUX-ROIDE
