25;CHE DES MEULES, LABERGEMENT SAINTE MARIE
25;RUE DE LA MIELLERIE, LABERGEMENT SAINTE MARIE
25;CHE DU MONT DE LA CROIX, LABERGEMENT SAINTE MARIE
25;CHE DE L OMBRAGE, LABERGEMENT SAINTE MARIE
25;RUE DE MOUTHE, LABERGEMENT SAINTE MARIE
25;RUE DES PRES, LABERGEMENT SAINTE MARIE
25;RTE DE REMORAY, LABERGEMENT SAINTE MARIE
25;CHE DU RONDEAU, LABERGEMENT SAINTE MARIE
25;CHE DE SAINT THEODULE, LABERGEMENT SAINTE MARIE
25;CHEM DES ESSARTS, LABERGEMENT SAINTE MARIE
25;IMP COTTI, LABERGEMENT SAINTE MARIE
25;RUE DE L'EGLISE, LABERGEMENT SAINTE MARIE
25;RUE ALFRED MAIRE, LABERGEMENT SAINTE MARIE
25;RUE DERRIERE CHEZ SAGET, LABERGEMENT SAINTE MARIE
25;LOT LE NEUF CLOS, VILLERS LE LAC
25;RUE CURE PINOT, VILLERS LE LAC
25;RUE DES AUBEPINES, VILLERS LE LAC
25;RTE DU BARRAGE, VILLERS LE LAC
25;RUE DE BELLERIVE, VILLERS LE LAC
25;RUE DU PRE PUINAN, VILLERS LE LAC
25;RUE DU NEUF CLOS, VILLERS LE LAC
25;RTE DES FINS, VILLERS LE LAC
25;RUE BELLEVUE, VILLERS LE LAC
25;RUE RAYMOND BILLOD, VILLERS LE LAC
25;RUE DE SAINT EXUPERY, VILLERS LE LAC
25;RUE DU BOIS JOLI, VILLERS LE LAC
25;RUE DES BOUCHERIES, VILLERS LE LAC
25;VC BRACON, VILLERS LE LAC
25;RTE CHAUFFAUD, VILLERS LE LAC
25;RTE DES BRENETS, VILLERS LE LAC
25;RUE DU CAPITAINE RICHARDOT, VILLERS LE LAC
25;RUE DU CAPORAL PEUGEOT, VILLERS LE LAC
25;RUE DU CHANEY, VILLERS LE LAC
25;RTE DU CHAUFFAUD, VILLERS LE LAC
25;RUE DES CHALETS, VILLERS LE LAC
25;RUE CHAMP BOUVEROT, VILLERS LE LAC
25;RUE DU CHAMP DUROT, VILLERS LE LAC
25;RUE DE CHAMPAGNE, VILLERS LE LAC
25;RUE DES CHAMPS VAUCHEZ, VILLERS LE LAC
25;RUE DE LA CHAPELLE, VILLERS LE LAC
25;RUE DES CHARDONNERETS, VILLERS LE LAC
25;RUE DES CHATEAUX D EAU, VILLERS LE LAC
25;CHE DU CHATELARD, VILLERS LE LAC
25;RUE CLAUDE PINOT, VILLERS LE LAC
25;RTE DE LA CLOISON, VILLERS LE LAC
25;RUE DES CLOS RONDOT, VILLERS LE LAC
25;RUE DU COL, VILLERS LE LAC
25;RUE DE COMBE LA FEVE, VILLERS LE LAC
25;RUE DE LA COMBE AU ROY, VILLERS LE LAC
25;RTE DES COMBES, VILLERS LE LAC
25;RUE DES COTES, VILLERS LE LAC
25;IMP DES COTES, VILLERS LE LAC
25;RUE DE LA COTOTE, VILLERS LE LAC
25;RUE LA COURPEE, VILLERS LE LAC
25;RUE DE LA CROIX BLANCHE, VILLERS LE LAC
25;RUE DE CURCOL, VILLERS LE LAC
25;RUE DES CYGNES, VILLERS LE LAC
25;RUE DU DOCTEUR CHOFFEZ, VILLERS LE LAC
25;RUE DU DOUBS, VILLERS LE LAC
25;PL DROZ BARTHOLET, VILLERS LE LAC
25;RUE DE L EGLISE, VILLERS LE LAC
25;IMP DES EPICEAS, VILLERS LE LAC
25;RUE DE L ESSART AU CLAIR, VILLERS LE LAC
25;RUE DES ESSARTS, VILLERS LE LAC
25;RUE DES FAUVETTES, VILLERS LE LAC
25;RUE DE LA FORET, VILLERS LE LAC
25;RUE DU FOUGEOT, VILLERS LE LAC
25;RUE DU COL DE FRANCE, VILLERS LE LAC
25;RUE FRANCOIS BILLOD GIRARD, VILLERS LE LAC
25;RUE DE LA GARE, VILLERS LE LAC
25;RUE DES GEAIS, VILLERS LE LAC
25;RUE DES GELINOTTES, VILLERS LE LAC
25;RUE GEN DE GAULLE, VILLERS LE LAC
25;RUE DES GENEVRIERS, VILLERS LE LAC
25;CHE DES GENEVRIERS, VILLERS LE LAC
25;RUE DES GENTIANES, VILLERS LE LAC
25;CHE DE GOURDAVI, VILLERS LE LAC
25;RUE DE LA GRANDE OIE, VILLERS LE LAC
25;RUE DU TECHE, VILLERS LE LAC
25;RUE H PARRENIN, VILLERS LE LAC
25;RUE DES HERONS, VILLERS LE LAC
25;RUE DES HIRONDELLES, VILLERS LE LAC
25;RUE DE L HORLOGERIE, VILLERS LE LAC
25;CHEM DU SAUT DU DOUBS, VILLERS LE LAC
25;RUE DU HUIT MAI, VILLERS LE LAC
25;RUE DE L ILE, VILLERS LE LAC
25;RUE JACQUES CARTIER, VILLERS LE LAC
25;RUE CAMILLE JORIOT, VILLERS LE LAC
25;RUE DU LAC, VILLERS LE LAC
25;RUE DES LAZINES, VILLERS LE LAC
25;RTE DES MAJORS, VILLERS LE LAC
25;RUE DES PATURAGES, VILLERS LE LAC
25;RUE MARECHAL DE LATTRE, VILLERS LE LAC
25;RUE MARECHAL FOCH, VILLERS LE LAC
25;RUE MARECHAL JUIN, VILLERS LE LAC
25;RUE MARECHAL LECLERC, VILLERS LE LAC
25;RUE DES MURGERS, VILLERS LE LAC
25;RUE DES MYRTILLES, VILLERS LE LAC
25;RUE NESTOR BAVOUX, VILLERS LE LAC
25;RUE JEAN MERMOZ, VILLERS LE LAC
25;PL MAXIME CUPILLARD, VILLERS LE LAC
25;RUE DES MESANGES, VILLERS LE LAC
25;RUE DU MUSEE, VILLERS LE LAC
25;RTE NATIONALE, VILLERS LE LAC
25;RUE NEWTON, VILLERS LE LAC
25;RUE DES NOISETIERS, VILLERS LE LAC
25;RUE NOTRE DAME DES NEIGES, VILLERS LE LAC
25;RUE PASTEUR, VILLERS LE LAC
25;CHE DE LA PATUROTE, VILLERS LE LAC
25;RUE PAUL MOUTARLIER, VILLERS LE LAC
25;RUE DES PERCE NEIGE, VILLERS LE LAC
25;RUE DE LA PERRIERE, VILLERS LE LAC
25;RUE PIERRE BERCOT, VILLERS LE LAC
25;RUE DES PINSONS, VILLERS LE LAC
25;CHE DES POMMIERS, VILLERS LE LAC
25;RUE DU PONT DU DIABLE, VILLERS LE LAC
25;RTE DU PORT, VILLERS LE LAC
25;CHE DU PRE NOEL, VILLERS LE LAC
25;RUE QUARTIER BELLEVUE, VILLERS LE LAC
25;RUE DU QUARTIER NEUF, VILLERS LE LAC
25;IMP DU RANG, VILLERS LE LAC
25;RUE DU REC, VILLERS LE LAC
25;RUE DES ROCHES, VILLERS LE LAC
25;RUE DES ROUGES GORGES, VILLERS LE LAC
25;GR GRANDE RUE, VILLERS LE LAC
25;RUE SAINT JEAN, VILLERS LE LAC
25;PL SAINT JEAN, VILLERS LE LAC
25;RUE DES SAPINS, VILLERS LE LAC
25;RUE DES SORBIERS, VILLERS LE LAC
25;RUE DU SOLEIL COUCHANT, VILLERS LE LAC
25;RUE DE LA SOURCE, VILLERS LE LAC
25;RUE DU SOUVENIR FRANCAIS, VILLERS LE LAC
25;RUE DU STADE, VILLERS LE LAC
25;IMP DES SEIGNOTTES, VILLERS LE LAC
25;RUE DES SUREAUX, VILLERS LE LAC
25;RUE DU TEMPLE, VILLERS LE LAC
25;RUE DES TERRES ROUGES, VILLERS LE LAC
25;CHE DU TILLEUL, VILLERS LE LAC
25;CHE DES TROUES DES BARRAQUES, VILLERS LE LAC
25;RUE ULYSSE ANGUENOT, VILLERS LE LAC
25;RUE DE LA VAUTHIERE, VILLERS LE LAC
25;RUE VERDAN, VILLERS LE LAC
25;RUE DE VERDUN, VILLERS LE LAC
25;RUE DES VERGERS, VILLERS LE LAC
25;RUE DES VIEUX PARGOTS, VILLERS LE LAC
25;RUE VIRGILE CUPILLARD, VILLERS LE LAC
25;RUE DES MEANDRES, VILLERS LE LAC
25;IMP DES ROSEAUX, VILLERS LE LAC
25;RUE ALAIN COLAS, VILLERS LE LAC
25;RUE JACQUES YVES COUSTEAU, VILLERS LE LAC
25;RUE DES ALOUETTES, VILLERS LE LAC
25;RUE BOIS DE BAN, VILLERS LE LAC
25;RUE CLAUDE VERMOT, VILLERS LE LAC
25;IMP BELLEVUE, LAIRE
25;IMP DES CHAMPS, LAIRE
25;IMP DU CHENOIS, LAIRE
25;RUE DU CIMETIERE, LAIRE
25;CHE DU COMMUNAL, LAIRE
25;RUE DES CRETS, LAIRE
25;CHE DES CROSOTTES, LAIRE
25;RUE DE LA FONTAINE, LAIRE
25;RUE DU GRAND BOIS, LAIRE
25;GR GRANDE RUE, LAIRE
25;CHE DES GRANDS CHAMPS, LAIRE
25;RTE D'ISSANS, LAIRE
25;PL DE LA MAIRIE, LAIRE
25;CHEM AUX PAIGRES, LAIRE
25;RUE DE LA PRAIRIERE, LAIRE
25;RUE DU PRE AUX CHENES, LAIRE
25;RUE AU PRESSEY, LAIRE
25;RUE DE LA RUOTTE, LAIRE
25;RTE DE TAVEY, LAIRE
25;RUE DE TREMOINS, LAIRE
25;RUE DE VERLANS, LAIRE
25;RUE DE VYANS LE VAL, LAIRE
25;LOT LES VIGNES GAUTROD, LAISSEY
25;RUE DU MAROC, LAISSEY
25;RUE DU BIEF, LAISSEY
25;IMP DU BREUILLE, LAISSEY
25;RUE DE LA CHAPELLE, LAISSEY
25;RUE DU CHATEAU, LAISSEY
25;RUE VIGNES COGNARD, LAISSEY
25;RTE DE DELUZ, LAISSEY
25;IMP DES DOCKS, LAISSEY
25;RUE ELYSEE BOST, LAISSEY
25;RUE DE LA FONTAINE, LAISSEY
25;GR GRANDE RUE, LAISSEY
25;CHE DES JARDINS, LAISSEY
25;IMP MALLE PLANCHES, LAISSEY
25;RUE DES MUROTS, LAISSEY
25;RUE DU PORT DE BARQUES, LAISSEY
25;RUE DE SOUS VANCE, LAISSEY
25;RUE VIGNES FREMY, LAISSEY
25;HAB VIE DE SERVIN, LANANS
25;RUE DU CHAMP REBOUTE, LANANS
25;RUE DE LA COMBE D'OR, LANANS
25;RUE DE L'ECOLE, LANANS
25;RUE DE LA FROMAGERIE, LANANS
25;GR GRANDE RUE, LANANS
25;RUE DE LA MAIRIE, LANANS
25;RTE DE MONTIVERNAGE, LANANS
25;RTE D OUVANS, LANANS
25;RUE DU RESERVOIR, LANANS
25;CHE DU TERRAIL, LANANS
25;CHE VIE DE SERVIN, LANANS
25;RUE DES TILLEULS, LANANS
25;RUE DE LA BASCULE, LANDRESSE
25;RUE DES CHEMINEES, LANDRESSE
25;RUE CLOS LAJOUX, LANDRESSE
25;RUE DE LA COTE, LANDRESSE
25;RUE DES GOULOTTES, LANDRESSE
25;RUE DES ECHELOTTES, LANDRESSE
25;RUE DE L EGLISE, LANDRESSE
25;RUE LES FAUBOURGS, LANDRESSE
25;GR GRANDE RUE, LANDRESSE
25;RTE D ORSANS, LANDRESSE
25;RTE DE PIERREFONTAINE, LANDRESSE
25;PL LOUIS PERGAUD, LANDRESSE
25;RUE DE LA PETITE COTE, LANDRESSE
25;RUE LES PRES DE LA VIE, LANDRESSE
25;RUE DES SOURCES, LANDRESSE
25;IMP DES VERNOIS, LANDRESSE
25;CHE DES AGEOTTES, LANTENNE VERTIERE
25;CHE DES AGES, LANTENNE VERTIERE
25;CHE DE BEAUREGARD, LANTENNE VERTIERE
25;RTE DES CHARMES, LANTENNE VERTIERE
25;RUE DU CHARMOT, LANTENNE VERTIERE
25;CHE DU CHATEAU, LANTENNE VERTIERE
25;RUE DE LA CITADELLE, LANTENNE VERTIERE
25;RUE DE L ECOLE, LANTENNE VERTIERE
25;RUE DE L EGLISE, LANTENNE VERTIERE
25;CHE DE LA FORGE, LANTENNE VERTIERE
25;GR GRANDE RUE, LANTENNE VERTIERE
25;CHE DU GUILLOT, LANTENNE VERTIERE
25;RUE DE L LUE, LANTENNE VERTIERE
25;RUE DE LA MAIRIE, LANTENNE VERTIERE
25;CHE DU RENAUDIN, LANTENNE VERTIERE
25;CHE DU SAUBANIOT, LANTENNE VERTIERE
25;RUE DE LA TUILERIE, LANTENNE VERTIERE
25;PL DE L'ABBAYE, LANTHENANS
25;RUE DE L'EGLISE, LANTHENANS
25;IMP DES GOUTHERYS, LANTHENANS
25;CHEM DES GRANDS VIES, LANTHENANS
25;GR GRANDE RUE, LANTHENANS
25;IMP VIE DE BERMONT, LANTHENANS
25;LOT BELLEVUE, LARNOD
25;CLOS DE LA DILIGENCE, LARNOD
25;LOT AU CRAIT, LARNOD
25;LOT SAUCENET, LARNOD
25;RTE DE BUSY, LARNOD
25;CHE DES COMBES, LARNOD
25;IMP DE LA COMBE, LARNOD
25;CHE DU  COUTARD  RAGOT, LARNOD
25;CHE DE LA COUTOTTE, LARNOD
25;IMP AU COUTARD, LARNOD
25;CHE DU CRAIT, LARNOD
25;RUE DU CRAIT, LARNOD
25;RUE DE LA DILIGENCE, LARNOD
25;RUE DES FINS DU VERGER, LARNOD
25;CHE DE LA FONTAINE, LARNOD
25;RTE DE LA GARE, LARNOD
25;CHE DE LA GRATTE, LARNOD
25;CHEM RURAL DIT DE GRATTERY, LARNOD
25;CHE DE LA GRIVOLEE, LARNOD
25;RTE DE LA MALTOURNEE, LARNOD
25;ESP MARTHE DAGOT, LARNOD
25;CHE DES MONTARDS, LARNOD
25;CHE NEUF, LARNOD
25;RTE NATIONALE, LARNOD
25;CHE DES PIERRES, LARNOD
25;RTE DE PUGEY, LARNOD
25;CHE DU REPOS, LARNOD
25;PL DE LA RESISTANCE, LARNOD
25;CHE SUR LA ROCHE, LARNOD
25;CHE DU ROCHER DE VALMY, LARNOD
25;RTE ROYALE, LARNOD
25;IMP SAINT JEAN, LARNOD
25;IMP SAINT LOUIS, LARNOD
25;CHE DES SAPINS, LARNOD
25;IMP SAUCENET, LARNOD
25;CHE DES VIGNES, LARNOD
25;RTE DU VILLAGE, LARNOD
25;LOT DERRIERE LES VERGERS, LAVANS QUINGEY
25;LOT SUR LA ROCHE, LAVANS QUINGEY
25;CHE DE LA CHAUX, LAVANS QUINGEY
25;RUE DU FOUR, LAVANS QUINGEY
25;RUE DE LA LAVANDIERE, LAVANS QUINGEY
25;RUE DE LAVAUX, LAVANS QUINGEY
25;RUE DE LA MAIRIE, LAVANS QUINGEY
25;N ROUTE NATIONALE, LAVANS QUINGEY
25;RUE DES PALOUSES, LAVANS QUINGEY
25;RUE DES PLANCHES, LAVANS QUINGEY
25;RUE DU PUITS, LAVANS QUINGEY
25;RTE DE QUINGEY, LAVANS QUINGEY
25;IMP DU RANG, LAVANS QUINGEY
25;RUE SUR LA ROCHE, LAVANS QUINGEY
25;RUE DES VERGERS, LAVANS QUINGEY
25;LOT LA CHANTRE, LAVANS-VUILLAFANS
25;HAB LE RONDEAU, LAVANS-VUILLAFANS
25;RUE DES ABEILLES, LAVANS-VUILLAFANS
25;RUE BERNARD BEZ, LAVANS-VUILLAFANS
25;IMP DE LA CHANTRE, LAVANS-VUILLAFANS
25;RUE DE LA CHARME, LAVANS-VUILLAFANS
25;RUE CLOS LA SAUCE, LAVANS-VUILLAFANS
25;CHEM DES CLOS RONDS, LAVANS-VUILLAFANS
25;GR GRANDE RUE, LAVANS-VUILLAFANS
25;CHEM NEUF, LAVANS-VUILLAFANS
25;CHE DE PALOT, LAVANS-VUILLAFANS
25;RUE DU PETIT COIN, LAVANS-VUILLAFANS
25;RUE DU REPOS, LAVANS-VUILLAFANS
25;RUE DE LA RIOTTE, LAVANS-VUILLAFANS
25;CHEM DES CLOS RONDOT, LAVANS-VUILLAFANS
25;RUE DU STADE, LAVANS-VUILLAFANS
25;RUE DES TILLEULS, LAVANS-VUILLAFANS
25;RUE DU RONDOT, LAVANS-VUILLAFANS
25;LOT LES GRANDES FOSSES, LAVERNAY
25;LOT LE BOUTO, LAVERNAY
25;PL DE BOUTO, LAVERNAY
25;CHE DE BEVEAU, LAVERNAY
25;PL DU BREUIL, LAVERNAY
25;RUE DU BOCHET, LAVERNAY
25;PL DU CHALET, LAVERNAY
25;RUE DE LA CERISERAIE, LAVERNAY
25;RUE DE L EGLISE, LAVERNAY
25;RUE DE LA CHENAURIE, LAVERNAY
25;CHE DU CROTO, LAVERNAY
25;RUE DE LA FONTAINE, LAVERNAY
25;CHE DE LA FONTAINE, LAVERNAY
25;RUE DE LA FONTENELLE, LAVERNAY
25;CHE FONTENELLE, LAVERNAY
25;RUE DES GRANDES FOSSES, LAVERNAY
25;RLE DES GRANDES FOSSES, LAVERNAY
25;RUE DE CROVEY, LAVERNAY
25;RUE DE LA GRAPILLE, LAVERNAY
25;RUE DES CHARMILLES, LAVERNAY
25;RUE DE MARNAY, LAVERNAY
25;RUE DE LA MOUSSE, LAVERNAY
25;RTE DE PLACEY, LAVERNAY
25;CHE DE PREFERRUE, LAVERNAY
25;RUE DE PRELE, LAVERNAY
25;IMP DES RAPPES, LAVERNAY
25;CHE DES RAPPES, LAVERNAY
25;RUE ROUGEOLE, LAVERNAY
25;CHE DE ROUGEOLLE, LAVERNAY
25;RUE DE SAINT VIT, LAVERNAY
25;CHE SALOU, LAVERNAY
25;RTE DE CORCONDRAY, LAVERNAY
25;RUE DE LA SOURCE, LAVERNAY
25;RUE DES VERGERS DU BOUTO, LAVERNAY
25;RLE DES VERGERS DE BOUTO, LAVERNAY
25;LOT LES JONQUILLES, LAVIRON
25;RTE DES BOULOIES, LAVIRON
25;RUE DE LA CASSINE, LAVIRON
25;RUE DE LA CORVEE, LAVIRON
25;RUE DE LA FONTAINE, LAVIRON
25;RUE DE LA FAYE, LAVIRON
25;RTE DE LA FAYE, LAVIRON
25;RUE DE SOUS LA FAYE, LAVIRON
25;RUE MONCLAR, LAVIRON
25;RUE DU FRENE, LAVIRON
25;RUE DES JARDINS, LAVIRON
25;RUE DES JONQUILLES, LAVIRON
25;RTE DE LA JOUX, LAVIRON
25;RUE DE LANDRESSE, LAVIRON
25;RTE DE LANDRESSE, LAVIRON
25;RTE D ORMONT, LAVIRON
25;RTE DU MORTEY, LAVIRON
25;IMP DE LA MAIRIE, LAVIRON
25;RUE DU PETIT LAVIRON, LAVIRON
25;RUE DU MOUREY, LAVIRON
25;RUE DU PEU, LAVIRON
25;RUE DE LA ROCHETTE, LAVIRON
25;RUE DES ROUTES, LAVIRON
25;RUE DU SAUCET, LAVIRON
25;IMP DU SAUCET, LAVIRON
25;RUE DE LA SALLE DES FETES, LAVIRON
25;RUE DE SOUS LE BOIS, LAVIRON
25;RUE DE LA TANNERIE, LAVIRON
25;RUE DES PRES, LAVIRON
25;RUE DU VERNOIS, LAVIRON
25;LOT DE LA COTE, LEVIER
25;RUE DE L ALLIER, LEVIER
25;RUE LAUBERCHOT, LEVIER
25;RUE DE BESANCON, LEVIER
25;RUE MADELEINE BOUSSON, LEVIER
25;RUE BUISSONNIERE, LEVIER
25;PL BUGNET, LEVIER
25;RUE CHAMPS BEGAUD, LEVIER
25;IMP DU CAROUGE, LEVIER
25;RUE DE CHAMPAGNOLE, LEVIER
25;RUE DES CHAUMELLES, LEVIER
25;IMP DES CHANGIERES, LEVIER
25;RUE DE CHAPELLE D HUIN, LEVIER
25;RUE DES CLARINES, LEVIER
25;IMP CLOS ST CLAUDE, LEVIER
25;RUE DU COUCHANT, LEVIER
25;RUE DU CRET, LEVIER
25;PL CRETIN, LEVIER
25;RUE DU DEUIL, LEVIER
25;IMP DU LEVANT, LEVIER
25;RUE DE LA DOLINE, LEVIER
25;RUE DE LA DOUET, LEVIER
25;CHE DES EGLANTIERS, LEVIER
25;PL DE L EGLISE, LEVIER
25;ALL DES EPICEAS, LEVIER
25;RUE DE LA GARE, LEVIER
25;RUE DES GENEVRIERS, LEVIER
25;RTE DE GRANGES MAILLOT, LEVIER
25;RUE DES FAUVETTES, LEVIER
25;RUE DU GENERAL DE GAULLE, LEVIER
25;RUE DES GENTIANES, LEVIER
25;RUE GUSTAVE COURBET, LEVIER
25;ALL DES JONQUILLES, LEVIER
25;RUE DE LA LIBERATION, LEVIER
25;RUE DE LA LOUVIERE, LEVIER
25;RUE MAURICE DEBOIS, LEVIER
25;RUE DU MONT, LEVIER
25;RUE DES MESANGES, LEVIER
25;RUE DE LA MOTTE, LEVIER
25;RUE DU LEVANT, LEVIER
25;IMP DES LOCAUX, LEVIER
25;RUE DES HIRONDELLES, LEVIER
25;RUE DU MOUTET, LEVIER
25;RUE PASTEUR, LEVIER
25;IMP DU PRADO, LEVIER
25;IMP DU GRAVIER, LEVIER
25;RUE CHARLES NICOD, LEVIER
25;RUE NOTRE DAME, LEVIER
25;RUE DE LA NUE, LEVIER
25;RUE DES PAQUERETTES, LEVIER
25;RUE DE LA PETITE COTE, LEVIER
25;RUE DE LA PERRIERE, LEVIER
25;RUE DU PLANE, LEVIER
25;RUE DE PONTARLIER, LEVIER
25;RUE DES PRAIRIES, LEVIER
25;RUE DU ROCHERET, LEVIER
25;RUE ALEXIS ROUSSET, LEVIER
25;RUE DE SALINS, LEVIER
25;IMP LA SAPINIERE, LEVIER
25;RUE DES SAPINS, LEVIER
25;RUE DE SEPTFONTAINE, LEVIER
25;RUE SIMONE VEIL, LEVIER
25;RUE DU STADE, LEVIER
25;RUE DU TACOT, LEVIER
25;RUE DES TILLEULS, LEVIER
25;IMP DU TREIZE MAI 1958, LEVIER
25;IMP DE LA TILLETTE, LEVIER
25;RUE DE TRAVERSE, LEVIER
25;RUE DES TULIPES, LEVIER
25;PL DE VERDUN, LEVIER
25;RUE VICTOR HUGO, LEVIER
25;RUE DE VUILLAFANS, LEVIER
25;RUE DE DESERVILLERS, LEVIER
25;RUE DU CURTIL MOULIN, LEVIER
25;RUE DE L EGLISE, LEVIER
25;RUE DE L ETANG, LEVIER
25;GR GRANDE RUE, LEVIER
25;RUE DU HAUT, LEVIER
25;RUE DU SAUSSET, LEVIER
25;RUE DE LA VIE, LEVIER
25;CHE DES AGES, LEVIER
25;RUE DE LA SAUCE, LEVIER
25;RTE DE LA CASCADE, LIEBVILLERS
25;IMP DU MOULIN, LIEBVILLERS
25;RTE DES FONTAINES, LIEBVILLERS
25;IMP LA RIOTTE, LIEBVILLERS
25;RTE DE CHATILLON, LIEBVILLERS
25;CHE DE LA CHARRIERE, LIEBVILLERS
25;CHE DES EUCHES, LIEBVILLERS
25;PL DU 19 AOUT 1944, LIEBVILLERS
25;RUE DU BISONTIN, LIEBVILLERS
25;LOT AU VILLAGE, LIESLE
25;RUE DE L ARBORETUM, LIESLE
25;RUE DES ARTISANS, LIESLE
25;RUE DE L AVENIR, LIESLE
25;RTE DE BUFFARD, LIESLE
25;RUE DE BOURG SEC, LIESLE
25;RUE DE BUFFARD, LIESLE
25;RUE DU CHAMP  DE LA RAYE, LIESLE
25;CHE DE LA CAILLETTE, LIESLE
25;RUE CHARLES DORNIER, LIESLE
25;RUE DES CHAILLES, LIESLE
25;RUE DES CREUX BOULIS, LIESLE
25;CHEM DE LA COMBE FANEY, LIESLE
25;RUE DE DOLE, LIESLE
25;RUE DE LA DOUMANGE, LIESLE
25;RUE DE LA FASSURE, LIESLE
25;RLE FRIPAPA, LIESLE
25;RUE FELIX GAFFIOT, LIESLE
25;CHE DE LA GARE, LIESLE
25;RUE DES GRANDS TERREAUX, LIESLE
25;RUE DE LA GARE, LIESLE
25;RUE DES GRANDS VERGERS, LIESLE
25;RUE DE LA LOUVOTIERE, LIESLE
25;RUE DE LA LUE, LIESLE
25;CHE DE MESMAY, LIESLE
25;RUE DU NORD, LIESLE
25;CHE DU PEU, LIESLE
25;RUE DES PETITS TERREAUX, LIESLE
25;PL DE LA PLANCHOTTE, LIESLE
25;RUE DE LA PLANCHOTTE, LIESLE
25;RLE DE LA PUCINE, LIESLE
25;PL ST ETIENNE, LIESLE
25;RUE DES TERREAUX, LIESLE
25;RUE DES TILLEULS, LIESLE
25;CHE DE VOITEY, LIESLE
25;CHE DE SAUMON, LIESLE
25;CHEM DE LA FENOTTE, LIESLE
25;ALL DES CAMPANULES, LIESLE
25;CHE DE LA COMTESSE, LIESLE
25;ALL DES EGLANTINES, LIESLE
25;ALL DES IRIS, LIESLE
25;ALL DES SAUGES, LIESLE
25;CHE DIT DE BARCHET, LIZINE
25;RUE DE LA CHARRIERE, LIZINE
25;RUE DE L'EGLISE, LIZINE
25;RUE GLORIA, LIZINE
25;RUE GRANDE RUE, LIZINE
25;RUE DU MOULIN, LIZINE
25;RUE DE SIMOLIERE, LIZINE
25;RUE DE LA TENDUE, LIZINE
25;LOT LA RAPPE, LODS
25;RUE AMBROISE ROY, LODS
25;RTE D ATHOSE, LODS
25;RTE DE BESANCON, LODS
25;RUE DU BIEF POUTOT, LODS
25;RUE DU BOUT D EN HAUT, LODS
25;PL DU BOUT DU PONT, LODS
25;RUE DU CHATEAU, LODS
25;RUE COMMANDANT VUILLEMIN, LODS
25;RUE DE L EGLISE, LODS
25;CHE DES FORGES, LODS
25;RUE DE JAUBOURG, LODS
25;RUE LANCRENON, LODS
25;PL PEZARD, LODS
25;RUE SUR LA PLACE, LODS
25;RUE DE REINE, LODS
25;RUE ROTE, LODS
25;RUE DE LA VIERGE, LODS
25;RUE DU BAS, LOMBARD
25;RUE BASSE, LOMBARD
25;CHE CHATAILLON, LOMBARD
25;CHE DE LA CHAUX, LOMBARD
25;RUE DE LA FONTAINE, LOMBARD
25;RUE DU FOUR, LOMBARD
25;VC GRANDE RUE, LOMBARD
25;CHE DE  GALVAUX, LOMBARD
25;CHEM DE L HAYER, LOMBARD
25;RUE DES JARDINS, LOMBARD
25;RUE AU MAIRE, LOMBARD
25;CHE DE MESMERAY, LOMBARD
25;RUE DE LA RIOTTE, LOMBARD
25;RUE DE TRAVERSE, LOMBARD
25;CHE DES VIGNES, LOMBARD
25;RUE VINCENT, LOMBARD
25;RUE DES ACACIAS, LOMONT SUR CRETE
25;RUE DU BOIS JOLI, LOMONT SUR CRETE
25;RUE DU CHATEAU D EAU, LOMONT SUR CRETE
25;RUE DE L EGLISE, LOMONT SUR CRETE
25;GR GRANDE RUE, LOMONT SUR CRETE
25;RUE DE LA LIBERTE, LOMONT SUR CRETE
25;PL DE LA MAIRIE, LOMONT SUR CRETE
25;RUE DE L ORATOIRE, LOMONT SUR CRETE
25;RUE DE LA STATION, LOMONT SUR CRETE
25;RUE DE SURFER, LOMONT SUR CRETE
25;RTE DE SURFER, LOMONT SUR CRETE
25;RTE DU VAL, LOMONT SUR CRETE
25;RUE DU VAL DE CUSANCE, LOMONT SUR CRETE
25;RUE DE LA FOYOTTE, LONGECHAUX
25;RUE GRANDE, LONGECHAUX
25;RTE DE LORAY, LONGECHAUX
25;LOT DE LA GARE, LONGEMAISON
25;RUE DU BOIS JEANNOT, LONGEMAISON
25;RTE DU CHAUMONT, LONGEMAISON
25;RTE DES CLOCHETTES, LONGEMAISON
25;RTE DU CLOS CHALET, LONGEMAISON
25;RUE DU CLOS DEVANT, LONGEMAISON
25;IMP DE LA COMBE AU BARBIER, LONGEMAISON
25;IMP DU COTARD, LONGEMAISON
25;PL DE L EGLISE, LONGEMAISON
25;RTE DE GILLEY, LONGEMAISON
25;RTE DU MOULIN, LONGEMAISON
25;CHE DE LA PATUROTTE, LONGEMAISON
25;RTE DU PRE CHOUARD, LONGEMAISON
25;IMP DU SORBIER, LONGEMAISON
25;PL DES TILLEULS, LONGEMAISON
25;CHEM DU VERNOIS, LONGEMAISON
25;CHE DE BLAGNIERE, LONGEVELLE-LES-RUSSEY
25;RUE DE LA CARRIERE, LONGEVELLE-LES-RUSSEY
25;RUE DU CHALET, LONGEVELLE-LES-RUSSEY
25;RUE DU CLOS ROUGEOT, LONGEVELLE-LES-RUSSEY
25;CHE DU CREUX DE HAUTE ROCHE, LONGEVELLE-LES-RUSSEY
25;RUE FRANCOIS DUSSAUD, LONGEVELLE-LES-RUSSEY
25;RUE DES GENEVRIERS, LONGEVELLE-LES-RUSSEY
25;CHEM JACOB, LONGEVELLE-LES-RUSSEY
25;RUE DES JARDINS, LONGEVELLE-LES-RUSSEY
25;CHE ST JOSEPH, LONGEVELLE-LES-RUSSEY
25;PL DU LAVOIR, LONGEVELLE-LES-RUSSEY
25;RUE RECEVEUR, LONGEVELLE-LES-RUSSEY
25;IMP DU TARTRE, LONGEVELLE-LES-RUSSEY
25;RUE DU TILLEUL, LONGEVELLE-LES-RUSSEY
25;CHE DE LA VELLE, LONGEVELLE-LES-RUSSEY
25;LOT DES CORNEILLES, LONGEVELLE SUR DOUBS
25;LOT DES COTEAUX, LONGEVELLE SUR DOUBS
25;IMP DES ACACIAS, LONGEVELLE SUR DOUBS
25;RTE DE BEUTAL, LONGEVELLE SUR DOUBS
25;RUE DU CHANOIS, LONGEVELLE SUR DOUBS
25;RUE DU CHATEAU D EAU, LONGEVELLE SUR DOUBS
25;RUE DU CHATELOT, LONGEVELLE SUR DOUBS
25;RUE DES COMBES, LONGEVELLE SUR DOUBS
25;RUE DE LA COUR, LONGEVELLE SUR DOUBS
25;RUE COURVOISIER, LONGEVELLE SUR DOUBS
25;RUE DES ECOLES, LONGEVELLE SUR DOUBS
25;RUE DE LA LOUVIERE, LONGEVELLE SUR DOUBS
25;RUE DU MOULIN, LONGEVELLE SUR DOUBS
25;RUE DU TEMPLE, LONGEVELLE SUR DOUBS
25;RUE DES VIGNES, LONGEVELLE SUR DOUBS
25;RUE DES COTEAUX, LONGEVELLE SUR DOUBS
25;RUE DU COTENTIN, LONGEVELLE SUR DOUBS
25;IMP DES CORNEILLES, LONGEVELLE SUR DOUBS
25;RUE DES ROUSSEAUX, LONGEVELLE SUR DOUBS
25;GR GRANDE RUE, LONGEVELLE SUR DOUBS
25;IMP DES PERRIERES, LONGEVELLE SUR DOUBS
25;IMP DES PRES ABRY, LONGEVELLE SUR DOUBS
25;CHE DES RETTEUX, LONGEVELLE SUR DOUBS
25;RUE DES TRIMOULOTS, LONGEVELLE SUR DOUBS
25;RUE DES ROUGES TERRES, LONGEVELLE SUR DOUBS
25;RUE DE LA VIE D'AMBRE, LONGEVELLE SUR DOUBS
25;LOT LES CRAIES, LONGEVILLE
25;RUE DU CHALET, LONGEVILLE
25;RUE DU CHATEAU, LONGEVILLE
25;RUE DE L ECOLE, LONGEVILLE
25;RUE DE L EGLISE, LONGEVILLE
25;RUE DE LA FORGE, LONGEVILLE
25;RUE DE FOUGERIS, LONGEVILLE
25;GR GRANDE RUE, LONGEVILLE
25;RUE DE LA PITIE, LONGEVILLE
25;RUE DE LA SOURCE, LONGEVILLE
25;RUE DU STADE, LONGEVILLE
25;RUE DU VALLON, LONGEVILLE
25;RUE DES VERGERS, LONGEVILLE
25;LOT A LA CLOISON, LA LONGEVILLE
25;RUE DE L'ADRET, LA LONGEVILLE
25;RTE DE BASSIGNET, LA LONGEVILLE
25;RUE DE BELLE VUE, LA LONGEVILLE
25;RTE DES CHALETS, LA LONGEVILLE
25;RTE DE LA CHAUX, LA LONGEVILLE
25;RTE DU COIN DU BOIS, LA LONGEVILLE
25;CHE DES COURTOTS, LA LONGEVILLE
25;RUE DU CLOS AUX ROUX, LA LONGEVILLE
25;RUE ENTRE DEUX VILLES, LA LONGEVILLE
25;RUE LA GARE, LA LONGEVILLE
25;RTE DE GILLEY, LA LONGEVILLE
25;RTE DE MONTBENOIT, LA LONGEVILLE
25;CHE CHEZ NOEL, LA LONGEVILLE
25;CHE DES PRES VUILLINS, LA LONGEVILLE
25;CHE DES ROCHES, LA LONGEVILLE
25;RUE LE TRAJE, LA LONGEVILLE
25;RTE DE VILLE DU PONT, LA LONGEVILLE
25;RTE DES COMBES, LA LONGEVILLE
25;RUE DE LA CROIX DES BARRES, LA LONGEVILLE
25;RUE DU COMMUNAL DES COURTOTS, LA LONGEVILLE
25;RUE DE L ANCHOT, LONGEVILLES-MONT-D OR
25;RUE DU BIEF BLANC, LONGEVILLES-MONT-D OR
25;RUE DU CENTRE, LONGEVILLES-MONT-D OR
25;RUE DE LA COMBE, LONGEVILLES-MONT-D OR
25;RUE DU COUSSON, LONGEVILLES-MONT-D OR
25;RUE DU CRET, LONGEVILLES-MONT-D OR
25;RUE DE LA CROIX, LONGEVILLES-MONT-D OR
25;RUE DU DOUBS, LONGEVILLES-MONT-D OR
25;RUE DE L ETOILE, LONGEVILLES-MONT-D OR
25;CHE DE LA FORGE, LONGEVILLES-MONT-D OR
25;RUE DE LA GARE, LONGEVILLES-MONT-D OR
25;RTE PRINCIPALE, LONGEVILLES-MONT-D OR
25;RUE DU LEVANT, LONGEVILLES-MONT-D OR
25;RUE DU PONT, LONGEVILLES-MONT-D OR
25;RUE DU PONT BOIS, LONGEVILLES-MONT-D OR
25;RTE DE PONTARLIER, LONGEVILLES-MONT-D OR
25;RUE DE LA POUDRIERE, LONGEVILLES-MONT-D OR
25;CHE DU RESERVOIR, LONGEVILLES-MONT-D OR
25;RUE DE LA SABLIERE, LONGEVILLES-MONT-D OR
25;IMP DES CHAMPS DE LA PAULE, LONGEVILLES-MONT-D OR
25;CHEM DES GRANDS CHAMPS, LONGEVILLES-MONT-D OR
25;RUE DE L ABBE LANDRY, LORAY
25;RUE DES AGES DE LORAY, LORAY
25;RUE DU  BAS DES AGES, LORAY
25;RUE DU CALVAIRE, LORAY
25;RUE DES CHAMPS MACHOTS, LORAY
25;RUE DE L EGLISE, LORAY
25;RUE DE L ETANG, LORAY
25;RUE DE LA FONTAINE RONDE, LORAY
25;RUE DU FOURNEY, LORAY
25;RUE DU CLOS GIRARDOT, LORAY
25;GR GRANDE RUE, LORAY
25;RUE DU LAVOIR, LORAY
25;RUE DE LA MAIRIE, LORAY
25;RUE DU PUITS DE CIVAL, LORAY
25;RUE DE LA JOUX, LORAY
25;RUE DES ROCHES, LORAY
25;RUE DE LA ROCHE BARCHEY, LORAY
25;RUE DE LA RUINE, LORAY
25;CHEM DES ARGILLETS, LOUGRES
25;RUE DE BEAUSOLEIL, LOUGRES
25;RUE DU BOIS JOLI, LOUGRES
25;RUE DE LA BONNE FONTAINE, LOUGRES
25;RUE DES CHAMPS MARQUIS, LOUGRES
25;RUE DU  CHENOIS, LOUGRES
25;RUE DU CHESAL, LOUGRES
25;RUE DE LA COMBASLE, LOUGRES
25;RUE DE LA COMBE DU DOUBS, LOUGRES
25;RUE DE L EPINE, LOUGRES
25;AV DES GRANDS BOIS, LOUGRES
25;CC LOUGRES STEMARIE, LOUGRES
25;RUE DE LA MIRE, LOUGRES
25;RUE DE MONTBELIARD, LOUGRES
25;RUE DE MONTENOIS, LOUGRES
25;RUE DES OICHES, LOUGRES
25;RUE DU PARADIS, LOUGRES
25;RUE DU PONT DE CLOS, LOUGRES
25;RUE DE LA ROCHETTE, LOUGRES
25;RUE EN ROMBOIS, LOUGRES
25;RUE DE SAINTE MARIE, LOUGRES
25;RUE SOUS GIEMONT, LOUGRES
25;RUE SAINTE MARIE, LOUGRES
25;RUE DU TENNIS, LOUGRES
25;RUE DE VERDEZ, LOUGRES
25;RUE DE VUILLEGAUX, LOUGRES
25;RUE GRANDE, LUHIER (LE)
25;RUE DU PONT, LUHIER (LE)
25;RUE DU SACRE COEUR, LUHIER (LE)
25;RUE DE SAINT HUBERT, LUHIER (LE)
25;CHEM DES 4 VENTS, LUHIER (LE)
25;RTE DE BAUME, LUXIOL
25;RUE DU CENTRE, LUXIOL
25;RUE DU CHALET, LUXIOL
25;RUE DES CHAMPS, LUXIOL
25;RUE DE LA COTE, LUXIOL
25;RUE DE LA FORGE, LUXIOL
25;PL DE LA MAIRIE, LUXIOL
25;CHE DU MENINPRE, LUXIOL
25;RUE DE LA POSTE, LUXIOL
25;RUE PRINCIPALE, LUXIOL
25;RUE DES PRES, LUXIOL
25;RTE DE VERNE, LUXIOL
25;CHE D ENTRE LES COTES, MAGNY CHATELARD
25;CD 30 DE MONCEY AU CD 50, MAGNY CHATELARD
25;RUE DU CHATELARD, MAGNY CHATELARD
25;GR GRANDE RUE, MAGNY CHATELARD
25;CLOS SAINT MICHEL, MAICHE
25;IMP DES ALPES, MAICHE
25;RUE D ALSACE, MAICHE
25;RUE D ATHENES, MAICHE
25;ALL DU RESERVOIR, MAICHE
25;RUE DE LA RASSE, MAICHE
25;RUE DE LA BATHEUSE, MAICHE
25;RUE DU BELVEDERE, MAICHE
25;RUE DE BERLIN, MAICHE
25;RUE DES BOUTONS D OR, MAICHE
25;CHEM DU BERJON, MAICHE
25;RUE DE BRUXELLES, MAICHE
25;CHE DE LA CANISSIERE, MAICHE
25;RUE DES CHALETS, MAICHE
25;PL DU CHAMP DE FOIRE, MAICHE
25;CHE DE LA CHAPELLE, MAICHE
25;RUE DES CITES, MAICHE
25;CHE DE LA COMBE MISSEY, MAICHE
25;RUE DES COMBES, MAICHE
25;RUE DES COMBOTTES, MAICHE
25;RUE DU CDT D AIGREMONT, MAICHE
25;RUE COPENHAGUE, MAICHE
25;RUE DE DUBLIN, MAICHE
25;PL DE L EGLISE, MAICHE
25;RUE DE L EUROPE, MAICHE
25;RUE FIN YOTTE, MAICHE
25;RUE DE FRAMBOUHANS, MAICHE
25;RUE DES FRENES, MAICHE
25;RUE DES QUATRE FRERES PIQUEREZ, MAICHE
25;RUE DE LA GARE, MAICHE
25;RUE GASTON MARIOTTE, MAICHE
25;RUE DU GENERAL DE GAULLE, MAICHE
25;RUE DES GENEVRIERS, MAICHE
25;RUE DE GOULE, MAICHE
25;RUE DES GRETTES, MAICHE
25;RUE GUSTAVE COURBET, MAICHE
25;RUE GUYNEMER, MAICHE
25;RUE DE GUYOT, MAICHE
25;RUE DU GYMNASE, MAICHE
25;RUE DE L HELVETIE, MAICHE
25;ALL DE L' HORLOGE, MAICHE
25;PLE DU HUIT MAI, MAICHE
25;RUE DU JAY, MAICHE
25;RUE JOSEPH AUBERT, MAICHE
25;RUE JOSEPH JEAMBRUN, MAICHE
25;RUE DU JURA, MAICHE
25;RUE DE KRESSBRONN, MAICHE
25;AV DU MAL LECLERC, MAICHE
25;RUE DE LISBONNE, MAICHE
25;RUE DE LONDRES, MAICHE
25;ALL DU LUXEMBOURG, MAICHE
25;RUE LOUIS PERGAUD, MAICHE
25;RUE DU PERTUS, MAICHE
25;RUE DE MADRID, MAICHE
25;RUE DES MAILLEUX, MAICHE
25;RUE MALSEIGNE, MAICHE
25;RUE DES MARRONNIERS, MAICHE
25;RUE VICTOR MAUVAIS, MAICHE
25;RUE DE MERODE, MAICHE
