25;RUE DEBUSSY, PONTARLIER
25;RUE DEMESMAY, PONTARLIER
25;RUE DENIS PAPIN, PONTARLIER
25;RUE DENIS DIDEROT, PONTARLIER
25;RUE DES DEPORTES, PONTARLIER
25;RUE DOCTEUR BAUD, PONTARLIER
25;RUE DOCTEUR BOUVERET, PONTARLIER
25;RUE DU DOCTEUR CHOPARD, PONTARLIER
25;RUE DU DOCTEUR GRENIER, PONTARLIER
25;RUE DOCTEUR MARGUET, PONTARLIER
25;RUE DONNET-ZEDEL, PONTARLIER
25;QUAI DU DOUBS, PONTARLIER
25;RUE DE DOUBS, PONTARLIER
25;RUE PAUL EDOUARD DUBIED, PONTARLIER
25;RUE DYONIS ORDINAIRE, PONTARLIER
25;RUE DE L ECOLE, PONTARLIER
25;RUE DES ECORCES, PONTARLIER
25;RUE DES ECOUSSONS, PONTARLIER
25;RUE EDGARD FAURE, PONTARLIER
25;RUE EDMOND ROSTAND, PONTARLIER
25;RUE EDOUARD GIROD, PONTARLIER
25;RUE EDWIGE FEUILLERE, PONTARLIER
25;ALL DES EGLANTINES, PONTARLIER
25;RUE EIFFEL, PONTARLIER
25;RUE EMILE CARDOT, PONTARLIER
25;RUE EMILE MAGNIN, PONTARLIER
25;RUE EMILE THOMAS, PONTARLIER
25;RUE DES EPINETTES, PONTARLIER
25;CHE DES EPINETTES, PONTARLIER
25;RUE ERNEST DENISET, PONTARLIER
25;RUE DE L ETRACHE, PONTARLIER
25;RUE EUGENE DROZ, PONTARLIER
25;PL DE L EUROPE, PONTARLIER
25;CHEM DE LA FAUCONNIERE, PONTARLIER
25;PL DE LA FAUCONNIERE, PONTARLIER
25;RUE DE LA FEE VERTE, PONTARLIER
25;CHE DE CHARPILLOT, PONTARLIER
25;RUE DE FONTENIS, PONTARLIER
25;RUE FRANCHET, PONTARLIER
25;RUE FRANCOIS TRUFFAUT, PONTARLIER
25;RUE FRANCOIS VILLON, PONTARLIER
25;RUE F R DE CHATEAUBRIAND, PONTARLIER
25;RUE FREDERIC MISTRAL, PONTARLIER
25;RUE FREDERIC CHOPIN, PONTARLIER
25;RUE DES FRERES BERTHET, PONTARLIER
25;RUE DES FRERES GUYON, PONTARLIER
25;RUE DES FRERES LUMIERE, PONTARLIER
25;RUE DES FUSILLES, PONTARLIER
25;RUE GABRIEL FAURE, PONTARLIER
25;RUE GAMBETTA, PONTARLIER
25;RUE DE LA GARE, PONTARLIER
25;RUE DE LA GENDARMERIE, PONTARLIER
25;AV DU GENERAL GIROD, PONTARLIER
25;PL GEORGES CLEMENCEAU, PONTARLIER
25;ROC GEORGES POMPIDOU, PONTARLIER
25;ALL DES GERANIUMS, PONTARLIER
25;RUE GEORGES BRASSENS, PONTARLIER
25;RUE GOUNOD, PONTARLIER
25;RUE DES GRANGES, PONTARLIER
25;RUE DE LA GRANGETTE, PONTARLIER
25;RUE DU GROS TILLEUL, PONTARLIER
25;RUE GUSTAVE COURBET, PONTARLIER
25;RUE DE LA HALLE, PONTARLIER
25;RUE HELENE BOUCHER, PONTARLIER
25;RUE HENRI BECQUEREL, PONTARLIER
25;RUE HENRI DUNANT, PONTARLIER
25;RUE HENRI POINCARE, PONTARLIER
25;RUE CHARLES HUGON, PONTARLIER
25;RUE DU 8 MAI, PONTARLIER
25;RUE DE L INDUSTRIE, PONTARLIER
25;RUE JACQUES BREL, PONTARLIER
25;RUE JACQUES CARTIER, PONTARLIER
25;RUE JACQUES PREVERT, PONTARLIER
25;RUE DES JARDINS, PONTARLIER
25;RUE JEAN JACQUES ROUSSEAU, PONTARLIER
25;RUE JEAN JAURES, PONTARLIER
25;RUE JEAN MONNET, PONTARLIER
25;RUE JEAN MOULIN, PONTARLIER
25;RUE MERMOZ, PONTARLIER
25;RUE JEAN PERRIN, PONTARLIER
25;RUE JEAN PETITE, PONTARLIER
25;RUE JEANNE D ARC, PONTARLIER
25;IMP JEANNE D ARC, PONTARLIER
25;RUE JOSEPH PILLOD, PONTARLIER
25;RUE JOUFFROY, PONTARLIER
25;RUE DE JOUX, PONTARLIER
25;RUE JULES FERRY, PONTARLIER
25;RUE JULES MATHEZ, PONTARLIER
25;PL JULES PAGNIER, PONTARLIER
25;RUE JULES VERNE, PONTARLIER
25;RUE LACUZON, PONTARLIER
25;RUE LA FONTAINE, PONTARLIER
25;RUE LAMARTINE, PONTARLIER
25;CHE DU LARMONT, PONTARLIER
25;RUE DES LAVAUX, PONTARLIER
25;RUE LAVOISIER, PONTARLIER
25;RUE LEANDRE MERCHET, PONTARLIER
25;RUE LEON JEANNERET, PONTARLIER
25;RUE DE LA LIBERATION, PONTARLIER
25;RUE DES LONGS TRAITS, PONTARLIER
25;RUE DE LORRAINE, PONTARLIER
25;RUE LOUIS PERGAUD, PONTARLIER
25;RUE DU LYCEE, PONTARLIER
25;RUE DU MAGASIN, PONTARLIER
25;RUE DE LA MALADIERE, PONTARLIER
25;RUE MARCELIN BERTHELOT, PONTARLIER
25;PL MAL DE LATTRE DE TASSIGNY, PONTARLIER
25;RUE MAL DE LATTRE DE TASSIGNY, PONTARLIER
25;RUE DU MARECHAL JOFFRE, PONTARLIER
25;PL MARECHAL JUIN, PONTARLIER
25;ALL DES MARGUERITES, PONTARLIER
25;RUE MARIUS LAITHIER, PONTARLIER
25;CHE DES MARNEAUX, PONTARLIER
25;RUE MARPAUD, PONTARLIER
25;RUE MASSENET, PONTARLIER
25;RUE MAURICE CORDIER, PONTARLIER
25;RUE MAURICE LAFFLY, PONTARLIER
25;RUE MAURICE MARROU, PONTARLIER
25;RUE PIERRE MENDES FRANCE, PONTARLIER
25;RUE MERVIL, PONTARLIER
25;RUE MIRABEAU, PONTARLIER
25;RUE MOLIERE, PONTARLIER
25;RUE MONGE, PONTARLIER
25;RUE DE LA MONTAGNE, PONTARLIER
25;RUE MONTAIGNE, PONTARLIER
25;RUE MONTRIEUX, PONTARLIER
25;RUE MORAND, PONTARLIER
25;PL MORAND, PONTARLIER
25;RUE DE MORTEAU, PONTARLIER
25;RUE DU MOULIN PARNET, PONTARLIER
25;CHE DU MOULIN VIEUX, PONTARLIER
25;ALL DES MYOSOTIS, PONTARLIER
25;AV DE NEUCHATEL, PONTARLIER
25;RUE NOTRE DAME, PONTARLIER
25;RUE DU ONZE NOVEMBRE, PONTARLIER
25;IMP DE OVALIE, PONTARLIER
25;RUE DE LA PAIX, PONTARLIER
25;ALL DES PAQUERETTES, PONTARLIER
25;RUE DU PARC, PONTARLIER
25;CITE DES PAREUSES, PONTARLIER
25;RUE DES PAREUSES, PONTARLIER
25;RUE PARGUEZ, PONTARLIER
25;RUE PASCAL, PONTARLIER
25;BD PASTEUR, PONTARLIER
25;RUE PAUL CEZANNE, PONTARLIER
25;RUE PAUL GRIMAULT, PONTARLIER
25;RUE PAUL LANGEVIN, PONTARLIER
25;ALL DES PERCE NEIGE, PONTARLIER
25;QUAI DU PETIT COURS, PONTARLIER
25;RUE PIERRE CORNEILLE, PONTARLIER
25;RUE PIERRE DECHANET, PONTARLIER
25;RUE PIERRE LOTI, PONTARLIER
25;RUE PIERRE ET MARIE CURIE, PONTARLIER
25;RUE PIERRE SEMARD, PONTARLIER
25;RUE DE LA PLAINE DE CHAMPAGNE, PONTARLIER
25;ALL DES PIVOINES, PONTARLIER
25;RUE POMPEE, PONTARLIER
25;RUE DE PONTARLIER VILLAGE, PONTARLIER
25;RUE PRISONNIERS DE GUERRE, PONTARLIER
25;RUE DE LA PROMENADE, PONTARLIER
25;RUE PROUDHON, PONTARLIER
25;RUE QUERRET, PONTARLIER
25;RUE RAOUL FOLLEREAU, PONTARLIER
25;RUE RACINE, PONTARLIER
25;RUE SEBASTIEN RACLE, PONTARLIER
25;RUE DES REMPARTS, PONTARLIER
25;RUE RENE MAILLEY, PONTARLIER
25;RUE RENE PAYOT, PONTARLIER
25;PL RENE POURNY, PONTARLIER
25;RUE DE LA REPUBLIQUE, PONTARLIER
25;RUE DU RHIN, PONTARLIER
25;RUE ROBERT FERNIER, PONTARLIER
25;PL ROGER SALENGRO, PONTARLIER
25;RUE RENEE ROGNON, PONTARLIER
25;RUE RENE ALLIO, PONTARLIER
25;RUE ROMAIN ROLLAND, PONTARLIER
25;RUE DE LA ROTONDE, PONTARLIER
25;RUE ROUGET DE L ISLE, PONTARLIER
25;RUE DE LA SABLIERE, PONTARLIER
25;RUE SAINT ANTIDE, PONTARLIER
25;PL SAINT BENIGNE, PONTARLIER
25;FG SAINT ETIENNE, PONTARLIER
25;RUE SAINT EXUPERY, PONTARLIER
25;RUE SAINT PAUL, PONTARLIER
25;RUE DU FBG SAINT PIERRE, PONTARLIER
25;PL SAINT PIERRE, PONTARLIER
25;CHE DE SAINT ROCH, PONTARLIER
25;RUE SAINT VINCENT DE PAUL, PONTARLIER
25;RUE SAINTE ANNE, PONTARLIER
25;RUE DE SALINS, PONTARLIER
25;RUE SARAH BERNHARDT, PONTARLIER
25;RUE DES SARRONS, PONTARLIER
25;RUE ROBERT SCHUMANN, PONTARLIER
25;RUE SERAPHIN LANQUETIN, PONTARLIER
25;RUE SIMONE SIGNORET, PONTARLIER
25;RUE SOEUR ABEL, PONTARLIER
25;PL DU SOUVENIR FRANCAIS, PONTARLIER
25;AV DU STADE, PONTARLIER
25;RUE PAUL STAINACRE, PONTARLIER
25;RUE DU STAND, PONTARLIER
25;RLE DES TANNERIES, PONTARLIER
25;RUE THIERS, PONTARLIER
25;RUE TISSOT, PONTARLIER
25;RUE DU TOULOMBIEF, PONTARLIER
25;RUE DES TOURBIERES, PONTARLIER
25;RUE TOUSSAINT LOUVERTURE, PONTARLIER
25;RUE DE TRAVERSE, PONTARLIER
25;RUE DU 3EME R.T.A., PONTARLIER
25;SQ VANDEL, PONTARLIER
25;RUE DE VANNOLLES, PONTARLIER
25;RUE DE VERDUN, PONTARLIER
25;RUE VERLAINE, PONTARLIER
25;RUE VICTOR HUGO, PONTARLIER
25;RUE VICTOR SCHOELCHER, PONTARLIER
25;RUE DE LA VIE, PONTARLIER
25;RUE DU VIEUX CHATEAU, PONTARLIER
25;PL VILLINGEN SCHWENNINGEN, PONTARLIER
25;ALL DES VIOLETTES, PONTARLIER
25;RUE VOLTAIRE, PONTARLIER
25;CHE DE VUILLECIN, PONTARLIER
25;RUE MARIE HELENE WUILLEUMIER, PONTARLIER
25;RUE XAVIER MARMIER, PONTARLIER
25;PL ZARAUTZ, PONTARLIER
25;RUE DES ACACIAS, PONT-DE-ROIDE
25;RUE D ALSACE, PONT-DE-ROIDE
25;IMP DES AUBEPINES, PONT-DE-ROIDE
25;RUE DE BESANCON, PONT-DE-ROIDE
25;RUE DE LA BOULOIE, PONT-DE-ROIDE
25;RUE DES BOULEAUX, PONT-DE-ROIDE
25;RUE DES BUIS, PONT-DE-ROIDE
25;IMP DU CAPITAINE DUBOIS, PONT-DE-ROIDE
25;IMP DES CERISIERS, PONT-DE-ROIDE
25;RUE DE CHAMBABON, PONT-DE-ROIDE
25;IMP DES CHAMPS DU FAUX, PONT-DE-ROIDE
25;RUE DES CHAMPS DU HAUT, PONT-DE-ROIDE
25;RUE DU CHEMIN NOIR, PONT-DE-ROIDE
25;RUE DE LA CHAPELLE, PONT-DE-ROIDE
25;RUE DES CHARMILLES, PONT-DE-ROIDE
25;RUE DU CHATEAU GAILLARD, PONT-DE-ROIDE
25;RUE DE CHATEY, PONT-DE-ROIDE
25;IMP DU CHENE, PONT-DE-ROIDE
25;RUE DES CHENEVRIERS, PONT-DE-ROIDE
25;IMP DE LA COMBE AUX EAUX, PONT-DE-ROIDE
25;RUE DE LA CRAYE, PONT-DE-ROIDE
25;IMP DU CUCHOT, PONT-DE-ROIDE
25;RUE CUVIER, PONT-DE-ROIDE
25;RUE LA DERRIERE, PONT-DE-ROIDE
25;PL GENERAL DE GAULLE, PONT-DE-ROIDE
25;RUE DE L EGLISE, PONT-DE-ROIDE
25;PL DE L EGLISE, PONT-DE-ROIDE
25;IMP EMILE PEUGEOT, PONT-DE-ROIDE
25;RUE DES EPICEAS, PONT-DE-ROIDE
25;IMP DES ESSARTS, PONT-DE-ROIDE
25;RUE FIERECK, PONT-DE-ROIDE
25;IMP DES FRAMBOISIERS, PONT-DE-ROIDE
25;RUE DE LA GARE, PONT-DE-ROIDE
25;RUE DU GENERAL HERR, PONT-DE-ROIDE
25;IMP DES GENEVRIERS, PONT-DE-ROIDE
25;GR GRANDE RUE, PONT-DE-ROIDE
25;IMP DE LA GRAVALE, PONT-DE-ROIDE
25;IMP DES GRAVIERS, PONT-DE-ROIDE
25;IMP DES GROSEILLIERS, PONT-DE-ROIDE
25;RUE HELENE PEUGEOT, PONT-DE-ROIDE
25;RUE D HELVETIE, PONT-DE-ROIDE
25;RUE DES JARDINS, PONT-DE-ROIDE
25;PL DES JARDINS DU ROIDE, PONT-DE-ROIDE
25;RUE DES LAURIERS, PONT-DE-ROIDE
25;RUE DE LA LIBERATION, PONT-DE-ROIDE
25;RUE DU LOMONT, PONT-DE-ROIDE
25;IMP DES MALTIERES, PONT-DE-ROIDE
25;RUE DU MAQUIS, PONT-DE-ROIDE
25;RUE DES MARRONNIERS, PONT-DE-ROIDE
25;RUE DE BESANCON-F. MITTERRAND, PONT-DE-ROIDE
25;RUE DE MONTBELIARD, PONT-DE-ROIDE
25;ALL JEAN MOULIN, PONT-DE-ROIDE
25;RUE DU MOULIN, PONT-DE-ROIDE
25;RUE DES MURGERS, PONT-DE-ROIDE
25;RUE DE NEUCHATEL URTIERE, PONT-DE-ROIDE
25;RUE NEUVE, PONT-DE-ROIDE
25;IMP DES NOISETIERS, PONT-DE-ROIDE
25;IMP DE LA PETITE CRAYE, PONT-DE-ROIDE
25;RUE DE LA PLAGE, PONT-DE-ROIDE
25;IMP DES PLANCHES DE FER, PONT-DE-ROIDE
25;RUE DES PLUMESSES, PONT-DE-ROIDE
25;IMP DU POMMEROT, PONT-DE-ROIDE
25;RUE DU PORT, PONT-DE-ROIDE
25;IMP PRES DE LA MAIX, PONT-DE-ROIDE
25;IMP DES PRUNIERS, PONT-DE-ROIDE
25;RUE DE LA RANCEUSE, PONT-DE-ROIDE
25;RUE DE LA RESISTANCE, PONT-DE-ROIDE
25;IMP DE LA ROCHETTE, PONT-DE-ROIDE
25;RUE ROMAINE, PONT-DE-ROIDE
25;RUE DE SAINT HIPPOLYTE, PONT-DE-ROIDE
25;IMP DE LA SAPINIERE, PONT-DE-ROIDE
25;IMP DU SEUTEROT, PONT-DE-ROIDE
25;RUE SOUS LA VELLE, PONT-DE-ROIDE
25;RUE DU STADE, PONT-DE-ROIDE
25;RUE DU TEMPLE, PONT-DE-ROIDE
25;RUE DES TILLEULS, PONT-DE-ROIDE
25;RUE DES TROENES, PONT-DE-ROIDE
25;RUE DU 12 SEPTEMBRE, PONT-DE-ROIDE
25;RUE DES SORBIERS, PONT-DE-ROIDE
25;RUE DU 4EME R T T, PONT-DE-ROIDE
25;RUE DE LA 9 DIC, PONT-DE-ROIDE
25;RUE DE LA VAUMAILLE, PONT-DE-ROIDE
25;IMP DES VERGERS, PONT-DE-ROIDE
25;RUE DU VIEUX MOULIN, PONT-DE-ROIDE
25;RUE DES VIGNES, PONT-DE-ROIDE
25;IMP SOUS LA VYE, PONT-DE-ROIDE
25;RUE DU CASINO, LES PONTETS
25;RUE DE LA DOYE, LES PONTETS
25;RUE CHAMP DU FOUR, LES PONTETS
25;RUE DU CHATEAU, LES PONTETS
25;CHE DES CHAUMELLES, LES PONTETS
25;RUE DE L'EGLISE, LES PONTETS
25;RUE GRANDE RUE, LES PONTETS
25;RUE THEODORE JOUFFROY, LES PONTETS
25;RUE DE MOUTHE, LES PONTETS
25;RUE PACAUD, LES PONTETS
25;IMP DES TILLEULS, LES PONTETS
25;RUE TURCHET, LES PONTETS
25;LOT BELLERIVE, PONT LES MOULINS
25;FRM DU BOIS RODOLPHE, PONT LES MOULINS
25;RUE DE LA CURE, PONT LES MOULINS
25;RUE BELLE RIVE, PONT LES MOULINS
25;RUE DES CHAMPS, PONT LES MOULINS
25;IMP DE L'EGLISE, PONT LES MOULINS
25;GR GRANDE RUE, PONT LES MOULINS
25;RUE DE PONTARLIER, PONT LES MOULINS
25;RUE DE TRAPELLE, PONT LES MOULINS
25;RUE DE LA VIEILLE COTE, PONT LES MOULINS
25;LOT LA POMMERAIE, POUILLEY FRANCAIS
25;LOT QUADEMENE, POUILLEY FRANCAIS
25;RUE DE L ANCIENNE FORGE, POUILLEY FRANCAIS
25;RUE BASSE, POUILLEY FRANCAIS
25;CHE DE BOUE, POUILLEY FRANCAIS
25;CHE DES BORMOTTES, POUILLEY FRANCAIS
25;RUE DE CHAILLOU, POUILLEY FRANCAIS
25;CHE DES CHAMPS, POUILLEY FRANCAIS
25;CHE DE LA MIGNONNE, POUILLEY FRANCAIS
25;RUE A L EAU DES CHAMPS, POUILLEY FRANCAIS
25;PL DE L EGLISE, POUILLEY FRANCAIS
25;RUE DE LA FONTAINE, POUILLEY FRANCAIS
25;IMP DE LA FORGE, POUILLEY FRANCAIS
25;RUE DES GENEVRIERS, POUILLEY FRANCAIS
25;GR GRANDE RUE, POUILLEY FRANCAIS
25;CHEM JULES GROSPERRIN, POUILLEY FRANCAIS
25;RUE DE LA JOLIOTTE, POUILLEY FRANCAIS
25;RUE DE LA LIBERATION, POUILLEY FRANCAIS
25;PL DE LA MAIRIE, POUILLEY FRANCAIS
25;RUE DE QUADEMENE, POUILLEY FRANCAIS
25;RTE ROUTE NATIONALE, POUILLEY FRANCAIS
25;RUE DE ROMPRE, POUILLEY FRANCAIS
25;CHE DE SERVOLE, POUILLEY FRANCAIS
25;RUE DU STADE, POUILLEY FRANCAIS
25;RUE DES VERGERS, POUILLEY FRANCAIS
25;LOT LE CLOS DES VIGNES, POUILLEY LES VIGNES
25;LOT LE COTEAU, POUILLEY LES VIGNES
25;LOT LE CROUZOT, POUILLEY LES VIGNES
25;LOT LA POMMERAIE, POUILLEY LES VIGNES
25;LOT PRES DU RIS, POUILLEY LES VIGNES
25;LOT CLOS DES SOURCES, POUILLEY LES VIGNES
25;LOT LA VIGNERAIE, POUILLEY LES VIGNES
25;LOT LES VIGNES DU MOULIN, POUILLEY LES VIGNES
25;RUE ALEXANDRE DUMAS, POUILLEY LES VIGNES
25;RUE BEAUREGARD, POUILLEY LES VIGNES
25;IMP BOILEAU, POUILLEY LES VIGNES
25;CHE DU BOIS DE LA DAME, POUILLEY LES VIGNES
25;CHE DE BOUGEILLE, POUILLEY LES VIGNES
25;CHE DE LA CHAILLE, POUILLEY LES VIGNES
25;RUE DES CHAMPS CHANTES, POUILLEY LES VIGNES
25;RUE DE CHAPELOT, POUILLEY LES VIGNES
25;RUE CHARLES FOURIER, POUILLEY LES VIGNES
25;RUE DE LA CHARLOTTE, POUILLEY LES VIGNES
25;RUE CHARRIERE SALEE, POUILLEY LES VIGNES
25;RUE DU CHATEAU D EAU, POUILLEY LES VIGNES
25;RUE DU COLLEGE, POUILLEY LES VIGNES
25;RUE DE LA CORVEE, POUILLEY LES VIGNES
25;RUE DES COMBOTTES, POUILLEY LES VIGNES
25;IMP COURBET, POUILLEY LES VIGNES
25;IMP DIDEROT, POUILLEY LES VIGNES
25;RUE DE L ECOLE, POUILLEY LES VIGNES
25;RUE DE L EGLISE, POUILLEY LES VIGNES
25;RUE D EMAGNY, POUILLEY LES VIGNES
25;RUE EMILE ZOLA, POUILLEY LES VIGNES
25;IMP DE L ETANG, POUILLEY LES VIGNES
25;PL DE L ETOILE, POUILLEY LES VIGNES
25;RUE DES FONTAINES, POUILLEY LES VIGNES
25;RUE FOURRIE, POUILLEY LES VIGNES
25;RUE FREDERIC CHOPIN, POUILLEY LES VIGNES
25;RUE DES FRESNES, POUILLEY LES VIGNES
25;IMP GAUGUIN, POUILLEY LES VIGNES
25;RUE GEORGES BIZET, POUILLEY LES VIGNES
25;RUE DE BON GRAIN, POUILLEY LES VIGNES
25;GR GRANDE RUE, POUILLEY LES VIGNES
25;RUE DE GRAY, POUILLEY LES VIGNES
25;RUE DE L INDUSTRIE, POUILLEY LES VIGNES
25;RUE DE LAUSANNE, POUILLEY LES VIGNES
25;RUE LOUIS PERGAUD, POUILLEY LES VIGNES
25;RUE DE LA MALETIERE, POUILLEY LES VIGNES
25;RUE DES MARRONNIERS, POUILLEY LES VIGNES
25;RUE DE MASSON, POUILLEY LES VIGNES
25;RUE DE MISEREY, POUILLEY LES VIGNES
25;IMP MONET, POUILLEY LES VIGNES
25;RUE DU MOULIN, POUILLEY LES VIGNES
25;RUE MOZART, POUILLEY LES VIGNES
25;RUE DES NOYERS, POUILLEY LES VIGNES
25;RUE DES ORMES, POUILLEY LES VIGNES
25;RUE DES PECHERS, POUILLEY LES VIGNES
25;CHE DU PEGRE, POUILLEY LES VIGNES
25;RUE DE PELOUSEY, POUILLEY LES VIGNES
25;RUE DE LA PERROUSE, POUILLEY LES VIGNES
25;RUE DE LA POMMERAIE, POUILLEY LES VIGNES
25;RUE DU PUITS, POUILLEY LES VIGNES
25;RUE DU REPOS, POUILLEY LES VIGNES
25;RUE DES SALINES, POUILLEY LES VIGNES
25;RUE DE SERRE, POUILLEY LES VIGNES
25;RUE VAN GOGH, POUILLEY LES VIGNES
25;CHE DE VAUFRESSON, POUILLEY LES VIGNES
25;RUE DES VERGERS DU PUITS, POUILLEY LES VIGNES
25;RUE VOLTAIRE, POUILLEY LES VIGNES
25;RUE VICTOR HUGO, POUILLEY LES VIGNES
25;RUE DES VIGNES, POUILLEY LES VIGNES
25;RUE D'ARCHAMP, POULIGNEY LUSANS
25;RUE DE LA CHAILLE, POULIGNEY LUSANS
25;RUE DU CHARMEY, POULIGNEY LUSANS
25;CHE DU CHATEAU, POULIGNEY LUSANS
25;CHE DES ESSARTS, POULIGNEY LUSANS
25;CHE DES ESSIES, POULIGNEY LUSANS
25;PL DE LA FONTAINE, POULIGNEY LUSANS
25;GR GRANDE RUE, POULIGNEY LUSANS
25;RTE DES GRANDES VIGNES, POULIGNEY LUSANS
25;PL DE LA MAIRIE, POULIGNEY LUSANS
25;RUE DU PAIGRE, POULIGNEY LUSANS
25;RUE DES PERRIERES, POULIGNEY LUSANS
25;RUE DE LA PEROUSOTTE, POULIGNEY LUSANS
25;RUE DU PRE VIGNOT, POULIGNEY LUSANS
25;RUE DU PUY, POULIGNEY LUSANS
25;RUE SAINT MARTIN, POULIGNEY LUSANS
25;RUE DE LA SOURCE, POULIGNEY LUSANS
25;RUE DU STADE, POULIGNEY LUSANS
25;RUE DE VENNANS, POULIGNEY LUSANS
25;CHE DE VERDI, POULIGNEY LUSANS
25;RUE DES VERGERS, POULIGNEY LUSANS
25;RUE DU VERJOULOT, POULIGNEY LUSANS
25;CHE DU MONT D OR, POULIGNEY LUSANS
25;RUE SAINT HUBERT, POULIGNEY LUSANS
25;RUE DES FOSSES, POULIGNEY LUSANS
25;RUE DES LONGEAUX, POULIGNEY LUSANS
25;RUE DU VERGER D'AGATHE, POULIGNEY LUSANS
25;RUE DU CHAMP DU CHARME, POULIGNEY LUSANS
25;RUE DE BART, PRESENTEVILLERS
25;RUE DE BAVANS, PRESENTEVILLERS
25;RUE DU CHAMP PREVOT, PRESENTEVILLERS
25;RUE DES CHARMES, PRESENTEVILLERS
25;RUE DU CHATEAU D EAU, PRESENTEVILLERS
25;IMP DES CHENES, PRESENTEVILLERS
25;RUE DU CIMETIERE, PRESENTEVILLERS
25;RUE DE L EGLISE, PRESENTEVILLERS
25;RUE EZ BRIERES, PRESENTEVILLERS
25;GR GRANDE RUE, PRESENTEVILLERS
25;RUE D ISSANS, PRESENTEVILLERS
25;RUE DES JARDINS, PRESENTEVILLERS
25;RUE DU LOTISSEMENT, PRESENTEVILLERS
25;RUE DE LA NOE, PRESENTEVILLERS
25;RUE DES PENOTTERS, PRESENTEVILLERS
25;IMP DES PINS, PRESENTEVILLERS
25;RUE DES PLATEAUX DU HAUT, PRESENTEVILLERS
25;RUE DES PRES, PRESENTEVILLERS
25;RUE PRES DU CLOITRE, PRESENTEVILLERS
25;RUE LES PRES DU MOULIN, PRESENTEVILLERS
25;RUE DE DUNG, PRESENTEVILLERS
25;RUE DE SAINTE MARIE, PRESENTEVILLERS
25;IMP SOUS LE BOIS, PRESENTEVILLERS
25;RUE SOUS LA ROCHE, PRESENTEVILLERS
25;RUE DU SOUVENIR, PRESENTEVILLERS
25;PL DU 28 OCTOBRE 1944, PRESENTEVILLERS
25;RUE BATTANT, LA PRETIERE
25;RUE DU DOUBS, LA PRETIERE
25;IMP DES GRANDS VERGERS, LA PRETIERE
25;RTE DE MEDIERE, LA PRETIERE
25;RUE DE LA MINOUCHE, LA PRETIERE
25;RUE SAINT VINCENT, LA PRETIERE
25;RUE DE L'EGLISE, PROVENCHERE
25;RUE DU FIL D'OR, PROVENCHERE
25;RUE GRANDE, PROVENCHERE
25;RUE DE LA MAIRIE, PROVENCHERE
25;RUE DE SURMONT, PROVENCHERE
25;RUE DU TARTRE, PROVENCHERE
25;RUE DES TILLEULS, PROVENCHERE
25;RUE SUR LA VELLE, PROVENCHERE
25;RUE DU CHATEAU, PUESSANS
25;RUE DE L'ECOLE, PUESSANS
25;RUE DU MONT D'ADAM, PUESSANS
25;RUE DES SOURCES, PUESSANS
25;RUE DES VIGNES, PUESSANS
25;LOT LES CHAMPS DE L ETANG, PUGEY
25;LOT LE CLOS DES HAUT PRES, PUGEY
25;LOT LES GRANDS PRES, PUGEY
25;LOT LES HAUTS DE PUGEY, PUGEY
25;LOT LES PLANCHES, PUGEY
25;RUE DES BEVALOTS, PUGEY
25;RUE DES CHAMPS GALANTS, PUGEY
25;RTE DES CLAIRONS, PUGEY
25;RUE DU CLOUSEY, PUGEY
25;RUE DE L EGLISE, PUGEY
25;CHE DU GRAPENOT, PUGEY
25;RTE DE LEVIER, PUGEY
25;RTE DES LHOMMES, PUGEY
25;RUE DE LA MALTOURNEE, PUGEY
25;CHE DE LA PETITE SUISSE, PUGEY
25;CHE DES PLANCHES, PUGEY
25;CHE DES PRES BASSAND, PUGEY
25;RUE DU TILLEUL, PUGEY
25;CHE DE TRAVERSE, PUGEY
25;CHE DE LA TUILERIE, PUGEY
25;CHEM DE LA COMBE D AULAVE, LE PUY
25;CHEM DE CROTEREY, LE PUY
25;GR GRANDE RUE, LE PUY
25;RUE DE SAINT HILAIRE, LE PUY
25;RUE VALY VILLAIN, LE PUY
25;LOT CHAMP LHOSTE, QUINGEY
25;LOT LES RIVES DE LA LOUE, QUINGEY
25;LOT LA MARIDELLE, QUINGEY
25;HAM DE SAINT RENOBERT, QUINGEY
25;LOT LES SAULES, QUINGEY
25;RUE DE L ABREUVOIR, QUINGEY
25;PL D ARMES, QUINGEY
25;RUE CHARLES BELLE, QUINGEY
25;RUE DU BOIS JOLI, QUINGEY
25;RUE DE BUSY, QUINGEY
25;RTE DE BYANS, QUINGEY
25;RUE CALIXTE II, QUINGEY
25;CHE DU CHALET, QUINGEY
25;CHEM CHAMP GROS PAIN, QUINGEY
25;CHE DU CIMETIERE, QUINGEY
25;RTE DES COMBES ET MARIDELLE, QUINGEY
25;PL DE LA CONFRERIE, QUINGEY
25;RUE DE L ECOLE, QUINGEY
25;RUE DE L EGLISE, QUINGEY
25;RUE DES ESSARTS, QUINGEY
25;CHEM DE L ETANG, QUINGEY
25;RUE DE LA FIN DERRIERE, QUINGEY
25;RUE DE LA FIN DU MILIEU, QUINGEY
25;RUE DES FORGES, QUINGEY
25;CHE DE TRAVERSE DE CHOUZELOT, QUINGEY
25;IMP DES VIGNES, QUINGEY
25;RUE DES FOSSES, QUINGEY
25;RUE FELIX GIACOMOTTI, QUINGEY
25;RUE DU GEY, QUINGEY
25;RUE DES GRANDS PRES, QUINGEY
25;CHEM DES GRAVES, QUINGEY
25;RUE DE LA LANTERNIERE, QUINGEY
25;RUE DES LILAS, QUINGEY
25;RTE DE LOMBARD, QUINGEY
25;RTE DE LYON, QUINGEY
25;CHE DE LA MARIDELLE, QUINGEY
25;RUE RENE LANOY, QUINGEY
25;CHEM RURAL DES PATURAGES, QUINGEY
25;GR GRANDE RUE, QUINGEY
25;RTE D ORNANS, QUINGEY
25;RUE DES PROMENADES, QUINGEY
25;RUE ROYALE, QUINGEY
25;FG SAINTE ANNE, QUINGEY
25;RUE SAINTE ANNE, QUINGEY
25;RUE SAINT RENOBERT, QUINGEY
25;PL SAINT MARTIN, QUINGEY
25;RUE DES SALINES, QUINGEY
25;RUE DES ROCHES, QUINGEY
25;CHE DES ROUTES, QUINGEY
25;RUE DU STADE, QUINGEY
25;RUE DES SOURCES, QUINGEY
25;RUE DE LA TANNERIE, QUINGEY
25;RUE DU TOUILLON, QUINGEY
25;RUE DE TRAVERSE, QUINGEY
25;IMP DU VERGER, QUINGEY
25;RUE BAS, RAHON
25;CHE RURAL DIT DES CARRIERES, RAHON
25;RUE DE LA CHAPELLE, RAHON
25;GR GRANDE RUE, RAHON
25;CHE RURAL DE RAHON A BELVOIR, RAHON
25;CHE DES JONQUILLES, RAHON
25;RTE DU LOMONT, RAHON
25;RTE DE BELVOIR, RAHON
25;RUE DU GUTY, RAHON
25;RTE DE SANCEY, RAHON
25;CHE DE LA CUVOTTE, RAHON
25;RUE DE LA FONTAINE, RAHON
25;CHE DE LA FONTAINE, RAHON
25;SEN DE LA CUVOTTE, RAHON
25;RUE DE L EGLISE, RANCENAY
25;RUE DU FAUBOURG, RANCENAY
25;RUE DE LAVAUX, RANCENAY
25;RUE DE LA MAIRIE, RANCENAY
25;RTE DE LA MARNE, RANCENAY
25;RTE DE MONTFERRAND, RANCENAY
25;CHE DE L OREE DU BOIS, RANCENAY
25;CHE DES PRES RONDOT, RANCENAY
25;RUE PRINCIPALE, RANCENAY
25;RUE AUX CHAMPS DU RANG, RANCENAY
25;RUE DES VIGNES, RANCENAY
25;HAB LE MONT DU VIEUX CHENE, RANDEVILLERS
25;CHE DU CLOSOT, RANDEVILLERS
25;RUE DE LA COTE, RANDEVILLERS
25;RTE DE LA COTE, RANDEVILLERS
25;RUE DE LA FORGE, RANDEVILLERS
25;GR GRANDE RUE, RANDEVILLERS
25;CHE DES GRANDS CHAMPS, RANDEVILLERS
25;RUE DU JEU DE QUILLES, RANDEVILLERS
25;CHE DE LA LAVIERE, RANDEVILLERS
25;RUE DE LA PRA, RANDEVILLERS
25;RUE DU RANCHOT, RANDEVILLERS
25;CHE DES VIES, RANDEVILLERS
25;PL DU VIEUX CHENE, RANDEVILLERS
25;RUE DES BOULOIS, RANG
25;RUE DU BERGER, RANG
25;IMP DU CHANOIS, RANG
25;RUE DE LA CHAPELLE, RANG
25;RUE DES ESSARTS NOUVEAUX, RANG
25;IMP DE LA COMBE BRUAU, RANG
25;IMP DES EGLANTIERS, RANG
25;RUE DE LA FONTAINE, RANG
25;RUE DU FAYS, RANG
25;RUE DE LA GOULISSE, RANG
25;GR GRANDE RUE, RANG
25;RUE DES JARDINS, RANG
25;RUE DE LA MAIRIE, RANG
25;IMP DE LA MALATIERE, RANG
25;RUE DES POMMIERS DE BOIS, RANG
25;IMP DU RUISSEAU, RANG
25;RUE DU POUMEROT, RANG
25;RUE DE LA SOURCE, RANG
25;RUE DU STADE, RANG
25;IMP DU TUNNEL, RANG
25;RUE DES VIGNES, RANG
25;PL DE L EGLISE, RANG
25;RUE DU CUENON, RANG
25;PL DE LA FONTAINE, RANG
25;IMP DES JARDINS, RANG
25;CHE DU STADE, RANG
25;RTE DES GRANDES PLANCHES, RANG
25;RUE DU CHAUFOUR, RAYNANS
25;RUE DES CONTOURS, RAYNANS
25;RUE DE LA COTE, RAYNANS
25;CHE DE L'EPENAY, RAYNANS
25;RUE DES FAILLYS, RAYNANS
25;RUE DES GRANDS PRES, RAYNANS
25;GR GRANDE RUE, RAYNANS
25;RUE D ISSANS, RAYNANS
25;RUE DES MOLLERAIES, RAYNANS
25;RUE DES MOULINS, RAYNANS
25;RUE DES PALES, RAYNANS
25;RUE DE LA PERUSSE, RAYNANS
25;RUE DU PIED DE CHAT, RAYNANS
25;RUE DES POMMIERES, RAYNANS
25;IMP DES ROUGEOTTES, RAYNANS
25;LOT LE CHANOIS, RECOLOGNE
25;LOT LE CHATEAU, RECOLOGNE
25;LOT LES HAUTS DE RECOLOGNE, RECOLOGNE
25;LOT LE TREMBLE, RECOLOGNE
25;CHE DU CHANOIS, RECOLOGNE
25;RUE DU CIMETIERE, RECOLOGNE
25;RUE DURETETE, RECOLOGNE
25;GR GRANDE RUE, RECOLOGNE
25;CHE DU MOULIN, RECOLOGNE
25;RUE DES TILLEULS, RECOLOGNE
25;PL DES TILLEULS, RECOLOGNE
25;CHE DE BREDAT, RECOLOGNE
25;RUE DU CHATEAU, RECOLOGNE
25;CHE DE LA CHAUX, RECOLOGNE
25;RTE DE CHEVIGNEY, RECOLOGNE
25;RUE DES CREUX DE TERRE, RECOLOGNE
25;RUE DE L ECOLE, RECOLOGNE
25;RUE DE L EGLISE, RECOLOGNE
25;IMP DE L ETANG, RECOLOGNE
25;RUE DU FER A CHEVAL, RECOLOGNE
25;RUE DE LA GRANDE FONTAINE, RECOLOGNE
25;RUE DES GRANGES, RECOLOGNE
25;CHE DU JEU DE QUILLES, RECOLOGNE
25;RTE DE MARNAY, RECOLOGNE
25;RUE DES MASEY, RECOLOGNE
25;RUE DU NOELLOT, RECOLOGNE
25;RTE DE NOIRONTE, RECOLOGNE
25;RUE DES GRANDS PRES, RECOLOGNE
25;VC RUELLE LUCIE, RECOLOGNE
25;CHE DE LA TRAVERSE, RECOLOGNE
25;RUE DU TREMBLE, RECOLOGNE
25;RUE DES VERGERS, RECOLOGNE
25;RTE DE FRANEY, RECOLOGNE
25;IMP DE TREMBLE, RECOLOGNE
25;RUE DE LA TUILERIE, RECOLOGNE
25;RUE DU MOULIN, RECOLOGNE
25;RUE BRELLAT, RECOLOGNE
25;IMP PANOUX, RECOLOGNE
25;RUE DE LORBE EPINE, RECOLOGNE
25;RTE DE ST VIT, RECOLOGNE
25;IMP DE SALIGNEY, RECOLOGNE
25;CHEM DE LA TUILERIE, RECOLOGNE
25;QUA SAINT JEAN, RECULFOZ
25;CHE DES LANDETTES, RECULFOZ
25;RTE DES COMBES DERNIERS, RECULFOZ
25;RUE PASTEUR, RECULFOZ
25;CLOS DES CERISIERS, REMONDANS VAIVRE
25;RUE DU CRATOT, REMONDANS VAIVRE
25;RUE DU GASPET, REMONDANS VAIVRE
25;RUE DES LONGS CHAMPS, REMONDANS VAIVRE
25;RUE DE LA MAIRIE, REMONDANS VAIVRE
25;RUE DU MOULIN, REMONDANS VAIVRE
25;RUE DES PONTS, REMONDANS VAIVRE
25;RUE DE LA RIBE, REMONDANS VAIVRE
25;IMP DES SOURCES, REMONDANS VAIVRE
25;RUE DES TUILIERES, REMONDANS VAIVRE
25;RUE DE VALAVI, REMONDANS VAIVRE
25;LOT LES PERRIERES, REMORAY BOUJEONS
25;RTE DES BUCLES, REMORAY BOUJEONS
25;RUE DE BELLEVUE, REMORAY BOUJEONS
25;RTE DE CHATELARD, REMORAY BOUJEONS
25;CHE DES CLOS, REMORAY BOUJEONS
25;CHE DES CANARDS, REMORAY BOUJEONS
25;RTE DU CRET, REMORAY BOUJEONS
25;CHE DE LA DREZINE, REMORAY BOUJEONS
25;IMP DE L ECOLE, REMORAY BOUJEONS
25;RUE DE L EGLISE, REMORAY BOUJEONS
25;RUE DE LA FORGE, REMORAY BOUJEONS
25;RTE DES GITS, REMORAY BOUJEONS
25;RUE DE LA FONTAINE, REMORAY BOUJEONS
25;RTE DE LA GRANDE COTE, REMORAY BOUJEONS
25;RTE DE GELLIN, REMORAY BOUJEONS
25;GR GRANDE RUE, REMORAY BOUJEONS
25;CHE DE LA GRAND DENT, REMORAY BOUJEONS
25;CHE DE MACLIN, REMORAY BOUJEONS
25;PL DE LA MAIRIE, REMORAY BOUJEONS
25;CHE DU MOULIN, REMORAY BOUJEONS
25;RTE DE MAISON DU BOIS, REMORAY BOUJEONS
25;CHE DE LA MOUSSE, REMORAY BOUJEONS
25;CHE DES PLACES, REMORAY BOUJEONS
25;CHE DE REMORAY A VAUX CHANTEGR, REMORAY BOUJEONS
25;CHE DU RESERVOIR, REMORAY BOUJEONS
25;CHE DE LA ROCHE, REMORAY BOUJEONS
25;IMP ROUGET, REMORAY BOUJEONS
25;RUE DES SAULES, REMORAY BOUJEONS
25;CHE DES SOUILLOTS, REMORAY BOUJEONS
25;RUE DE LA SEIGNE, REMORAY BOUJEONS
25;RTE DES SOURCES, REMORAY BOUJEONS
25;RUE DU TILLEUL, REMORAY BOUJEONS
25;CHE DES 4 VENTS, REMORAY BOUJEONS
25;RUE DE LA CONGE, RENEDALE
25;RUE DE LA FONTAINE, RENEDALE
25;RUE PRINCIPALE, RENEDALE
25;RUE DES BARRIERES, RENNES SUR LOUE
25;RTE DE BY, RENNES SUR LOUE
25;CHE DES CHAMPS BLONDS, RENNES SUR LOUE
25;RTE DE LA CHAPELLE, RENNES SUR LOUE
25;PL DE LA CHAPELLE, RENNES SUR LOUE
25;RUE DE LA FONTAINE, RENNES SUR LOUE
25;RUE DU FOUR, RENNES SUR LOUE
25;RLE DU FOUR, RENNES SUR LOUE
25;GR GRANDE RUE, RENNES SUR LOUE
25;RUE DU MOULIN, RENNES SUR LOUE
25;RUE DES MURAILLES NEUVES, RENNES SUR LOUE
25;RTE NATIONALE, RENNES SUR LOUE
25;RUE DU PONT, RENNES SUR LOUE
25;RUE RTE PRINCIPALE, RENNES SUR LOUE
25;PL VILLAGE, RENNES SUR LOUE
25;RUE DE LA COUR, RENNES SUR LOUE
25;RUE DU CRET, RENNES SUR LOUE
25;CHE DES ECOLIERS, RENNES SUR LOUE
25;RUE DE L ASPIRANT GREUSARD, REUGNEY
25;RTE DE BOLANDOZ, REUGNEY
25;RUE DU BONHEUR, REUGNEY
25;CHE DE COURCELLES, REUGNEY
25;CHEM DE LA COTE, REUGNEY
25;RUE COMBE LAURENCE, REUGNEY
