25;CHE DES MALLEROIS, CHATILLON LE DUC
25;CHE DU MAROT, CHATILLON LE DUC
25;RUE DES MAURAPANS, CHATILLON LE DUC
25;CHE DES MAURAPANS, CHATILLON LE DUC
25;RUE DE LA PARGELIERE, CHATILLON LE DUC
25;ALL DU BOUCHET, CHATILLON LE DUC
25;ALL DES PINS DU CAUCASE, CHATILLON LE DUC
25;CHE DE L ETANG, CHATILLON LE DUC
25;CLOS DE L EPAULIE, CHATILLON LE DUC
25;RUE DU DUC DE MERANIE, CHATILLON LE DUC
25;RUE DES SAULES, CHATILLON LE DUC
25;CHE DES REMOUSSARDS, CHATILLON LE DUC
25;RUE DES PLANTES, CHATILLON LE DUC
25;ALL DES SORENTINES, CHATILLON LE DUC
25;IMP DES ECUREUILS, CHATILLON LE DUC
25;IMP ALOUETTE 2, CHATILLON LE DUC
25;ALL DU CHEVREUIL, CHATILLON LE DUC
25;CHE DU CHOUMOIS, CHATILLON LE DUC
25;ALL DES ROMPEUX, CHATILLON LE DUC
25;RUE DES VERGERS, CHATILLON LE DUC
25;CHE DU BAC, CHATILLON SUR LISON
25;CHE DES BARBOUILLONS, CHATILLON SUR LISON
25;CHE DES FORGES, CHATILLON SUR LISON
25;CHE RURAL DES GRANDS CHAMPS, CHATILLON SUR LISON
25;CHE DES GRANGES AUX FORGES, CHATILLON SUR LISON
25;CHE DE L ISLE DU CHEVAL, CHATILLON SUR LISON
25;CHE DU VAUCERY, CHATILLON SUR LISON
25;RUE DES ANCIENNES ECOLES, CHAUCENNE
25;RUE DES BARROTS, CHAUCENNE
25;RUE DE LA BASCULE, CHAUCENNE
25;RUE DE BESANCON, CHAUCENNE
25;RUE JEAN FRANCOIS BRUN, CHAUCENNE
25;CHEM EN CHAMP FANUT, CHAUCENNE
25;CHEM DU CHATEAU D EAU, CHAUCENNE
25;RUE CORNE GAUDET, CHAUCENNE
25;CHE DE L EGLISE, CHAUCENNE
25;CHE DE L ESSART BUSON, CHAUCENNE
25;GR GRANDE RUE, CHAUCENNE
25;CHEM DE FANEY, CHAUCENNE
25;CHE DE JERICHO, CHAUCENNE
25;CHE DE LOUISZARD, CHAUCENNE
25;CHEM DES PERRIERES, CHAUCENNE
25;RUE DES PERRIERES, CHAUCENNE
25;RTE DE LA MAGUYOTE, CHAUCENNE
25;RUE DES JARDINS, CHAUCENNE
25;RTE DE MONCLEY, CHAUCENNE
25;CHEM DES PLANCHES, CHAUCENNE
25;CHEM DES PRES, CHAUCENNE
25;RUE DU SAUCET, CHAUCENNE
25;RUE ST JEAN, CHAUCENNE
25;CHEM DES SAPINS, CHAUCENNE
25;CHEM DES SAULES, CHAUCENNE
25;RUE DES TILLEULS, CHAUCENNE
25;CHE DE SYMPHORIEN PERREUX, CHAUCENNE
25;RUE DES VARENNES, CHAUCENNE
25;CHEM DES VERNES, CHAUCENNE
25;CHE DES VIGNES ROCHET, CHAUCENNE
25;CHE DES CYPRES, CHAUCENNE
25;RUE DE CHANEY, CHAUCENNE
25;CHE DE LA CADOLE, TERRES-DE-CHAUX (LES)
25;CHE DU CHATEAU, TERRES-DE-CHAUX (LES)
25;RTE DE CHAUX, TERRES-DE-CHAUX (LES)
25;CHE DU CHENE, TERRES-DE-CHAUX (LES)
25;IMP DE L'EGLISE, TERRES-DE-CHAUX (LES)
25;CHE DES FONTAINES, TERRES-DE-CHAUX (LES)
25;CHE DE GEFANE, TERRES-DE-CHAUX (LES)
25;CHE GRAVEROT, TERRES-DE-CHAUX (LES)
25;CHE DE GRIVEY, TERRES-DE-CHAUX (LES)
25;CHE DE NODS, TERRES-DE-CHAUX (LES)
25;CHE DE ROCHE ROUGE, TERRES-DE-CHAUX (LES)
25;CHE DE LA SEIGNE, TERRES-DE-CHAUX (LES)
25;IMP DES VERGERS, TERRES-DE-CHAUX (LES)
25;RTE DE BUGNY, LA CHAUX
25;RTE DE GILLEY, LA CHAUX
25;RUE DU DOCTEUR GIRARD, LA CHAUX
25;CHE DU MONTET, LA CHAUX
25;RUE DE LA NOIRETTE, LA CHAUX
25;CHEM DU PETRA, LA CHAUX
25;RTE DU SKI, LA CHAUX
25;RUE DU CHALET, CHAUX LES PASSAVANT
25;RUE LA COMBE, CHAUX LES PASSAVANT
25;VC GRANDE RUE, CHAUX LES PASSAVANT
25;RUE DE GONSELIN, CHAUX LES PASSAVANT
25;RUE DE LA JOCONDE, CHAUX LES PASSAVANT
25;RUE LA MAILLIER, CHAUX LES PASSAVANT
25;RUE DE LA PAULE, CHAUX LES PASSAVANT
25;RUE LES VIES DE VERCEL, CHAUX LES PASSAVANT
25;HAM LES COTES, CHAUX-NEUVE
25;LOT LE LERNIER, CHAUX-NEUVE
25;RUE DU CEBRIOT, CHAUX-NEUVE
25;RTE DE CHAPELLE DES BOIS, CHAUX-NEUVE
25;RUE DU CHATELET, CHAUX-NEUVE
25;RUE DES CHAUMELLES, CHAUX-NEUVE
25;RUE DE L EGLISE, CHAUX-NEUVE
25;GR GRANDE RUE, CHAUX-NEUVE
25;RUE DE LA GRANDE FONTAINE, CHAUX-NEUVE
25;RUE DES PRES PARRETS, CHAUX-NEUVE
25;PL DE LA MAIRIE, CHAUX-NEUVE
25;RTE DE BRERES, CHAY
25;RUE DE LA COMBE, CHAY
25;RUE DE LA FONTAINE, CHAY
25;RUE DES FOSSES, CHAY
25;RUE DE LA FORGE, CHAY
25;RUE DU MOULIN, CHAY
25;RUE DU PONT, CHAY
25;RUE PRINCIPALE, CHAY
25;RTE DE RENNES, CHAY
25;RUE DE ROCHES, CHAY
25;CHE DE BAS DE ROUGEOLLE, CHAY
25;RUE DE LA VIERGE, CHAY
25;RUE DES ILES, CHAY
25;CHE DU CIMETIERE, CHAZOT
25;RUE DE LA CHAPELLE, CHAZOT
25;IMP DES CRAS, CHAZOT
25;RTE DE CROSEY, CHAZOT
25;CHE DE FONTENELLE, CHAZOT
25;PL DE L EGLISE, CHAZOT
25;RUE DE LA FROMAGERIE, CHAZOT
25;GR GRANDE RUE, CHAZOT
25;CHE DE MONTOT, CHAZOT
25;VC SOUS TORME, CHAZOT
25;RUE DES SUEDES, CHAZOT
25;RTE DE VELLEVAUS, CHAZOT
25;CHE DE LA VIE DES ANGLES, CHAZOT
25;LOT LA COMBE AU PRETRE, CHEMAUDIN ET VAUX
25;CLOS MENUEY, CHEMAUDIN ET VAUX
25;LOT DES DESSUS DES LOUTRES, CHEMAUDIN ET VAUX
25;LOT LA CROISEE DES LAVES, CHEMAUDIN ET VAUX
25;LOT LES JARDINS DE LA NOUELLE, CHEMAUDIN ET VAUX
25;RES LA ROBERDE, CHEMAUDIN ET VAUX
25;LOT LE CHATEAU, CHEMAUDIN ET VAUX
25;IMP BEAUVALLON, CHEMAUDIN ET VAUX
25;RUE DES CHARMES, CHEMAUDIN ET VAUX
25;CHE DE BEAUVALLON, CHEMAUDIN ET VAUX
25;RTE DE BESANCON, CHEMAUDIN ET VAUX
25;RUE DU CALVAIRE, CHEMAUDIN ET VAUX
25;CHE DE CHAMP RICHARD, CHEMAUDIN ET VAUX
25;CHE DES GRANDS CHAMPS, CHEMAUDIN ET VAUX
25;IMP DU CHALET, CHEMAUDIN ET VAUX
25;RUE DU CHATEAU D EAU, CHEMAUDIN ET VAUX
25;CHE DES CHAUVIERES, CHEMAUDIN ET VAUX
25;RUE DE LA COMBE, CHEMAUDIN ET VAUX
25;CHE DES CHENES, CHEMAUDIN ET VAUX
25;GR GRANDE RUE CHEMAUDIN, CHEMAUDIN ET VAUX
25;RUE DES FROMENTELLES, CHEMAUDIN ET VAUX
25;CHE DES LANCIS, CHEMAUDIN ET VAUX
25;RUE DES LAVES, CHEMAUDIN ET VAUX
25;CHE DE LONGEAIGE, CHEMAUDIN ET VAUX
25;RUE DU MALOUBIER, CHEMAUDIN ET VAUX
25;RUE DES MAISONS NEUVES, CHEMAUDIN ET VAUX
25;CHE DE MAITRE NICOLAS, CHEMAUDIN ET VAUX
25;RUE DE LA MARE, CHEMAUDIN ET VAUX
25;CHE DE MENUEY, CHEMAUDIN ET VAUX
25;IMP MOURGIOURDOT, CHEMAUDIN ET VAUX
25;IMP DE LA NOUELLE, CHEMAUDIN ET VAUX
25;RUE DE LA NOUELLE, CHEMAUDIN ET VAUX
25;RUE DU PETIT CHAMPSOL, CHEMAUDIN ET VAUX
25;CHE DE LA POTTE, CHEMAUDIN ET VAUX
25;CHE DU PUITS NEUF, CHEMAUDIN ET VAUX
25;IMP DU PRETRE, CHEMAUDIN ET VAUX
25;CHE DE QUESOTTE, CHEMAUDIN ET VAUX
25;RUE DES QUERCUS, CHEMAUDIN ET VAUX
25;RUE DU RETEUX, CHEMAUDIN ET VAUX
25;IMP DU RETEUX, CHEMAUDIN ET VAUX
25;IMP DE ROUSSEY, CHEMAUDIN ET VAUX
25;RUE DU STADE, CHEMAUDIN ET VAUX
25;RUE THALES, CHEMAUDIN ET VAUX
25;RUE DE TRAVERS, CHEMAUDIN ET VAUX
25;RUE DES AUBEPINES, CHEMAUDIN ET VAUX
25;RUE BOUVERT, CHEMAUDIN ET VAUX
25;RUE DES CARDIERS, CHEMAUDIN ET VAUX
25;CLOS DU VALLON, CHEMAUDIN ET VAUX
25;RUE PYTHAGORE, CHEMAUDIN ET VAUX
25;RUE CLAUDE GIRARD, CHEMAUDIN ET VAUX
25;CHE DE CHAMPAGNEY, CHEMAUDIN ET VAUX
25;RUE DES CHARRIERES, CHEMAUDIN ET VAUX
25;RUE DU CHATEAU, CHEMAUDIN ET VAUX
25;RUE DE L ECOLE, CHEMAUDIN ET VAUX
25;RUE DE L EGLISE, CHEMAUDIN ET VAUX
25;RUE DES FOUGERES, CHEMAUDIN ET VAUX
25;CHE DU NOYER, CHEMAUDIN ET VAUX
25;RUE DE LA SOURCE, CHEMAUDIN ET VAUX
25;RUE DE LA TUILERIE, CHEMAUDIN ET VAUX
25;RTE DE VILLERS BUZON, CHEMAUDIN ET VAUX
25;IMP DES VIGNERONS, CHEMAUDIN ET VAUX
25;RUE DE LA GRANDE VIGNE, CHEMAUDIN ET VAUX
25;RUE CLAUDE GIRARD, CHEMAUDIN ET VAUX
25;CHEM DES ARBEUX, CHEMAUDIN ET VAUX
25;RUE AUGUSTE PERRET, CHEMAUDIN ET VAUX
25;CHEM DE LA TUILERIE, CHEMAUDIN ET VAUX
25;RUE DIDIER GREGOIRE TRINCANO, CHEMAUDIN ET VAUX
25;RUE VICTOR CONSIDERANT, CHEMAUDIN ET VAUX
25;RUE HENRI MOUHOT, CHEMAUDIN ET VAUX
25;RUE ALEXIS GODILLOT, CHEMAUDIN ET VAUX
25;RUE PIERRE VERNIER, CHEMAUDIN ET VAUX
25;RTE DE MAZEROLLES LE SALIN, CHEMAUDIN ET VAUX
25;RUE DES ECORCHOUES, CHEMAUDIN ET VAUX
25;RUE DES REMPARTS, CHEMAUDIN ET VAUX
25;RUE DES EPOUX GRANVELLE, CHEMAUDIN ET VAUX
25;RUE ECHAUGUETTE, CHEMAUDIN ET VAUX
25;CHE DE RONDE, CHEMAUDIN ET VAUX
25;RUE PRINCIPALE, CHEMAUDIN ET VAUX
25;RUE DES AVELINES, CHENALOTTE (LA)
25;RUE DU BOIS JOLI, CHENALOTTE (LA)
25;RUE CHARLEMAGNE, CHENALOTTE (LA)
25;RUE CLOS DE LA VIE, CHENALOTTE (LA)
25;RUE DES ECOLES, CHENALOTTE (LA)
25;RUE DE L'EGLISE, CHENALOTTE (LA)
25;RUE DE LA FONTAINE, CHENALOTTE (LA)
25;RUE LE FRENE, CHENALOTTE (LA)
25;RUE DES JONQUILLES, CHENALOTTE (LA)
25;RUE LIMONADERIE, CHENALOTTE (LA)
25;IMP DES NARCISSES, CHENALOTTE (LA)
25;RUE DES PALAIS, CHENALOTTE (LA)
25;RUE DE ROSEMONT, CHENALOTTE (LA)
25;RUE DES TILLEULS, CHENALOTTE (LA)
25;RUE DES TOURBIERES, CHENALOTTE (LA)
25;LOT LA BERGERE, CHENECEY-BUILLON
25;RUE DE L'ANCIENNE FONTAINE, CHENECEY-BUILLON
25;RUE DE LA BERGERE, CHENECEY-BUILLON
25;CHE DU BAS DES COMBES, CHENECEY-BUILLON
25;RTE DE BESANCON, CHENECEY-BUILLON
25;CHE DE BUILLON, CHENECEY-BUILLON
25;RUE DE LA CARRIERE, CHENECEY-BUILLON
25;RUE DU CERISIER, CHENECEY-BUILLON
25;CHE DU CHALET D'ARGUEL, CHENECEY-BUILLON
25;RUE DU CHAMP DE LA CROIX, CHENECEY-BUILLON
25;RUE DU CHARMILLE, CHENECEY-BUILLON
25;RUE DES CHARRIERES, CHENECEY-BUILLON
25;RUE DU CHAZAL, CHENECEY-BUILLON
25;CHE DES COMBES MARINS, CHENECEY-BUILLON
25;RUE COMBE TOLLIN, CHENECEY-BUILLON
25;RUE DE L EGLISE, CHENECEY-BUILLON
25;RTE D'EPEUGNEY, CHENECEY-BUILLON
25;CHE DE LA FERME DE BUILLON, CHENECEY-BUILLON
25;RUE DU FOITEY, CHENECEY-BUILLON
25;CHE DES FORGES, CHENECEY-BUILLON
25;CHE DES FOURNIERS, CHENECEY-BUILLON
25;RUE DU FRENE, CHENECEY-BUILLON
25;CHE DU GOUFFRE, CHENECEY-BUILLON
25;RUE DES GRANGES MATHIEU, CHENECEY-BUILLON
25;GR GRANDE RUE, CHENECEY-BUILLON
25;CHE DE LA GROTEILLE, CHENECEY-BUILLON
25;RUE DE LA LAVIERE, CHENECEY-BUILLON
25;CHE DE LA LEVERE, CHENECEY-BUILLON
25;RUE DE LA MESSE, CHENECEY-BUILLON
25;CHE DE LA MILLIERE, CHENECEY-BUILLON
25;CHE DE MONTROND, CHENECEY-BUILLON
25;CHE DU MOULIN, CHENECEY-BUILLON
25;CHE NOIR, CHENECEY-BUILLON
25;RUE DE LA PAROUSE, CHENECEY-BUILLON
25;RTE DES PLANCHES, CHENECEY-BUILLON
25;CHE DU POINT DE VUE, CHENECEY-BUILLON
25;CHE DES PRES, CHENECEY-BUILLON
25;CHE DES RAQUENAILLES, CHENECEY-BUILLON
25;RUE SOUS LA ROCHE, CHENECEY-BUILLON
25;RUE SUR LA ROCHE, CHENECEY-BUILLON
25;RUE DU STADE, CHENECEY-BUILLON
25;RUE DES TILLEULS, CHENECEY-BUILLON
25;RUE DE TRAVERS, CHENECEY-BUILLON
25;CHE DES VERGERS CHARMETS, CHENECEY-BUILLON
25;RUE DE VILLE, CHENECEY-BUILLON
25;IMP COMBE MARIN, CHENECEY-BUILLON
25;IMP DES EMIGUETTES, CHENECEY-BUILLON
25;IMP DE LA CHENEVIERE, CHENECEY-BUILLON
25;RUE COMBE MARIN, CHENECEY-BUILLON
25;HAM DU VERT COTEAU, CHEVIGNEY SUR L'OGNON
25;LOT DU CHATEAU, CHEVIGNEY SUR L'OGNON
25;LOT MIGEON, CHEVIGNEY SUR L'OGNON
25;RUE DE LA BIBLIOTHEQUE, CHEVIGNEY SUR L'OGNON
25;RUE DU CHAMP POTOT, CHEVIGNEY SUR L'OGNON
25;RUE CHAMPOTOT, CHEVIGNEY SUR L'OGNON
25;RUE DU CHATEAU, CHEVIGNEY SUR L'OGNON
25;CHE DES CHAMPS DU MOULIN, CHEVIGNEY SUR L'OGNON
25;CHE DES EPICEAS, CHEVIGNEY SUR L'OGNON
25;RUE DE L ECOLE, CHEVIGNEY SUR L'OGNON
25;GR GRANDE RUE, CHEVIGNEY SUR L'OGNON
25;CHE DU GOUSSOT, CHEVIGNEY SUR L'OGNON
25;RUE DE LA GRANGE DU BAS, CHEVIGNEY SUR L'OGNON
25;RUE DES NOUES, CHEVIGNEY SUR L'OGNON
25;IMP DU LAVOIR, CHEVIGNEY SUR L'OGNON
25;CHE DE ST LEGER, CHEVIGNEY SUR L'OGNON
25;RUE DES SAPINS, CHEVIGNEY SUR L'OGNON
25;RUE DU VERT COTEAU, CHEVIGNEY SUR L'OGNON
25;RUE DU CAMP, CHEVIGNEY-LES-VERCEL
25;RUE DES CARELLES, CHEVIGNEY-LES-VERCEL
25;PL DE L EGLISE, CHEVIGNEY-LES-VERCEL
25;GR GRANDE RUE, CHEVIGNEY-LES-VERCEL
25;RUE DU PETIT BOIS, CHEVIGNEY-LES-VERCEL
25;CHE DES ROUTES, CHEVIGNEY-LES-VERCEL
25;RTE DE VERCEL, CHEVIGNEY-LES-VERCEL
25;CHE DES CHARMEUX, CHEVIGNEY-LES-VERCEL
25;RUE DES GRANGES, CHEVIGNEY-LES-VERCEL
25;LOT DES NOYERS, LA CHEVILLOTTE
25;RTE DE NAISEY, LA CHEVILLOTTE
25;IMP DE L'OREE DU BOIS, CHEVROZ
25;CHE DE LA CHARRETTE, CHEVROZ
25;IMP DU CHATEAU, CHEVROZ
25;RUE DES CHENEVIERES, CHEVROZ
25;RUE DES FONTAINES, CHEVROZ
25;RTE DE GENEUILLE, CHEVROZ
25;CHEM DE L'ILE, CHEVROZ
25;RUE DU PRE DU ROY, CHEVROZ
25;RUE DE LA ROCHETTE, CHEVROZ
25;RTE DE VESOUL, CHEVROZ
25;RUE DE L ABREUVOIR, CHOUZELOT
25;CHE DU BOIS DE CHANTELIBAS, CHOUZELOT
25;RTE DE BUSY, CHOUZELOT
25;RTE DE BYANS, CHOUZELOT
25;RUE CHARLES PRILLARD, CHOUZELOT
25;CHE DE CHANTELIBAS, CHOUZELOT
25;RUE DU CLOS, CHOUZELOT
25;CHE DES GADOUOIRES, CHOUZELOT
25;GR GRANDE RUE, CHOUZELOT
25;RTE DE LYON, CHOUZELOT
25;RTE DU MONT GARDOT, CHOUZELOT
25;RTE NATIONALE, CHOUZELOT
25;CHEM DU PREI, CHOUZELOT
25;CHE DE TRAVERSE, CHOUZELOT
25;CHE DES VIGNES, CHOUZELOT
25;RUE JEAN COMPAGNON, CHOUZELOT
25;CHEM DE LA GARE, CLERON
25;RUE DE LA BATAILLE, CLERON
25;RUE DU CHATEAU, CLERON
25;RUE DU CHENE, CLERON
25;CHEM DE CHAUCHU, CLERON
25;RUE DE LA GOULOTTE, CLERON
25;GR GRANDE RUE, CLERON
25;CHEM DE L'EPINE, CLERON
25;RUE DES HAUTS DE CLERON, CLERON
25;IMP DE LA FRUITIERE, CLERON
25;RUE DE LA LAVE, CLERON
25;RUE DE LA LOUE, CLERON
25;RUE DU MONT, CLERON
25;CHE DU MOULIN, CLERON
25;RUE DE NAHIN, CLERON
25;RUE DU NECLOS, CLERON
25;RUE DE L ORATOIRE, CLERON
25;PL DE L'EGLISE, CLERON
25;RUE DU PATER, CLERON
25;RUE DU SINGLE, CLERON
25;RUE DU PETIT CHENEAU, CLERON
25;RUE DU PRELOT, CLERON
25;SEN DU TACOT, CLERON
25;RUE DE LA TRAVERSE, CLERON
25;CHE DU VIADUC, CLERON
25;LOT DELACOUR, PAYS DE CLERVAL
25;LOT DE LA COUR, PAYS DE CLERVAL
25;LOT LA CRAIE, PAYS DE CLERVAL
25;LOT LA LAUCHERE, PAYS DE CLERVAL
25;LOT LES BROTTES, PAYS DE CLERVAL
25;RTE D ANTEUIL PAYS CLERVAL, PAYS DE CLERVAL
25;RUE BASSE, PAYS DE CLERVAL
25;RUE BERAUD, PAYS DE CLERVAL
25;RUE DE BESANCON, PAYS DE CLERVAL
25;RTE DE BESANCON, PAYS DE CLERVAL
25;RTE DE BRANNE, PAYS DE CLERVAL
25;RUE DU CANAL, PAYS DE CLERVAL
25;CHE DE LA CHAPELLE, PAYS DE CLERVAL
25;RUE DE LA CRAIE, PAYS DE CLERVAL
25;RUE DELACOUR, PAYS DE CLERVAL
25;RUE DE L EGLISE, PAYS DE CLERVAL
25;RUE DU FOUR, PAYS DE CLERVAL
25;RUE DE LA FONTAINE PAYS CLER, PAYS DE CLERVAL
25;PL DE LA GARE, PAYS DE CLERVAL
25;AV GASTON RENAUD, PAYS DE CLERVAL
25;RUE GASTON RENAUD, PAYS DE CLERVAL
25;RUE GEORGES FAIVRE, PAYS DE CLERVAL
25;PL DU GRAVIER, PAYS DE CLERVAL
25;RUE HAUTE, PAYS DE CLERVAL
25;RTE DE L HOPITAL, PAYS DE CLERVAL
25;PL DE L HOTEL DE VILLE, PAYS DE CLERVAL
25;RUE DES HUSSARDS, PAYS DE CLERVAL
25;RTE DE L ISLE, PAYS DE CLERVAL
25;RUE JEAN BILLEREY, PAYS DE CLERVAL
25;RUE DE LA LAUCHERE, PAYS DE CLERVAL
25;RUE LEONEL DE MOUSTIER, PAYS DE CLERVAL
25;PL DE LA LIBERATION, PAYS DE CLERVAL
25;CHE DU MILLERY, PAYS DE CLERVAL
25;RUE DU MILIEU, PAYS DE CLERVAL
25;RUE DES MURS, PAYS DE CLERVAL
25;CHE DES MURS, PAYS DE CLERVAL
25;RUE DE LA PLENOISE, PAYS DE CLERVAL
25;RUE DE LA PORTE DE CHAUX, PAYS DE CLERVAL
25;RUE DE LA PORTE DES NOYES, PAYS DE CLERVAL
25;CHE DE POULIGNEY, PAYS DE CLERVAL
25;RUE DU QUARTIER, PAYS DE CLERVAL
25;RUE DU RELAIS, PAYS DE CLERVAL
25;RUE DE SAINT QUENTIN, PAYS DE CLERVAL
25;RTE DE SANTOCHE, PAYS DE CLERVAL
25;RUE DE SANTOCHE, PAYS DE CLERVAL
25;RUE SOUS LA LAUCHERE, PAYS DE CLERVAL
25;IMP DU SOUVENIR, PAYS DE CLERVAL
25;RTE DE SOYE, PAYS DE CLERVAL
25;RUE DU STADE, PAYS DE CLERVAL
25;RUE DES TANNERIES, PAYS DE CLERVAL
25;RUE DES TERREAUX, PAYS DE CLERVAL
25;RUE DE LA TRAVERSE, PAYS DE CLERVAL
25;RUE DE LA TUILERIE, PAYS DE CLERVAL
25;RUE DES URSULINES, PAYS DE CLERVAL
25;RUE DE VERDUN, PAYS DE CLERVAL
25;RUE DE CLERVAL, PAYS DE CLERVAL
25;RUE DES BROTTES, PAYS DE CLERVAL
25;RUE DU DOLMEN, PAYS DE CLERVAL
25;IMP DU DOUBS, PAYS DE CLERVAL
25;RUE SAINT ERMENFROI, PAYS DE CLERVAL
25;RTE DE POMPIERRE, PAYS DE CLERVAL
25;RUE DES VERGERS D'ARMAND, PAYS DE CLERVAL
25;RTE D ANTEUIL CHAUX, PAYS DE CLERVAL
25;RUE DES CHALETS, PAYS DE CLERVAL
25;GR GRANDE RUE, PAYS DE CLERVAL
25;RUE DES LILAS, PAYS DE CLERVAL
25;RUE DE LA PLACE, PAYS DE CLERVAL
25;RUE DE LA SCIE, PAYS DE CLERVAL
25;RUE DE LA SCIERIE, PAYS DE CLERVAL
25;RUE DE LA CHAPELLE, PAYS DE CLERVAL
25;RUE CHARDENNOT, PAYS DE CLERVAL
25;RTE DE SANCEY, PAYS DE CLERVAL
25;RUE DE CROSEY, PAYS DE CLERVAL
25;RUE DES VIGNES, PAYS DE CLERVAL
25;RUE DE LA FONTAINE CHAUX, PAYS DE CLERVAL
25;CHE DE LA ROCHE, PAYS DE CLERVAL
25;CHE SOUS LES VIGNES, PAYS DE CLERVAL
25;LOT LES FOURNEAUX, LA CLUSE ET MIJOUX
25;RUE VAL DU FORT, LA CLUSE ET MIJOUX
25;RUE DE LA BASCULE, COLOMBIER-FONTAINE
25;RUE DU BIE, COLOMBIER-FONTAINE
25;RUE DU CANAL, COLOMBIER-FONTAINE
25;RUE DE LA CANTINE, COLOMBIER-FONTAINE
25;RUE DE LA CHAISERIE, COLOMBIER-FONTAINE
25;RUE DE CHAMPAGNE, COLOMBIER-FONTAINE
25;RUE DES CHAMPS MONTANTS, COLOMBIER-FONTAINE
25;RUE DES CHARMES, COLOMBIER-FONTAINE
25;RUE DU CHATEAU D EAU, COLOMBIER-FONTAINE
25;RUE DU CIMETIERE, COLOMBIER-FONTAINE
25;RUE DES CITES, COLOMBIER-FONTAINE
25;CHE DES COMBES, COLOMBIER-FONTAINE
25;RUE DE COUTREMONT, COLOMBIER-FONTAINE
25;RUE DES CRES, COLOMBIER-FONTAINE
25;RUE DU DOUBS, COLOMBIER-FONTAINE
25;RUE DE LA DOUVE, COLOMBIER-FONTAINE
25;RUE DES ECOLES, COLOMBIER-FONTAINE
25;PL DE L EGLISE, COLOMBIER-FONTAINE
25;RUE DE LA FILATURE, COLOMBIER-FONTAINE
25;IMP DE LA GARE, COLOMBIER-FONTAINE
25;RUE DE LA GARE, COLOMBIER-FONTAINE
25;RUE DU GRAVEROT, COLOMBIER-FONTAINE
25;IMP DES NOISETIERS, COLOMBIER-FONTAINE
25;RUE DES OUCHES, COLOMBIER-FONTAINE
25;CHEM DES PLANCHES, COLOMBIER-FONTAINE
25;RUE DES PRES, COLOMBIER-FONTAINE
25;GR GRANDE RUE, COLOMBIER-FONTAINE
25;RUE DE SAINT MAURICE, COLOMBIER-FONTAINE
25;RUE DU 16 NOVEMBRE 1944, COLOMBIER-FONTAINE
25;RUE DE LA SOURCE, COLOMBIER-FONTAINE
25;RUE DU STADE, COLOMBIER-FONTAINE
25;RUE DU TEMPLE, COLOMBIER-FONTAINE
25;RUE DU TROULOT, COLOMBIER-FONTAINE
25;CHE DE VEAUX, COLOMBIER-FONTAINE
25;RUE DES VERGERS, COLOMBIER-FONTAINE
25;CHE DES MONTS BOBILLIERS, LES COMBES
25;RUE DU VIEUX CHALET, LES COMBES
25;RUE DES CHAMOIS, LES COMBES
25;IMP DU CHAZAL, LES COMBES
25;RUE DES CLARINES, LES COMBES
25;RTE DE LA COLOMBIERE, LES COMBES
25;PL DE LA COLOMBIERE, LES COMBES
25;RUE DES DOLINES, LES COMBES
25;RUE DE L EGLISE, LES COMBES
25;RUE DES EPINETTES, LES COMBES
25;RTE DE LA FONTAINE, LES COMBES
25;IMP DE LA GARE, LES COMBES
25;RUE DES GENTIANES, LES COMBES
25;RTE DE GILLEY, LES COMBES
25;RTE DE LA GROTTE, LES COMBES
25;RTE DU LUISANS, LES COMBES
25;RUE DU 8 MAI, LES COMBES
25;PL DE LA MAIRIE, LES COMBES
25;RUE DU MOULIN, LES COMBES
25;RUE DU POUCHET, LES COMBES
25;IMP LE REVET, LES COMBES
25;CHE DE DERRIERE SEUILLET, LES COMBES
25;RUE DU BOIS DES DAMES, CORCELLES-FERRIERES
25;RUE DU CHAMP DU CHAT, CORCELLES-FERRIERES
25;RUE DE LA CITADELLE, CORCELLES-FERRIERES
25;IMP DU CHAMP DU CHAT, CORCELLES-FERRIERES
25;CHE DES COMMUNAUX, CORCELLES-FERRIERES
25;RUE DE L'ETANG, CORCELLES-FERRIERES
25;PL DE LA FONTAINE, CORCELLES-FERRIERES
25;RUE GRANDE RUE, CORCELLES-FERRIERES
25;RUE DE  JALLERANGE, CORCELLES-FERRIERES
25;RTE DE LAVERNAY, CORCELLES-FERRIERES
25;RUE DE MARNAY, CORCELLES-FERRIERES
25;RUE DES ONGLOTS, CORCELLES-FERRIERES
25;RUE DU PARADIS, CORCELLES-FERRIERES
25;RUE DES PLANCHES, CORCELLES-FERRIERES
25;RUE DES PRELOTS, CORCELLES-FERRIERES
25;RUE DU SABOTIER, CORCELLES-FERRIERES
25;RUE DE SAINT VIT, CORCELLES-FERRIERES
25;RUE DE LA VIERGE, CORCELLES-FERRIERES
25;RUE DU CHATEAU, CORCELLE-MIESLOT
25;RUE DE LA CRAIE, CORCELLE-MIESLOT
25;RUE DE LA MAIRIE, CORCELLE-MIESLOT
25;RUE DES NOYERS, CORCELLE-MIESLOT
25;RUE DES OUDOTS, CORCELLE-MIESLOT
25;CHE DU TILLEUL, CORCELLE-MIESLOT
25;RUE DE L EGLISE, CORCONDRAY
25;RUE FERME DE L ETANG, CORCONDRAY
25;RUE HAMEAU DE L ETANG, CORCONDRAY
25;RUE DE L ETANG, CORCONDRAY
25;CHE DES GRANDS CHAMPS, CORCONDRAY
25;GR GRANDE RUE, CORCONDRAY
25;RTE DE LAVERNAY, CORCONDRAY
25;PL DU MONUMENT, CORCONDRAY
25;CHE DE PONTCHARREAU, CORCONDRAY
25;IMP RIOTTES, CORCONDRAY
25;CHE DE LA TOUR, CORCONDRAY
25;CHE DES VIGNES, CORCONDRAY
25;RUE DU CHATEAU, COTEBRUNE
25;CHE DU CREUX, COTEBRUNE
25;CHE DE LA FONTAINE, COTEBRUNE
25;PL DE LA MAIRIE, COTEBRUNE
25;RUE DE LA MAIRIE, COTEBRUNE
25;RUE PERROT, COTEBRUNE
25;RUE PRINCIPALE, COTEBRUNE
25;RUE DES TILLEULS, COTEBRUNE
25;RUE DES VERGERS, COTEBRUNE
25;RUE DE L AERODROME, COURCELLES-LES-MONTBELIARD
25;RUE DU BOIS, COURCELLES-LES-MONTBELIARD
25;RUE DU CANAL, COURCELLES-LES-MONTBELIARD
25;RUE DES CERISIERS, COURCELLES-LES-MONTBELIARD
25;RUE DE LA CHAPELLE, COURCELLES-LES-MONTBELIARD
25;RUE DES CHENES, COURCELLES-LES-MONTBELIARD
25;RUE DE  CHEVRIERS, COURCELLES-LES-MONTBELIARD
25;RUE DES COQUELICOTS, COURCELLES-LES-MONTBELIARD
25;RUE DES CORNEILLIERES, COURCELLES-LES-MONTBELIARD
25;RUE DE LA COTOTE, COURCELLES-LES-MONTBELIARD
25;RUE DE LA CRUE, COURCELLES-LES-MONTBELIARD
25;RUE DE L ECLUSE, COURCELLES-LES-MONTBELIARD
25;RUE ETIENNE OEHMICHEN, COURCELLES-LES-MONTBELIARD
25;RUE DES FLEURS, COURCELLES-LES-MONTBELIARD
25;RUE DES IRIS, COURCELLES-LES-MONTBELIARD
25;IMP DES JARDINS, COURCELLES-LES-MONTBELIARD
25;RUE DES LILAS, COURCELLES-LES-MONTBELIARD
25;RUE DES MARGUERITES, COURCELLES-LES-MONTBELIARD
25;RUE MECHAIN, COURCELLES-LES-MONTBELIARD
25;RUE DE MONTBELIARD, COURCELLES-LES-MONTBELIARD
25;RUE DE LA PETITE HOLLANDE, COURCELLES-LES-MONTBELIARD
25;RUE DES PEUPLIERS, COURCELLES-LES-MONTBELIARD
25;RUE DE LA COMBE AUX PINS, COURCELLES-LES-MONTBELIARD
25;RUE DES POMMIERS, COURCELLES-LES-MONTBELIARD
25;RUE DES PRES, COURCELLES-LES-MONTBELIARD
25;IMP DES PRIMEVERES, COURCELLES-LES-MONTBELIARD
25;RUE ROMPENCOT, COURCELLES-LES-MONTBELIARD
25;RUE DU STADE, COURCELLES-LES-MONTBELIARD
25;RUE DES TOUVIERS, COURCELLES-LES-MONTBELIARD
25;RUE DES VERGERS, COURCELLES-LES-MONTBELIARD
25;RUE DES VIGNOTTES, COURCELLES-LES-MONTBELIARD
25;RUE DES VIOLETTES, COURCELLES-LES-MONTBELIARD
25;RUE DE VOUJEAUCOURT, COURCELLES-LES-MONTBELIARD
25;RUE DE LA FONTAINE, COURCELLES
25;CHE DE LA FOUGERE, COURCELLES
25;GR GRANDE RUE, COURCELLES
25;RUE DU MONT, COURCELLES
25;VC PRES DE L'ETANG, COURCELLES
25;RTE DE QUINGEY, COURCELLES
25;LOT LES GRANDS GRAVIERS, COURCHAPON
25;RUE DES CLOS, COURCHAPON
25;CHE D ETRABONNE, COURCHAPON
25;GR GRANDE RUE, COURCHAPON
25;PL DE L EGLISE, COURCHAPON
25;CHE DE LANTENNE, COURCHAPON
25;CHE DU MOULIN, COURCHAPON
25;RLE DES MUROTS, COURCHAPON
25;CHEM DU PETIT BOIS, COURCHAPON
25;CHE DU RUISSEAU, COURCHAPON
25;RUE DES TILLEULS, COURCHAPON
25;RUE DU VAL DE L'OGNON, COURCHAPON
25;CHE DE VAUBOULON, COURCHAPON
25;RUE DES MOULINS, COURCHAPON
25;RUE DES CHALETS, COUR-SAINT-MAURICE
25;RUE DE LA CHAPELLE, COUR-SAINT-MAURICE
25;RUE DE LA CHAISERIE, COUR-SAINT-MAURICE
25;RUE DU CIMETIERE, COUR-SAINT-MAURICE
25;RUE DE COUR, COUR-SAINT-MAURICE
25;RUE DU DESSOUBRE, COUR-SAINT-MAURICE
25;RUE DE L'ECLUSE, COUR-SAINT-MAURICE
25;PL DE L'EGLISE, COUR-SAINT-MAURICE
25;RUE DE FERRIERE, COUR-SAINT-MAURICE
25;RUE GRANDE, COUR-SAINT-MAURICE
25;RUE DE LA MAIRIE, COUR-SAINT-MAURICE
25;RUE DES PECHEURS, COUR-SAINT-MAURICE
25;RUE DU STADE, COUR-SAINT-MAURICE
25;RUE DE VAUCLUSE, COUR-SAINT-MAURICE
25;RUE DU VILLAGE DE COUR, COUR-SAINT-MAURICE
25;RUE DU BAN, COURTEFONTAINE
25;RUE DU CHALET, COURTEFONTAINE
25;RUE DE LA CRAIE, COURTEFONTAINE
25;RUE SOUS L'EGLISE, COURTEFONTAINE
25;RUE DE DERRIERE LES FAITS, COURTEFONTAINE
25;RUE GRANDE, COURTEFONTAINE
25;RUE DU LAVOIR, COURTEFONTAINE
25;RUE DE LA LOUVIERE, COURTEFONTAINE
25;CHEM DE LA MESSENOTTE, COURTEFONTAINE
25;RUE DE LA PATUROTTE, COURTEFONTAINE
25;RUE DE LA RASSE, COURTEFONTAINE
25;RUE DU SAUVAGE, COURTEFONTAINE
25;RUE DU SAUVEUR, COURTEFONTAINE
25;RUE LES VAREILLES, COURTEFONTAINE
25;CHE DES CHAUCHEUX, COURTETAIN ET SALANS
25;CHEM D'EXPLOITAION N 9, COURTETAIN ET SALANS
25;CHE DE LA COTE, COURTETAIN ET SALANS
25;RUE DE L'EGLISE, COURTETAIN ET SALANS
25;CHE DE LA MAIRIE, COURTETAIN ET SALANS
25;RUE GRANDE RUE, COURTETAIN ET SALANS
25;RUE DU TILLEUL, COURTETAIN ET SALANS
25;RUE DE L AUBETTE, COURVIERES
25;RUE DU BARBOUILLON, COURVIERES
25;RUE DU CHATEAU D EAU, COURVIERES
25;RUE DES ECOLES, COURVIERES
25;RUE DE CUVIER, COURVIERES
25;RUE DES ESSARTS, COURVIERES
25;RUE DU FRENE, COURVIERES
25;RUE DU MOULIN, COURVIERES
25;CHE DU PARU, COURVIERES
25;RUE DES VIEILLES PERRIERES, COURVIERES
25;CHE DES PLAINES, COURVIERES
25;RUE DE LA POSTE, COURVIERES
25;RUE DU PRE COUVERT, COURVIERES
25;CHE DES PREFILLES, COURVIERES
25;RTE DE SALINS, COURVIERES
25;RUE DU VIEUX PUIT, COURVIERES
25;HAM DE LA FORET, CROSEY LE GRAND
25;LOT LES QUARES, CROSEY LE GRAND
25;RUE DE BATAILLOT, CROSEY LE GRAND
25;RTE DE CHAZOT, CROSEY LE GRAND
25;CHE DES COMBES, CROSEY LE GRAND
25;RUE DE L'ECOLE, CROSEY LE GRAND
25;RUE DE L'EGLISE, CROSEY LE GRAND
25;RUE DE LA FONTAINE, CROSEY LE GRAND
25;RUE DE LA FORET, CROSEY LE GRAND
25;RUE GRANDE RUE, CROSEY LE GRAND
25;RUE DU LAVOIR, CROSEY LE GRAND
25;RTE DE MONTNOIROTTE, CROSEY LE GRAND
25;RUE DES QUARES, CROSEY LE GRAND
25;RUE DU BAS, CROSEY LE PETIT
25;RUE BEGIN, CROSEY LE PETIT
25;RTE DE CLERVAL, CROSEY LE PETIT
25;RUE DU CORNET, CROSEY LE PETIT
25;RTE DE CROSEY LE GRAND, CROSEY LE PETIT
25;CHE DE CUSANCE, CROSEY LE PETIT
25;RUE DE LA FONTAINE, CROSEY LE PETIT
25;RUE DU GRAND VERGER, CROSEY LE PETIT
25;RUE DE LA GRAPPE, CROSEY LE PETIT
25;RUE DES LILAS, CROSEY LE PETIT
25;RUE DU DESSUS, CROSEY LE PETIT
25;GR GRANDE RUE, CROSEY LE PETIT
25;RTE DU LOMONT, CROSEY LE PETIT
25;RTE DE VELLEVANS, CROSEY LE PETIT
25;RUE DES VERGEROTS, CROSEY LE PETIT
25;RTE DES CHAMPS CLOISIERS, LE CROUZET
25;RTE DES COMBES DERNIERS, LE CROUZET
25;RUE SAINTE ANNE, LE CROUZET
25;RUE DE LA FONTAINE, LE CROUZET
25;RUE GRANDE RUE, LE CROUZET
25;IMP IMPASSE, LE CROUZET
25;RUE DE L AUBERGE, CROUZET-MIGETTE
25;CHE DU BONHEUR, CROUZET-MIGETTE
25;RUE DES CHEVRIES, CROUZET-MIGETTE
25;RUE COMBE LUETTE, CROUZET-MIGETTE
25;RUE DES BEAUX GARCONS, CROUZET-MIGETTE
25;RUE DU CHAMP GOGNET, CROUZET-MIGETTE
25;RUE DU CHAZAL, CROUZET-MIGETTE
25;RUE DU CUL DE SAC, CROUZET-MIGETTE
25;RUE DU DEROUCHOU, CROUZET-MIGETTE
25;RUE SUR LA CROIX, CROUZET-MIGETTE
25;RUE DE L EGLISE, CROUZET-MIGETTE
25;CHE MELISANE, CROUZET-MIGETTE
25;RUE DE MIGETTE, CROUZET-MIGETTE
25;RTE DE NANS, CROUZET-MIGETTE
25;PL DU NIAUD, CROUZET-MIGETTE
25;RTE DE SAINTE ANNE, CROUZET-MIGETTE
25;RUE DES SOURCES, CROUZET-MIGETTE
25;RUE DES TERRASSES, CROUZET-MIGETTE
25;RUE DE LA TIOUPE, CROUZET-MIGETTE
25;RTE DE VILLENEUVE, CROUZET-MIGETTE
25;RTE DU PONT DU DIABLE, CROUZET-MIGETTE
25;MAIS D ACCUEIL SPECIALISEE, CUBRIAL
25;CHE DE LA COTE, CUBRIAL
25;RTE DE CUSE, CUBRIAL
25;RUE DE L EGALITE, CUBRIAL
25;RUE DE LA GOUTTE, CUBRIAL
25;CHE DU JARDIN BLANC, CUBRIAL
25;RUE DU MOULIN, CUBRIAL
25;RTE DE PONT, CUBRIAL
25;CHE DU TILLON, CUBRIAL
25;CHE SUR LA VELLE, CUBRIAL
25;CHE DE LA VIERGE, CUBRIAL
25;CHE DES VIGNES, CUBRIAL
25;RUE DU MONUMENT, CUBRY
25;CHE DE LA BRERE, CUBRY
25;RUE DU CHATEAU, CUBRY
25;RUE DE LA FONTAINE GIRARD, CUBRY
25;RUE DE L EPICERIE, CUBRY
25;RUE DE LA FRUITIERE, CUBRY
25;IMP DE LA CURE, CUSANCE
25;CHE DE LA CHAPELLE, CUSANCE
25;CHE DU CHAUFFOUR, CUSANCE
25;IMP DE L'ECOLE, CUSANCE
25;RUE DE L'ECOLE, CUSANCE
25;CHE DU LAVOIR, CUSANCE
25;RTE DU LOMONT, CUSANCE
25;RTE DU MONT MILLOT, CUSANCE
25;CHE DU MONT NOIROT, CUSANCE
25;CHE DU MOULIN, CUSANCE
25;CHE DE LA PAPETERIE POUILLET, CUSANCE
25;CHE DE LA SOURCE BLEUE, CUSANCE
