32;QUA LE BOURGUET, AIGNAN
32;LOT GUILHEMBLANC, AIGNAN
32;CITE LE VERGER, AIGNAN
32;RUE DE L'ABBE MONLEZUN, AIGNAN
32;PL DES ARENES, AIGNAN
32;AV DE L'ARMAGNAC, AIGNAN
32;RUE DES ARTS, AIGNAN
32;RUE DU BATAILLON DE L'ARMAGNAC, AIGNAN
32;CHE DE BLANIN, AIGNAN
32;CHE DU BOIS, AIGNAN
32;RUE DU DUC DE BOUILLON, AIGNAN
32;PL DU BOURGUET, AIGNAN
32;RTE DE CASTELNAVET, AIGNAN
32;CHE DU CAROY, AIGNAN
32;RUE DES CASTORS, AIGNAN
32;RUE DU CENTRE, AIGNAN
32;CHE DE LA COUDETTE, AIGNAN
32;PL DU COLONEL PARISOT, AIGNAN
32;RUE DU DIX NEUF MARS 1962, AIGNAN
32;AV DU DOCTEUR DOUSSET, AIGNAN
32;RTE D EAUZE, AIGNAN
32;IMP DES ECOLES, AIGNAN
32;RUE DE L EGLISE, AIGNAN
32;RUE DU FOIRAIL, AIGNAN
32;RUE DE LA GENDARMERIE, AIGNAN
32;RUE GUILLAUME VITAL, AIGNAN
32;RUE DE L'HOTEL, AIGNAN
32;RUE DES JARDINS, AIGNAN
32;RUE JULES FONTAN, AIGNAN
32;CHE DE LABOURDETTE, AIGNAN
32;CHE DE LASBERDESQUES, AIGNAN
32;CITE DE LASBERDESQUES, AIGNAN
32;AV DE LA LIBERATION, AIGNAN
32;CHE DE NAOUCROUTS, AIGNAN
32;AV DE NAVARRE, AIGNAN
32;CHE DU PERDIGAT, AIGNAN
32;IMP DE LA PISCINE, AIGNAN
32;RTE DE PLAISANCE, AIGNAN
32;RUE DU PRESBYTERE, AIGNAN
32;AV DES PYRENEES, AIGNAN
32;RUE DE LA RAMPE, AIGNAN
32;RTE DE RISCLE, AIGNAN
32;RUE SAINT SATURNIN, AIGNAN
32;IMP DU SOULAN, AIGNAN
32;RUE DE LA TOUR, AIGNAN
32;CHE DE LA TUILERIE, AIGNAN
32;RTE DE L'USINE, AIGNAN
32;RUE DU VERGER, AIGNAN
32;IMP DE LA VERRERIE, AIGNAN
32;CHEM DE L'ARRATS, ANSAN
32;RTE D'AUBIET, ANSAN
32;CHEM D'EN BENTARO, ANSAN
32;CHEM DU BIGOURDAN, ANSAN
32;RTE DE CRASTES, ANSAN
32;RUE DE LA MAIRIE, ANSAN
32;IMP DU MESPLE, ANSAN
32;CHEM DE NOUGAROULET, ANSAN
32;RUE DES ROSIERS, ANSAN
32;RTE DE SAINT SAUVY, ANSAN
32;RTE DE L'ARRANCHELAN, ANTRAS
32;RTE DE L'AULOUE, ANTRAS
32;RTE D'AUSTERLITZ, ANTRAS
32;CHEM DU BARRIOT, ANTRAS
32;CHEM DU BIAU, ANTRAS
32;CHEM DE CASSAN, ANTRAS
32;CHEM DES CRETES, ANTRAS
32;CHEM DE L'EGLISE, ANTRAS
32;CHEM D'ENCOTS, ANTRAS
32;CHEM D'ENFIEUX, ANTRAS
32;PL DU GAY, ANTRAS
32;CHEM DE MARAINGO, ANTRAS
32;CHEM DES MOULINS, ANTRAS
32;CHEM DE TACHUS, ANTRAS
32;RTE DU VILLAGE, ANTRAS
32;RTE DE BARCELONNE, ARBLADE-LE-BAS
32;RTE DE BEROLLE, ARBLADE-LE-BAS
32;RTE DE BOURROUILLON, ARBLADE-LE-BAS
32;RTE DE CATCHEBOT, ARBLADE-LE-BAS
32;RTE DE LELIN, ARBLADE-LE-BAS
32;RTE DU LUC, ARBLADE-LE-BAS
32;RTE DE LUPPE, ARBLADE-LE-BAS
32;IMP DU MIGNON, ARBLADE-LE-BAS
32;RTE DE PEILLAS, ARBLADE-LE-BAS
32;RTE DU REY, ARBLADE-LE-BAS
32;RTE DE VERGOIGNAN, ARBLADE-LE-BAS
32;LOT LA HITO, ARBLADE-LE-HAUT
32;RTE DE L'AUBERGE, ARBLADE-LE-HAUT
32;IMP DE BAMBALERE, ARBLADE-LE-HAUT
32;IMP DU CASSOULET, ARBLADE-LE-HAUT
32;IMP DU CHATEAU D'EAU, ARBLADE-LE-HAUT
32;RTE DU CHATEAU, ARBLADE-LE-HAUT
32;RTE E LA CROIX DE GIGNAN, ARBLADE-LE-HAUT
32;RTE DE L'EGLISE, ARBLADE-LE-HAUT
32;IMP DE HAOUERES, ARBLADE-LE-HAUT
32;RTE DE LA HEOUGUERE, ARBLADE-LE-HAUT
32;RTE DE LA HITO, ARBLADE-LE-HAUT
32;RTE DE L'IZAUTE, ARBLADE-LE-HAUT
32;RTE DE LARTIGUE, ARBLADE-LE-HAUT
32;RTE DE LOISSAN, ARBLADE-LE-HAUT
32;RTE DE LA MAIRIE, ARBLADE-LE-HAUT
32;RTE DU MARAICHER, ARBLADE-LE-HAUT
32;CHEM DU MOULIN, ARBLADE-LE-HAUT
32;IMP LE PLEYS, ARBLADE-LE-HAUT
32;IMP DE POUJOLLE, ARBLADE-LE-HAUT
32;RTE DE RISCLE, ARBLADE-LE-HAUT
32;RTE DE SAINT GRIEDE, ARBLADE-LE-HAUT
32;RTE DE SAINT MARTIN, ARBLADE-LE-HAUT
32;RTE DE TAOUZIEROT, ARBLADE-LE-HAUT
32;CHEM DE TOURNERIE, ARBLADE-LE-HAUT
32;RTE VIEILLE, ARBLADE-LE-HAUT
32;CHEM DES AUGUSTINS, ARMENTIEUX
32;IMP DE CAILLABEROUS, ARMENTIEUX
32;CHEM DE CARRERE, ARMENTIEUX
32;RTE DES CHAMPS, ARMENTIEUX
32;RTE DU CLOCHETON, ARMENTIEUX
32;CHEM DE COUDOUNIES, ARMENTIEUX
32;CHEM DE CRETE, ARMENTIEUX
32;CHEM DE GARONNE, ARMENTIEUX
32;CHEM DE LA GRAVIERE, ARMENTIEUX
32;CHEM DE LASTRECHE, ARMENTIEUX
32;IMP DE MAUPEOU, ARMENTIEUX
32;CHEM DE MESTAOUGE, ARMENTIEUX
32;CHEM DU MOULIN, ARMENTIEUX
32;CHEM DE POULOU, ARMENTIEUX
32;IMP DE LA PRADE, ARMENTIEUX
32;RES DU STADE, AUBIET
32;RUE FRANCOIS ALEM ROUSSEAU, AUBIET
32;RTE D AUCH, AUBIET
32;CHE DU BARRY, AUBIET
32;RUE DE LA BRECHE, AUBIET
32;RTE DE CASTELNAU, AUBIET
32;RUE DU CUL DE SAC, AUBIET
32;RUE DU CENTRE, AUBIET
32;RUE LEOPOLD DESTARAC, AUBIET
32;RUE DU DOCTEUR BONNEMAISON, AUBIET
32;RUE DES ECOLES, AUBIET
32;RUE DE L'EGLISE, AUBIET
32;RUE DE L'ESCALIER, AUBIET
32;RUE DU FOIRAIL, AUBIET
32;RUE DE LA FONTAINE, AUBIET
32;RUE DU FOUSSAT, AUBIET
32;AV DU FOYER RURAL, AUBIET
32;RUE DE LA GARE, AUBIET
32;RUE DE GEER, AUBIET
32;GR GRAND RUE, AUBIET
32;AV DU GROUPE SCOLAIRE, AUBIET
32;RUE ROGER LECHES, AUBIET
32;RTE DE L'ISLE ARNE, AUBIET
32;PL DE LA MAIRIE, AUBIET
32;RUE DE LA MAIRIE, AUBIET
32;PL DU 19 MARS 1962, AUBIET
32;RUE DE LA MARE, AUBIET
32;PL DE LA MARE, AUBIET
32;RTE DE MAUVEZIN, AUBIET
32;PL DES MIMOSAS, AUBIET
32;RTE DU MOULIN, AUBIET
32;RTE NATIONALE N 124, AUBIET
32;RTE DE NOUGAROULET, AUBIET
32;RUE DU PATUS, AUBIET
32;RUE DU PRESBYTERE, AUBIET
32;RUE DU PUITS, AUBIET
32;RUE PUJOL, AUBIET
32;CHE DE SAINT TAURIN, AUBIET
32;RTE DE TOULOUSE, AUBIET
32;RUE DE LA TOUR, AUBIET
32;RUE DES MIMOSAS, AUBIET
32;VTE VIEILLE ROUTE, AUBIET
32;RES JEAN DE BEAUJEU, AUCH
32;CITE DE COLMAR, AUCH
32;RES DU BARRAIL, AUCH
32;RES HELIOS, AUCH
32;RUIS DE COGARET, AUCH
32;RUIS DE TARRABUSQUE, AUCH
32;VOIE FERREE AUCH TOULOUSE, AUCH
32;VOIE FERREE TARBES AGEN, AUCH
32;RUIS DE JOURDANIS, AUCH
32;PONT DE LA TREILLE, AUCH
32;RUIS DE MONTLAUR, AUCH
32;PONT GARIGLIANO, AUCH
32;RUIS DU COULOUME, AUCH
32;RUIS DE SAINTES, AUCH
32;RUIS DE LA PAUSE, AUCH
32;PONT D ENDOUMENGUE, AUCH
32;PONT DU MOUZON, AUCH
32;PONT DE LA RIBERE, AUCH
32;RUIS D'EMBAQUES, AUCH
32;RUIS DE L'ARCON, AUCH
32;RUIS L AULOUE, AUCH
32;RUIS DE BARON, AUCH
32;RUIS DE BARRIAC, AUCH
32;RUIS DE LA BOURDETTE, AUCH
32;RUIS DE CAMASSES, AUCH
32;RUIS DE CARLES, AUCH
32;RUIS DE CLAIRE FONTAINE, AUCH
32;RUIS DU COMTE, AUCH
32;RUIS DU COULOM, AUCH
32;RUIS D EMPAILLON, AUCH
32;RUIS D EMPITRAC, AUCH
32;RUIS D ENGOURMANDON, AUCH
32;RUIS D ENSALETTE, AUCH
32;RUIS DE L ESCU, AUCH
32;RUIS DE FERRIS, AUCH
32;RUIS DE GAOUERE, AUCH
32;RUIS DE LA GARENNE, AUCH
32;RUIS DE GARRANE, AUCH
32;RUIS DU GARROS, AUCH
32;RUIS DU HAOURET, AUCH
32;RUIS DE LA HOUNT DE REY, AUCH
32;RUIS D ISANDON, AUCH
32;RUIS DE LAGORS, AUCH
32;RUIS DE LARAJADE, AUCH
32;RUIS DE LARROS, AUCH
32;RUIS DE LARROUSSAGNET, AUCH
32;RUIS DE LASCAPELLE, AUCH
32;RUIS DE LASTRAN, AUCH
32;RUIS DE LESPAU, AUCH
32;RUIS DE MAILLOSSIS, AUCH
32;RUIS DE MARIN, AUCH
32;RUIS DE MOUSQUERES, AUCH
32;RUIS DE PEJOULIN, AUCH
32;RUIS DE PLAISANCE, AUCH
32;RUIS DU PLAN, AUCH
32;RUIS DE ROUAN, AUCH
32;RUIS DE SAINT URIN, AUCH
32;RUIS DU TALOUCH, AUCH
32;RUIS DU TOUGEY, AUCH
32;RUIS DE TOUR PLEGAT, AUCH
32;RUIS DE VILLENEUVE, AUCH
32;ALL ALAIN BOMBARD, AUCH
32;RUE ABEL GARDEY, AUCH
32;RUE ADRIEN NUX, AUCH
32;RTE D AGEN, AUCH
32;PL ADRIEN NUX, AUCH
32;RUE ABBE DE MONTESQUIOU, AUCH
32;RUE ABEL SARRAMIAC, AUCH
32;RUE AIME CESAIRE, AUCH
32;RUE ALAIN FOURNIER, AUCH
32;RUE ALBERT CAMUS, AUCH
32;RUE ALBERT SCHWEITZER, AUCH
32;RUE ALEM ROUSSEAU, AUCH
32;ALL ALEXANDRE BAURENS, AUCH
32;RUE ALEXANDRE DUMAS, AUCH
32;RUE ALFRED DE VIGNY, AUCH
32;IMP ALPHONSE LLORET, AUCH
32;IMP DE L ALOUETTE, AUCH
32;AV D ALSACE, AUCH
32;RUE DE L AMIRAL BUGARD, AUCH
32;IMP DE L AMIRAL BUGARD, AUCH
32;RUE DE L AMIRAL PEPHAU, AUCH
32;IMP ANDRE CAYATTE, AUCH
32;RUE ANATOLE FRANCE, AUCH
32;PL DE L ANCIEN FOIRAIL, AUCH
32;RUE ANDRE CAYATTE, AUCH
32;RUE ANDRE GIDE, AUCH
32;RUE ANDRE JOLIVET, AUCH
32;RUE ANDRE PERE, AUCH
32;RUE ANNE FRANK, AUCH
32;RUE ANTONIN BORDES, AUCH
32;RUE ARAGO, AUCH
32;IMP ARAGO, AUCH
32;CHE D'ARCADIE, AUCH
32;CHEM DE L'ARCON, AUCH
32;IMP DE L'ARCON, AUCH
32;RTE DE L ARCON, AUCH
32;RUE AREXY, AUCH
32;RUE ARISTIDE BRIAND, AUCH
32;RUE ARISTOTE, AUCH
32;RUE D ARMAGNAC, AUCH
32;IMP ARMAGNAC, AUCH
32;RUE ARNAUD DE MOLES, AUCH
32;PL ARNAUD DENJOY, AUCH
32;CHE DES ARROUILLERES, AUCH
32;CHE DES ARRIOUETS, AUCH
32;RUE ARTHUR RIMBAUD, AUCH
32;PTE D'ARTON, AUCH
32;ALL DES ARTS, AUCH
32;RUE AUGUSTA, AUCH
32;CHE DE L'AULOUE, AUCH
32;CHE DU BALENT, AUCH
32;RUE BALECH, AUCH
32;RUE DE BAPAUME, AUCH
32;RUE BARBANEGRE, AUCH
32;PL BARBES, AUCH
32;RUE BARBES, AUCH
32;RUE BARBARA, AUCH
32;CHE DE BAREILLAC, AUCH
32;CHE DE BARON, AUCH
32;RUE DE LA BARONNE, AUCH
32;IMP DE LA BARONNE, AUCH
32;IMP DU BARRAIL, AUCH
32;CHE DU BARRAIL, AUCH
32;RUE DE BARRAN, AUCH
32;RTE DE BARRAN, AUCH
32;CHE DE BARRAN, AUCH
32;CHE DE BATAILLE, AUCH
32;RUE DE BATAILLE, AUCH
32;RUE DU BATAILLON DE L'ARMAGNAC, AUCH
32;RUE BATBIE, AUCH
32;RUE BAUDIN, AUCH
32;ALL BAYLAC, AUCH
32;RUE DE BAZEILLES, AUCH
32;RUE BAZILLAC, AUCH
32;IMP BEAUMARCHAIS, AUCH
32;CHE DE BEGUE, AUCH
32;RUE DE BELFORT, AUCH
32;RUE BELLEFOREST, AUCH
32;RUE BERANGER, AUCH
32;CHE DE BERDOULET, AUCH
32;RUE DES BERGERONNETTES, AUCH
32;RUE BERLIOZ, AUCH
32;RUE BERNADOTTE, AUCH
32;RUE BERNARD PALISSY, AUCH
32;CHEM DE BERRY, AUCH
32;ALL BERTHE MORISOT, AUCH
32;RUE BERWICK, AUCH
32;PL BETCLAR, AUCH
32;CHE DE BIGAOUDERE, AUCH
32;RUE BISCARRA, AUCH
32;RUE DE BITCHE, AUCH
32;RUE BLAISE PASCAL, AUCH
32;ALL BLANCHE ODIN, AUCH
32;RUE DE BLAZY, AUCH
32;IMP DES BLEUETS, AUCH
32;RUE BOBILLOT, AUCH
32;CHE DU BOIS D AUCH, AUCH
32;RUE BOISSY D ANGLAS, AUCH
32;RUE BON PASTEUR, AUCH
32;RUE BONNAIL, AUCH
32;RUE DE BOUBEE, AUCH
32;IMP BOUE DE LAPEYRERE, AUCH
32;CHE DE LA BOURDETTE, AUCH
32;IMP DE LA BOURDETTE, AUCH
32;RUE DU BOURGET, AUCH
32;CHE DE BOUSCASSE, AUCH
32;RUE DES BOUVREUILS, AUCH
32;ALL WANGARI MUTA MAATHAI, AUCH
32;IMP DE BRAU, AUCH
32;CHE DU BROC DE L'AGACO, AUCH
32;RUE BRUNE, AUCH
32;IMP BRUNE, AUCH
32;RUE BUFFON, AUCH
32;RUE DE BUZENVAL, AUCH
32;CHE DES CABANES, AUCH
32;CHE DE LA CAHUZE, AUCH
32;RUE CAILHAVA, AUCH
32;CHE DE LA CAILLAOUERE, AUCH
32;PL DU CAILLOU, AUCH
32;RUE CALMETTE ET GUERIN, AUCH
32;CHEM DE CAMASSES, AUCH
32;RUE CAMBON, AUCH
32;RUE DE CAMERONE, AUCH
32;ALL CAMILLE CLAUDEL, AUCH
32;RUE CAMILLE DESMOULINS, AUCH
32;RUE CAMILLE SAINT SAENS, AUCH
32;RUE DU CANAL, AUCH
32;IMP DU CANAL, AUCH
32;RUE DES CANARIS, AUCH
32;RUE CAP DANJOU, AUCH
32;RUE CARDINAL DE TOURNON, AUCH
32;PL DES CARMELITES, AUCH
32;CHEM DE CARRAS, AUCH
32;CHE DU CASCAROT, AUCH
32;IMP DE LA CASCOUILLE, AUCH
32;CHE DU CASSOU DE LA DEMORO, AUCH
32;CHE DE CASTILLON MASSAS, AUCH
32;RUE CAUMONT, AUCH
32;RUE CHAMP D AIGNAN, AUCH
32;RUE DE CHAMPIGNY, AUCH
32;RUE CHAMPIONNET, AUCH
32;RUE CHAMPOLLION, AUCH
32;RUE CHARCOT, AUCH
32;RUE CHARLES NICOLLE, AUCH
32;RUE CHARLES CROS, AUCH
32;RUE DES CHARDONNERETS, AUCH
32;RUE CHARLES SAMARAN, AUCH
32;RUE CHARRAS, AUCH
32;IMP CHATEAUBRIAND, AUCH
32;RUE CHELERE, AUCH
32;IMP CHELERE, AUCH
32;RUE DE CHATEAUDUN, AUCH
32;CHE CHEMIN DU HOL, AUCH
32;RUE CICERON, AUCH
32;RUE DES CIGOGNES, AUCH
32;RUE COLETTE BESSON, AUCH
32;RUE EDITH PIAF, AUCH
32;CHE DE CLAIRE FONTAINE, AUCH
32;CHE DE CLARAC, AUCH
32;RUE CLAUDE NOUGARO, AUCH
32;RUE CLAUDE CHAPPE, AUCH
32;RUE CLAUDE MONET, AUCH
32;RUE CLEMENT MAROT, AUCH
32;RUE CLEMENT ADER, AUCH
32;RUE DES COLIBRIS, AUCH
32;RUE DES COLLINES, AUCH
32;IMP COLMAR, AUCH
32;RUE DE COLMAR, AUCH
32;CHE DE COMMERE MARTIN, AUCH
32;RUE DU COMTE, AUCH
32;RTE DE CONDOM, AUCH
32;RUE DE LA CONVENTION, AUCH
32;IMP DES COQUELICOTS, AUCH
32;ALL HENRI TROYAT, AUCH
32;RUE COQUILLE, AUCH
32;RUE DES CORMORANS, AUCH
32;PL CORNEILLE, AUCH
32;AV DU CORPS FRANC POMMIES, AUCH
32;RUE DES COTINGAS, AUCH
32;PL DE LA COTE DES NEIGES, AUCH
32;CHE DU COUGERON, AUCH
32;IMP DU COUGET, AUCH
32;CHE DU COUGET, AUCH
32;CHE DU BOIS DU COUGET, AUCH
32;CHE DU COULON, AUCH
32;CHE DE LA COUME DE BAZERES, AUCH
32;CHE DE LA COUME, AUCH
32;CHE DES COURREGES, AUCH
32;CHE DU CUSSOUAU, AUCH
32;RUE CUVIER, AUCH
32;RUE D ALEMBERT, AUCH
32;RUE D ANGERVILLE, AUCH
32;IMP D ANGERVILLE, AUCH
32;RUE DAIGNAN DU SENDAT, AUCH
32;RUE DARWIN, AUCH
32;RUE D ARTAGNAN, AUCH
32;RUE D ASSAS, AUCH
32;IMP D ASSAS, AUCH
32;RUE D ASTORG, AUCH
32;ALL DANIELE CASANOVA, AUCH
32;PL DASTROS, AUCH
32;RUE DAUMESNIL, AUCH
32;RUE DEBUSSY, AUCH
32;RUE DEGERS, AUCH
32;RTE D ENDOUMENGUE, AUCH
32;PL DENFERT ROCHEREAU, AUCH
32;RTE D ENGACHIES, AUCH
32;CHE D ENGACHIES, AUCH
32;IMP D ENGACHIES, AUCH
32;RUE D EPERNON, AUCH
32;RUE DE PESQUIDOUX, AUCH
32;CHE D ENGUILHEMOT, AUCH
32;RUE DESAIX, AUCH
32;IMP DESAIX, AUCH
32;RUE FRANCOISE SAGAN, AUCH
32;RUE DESCARTES, AUCH
32;RUE DESIRAT, AUCH
32;IMP DESIRAT, AUCH
32;PL GUY DESPAX, AUCH
32;RUE GUY DESPAX, AUCH
32;RUE GUY DE MAUPASSANT, AUCH
32;IMP DESSOLES, AUCH
32;RUE DESSOLES, AUCH
32;ALL D ETIGNY, AUCH
32;RUE D ETIGNY, AUCH
32;PL DU 2ME REGIMENT DE DRAGONS, AUCH
32;RUE DIDEROT, AUCH
32;RUE DE DIJON, AUCH
32;RUE DIX NEUF MARS 1962, AUCH
32;PL DU DR ALEXANDRE YERSIN, AUCH
32;RUE DOCTEUR BRANET, AUCH
32;IMP DOCTEUR BRANET, AUCH
32;RUE DOCTEUR CAPURON, AUCH
32;RUE DOCTEUR RAULIN, AUCH
32;RUE DOC ROUX, AUCH
32;RUE DOCTEUR SAMALENS, AUCH
32;ALL DOMINIQUE SERRES, AUCH
32;SQ DES DROITS DE L'ENFANT, AUCH
32;IMP DUCOS DU HAURON, AUCH
32;RUE DUGOMMIER, AUCH
32;IMP DUGOMMIER, AUCH
32;RUE DUPONT DE L EURE, AUCH
32;CHE DE DURAN, AUCH
32;RTE DE DURAN, AUCH
32;RUE EDGARD QUINET, AUCH
32;RUE EDMOND CASTERA, AUCH
32;IMP EDMOND MICHELET, AUCH
32;RUE EDMOND ROSTAND, AUCH
32;RUE EDOUARD LARTET, AUCH
32;IMP DE L EGALITE, AUCH
32;RUE DE L EGALITE, AUCH
32;RUE ELSA TRIOLET, AUCH
32;RUE D EMBAQUES, AUCH
32;CHE D EMBATS, AUCH
32;RUE EMILE ZOLA, AUCH
32;CHE D'EMPEYROUTON, AUCH
32;CHE D'EMPITRAC, AUCH
32;CHE D'ENSANS, AUCH
32;RUE ERIC TABARLY, AUCH
32;RUE ERNEST LAVERDURE, AUCH
32;RUE ERNEST VILA, AUCH
32;CHE D ESCAGNAN, AUCH
32;RUE DE L ESCOURRE, AUCH
32;VC MONUMENTAL, AUCH
32;PAS DE L ESCOURRE, AUCH
32;RUE ESPAGNE, AUCH
32;RUE ETIENNE DRALET, AUCH
32;RUE EUGENE DELACROIX, AUCH
32;RUE EUGENE SUE, AUCH
32;RUE EVARISTE GALOIS, AUCH
32;RUE FABRE D EGLANTINE, AUCH
32;RUE DES FAUVETTES, AUCH
32;RUE FEART, AUCH
32;IMP FEART, AUCH
32;RUE FEDERICO GARCIA LORCA, AUCH
32;RUE FERMAT, AUCH
32;IMP FERMAT, AUCH
32;RUE AUGUSTE SEMPE, AUCH
32;RUE FERNAND MAUROUX, AUCH
32;RUE FLEMING, AUCH
32;RUE DES FLEURS, AUCH
32;RUE FLORA TRISTAN, AUCH
32;RUE DE FLORENCE, AUCH
32;IMP DU FOIRAIL, AUCH
32;PL DE LA FONTAINE, AUCH
32;RUE FRANCIS POULENC, AUCH
32;CHE DE LA FONTAINE DE LAGORS, AUCH
32;RUE FRANCOISE GIROUD, AUCH
32;RUE FRANCOIS MAURIAC, AUCH
32;RUE FRANCOIS VILLON, AUCH
32;RUE FRANCOIS TRUFFAUT, AUCH
32;RUE GABRIEL FAURE, AUCH
32;RUE GAMBETTA, AUCH
32;CHE DE GAOUERE, AUCH
32;PL GARIBALDI, AUCH
32;IMP DE GASCOGNE, AUCH
32;RUE GASTON DEFERRE, AUCH
32;RUE GASTON LANDES, AUCH
32;CHE DE GAUBERT, AUCH
32;RUE GEN BAGNERIS, AUCH
32;RUE GEN CASTEX, AUCH
32;RUE DU GENERAL DE GAULLE, AUCH
32;RUE DU GENERAL SCHLESSER, AUCH
32;RUE GEN DELORT, AUCH
32;PAS GERARD DE NERVAL, AUCH
32;PL GERARD PHILIPE, AUCH
32;RUE GEORGE SAND, AUCH
32;RUE GILBERT BREGAIL, AUCH
32;RUE GEORGES BIZET, AUCH
32;RUE GEORGES BRASSENS, AUCH
32;SQ GERARD BEDOUT, AUCH
32;IMP DR GEORGES PUECHBERTY, AUCH
32;RUE GEORGES DAUBEZE, AUCH
32;ALL GEORGES VEDEL, AUCH
32;RUE DES GRAZES, AUCH
32;IMP DU GRISON, AUCH
32;RUE DES GRISONS, AUCH
32;RUE DES GRIVES, AUCH
32;RUE GUILLAUME PUJOS, AUCH
32;CHE DE GUILLEMERE, AUCH
32;RUE GUSTAVE FLAUBERT, AUCH
32;RUE GUY LAFITTE, AUCH
32;RUE GUYNEMER, AUCH
32;CHE DU HAGET, AUCH
32;RUE DU HAGET, AUCH
32;RUE DU HAMEAU, AUCH
32;CHE DE HARGUES, AUCH
32;CHE DU HAUT LIEU, AUCH
32;RUE HECTOR DE GALARD, AUCH
32;RUE HENRI DELAUNAY, AUCH
32;RUE HENRI MARTIN, AUCH
32;RUE HENRI MATISSE, AUCH
32;RUE HENRI IV, AUCH
32;RUE HENRI REGNAULT, AUCH
32;RUE HENRIOT, AUCH
32;RUE D HERICOURT, AUCH
32;CHE DE L HERMITAGE, AUCH
32;RUE DE LAS HILLETOS, AUCH
32;IMP DES HIRONDELLES, AUCH
32;AV HOCHE, AUCH
32;RUE HOMERE, AUCH
32;RUE HORACE, AUCH
32;CHE DE LA HOUNT DE REY, AUCH
32;CHE DE HOURTANE, AUCH
32;RUE DU 8 MAI, AUCH
32;CHE DE LA HURE, AUCH
32;RUE DE L INDUSTRIE, AUCH
32;RUE INGRES, AUCH
32;RUE ISAAC NEWTON, AUCH
32;CHE D IZANDON, AUCH
32;RUE IRENEE DAVID, AUCH
32;RUE I ET F JOLIOT CURIE, AUCH
32;RUE JACQUES BREL, AUCH
32;RUE JACQUELINE AURIOL, AUCH
32;RUE JACQUES PREVERT, AUCH
32;RUE JACQUELINE DE ROMILLY, AUCH
32;IMP DU JALIS, AUCH
32;CHE DU JALIS, AUCH
32;IMP DES JARDINS, AUCH
32;RUE DES JARDINS, AUCH
32;RUE JASMIN, AUCH
32;RUE JEAN BAPTISTE CLEMENT, AUCH
32;PAS JEAN BOURREC, AUCH
32;PL JEAN DAVID, AUCH
32;RUE JEAN DE BEAUJEU, AUCH
32;PL JEAN DOURS, AUCH
32;RUE JEAN DE LA FONTAINE, AUCH
32;RUE JEAN JAURES, AUCH
32;RUE JEANNE D ALBRET, AUCH
32;RUE JEAN MONNET, AUCH
32;SQ JEROME CUZIN, AUCH
32;RUE JOSEPH BARA, AUCH
32;ALL JEANNE DAGUZAN, AUCH
32;RUE JOSEPH CHENIER, AUCH
32;PAS JOSEPH CHENIER, AUCH
32;RUE JOSEPH TARDOS, AUCH
32;ALL JOSEPH GESTA, AUCH
32;RUE DE JUILLAN, AUCH
32;RUE JULES FERRY, AUCH
32;RPT DES JUSTES, AUCH
32;IMP DU RPT DES JUSTES, AUCH
32;RUE KLEBER, AUCH
32;CHE DE LABADIE, AUCH
32;IMP DE LABADIE, AUCH
32;CHE DE LABAUP, AUCH
32;RUE LABORDE, AUCH
32;IMP LACEPEDE, AUCH
32;RUE LAFAYETTE, AUCH
32;IMP LAFAYETTE, AUCH
32;RUE LAFOURCADE, AUCH
32;ALL LAGARRASIC, AUCH
32;CHE DE LAGORS, AUCH
32;RUE LAKANAL, AUCH
32;RUE LAMARTINE, AUCH
32;CHE DE LAMOTHE, AUCH
32;VOIE DE LANDON, AUCH
32;PAS DE LANDON, AUCH
32;CHE DE LANDON, AUCH
32;IMP LANDON, AUCH
32;RUE LANNELONGUE, AUCH
32;IMP LAROUGEAT, AUCH
32;IMP LAVOISIER, AUCH
32;CHE DE LASCAGNAN, AUCH
32;CHE DE LAVACANT, AUCH
32;RUE LECONTE DE LISLE, AUCH
32;PL LEDRU ROLLIN, AUCH
32;PL DE LA LEGION ETRANGERE, AUCH
32;CHE DE LESCAT, AUCH
32;PL DE LA LIBERATION, AUCH
32;PL DE LA LIBERTE, AUCH
32;RUE DES LILAS, AUCH
32;RUE LIMOUZIN, AUCH
32;IMP LINNE, AUCH
32;QUAI LISSAGARAY, AUCH
32;RUE LISSAGARAY, AUCH
32;IMP LOGUET, AUCH
32;RUE DES LORIOTS, AUCH
32;RUE DE LORRAINE, AUCH
32;RUE LOUIS ARAGON, AUCH
32;RUE LOUIS AUCOIN, AUCH
32;PL LOUIS BLANC, AUCH
32;RUE LOUIS MAUROUX, AUCH
32;RUE LOUIS PUECH, AUCH
32;RUE LOUISE MICHEL, AUCH
32;RUE LOUIS VILLANOVA, AUCH
32;RUE LUCIE AUBRAC, AUCH
32;CHEM DE LUCANTE, AUCH
32;CHEM DE LUSSAN, AUCH
32;RUE MARTIN LUTHER KING, AUCH
32;CHE DE MAILLOSSIS, AUCH
32;RUE MAL DE GONTAUT BIRON, AUCH
32;CHE DE MALARTIC, AUCH
32;PAS DE MALARTIC, AUCH
32;IMP DES MANGOUNETS, AUCH
32;RUE MARC CHAGALL, AUCH
32;PL MARCEAU, AUCH
32;RUE MARCEAU, AUCH
32;RUE MARCEL PROUST, AUCH
32;RUE MARCEL LUQUET, AUCH
32;RUE MARCEL PAGNOL, AUCH
32;RUE MARCEL CANTET, AUCH
32;IMP MARC CHAGALL, AUCH
32;RUE MARECHAL LANNES, AUCH
32;PL DU MARECHAL LANNES, AUCH
32;RUE MARGUERITE BOUCICAUT, AUCH
32;RUE MARGUERITE DE NAVARRE, AUCH
32;RUE MARGUERITE DURAS, AUCH
32;IMP MARGUERITE ORCIVAL, AUCH
32;RUE MARGUERITE YOURCENAR, AUCH
32;ALL MARIE LOUISE JAY, AUCH
32;ALL MARIE CLARAC, AUCH
32;RUE MARIO CAVAGLIERI, AUCH
32;CHE DE MARIN, AUCH
32;AV DE LA MARNE, AUCH
32;IMP DE LA MARNE, AUCH
32;QUAI DES MARRONNIERS, AUCH
32;IMP MASSENA, AUCH
32;RUE MASSENA, AUCH
32;PL MAURICE BARTHE, AUCH
32;RUE MAURICE BORDES, AUCH
32;RUE MAX POL FOUCHET, AUCH
32;RUE MAZAGRAN, AUCH
32;RUE DE MEILHAN, AUCH
32;RUE DE MEMMINGEN, AUCH
32;RUE DES MESANGES, AUCH
32;CHE DE MESTRESSENS, AUCH
32;RUE DE METZ, AUCH
32;RUE MICHELET, AUCH
32;RUE MIRABEAU, AUCH
32;RTE DE MIRANDE, AUCH
32;AV FRANCOIS MITTERRAND, AUCH
32;RUE DES MOINEAUX, AUCH
32;CHE DE MOLAS, AUCH
32;RUE MOLIERE, AUCH
32;CHE DE MONLAUR, AUCH
32;RUE MONLUC, AUCH
32;CHE DE MONBERNAT, AUCH
32;RUE MONTAIGNE, AUCH
32;RUE DE MONTEBELLO, AUCH
32;IMP MONTESQUIEU, AUCH
32;IMP DU MOULIN, AUCH
32;RUE DU MOULIN, AUCH
32;CHE MOULIN A VENT DE ST CRICQ, AUCH
32;CHE DU MOULIN DE LA RIBERE, AUCH
32;CHE DE MONTEGUT, AUCH
32;CHE DU MOULIN DE TROYES, AUCH
32;CHE MOULOUDJI, AUCH
32;RUE DU MOURROUSSIN, AUCH
32;RUE DES MOUSQUETAIRES, AUCH
32;RUE MOZART, AUCH
32;CHEM DE NASQUE, AUCH
32;CHE DE NAREOUX, AUCH
32;RTE NATIONALE N 124, AUCH
32;CHE DE NAUBAN, AUCH
32;RUE OLYMPE DE GOUGES, AUCH
32;CHE DE PAQUETAYRE, AUCH
32;CHE DE PESSAN, AUCH
32;CHE DE NOURRIC, AUCH
32;RUE DU 11 NOVEMBRE, AUCH
32;RUE PABLO NERUDA, AUCH
32;RUE PABLO PICASSO, AUCH
32;RUE PAGODEOUTES, AUCH
32;RUE DES PALOMBES, AUCH
32;RUE DE PARMAIN, AUCH
32;RUE PASTEUR, AUCH
32;RUE PATRICE BROCAS, AUCH
32;PL PATRICE BROCAS, AUCH
32;ALL P. BAUDEAN ET L. SENSEBY, AUCH
32;PAS PAUL BRANA, AUCH
32;RUE PAUL CEZANNE, AUCH
32;RUE PAUL DECKER DAVID, AUCH
32;RUE PAUL DESCOMPS, AUCH
32;PL PAUL DESCOMPS, AUCH
32;RUE PAUL GAUGUIN, AUCH
32;RUE PAUL LANGEVIN, AUCH
32;CHE DE LA PAUSE, AUCH
32;RUE PAUL VALERY, AUCH
32;RUE PAUL VERLAINE, AUCH
32;RUE PAUL GAUZY, AUCH
32;RUE PELLETIER D OISY, AUCH
32;RUE DES PENITENTS BLEUS, AUCH
32;RTE DE PESSAN, AUCH
32;CHE DE LA PETARASSE, AUCH
32;CHE DU PETIT BEAULIEU, AUCH
32;CHE DU PETIT BERRY, AUCH
32;CHE DU PETIT COUGET, AUCH
32;IMP DU PETIT FERRIS, AUCH
32;IMP DU PETIT PRINCE, AUCH
32;RUE DU PETIT PRINCE, AUCH
32;IMP PIERRE CADEAC, AUCH
32;RUE PIERRE BROSSOLETTE, AUCH
32;RUE PIERRE DE COUBERTIN, AUCH
32;AV PIERRE DE MONTESQUIOU, AUCH
32;AV PIERRE MENDES FRANCE, AUCH
32;CHE DU PIGEON BLANC, AUCH
32;RUE DES PINSONS, AUCH
32;CHE DU PLAN, AUCH
32;CHE DU PLAN DE TERRAUBE, AUCH
32;IMP DE PLAISANCE, AUCH
32;CHE DE PLAISANCE, AUCH
32;IMP DU PLATEAU DE LESCAT, AUCH
32;RUE PLATON, AUCH
32;IMP POLLARD, AUCH
32;RUE DU PONT NATIONAL, AUCH
32;CHE DE PONTAC, AUCH
32;RUE PORTE NEUVE, AUCH
32;CHE DE LA PETITE BARONNE, AUCH
32;PL DE LA PORTE TROMPETTE, AUCH
32;IMP DE LA POUDRIERE, AUCH
32;CHE DU POUNTET, AUCH
32;RUE POUSTERLE DES COULOUMATS, AUCH
32;RUE POUSTERLE DE L EST, AUCH
32;RUE POUSTERLE DE LAS HOUMETTOS, AUCH
32;RUE POUSTERLE DE PARIS, AUCH
32;RUE DU POUY, AUCH
32;PL DU PREFET CLAUDE ERIGNAC, AUCH
32;AV DE LA 1ERE ARMEE FRANCAISE, AUCH
32;RUE PDT LACAVE LAPLAGNE, AUCH
32;RUE PROF RAMON, AUCH
32;RUE PROSPER LAFFORGUE, AUCH
32;PL PUITS DE MOTHE, AUCH
32;AV DES PYRENEES, AUCH
32;IMP DES PYRENEES, AUCH
32;PL DU 14 JUIL, AUCH
32;RUE DU 14 JUIL, AUCH
32;RUE DU 4 SEPTEMBRE, AUCH
32;RUE DU 88EME, AUCH
32;ALL 88EME, AUCH
32;RUE RABELAIS, AUCH
32;RUE RACINE, AUCH
32;RUE RAMEAU, AUCH
32;CHE DE RANSAN, AUCH
32;RUE RASPAIL, AUCH
32;RUE RAVEL, AUCH
32;RUE RENE CASSIN, AUCH
32;PL RENE MARET, AUCH
32;RUE RENE CLAIR, AUCH
32;IMP RENE CLAIR, AUCH
32;RUE DU REPOS, AUCH
32;PL DE LA REPUBLIQUE, AUCH
32;RUE DE LA REPUBLIQUE, AUCH
32;CHE DE LA RETHOURIE, AUCH
32;IMP DE LA RETHOURIE, AUCH
32;QUAI DE LA REVOLUTION, AUCH
32;AV RHIN ET DANUBE, AUCH
32;CHE DE LA RIBERE, AUCH
32;IMP DE LA RIBERE, AUCH
32;RUE ROBERT SCHUMAN, AUCH
32;RUE DE ROCLINCOURT, AUCH
32;ALL DE ROCLINCOURT, AUCH
32;RUE ROGER SALENGRO, AUCH
32;PL DES ROITELETS, AUCH
32;IMP RONSARD, AUCH
32;BD ROQUELAURE, AUCH
32;CHEM DE ROQUELAURE, AUCH
32;CHE DE ROUAN, AUCH
32;CHE DE ROUBIN, AUCH
32;RUE DES ROUGE GORGES, AUCH
32;RUE ROUGET DE LISLE, AUCH
32;CHE DE ROUMEGUERE, AUCH
32;IMP ROUMEGUERE, AUCH
32;BD SADI CARNOT, AUCH
32;CHE DE ST BERTRANET, AUCH
32;CHE DE SAINT CHRISTAU, AUCH
32;CHE DE SAINT CRICQ, AUCH
32;RUE SAINT-EXUPERY, AUCH
32;RUE SAINT-JACQUES, AUCH
32;IMP SAINT MARTIN, AUCH
32;RUE ST PAUL, AUCH
32;RUE SAINTE QUITTERIE, AUCH
32;CHE DE SAINTES, AUCH
32;PL SALINIS, AUCH
32;RUE SALLENEUVE, AUCH
32;PL SALUSTE DU BARTAS, AUCH
32;RUE SALVADOR ALLENDE, AUCH
32;IMP SALVANDY, AUCH
32;CHE DE SAMAYRAN, AUCH
32;AV SAMBRE ET MEUSE, AUCH
32;CHE DE LA SAUVETAT, AUCH
32;CHE DU SEILHAN, AUCH
32;IMP DU SEILHAN, AUCH
32;RUE DU SENECHAL, AUCH
32;RUE SIMONE SIGNORET, AUCH
32;RUE DES SITTELLES, AUCH
32;IMP DE LA SOMME, AUCH
32;RUE DE LA SOMME, AUCH
32;RUE DE SON TAY, AUCH
32;IMP SOULAN DU BARRAIL, AUCH
32;PL DU SOUVENIR FRANCAIS, AUCH
32;IMP SUBERVIE, AUCH
32;CHE DE SUCHAN, AUCH
32;RUE DE TAILLADIS, AUCH
32;CHE DE TAILLADIS, AUCH
32;RUE DU TAPIS VERT, AUCH
32;CHE DES TAPS, AUCH
32;RTE DE TARBES, AUCH
32;RUE DES TARINS, AUCH
32;RUE TARRIBLE, AUCH
32;RUE DE LA TENAREZE, AUCH
32;CHEM DE TARRABUSQUE, AUCH
32;PL DE LA TERRADE, AUCH
32;CHE DE TERRAUBE, AUCH
32;CHEM DE LA TERRERE, AUCH
32;CHE DE TOUGEY, AUCH
32;CHE DE TESTAS, AUCH
32;RUE DANIEL TOSCAN DU PLANTIER, AUCH
32;RTE DE TOULOUSE, AUCH
32;CHE DE LA TOURETTE, AUCH
32;RUE TOURTERELLE, AUCH
32;PAS TOURTERELLE, AUCH
32;RUE DE LA TRANQUILITE, AUCH
32;IMP DE LA TRANQUILITE, AUCH
32;PL DE LA TREILLE, AUCH
32;CHE DU TUCO, AUCH
32;RUE TURGOT, AUCH
32;RUE DE VALMY, AUCH
32;RUE VENDOME, AUCH
32;PL DE VERDUN, AUCH
32;RUE VIALA, AUCH
32;RTE DE VIC, AUCH
32;RUE VICTOR HUGO, AUCH
32;IMP VICTOR HUGO, AUCH
32;RUE VICTOR MASSE, AUCH
32;RUE VIEILLE POUSTERLE, AUCH
32;IMP DU VIGNOBLE, AUCH
32;PL VILLARET DE JOYEUSE, AUCH
32;RUE DE VILLERSEXEL, AUCH
32;CHE DE VILLENEUVE, AUCH
32;RUE VINCENT VAN GOGH, AUCH
32;CHE 21 BIS, AUCH
32;RUE DES VIOLETTES, AUCH
32;RUE DU 24 FEVRIER, AUCH
32;RUE VIRGILE, AUCH
32;RUE VOLTAIRE, AUCH
32;AV DE L YSER, AUCH
32;IMP DE L YSER, AUCH
32;RUE YVES MONTAND, AUCH
32;IMP D'AZIMONT, AURADE
32;RUE DU BAS DU COURE, AURADE
32;RTE DU BASSIOUES, AURADE
32;CHEM DE BEL AIR, AURADE
32;RTE DE BLANQUEFORT, AURADE
32;IMP DU BOIS, AURADE
32;RTE DE BONREPOS, AURADE
32;RUE DU BOULODROME, AURADE
32;CHEM DU BROC, AURADE
32;RUE DE CAGUELOUP, AURADE
32;RTE DU CAP DU BOSC, AURADE
32;IMP DE LAS CARBOUERES, AURADE
32;CHEM DU CARRETE, AURADE
32;IMP DE CASSELONG, AURADE
32;RUE DU CRABET, AURADE
32;RUE DE L'EGLISE, AURADE
32;RTE D'EMPEAUX, AURADE
32;IMP D'ENCOUSTALET, AURADE
32;RTE D'ENDOUFIELLE, AURADE
32;IMP D'ENGARGALIDE, AURADE
32;IMP ENJOUAN MARTIN, AURADE
32;CHEM DE L'ESTOUE, AURADE
32;RUE DE LA FORGE, AURADE
32;IMP GALEJOU, AURADE
32;CHEM DE LACLERE, AURADE
32;CHEM DE LAGAYNETTE, AURADE
32;RTE DE LAQUERE, AURADE
32;CHEM DE LARTIGUAT, AURADE
32;RTE DE LIAS, AURADE
32;PL DE LA MAIRIE, AURADE
32;RUE DU MICAN, AURADE
32;CHEM DE MONTOUSSE, AURADE
32;PAS DE LA MOTTE, AURADE
32;RTE DE PAGES, AURADE
32;CHEM DE PEYROT, AURADE
32;CHEM DU POUCHAN, AURADE
32;RUE DE LA PRADE, AURADE
32;RTE DE SAMATAN, AURADE
32;RUE DU SARAILHE, AURADE
32;CHEM CASTAGNON, AURENSAN
32;CHEM DE CRABOT, AURENSAN
32;CHEM DE LA CRETE, AURENSAN
32;RTE DEPARTEMENTALE 22, AURENSAN
32;RTE DEPARTEMENTALE 946, AURENSAN
32;CHEM GELLEMALE, AURENSAN
32;CHEM DE JEANNETON, AURENSAN
32;CHEM DE JOUANOT, AURENSAN
32;CHEM DE LABURTHE, AURENSAN
32;CHEM MONTAGNE, AURENSAN
32;CHEM DU MOULIN, AURENSAN
32;CHEM DE PATCHOT, AURENSAN
32;CHEM DE POUSSEPAILLE, AURENSAN
32;CHEM DE SAINT MONT, AURENSAN
32;RTE D'AUCH, AUTERRIVE
32;RUE DU BARRY, AUTERRIVE
32;IMP DU BARRY, AUTERRIVE
32;RTE DE BOUCAGNERES, AUTERRIVE
32;CHEM DE CAMPARO, AUTERRIVE
32;IMP DU CHATEAU, AUTERRIVE
32;COTE DE CASTEX, AUTERRIVE
32;CHEM DE COUME D'EN JOURDAN, AUTERRIVE
32;CHEM DES CRETES, AUTERRIVE
32;CHEM D'EMPELAUJO, AUTERRIVE
32;IMP DE LA FONTAINE, AUTERRIVE
32;RUE DES FOSSES, AUTERRIVE
