32;AV DE LA REPUBLIQUE, CASTELNAU D'AUZAN LABARRERE
32;CHE DE LA RIBERE, CASTELNAU D'AUZAN LABARRERE
32;RTE DE RIEUPEYROUX, CASTELNAU D'AUZAN LABARRERE
32;RUE ROUGET DE L ISLE, CASTELNAU D'AUZAN LABARRERE
32;RUE DES SAULES, CASTELNAU D'AUZAN LABARRERE
32;RTE DE SENSEVER, CASTELNAU D'AUZAN LABARRERE
32;RUE DU STADE, CASTELNAU D'AUZAN LABARRERE
32;RUE DE LA TREILLE, CASTELNAU D'AUZAN LABARRERE
32;PL DE VERDUN, CASTELNAU D'AUZAN LABARRERE
32;IMP DES BAINS DOUCHES, CASTELNAU D'AUZAN LABARRERE
32;RUE VICTOR HUGO, CASTELNAU D'AUZAN LABARRERE
32;RUE DE LA BOULANGERIE, CASTELNAU D'AUZAN LABARRERE
32;RUE DE LA CHARMILLE, CASTELNAU D'AUZAN LABARRERE
32;PL DE LA CROIX, CASTELNAU D'AUZAN LABARRERE
32;PL DE LA FONTAINE, CASTELNAU D'AUZAN LABARRERE
32;RUE DE L EGLISE, CASTELNAU D'AUZAN LABARRERE
32;RUE DE LA FORGE, CASTELNAU D'AUZAN LABARRERE
32;RUE GRANDE, CASTELNAU D'AUZAN LABARRERE
32;RUE DES GRANGES, CASTELNAU D'AUZAN LABARRERE
32;RUE DU CARREROT, CASTELNAU D'AUZAN LABARRERE
32;RUE DU MIDI, CASTELNAU D'AUZAN LABARRERE
32;RUE DU PRESBYTERE, CASTELNAU D'AUZAN LABARRERE
32;RUE SAINT JOSEPH, CASTELNAU D'AUZAN LABARRERE
32;PL SAINTE MADELEINE, CASTELNAU D'AUZAN LABARRERE
32;RTE DE SAINT ORENS, CASTELNAU D'AUZAN LABARRERE
32;RTE DE SAURET, CASTELNAU D'AUZAN LABARRERE
32;RTE DE SEGURET, CASTELNAU D'AUZAN LABARRERE
32;RTE DE LA SOURCE, CASTELNAU D'AUZAN LABARRERE
32;RTE DE TARRIT LE HAUT, CASTELNAU D'AUZAN LABARRERE
32;AV DE LA TENAREZE, CASTELNAU D'AUZAN LABARRERE
32;RTE DE LAS TEOULERES, CASTELNAU D'AUZAN LABARRERE
32;RTE DU TINTE, CASTELNAU D'AUZAN LABARRERE
32;RTE DE TORREBREN, CASTELNAU D'AUZAN LABARRERE
32;RTE DU VERDON, CASTELNAU D'AUZAN LABARRERE
32;AV 21 JUIN 1944, CASTELNAU-SUR-L AUVIGNON
32;RTE D'ASTAFFORT, CASTERA-LECTOUROIS
32;CHEM DE BRIMONT, CASTERA-LECTOUROIS
32;RTE DE CAOUZES, CASTERA-LECTOUROIS
32;RUE CARRELOT DE LA FORGE, CASTERA-LECTOUROIS
32;CHEM DE CAZENEUVE, CASTERA-LECTOUROIS
32;RTE DE LA GARE, CASTERA-LECTOUROIS
32;RTE DE LA HILLERE, CASTERA-LECTOUROIS
32;CHEM DE LABARTHETE, CASTERA-LECTOUROIS
32;RTE DE LECTOURE, CASTERA-LECTOUROIS
32;RTE DE MAURENS, CASTERA-LECTOUROIS
32;CHEM DU MOULIN NEUF, CASTERA-LECTOUROIS
32;RUE DE LA PEYRADE, CASTERA-LECTOUROIS
32;CHEM DE PIQUEOU, CASTERA-LECTOUROIS
32;RTE DE PIS, CASTERA-LECTOUROIS
32;RTE DU PLATEAU, CASTERA-LECTOUROIS
32;IMP RESTERAC, CASTERA-LECTOUROIS
32;RTE ROMAINE, CASTERA-LECTOUROIS
32;RTE DE SAINT AVIT FRANDAT, CASTERA-LECTOUROIS
32;CHEM DE SAINT SEVET, CASTERA-LECTOUROIS
32;PARC LANNELONGUE, CASTERA-VERDUZAN
32;RUE DE L AMITIE, CASTERA-VERDUZAN
32;PL DE L ANCIEN FOIRAIL, CASTERA-VERDUZAN
32;PL DE L'ANCIEN MARRONNIER, CASTERA-VERDUZAN
32;RUE DES ANCIENS COMBATTANTS, CASTERA-VERDUZAN
32;RUE DE L ARMAGNAC, CASTERA-VERDUZAN
32;IMP DE L AULOUE, CASTERA-VERDUZAN
32;PROM DE L AULOUE, CASTERA-VERDUZAN
32;RUE DE BISSINS, CASTERA-VERDUZAN
32;RUE DES CHENES, CASTERA-VERDUZAN
32;RUE DE LA CIGALERAIE, CASTERA-VERDUZAN
32;AV CLAUDE BORDENAVE, CASTERA-VERDUZAN
32;RUE DU 19 MARS, CASTERA-VERDUZAN
32;RUE DES ECOLES, CASTERA-VERDUZAN
32;PL DE L EGLISE, CASTERA-VERDUZAN
32;RUE DE L EGLISE, CASTERA-VERDUZAN
32;RUE DE L ESSOR, CASTERA-VERDUZAN
32;RUE DES FONTAINES, CASTERA-VERDUZAN
32;RUE DE LA GARENNE, CASTERA-VERDUZAN
32;RUE DE GIGOULI, CASTERA-VERDUZAN
32;RUE DE LA GUINGUETTE, CASTERA-VERDUZAN
32;IMP DE LA HALTE, CASTERA-VERDUZAN
32;PL DU 8 JUILLET 1977, CASTERA-VERDUZAN
32;RUE DU LAC, CASTERA-VERDUZAN
32;RUE DE LOMAGNE, CASTERA-VERDUZAN
32;RUE DU 8 MAI, CASTERA-VERDUZAN
32;PL DU MARRONNIER, CASTERA-VERDUZAN
32;RUE DE GASCOGNE, CASTERA-VERDUZAN
32;PL DU 11 NOVEMBRE, CASTERA-VERDUZAN
32;PL ODILON LANNELONGUE, CASTERA-VERDUZAN
32;RUE DU PARC, CASTERA-VERDUZAN
32;RUE DES PYRENEES, CASTERA-VERDUZAN
32;PL DE LA SOLIDARITE, CASTERA-VERDUZAN
32;AV DE LA TENAREZE, CASTERA-VERDUZAN
32;AV DES THERMES, CASTERA-VERDUZAN
32;RUE DU VAL D AULOUE, CASTERA-VERDUZAN
32;RUE DE VERDUZAN, CASTERA-VERDUZAN
32;RUE DU VIEUX CASTERA, CASTERA-VERDUZAN
32;RUE DU MIDI, CASTERA-VERDUZAN
32;RUE DU CHATEAU, CASTERA-VERDUZAN
32;CHEM DE NABEAU, CASTERA-VERDUZAN
32;RUE OCCITANE, CASTERA-VERDUZAN
32;IMP DES ACACIAS, CASTET-ARROUY
32;CHEM DES BARADASSES, CASTET-ARROUY
32;RTE DE CAILLAVA, CASTET-ARROUY
32;PL DE L'EGLISE, CASTET-ARROUY
32;RUE DES ERABLES, CASTET-ARROUY
32;RUE DES GLYCINES, CASTET-ARROUY
32;RUE DES HORTENSIAS, CASTET-ARROUY
32;RTE DE MIRADOUX, CASTET-ARROUY
32;CHEM DE NOGUES, CASTET-ARROUY
32;CHEM D'AUTEFAGE, CASTEX
32;IMP DU BALECH, CASTEX
32;CHEM DE BORDENEUVE, CASTEX
32;IMP DU CHRESTIAN, CASTEX
32;CHEM DE DEVANT, CASTEX
32;IMP DE GIGNOUX, CASTEX
32;CHEM ROUEDE VERGEZ, CASTEX
32;RTE DE L'ARMAGNAC, CASTEX D ARMAGNAC
32;CHEM DES BARTHES, CASTEX D ARMAGNAC
32;RTE DU BERNET, CASTEX D ARMAGNAC
32;CHEM DE LA BIRADE, CASTEX D ARMAGNAC
32;PL DE L'EGLISE, CASTEX D ARMAGNAC
32;CHEM DE LA FONTAINE, CASTEX D ARMAGNAC
32;RTE DE FRONTIGNAN, CASTEX D ARMAGNAC
32;CHEM DE LA GAUCHINE, CASTEX D ARMAGNAC
32;CHEM DU HARAS, CASTEX D ARMAGNAC
32;CHEM DE L'HOMME DE BIEN, CASTEX D ARMAGNAC
32;CHEM DE JENBOY, CASTEX D ARMAGNAC
32;CHEM DU LAVOIR, CASTEX D ARMAGNAC
32;PL DE LA MAIRIE, CASTEX D ARMAGNAC
32;RTE DU MIDOUR, CASTEX D ARMAGNAC
32;RTE DU MOULIN, CASTEX D ARMAGNAC
32;CHEM DE PARRAT, CASTEX D ARMAGNAC
32;RTE DU PONT DU ROY, CASTEX D ARMAGNAC
32;RTE DE BELMONT, CASTILLON-DEBATS
32;CHEM DE CLOUQUEJEOU, CASTILLON-MASSAS
32;CHEM COTE DE LESTANGUE, CASTILLON-MASSAS
32;CHEM DU COURTADE, CASTILLON-MASSAS
32;RTE DE DURAN, CASTILLON-MASSAS
32;CHEM D'ENJOUTET, CASTILLON-MASSAS
32;PL GUY DUGROS, CASTILLON-MASSAS
32;CHEM DE LA GUZERDE, CASTILLON-MASSAS
32;CHEM DE LALANNE, CASTILLON-MASSAS
32;RTE DE LARRAMA, CASTILLON-MASSAS
32;CHEM DE LAUZERO, CASTILLON-MASSAS
32;RTE DE LAVARDENS, CASTILLON-MASSAS
32;CHEM DE MESTRESSENS, CASTILLON-MASSAS
32;CHEM DE MOUSSAS, CASTILLON-MASSAS
32;CHEM DE PARDAN, CASTILLON-MASSAS
32;CHEM D'EN PELAT, CASTILLON-MASSAS
32;RTE DE PEYRUSSE MASSAS, CASTILLON-MASSAS
32;RTE DES QUATRE CHEMINS, CASTILLON-MASSAS
32;RTE DE SAINT LARY, CASTILLON-MASSAS
32;LOT LA PEYRADE, CASTILLON-SAVES
32;AV DU COGOTOIS, CASTILLON-SAVES
32;RUE DE LA FORGE, CASTILLON-SAVES
32;CHEM LA GRANDE COTE, CASTILLON-SAVES
32;CHEM DE LAS GRAVES, CASTILLON-SAVES
32;CHEM DE MONPLAISIR, CASTILLON-SAVES
32;CHEM DES BARBOTS, CASTILLON-SAVES
32;RTE DES BRILLATS, CASTILLON-SAVES
32;CHEM D'EN CERIDE, CASTILLON-SAVES
32;CHEM DU CESSE, CASTILLON-SAVES
32;CHEM DU CHIRRE, CASTILLON-SAVES
32;CHEM D'ENTOCOLOY, CASTILLON-SAVES
32;RTE DE FREGOUVILLE, CASTILLON-SAVES
32;RTE DE LA GARRIERE, CASTILLON-SAVES
32;RTE DE LA GUIRONNE, CASTILLON-SAVES
32;RTE DE L'HERETE, CASTILLON-SAVES
32;CHEM DE LA HOUGUERE, CASTILLON-SAVES
32;CHEM D'EN LANNES, CASTILLON-SAVES
32;RTE DE LASTOU, CASTILLON-SAVES
32;RTE D'EN MAGNE, CASTILLON-SAVES
32;RTE DE MONFERRAN, CASTILLON-SAVES
32;CHEM DU MONTIRON, CASTILLON-SAVES
32;RTE DE LA MOUNICHE, CASTILLON-SAVES
32;RTE D'EN MOYE, CASTILLON-SAVES
32;CHEM DE LA PEYRADE, CASTILLON-SAVES
32;RTE DU SIES, CASTILLON-SAVES
32;RES DU BROQUA, CASTIN
32;QUA DU MOULIN, CASTIN
32;LOT AU SOULAN DU VILLAGE, CASTIN
32;RUE DU CASTELBIELH, CASTIN
32;CHEM DE COMMERE MARTIN, CASTIN
32;CHEM D'EN COURRENT, CASTIN
32;CHEM DE GIRONIS, CASTIN
32;RUE DE LA GLEYSETTE, CASTIN
32;CHEM DE LARROQUE, CASTIN
32;RUE DE LA MAIRIE, CASTIN
32;RUE MARCEL LACOSTE, CASTIN
32;RUE DU MOULIN, CASTIN
32;CHEM D'EN PISSET, CASTIN
32;RTE DE ROQUELAURE, CASTIN
32;RUE DE RUDA, CASTIN
32;CHEM DU BRANET, CASTIN
32;CHEM DU BUGAT, CASTIN
32;CHEM DE CARRAS, CASTIN
32;CHEM D'EN CASSAGNARD, CASTIN
32;CHEM DE CASTILLON MASSAS, CASTIN
32;RTE DE L'ADOUR, CAUMONT
32;IMP DE BACARIOU, CAUMONT
32;RUE DE BAUHE, CAUMONT
32;IMP CAMPFRANC, CAUMONT
32;IMP DE CAPDESSUS, CAUMONT
32;RTE DE CATON, CAUMONT
32;RUE DE CATON, CAUMONT
32;IMP DE CAUMONTE, CAUMONT
32;PL DES CHENES, CAUMONT
32;IMP DE COUECOU, CAUMONT
32;IMP DESCOMS, CAUMONT
32;IMP DE LA DOUCEUR, CAUMONT
32;RUE DE DOUMENGES, CAUMONT
32;CHEM DE JACQUOT, CAUMONT
32;CHEM DES KIWIS, CAUMONT
32;IMP DE LACOUREGE, CAUMONT
32;CHEM DE LAFFONT, CAUMONT
32;RTE DE LA LAUZE, CAUMONT
32;RUE DE MAULICHERES, CAUMONT
32;RUE DES MIMOSAS, CAUMONT
32;RTE DU MOULIN, CAUMONT
32;IMP DE NAUTE, CAUMONT
32;IMP DE PERUILLET, CAUMONT
32;RUE DE LA PLAINE, CAUMONT
32;IMP DU POUY, CAUMONT
32;RUE DU POUY, CAUMONT
32;CHEM DE LA PRUNE, CAUMONT
32;RUE DE LA SABLIERE, CAUMONT
32;RUE DE TREMBLE, CAUMONT
32;IMP DES VIGNES, CAUMONT
32;RTE DU VILLAGE, CAUMONT
32;RTE DE LAS BARTHETES, CAUPENNE-D ARMAGNAC
32;RTE DE BORDENEUVE, CAUPENNE-D ARMAGNAC
32;RTE DE BOURGELA, CAUPENNE-D ARMAGNAC
32;RTE DE CANTIRAN, CAUPENNE-D ARMAGNAC
32;RTE DE LA CARRERE DE BAS, CAUPENNE-D ARMAGNAC
32;RTE DE CAUPENNE, CAUPENNE-D ARMAGNAC
32;RTE DU CLAOUS, CAUPENNE-D ARMAGNAC
32;RTE DE CURATS, CAUPENNE-D ARMAGNAC
32;RTE D'ESPAGNET, CAUPENNE-D ARMAGNAC
32;RTE D'ESPALIERE, CAUPENNE-D ARMAGNAC
32;RTE DE HOURCADE, CAUPENNE-D ARMAGNAC
32;RTE DE HOURQUET, CAUPENNE-D ARMAGNAC
32;RTE DE JANTOUET, CAUPENNE-D ARMAGNAC
32;RTE DE JOUANELLE, CAUPENNE-D ARMAGNAC
32;RTE DE LAGORS, CAUPENNE-D ARMAGNAC
32;RTE DE LASSALLE, CAUPENNE-D ARMAGNAC
32;RTE DE LAUJUZAN, CAUPENNE-D ARMAGNAC
32;RTE DE MISELLE, CAUPENNE-D ARMAGNAC
32;RTE DE MONJAN, CAUPENNE-D ARMAGNAC
32;CHEM DE MONTAUBAN, CAUPENNE-D ARMAGNAC
32;RTE DU MOULIN DE SALLES, CAUPENNE-D ARMAGNAC
32;RTE DU NAUTON, CAUPENNE-D ARMAGNAC
32;RTE DU NOGAROPOLE, CAUPENNE-D ARMAGNAC
32;RTE DE POUCHIOU, CAUPENNE-D ARMAGNAC
32;RTE DE SOUCARET, CAUPENNE-D ARMAGNAC
32;RTE DE SOURDOIS, CAUPENNE-D ARMAGNAC
32;RTE DE TOUJET, CAUPENNE-D ARMAGNAC
32;RTE DE TRESCORS, CAUPENNE-D ARMAGNAC
32;LOT LOT DU GAUT, CAUSSENS
32;CHEM DE AURENS, CAUSSENS
32;CHEM DU BARADIEU, CAUSSENS
32;CHEM DE LA BARAILLE, CAUSSENS
32;IMP DE BORDENEUVE, CAUSSENS
32;RUE DU BOUZET, CAUSSENS
32;RTE DU CAMUS, CAUSSENS
32;RUE DES CARILLONNEURS, CAUSSENS
32;RTE DE CONDOM, CAUSSENS
32;RUE DU CORDONNIER, CAUSSENS
32;PL DE L'EGLISE, CAUSSENS
32;RUE DE L'EGLISE, CAUSSENS
32;RUE DE L'ANCIENNE ECOLE, CAUSSENS
32;PL DE LA FONTAINE, CAUSSENS
32;CHEM DU GARAILLON, CAUSSENS
32;IMP DE GELAS, CAUSSENS
32;GR GRAND 'RUE, CAUSSENS
32;CHE DE LA HALIPPE, CAUSSENS
32;RUE DU CHRISTIAN, CAUSSENS
32;RUE DE LA HALIPPE, CAUSSENS
32;RUE DE LA HOUNTETE, CAUSSENS
32;RUE DES JARDINIERS, CAUSSENS
32;CHEM DE LA JUSTICE, CAUSSENS
32;CHEM DU LAC, CAUSSENS
32;IMP DE LARROUY, CAUSSENS
32;RTE DE LECTOURE, CAUSSENS
32;RUE DES LILAS, CAUSSENS
32;CHEM DE LA MASSESCASSE, CAUSSENS
32;CHEM DU PAILLERAT, CAUSSENS
32;RUE DU PLATE, CAUSSENS
32;PL DU PUITS, CAUSSENS
32;RUE DES PYRENEES, CAUSSENS
32;RTE DE LA ROMIEU, CAUSSENS
32;CHEM DE SAINT ORENS, CAUSSENS
32;RUE DE LA VIEILLE ECOLE, CAUSSENS
32;RES ARMAGNAC, CAZAUBON
32;RES BERNARD PALISSY, CAZAUBON
32;RES HENRI IV, CAZAUBON
32;CITE ALEXANDRE DUFRECHE, CAZAUBON
32;CITE D ARTAGNAN, CAZAUBON
32;CITE CAP DOU BOSCQ, CAZAUBON
32;CITE ROUSSEAU, CAZAUBON
32;RES DU SOLEIL D OC, CAZAUBON
32;RES LES OMBRAGES, CAZAUBON
32;HAM DES MOULIES, CAZAUBON
32;CITE DE BAQUE, CAZAUBON
32;CITE DES PYRENEES, CAZAUBON
32;QUA CLOS DES LILAS, CAZAUBON
32;QUA CLOS DES VIGNES, CAZAUBON
32;RES DES PINS, CAZAUBON
32;RUE D ALBRET, CAZAUBON
32;RUE DE L ABBE ESCARNOT, CAZAUBON
32;CITE GERARD, CAZAUBON
32;PL ALBAN DULHOSTE, CAZAUBON
32;CITE ALEXANDRE DUFRECHE, CAZAUBON
32;IMP ALEX CLAVERIE, CAZAUBON
32;RUE ANDRE BOURDIEU, CAZAUBON
32;IMP ARAMIS, CAZAUBON
32;PL DE L ARMAGNAC, CAZAUBON
32;RUE ARTIGOLLE, CAZAUBON
32;CHEM DE BAILLARGUE, CAZAUBON
32;RUE A BAQUE, CAZAUBON
32;RUE DE LA BRECHE, CAZAUBON
32;RUE DES CAGOTS, CAZAUBON
32;RTE DE CAMPAGNE, CAZAUBON
32;RUE DE LAS CANERES, CAZAUBON
32;CHE DU CAP DOU BOSC, CAZAUBON
32;RTE DE CAP PELAT, CAZAUBON
32;RTE DE LA CAUSSADE, CAZAUBON
32;RUE CHARLEMAGNE, CAZAUBON
32;RTE DE CHIC COTON, CAZAUBON
32;RUE DU COUSINE, CAZAUBON
32;RUE DE COUTON, CAZAUBON
32;RUE DU COUVENT, CAZAUBON
32;RUE DU DOC DE RAQUINE, CAZAUBON
32;RTE D'EAUZE, CAZAUBON
32;RUE DES ECOLES, CAZAUBON
32;RTE DE L'EGLISE, CAZAUBON
32;RTE D'ESTANG, CAZAUBON
32;RUE DE GASCOGNE, CAZAUBON
32;RUE DE GELLE, CAZAUBON
32;RUE DU GEN VIDALON, CAZAUBON
32;RUE DE LA GOURGUE, CAZAUBON
32;IMP GUIRAUTAT, CAZAUBON
32;RTE DU HAGET, CAZAUBON
32;RTE DU HAJA, CAZAUBON
32;AV HENRI IV, CAZAUBON
32;RTE DU HOUR, CAZAUBON
32;PL HYPPOLITE LASCOURREGES, CAZAUBON
32;RUE JEAN FRANCOIS CAILHAVA, CAZAUBON
32;RUE JOSEPH CAPPIN, CAZAUBON
32;RUE LABARTHE VACQUIER, CAZAUBON
32;AV DU LAC, CAZAUBON
32;RTE DE LAGRANGE, CAZAUBON
32;AV DES LANDES, CAZAUBON
32;RUE LAPEYRADE, CAZAUBON
32;RTE DE LAREE, CAZAUBON
32;RTE DE LARTIGUE, CAZAUBON
32;RUE LEONCE COUTURE, CAZAUBON
32;CHEM DE LATRAUBE, CAZAUBON
32;IMP DU LAVOIR, CAZAUBON
32;RTE DE LICHE, CAZAUBON
32;PL DE LA MAIRIE, CAZAUBON
32;RTE DE MARGUESTAU, CAZAUBON
32;RTE DE MONT DE MARSAN, CAZAUBON
32;RUE MONTAIGNE, CAZAUBON
32;RTE DE LA MONTJOIE, CAZAUBON
32;RUE DE MOUTIQUES, CAZAUBON
32;RTE DU MOULIES, CAZAUBON
32;BD PAUL DAUDE, CAZAUBON
32;RUE PETIT PIERRE, CAZAUBON
32;RUE DE LA PORTE DU HOURRAT, CAZAUBON
32;RUE DE FORTUNA, CAZAUBON
32;CHEM FREDERIC LE PLAY, CAZAUBON
32;RTE DE GABARRET, CAZAUBON
32;RTE DE LA GARE, CAZAUBON
32;RTE DU MOULLE, CAZAUBON
32;RUE DU PROF LANNELONGUE, CAZAUBON
32;RTE DE PEDOUCAU, CAZAUBON
32;RTE DE POUNELLE, CAZAUBON
32;BD DES PYRENEES, CAZAUBON
32;RUE DU GENERAL RAPP, CAZAUBON
32;RUE DU RUIS DES CASTAGNETTES, CAZAUBON
32;PL DU RUISSEAU CHAUD, CAZAUBON
32;RTE DE SAINTE FAUSTE, CAZAUBON
32;RUE SAN PE DU RIOU CAU, CAZAUBON
32;RTE DE SANCET, CAZAUBON
32;RTE DE SANTO, CAZAUBON
32;RTE DE SENTEX, CAZAUBON
32;PL DE L'ABBE DUCRUC, CAZAUBON
32;RTE DE TARGUERIE, CAZAUBON
32;AV DES THERMES, CAZAUBON
32;RTE DE THUILLIER, CAZAUBON
32;RUE DES TONNELIERS, CAZAUBON
32;RUE DE LA TOUR, CAZAUBON
32;AV DE L UBY, CAZAUBON
32;IMP DU VERT VALLON, CAZAUBON
32;RUE DU VERT GALANT, CAZAUBON
32;PL BATAILLON DE L ARMAGNAC, CAZAUBON
32;RTE CHATEAU D EAU, CAZAUBON
32;RTE DE CONDOM, CAZAUBON
32;CHEM DU COURROS, CAZAUBON
32;VC 109, CAZAUBON
32;VC 108, CAZAUBON
32;VC 106 DE TORREBREN, CAZAUBON
32;RTE DE LASSALLE, CAZAUBON
32;RTE DE CUGRAC, CAZAUBON
32;RTE DU TILLOT, CAZAUBON
32;VC 107, CAZAUBON
32;VC 102, CAZAUBON
32;RTE DE COUILLOT, CAZAUBON
32;RTE DES JARDINS, CAZAUBON
32;RTE DE MESTEPE, CAZAUBON
32;RTE DU TOURNE, CAZAUBON
32;RUE DES MEUNIERS, CAZAUBON
32;RTE DU MOULIN, CAZAUBON
32;RTE DE CAILLAVER, CAZAUBON
32;RTE DE LANAS, CAZAUBON
32;VC 121 DE COURBAT, CAZAUBON
32;VC 120, CAZAUBON
32;CITE DU CAP DU BOSC, CAZAUBON
32;VC 119 DU CAP DU BOSC, CAZAUBON
32;VC 118 DU MOULIE, CAZAUBON
32;VC 117 DE BARON, CAZAUBON
32;VC 116 DE COULOM, CAZAUBON
32;CR 27 DE SANTO A GABARRET, CAZAUBON
32;RTE DE JANICOT, CAZAUBON
32;CR 69, CAZAUBON
32;RTE DE COUPEAU, CAZAUBON
32;RTE DE BRUNAN, CAZAUBON
32;RTE DE TAVERNES, CAZAUBON
32;CR 57 DE COURBAT, CAZAUBON
32;VC 122 DE SENTOU, CAZAUBON
32;RTE DE CAMAT, CAZAUBON
32;RTE DE CANTELOUP, CAZAUBON
32;RTE DE BARBE, CAZAUBON
32;RUE CITE ROUSSEAU, CAZAUBON
32;RTE DE BEGUE, CAZAUBON
32;RUE DES ARENES, CAZAUBON
32;RTE DE SAINT CHRISTAU, CAZAUBON
32;RTE DE JEAN DE BORDEAUX, CAZAUBON
32;PL DE GASCOGNE, CAZAUBON
32;CITE CARRIERE, CAZAUBON
32;RUE COLLEGE, CAZAUBON
32;RTE DE JOUANIN, CAZAUBON
32;RUE DES PIQUE PRUNES, CAZAUBON
32;CHEM DE CRETE, CAZAUX-VILLECOMTAL
32;CHEM COTE DE LARROQUE, CAZAUX-VILLECOMTAL
32;CHEM DE LA PAGUERE, CAZAUX-VILLECOMTAL
32;IMP DE PEYROUDETS, CAZAUX-VILLECOMTAL
32;ALL DE L'ARMAGNAC, CAZENEUVE
32;IMP DE L'ARMAGNAC, CAZENEUVE
32;CHEM DES BOUILLEURS DE CRU, CAZENEUVE
32;CHEM DE LA CHAPELLE, CAZENEUVE
32;CHEM DE L'EGLISE, CAZENEUVE
32;CHEM DE L'ESQUIROU, CAZENEUVE
32;CHEM VOIE IMPERIALE, CAZENEUVE
32;RTE DE LA MANILLE, CAZENEUVE
32;CHEM DE MARAMBAT, CAZENEUVE
32;RUE MASSAS, CAZENEUVE
32;RTE DE MONTREAL DU GERS, CAZENEUVE
32;RTE DE LA NOVEMPOPULANIE, CAZENEUVE
32;CHEM DU PARDAILLAN, CAZENEUVE
32;RTE DE LA TENAREZE, CAZENEUVE
32;CHEM DE TERROUGE, CAZENEUVE
32;CHEM DE LA TOUR, CAZENEUVE
32;CHEM DES VIGNES, CAZENEUVE
32;QUA DU GRAND CHENE, CERAN
32;RTE DE BRUGNENS, CERAN
32;CHEM DE CASTILLON, CERAN
32;CHEM DE LA COLOMERE, CERAN
32;RTE D'EMBIDALET, CERAN
32;RTE DE FLEURANCE, CERAN
32;CHEM DE HOURTINES, CERAN
32;CHEM DE LASSALLE, CERAN
32;PL MARIE PIERRE BOURDON, CERAN
32;CHEM DE MONTECHUT, CERAN
32;RTE DE MONTESTRUC, CERAN
32;CHEM DU PIGEONNIER, CERAN
32;IMP DU PUITS, CERAN
32;RTE DE PUYCASQUIER, CERAN
32;CHEM DE RONDE, CERAN
32;IMP DU RUISSEAU, CERAN
32;IMP D'EN SANSAU, CERAN
32;PL DU VILLAGE, CERAN
32;ALL DES FRENES, CEZAN
32;ALL DES TULIPES, CEZAN
32;RUE DES ACACIAS, CEZAN
32;CHEM LES ANGELES, CEZAN
32;CHEM DU BIOTE, CEZAN
32;CHEM DU CALA, CEZAN
32;RTE DE CASTERA, CEZAN
32;IMP DU CHARON, CEZAN
32;RUE DU CHATEAU, CEZAN
32;RTE DE FLEURANCE, CEZAN
32;RUE DU JARDIN, CEZAN
32;CHEM DE LA JARDINIERE, CEZAN
32;RTE DE JEGUN, CEZAN
32;CHEM DU MACON, CEZAN
32;PL DU MARRONNIER, CEZAN
32;RUE DE LA PORTE, CEZAN
32;RTE DE PRECHAC, CEZAN
32;RUE DU REPOS, CEZAN
32;CHEM DE RONDE, CEZAN
32;RUE SAINTE EULALIE, CEZAN
32;RTE DE SAINT PUY, CEZAN
32;RTE DE LA SAUVETAT, CEZAN
32;CHEM DE TOULAN, CEZAN
32;CHE DU ARNES, CLERMONT-SAVES
32;RTE DU BOIS DE L'HOMME, CLERMONT-SAVES
32;RTE DU BOURDIEU, CLERMONT-SAVES
32;CHEM DES CARDAYRES, CLERMONT-SAVES
32;CHE DU CARREROT, CLERMONT-SAVES
32;CHE DU CHATEAU, CLERMONT-SAVES
32;RTE DE COGOTOIS, CLERMONT-SAVES
32;CHEM DE CROSA VIELH, CLERMONT-SAVES
32;CHE D'ENMAGRET, CLERMONT-SAVES
32;CHEM DU GAY, CLERMONT-SAVES
32;IMP DES LILAS, CLERMONT-SAVES
32;CHE DU MAGNAS, CLERMONT-SAVES
32;ESP DE LA MAIRIE, CLERMONT-SAVES
32;CHEM D'EN MESPLET, CLERMONT-SAVES
32;CHE DU PESIGUAN, CLERMONT-SAVES
32;CHE DES PYRENEES, CLERMONT-SAVES
32;CHEM DU ROUCHELET, CLERMONT-SAVES
32;IMP DU SOLEIL LEVANT, CLERMONT-SAVES
32;CHE DU SOULAN DU JOLY, CLERMONT-SAVES
32;ESP LE SOUVENIR FRANCAIS, CLERMONT-SAVES
32;IMP A LAS URBANES, CLERMONT-SAVES
32;IMP DES USCLADES, CLERMONT-SAVES
32;CITE CHRISTIANIE, COLOGNE
32;LOT LE LEVANT DE SAINT SAUBION, COLOGNE
32;LOT LES JARDINS DE LA BASTIDE, COLOGNE
32;RUE DE L ANCIEN FOIRAIL, COLOGNE
32;CHE GRAND, COLOGNE
32;RTE DE SOLOMIAC, COLOGNE
32;RUE D AUZILLES, COLOGNE
32;CHE BEAUREGARD, COLOGNE
32;RUE DE BEAUMONT, COLOGNE
32;VC BOURBON, COLOGNE
32;RUE CAMILLE CATALAN, COLOGNE
32;RUE DU CHAMP DE FOIRE, COLOGNE
32;RUE DU COUVENT, COLOGNE
32;RUE DE COX, COLOGNE
32;CHE DE LA CHRISTIANIE, COLOGNE
32;RUE DE L EGLISE, COLOGNE
32;RUE D ENCABANE, COLOGNE
32;PL DE LA HALLE, COLOGNE
32;RUE DE LA POSTE, COLOGNE
32;PL DES PYRENEES, COLOGNE
32;RUE SAINT AUBIN, COLOGNE
32;RUE D'HAUCONCOURT, COLOGNE
32;RUE DE TOULOUSE, COLOGNE
32;RUE ODON DE TERRIDE, COLOGNE
32;RTE DE SABOULIES, COLOGNE
32;RTE DE SIRAC, COLOGNE
32;CHE DE RONDE, COLOGNE
32;RUE DU BARRY, COLOGNE
32;RTE DE MAUVEZIN, COLOGNE
32;FG BOURBON, COLOGNE
32;RUE DE SABOULIES, COLOGNE
32;RTE DE SAINT GERMIER, COLOGNE
32;CHE DE LA CHICOUE, COLOGNE
32;RUE MAX LABORIE, COLOGNE
32;RTE D'ARDIZAS, COLOGNE
32;CHEM DU BACHAYRE, COLOGNE
32;CHEM DU BUGUET HAUT, COLOGNE
32;RTE DE CADOURS, COLOGNE
32;RTE DE L'ISLE JOURDAIN, COLOGNE
32;CHEM DE MONTUQUET, COLOGNE
32;CHEM DU PENUT, COLOGNE
32;CHEM DU ROY, COLOGNE
32;QUA LOU CARRELOT, CONDOM
32;CITE LES JACOBINS, CONDOM
32;CITE HLM LES PYRENEES, CONDOM
32;LOT DES CEDRES, CONDOM
32;LOT MIRATEAU, CONDOM
32;CITE LA SILISSE, CONDOM
32;LOT LOT DES MARRONNIERS, CONDOM
32;CITE MONREPOS, CONDOM
32;CITE SAINTE CLAIRE, CONDOM
32;CITE DES MARRONNIERS, CONDOM
32;HAM DE BELLOMBRE, CONDOM
32;RUE DE L ABATTOIR, CONDOM
32;RUE ALFRED DE VIGNY, CONDOM
32;RTE D AGEN, CONDOM
32;RUE ALBERT CAMUS, CONDOM
32;RUE ANATOLE FRANCE, CONDOM
32;AV D AQUITAINE, CONDOM
32;AV DES ANCIENS COMB AN ET TOE, CONDOM
32;RUE DES ARGENTIERS, CONDOM
32;RUE ARISTIDE BRIAND, CONDOM
32;AV DE L ARMAGNAC, CONDOM
32;RUE DES ARMURIERS, CONDOM
32;RTE D AUCH, CONDOM
32;RUE AUGUSTE RENOIR, CONDOM
32;RUE D AUX, CONDOM
32;RUE DU BARADET, CONDOM
32;RUE BARLET, CONDOM
32;PL DU BATAILLON DE L ARMAGNAC, CONDOM
32;RUE BERANJON, CONDOM
32;RUE BIGOS, CONDOM
32;RUE BONNAMY, CONDOM
32;PAS DES BELLES MERES, CONDOM
32;RUE BONNEMAISON, CONDOM
32;RUE BOILEAU, CONDOM
32;CHEM DE BORDENEUVE DES CARMES, CONDOM
32;PL BOSSUET, CONDOM
32;QUAI BUZON, CONDOM
32;CHE DU BOY, CONDOM
32;CHEM DE BOUCHAT, CONDOM
32;CHEM DE LA BUTTE DU BOY, CONDOM
32;RUE BUZON, CONDOM
32;RUE CADEOT, CONDOM
32;RUE CAILLAVET, CONDOM
32;CHEM DE CALAMET, CONDOM
32;ALL DU CANAL, CONDOM
32;CHE DES CAPOTS DE TESTE, CONDOM
32;RUE CAPURON, CONDOM
32;RUE DES ARENES, CONDOM
32;RTE DE CANNES, CONDOM
32;CHEM DES CAPOTS DE L OSSE, CONDOM
32;CHEM DE CAPOUT, CONDOM
32;PL DU CARDINAL, CONDOM
32;RUE DU CARMEL, CONDOM
32;RUE DES CARMES, CONDOM
32;RTE DE CASSAIGNE, CONDOM
32;RUE CASSIN, CONDOM
32;RUE DES CHARPENTIERS, CONDOM
32;RUE DES CHAMPS, CONDOM
32;RUE DES CEDRES, CONDOM
32;RUE CHARLES PERRAULT, CONDOM
32;RUE DES CHARDONNERETS, CONDOM
32;RUE CHARRON, CONDOM
32;CHE DE CHOTTE, CONDOM
32;AV DU CIMETIERE, CONDOM
32;RUE DE LA CITADELLE, CONDOM
32;BD CLEMENCEAU, CONDOM
32;PL CORNEILLE, CONDOM
32;CHEM DU CLAOUE, CONDOM
32;CRS DES CLOITRES, CONDOM
32;CHEM DE COMPOSTELLE, CONDOM
32;CHEM DE LA COTE, CONDOM
32;CHEM DE COUCHET, CONDOM
32;CHEM DES COUSSOUS, CONDOM
32;RUE DES CORDELIERS, CONDOM
32;RUE DESERTE, CONDOM
32;RUE DASTON, CONDOM
32;RUE DAUNOU, CONDOM
32;CHE DE LA DIGUE, CONDOM
32;IMP DENISE PITOUS, CONDOM
32;RUE DUCOMET, CONDOM
32;RUE DUPRAT, CONDOM
32;IMP DURAN, CONDOM
32;RUE DUTOYA, CONDOM
32;RTE D EAUZE, CONDOM
32;CHEM D'ECHE, CONDOM
32;RUE DES ECLOSETTES, CONDOM
32;RUE DE L ESPLANADE, CONDOM
32;RUE DES ENTREPRENEURS, CONDOM
32;CHEM DE L'ESCOUPERLE, CONDOM
32;RUE DE L EVECHE, CONDOM
32;RTE DE FOURCES, CONDOM
32;RUE FOUR L EVEQUE, CONDOM
32;RUE FRANCOIS BACO, CONDOM
32;CHE DE GACHIOU, CONDOM
32;RUE GAICHIES, CONDOM
32;RUE GAMBETTA, CONDOM
32;RUE GARAS, CONDOM
32;AV DE LA GARE, CONDOM
32;CHE DE SOLOMBERE, CONDOM
32;RUE GASPAR, CONDOM
32;RUE DE LA GATISE, CONDOM
32;CHE DE GAUGE, CONDOM
32;RUE GAVARRET, CONDOM
32;AV GEN DE GAULLE, CONDOM
32;CHEM DU GAY, CONDOM
32;RUE GEORGES BRASSENS, CONDOM
32;RUE GRICHET, CONDOM
32;CHEM DU GOALARD, CONDOM
32;CHEM DU GRAND NOBLE, CONDOM
32;RTE DE GRAZIAC, CONDOM
32;RTE DE GRAZIMIS, CONDOM
32;AV DE GRUNBERG, CONDOM
32;CHEM DE GUILHEMICHEL, CONDOM
32;RUE DE LA HACHE, CONDOM
32;PL DE LA HALLE, CONDOM
32;RUE DE LA HONLADE, CONDOM
32;RUE HONORE CAZAUBON, CONDOM
32;IMP SAINT JEAN, CONDOM
32;RUE HOTEL DE VILLE (PTE), CONDOM
32;RUE ICHON, CONDOM
32;RUE DES JACOBINS, CONDOM
32;QUAI JAUBERT, CONDOM
32;RUE JEAN DABOS, CONDOM
32;RUE JEAN JACQUES ROUSSEAU, CONDOM
32;RUE JEAN MOULIN, CONDOM
32;RUE JEAN JAURES, CONDOM
32;RUE JULES FERRY, CONDOM
32;RUE JEAN RACINE, CONDOM
32;QUAI LABOUPILLERE, CONDOM
32;RUE LAFONTAINE, CONDOM
32;RUE LAMARTINE, CONDOM
32;PL LANNELONGUE, CONDOM
32;RUE LAPEYRE, CONDOM
32;RUE LARTIGUE, CONDOM
32;CHEM DE LARROUZE, CONDOM
32;RTE DE LECTOURE, CONDOM
32;BD DE LA LIBERATION, CONDOM
32;RUE DE LA LIBERATION, CONDOM
32;PL DE LA LIBERTE, CONDOM
32;CHE DES LIONS, CONDOM
32;PL DU LION D OR, CONDOM
32;RUE DES LITANIES, CONDOM
32;CHEM DE LIZARIS, CONDOM
32;PL LUCIEN LAMARQUE, CONDOM
32;RUE DE LA MANUFACTURE, CONDOM
32;CHEM DU MAGE, CONDOM
32;RUE MAL FOCH, CONDOM
32;AV MAL JOFFRE, CONDOM
32;RUE MARGASTA, CONDOM
32;RUE MARIE BARBE, CONDOM
32;PL MARRE, CONDOM
32;CHEM DE MAYROT, CONDOM
32;RTE DE MEZIN, CONDOM
32;CHEM DE MIRANE, CONDOM
32;RUE MILON, CONDOM
32;RUE DE MEZIN, CONDOM
32;RUE DE MIQUE, CONDOM
32;RUE MOLIERE, CONDOM
32;CHE DE MIRATEAU, CONDOM
32;RUE DE LA MONNAIE, CONDOM
32;VC RINGUES, CONDOM
32;BD MONPLAISIR, CONDOM
32;CHEM DE MONDINET, CONDOM
32;RTE DE MONTREAL, CONDOM
32;CHEM DU MOULIN A VENT, CONDOM
32;CHEM DE MOUSSARON, CONDOM
32;RUE MOUCAUHAJAN, CONDOM
32;CHE DE MONTELEONE, CONDOM
32;RUE DU MOULIN (PTE), CONDOM
32;RUE DU MOULIN, CONDOM
32;AV DES MOUSQUETAIRES, CONDOM
32;RTE DE NERAC, CONDOM
32;RUE DE L ORANGERIE, CONDOM
32;IMP DE L'OCTROI, CONDOM
32;RUE DE LA PAIX, CONDOM
32;RUE DE LA PARGUERE, CONDOM
32;PL DE LA PARGUERE, CONDOM
32;RUE PAUL GAUGUIN, CONDOM
32;BD PASTEUR, CONDOM
32;RUE PAUL SOLANA, CONDOM
32;PL PENCENS, CONDOM
32;RUE PERDUE, CONDOM
32;RUE DES PEUPLIERS, CONDOM
32;RUE PIERRE BAZAX, CONDOM
32;RUE PORTE SAINT-JEAN, CONDOM
32;RUE PORTENEUVE, CONDOM
32;RUE DE LA POULE, CONDOM
32;AV DE PROUILLAN, CONDOM
32;CHEM DE L'OSSE, CONDOM
32;CHEM DE PAJON, CONDOM
32;CHEM DU PARC, CONDOM
32;CHEM DE PARRETE, CONDOM
32;CHEM DE PERGAIN, CONDOM
32;CHEM DU PETIT PARIS, CONDOM
32;CHEM DU PETO, CONDOM
32;CHEM DE POMARO, CONDOM
32;CHEM DU POUY, CONDOM
32;CHEM DE POUYPARDIN, CONDOM
32;CHEM DE RABIN, CONDOM
32;CHEM DE RAMOUNET, CONDOM
32;RUE DU PUITS, CONDOM
32;AV DES PYRENEES, CONDOM
32;RUE DE LA REPUBLIQUE, CONDOM
32;AV RHIN ET DANUBE, CONDOM
32;RUE RIGUEPEU, CONDOM
32;RUE RIVIERE, CONDOM
32;RUE DE LA RIVIERE, CONDOM
32;RUE RONSARD, CONDOM
32;RUE ROQUEPINE, CONDOM
32;IMP DU ROCHER, CONDOM
32;RUE ROQUES, CONDOM
32;CHE DE ROUCOUTOUCOU, CONDOM
32;RUE DE ROUCOUTOUCOU, CONDOM
32;RUE SABATHIER, CONDOM
32;PL SOUVENIR, CONDOM
32;CHE DE GELLE, CONDOM
32;ESP DE LA BELLE MARIE, CONDOM
32;RUE ST-BARTHELEMY (PTE), CONDOM
32;RUE ST CLAIR, CONDOM
32;RUE STE EULALIE, CONDOM
32;RUE SAINT EXUPERY, CONDOM
32;IMP DE SAINT HUBERT, CONDOM
32;BD ST-JACQUES, CONDOM
32;BD ST JEAN, CONDOM
32;RUE SAINT-LOUP, CONDOM
32;CHEM DE SAINT LUPERC, CONDOM
32;BD ST-MICHEL, CONDOM
32;PL SAINT PIERRE, CONDOM
32;RTE DE ST PUY, CONDOM
32;RUE DE LA POUDRIERE, CONDOM
32;RUE SAINTE CLAIRE, CONDOM
32;CHEM DE SARRAZAN, CONDOM
32;SQ SALVANDY, CONDOM
32;RUE SARADE, CONDOM
32;PL SCIPION DUPLEIX, CONDOM
32;RUE DE LA SELISSE, CONDOM
32;CHEM DE SEAILLES, CONDOM
32;CHEM DE SEMPE, CONDOM
32;RUE DU SENECHAL, CONDOM
32;CHEM DE LAS TAPIES, CONDOM
32;RUE DE LA TONNELLERIE, CONDOM
32;RUE DE TESTE, CONDOM
32;IMP DE TESTE, CONDOM
32;AV DE TORO, CONDOM
32;RUE TRIPIERE, CONDOM
32;RUE DES URSULINES, CONDOM
32;AV VICTOR HUGO, CONDOM
32;PL VOLTAIRE, CONDOM
32;RTE DE VOPILLON, CONDOM
32;RUE VOUTEE, CONDOM
32;RUE DE BEAULIEU, CONDOM
32;CHEM DU PICHOURET, CONDOM
32;IMP LANNELONGUE, CONDOM
32;CHE DE LA TERRASSE, CONDOM
32;RUE DES METIERS, CONDOM
32;RUE ALEXANDRE DUMAS, CONDOM
32;RUE DU COLONEL ARNAUD BELTRAME, CONDOM
32;CHE DE RINGUES, CONDOM
32;RUE DES ARTISANS, CONDOM
32;RUE DES MARRONNIERS, CONDOM
32;CHEM DU PETIT BOURDIEU, CONDOM
32;CHEM DU PETIT GOALARD, CONDOM
32;AV PIERRE DE COUBERTIN, CONDOM
32;CHE DE RAFIN, CONDOM
32;IMP GRICHET, CONDOM
