32;RUE DU FOURNIL, LANNEPAX
32;RUE DE LA FRATERNITE, LANNEPAX
32;SQ DE GASCOGNE, LANNEPAX
32;CHEM DE GASTON, LANNEPAX
32;CHEM DU HAGET, LANNEPAX
32;RTE DU LACA, LANNEPAX
32;CHEM DE LACAVE, LANNEPAX
32;CHEM DE LAFFARGUE, LANNEPAX
32;RTE DE LAGRAULAS, LANNEPAX
32;RUE DE LA LAICITE, LANNEPAX
32;CHEM DE LA LANDE, LANNEPAX
32;RTE DE LAPLAGNE, LANNEPAX
32;CHEM DE LAVARDAC, LANNEPAX
32;RUE DES LEGENDES, LANNEPAX
32;RUE DE LA LIBERTE, LANNEPAX
32;RUE DU MIDI, LANNEPAX
32;RUE DES MILLESIMES, LANNEPAX
32;RTE DE MOUREDE, LANNEPAX
32;RTE DE NABIDAUX, LANNEPAX
32;CHEM DE NAUDIN, LANNEPAX
32;RUE DE LA PAIX, LANNEPAX
32;RUE DU PESQUE, LANNEPAX
32;CHEM DE LA PITORRE, LANNEPAX
32;RTE DE LA PITORRE, LANNEPAX
32;CHEM DU POUY, LANNEPAX
32;CHEM DU POUY BAS, LANNEPAX
32;AV DES PYRENEES, LANNEPAX
32;CHEM DE RIZAC, LANNEPAX
32;CHEM DE SAINT AMAND, LANNEPAX
32;CHEM DU SANIPON, LANNEPAX
32;RUE DU STADE, LANNEPAX
32;IMP DE LA VERITE, LANNEPAX
32;RTE DE VIC, LANNEPAX
32;RUE DE LA VICTOIRE, LANNEPAX
32;PL MAIRIE, LANNEPAX
32;RUE DES AMOURS, LANNEPAX
32;RTE D'AIRE, LANNE-SOUBIRAN
32;CHEM DE BEL AIR, LANNE-SOUBIRAN
32;CHEM DE BENASI, LANNE-SOUBIRAN
32;CHEM DE BERNET, LANNE-SOUBIRAN
32;CHEM DU BOIS, LANNE-SOUBIRAN
32;CHEM DU CHATEAU D'EAU, LANNE-SOUBIRAN
32;AV DE CLARENS, LANNE-SOUBIRAN
32;CHEM DE DUCLABOU, LANNE-SOUBIRAN
32;PL DE L'EGLISE, LANNE-SOUBIRAN
32;RTE DU HOUGA, LANNE-SOUBIRAN
32;CHEM DE LABARBE, LANNE-SOUBIRAN
32;CHEM DE LAPUJOLLE, LANNE-SOUBIRAN
32;CHEM DU LAVOIR, LANNE-SOUBIRAN
32;RTE DE MAGNAN, LANNE-SOUBIRAN
32;CHEM DE MAILLOC, LANNE-SOUBIRAN
32;RTE DE NOGARO, LANNE-SOUBIRAN
32;CHEM DE PITET, LANNE-SOUBIRAN
32;CHEM DE RIGADE, LANNE-SOUBIRAN
32;RTE DE SAINT GRIEDE, LANNE-SOUBIRAN
32;CHEM DE TURBAN, LANNE-SOUBIRAN
32;CHEM DES BAINS, LANNUX
32;CHEM DE BARADAT, LANNUX
32;CHEM DE BARLADE, LANNUX
32;CHEM DE LA COTE DE BEL AIR, LANNUX
32;CHEM DE BOUNATE, LANNUX
32;CHEM DE BRAGUET, LANNUX
32;CHEM DU CANTONNIER, LANNUX
32;CHEM DU COL, LANNUX
32;CHEM DU CONTE, LANNUX
32;CHEM DE COUMIS ROQUE, LANNUX
32;CHEM DE CRABOT, LANNUX
32;CHEM DE LA CRETE, LANNUX
32;CHEM DE L ECOLE, LANNUX
32;PL DE L ECOLE, LANNUX
32;CHEM DE GAILLASSE, LANNUX
32;CHEM DE GUILLE, LANNUX
32;CHEM DE JANOU, LANNUX
32;CHEM DE JEANCHIN, LANNUX
32;CHEM DE JOUANNETON, LANNUX
32;CHEM DES LANDES, LANNUX
32;CHEM DE LASBERETTES, LANNUX
32;CHEM DE LASSERRE, LANNUX
32;PL DE LA MAIRIE, LANNUX
32;CHEM DE MONFORT, LANNUX
32;CHEM DU MOULIN, LANNUX
32;CHEM DE PEYRET, LANNUX
32;CHEM DE LA COTE DE PICHOULET, LANNUX
32;CHEM DE LA PLAINE, LANNUX
32;CHEM DE ROUSSEAU, LANNUX
32;CHEM DE LA COTE DE TOUPIE, LANNUX
32;CHEM DU VILLAGE, LANNUX
32;CHEM DE LENGLERE, LANNUX
32;CHE DE GUIROTTE, LANNUX
32;CHE DE L'HIPPODROME, LANNUX
32;RTE DE L'ARMAGNAC, LAREE
32;RTE DE BELLEVUE, LAREE
32;RTE DE BONHEUR, LAREE
32;RTE DE CAZAUBON, LAREE
32;IMP DE LAS CLOTTES, LAREE
32;RTE DE LA COTE DE BRAQUET, LAREE
32;RTE DE LA COTE DU POUGET, LAREE
32;ALL DE LA DOUZE, LAREE
32;RTE D'EAUZE, LAREE
32;ALL DE L'EGLISE, LAREE
32;IMP DE GARES, LAREE
32;RTE DU GLEZIA, LAREE
32;IMP DES GRIVES, LAREE
32;IMP DE LA HITERE, LAREE
32;RTE JEAN DE BORDEAUX, LAREE
32;RTE DE LABEYRIE, LAREE
32;RTE DU LAC, LAREE
32;CHEM DES LANDES, LAREE
32;IMP DE LASBOUZIGUES, LAREE
32;IMP DE MICHALET, LAREE
32;RTE DE NOGARO, LAREE
32;RTE DE PEYROUTIN, LAREE
32;IMP DES PINS, LAREE
32;RTE DE POUYBLANC, LAREE
32;IMP DES PYRENEES, LAREE
32;RTE DE SAINT CHRISTAUD, LAREE
32;RTE DE SAINTE FAUSTE, LAREE
32;RTE DES VIGNES, LAREE
32;PL DU VILLAGE, LARROQUE-ENGALIN
32;ALL DE L'EGLISE, LARROQUE-ENGALIN
32;RUE DU CASTELNAU, LARROQUE-ENGALIN
32;RTE DE L'AUCHIE, LARROQUE-ENGALIN
32;CHEM DE BEAULIEU, LARROQUE-ENGALIN
32;RTE DE CARRETON, LARROQUE-ENGALIN
32;IMP DU CHATEAU, LARROQUE-ENGALIN
32;CHEM DE GACHON, LARROQUE-ENGALIN
32;CHEM DE HOMS, LARROQUE-ENGALIN
32;CHEM DU LAVOIR, LARROQUE-ENGALIN
32;PL DE LA MAIRIE, LARROQUE-ENGALIN
32;IMP MARIA, LARROQUE-ENGALIN
32;BD DU MIDI, LARROQUE-ENGALIN
32;BD DU MOULIN, LARROQUE-ENGALIN
32;BD DU NORD, LARROQUE-ENGALIN
32;CHEM DE PEYRECAVE, LARROQUE-ENGALIN
32;TSSE DU PORCHE, LARROQUE-ENGALIN
32;COTE DE ROCAIN, LARROQUE-ENGALIN
32;RTE DE LA ROMIEU, LARROQUE-ENGALIN
32;CHEM DE SAINT AMAN, LARROQUE-ENGALIN
32;RTE VERS LECTOURE, LARROQUE-ENGALIN
32;PAS DU VIEUX PORCHE, LARROQUE-ENGALIN
32;CHEM DE LA BOURDETTE, LARTIGUE
32;CHEM DU CARAOUE, LARTIGUE
32;CHEM DE CASTAGNAU, LARTIGUE
32;RTE DE CASTELNAU BARBARENS, LARTIGUE
32;CHEM DU CRABE, LARTIGUE
32;ESP DE L'EGLISE, LARTIGUE
32;RTE DE L'ESPLANADE, LARTIGUE
32;PL DU FOUR A PAIN, LARTIGUE
32;CHEM DE GARRIGAS, LARTIGUE
32;RTE DE HERECHOU, LARTIGUE
32;CHEM DE JOUANBLANC, LARTIGUE
32;CHEM D'EN JOUANTET, LARTIGUE
32;CHEM DU LAC, LARTIGUE
32;CHEM DE LAGOUARDE, LARTIGUE
32;RTE DE LARREBIAN, LARTIGUE
32;CHEM DE LASSERRE, LARTIGUE
32;RTE DE MAZERES, LARTIGUE
32;CHEM DU PATACHON, LARTIGUE
32;CHEM DE PEYRERE, LARTIGUE
32;RTE DE SARAMON, LARTIGUE
32;RTE DE SEMEZIES, LARTIGUE
32;CHEM DE TAMBOURET, LARTIGUE
32;RTE DE TRAVERSERES, LARTIGUE
32;CHEM DE VILLENEUVE, LARTIGUE
32;RUE PLAINE DE CALIFORNIE, LASSERAN
32;CHEM DE LA HITERE, LASSERAN
32;CHEM DU LAVOIR, LASSERAN
32;CHEM DE MAUBEC, LASSERAN
32;CHEM DE NAUGAS, LASSERAN
32;RUE FERME DE NAUGAS, LASSERAN
32;CHEM DU TAILLEUR, LASSERAN
32;PL DU VILLAGE, LASSERAN
32;CHEM DE BELLEVUE, LASSEUBE-PROPRE
32;CHEM DE BIRAGA, LASSEUBE-PROPRE
32;ALL DU BOIS, LASSEUBE-PROPRE
32;ALL DE BOUSCARROT, LASSEUBE-PROPRE
32;CHEM D'EN CAMPAN, LASSEUBE-PROPRE
32;CHEM DU CEDON, LASSEUBE-PROPRE
32;CHEM DU CHATEAU VIEUX, LASSEUBE-PROPRE
32;CHEM DES CLAUSIS, LASSEUBE-PROPRE
32;CHEM DU CONTE, LASSEUBE-PROPRE
32;ALL DU COTEAU, LASSEUBE-PROPRE
32;CHEM D'EN COUTENE, LASSEUBE-PROPRE
32;CHEM D'EMPERRIS, LASSEUBE-PROPRE
32;CHEM DE LA GAVACHE, LASSEUBE-PROPRE
32;CHEM DU HAJAT, LASSEUBE-PROPRE
32;CHEM DE LABARRAN, LASSEUBE-PROPRE
32;CHEM DE LABLENNERIE, LASSEUBE-PROPRE
32;PL DE LA MAIRIE, LASSEUBE-PROPRE
32;IMP DE LA MARCADERE, LASSEUBE-PROPRE
32;CHEM DE NAROQUES, LASSEUBE-PROPRE
32;CHEM D'EN NESQUERRE, LASSEUBE-PROPRE
32;CHEM DE PAVIE, LASSEUBE-PROPRE
32;CHEM D'EN PEYRIS, LASSEUBE-PROPRE
32;CHEM DES PLATS, LASSEUBE-PROPRE
32;CHEM DES QUATRE CHENES, LASSEUBE-PROPRE
32;CHEM DE SAINT JEAN LE COMTAL, LASSEUBE-PROPRE
32;CHEM DE SOTOM, LASSEUBE-PROPRE
32;CHEM DU VILLAGE, LASSEUBE-PROPRE
32;CHEM D'ES VIVES, LASSEUBE-PROPRE
32;LOT LE BOUSQUET, LAUJUZAN
32;RTE JEAN BOUGNERES, LAUJUZAN
32;CHEM PIERRE BOURDENS, LAUJUZAN
32;RUE JOSEPH BERNAT CANTAU, LAUJUZAN
32;RUE LOUIS JOSEPH CANTAU, LAUJUZAN
32;RTE DE CAUPENNE, LAUJUZAN
32;RTE JEAN DANDO, LAUJUZAN
32;ALL HENRI DUBEDAT, LAUJUZAN
32;RTE JACQUES DUBEDAT, LAUJUZAN
32;RTE JEAN DUBEDAT, LAUJUZAN
32;IMP GABRIEL DUBOSC, LAUJUZAN
32;RTE JEAN DUFRANC, LAUJUZAN
32;RTE LOUIS FAGET, LAUJUZAN
32;RUE FERRADE, LAUJUZAN
32;RTE JEAN VINCENT GALABERT, LAUJUZAN
32;IMP PIERRE LALANNE, LAUJUZAN
32;RTE VITAL FERDINAND LAZAREY, LAUJUZAN
32;RTE DE MAGNAN, LAUJUZAN
32;RTE DE MONLEZUN, LAUJUZAN
32;RTE DE MORMES, LAUJUZAN
32;RTE DE NOGARO, LAUJUZAN
32;RTE DE PANJAS, LAUJUZAN
32;ALL GEORGES SAMALENS, LAUJUZAN
32;ALL JEAN SAMALENS, LAUJUZAN
32;PL JEAN FRANCOIS SAMALENS, LAUJUZAN
32;RTE ARISTIDE SAMALENS, LAUJUZAN
32;RUE DU BOURDIEU, LAURAET
32;CHEM DU COUSSO DE L'ESQUILLOT, LAURAET
32;RUE DU COUSSO DE L'ESQUILLOT, LAURAET
32;RUE DE L'EGLISE, LAURAET
32;RUE DU FOURNIL, LAURAET
32;RUE DE LA MURETTE, LAURAET
32;RUE DU 9EME ART, LAURAET
32;RUE PIERRE BROSSOLETTE, LAURAET
32;RUE DES PLATANES, LAURAET
32;RUE DU PRESBYTERE, LAURAET
32;RUE DES PYRENEES, LAURAET
32;RUE DU RACOU, LAURAET
32;RUE ANTOINE DE ROQUELAURE, LAVARDENS
32;CHEM DE BOUHABENT, LAVERAET
32;IMP DE CANTECOUCUT, LAVERAET
32;CHEM DE L'EGLISE, LAVERAET
32;CHEM DE GUINLETS, LAVERAET
32;CHEM DE LAGARDERE, LAVERAET
32;CHEM DU MOULIES, LAVERAET
32;CHEM DU MOULIN NEUF, LAVERAET
32;CHEM DE PARROUQUET, LAVERAET
32;CHEM DU PECOS, LAVERAET
32;CHEM DE RONDE, LAVERAET
32;PL DE LA MAIRIE, LEBOULIN
32;PL DU 26 JUILLET 1944, LEBOULIN
32;CITE DU COULOUME, LECTOURE
32;LOT LA BOERE, LECTOURE
32;CITE DES AMANDIERS, LECTOURE
32;CITE BAGATELLE, LECTOURE
32;LOT DE LA HUNE, LECTOURE
32;LOT LES PEUPLIERS, LECTOURE
32;LOT LA SAMARITAINE, LECTOURE
32;LOT DU CAMPARDINE, LECTOURE
32;RTE D'AGEN, LECTOURE
32;PL AIME LEPETIT, LECTOURE
32;RUE ALSACE LORRAINE, LECTOURE
32;CHE DES AMANDIERS, LECTOURE
32;RUE DE L ABBE TOURNIER, LECTOURE
32;AV ANDRE MAGNE, LECTOURE
32;RUE RENE ANTICHAN, LECTOURE
32;CHE DES ACACIAS, LECTOURE
32;CRS D ARMAGNAC, LECTOURE
32;RUE DE L'ARTISANAT, LECTOURE
32;RTE D'AUCH, LECTOURE
32;BD BANEL, LECTOURE
32;RUE BARBACANE, LECTOURE
32;RUE DES BLES, LECTOURE
32;CHE D YDRONE, LECTOURE
32;CHE DE LA BOERE, LECTOURE
32;PL BOUE DE LAPEYRERE, LECTOURE
32;PL BROSSOLETTE, LECTOURE
32;RUE BUTTE BAULAC, LECTOURE
32;RUE DU CAMPARDINE, LECTOURE
32;IMP DES CAPUCINS, LECTOURE
32;RUE DES CAPUCINS, LECTOURE
32;RUE DES CHENES, LECTOURE
32;RUE CLAUDE YDRON, LECTOURE
32;CHE CLAUDE YDRON, LECTOURE
32;CHE DE LA COLLINE, LECTOURE
32;RTE DE CONDOM, LECTOURE
32;RUE CONSTANTIN, LECTOURE
32;RUE DE CORHAUT, LECTOURE
32;IMP DU COULOUME, LECTOURE
32;RUE CRABERE, LECTOURE
32;IMP CROIX ROUGE, LECTOURE
32;PL ALBERT DESCAMPS, LECTOURE
32;RUE DIANE, LECTOURE
32;AV DU DOC SOUVIRON, LECTOURE
32;RUE DU PLATEAU, LECTOURE
32;RUE DUPOUY, LECTOURE
32;RUE DE L EGALITE, LECTOURE
32;CHEM EMILIE SABATHE, LECTOURE
32;ALL DES ENTREPRENEURS, LECTOURE
32;RUE FONTELIE, LECTOURE
32;IMP DES FRENES, LECTOURE
32;RUE DES FRERES DANZAS, LECTOURE
32;AV DE LA GARE, LECTOURE
32;PL DU GENERAL DE GAULLE, LECTOURE
32;IMP DU GENERAL LATERRADE, LECTOURE
32;RUE DU GENERAL MANGIN, LECTOURE
32;RUE DE LA GIROFLEE, LECTOURE
32;RUE DU GUICHET, LECTOURE
32;CRS GAMBETTA, LECTOURE
32;AV JACQUES DESCAMPS, LECTOURE
32;CHE DE LA HUNE, LECTOURE
32;RUE DE L'INNOVATION, LECTOURE
32;RUE JEAN MOULIN, LECTOURE
32;BD JEAN JAURES, LECTOURE
32;RUE JULES DE SARDAC, LECTOURE
32;RUE LAFEUGERE BOUTAN, LECTOURE
32;IMP LAURENT RACHOU, LECTOURE
32;CHE DE LAUCATE, LECTOURE
32;RUE LAGRANGE, LECTOURE
32;CHE DU COULOUME, LECTOURE
32;CHE DE LAMARQUE, LECTOURE
32;ALL DE LOMAGNE, LECTOURE
32;PL LOUIS DAMBLANC, LECTOURE
32;RUE DE MARES, LECTOURE
32;PL DU 19 MARS 1962, LECTOURE
32;RUE MAURICE CAZENEUVE, LECTOURE
32;IMP MAURICE TOQUEBENS, LECTOURE
32;RUE DES METIERS, LECTOURE
32;BD DU MIDI, LECTOURE
32;RUE MONTEBELLO, LECTOURE
32;ALL MONTMORENCY, LECTOURE
32;RUE DES MOULINS, LECTOURE
32;CHE DE LA MOULINE, LECTOURE
32;RUE NATIONALE, LECTOURE
32;RUE NARBONNE PELET, LECTOURE
32;BD DU NORD, LECTOURE
32;IMP DES ORMES, LECTOURE
32;RUE DU PASTEL, LECTOURE
32;RUE PAULE ET GEORGES BROSSARD, LECTOURE
32;IMP PERICER, LECTOURE
32;IMP DES PEUPLIERS, LECTOURE
32;RUE PEY DE GARROS, LECTOURE
32;CHE DES PIETONS, LECTOURE
32;PL PIERRE GARDEIL, LECTOURE
32;RUE DES PYRENEES, LECTOURE
32;IMP DES REFRACTAIRES, LECTOURE
32;RUE REILLAS, LECTOURE
32;RUE DES REMPARTS, LECTOURE
32;SQ DES REMPARTS, LECTOURE
32;SQ RENE CASSIN, LECTOURE
32;RUE ROBERT DUCLOS, LECTOURE
32;CHE DU RUISSEAU, LECTOURE
32;CHE DE SAINT CLAIR, LECTOURE
32;RTE DE SAINT CLAR, LECTOURE
32;RUE SAINT ESPRIT, LECTOURE
32;PL SAINT GERVAIS, LECTOURE
32;RUE SAINT GERVAIS, LECTOURE
32;RUE SAINT JACQUES, LECTOURE
32;RUE SAINTE CLAIRE, LECTOURE
32;PL SAINTE MARIE, LECTOURE
32;AV SIMONE NUX, LECTOURE
32;RUE SOULES, LECTOURE
32;AV DU SOUVENIR FRANCAIS, LECTOURE
32;RUE SUBERVIE, LECTOURE
32;AV DU MARECHAL LANNES, LECTOURE
32;RUE DE LA TOUR, LECTOURE
32;RUE DES TOURNESOLS, LECTOURE
32;CHE DE LA TRIDE, LECTOURE
32;RTE DE LA VIEILLE COTE, LECTOURE
32;RUE DES VIEILLES ECOLES, LECTOURE
32;RUE VICTOR HUGO, LECTOURE
32;AV VILLE DE SAINT LOUIS, LECTOURE
32;RUE DU 14 JUILLET, LECTOURE
32;VC 26 DITE DU MARQUISAT, LECTOURE
32;CHE DU MARQUISAT, LECTOURE
32;IMP DES ALOUETTES, LIAS
32;IMP DE LA CHAPELLE, LIAS
32;IMP DES CHENES, LIAS
32;RUE CLAUDE NOUGARO, LIAS
32;PL DES COMTES DE GASCOGNE, LIAS
32;RTE DE FONTENILLES, LIAS
32;IMP DES GEAIS, LIAS
32;RUE GEORGES BRASSENS, LIAS
32;PL GEORGES LABORIE, LIAS
32;RUE HAROUN TAZIEFF, LIAS
32;PL DU 8 MAI 1945, LIAS
32;RTE DE L'ISLE JOURDAIN, LIAS
32;RUE JEANETTE GUYOT, LIAS
32;PL JEAN PIERRE JOSEPH, LIAS
32;IMP JEAN MOULIN, LIAS
32;IMP LUCIE AUBRAC, LIAS
32;IMP DES MERLES, LIAS
32;RTE D'OCCITANIE, LIAS
32;IMP DES PALOMBES, LIAS
32;IMP DES PIGEONNIERS, LIAS
32;IMP DES PYRENEES, LIAS
32;RUE RAYMOND IDRAC, LIAS
32;RUE ROGER QUILLOT, LIAS
32;IMP DES ROSSIGNOLS, LIAS
32;RUE SIMONE VEIL, LIAS
32;IMP DES TOURNESOLS, LIAS
32;PL DU GENERAL LAFFARGUE, LIGARDES
32;RTE DE FRANCESCAS, LIGARDES
32;LOT CANTELOUP, LOMBEZ
32;CITE DES CASTORS, LOMBEZ
32;CITE DE LA RIBERE, LOMBEZ
32;CHE DE L'ANGELIAC, LOMBEZ
32;PL DE LA 1ERE ARMEE FRANCAISE, LOMBEZ
32;RUE D'ASTE, LOMBEZ
32;RUE DU BARRY NEUF, LOMBEZ
32;RUE BERTIN, LOMBEZ
32;RUE DES BOULANGERS, LOMBEZ
32;RTE DE CARBONNE, LOMBEZ
32;RUE DU CARRELOT, LOMBEZ
32;PL DE LA CATHEDRALE, LOMBEZ
32;CHE DU CIMETIERE, LOMBEZ
32;CHE DE LA COOPERATIVE, LOMBEZ
32;AV DU CORPS FRANC POMMIES, LOMBEZ
32;PL DU CORPS FRANC POMMIES, LOMBEZ
32;RUE DU CUL DE SAC, LOMBEZ
32;RUE DU DEVERSOIR, LOMBEZ
32;CHE DES RELIGIEUSES, LOMBEZ
32;AV DU DOCTEUR RAYNAUD, LOMBEZ
32;CHE D'ENCOUGET, LOMBEZ
32;CHE D'ENHOURTON, LOMBEZ
32;RTE D'ESPAON, LOMBEZ
32;AV DE LA GAILLOUE, LOMBEZ
32;CHE DE LA GAILLOUE, LOMBEZ
32;RUE DES GENETS, LOMBEZ
32;RUE DES GRENIERS, LOMBEZ
32;RUE HENRI BECANNE, LOMBEZ
32;CHE DE L HOPITAL, LOMBEZ
32;PL DU HUIT MAI, LOMBEZ
32;RUE JACQUES LALANNE, LOMBEZ
32;RUE JEAN MOULIN, LOMBEZ
32;CHE DE LARTIGUE, LOMBEZ
32;CHE DE LASCANAOUERES, LOMBEZ
32;IMP LASCANAOUERES, LOMBEZ
32;RUE DES LAURIERES, LOMBEZ
32;RUE DES LAVANDES, LOMBEZ
32;CHE DU LAVOIR, LOMBEZ
32;PL DE LA LIBERATION, LOMBEZ
32;RUE DU LOMBEZIS, LOMBEZ
32;AV DU MAQUIS DE MEILHAN, LOMBEZ
32;RUE DU 19 MARS 1962, LOMBEZ
32;RTE DE MONTADET, LOMBEZ
32;RTE DE MONTARUS, LOMBEZ
32;RUE DU MOULIN, LOMBEZ
32;RUE NOTRE DAME, LOMBEZ
32;RUE DE L ORME, LOMBEZ
32;RUE DE LA POSTE, LOMBEZ
32;CHE DES PRES, LOMBEZ
32;RTE DE PUYLAUSIC, LOMBEZ
32;BD DES PYRENEES, LOMBEZ
32;RUE DE LA RAMONDERE, LOMBEZ
32;RUE DE LA REILHE, LOMBEZ
32;RUE DE RETONFEY, LOMBEZ
32;RUE DES ROMARINS, LOMBEZ
32;RUE SAINT  ADOURE, LOMBEZ
32;CHE DE SAINT MAJAN, LOMBEZ
32;RTE DE SAMATAN, LOMBEZ
32;RTE DE SARAMON, LOMBEZ
32;RUE DES SARRADES, LOMBEZ
32;IMP DES SAULES, LOMBEZ
32;IMP DE LA SAVE, LOMBEZ
32;RUE DU SAVES, LOMBEZ
32;RTE DE TARBES, LOMBEZ
32;RUE DES TILLEULS, LOMBEZ
32;RUE DU TINAL, LOMBEZ
32;RTE DE TOULOUSE, LOMBEZ
32;AV DE TOULOUSE, LOMBEZ
32;PL DU TRIANON, LOMBEZ
32;AV DES TROIS ROIS, LOMBEZ
32;RTE DE VIGNOLLES, LOMBEZ
32;RUE DE LA REPUBLIQUE, LOMBEZ
32;RTE DE LOMBEZ, LOMBEZ
32;RUE DE L EGLISE, LOMBEZ
32;PL DE L HOTEL DE VILLE, LOMBEZ
32;RUE DE LA GLACE, LOMBEZ
32;RUE DES PENITENTS, LOMBEZ
32;FG SAINT JACQUES, LUPIAC
32;FG SAINT ANDRE, LUPIAC
32;RTE AIGNAN, LUPIAC
32;RUE FEART, LUPIAC
32;CHE DE LA FONTAINE, LUPIAC
32;CHE DU MOULIN DE BOURDEOU, LUPIAC
32;CHE DU REMPART DU MIDI, LUPIAC
32;RUE DU REMPART NORD, LUPIAC
32;RTE DE VIC FEZENSAC, LUPIAC
32;GPL GRANDE PLACE, LUPIAC
32;GR GRANDE RUE, LUPIAC
32;LOT DE L'ARGELA, LUPPE-VIOLLES
32;CHEM D'ARBLADE LE BAS, LUPPE-VIOLLES
32;IMP CAOUPIT, LUPPE-VIOLLES
32;IMP CAP DE LALANNE, LUPPE-VIOLLES
32;IMP CRAVENCERES, LUPPE-VIOLLES
32;IMP CUGRAND, LUPPE-VIOLLES
32;RTE DEPARTEMENTALE 931, LUPPE-VIOLLES
32;CHEM DE DUBEDAT, LUPPE-VIOLLES
32;CHEM DE L'EGLISE, LUPPE-VIOLLES
32;CHEM DE L'ESTIENNE, LUPPE-VIOLLES
32;VOIE TIRES DE LAS TIRES, LUPPE-VIOLLES
32;IMP DU GRAIN, LUPPE-VIOLLES
32;CHEM DE HITON, LUPPE-VIOLLES
32;CHEM DE JEAN BLANC, LUPPE-VIOLLES
32;CHEM DE LARROUDE, LUPPE-VIOLLES
32;RTE DE LELIN LAPUJOLLE, LUPPE-VIOLLES
32;RUE DE LA MAIRIE, LUPPE-VIOLLES
32;IMP MARGOT, LUPPE-VIOLLES
32;CHEM DE PALANQUE, LUPPE-VIOLLES
32;CHEM DE PEOUBLANC, LUPPE-VIOLLES
32;CHEM DE PEREUIL, LUPPE-VIOLLES
32;IMP PIERROT, LUPPE-VIOLLES
32;RTE DE SAINT GERME, LUPPE-VIOLLES
32;RTE D'AUBIET, LUSSAN
32;RTE D'AUCH, LUSSAN
32;CHEM DE LA BOUTIGUERE, LUSSAN
32;CHEM DU CAP DU BOSC, LUSSAN
32;CHEM DE CASTELNAU, LUSSAN
32;CHEM D'EN CHAMBRE, LUSSAN
32;CHEM D'EN CLAQUET, LUSSAN
32;CHEM DE LA CROIX DE LABAT, LUSSAN
32;CHEM DES CYPRES, LUSSAN
32;CHEM D'EN GEORGIS, LUSSAN
32;RTE DE L'ISLE ARNE, LUSSAN
32;CHEM DE LALANNE, LUSSAN
32;CHEM DE LOSTE, LUSSAN
32;CHEM DE PAILHAN, LUSSAN
32;CHEM DE PESSAN, LUSSAN
32;CHEM D'EN POURCET, LUSSAN
32;CHEM DU TAILLAT, LUSSAN
32;CHEM D'EN TUDELLE, LUSSAN
32;QUA DU CASTERA, MAGNAN
32;QUA AU VILLAGE, MAGNAN
32;RTE D'AIRE SUR ADOUR, MAGNAN
32;CHEM VOIE DE LA BAYLE, MAGNAN
32;CHEM VOIE DE BONNIFACE, MAGNAN
32;CHEM DE COUSSO, MAGNAN
32;CHEM VOIE DE CREMENS, MAGNAN
32;CHEM VOIE DE CRIERON, MAGNAN
32;CHEM VOIE DE DAUNIAN, MAGNAN
32;CHEM VOIE DE DUFOUR, MAGNAN
32;PL DE L'EGLISE, MAGNAN
32;CHEM VOIE DE L'EGLISE CREMENS, MAGNAN
32;CHEM DU HAUBELON, MAGNAN
32;RTE DE LANNE SOUBIRAN, MAGNAN
32;CHEM DE LARPENT, MAGNAN
32;RTE DE LAUJUZAN, MAGNAN
32;RTE DE NOGARO, MAGNAN
32;CHEM DE PEYROUET, MAGNAN
32;PL DU SABOTIER, MAGNAN
32;CHEM DE TARRANQUET, MAGNAN
32;LOT DES VALLONS, MAIGNAUT-TAUZIA
32;CHEM DE L'AULOUE, MAIGNAUT-TAUZIA
32;CHEM D'AVEYRON, MAIGNAUT-TAUZIA
32;PL DU CANONGE, MAIGNAUT-TAUZIA
32;CHEM DE CATALAN, MAIGNAUT-TAUZIA
32;CHEM DE LA CHAPELLE, MAIGNAUT-TAUZIA
32;RTE DE CONDOM, MAIGNAUT-TAUZIA
32;CHEM COTE DE VALENCE, MAIGNAUT-TAUZIA
32;CHEM VOIE DE FLARAN, MAIGNAUT-TAUZIA
32;CHEM DE LA GELE, MAIGNAUT-TAUZIA
32;CHEM DE HERRET, MAIGNAUT-TAUZIA
32;CHEM DE LARROUY, MAIGNAUT-TAUZIA
32;CHEM DU LAUZIT, MAIGNAUT-TAUZIA
32;CHEM DU LAVOIR, MAIGNAUT-TAUZIA
32;CHEM DU LIVET, MAIGNAUT-TAUZIA
32;CHEM DE LAS PISSETTES, MAIGNAUT-TAUZIA
32;CHEM DE RONDE, MAIGNAUT-TAUZIA
32;CHEM DE SAINT MAURICE, MAIGNAUT-TAUZIA
32;RTE DE SAINT PUY, MAIGNAUT-TAUZIA
32;CHEM VOIE DE SAINT ORENS, MAIGNAUT-TAUZIA
32;CHEM DU TAUZIA, MAIGNAUT-TAUZIA
32;PL DU VILLAGE, MAIGNAUT-TAUZIA
32;IMP DE L'ARROS, MALABAT
32;CHEM DES CURS, MALABAT
32;CHEM DE L'ECOLE, MALABAT
32;IMP DE MENGE, MALABAT
32;CHEM DE MENGINOLLE, MALABAT
32;CHEM DE ROQUES, MALABAT
32;CHEM DE SANGDEMOY, MALABAT
32;IMP DE BOURDALERA, MANAS-BASTANOUS
32;CHEM DE LA CHAPELLE D'AROUX, MANAS-BASTANOUS
32;CHEM DE LAS COSTES, MANAS-BASTANOUS
32;CHEM DE L'EGLISE, MANAS-BASTANOUS
32;RTE DE FONTRAILLES, MANAS-BASTANOUS
32;CHEM DE LAURENT, MANAS-BASTANOUS
32;CHEM DE LAS MERLERES, MANAS-BASTANOUS
32;CHEM DE MONTAUBA, MANAS-BASTANOUS
32;IMP DE L'OUSTAU, MANAS-BASTANOUS
32;CHEM DE LA PACHERE, MANAS-BASTANOUS
32;CHEM DU PETIT BARON, MANAS-BASTANOUS
32;CHEM DE PORTENEUVE, MANAS-BASTANOUS
32;CITE DES CASTORS, MANCIET
32;CITE CREVE COEUR, MANCIET
32;RUE DES ARENES, MANCIET
32;RUE BERGUE, MANCIET
32;RUE DE BOURROUILLAN, MANCIET
32;RUE DES CASTORS, MANCIET
32;RUE CATALOT, MANCIET
32;RUE CENTRALE, MANCIET
32;RUE DES ECOLES, MANCIET
32;RTE D'ESPAS, MANCIET
32;PL FEART, MANCIET
32;PL DU FOIRAIL, MANCIET
32;RUE DES FONTAINES, MANCIET
32;PL DE LA MAIRIE, MANCIET
32;RUE DE LA MATERNELLE, MANCIET
32;PL DU MONUMENT AUX MORTS, MANCIET
32;PL DU PESQUEROT, MANCIET
32;RUE DES VIGNES, MANCIET
32;RUE DE L HOSPICE, MANCIET
32;PL DE LA REPUBLIQUE, MANCIET
32;CHE DE LAGUIRE, MANCIET
32;RUE DES REMPARTS, MANCIET
32;CHE DE LA FONTAINE, MARAMBAT
32;CHE DE MOUSSEIGNE, MARAMBAT
32;CHE DE LAR, MARAMBAT
32;CHE DE HAILLE, MARAMBAT
32;CHEM DE BARIQUERE A COUMETS, MARAMBAT
32;CHEM DU BASCOU, MARAMBAT
32;RTE DE BEZOLLES, MARAMBAT
32;CHEM DE BOLLE, MARAMBAT
32;RTE DU CAMP DU HAUT, MARAMBAT
32;CHEM DE CAPOT, MARAMBAT
32;RTE DE CASTERA, MARAMBAT
32;CHEM DES CRETES, MARAMBAT
32;PL DE L'EGLISE, MARAMBAT
32;CHEM D'ESPIET, MARAMBAT
32;CHEM DES IRIS, MARAMBAT
32;CHEM DU LAVOIR, MARAMBAT
32;RUE DE LA LIBERTE, MARAMBAT
32;RUE DE LA MARE, MARAMBAT
32;RUE DU MAS BIELH, MARAMBAT
32;CHEM DE MAUBESTE, MARAMBAT
32;IMP DES MESANGES, MARAMBAT
32;RUE DES MIMOSAS, MARAMBAT
32;RTE DE MIRAN, MARAMBAT
32;RTE DE MOUCHAN, MARAMBAT
32;CHEM DU PARRAT, MARAMBAT
32;RTE DE PESSALLE, MARAMBAT
32;CHEM DU PETE, MARAMBAT
32;RUE DU PETIT CHEMIN, MARAMBAT
32;CHEM DU PRESBYTERE, MARAMBAT
32;CHEM DE PRIMAT, MARAMBAT
32;RTE DE VALENCE, MARAMBAT
32;RTE DE VIC FEZENSAC, MARAMBAT
32;RES BEL HORIZON, MARCIAC
32;LOT LES BASTIDONS, MARCIAC
32;CITE BUJALON, MARCIAC
32;CITE CLAIR LOGIS, MARCIAC
32;RES LA FLANERIE, MARCIAC
32;RES ROCA SOLEIL, MARCIAC
32;CHE DE L'AJANSON, MARCIAC
32;CHE DES ARENES, MARCIAC
32;RTE D'AUCH, MARCIAC
32;RTE DE BASSOUES, MARCIAC
32;RUE DES JARDINS, MARCIAC
32;CHE DE LA CHAPELLE, MARCIAC
32;RUE DES LILAS, MARCIAC
32;PL DU CHEVALIER D'ANTRAS, MARCIAC
32;RUE DES CINQ PARTS, MARCIAC
32;RUE HENRI LAIGNOUX, MARCIAC
32;PL DE L'HOTEL DE VILLE, MARCIAC
32;IMP JEAN MOULIN, MARCIAC
32;RUE JOSEPH ABEILHE, MARCIAC
32;CHE DE BONNET, MARCIAC
32;RUE DE JUILLAC, MARCIAC
32;RTE DE LAVERAET, MARCIAC
32;RUE DU HUIT MAI 1945, MARCIAC
32;RTE DE MAUBOURGUET, MARCIAC
32;RTE DE MIRANDE, MARCIAC
32;RUE MORLAS, MARCIAC
32;CHE NEUF, MARCIAC
32;RUE NOTRE DAME, MARCIAC
32;RUE DU 11 NOVEMBRE 1918, MARCIAC
32;RUE DU PAVILLON, MARCIAC
32;CHE DE PERA, MARCIAC
32;RTE DE PLAISANCE, MARCIAC
32;RUE PORTE DE LA VILLE, MARCIAC
32;RUE PUTNAOU, MARCIAC
32;CHE DE RONDE, MARCIAC
32;RUE SAINT JEAN, MARCIAC
32;RTE DE SAINT JUSTIN, MARCIAC
32;RUE SAINT JUSTIN, MARCIAC
32;RUE SAINT PIERRE, MARCIAC
32;CHE DU STADE, MARCIAC
32;RTE D'AUBIET, MARSAN
32;CHEM DU BOSC, MARSAN
32;CHEM CAP DU MESPLET, MARSAN
32;CHEM CAP DU PRAT, MARSAN
32;CHEM D'EN CLAQUET, MARSAN
32;CHEM LAS COUMES, MARSAN
32;CHEM DE LAS DAOUNES, MARSAN
32;IMP DE L'ECOLE, MARSAN
32;RUE EMBLANDIN, MARSAN
32;IMP FERDINAND CAUMONT, MARSAN
32;CHEM D'EN JULIEN, MARSAN
32;RTE DE LAHITTE, MARSAN
32;RTE DE LAMA, MARSAN
32;CHEM LESTAGNERES, MARSAN
32;CHEM DE LOUBEDAT, MARSAN
32;RTE DE LUSSAN, MARSAN
32;IMP MENINEC, MARSAN
32;RUE MENINEC, MARSAN
32;CHEM DE MONDILLON, MARSAN
32;RTE DE MONTAUT LES CRENEAUX, MARSAN
32;RTE DE NOUGAROULET, MARSAN
32;CHEM DU PARRIAGUES, MARSAN
32;CHEM DE LA PEYRERE, MARSAN
32;RUE PIERRE DE MONTESQUIOU, MARSAN
32;CHEM D'EN PONSAN, MARSAN
32;RUE DU PUIT, MARSAN
32;CHEM DES QUATRE ROUTES, MARSAN
32;CHEM DE ROME, MARSAN
32;CHEM D'EN SARRAGNET, MARSAN
32;CHEM DU SOURBET, MARSAN
32;RUE DU STADE, MARSAN
32;RUE DES TILLEULS, MARSAN
32;CHEM DE TULLE, MARSAN
32;PL DES ARCADES, MAS D AUVIGNON
32;CHEM DE L'AUVIGNON, MAS D AUVIGNON
32;CHEM DE CARRERE, MAS D AUVIGNON
32;RUE DU CHATEAU, MAS D AUVIGNON
32;RUE DES ECUREUILS, MAS D AUVIGNON
32;PAS FIMARCON, MAS D AUVIGNON
32;RUE DE LA FORGE, MAS D AUVIGNON
32;RTE DE LA LOMAGNE, MAS D AUVIGNON
32;RUE DE LA METAIRIE, MAS D AUVIGNON
32;BD DU MIDI, MAS D AUVIGNON
32;PL DU PORCHE, MAS D AUVIGNON
32;CHEM PRAT COMDAOU, MAS D AUVIGNON
32;RUE DU PRESBYTERE, MAS D AUVIGNON
32;CHEM DE LA PUZOQUE, MAS D AUVIGNON
32;RTE DES PYRENEES, MAS D AUVIGNON
32;RUE DES REMPARTS, MAS D AUVIGNON
32;IMP SAVAGNAC, MAS D AUVIGNON
32;CHEM SAINT LEZER, MAS D AUVIGNON
32;RTE DE LA TENAREZE, MAS D AUVIGNON
32;VC VOIE COMMUNALE N 1, MAS D AUVIGNON
32;VC VOIE COMMUNALE N 2, MAS D AUVIGNON
32;VC VOIE COMMUNALE N 3, MAS D AUVIGNON
32;VC VOIE COMMUNALE N 4, MAS D AUVIGNON
32;VC VOIE COMMUNALE N 5, MAS D AUVIGNON
32;VC VOIE COMMUNALE N 6, MAS D AUVIGNON
32;VC VOIE COMMUNALE N 7, MAS D AUVIGNON
32;VC VOIE COMMUNALE N 8, MAS D AUVIGNON
32;VC VOIE COMMUNALE N 11, MAS D AUVIGNON
32;CR CHEMIN RURAL N 1, MAS D AUVIGNON
32;RUE ALBIN BIBAL, MASSEUBE
32;RUE LUBAS, MASSEUBE
32;RUE BOUGUES, MASSEUBE
32;RUE DE LA BRECHE, MASSEUBE
32;RUE BROCHAIN, MASSEUBE
32;RUE DU COMMERCE, MASSEUBE
32;IMP DU COUVENT, MASSEUBE
32;RUE JEAN FURCATTE, MASSEUBE
32;RUE JEAN PERI, MASSEUBE
32;RUE LAGRANGE, MASSEUBE
32;RUE NATIONALE, MASSEUBE
32;RUE NEUVE, MASSEUBE
32;RUE DES PENITENTS BLANCS, MASSEUBE
32;RUE DU TOUR DE VILLE, MASSEUBE
32;PL DU FOIRAIL, MASSEUBE
32;CHE NEUF, MASSEUBE
32;RUE DES TOURTERELLES, MASSEUBE
32;RUE GENERAL DE GAULLE, MASSEUBE
32;AV ELYSEE DUFFRECHOU, MASSEUBE
32;AV JULES DUFFORT, MASSEUBE
32;AV COUZIERS, MASSEUBE
32;RTE DU MOULIN, MASSEUBE
32;RUE DES MERLES, MASSEUBE
32;AV JEAN CASSE, MASSEUBE
32;PL PLACE DE LA MAIRIE, MASSEUBE
32;CHE DE BRUN, MASSEUBE
32;RUE JULES SABIN CORTIES, MASSEUBE
32;RUE HENRI NASSANS, MASSEUBE
32;RTE DES PYRENEES, MASSEUBE
32;RUE ANDRE BRUYERE, MASSEUBE
32;RUE DE CHANTEGRENOUILLE, MASSEUBE
32;RUE BEAUSOLEIL, MASSEUBE
32;RUE DES PALOMBES, MASSEUBE
32;AV HENRI TRILHA, MASSEUBE
32;CHE DU MOULIN, MASSEUBE
32;RUE CARRERO DE LAS CANLEVOS, MASSEUBE
32;RUE DU MOULIN, MASSEUBE
32;RUE DU PASTOURET, MASSEUBE
32;CHE DU CAMUS, MASSEUBE
32;RUE SAINT FRIS, MASSEUBE
32;CHE DE L ESTIVE, MASSEUBE
32;CHE DE BEAUREGARD, MASSEUBE
32;RUE ENTOUTBLANC, MASSEUBE
32;RUE DES JARDINS, MASSEUBE
32;CHE DE PERPETUAT, MASSEUBE
32;CHE DE MONPLAISIR, MASSEUBE
32;CHE DE LERMETERIE, MASSEUBE
32;RUE DE L ALAMBIC, MASSEUBE
32;RUE DE L ESTREMAOU, MASSEUBE
32;RUE DES REMPARTS, MASSEUBE
32;RUE DE BEAUREGARD, MASSEUBE
32;RUE DU CORPS FRANC POMMIES, MASSEUBE
32;RUE 1ERE ARMEE FR.RHIN DANUBE, MASSEUBE
32;RUE DU MAQUIS DE MEILHAN, MASSEUBE
32;PL DASTE, MASSEUBE
32;PL FRANCOIS MITTERRAND, MASSEUBE
32;RUE MARCEL PAUL, MASSEUBE
32;CHEM DU BOIS, MASSEUBE
32;CHEM DES CHENES, MASSEUBE
32;RUE DU 19 MARS 1962, MASSEUBE
32;RUE RENE CAIROU, MASSEUBE
32;RTE RTE DE GRIEDE, MAULICHERES
32;CHEM D'AMELIE, MAULICHERES
32;IMP DE BARTAT, MAULICHERES
32;RTE DE CAUMONT, MAULICHERES
32;CHEM DE DOMENGINE, MAULICHERES
32;RTE DE L'EGLISE, MAULICHERES
32;IMP DE GUILLAN, MAULICHERES
32;CHEM DE HOURPELAT, MAULICHERES
32;IMP DE LAHITTE, MAULICHERES
32;RTE DE LA MAIRIE, MAULICHERES
32;RTE DE MONPLAISIR, MAULICHERES
32;CHEM DE MOULIE, MAULICHERES
32;RTE DE NOGARO, MAULICHERES
32;RTE DE PLAISANCE, MAULICHERES
32;RTE DE SAINT GRIEDE, MAULICHERES
32;IMP DE VILLEPINTE, MAULICHERES
32;CHEM DE BORDENEUVE, MAURENS
32;CHEM DE LA BOUZIGUE, MAURENS
32;RTE DE CAZAUX SAVES, MAURENS
32;RUE DE LA COTE, MAURENS
32;CHEM DES CRETES, MAURENS
32;RUE DE L'ECOLE, MAURENS
32;CHEM D'EMBARRAOU, MAURENS
32;CHEM D'ENBIGARD, MAURENS
32;CHEM D'ENMENJOULET, MAURENS
32;CHEM D'ENTESTET, MAURENS
32;RTE DE FREGOUVILLE, MAURENS
32;RTE DE GIMONT, MAURENS
32;CHEM DE GISCARO, MAURENS
32;CHEM DE HUSTE, MAURENS
32;CHEM DE LAHAS, MAURENS
32;CHEM DE LASSEGUE, MAURENS
32;CHEM DE LAURENG, MAURENS
32;CHEM DE MAGOUBERT, MAURENS
32;CHEM DE LA MARCAOUE, MAURENS
32;CHEM DU MONGET, MAURENS
32;CHEM DE MOUSCAILLON, MAURENS
32;CHEM DE SAINT JEAN, MAURENS
32;CHEM DU TOUGNON, MAURENS
32;RUE DU VILLAGE, MAURENS
32;RLE DES TANNERIES, MAUROUX
