52;IMP PIERRE ROCHE, CHAUMONT
52;RUE PIERRE SIMON, CHAUMONT
52;RUE DES PINSONS, CHAUMONT
52;RUE DES PIVERTS, CHAUMONT
52;RUE DES PLATANES, CHAUMONT
52;AV POL ANTOINE, CHAUMONT
52;RUE DU PRESIDENT KENNEDY, CHAUMONT
52;RUE DU PRIEURE, CHAUMONT
52;RUE DES PRIMEVERES, CHAUMONT
52;RUE DE LA PRISE D EAU, CHAUMONT
52;RUE DU 14 JUILLET, CHAUMONT
52;IMP DES 4 VENTS, CHAUMONT
52;RUE DE LA QUELLEMELE, CHAUMONT
52;RUE DES RAMIERS, CHAUMONT
52;RUE RASPAIL, CHAUMONT
52;RUE RAYMOND POINCARE, CHAUMONT
52;RUE RAYMOND SAVIGNAC, CHAUMONT
52;RUE RENE SIMON, CHAUMONT
52;AV DE LA REPUBLIQUE, CHAUMONT
52;PL DE LA RESISTANCE ET MARTYR, CHAUMONT
52;RUE RIBOT, CHAUMONT
52;PAS ROBESPIERRE, CHAUMONT
52;RUE ROBESPIERRE, CHAUMONT
52;RUE ROCHAMBEAU, CHAUMONT
52;RUE ROGER SALENGRO, CHAUMONT
52;RUE DES ROSIERS, CHAUMONT
52;RUE DES ROSSIGNOLS, CHAUMONT
52;RUE ROUX CHAMPION, CHAUMONT
52;RUE DE ST AIGNAN, CHAUMONT
52;RUE SAINT HUBERT, CHAUMONT
52;RUE SAINT JEAN, CHAUMONT
52;RUE SAINT LOUIS, CHAUMONT
52;RUE SAINT ROCH, CHAUMONT
52;RTE DE SAINT ROCH, CHAUMONT
52;RUE DE SAVIGNY, CHAUMONT
52;RTE DE SEMOUTIERS, CHAUMONT
52;RUE SIMONE FEVRE, CHAUMONT
52;RUE DES SOEURS JULIEN, CHAUMONT
52;RUE DE LA SUIZE, CHAUMONT
52;RUE DES TANNERIES, CHAUMONT
52;RUE DES TANNEURS, CHAUMONT
52;RUE DU TEMPLE, CHAUMONT
52;RUE DES TENNIS, CHAUMONT
52;BD THIERS, CHAUMONT
52;ESP THOMAS WOODROW WILSON, CHAUMONT
52;PL DES TILLEULS, CHAUMONT
52;RUE TOULOUSE LAUTREC, CHAUMONT
52;RUE TOUPOT DE BEVEAUX, CHAUMONT
52;RUE TOUR CHARTON, CHAUMONT
52;RUE TOUR DU BERGER, CHAUMONT
52;RUE DE LA TOUR MONGEARD, CHAUMONT
52;RUE DES TRITONS, CHAUMONT
52;RUE DES URSULINES, CHAUMONT
52;RUE DU VAL ANDRE, CHAUMONT
52;RUE DU VAL ANNE MARIE, CHAUMONT
52;RUE DU VAL D'AOSTE, CHAUMONT
52;RUE DU VAL BARIZIEN, CHAUMONT
52;RUE DU VAL DE MARNE, CHAUMONT
52;RUE DE LA VALLEE, CHAUMONT
52;RUE DU VAL PONCE, CHAUMONT
52;RUE VAUGELADE, CHAUMONT
52;RUE DE LA VENERIE, CHAUMONT
52;RUE DE VERDUN, CHAUMONT
52;RUE DU VERT COTEAU, CHAUMONT
52;RUE VICTOIRE DE LA MARNE, CHAUMONT
52;RUE VICTOR FOURCAULT, CHAUMONT
52;AV VICTOR HUGO, CHAUMONT
52;RUE VICTOR MARIOTTE, CHAUMONT
52;RUE DU VIEUX MOULIN, CHAUMONT
52;RUE DE VIEVILLE, CHAUMONT
52;RUE DE VILLIERS, CHAUMONT
52;RLE DE VILLIERS, CHAUMONT
52;RUE VINCENT VAN GOGH, CHAUMONT
52;RUE DU VINAIGRIER, CHAUMONT
52;RUE DU 21 IEME R I C, CHAUMONT
52;RUE DU VINGT ET UNIEME, CHAUMONT
52;RUE VOIE BEUGNOT, CHAUMONT
52;RUE DE LA VOIE CREUSE, CHAUMONT
52;BD VOLTAIRE, CHAUMONT
52;RUE DES VERGERS, CHAUMONT
52;RUE DES VOSGES, CHAUMONT
52;RUE DE WASHINGTON, CHAUMONT
52;RUE YOURI GAGARINE, CHAUMONT
52;CR DIT ANCIENNE RTE NEUILLY, CHAUMONT
52;CHE DIT DES BAS, CHAUMONT
52;CR DE LA BORDE, CHAUMONT
52;CHE DIT DE LA BORNE ROMPUE, CHAUMONT
52;CR DIT DE BOURDONS, CHAUMONT
52;CR DIT DE BROTTES A CRENAY, CHAUMONT
52;VC DE BROTTES A NEUILLY /SUIZ, CHAUMONT
52;CR DE BROTTES A MORMANT, CHAUMONT
52;CHE DIT DES BRUYERES, CHAUMONT
52;CHE DIT DU BUISSON, CHAUMONT
52;CHE DIT DU CAMP, CHAUMONT
52;CHE DIT DE CHAMARANDES, CHAUMONT
52;CD 119, CHAUMONT
52;CHE DU CHAMP DU CHAPITRE, CHAUMONT
52;CHE DIT DU CHAMP MONSIEUR, CHAUMONT
52;CHE DU CHAMP AU GENEVES, CHAUMONT
52;CHE DU CHATEAU PAILLOT, CHAUMONT
52;CD 161, CHAUMONT
52;CD 162, CHAUMONT
52;CHE DIT DE CHAUMONT, CHAUMONT
52;CR CHAUMONT FERME QUARTIERS, CHAUMONT
52;CR DE CHAUMONT A MONTSAON, CHAUMONT
52;SEN DIT DE CHAUMONT LE BOIS, CHAUMONT
52;CR DE CHOIGNES A RECLANCOURT, CHAUMONT
52;CR DIT CHEMIN LORRAIN, CHAUMONT
52;CHE DIT DES CLAIRS CHENES, CHAUMONT
52;PONT DE CLAMART, CHAUMONT
52;CHE DIT DE LA COMBE, CHAUMONT
52;CR DIT DES COMBES, CHAUMONT
52;CHE DIT DE LA COMBE BERGEROT, CHAUMONT
52;CR DIT DE LA COMBE BRICARD, CHAUMONT
52;CHE PART DIT DE LA COMBE GEVIN, CHAUMONT
52;CR CORGEBIN A CHAUMONT, CHAUMONT
52;CHE DIT DE LA COMBE PAQUOTTE, CHAUMONT
52;CHEM DIT DU CORGEBIN, CHAUMONT
52;CHE DIT DU COTE GOUJARD, CHAUMONT
52;CR CORGEBIN A RICHEBOURG, CHAUMONT
52;CHE DIT DE LA COTE DE GRILLE, CHAUMONT
52;CHE DIT DE COTE AUX FOURCHES, CHAUMONT
52;CHE DIT DU COTE FREGOT, CHAUMONT
52;CHE DIT DU COTE RENARD, CHAUMONT
52;D 10, CHAUMONT
52;N 19, CHAUMONT
52;CHE DIT DU FAYS, CHAUMONT
52;CHE DIT DE FERME DE LA BORDE, CHAUMONT
52;CHE DIT DE FERME DES RIEPPES, CHAUMONT
52;CR DIT DE LA FERME DU FAYS, CHAUMONT
52;PONT DES FLANEURS, CHAUMONT
52;CR DIT DE LA FONTAINE, CHAUMONT
52;SEN DU FORT LAMBERT, CHAUMONT
52;SEN DE FROID CUL, CHAUMONT
52;CHE PART FONTAINE STE LIBERT, CHAUMONT
52;CHE DIT DE LA GARENNE, CHAUMONT
52;SEN DE LA GLORIETTE, CHAUMONT
52;CHE DIT DE LA GOGUETTE, CHAUMONT
52;CHE DIT DE LA GRISELLE, CHAUMONT
52;CHE EXPLOIT DES HAUTS POIRIERS, CHAUMONT
52;CHE DIT DES HERBUES, CHAUMONT
52;CHE DIT DE L HOMME MORT, CHAUMONT
52;CHE DIT DE LA HORTE, CHAUMONT
52;CHE DIT DU JARDINOT, CHAUMONT
52;CHE N 7 JONCHERY A BUXEREUILLE, CHAUMONT
52;CHE DIT DE JOURNEVILLE, CHAUMONT
52;PONT DE LANGRES, CHAUMONT
52;CHE LATERAL AU CANAL, CHAUMONT
52;CHE DIT DE LA LEVEE, CHAUMONT
52;CHE DIT DES LONGUES ROYES, CHAUMONT
52;CHEM DIT DU LOUP, CHAUMONT
52;COTE DE LA MALADIERE, CHAUMONT
52;CHE DIT DU MOULIN JEAN RENAUD, CHAUMONT
52;CHE DIT DE LA NACQUE, CHAUMONT
52;CHE DIT DE NEUILLY, CHAUMONT
52;CHE DIT DES OIES, CHAUMONT
52;CHEM DIT DU PARTERRE, CHAUMONT
52;CR DIT DU PATE DE TRUITES, CHAUMONT
52;CHEM DIT DE LA PIERRE A L EAU, CHAUMONT
52;CR DU PLUME, CHAUMONT
52;CHEM DIT DU PLUME RENARD, CHAUMONT
52;CHEM DIT DE LA POLLE, CHAUMONT
52;CHEM DIT DE PREVOT, CHAUMONT
52;CHEM DIT DU PUITS DES MEZES, CHAUMONT
52;CHEM DIT DES QUARRES, CHAUMONT
52;CHEM DIT DES QUARTIERS, CHAUMONT
52;CHEM DES QUATRE MOULINS, CHAUMONT
52;CD 417, CHAUMONT
52;CHE DIT DE LA QUELLEMELE, CHAUMONT
52;CHEM DIT DES QUEROTTES, CHAUMONT
52;CR DE RICHEBOURG A CHAUMONT, CHAUMONT
52;CHEM DIT DES ROCHOTTES, CHAUMONT
52;CHEM DIT DU SAMBRELIN, CHAUMONT
52;CHEM DIT DE SEMOUTIERS, CHAUMONT
52;VC N 2 SEMOUTIERS NEUILLY, CHAUMONT
52;CD 65, CHAUMONT
52;CD 65 BIS, CHAUMONT
52;D 65 C, CHAUMONT
52;N 67, CHAUMONT
52;D 674, CHAUMONT
52;N 74, CHAUMONT
52;CR DIT DE SOUS SAINT AIGNAN, CHAUMONT
52;CR DIT SOUS SAINT ROCH, CHAUMONT
52;CHEM DIT DE LA SOLLE, CHAUMONT
52;CR DES THEVENARDS, CHAUMONT
52;CHEM PART TRANCHE STE LIBERT, CHAUMONT
52;CHEM N 15 DIT DE TREIX, CHAUMONT
52;CHEM N 16 DIT DE TREIX, CHAUMONT
52;CHEM EXP TREIX A LAVILLE AUX BO, CHAUMONT
52;CR DU VAL ANNE MARIE, CHAUMONT
52;CHEM DU VAL BARIZIEN, CHAUMONT
52;CR DU VAL DE VILLIERS, CHAUMONT
52;CR VILLIERS LE SEC A BROTTES, CHAUMONT
52;CHEM PARTICULIER DIT DU VE, CHAUMONT
52;CR VILLIERS LE SEC A MORMANT, CHAUMONT
52;CR DIT DE LA VOIE DE MONTSAON, CHAUMONT
52;CR DE LA VOIE MAGNIEN, CHAUMONT
52;CR DIT DE LA VOIX DU BOIS, CHAUMONT
52;PL EUGENE GRASSET, CHAUMONT
52;RUE JULES CHERET, CHAUMONT
52;RUE CAMILLE PISSARRO, CHAUMONT
52;IMP EDGAR DEGAS, CHAUMONT
52;RUE DES CLAIRS CHENES, CHAUMONT-LA-VILLE
52;RUE HAUTE, CHAUMONT-LA-VILLE
52;RUE DU LAVOIR, CHAUMONT-LA-VILLE
52;CHE DE LOYER, CHAUMONT-LA-VILLE
52;RUE DU PATIS, CHAUMONT-LA-VILLE
52;RUE PRINCIPALE, CHAUMONT-LA-VILLE
52;RTE DE ROBECOURT, CHAUMONT-LA-VILLE
52;RUE SAINT MARTIN, CHAUMONT-LA-VILLE
52;RUE DU BANC, CHEVILLON
52;RUE DU BAS DU BANC, CHEVILLON
52;RUE DU BOCARD, CHEVILLON
52;RUE DE BRAUVILLIERS, CHEVILLON
52;RUE DU CAP DINEZ, CHEVILLON
52;CHE DES CRATS, CHEVILLON
52;CHE LATERAL, CHEVILLON
52;RUE CHANTERAINE, CHEVILLON
52;RUE DU CHATEAU DE CHEVILLON, CHEVILLON
52;RUE DU CHATEAU DE SOMMEVILLE, CHEVILLON
52;RUE DE LA CHERRIERE, CHEVILLON
52;RUE DE LA COURTEE, CHEVILLON
52;RUE DES DEUX RUISSEAUX, CHEVILLON
52;RUE DE L'EGLISE, CHEVILLON
52;RUE DU FAYS, CHEVILLON
52;RUE DU FOURNEAU, CHEVILLON
52;PL DE LA GARE, CHEVILLON
52;RUE DE LA GARE, CHEVILLON
52;RUE DE LA GENDARMERIE, CHEVILLON
52;CHE DE LA GIRONDE, CHEVILLON
52;RUE GRANDE DE CHEVILLON, CHEVILLON
52;RUE GRANDE DE SOMMEVILLE, CHEVILLON
52;RUE DE LA GRENOUILLE, CHEVILLON
52;RUE DU HAUT DU BANC, CHEVILLON
52;RUE DU JAROT, CHEVILLON
52;RUE DE JAT, CHEVILLON
52;RUE DES JUIFS, CHEVILLON
52;RUE DE LA LANDRE, CHEVILLON
52;RUE DE LA MARNE, CHEVILLON
52;RUE DE LA MEY, CHEVILLON
52;RUE DU MOULIN, CHEVILLON
52;RUE DES PRESSOIRS, CHEVILLON
52;RUE LA RUELLE, CHEVILLON
52;RUE ST HILAIRE, CHEVILLON
52;RUE DU STADE, CHEVILLON
52;RUE DES TILLEULS, CHEVILLON
52;RUE DE TUGNEVILLE, CHEVILLON
52;RUE DE LA VALOTTE, CHEVILLON
52;RUE DU VAL ST GERMAIN, CHEVILLON
52;RUE DU VAL ST HILAIRE, CHEVILLON
52;RUE DU VAL TREMPOLLE, CHEVILLON
52;RUE DES VARENNES, CHEVILLON
52;RUE DE LA COTE DES LOUPS, CHEVILLON
52;PL DE L'ARIET, CHEVILLON
52;RUE DE L'AULNE, CHEVILLON
52;RUE DE LA POTERIE, CHEVILLON
52;RUE L'AVENUE, CHEVILLON
52;RUE L'INSUE, CHEVILLON
52;RUE COLLOT, CHEVILLON
52;CHEM DE LA COMBE, CHEVILLON
52;RUE D'EN HAUT, CHEVILLON
52;CHE DU GUE (BREUIL), CHEVILLON
52;CHE DE LA PLATENIERE, CHEVILLON
52;CHE DES FONTENELLES, CHEVILLON
52;RUE DE L EGLISE DE BREUIL, CHEVILLON
52;CRS DU VIEUX PUITS, CHEVILLON
52;RUE DES VERGERS, CHEVILLON
52;RUE DE BAULIEU, CHEVILLON
52;RUE DE LA CHAPELLE, CHEVILLON
52;RUE DES RIONS, CHEVILLON
52;RUE ROLAND GULPHE, CHEVILLON
52;PL DE LA FONTAINE, CHEVILLON
52;RUE DES LONGUES ROYES, CHEVILLON
52;RUE DE LA BRUNETTE, CHEVILLON
52;RTE DE BOURBONNE, CHEZEAUX
52;RUE DU CHATEAU, CHEZEAUX
52;RUE DE L EGLISE A CHEZEAUX, CHEZEAUX
52;RUE DE LA FONTAINE, CHEZEAUX
52;PL DE LA MAIRIE, CHEZEAUX
52;RUE DU MALPERTHUIS, CHEZEAUX
52;RUE DES MARAIS, CHEZEAUX
52;RUE DU MOULIN, CHEZEAUX
52;RUE NEUVE A CHEZEAUX, CHEZEAUX
52;RUE DE SOYERS, CHEZEAUX
52;HAM DE BELLEVUE, CHAMARANDES-CHOIGNES
52;LOT LA FAUCONNIERE, CHAMARANDES-CHOIGNES
52;LOT VAL DE MARNE, CHAMARANDES-CHOIGNES
52;LOT LES VERGERS, CHAMARANDES-CHOIGNES
52;IMP DES ANTES, CHAMARANDES-CHOIGNES
52;RUE DITE DE LA HAUTE BANNIE, CHAMARANDES-CHOIGNES
52;RUE HAMEAU DE BELLEVUE, CHAMARANDES-CHOIGNES
52;RTE DE CHAMARANDES, CHAMARANDES-CHOIGNES
52;RUE DE CHAMARANDES, CHAMARANDES-CHOIGNES
52;AV DES HTES CHARRIERES CHOIGN, CHAMARANDES-CHOIGNES
52;RUE DU CHATEAU, CHAMARANDES-CHOIGNES
52;AV DES HTES CHARRIERES CHAMAR, CHAMARANDES-CHOIGNES
52;RUE DE CHAUMONT, CHAMARANDES-CHOIGNES
52;RUE DU CHEMIN DE FER, CHAMARANDES-CHOIGNES
52;RUE DU COTEAU SAINT MICHEL, CHAMARANDES-CHOIGNES
52;CHE DU DESSUS DES VIGNES, CHAMARANDES-CHOIGNES
52;RUE AUGUSTE DESCHARMES, CHAMARANDES-CHOIGNES
52;RUE EDITH BOURLON DE ROUVRE, CHAMARANDES-CHOIGNES
52;IMP DE LA FAUCONNIERE, CHAMARANDES-CHOIGNES
52;RUE LA FAUCONNIERE, CHAMARANDES-CHOIGNES
52;IMP DE LA FOUILLETIERE, CHAMARANDES-CHOIGNES
52;RUE DU FOULON, CHAMARANDES-CHOIGNES
52;RUE ROBERT GARNIER, CHAMARANDES-CHOIGNES
52;IMP ROBERT GARNIER, CHAMARANDES-CHOIGNES
52;RUE DU GARIGLIANO, CHAMARANDES-CHOIGNES
52;IMP DE LA GRAVIERE A CHOIGNES, CHAMARANDES-CHOIGNES
52;CHE DES JARDINS, CHAMARANDES-CHOIGNES
52;IMP DE LA GRAVIERE A CHAMARAND, CHAMARANDES-CHOIGNES
52;RUE ANDRE JACOB, CHAMARANDES-CHOIGNES
52;RUE LAMARTINE, CHAMARANDES-CHOIGNES
52;RTE DE LANGRES, CHAMARANDES-CHOIGNES
52;RUE DU LYCEE, CHAMARANDES-CHOIGNES
52;RUE DU MOULIN, CHAMARANDES-CHOIGNES
52;RUE HENRI NOIROT, CHAMARANDES-CHOIGNES
52;RUE LOT LES PAQUIS, CHAMARANDES-CHOIGNES
52;RUE DU PAQUIS BAS, CHAMARANDES-CHOIGNES
52;RUE DU PAQUIS HAUT, CHAMARANDES-CHOIGNES
52;CHE DES PAQUOTTIERS, CHAMARANDES-CHOIGNES
52;RUE DE LA PRAIRIE, CHAMARANDES-CHOIGNES
52;RUE LOT ROZIAN SUD, CHAMARANDES-CHOIGNES
52;RUE SAINT MARTIN, CHAMARANDES-CHOIGNES
52;RUE SAINT VALLIER, CHAMARANDES-CHOIGNES
52;PL DU TILLEUL, CHAMARANDES-CHOIGNES
52;RUE LOT VAL DE MARNE, CHAMARANDES-CHOIGNES
52;CHE DE LA VENDUE, CHAMARANDES-CHOIGNES
52;RUE LES VERGERS, CHAMARANDES-CHOIGNES
52;LOT DU CANAL, CHOILLEY-DARDENAY
52;LOT DU CANAL, CHOILLEY-DARDENAY
52;LOT DU SOC, CHOILLEY-DARDENAY
52;RTE DE BEZE, CHOILLEY-DARDENAY
52;RUE DE LA CHAPELLE, CHOILLEY-DARDENAY
52;RTE DE CHOILLEY, CHOILLEY-DARDENAY
52;RTE DE CUSEY A DARDENAY, CHOILLEY-DARDENAY
52;RUE DE L EGLISE, CHOILLEY-DARDENAY
52;RUE DE MONTAUBAIN, CHOILLEY-DARDENAY
52;CHE DE MONTAUBIN, CHOILLEY-DARDENAY
52;RUE DE MONTAUBAIN A DARDENAY, CHOILLEY-DARDENAY
52;RUE DU MOULIN, CHOILLEY-DARDENAY
52;RUE DU MOULIN A DARDENAY, CHOILLEY-DARDENAY
52;RUE DE L ORME, CHOILLEY-DARDENAY
52;RUE DU PONT, CHOILLEY-DARDENAY
52;RUE DE LA ROCHE, CHOILLEY-DARDENAY
52;CHE DE LA VINGEANNE, CHOILLEY-DARDENAY
52;RUE DE LA CONFRERIE, CHOISEUL
52;RUE DE L EGLISE, CHOISEUL
52;RUE DU FOUR, CHOISEUL
52;RUE NEUVE, CHOISEUL
52;RUE SAINT NICOLAS, CHOISEUL
52;LOT LA BOUROTTE, CIREY-LES-MAREILLES
52;RUE DU BEL ORDRE, CIREY-LES-MAREILLES
52;RTE DE LA CRETE, CIREY-LES-MAREILLES
52;IMP DE LA CURE, CIREY-LES-MAREILLES
52;GR GRANDE RUE, CIREY-LES-MAREILLES
52;RUE DE LA MARE, CIREY-LES-MAREILLES
52;PL DU MARECHAL LECLERC, CIREY-LES-MAREILLES
52;RUE DU MONTIER, CIREY-LES-MAREILLES
52;IMP DU TILLEUL, CIREY-LES-MAREILLES
52;RUE DU TILLEUL, CIREY-LES-MAREILLES
52;RUE DE VERDUN, CIREY-LES-MAREILLES
52;RUE ADELAIDE DE SIMIANE, CIREY-SUR-BLAISE
52;RUE EMILIE DU CHATELET, CIREY-SUR-BLAISE
52;RUE DE LA FERME, CIREY-SUR-BLAISE
52;RUE MENISSIER, CIREY-SUR-BLAISE
52;RLE DU PETIT PONT, CIREY-SUR-BLAISE
52;RUE VOLTAIRE, CIREY-SUR-BLAISE
52;LOT DU VAL DE CREUSE, CIRFONTAINES-EN-AZOIS
52;CHE DE LA CHAPELLE, CIRFONTAINES-EN-AZOIS
52;RUE DES CHOISIS, CIRFONTAINES-EN-AZOIS
52;CHE DE LA CREUSE, CIRFONTAINES-EN-AZOIS
52;RLE DE L EGLISE, CIRFONTAINES-EN-AZOIS
52;RUE DE LA FERME DE CLAIRVAUX, CIRFONTAINES-EN-AZOIS
52;RUE DE LA FONTAINE AUX CHENES, CIRFONTAINES-EN-AZOIS
52;GR GRANDE RUE, CIRFONTAINES-EN-AZOIS
52;CHE DES HUCHES, CIRFONTAINES-EN-AZOIS
52;PL DE LA MAIRIE, CIRFONTAINES-EN-AZOIS
52;CHE DES RONCIERS, CIRFONTAINES-EN-AZOIS
52;RUE SAINT HILAIRE, CIRFONTAINES-EN-AZOIS
52;IMP DE LA SENCE, CIRFONTAINES-EN-AZOIS
52;RUE DES SILLONS, CIRFONTAINES-EN-AZOIS
52;CHE DE LA VALOTTE, CIRFONTAINES-EN-AZOIS
52;RUE DE LA FORGE, CIRFONTAINES-EN-ORNOIS
52;RUE DE GAULT, CIRFONTAINES-EN-ORNOIS
52;RUE DE GERMAY, CIRFONTAINES-EN-ORNOIS
52;RTE DE GILLAUME, CIRFONTAINES-EN-ORNOIS
52;RUE DU MOULIN, CIRFONTAINES-EN-ORNOIS
52;LOT LE TEOLOPA, CLEFMONT
52;RUE DU CHATEAU, CLEFMONT
52;RUE DE CHAUMONT, CLEFMONT
52;RUE DE LA CRECHE, CLEFMONT
52;RUE DE L'ECOLE, CLEFMONT
52;RUE DE LA FONTAINE, CLEFMONT
52;RUE DES FOSSES, CLEFMONT
52;RUE GOURIERE, CLEFMONT
52;RUE DES GUEUX, CLEFMONT
52;RUE DU JARDINET, CLEFMONT
52;PL DE LA MAIRIE, CLEFMONT
52;D 74, CLEFMONT
52;RUE DU TEOLOPA, CLEFMONT
52;RUE DU VERGER, CLEFMONT
52;RUE DE PERRUSSE, CLEFMONT
52;RTE DE THOL, CLEFMONT
52;RUE DU CERISELOT, CLINCHAMP
52;RTE D'ECOT, CLINCHAMP
52;RUE DU MOULIN A VENT, CLINCHAMP
52;RUE DES QUINZE ECUS, CLINCHAMP
52;RUE DE LA ROUASSE, CLINCHAMP
52;RUE SAINT PIERRE ES LIENS, CLINCHAMP
52;RUE DU BIEZ DE LA PORTE, COHONS
52;RTE DE BOURG, COHONS
52;RUE CANDEE, COHONS
52;RUE CANDREE, COHONS
52;RUE CARRON MAIRE, COHONS
52;RUE DU CARRON MAIRE, COHONS
52;PL DU COIN, COHONS
52;RUE DE L EGLISE, COHONS
52;RUE FROQUEE, COHONS
52;RUE JEAN GARNIER, COHONS
52;RUE JOYEUSE, COHONS
52;RTE DE LONGEAU, COHONS
52;RUE DE LONGEAU, COHONS
52;RLE DES MAIX, COHONS
52;RUE DU MONT, COHONS
52;RUE DE MONT CHOISEUL, COHONS
52;RUE DU MONT CHOISEUL, COHONS
52;RUE DE NOIDANT, COHONS
52;RUE DE LA PLACE, COHONS
52;RUE DE LA PORTE, COHONS
52;RUE DU VARINOT, COHONS
52;RUE DU VERGER MARCEL, COHONS
52;RUE DU BAS, COIFFY-LE-BAS
52;RUE DE LA CHAPELLE, COIFFY-LE-BAS
52;RUE CHEMIN DES CRETS, COIFFY-LE-BAS
52;RUE DU COIN, COIFFY-LE-BAS
52;RUE DES DAMES, COIFFY-LE-BAS
52;RUE DE L EGLISE, COIFFY-LE-BAS
52;CHE DE LA GRANDE COTE, COIFFY-LE-BAS
52;RUE DU MOULIN, COIFFY-LE-BAS
52;RUE DE L ORMEAU, COIFFY-LE-BAS
52;RUE DES VIGNERONS, COIFFY-LE-BAS
52;RTE DES VIGNES, COIFFY-LE-BAS
52;RUE DU BAS, COIFFY-LE-HAUT
52;CHE DE BOURBONNE A VAILLANT, COIFFY-LE-HAUT
52;RUE DES BOURGEOIS, COIFFY-LE-HAUT
52;CHE CHAMP GALAS, COIFFY-LE-HAUT
52;RUE DU CIMETIERE, COIFFY-LE-HAUT
52;RUE ENTRE DEUX PONTS, COIFFY-LE-HAUT
52;CHE DE LA FERME ADRIEN, COIFFY-LE-HAUT
52;RUE DES FOSSES DU CHATEAU, COIFFY-LE-HAUT
52;GR GRANDE RUE NOTRE DAME, COIFFY-LE-HAUT
52;VOIE DES GRANGES DU VOL, COIFFY-LE-HAUT
52;RLE HOLOGNE, COIFFY-LE-HAUT
52;VOIE DE MONTCHARVOT, COIFFY-LE-HAUT
52;RUE NOTRE DAME, COIFFY-LE-HAUT
52;RUE DU PAIN, COIFFY-LE-HAUT
52;CHE DE PARNOT A MONTCHARVOT, COIFFY-LE-HAUT
52;VOIE DES PATIS, COIFFY-LE-HAUT
52;RUE SAINTE CATHERINE, COIFFY-LE-HAUT
52;CHE DE LA VIEILLE COTE, COIFFY-LE-HAUT
52;RLE DU BAS, COLMIER-LE-BAS
52;CHE DU COTELOT, COLMIER-LE-BAS
52;GR GRANDE RUE, COLMIER-LE-BAS
52;PL DE LA MAIRIE, COLMIER-LE-BAS
52;CHE DU PATIS, COLMIER-LE-BAS
52;RTE DES TILLEULS, COLMIER-LE-BAS
52;RTE DE VILLARS, COLMIER-LE-BAS
52;RUE GRANDE COUR, COLMIER-LE-HAUT
52;RUE GRANDE RUE, COLMIER-LE-HAUT
52;RUE DU GUE, COLMIER-LE-HAUT
52;RUE DE LA MAIRIE, COLMIER-LE-HAUT
52;RUE DU MIDI, COLMIER-LE-HAUT
52;RUE MONT MICHELOT, COLMIER-LE-HAUT
52;RUE PETIT CHARRI, COLMIER-LE-HAUT
52;RTE NATIONALE 19, COLOMBEY LES DEUX EGLISES
52;RTE NATIONALE 19 A LAVILLENEUV, COLOMBEY LES DEUX EGLISES
52;CHE DU CREDO A ARGENTOLLES, COLOMBEY LES DEUX EGLISES
52;RUE D ARGENTOLLES, COLOMBEY LES DEUX EGLISES
52;IMP DE L ABREUVOIR A BIERNES, COLOMBEY LES DEUX EGLISES
52;RLE DE L ABREUVOIR A BIERNES, COLOMBEY LES DEUX EGLISES
52;RUE D ASSENS, COLOMBEY LES DEUX EGLISES
52;RUE DE BAR SUR AUBE, COLOMBEY LES DEUX EGLISES
52;RUE DE BIERNES A HARRICOURT, COLOMBEY LES DEUX EGLISES
52;RUE DE BLAISE, COLOMBEY LES DEUX EGLISES
52;RTE DE BLAISE A CHAMPCOURT, COLOMBEY LES DEUX EGLISES
52;RUE DE BUCHEY A HARRICOURT, COLOMBEY LES DEUX EGLISES
52;RUE DE CHAMPCOURT A HARRICOURT, COLOMBEY LES DEUX EGLISES
52;RUE DE CHAMPCOURT A BLAISE, COLOMBEY LES DEUX EGLISES
52;RUE DU CHATEAU A BLAISE, COLOMBEY LES DEUX EGLISES
52;RLE DES CHARMILLES, COLOMBEY LES DEUX EGLISES
52;RLE DES CHENEVIERES A BLAISE, COLOMBEY LES DEUX EGLISES
52;RUE DE LA COLETTE A BLAISE, COLOMBEY LES DEUX EGLISES
52;RUE DE LA CRUON A HARRICOURT, COLOMBEY LES DEUX EGLISES
52;CHE DE CURMONT A BLAISE, COLOMBEY LES DEUX EGLISES
52;RUE DU FOUR A BLAISE, COLOMBEY LES DEUX EGLISES
52;RUE NICOLAS DUBOIS A PRATZ, COLOMBEY LES DEUX EGLISES
52;RUE DE DURMONT A BIERNES, COLOMBEY LES DEUX EGLISES
52;PL DE L'EGLISE, COLOMBEY LES DEUX EGLISES
52;RUE DE L EGLISE, COLOMBEY LES DEUX EGLISES
52;RUE DE L EGLISE A BLAISE, COLOMBEY LES DEUX EGLISES
52;RUE DE L EGLISE A CHAMPCOURT, COLOMBEY LES DEUX EGLISES
52;RUE DE L EGLISE A HARRICOURT, COLOMBEY LES DEUX EGLISES
52;RUE DU GENERAL DE GAULLE, COLOMBEY LES DEUX EGLISES
52;RUE DE LA FONTAINE A PRATZ, COLOMBEY LES DEUX EGLISES
52;RUE DES GRANDS CHARMES, COLOMBEY LES DEUX EGLISES
52;COTE DU FOUR A CHAMPCOURT, COLOMBEY LES DEUX EGLISES
52;RUE DES HALLES A BLAISE, COLOMBEY LES DEUX EGLISES
52;RUE D'HARRICOURT, COLOMBEY LES DEUX EGLISES
52;RUE DE LA GRANDE FONTAINE, COLOMBEY LES DEUX EGLISES
52;RUE DU LAVOIR A HARRICOURT, COLOMBEY LES DEUX EGLISES
52;RUE DE LA MAIRIE A BIERNES, COLOMBEY LES DEUX EGLISES
52;RUE DE LA MAIRIE A CHAMPCOURT, COLOMBEY LES DEUX EGLISES
52;RTE DE LAMOTHE EN BLAISY, COLOMBEY LES DEUX EGLISES
52;RUE DE LA MONTAGNE, COLOMBEY LES DEUX EGLISES
52;RUE DES MOULINS A BLAISE, COLOMBEY LES DEUX EGLISES
52;RUE DES MARONNIERS A PRATZ, COLOMBEY LES DEUX EGLISES
52;RUE DE LA PETITE FONTAINE, COLOMBEY LES DEUX EGLISES
52;RUE DU PARTERRE, COLOMBEY LES DEUX EGLISES
52;RUE DE L EGLISE A ARGENTOLLES, COLOMBEY LES DEUX EGLISES
52;PL DE LA MAIRIE A ARGENTOLLES, COLOMBEY LES DEUX EGLISES
52;RUE DU MOULIN A VENT A BIERNES, COLOMBEY LES DEUX EGLISES
52;RUE DE PISSELOUP, COLOMBEY LES DEUX EGLISES
52;RTE DE PRATZ A ARGENTOLLES, COLOMBEY LES DEUX EGLISES
52;RUE DES PRIMEVERES, COLOMBEY LES DEUX EGLISES
52;RUE PRINCIPALE A BIERNES, COLOMBEY LES DEUX EGLISES
52;RTE DE RIZAUCOURT A ARGENTOLLE, COLOMBEY LES DEUX EGLISES
52;RUE PRINCIPALE A LAVILLENEUVE, COLOMBEY LES DEUX EGLISES
52;CHE DES VIGNES A ARGENTOLLES, COLOMBEY LES DEUX EGLISES
52;RUE DES VIGNES, COLOMBEY LES DEUX EGLISES
52;RUE DE VILLESEC, COLOMBEY LES DEUX EGLISES
52;RLE DU HAMELET A BLAISE, COLOMBEY LES DEUX EGLISES
52;RLE DES HERBUES A BLAISE, COLOMBEY LES DEUX EGLISES
52;CHE DES PUITS, COLOMBEY LES DEUX EGLISES
52;RTE DE COLOMBEY, COLOMBEY LES DEUX EGLISES
52;RUE DE LA CREUSE, COLOMBEY LES DEUX EGLISES
52;IMP DE LA MAIRIE, COLOMBEY LES DEUX EGLISES
52;PL DE LA MAIRIE, COLOMBEY LES DEUX EGLISES
52;IMP DE LA MEDELA, COLOMBEY LES DEUX EGLISES
52;RUE GRANDE RUE, COLOMBEY LES DEUX EGLISES
52;RUE DU SOLEIL COUCHANT, COLOMBEY LES DEUX EGLISES
52;RUE DU VAL CHEVREUIL, COLOMBEY LES DEUX EGLISES
52;LOT BELLE RIVE, CONDES
52;LOT LES POMMEROTS, CONDES
52;RTE NATIONALE 67, CONDES
52;CHE DE L'ABREUVOIR, CONDES
52;RUE DES CHAMPS NOISETTES, CONDES
52;RUE DU COTEAU DE LA FORGE, CONDES
52;RUE DES CRETS, CONDES
52;RUE DES GOULOTTES, CONDES
52;RUE DES IRIS, CONDES
52;RTE DE JONCHERY, CONDES
52;RUE DE LA MONTAGNE, CONDES
52;RUE DU PETIT BOIS, CONDES
52;RUE DU PETIT BRETHENAY, CONDES
52;RUE DES PRIMEVERES, CONDES
52;RTE DE TREIX, CONDES
52;PL DE VERDUN, CONDES
52;RUE DES POMMEROTS, CONDES
52;RUE BELLE RIVE, CONDES
52;RUE DU BAS, CONSIGNY
52;CHE DIT DU CHAMP MATREMONT, CONSIGNY
52;RUE DE LA FONTAINE DU CHARME, CONSIGNY
52;SEN DIT DU HAUT DU PUITS, CONSIGNY
52;SEN DIT DE LA SUEURRE, CONSIGNY
52;RUE DE L EGLISE, CONSIGNY
52;GR GRANDE RUE, CONSIGNY
52;RUE DU JOLIMENT, CONSIGNY
52;PL DE LA MAIRIE, CONSIGNY
52;RUE DE LA SUEURRE, CONSIGNY
52;RUE DE LA BARRE, COUBLANC
52;RUE DU BOURG, COUBLANC
52;RUE DU CHATEAU, COUBLANC
52;CHE DES FOSSES, COUBLANC
52;RUE DE LA GRANDE PORTE, COUBLANC
52;GR GRANDE RUE, COUBLANC
52;RUE DE GRENANT, COUBLANC
52;RUE SOUS LES GUERETS, COUBLANC
52;PL DES HALLES, COUBLANC
52;RUE L'HUILLIER, COUBLANC
52;RUE DE L'ORME, COUBLANC
52;RUE DE LA PLANCHOTTE, COUBLANC
52;RUE DU PONT DE FRETTES, COUBLANC
52;RUE DES PRETRES, COUBLANC
52;RUE DE LA VENDEE, COUBLANC
52;RUE DES ABREUVOIRS, COUPRAY
52;RTE D ARC, COUPRAY
52;RLE DU CENTRE, COUPRAY
52;RUE DE LA CHAPELLE, COUPRAY
52;RUE DE LA CHARME, COUPRAY
52;RTE DE CHATEAUVILLAIN, COUPRAY
52;RUE DE CHAUMONT, COUPRAY
52;RUE DE DANCEVOIR, COUPRAY
52;RUE DE L'EGLISE, COUPRAY
52;IMP DES GRANGES, COUPRAY
52;RUE DU LAVOIR, COUPRAY
52;RUE DES PATOUILLETS, COUPRAY
52;RLE DE LA PLACETTE, COUPRAY
52;RUE PRINCIPALE, COUPRAY
52;RUE DE ROUVILLE, COUPRAY
52;CD 287, COURCELLES-EN-MONTAGNE
52;CHE DU CIMETIERE, COURCELLES-EN-MONTAGNE
52;RLE DE LA CURE, COURCELLES-EN-MONTAGNE
52;RUE DU DIME, COURCELLES-EN-MONTAGNE
52;RLE GAULLOT, COURCELLES-EN-MONTAGNE
52;RUE DU GRAND CHAMP, COURCELLES-EN-MONTAGNE
52;GR GRANDE RUE, COURCELLES-EN-MONTAGNE
52;RUE DE LA MARGELLE, COURCELLES-EN-MONTAGNE
52;CHE DU MOULIN DE SENANCES, COURCELLES-EN-MONTAGNE
52;RUE DES RETETS, COURCELLES-EN-MONTAGNE
52;RUE DES VIGNES, COURCELLES-EN-MONTAGNE
52;RTE DE VOISINES, COURCELLES-EN-MONTAGNE
52;CHE DE BAR SUR AUBE, COURCELLES-SUR-BLAISE
52;RUE BASSE, COURCELLES-SUR-BLAISE
52;RTE DE BAUDRECOURT, COURCELLES-SUR-BLAISE
52;RUE DU CHAMP CHAPON, COURCELLES-SUR-BLAISE
52;RUE DE L EGLISE, COURCELLES-SUR-BLAISE
52;AV DE LA GARE, COURCELLES-SUR-BLAISE
52;RUE HAUTE, COURCELLES-SUR-BLAISE
52;RUE DU LAVOIR, COURCELLES-SUR-BLAISE
52;PL DU MOULIN, COURCELLES-SUR-BLAISE
52;RTE NATIONALE, COURCELLES-SUR-BLAISE
52;RES CHAMP FLEURY, COUR-L EVEQUE
52;RUE DE L ABREUVOIR, COUR-L EVEQUE
52;RTE D AUBEPIERRE, COUR-L EVEQUE
52;RUE DE LA COMBE, COUR-L EVEQUE
52;PL DE LA MAIRIE, COUR-L EVEQUE
52;RUE DE L EGLISE, COUR-L EVEQUE
52;CHE DES ELLEUX, COUR-L EVEQUE
52;RUE DE LA FORGE, COUR-L EVEQUE
52;RUE DU FOURNEAU, COUR-L EVEQUE
52;GR GRANDE RUE, COUR-L EVEQUE
52;RUE DU MAJORAT, COUR-L EVEQUE
52;RUE DE LA MONTAGNE, COUR-L EVEQUE
52;RUE DU MOULIN, COUR-L EVEQUE
52;RUE DU PIED AU LOUP, COUR-L EVEQUE
52;RUE DE LA TRESSE, COUR-L EVEQUE
52;CR CHEMIN NOIR, CULMONT
52;RUE DE LA BOUDAINE, CULMONT
52;RUE CHARLES MAITRET, CULMONT
52;IMP CHEMIN NOIR, CULMONT
52;RUE DU COURNOT, CULMONT
52;AV DE LA GARE, CULMONT
52;RUE DE LA GARE, CULMONT
52;RUE DU HAUT, CULMONT
52;RUE LOUIS PASTEUR, CULMONT
52;RUE DES PETITS PRES, CULMONT
52;RUE DU SAULT, CULMONT
52;RUE DES SOLLIERES, CULMONT
52;IMP LES ALLIES, CULMONT
52;RUE DU CHEMIN NOIR, CULMONT
52;RLE DE LA TRESORERIE, CULMONT
52;RUE DE VERMANGON, CULMONT
52;RTE D AUTIGNY, CUREL
52;RUE DES CAVES, CUREL
52;RUE DE LA CHARBONNERIE, CUREL
52;RUE DU CHATEAU, CUREL
52;CHE DE LA CHERME, CUREL
52;CHE DE DERRIERE LES CHAMPS, CUREL
52;RUE DES ECOLES, CUREL
52;RUE DE L EGLISE, CUREL
52;RUE DE LA FONTAINE, CUREL
52;RUE DE LA GARE, CUREL
52;RUE DE LA GARENNE, CUREL
52;RUE GRANDE RUE, CUREL
52;RUE DU HAM, CUREL
52;PL DU HUIT MAI, CUREL
52;RUE DE LA MADELEINE, CUREL
52;RUE DE LA MAIRIE, CUREL
52;RUE DE L OSNE, CUREL
52;RUE DE LA REPUBLIQUE, CUREL
52;ECL DU BEC, CUSEY
52;RUE BASSE, CUSEY
52;PL DE LA BEGUINE, CUSEY
52;RUE DE LA BEGUINE, CUSEY
52;RUE DES CHAMPIS, CUSEY
52;RUE DU CHATEAU, CUSEY
52;RUE DU CIMETIERE, CUSEY
52;RUE LOT LE CLOS DU PRESBYTERE, CUSEY
52;RLE DAME, CUSEY
52;RUE DU GRAND CORNOT, CUSEY
52;PL DU GRAND PUITS, CUSEY
52;GR GRANDE RUE, CUSEY
52;RUE HAUTE, CUSEY
52;RUE EN JANIN, CUSEY
52;CHE DES LOMES, CUSEY
52;RUE DU PETIT CORNOT, CUSEY
52;RUE DE LA PICARDE, CUSEY
52;RUE DU PONT D'ARCHON, CUSEY
52;CHE RAPIDE, CUSEY
52;RUE DU RESERVOIR, CUSEY
52;RUE DU RU, CUSEY
52;RUE DU VERDURET, CUSEY
52;RUE DE L'ABBE DONNOT, CUSEY
52;RUE DE BEL AIR, CUSEY
52;RUE DES BOIS, CUSEY
52;RLE DES BREGEONS, CUSEY
52;RUE DES CHAILLOTS, CUSEY
52;RUE DU CHARREY, CUSEY
52;RLE DU CHATEAU, CUSEY
52;RUE DES DEUX PONTS, CUSEY
52;RUE DE LA GROTTE AUX FEES, CUSEY
52;RUE DU JEU DE QUILLES, CUSEY
52;RUE DE LA PICARDIE, CUSEY
52;RUE DE LA PRAYE, CUSEY
52;RUE DU RAVERY, CUSEY
52;RUE REINE BRUNEHAUT, CUSEY
52;PL DE LA VINGEANNE, CUSEY
52;RUE DE LA CHAPELLE, CUVES
52;RUE DU CHATEAU, CUVES
52;PL DE LA FONTAINE, CUVES
52;RUE DE LA GRAND VOIE, CUVES
52;RLE DE LA MAISON DU BERGER, CUVES
52;RUE DU MOULIN, CUVES
52;RUE DU PUITS, CUVES
52;RUE DU PONT NEUF, CUVES
52;RUE DU VIEUX PONT, CUVES
52;RUE DE L'ARBOYON, DAILLANCOURT
52;VOIE DE BLAISE, DAILLANCOURT
52;RUE DE BOUZANCOURT, DAILLANCOURT
52;RUE DE CHAMPCOURT, DAILLANCOURT
52;RUE DE L'EGLISE, DAILLANCOURT
52;RUE GRANDE, DAILLANCOURT
52;RUE DU MOULIN, DAILLANCOURT
52;RUE DE LA PROUSE, DAILLANCOURT
52;IMP DU RUISSEAU, DAILLANCOURT
52;RTE DES CHOISEUL, DAILLECOURT
52;RUE DE L EGLISE, DAILLECOURT
52;RUE DES FONTAINES, DAILLECOURT
52;PL DE LA MAIRIE, DAILLECOURT
52;RUE DES PRELES, DAILLECOURT
52;RUE SAINT MARTIN, DAILLECOURT
52;RTE DEPARTEMENTALE 74, DAILLECOURT
52;HAM DE MALROY, DAMMARTIN-SUR-MEUSE
