52;RUE DE L ABREUVOIR, AGEVILLE
52;ALL DE L AULNOY, AGEVILLE
52;RUE DE L AVENIR, AGEVILLE
52;RUE DES CHEVAUX, AGEVILLE
52;CHE DIT DE CEINTURE, AGEVILLE
52;RUE D ESNOUVEAUX, AGEVILLE
52;ALL DES FOURCHATS, AGEVILLE
52;RUE GAULERE, AGEVILLE
52;ALL DE LA GENEVROYE, AGEVILLE
52;GR GRANDE RUE, AGEVILLE
52;ALL DU HAUT SENTIER, AGEVILLE
52;RUE DU MOULIN, AGEVILLE
52;RUE DE LA PAIX, AGEVILLE
52;RUE DU PIERGE, AGEVILLE
52;ALL DU STADE, AGEVILLE
52;RUE DU TILLEUL, AGEVILLE
52;RUE DE VERDUN, AGEVILLE
52;RUE DES VERGERS, AGEVILLE
52;CHE DU VETHIAIS, AGEVILLE
52;RUE DE LA VIGNE PRIX, AGEVILLE
52;IMP DES VIOLETTES, AGEVILLE
52;ECA LE MOULIN DE LA FORGE, AIGREMONT
52;RUE DU CIMETIERE, AIGREMONT
52;CHE DE LA FRENEE, AIGREMONT
52;RUE GRANDE RUE, AIGREMONT
52;RUE DU CENTRE, AILLIANVILLE
52;RUE DU CUL DE SAC, AILLIANVILLE
52;RUE DE L EGLISE, AILLIANVILLE
52;RUE DU FOUR, AILLIANVILLE
52;RUE DU GATIS, AILLIANVILLE
52;RUE DU GENERAL SALME, AILLIANVILLE
52;RTE DE GRAND, AILLIANVILLE
52;RUE DU GUET, AILLIANVILLE
52;RUE DU 19 MARS 1962, AILLIANVILLE
52;RUE DU ONZE NOVEMBRE, AILLIANVILLE
52;RUE DES ORMEAUX, AILLIANVILLE
52;RTE D ORQUEVAUX, AILLIANVILLE
52;RUE DE LA PEPINIERE, AILLIANVILLE
52;CHE DES PROMENEURS, AILLIANVILLE
52;RUE DU PUITS, AILLIANVILLE
52;CHE DE REYNEL, AILLIANVILLE
52;RUE DE L EGLISE, AINGOULAINCOURT
52;CHE D IRVAL, AINGOULAINCOURT
52;PL ANDRE JEANRONT, AINGOULAINCOURT
52;CHE DES PRES, AINGOULAINCOURT
52;RUE OLIVIER DE VEZIN, AINGOULAINCOURT
52;RUE DE L EGLISE, AIZANVILLE
52;RUE DU MOULIN, AIZANVILLE
52;RUE DU PONT, AIZANVILLE
52;RUE SAINT THOMAS, AIZANVILLE
52;IMP DES BOUVREUILS, ALLICHAMPS
52;RUE DU CAVEE, ALLICHAMPS
52;RUE DES DAMES, ALLICHAMPS
52;IMP DE LA FONTAINE, ALLICHAMPS
52;RUE DU FOURNEAU, ALLICHAMPS
52;RUE FREDERIC CHOPIN, ALLICHAMPS
52;RUE DU GUE, ALLICHAMPS
52;RTE D HUMBECOURT, ALLICHAMPS
52;RUE DES LILAS, ALLICHAMPS
52;RTE DE LOUVEMONT, ALLICHAMPS
52;RTE DES MORAMBERTS, ALLICHAMPS
52;CHE DU MOULIN, ALLICHAMPS
52;RUE NICOLAS DESETANGTS, ALLICHAMPS
52;ALL DU PETIT CLOS, ALLICHAMPS
52;RUE DE LA REPUBLIQUE, ALLICHAMPS
52;RUE DES ROSES, ALLICHAMPS
52;CHE DES TOURNIERES, ALLICHAMPS
52;RUE DU VIEUX MOULIN, ALLICHAMPS
52;RUE DES VIOLETTES, ALLICHAMPS
52;IMP DE BOURGOGNE, AMBONVILLE
52;RUE DE L'EGLISE, AMBONVILLE
52;PL DE LA FONTAINE, AMBONVILLE
52;GR GRANDE RUE, AMBONVILLE
52;RUE DE GUINDRECOURT, AMBONVILLE
52;CHE DU MOULIN, AMBONVILLE
52;RUE DU MOUTIER, AMBONVILLE
52;RUE DU PATIS, AMBONVILLE
52;RUE DES PRES, AMBONVILLE
52;RUE DU TERME, AMBONVILLE
52;RUE DES VAUX DE CIREY, AMBONVILLE
52;RTE DE L ABBAYE DE SEPTFONTAIN, ANDELOT-BLANCHEVILLE
52;RUE DE L ABREUVOIR, ANDELOT-BLANCHEVILLE
52;RTE DE BLANCHEVILLE, ANDELOT-BLANCHEVILLE
52;PL DU BRIGADIER DEROCLE, ANDELOT-BLANCHEVILLE
52;RUE DE LA BUXIERE, ANDELOT-BLANCHEVILLE
52;PL CANTAREL, ANDELOT-BLANCHEVILLE
52;RUE DE LA CHARME, ANDELOT-BLANCHEVILLE
52;RLE DU CHEMIN DE FER, ANDELOT-BLANCHEVILLE
52;RUE DE LA CRAA, ANDELOT-BLANCHEVILLE
52;RUE DU CLOS, ANDELOT-BLANCHEVILLE
52;RUE DE LA COTE NEUVE, ANDELOT-BLANCHEVILLE
52;RUE COTE BETIN, ANDELOT-BLANCHEVILLE
52;RUE DE LA CROIX SAINTE BARBE, ANDELOT-BLANCHEVILLE
52;RUE DU DARDIGNON, ANDELOT-BLANCHEVILLE
52;RTE DEPARTEMENTALE N 44, ANDELOT-BLANCHEVILLE
52;RUE DE LA DIVISION GEN LECLERC, ANDELOT-BLANCHEVILLE
52;PL DE L'EGLISE, ANDELOT-BLANCHEVILLE
52;RUE DE L EGLISE, ANDELOT-BLANCHEVILLE
52;RUE DE LA FONTAINE RONDE, ANDELOT-BLANCHEVILLE
52;RTE DE LA FORET, ANDELOT-BLANCHEVILLE
52;RUE DE LA FOUCHERE, ANDELOT-BLANCHEVILLE
52;RUE DE LA GARE, ANDELOT-BLANCHEVILLE
52;PL DU GENERAL DILLEMANN, ANDELOT-BLANCHEVILLE
52;RUE DU GUE, ANDELOT-BLANCHEVILLE
52;RUE GEORGES LIBERT, ANDELOT-BLANCHEVILLE
52;RUE CITE JACQUEMIN, ANDELOT-BLANCHEVILLE
52;RUE MAGNAN, ANDELOT-BLANCHEVILLE
52;RUE MERGER, ANDELOT-BLANCHEVILLE
52;RTE DE MORTEAU, ANDELOT-BLANCHEVILLE
52;RUE DU MOULIN, ANDELOT-BLANCHEVILLE
52;RTE DE NEUFCHATEAU, ANDELOT-BLANCHEVILLE
52;RUE DU PARC, ANDELOT-BLANCHEVILLE
52;RUE DE LA PETITE MONTAGNE, ANDELOT-BLANCHEVILLE
52;RUE DE LA PIERRE LOMBARD, ANDELOT-BLANCHEVILLE
52;RUE PINOLET DE MONTECLAIR, ANDELOT-BLANCHEVILLE
52;RUE DES RENNEPONNES, ANDELOT-BLANCHEVILLE
52;RUE DE LA ROCHOTTE, ANDELOT-BLANCHEVILLE
52;RUE SAINT LOUVENT, ANDELOT-BLANCHEVILLE
52;RUE SAINT MICHEL, ANDELOT-BLANCHEVILLE
52;RUE SAINT NICOLAS, ANDELOT-BLANCHEVILLE
52;RUE DE SIGNEVILLE, ANDELOT-BLANCHEVILLE
52;PL DU TRAITE D ANDELOT, ANDELOT-BLANCHEVILLE
52;RUE DES VAUX, ANDELOT-BLANCHEVILLE
52;RUE DE VERDUN, ANDELOT-BLANCHEVILLE
52;RUE DU VIADUC, ANDELOT-BLANCHEVILLE
52;RUE DU VIEUX MOIRE, ANDELOT-BLANCHEVILLE
52;RTE DE VIGNES, ANDELOT-BLANCHEVILLE
52;RUE DU VIVIER, ANDELOT-BLANCHEVILLE
52;RUE BERGERE, ANDILLY EN BASSIGNY
52;RUE DU COIN, ANDILLY EN BASSIGNY
52;RUE DE LA CROIX DE CHAMOIS, ANDILLY EN BASSIGNY
52;PL DE L EGLISE, ANDILLY EN BASSIGNY
52;RUE DE LA GARE, ANDILLY EN BASSIGNY
52;GR GRANDE RUE, ANDILLY EN BASSIGNY
52;RUE DE MARCILLY-EN-BASSIGNY, ANDILLY EN BASSIGNY
52;RUE MORLIN, ANDILLY EN BASSIGNY
52;RUE DES ORMES, ANDILLY EN BASSIGNY
52;RUE DU PETIT PARIS, ANDILLY EN BASSIGNY
52;RUE DE POISEUL, ANDILLY EN BASSIGNY
52;RUE THEO GERSBACH, ANDILLY EN BASSIGNY
52;RUE D ANTAN, ANNEVILLE-LA-PRAIRIE
52;CHE DE CHAMPIGNEULLE, ANNEVILLE-LA-PRAIRIE
52;RUE DES CHAMPS ROUGES, ANNEVILLE-LA-PRAIRIE
52;RUE DU CHATEAU, ANNEVILLE-LA-PRAIRIE
52;PL DE L EGLISE, ANNEVILLE-LA-PRAIRIE
52;RUE DE LA FONTAINE, ANNEVILLE-LA-PRAIRIE
52;RUE DE LA PRAIRIE, ANNEVILLE-LA-PRAIRIE
52;RUE PRINCIPALE, ANNEVILLE-LA-PRAIRIE
52;RUE DE VAL SINCOURT, ANNEVILLE-LA-PRAIRIE
52;RUE DE LA GARE, ANNEVILLE-LA-PRAIRIE
52;RUE DE LA FONTAINE, ANNONVILLE
52;RUE GRANDE RUE, ANNONVILLE
52;HAM DE LA MOTHE, ANROSEY
52;RUE HUBERT JACOB, ANROSEY
52;CHE DU BOIS, ANROSEY
52;RUE DU BREUIL, ANROSEY
52;RUE DU DOCTEUR VAUTHRIN, ANROSEY
52;RUE DU GRAND BUISSON, ANROSEY
52;RUE DU GRAND JARDIN, ANROSEY
52;RUE DU MOULIN DE GYPSE, ANROSEY
52;CHE DE LA PERCHE, ANROSEY
52;CHE DES ROUTOIRS, ANROSEY
52;RUE SAINT MARTIN, ANROSEY
52;RUE BASSE (HAM DE VILLEHAUT), APREY
52;RUE DU BOIS, APREY
52;RUE DE LA CHARMOTTE, APREY
52;RUE DE DERRIERE, APREY
52;RUE DE LA FAIENCERIE, APREY
52;CHE DIT DES CHENEVIERES, APREY
52;RLE DITE DU BAS DE VILLEHAUT, APREY
52;GR GRANDE RUE, APREY
52;RUE LA GRANDE RUELLE, APREY
52;GR GRANDE RUE VILLEHAUT, APREY
52;RUE DES HALLES, APREY
52;RUE DU LOTISSEMENT, APREY
52;PL DU MARCHE, APREY
52;RUE DE PARIS, APREY
52;RLE PERROT, APREY
52;PTR PETITE RUE, APREY
52;RUE LA PETITE RUELLE, APREY
52;RUE DES PLANTES, APREY
52;RUE DES RANGS DE VILLEHAUT, APREY
52;RUE DE LA ROCHE (HAM VILLEHAUT, APREY
52;RUE DE LA TUILERIE, APREY
52;RUE DU VAU, APREY
52;RUE DE LA VERRERIE, APREY
52;IMP DE LA VERRERIE, APREY
52;RLE DE VILLEHAUT, APREY
52;RTE DE VILLEHAUT, APREY
52;RUE DE LA VINGEANNE, APREY
52;RUE DE CHAMPIGNY, ARBIGNY-SOUS-VARENNES
52;RUE DES CHARRIERES, ARBIGNY-SOUS-VARENNES
52;RUE DU CHATEAU, ARBIGNY-SOUS-VARENNES
52;RUE DU CORNOT, ARBIGNY-SOUS-VARENNES
52;RUE DE L'EGLISE, ARBIGNY-SOUS-VARENNES
52;RUE DU GRIFFON, ARBIGNY-SOUS-VARENNES
52;COTE DE HORTES, ARBIGNY-SOUS-VARENNES
52;RUE DU MOULIN, ARBIGNY-SOUS-VARENNES
52;RUE DU PONT, ARBIGNY-SOUS-VARENNES
52;RUE BASSE, ARBOT
52;RUE DU CARON, ARBOT
52;RUE DE LA COUR, ARBOT
52;GR GRANDE RUE, ARBOT
52;RUE HAUTE, ARBOT
52;RUE DE LA MAIRIE, ARBOT
52;RUE PETITE RUE, ARBOT
52;RUE DU PRE AUX CHENES, ARBOT
52;IMP DES ROCAILLES, ARBOT
52;PL SAINT PIERRE ES LIENS, ARBOT
52;RUE DU VAL, ARBOT
52;FRM DE LA MAISON FOIN, ARC-EN-BARROIS
52;FRM DE LA MAISON PAULIN, ARC-EN-BARROIS
52;FRM DE SAUTREUIL, ARC-EN-BARROIS
52;RUE ABEL POULAIN, ARC-EN-BARROIS
52;RUE AMEDEE PIERRE, ARC-EN-BARROIS
52;RUE ANATOLE GABEUR, ARC-EN-BARROIS
52;RLE ANATOLE GABEUR, ARC-EN-BARROIS
52;RTE D AUBEPIERRE, ARC-EN-BARROIS
52;RUE AUGUSTE HUVIG, ARC-EN-BARROIS
52;RUE AURELIE PICARD TEDJANI, ARC-EN-BARROIS
52;RUE BELLE CROIX, ARC-EN-BARROIS
52;RUE ETIENNE JEAN BOUCHU, ARC-EN-BARROIS
52;RUE DE CAULE, ARC-EN-BARROIS
52;RTE DE CHAUMONT, ARC-EN-BARROIS
52;RLE DES CLOS, ARC-EN-BARROIS
52;RUE DU COLONEL BRALET, ARC-EN-BARROIS
52;PL DU COUVENT, ARC-EN-BARROIS
52;RUE DU DOCTEUR CHAUFOURT, ARC-EN-BARROIS
52;PLA DE L EGLISE A MONTROT, ARC-EN-BARROIS
52;RUE DE L EGLISE A MONTROT, ARC-EN-BARROIS
52;RUE DES ELEUX, ARC-EN-BARROIS
52;RUE DE L ESPERANCE, ARC-EN-BARROIS
52;RUE DES FOSSES, ARC-EN-BARROIS
52;RUE GABRIEL PEIGNOT, ARC-EN-BARROIS
52;RTE DE GIEY, ARC-EN-BARROIS
52;RUE DE GIEY / AUJON A MONTROT, ARC-EN-BARROIS
52;RUE HENRI ROSSIGNOL, ARC-EN-BARROIS
52;RUE DU DOCTEUR HENRI SOMMELET, ARC-EN-BARROIS
52;RUE INSTITUTEUR ANDRE, ARC-EN-BARROIS
52;RUE JACQUES APAP, ARC-EN-BARROIS
52;RUE PIERRE LABELLE, ARC-EN-BARROIS
52;RTE DE LANGRES, ARC-EN-BARROIS
52;RTE DE LONGEAU, ARC-EN-BARROIS
52;RUE DE LA METAIRIE, ARC-EN-BARROIS
52;PL MOREAU, ARC-EN-BARROIS
52;RUE DE LA MOTTE, ARC-EN-BARROIS
52;RLE DU MOULIN, ARC-EN-BARROIS
52;RUE DU PETIT BOURG, ARC-EN-BARROIS
52;RUE PIERRE JACQUES, ARC-EN-BARROIS
52;RLE DU PRIEURE, ARC-EN-BARROIS
52;RUE DE LA PROTTE, ARC-EN-BARROIS
52;CHEM DE LA PROTTE, ARC-EN-BARROIS
52;CHE DE SAINT ANNE, ARC-EN-BARROIS
52;RUE SAINT JACQUES, ARC-EN-BARROIS
52;RLE DE LA TANNERIE, ARC-EN-BARROIS
52;RUE DU VAL DIEU, ARC-EN-BARROIS
52;RUE DES CHENEVIERES, ARNANCOURT
52;CHE DE LA COLLOTIERE, ARNANCOURT
52;RUE DE LA COLLOTIERE, ARNANCOURT
52;RTE DE COLOMBEY LES DEUX EGLIS, ARNANCOURT
52;RUE DE L EGLISE, ARNANCOURT
52;PL DE LA MAIRIE, ARNANCOURT
52;RUE DE LA MONTAGNE, ARNANCOURT
52;CHE DES PECHEURS, ARNANCOURT
52;RUE DES PINSONS, ARNANCOURT
52;RLE DES PINSONS, ARNANCOURT
52;RUE DU PONT, ARNANCOURT
52;RUE DES PUITS, ARNANCOURT
52;RUE DU SERINGAT, ARNANCOURT
52;CHE DU VAL DU MOULIN, ARNANCOURT
52;RUE DES VARENNES, ARNANCOURT
52;RUE DE LA CROIX DE FER, ATTANCOURT
52;RUE DE L ECOLE, ATTANCOURT
52;RUE GRANDE RUE, ATTANCOURT
52;RUE GRANDE RUELLE, ATTANCOURT
52;RUE HAUTE, ATTANCOURT
52;RUE DES LILAS, ATTANCOURT
52;RUE DES MARRONNIERS, ATTANCOURT
52;RUE DE LA MOTHE, ATTANCOURT
52;CHE DU MOULIN, ATTANCOURT
52;RUE DU PAQUIS, ATTANCOURT
52;RUE PETITE RUELLE, ATTANCOURT
52;RTE D'ARC, AUBEPIERRE SUR AUBE
52;RUE DU BIEN ETRE, AUBEPIERRE SUR AUBE
52;IMP BULLIARD, AUBEPIERRE SUR AUBE
52;RUE DU CIMETIERE, AUBEPIERRE SUR AUBE
52;RUE DE DERRIERE LES MURS, AUBEPIERRE SUR AUBE
52;RUE DE L ETRE, AUBEPIERRE SUR AUBE
52;RUE DE LA MONTEE, AUBEPIERRE SUR AUBE
52;RUE DU MOULIN, AUBEPIERRE SUR AUBE
52;PTR PETITE RUE DU VAUX, AUBEPIERRE SUR AUBE
52;RUE DE LA PORTE D'EAU, AUBEPIERRE SUR AUBE
52;RUE DE LA REPUBLIQUE, AUBEPIERRE SUR AUBE
52;RUE SAINT ROCH, AUBEPIERRE SUR AUBE
52;RUE DU VAUX, AUBEPIERRE SUR AUBE
52;LOT LES CHARBONNIERES, AUBERIVE
52;RUE DE L ABBATIALE, AUBERIVE
52;RUE DE L ABATTOIR, AUBERIVE
52;RUE DE L ABBAYE, AUBERIVE
52;COTE DE L'ABBATIALE, AUBERIVE
52;PL DE L'ABBAYE, AUBERIVE
52;RUE DE LA BERGE, AUBERIVE
52;RUE DE LA BOUCHERIE, AUBERIVE
52;RUE DES CHARBONNIERES, AUBERIVE
52;RTE DE CHATILLON, AUBERIVE
52;RUE DU CIMETIERE, AUBERIVE
52;IMP DE LA COMBE AU PREVET, AUBERIVE
52;RUE DE L ECOLE DES FILLES, AUBERIVE
52;RUE DE L'ECOLE DES GARCONS, AUBERIVE
52;PL DE L EGLISE, AUBERIVE
52;PROM ENTRE DEUX MURS, AUBERIVE
52;PROM ENTRE DEUX EAUX, AUBERIVE
52;RUE DES FERMIERS, AUBERIVE
52;IMP DE LA GENDARMERIE, AUBERIVE
52;RTE DE LANGRES, AUBERIVE
52;RUE DE LA MAIRIE, AUBERIVE
52;RUE DU MOULIN, AUBERIVE
52;RLE DES PASSERELLES, AUBERIVE
52;RUE DE LA PETITE ECOLE, AUBERIVE
52;RUE DE LA POSTE, AUBERIVE
52;RTE DE SANTENOGE, AUBERIVE
52;CHE DU SINAI, AUBERIVE
52;CHE DU VAL CLAVIN, AUBERIVE
52;RLE DU VAL CLAVIN, AUBERIVE
52;RUE DU COIN, AUDELONCOURT
52;RTE DEPARTEMENTALE 74, AUDELONCOURT
52;RTE DEPARTEMENTALE 110, AUDELONCOURT
52;RTE DEPARTEMENTALE 220, AUDELONCOURT
52;RUE DE DERRIERE LES JARDINS, AUDELONCOURT
52;RUE DE L EGLISE, AUDELONCOURT
52;RUE DE LA GARENNE, AUDELONCOURT
52;RUE DU HAM, AUDELONCOURT
52;RUE DES JARDINS, AUDELONCOURT
52;IMP LAFAYETTE, AUDELONCOURT
52;PL LAFAYETTE, AUDELONCOURT
52;RUE DE LA MORIERE, AUDELONCOURT
52;RUE NEUVE, AUDELONCOURT
52;RUE DE LA PRESLES, AUDELONCOURT
52;RUE DU RE, AUDELONCOURT
52;RTE D AUBERIVE, AUJEURRES
52;CHE DE CHANOY, AUJEURRES
52;RUE DE L ECOLE, AUJEURRES
52;RUE DE L EGLISE, AUJEURRES
52;PL DE L EGLISE, AUJEURRES
52;RUE DE LA GRANDE FONTAINE, AUJEURRES
52;RUE DE LA PETITE FONTAINE, AUJEURRES
52;RUE DES GARGOUILLES, AUJEURRES
52;GR GRANDE RUE, AUJEURRES
52;RUE DE LA MAIRIE, AUJEURRES
52;PL DE LA PEUTE BETE, AUJEURRES
52;RUE DES ROCHES, AUJEURRES
52;SEN SAUVAGE, AUJEURRES
52;CHE DE SINELLY, AUJEURRES
52;RTE DES 4 TILLEULS, AUJEURRES
52;RUE DE TRAVERSE, AUJEURRES
52;RUE DES AULNES, AULNOY-SUR-AUBE
52;CHE DE BAY, AULNOY-SUR-AUBE
52;RUE DES FONTAINES, AULNOY-SUR-AUBE
52;CHE DE LA FONTENELLE, AULNOY-SUR-AUBE
52;RTE DE LA TUILERIE, AULNOY-SUR-AUBE
52;RUE ANTOINE LABREVEUX, AUTIGNY-LE-GRAND
52;SEN DU CHAMP PRIEUR, AUTIGNY-LE-GRAND
52;CHE DU CHATEAU D'EAU, AUTIGNY-LE-GRAND
52;RUE DE LA FONTAINE ST PIERRE, AUTIGNY-LE-GRAND
52;IMP GEORGES BRASSENS, AUTIGNY-LE-GRAND
52;SEN DES VIGNOTTES, AUTIGNY-LE-GRAND
52;SEN DU VILLAGE, AUTIGNY-LE-GRAND
52;IMP W A MOZART, AUTIGNY-LE-GRAND
52;RUE DES BENEVOLES, AUTIGNY LE PETIT
52;COUR DU CHATEAU, AUTIGNY LE PETIT
52;GR RUE, AUTIGNY LE PETIT
52;RUE DE LA VALLEE, AUTIGNY LE PETIT
52;RUE DU BOIS CHIGNEUX, AUTREVILLE-SUR-LA-RENNE
52;RLE DE BOUILLY, AUTREVILLE-SUR-LA-RENNE
52;RUE DE BUXIERES, AUTREVILLE-SUR-LA-RENNE
52;RUE DU CAPITAINE SCHREIBER, AUTREVILLE-SUR-LA-RENNE
52;CHE DU CALVAIRE, AUTREVILLE-SUR-LA-RENNE
52;RLE CHANTEVERT, AUTREVILLE-SUR-LA-RENNE
52;RLE DES COCHONS, AUTREVILLE-SUR-LA-RENNE
52;RLE DES CORVEES, AUTREVILLE-SUR-LA-RENNE
52;RUE DE LA 2EME D B, AUTREVILLE-SUR-LA-RENNE
52;RUE DU DOCTEUR JEAN LEBON, AUTREVILLE-SUR-LA-RENNE
52;SEN DIT DU MOULIN, AUTREVILLE-SUR-LA-RENNE
52;SEN DIT SOUS FORET, AUTREVILLE-SUR-LA-RENNE
52;RUE DE L EGLISE A ST MARTIN, AUTREVILLE-SUR-LA-RENNE
52;RUE DE L EMPLATRE, AUTREVILLE-SUR-LA-RENNE
52;RUE DE L EURCEY, AUTREVILLE-SUR-LA-RENNE
52;RLE DE LA FONTAINE, AUTREVILLE-SUR-LA-RENNE
52;CHE DE GILLANCOURT, AUTREVILLE-SUR-LA-RENNE
52;GR GRANDE RUE, AUTREVILLE-SUR-LA-RENNE
52;RUE DE JUZENNECOURT, AUTREVILLE-SUR-LA-RENNE
52;PL DE LA MAIRIE, AUTREVILLE-SUR-LA-RENNE
52;RUE DE LA MAIRIE, AUTREVILLE-SUR-LA-RENNE
52;RUE MERDANTON, AUTREVILLE-SUR-LA-RENNE
52;RLE DU MOULIN, AUTREVILLE-SUR-LA-RENNE
52;RUE NOTRE DAME, AUTREVILLE-SUR-LA-RENNE
52;RUE DE L OUTRE, AUTREVILLE-SUR-LA-RENNE
52;RUE DU PAQUIS, AUTREVILLE-SUR-LA-RENNE
52;PTR PETITE RUE, AUTREVILLE-SUR-LA-RENNE
52;RLE POIGNOT, AUTREVILLE-SUR-LA-RENNE
52;RUE DE LA POMPADOUR, AUTREVILLE-SUR-LA-RENNE
52;RUE PRINCIPALE, AUTREVILLE-SUR-LA-RENNE
52;RLE DU PUISAT, AUTREVILLE-SUR-LA-RENNE
52;CHE DES ROISES, AUTREVILLE-SUR-LA-RENNE
52;RUE DE LA ROULANDE, AUTREVILLE-SUR-LA-RENNE
52;RUE SAINT BLAISE, AUTREVILLE-SUR-LA-RENNE
52;RUE SAINT LOUP, AUTREVILLE-SUR-LA-RENNE
52;RUE DE SAINT MARTIN, AUTREVILLE-SUR-LA-RENNE
52;RUE SAINT PERE, AUTREVILLE-SUR-LA-RENNE
52;RUE SAINT PIERRE, AUTREVILLE-SUR-LA-RENNE
52;RUE DES VARENNES, AUTREVILLE-SUR-LA-RENNE
52;RUE DE VAUDREMONT, AUTREVILLE-SUR-LA-RENNE
52;RUE VOIE DAMEE, AUTREVILLE-SUR-LA-RENNE
52;HAM DE FORFILLIERES, AVRECOURT
52;CHE D'ANDILLY, AVRECOURT
52;RUE DE BEL FAYS, AVRECOURT
52;IMP DU BREUIL, AVRECOURT
52;RUE DU CENTRE, AVRECOURT
52;RTE DU CHATEAU D'EAU, AVRECOURT
52;RUE DE LA MAIRIE, AVRECOURT
52;CHE DE MEUSE, AVRECOURT
52;RUE DE MONTIGNY, AVRECOURT
52;RUE DE RECOURT, AVRECOURT
52;RUE DE L EGLISE, BAILLY AUX FORGES
52;RUE DE LA FONTAINE, BAILLY AUX FORGES
52;RUE GRANDE RUE, BAILLY AUX FORGES
52;RUE DES AUGES, BAISSEY
52;RUE BASSE, BAISSEY
52;RLE DU BREUIL, BAISSEY
52;PL DU CALVAIRE, BAISSEY
52;PL DE LA CHAPELLE, BAISSEY
52;RUE DU CHATELET, BAISSEY
52;RUE DU CHEMIN DES LOUPS, BAISSEY
52;RLE DITE DE LA COMBE, BAISSEY
52;RUE DE LA DAME AUX BOIS, BAISSEY
52;RLE DE L ECOLE, BAISSEY
52;CHE DU CLOS, BAISSEY
52;RUE DE L EGLISE, BAISSEY
52;RLE DES ESCARGODETS, BAISSEY
52;RLE DE L ESPAGNE, BAISSEY
52;RLE DE LA MAIRIE, BAISSEY
52;RUE MONSEIGNEUR DE LANGRES, BAISSEY
52;RTE D'ORCEVAUX, BAISSEY
52;RUE DU PARADIS, BAISSEY
52;RUE DU PRESLOT, BAISSEY
52;IMP DE LA ROUELLE, BAISSEY
52;RUE DE LA ROULOTTE, BAISSEY
52;PL SAINT PIERRE ET SAINT PAUL, BAISSEY
52;RLE DES SOEURS DE LA PROVIDENC, BAISSEY
52;RUE DU TET, BAISSEY
52;RUE DU VAUX, BAISSEY
52;RUE DU BOUTONNIER, BANNES
52;RUE DE L ECOLE, BANNES
52;RUE DE LA GARE, BANNES
52;CHE DE LA CRAIE, BANNES
52;RUE DU LAC, BANNES
52;RTE DE LANGRES, BANNES
52;RUE DE LA LIEZ, BANNES
52;RUE DE NANCY, BANNES
52;RUE DU POMMERET, BANNES
52;RUE DU RUISSEAU, BANNES
52;RUE DES 4 CHENES, BANNES
52;VOIE DE CHOISEUL, BASSONCOURT
52;RUE DE L'ECOLE, BASSONCOURT
52;CHE DU HAUT MONT, BASSONCOURT
52;RUE DE JUIN, BASSONCOURT
52;CHE DE LA MOUCHOUSE, BASSONCOURT
52;RUE DU PLECY, BASSONCOURT
52;IMP DES VERGERS, BASSONCOURT
52;RUE CORNETTE, BAUDRECOURT
52;RUE BARBE DE CHEVRE, BAUDRECOURT
52;RUE DE BOUDET, BAUDRECOURT
52;RTE DE CHARMES, BAUDRECOURT
52;RTE DE COURCELLES, BAUDRECOURT
52;RTE DE DOMMARTIN, BAUDRECOURT
52;RUE GRANDE RUE, BAUDRECOURT
52;RUE DE LA GRANDE VOIE, BAUDRECOURT
52;PL DE LA MAIRIE, BAUDRECOURT
52;CHE DE MORANCOURT, BAUDRECOURT
52;RLE DE LA MOTTE, BAUDRECOURT
52;RUE DU MOULIN, BAUDRECOURT
52;RUE DE LA PETITE VOIE, BAUDRECOURT
52;CHE DES PRES, BAUDRECOURT
52;CHE DE L'AUBE, BAY-SUR-AUBE
52;CHE DU CHAMP AU PRETRE, BAY-SUR-AUBE
52;CHE DE LA CITADELLE, BAY-SUR-AUBE
52;RUE DE L'EGLISE, BAY-SUR-AUBE
52;RUE DES FONTAINES, BAY-SUR-AUBE
52;RUE DU FOUR BANAL, BAY-SUR-AUBE
52;IMP DES FROMAGERS, BAY-SUR-AUBE
52;PL JOSEPH MICHEL, BAY-SUR-AUBE
52;RUE AU LIEVRE, BAY-SUR-AUBE
52;CHE DU MOULIN, BAY-SUR-AUBE
52;PAS DU PRESBYTERE, BAY-SUR-AUBE
52;RTE DE LA VALLEE, BAY-SUR-AUBE
52;RUE DES AUGES, BEAUCHEMIN
52;RUE DU CALVAIRE, BEAUCHEMIN
52;RUE DE CHANOY, BEAUCHEMIN
52;RUE DE LA CHARME, BEAUCHEMIN
52;RUE DU COLLEGE, BEAUCHEMIN
52;PL DE L EGLISE, BEAUCHEMIN
52;PL DES FONTAINES, BEAUCHEMIN
52;RUE DES FONTAINES, BEAUCHEMIN
52;IMP DU MONT JARD'HEUIL, BEAUCHEMIN
52;RUE DU PONT BERNARD, BEAUCHEMIN
52;RUE DE ST MARTIN, BEAUCHEMIN
52;RUE DE SAINT CIERGUES, BEAUCHEMIN
52;RTE DES TEMPLIERS, BEAUCHEMIN
52;RUE DE L ABBAYE, BELMONT
52;RTE DES CHENEVIERES, BELMONT
52;RUE FONTAINE EAU CLAIRE, BELMONT
52;RUE DU MOULIN, BELMONT
52;CHE DES MUIDS, BELMONT
52;RUE DES PONTS CHARROIS, BELMONT
52;CHE DES PRES VERTS, BELMONT
52;RTE DES VERGERS, BELMONT
52;CHE DE L'ABREUGNEY, ROCHES-BETTAINCOURT
52;RUE DE L'AJOUX, ROCHES-BETTAINCOURT
52;IMP ANNE PAGEOT, ROCHES-BETTAINCOURT
52;RUE ANNE PAGEOT, ROCHES-BETTAINCOURT
52;RUE DES BAINS DOUCHES, ROCHES-BETTAINCOURT
52;IMP DE LA RUE BASSE, ROCHES-BETTAINCOURT
52;RUE BASSE, ROCHES-BETTAINCOURT
52;RUE DE LA BATTERIE, ROCHES-BETTAINCOURT
52;CHE DES BOIS, ROCHES-BETTAINCOURT
52;RTE DE BUSSON, ROCHES-BETTAINCOURT
52;RUE DU CARON, ROCHES-BETTAINCOURT
52;RUE DU CHATEAU D'EAU, ROCHES-BETTAINCOURT
52;RUE CHAUMONNET, ROCHES-BETTAINCOURT
52;ALL DU CORDON, ROCHES-BETTAINCOURT
52;CHE DE COURTINVEAU, ROCHES-BETTAINCOURT
52;PL DE L'EGLISE, ROCHES-BETTAINCOURT
52;RUE DE LA FONTAINE, ROCHES-BETTAINCOURT
52;RUE DE LA FORET, ROCHES-BETTAINCOURT
52;RUE DE LA FORGE, ROCHES-BETTAINCOURT
52;RUE DU FOUR, ROCHES-BETTAINCOURT
52;RUE DE LA GARE, ROCHES-BETTAINCOURT
52;RUE DE LA GLACIERE, ROCHES-BETTAINCOURT
52;ALL DU GRIPELOT, ROCHES-BETTAINCOURT
52;CHE DU HAUT BUISSON, ROCHES-BETTAINCOURT
52;RUE HAUTE, ROCHES-BETTAINCOURT
52;AV JOUFFROY D'ABBANS, ROCHES-BETTAINCOURT
52;IMP DE LAVAUX, ROCHES-BETTAINCOURT
52;RUE DE LAVAUX, ROCHES-BETTAINCOURT
52;RUE DU MOULIN, ROCHES-BETTAINCOURT
52;RUE DU PETIT CULTRUT, ROCHES-BETTAINCOURT
52;RUE DES PETITS PONTS, ROCHES-BETTAINCOURT
52;RUE DES PONTS, ROCHES-BETTAINCOURT
52;RUE DES QUAIS, ROCHES-BETTAINCOURT
52;RTE DE RIMAUCOURT, ROCHES-BETTAINCOURT
52;RUE DES ROIES MONTANTES, ROCHES-BETTAINCOURT
52;RUE DE LA SABOTTERIE, ROCHES-BETTAINCOURT
52;AV DE VERDUN, ROCHES-BETTAINCOURT
52;RUE DE VERDUN, ROCHES-BETTAINCOURT
52;LOT LE COUTEROT, BETTANCOURT LA FERREE
52;RUE ANDRE THEURIET, BETTANCOURT LA FERREE
52;RUE ANNE FRANK, BETTANCOURT LA FERREE
52;RUE ALBERT SCHWEITZER, BETTANCOURT LA FERREE
52;RUE ALESSANDRO VOLTA, BETTANCOURT LA FERREE
52;RUE ALBERT FERT, BETTANCOURT LA FERREE
52;RUE ALFRED KASTLER, BETTANCOURT LA FERREE
52;RUE ARTHUR RIMBAUD, BETTANCOURT LA FERREE
52;RTE DE BAR LE DUC, BETTANCOURT LA FERREE
52;IMP BOILEAU, BETTANCOURT LA FERREE
52;RUE BOILEAU, BETTANCOURT LA FERREE
52;ALL DU BOIS, BETTANCOURT LA FERREE
52;ALL BOUCHARDON, BETTANCOURT LA FERREE
52;ALL CAMILLE FLAMMARION, BETTANCOURT LA FERREE
52;RUE DU COLONEL FABIEN, BETTANCOURT LA FERREE
52;RUE DE L'ORNEL, BETTANCOURT LA FERREE
52;ALL DU COUTEROT, BETTANCOURT LA FERREE
52;RUE DENIS MOUGEOT, BETTANCOURT LA FERREE
52;RUE DIDEROT, BETTANCOURT LA FERREE
52;RUE ELSA TRIOLET, BETTANCOURT LA FERREE
52;RUE EMILE ZOLA, BETTANCOURT LA FERREE
52;RUE DES FRERES LUMIERES, BETTANCOURT LA FERREE
52;RUE DU FOND DES VAUX, BETTANCOURT LA FERREE
52;CHE DE LA FONTAINE, BETTANCOURT LA FERREE
52;ALL HENRY BARBUSSE, BETTANCOURT LA FERREE
52;RUE JACQUES DUCLOS, BETTANCOURT LA FERREE
52;RUE JACQUES PREVERT, BETTANCOURT LA FERREE
52;RUE JEAN JAURES, BETTANCOURT LA FERREE
52;RUE JEAN MOULIN, BETTANCOURT LA FERREE
52;RUE JEAN ROSTAND, BETTANCOURT LA FERREE
52;RUE JOLIOT CURIE, BETTANCOURT LA FERREE
52;RUE JULES FERRY, BETTANCOURT LA FERREE
52;RUE LAMARTINE, BETTANCOURT LA FERREE
52;RUE LEON BLUM, BETTANCOURT LA FERREE
52;RUE DE LA LIBERATION, BETTANCOURT LA FERREE
52;RUE LOUIS ARAGON, BETTANCOURT LA FERREE
52;RUE LOUIS NEEL, BETTANCOURT LA FERREE
52;RUE LOUISE MICHEL, BETTANCOURT LA FERREE
52;ALL DU MAQUIS MAUGUET, BETTANCOURT LA FERREE
52;RUE DU MAQUIS MAUGUET, BETTANCOURT LA FERREE
52;RUE MARCEL MANSUY, BETTANCOURT LA FERREE
52;RUE MARGUERITE PEREY, BETTANCOURT LA FERREE
52;RUE DU 19 MARS 1962, BETTANCOURT LA FERREE
52;RUE DES MARTYRS DE LA SAULX, BETTANCOURT LA FERREE
52;ALL DES ORGERES, BETTANCOURT LA FERREE
52;RUE PARKWAY, BETTANCOURT LA FERREE
52;ALL PASTEUR, BETTANCOURT LA FERREE
52;RUE PASTEUR, BETTANCOURT LA FERREE
52;ALL PHILIPPE LEBON, BETTANCOURT LA FERREE
52;RUE PIERRE BROSSOLETTE, BETTANCOURT LA FERREE
52;RUE PIERRE GILLES DE GENNES, BETTANCOURT LA FERREE
52;RUE DU PRE ADAM, BETTANCOURT LA FERREE
52;RUE DU REPOS, BETTANCOURT LA FERREE
52;RUE DES ROISES, BETTANCOURT LA FERREE
52;IMP DES ROISES, BETTANCOURT LA FERREE
52;RLE SAINT DENIS, BETTANCOURT LA FERREE
52;RUE DE STALINGRAD, BETTANCOURT LA FERREE
52;RUE THOMAS EDISON, BETTANCOURT LA FERREE
52;IMP DE LA VACQUERIE, BETTANCOURT LA FERREE
52;RUE DE LA VACQUERIE, BETTANCOURT LA FERREE
52;RUE DE VERDUN, BETTANCOURT LA FERREE
52;RUE VICTOR HUGO, BETTANCOURT LA FERREE
52;RUE VOLTAIRE, BETTANCOURT LA FERREE
52;FRM D ACRON, BEURVILLE
52;HAM DE BLINFEY, BEURVILLE
52;FRM DE CHANET, BEURVILLE
52;FRM DU CHATEAU PAILLOT, BEURVILLE
52;FRM DE LA GAIETE, BEURVILLE
52;RTE DE COLOMBEY, BEURVILLE
52;RUE DES CRETS, BEURVILLE
52;RUE DE L EGLISE, BEURVILLE
52;RUE DE L HANTELLE, BEURVILLE
52;SEN DES LILAS, BEURVILLE
52;PL DE LA MAIRIE, BEURVILLE
52;RUE DU MOULIN, BEURVILLE
52;RTE DE THORS, BEURVILLE
52;RUE DU VAL DE CLAIRVAUX, BEURVILLE
52;RUE DU VAL MILLET, BEURVILLE
52;RUE DU VAL MOUSSET, BEURVILLE
52;RUE D AGEVILLE, BIESLES
52;IMP DE L ARUM, BIESLES
52;RUE DU BAN, BIESLES
52;RUE DE BAVIERE, BIESLES
52;RUE DU BIEZ, BIESLES
52;PL DES BLEUETS, BIESLES
52;RUE DE BOURBONNE, BIESLES
52;RUE DE BOURGOGNE, BIESLES
52;ALL DES CAPUCINES, BIESLES
52;RUE CHAMP LA DAME, BIESLES
52;RUE DE CHAMPAGNE, BIESLES
52;CHE DIT DE LA CHARMELLE, BIESLES
52;RUE LOT LA CHARMELLE, BIESLES
52;RUE DU CHATEAU, BIESLES
52;RLE DU CHATEAU, BIESLES
52;CHE DU CHATEAU, BIESLES
52;RUE DE CHAUMONT, BIESLES
52;RUE DU CHATEAU D EAU, BIESLES
52;RUE DU CHEMINE, BIESLES
52;RUE DU CHEMINET, BIESLES
52;RUE DU COHEMAND, BIESLES
52;RUE COTE DE L EAU, BIESLES
52;IMP ELOI PERNET, BIESLES
52;RUE ELOI PERNET, BIESLES
52;RUE DE LA VOIE DE MANDRES, BIESLES
52;AV DE L EUROPE, BIESLES
52;RUE DE L EUROPE, BIESLES
52;RUE DE LA FONTAINE, BIESLES
52;RUE DES FORGES, BIESLES
52;RUE FORT MAISON, BIESLES
52;IMP DES GANTIERES, BIESLES
52;RUE DES GANTIERES, BIESLES
52;RUE DES GERANIUMS, BIESLES
52;GR GRANDE RUE, BIESLES
52;CHE HAUT, BIESLES
52;COUR DES HORTENSIAS, BIESLES
52;IMP DU HUIT MAI, BIESLES
52;RUE DU HUIT MAI, BIESLES
52;RUE DES IRIS, BIESLES
52;RUE DES JONQUILLES, BIESLES
52;RUE DE LAMAINE, BIESLES
52;RUE DES LAVANDIERES, BIESLES
52;IMP DU LAVOIR, BIESLES
52;RUE DE LORRAINE, BIESLES
52;RUE LOUIS ANDRE, BIESLES
52;RUE LOUIS ELOI PERNET, BIESLES
52;PL DE LA MAIRIE, BIESLES
52;IMP MARCEL OLIVAIN, BIESLES
52;RUE MARCEL OLIVAIN, BIESLES
52;RUE VOIE MAUDIER, BIESLES
52;RUE MEMASSE, BIESLES
52;RLE MEMASSE, BIESLES
52;IMP DU MUGUET, BIESLES
52;RUE DES NARCISSES, BIESLES
52;RUE DES RIEPPES, BIESLES
52;IMP DU ROMARIN, BIESLES
52;RUE ZI SAINT ROCH, BIESLES
52;CHE DE SARCEY, BIESLES
52;RUE DE SARCEY, BIESLES
52;RUE DES TROIS SOURCES, BIESLES
52;CHE DES TULIPES, BIESLES
52;RUE DE VERDUN, BIESLES
52;RUE DES CHENEVIERES, BIZE
52;CHE DU PETIT PLAIN, BIZE
52;RUE DES TILLEULS, BIZE
52;CHE DES VERNES, BIZE
52;RTE NATIONALE 19, BLAISY
52;RTE DE CHAUMONT, BLAISY
52;RUE DE LA FONTAINE, BLAISY
52;CHE DES GRANDS BOIS, BLAISY
52;RUE DE LA MAIRIE, BLAISY
52;CHE DES REPES, BLAISY
52;RUE DU TROU, BLAISY
52;RLE DES VALOTTES, BLAISY
52;RUE DES TRINCOMBELLES, BLECOURT
52;RUE DES MARRONNIERS, BLECOURT
52;CHE DE MALASSISE, BLECOURT
52;RUE DE LA SABLIERE, BLECOURT
52;CHE DU GRAND JARDIN, BLECOURT
52;RUE JEANNE D'ARC, BLECOURT
52;RUE NOTRE DAME, BLECOURT
52;CHE DE BOUVOT, BLECOURT
52;RUE DES LAVANDIERES, BLECOURT
52;LOT DE LA LOUERE, BLESSONVILLE
52;LOT DU MOULIN A VENT, BLESSONVILLE
52;RLE BIZIOT, BLESSONVILLE
52;RLE MARNAY, BLESSONVILLE
52;RUE DU CARON, BLESSONVILLE
52;IMP DU COIN, BLESSONVILLE
52;IMP DU COQ, BLESSONVILLE
52;RUE DELETTRE, BLESSONVILLE
52;CHE DE LA LOUERE, BLESSONVILLE
52;RUE DE LA MARE, BLESSONVILLE
52;RTE DE MONTSAON, BLESSONVILLE
52;RUE PRINCIPALE, BLESSONVILLE
52;CHE VOIE D ORGES, BLESSONVILLE
52;RLE DES CHARTREUX, BLUMERAY
52;CHE DE LA COTE DU ROI, BLUMERAY
52;RUE DE L EGLISE, BLUMERAY
52;RUE NAPOLEON, BLUMERAY
52;RUE PHILIPPE LEBON, BLUMERAY
52;SEN DU PLAISIER, BLUMERAY
52;RUE SAINT LAURENT, BLUMERAY
52;RUE BEL AIR, BOLOGNE
52;RUE LOUIS GEOFFROY, BOLOGNE
52;RUE CHATEAU D EAU, BOLOGNE
52;RUE BEAU SITE, BOLOGNE
52;RUE BELLEVUE, BOLOGNE
