52;RUE PETITE RUE DE L'EGLISE, RACHECOURT-SUR-MARNE
52;RUE DES FOULEURS, RACHECOURT-SUR-MARNE
52;IMP DE LA GIRONDE, RACHECOURT-SUR-MARNE
52;RUE DE LA GIRONDE, RACHECOURT-SUR-MARNE
52;RUE DU HAUSSE PIED, RACHECOURT-SUR-MARNE
52;IMP DU HAUSSE PIED, RACHECOURT-SUR-MARNE
52;AV DE LA MARNE, RACHECOURT-SUR-MARNE
52;RLE DU MAROC, RACHECOURT-SUR-MARNE
52;RUE DES MARRONNIERS, RACHECOURT-SUR-MARNE
52;RUE DU PRESSOIR, RACHECOURT-SUR-MARNE
52;RUE DU PUITS, RACHECOURT-SUR-MARNE
52;RUE DU SENTIER, RACHECOURT-SUR-MARNE
52;RUE DES SARMENTS, RACHECOURT-SUR-MARNE
52;RUE DU STADE, RACHECOURT-SUR-MARNE
52;RUE DES SOEURS, RACHECOURT-SUR-MARNE
52;RUE DES TILLEULS, RACHECOURT-SUR-MARNE
52;AV DE WASSY, RACHECOURT-SUR-MARNE
52;RUE DE LA BARRE, RANCONNIERES
52;RUE DU DESSOUS, RANCONNIERES
52;RUE DU FOUR, RANCONNIERES
52;RUE JEAN MONNY, RANCONNIERES
52;RUE DE LA LIBERATION, RANCONNIERES
52;PL DE LA MAIRIE, RANCONNIERES
52;RUE MARIOTTE, RANCONNIERES
52;CHE DU PETIT BOIS, RANCONNIERES
52;RUE DU BAS, RANGECOURT
52;RUE DE LA FONTAINE, RANGECOURT
52;RUE GRATIEN MICHAUX, RANGECOURT
52;RUE DU LAIT, RANGECOURT
52;RUE THEOPHILE DE VIAU, RANGECOURT
52;RUE VIEILLE COTE, RANGECOURT
52;RUE DU VIOT, RANGECOURT
52;LOT DES QUATRE VENTS, RENNEPONT
52;IMP DU CANAL, RENNEPONT
52;RUE DES CRAIS, RENNEPONT
52;RUE DES CROTS, RENNEPONT
52;IMP EGLISE SAINT MAURICE, RENNEPONT
52;CHE DES FONTENILS, RENNEPONT
52;CHE DE JURVILLE, RENNEPONT
52;RTE DE LONGCHAMP, RENNEPONT
52;PL DE LA MAIRIE, RENNEPONT
52;RTE DE MARANVILLE, RENNEPONT
52;RUE DU MOULIN, RENNEPONT
52;CHE DES PRES, RENNEPONT
52;RUE PRINCIPALE, RENNEPONT
52;IMP DU BERGER, REYNEL
52;RUE DU BOURRELIER, REYNEL
52;RTE DE BUSSON, REYNEL
52;RUE DU CHARRON, REYNEL
52;IMP DE L'EGLISE, REYNEL
52;RUE DE L ANCIENNE EGLISE, REYNEL
52;RUE DE LA FONTAINE, REYNEL
52;GR GRANDE RUE, REYNEL
52;SEN DU MOULIN, REYNEL
52;PTR PETITE RUE, REYNEL
52;RUE DU PILLET VERT, REYNEL
52;RUE DES PRETRES, REYNEL
52;CHE DES QUATRE ROMAINS, REYNEL
52;RUE DES 7 TOURS, REYNEL
52;CHE DES ROCHES, REYNEL
52;RUE DES TROIS BOSSES, RIAUCOURT
52;RUE DU CARRON, RIAUCOURT
52;RUE DU CHATEAU, RIAUCOURT
52;RUE DES CHENEVIERES, RIAUCOURT
52;RUE DE L EGLISE, RIAUCOURT
52;RUE DE LA FONTAINE, RIAUCOURT
52;RUE DE LA FORGE, RIAUCOURT
52;RUE DE LA GOULOTTE, RIAUCOURT
52;GR GRANDE RUE, RIAUCOURT
52;RUE DES PRE MARION, RIAUCOURT
52;RUE SOUS FOURREE, RIAUCOURT
52;RUE SOUS LES VIGNES, RIAUCOURT
52;RUE DU PRE ROBIN, RIAUCOURT
52;RUE DU TERTRE, RIAUCOURT
52;RUE DE LA VIEILLE COTE, RIAUCOURT
52;LOT SAPRR, RICHEBOURG
52;CD DINTEVILLE A MONTIGNY, RICHEBOURG
52;CD MARANVILLE A MARAC, RICHEBOURG
52;CR DE LA MAISON RENAUD, RICHEBOURG
52;CR DE LA VOIE DE CHAUMONT, RICHEBOURG
52;CHV DE COUR L EVEQUE, RICHEBOURG
52;RTE D ARC EN BARROIS, RICHEBOURG
52;RUE DE LA CHARME, RICHEBOURG
52;RTE DE CHATEAUVILLAIN, RICHEBOURG
52;RUE DE CHATEAUVILLAIN, RICHEBOURG
52;RTE DE CHAUMONT, RICHEBOURG
52;RUE DU COIN, RICHEBOURG
52;RUE CORDONNIERE, RICHEBOURG
52;IMP DU CROC DE TEMPETE, RICHEBOURG
52;RUE DE L'EGLISE, RICHEBOURG
52;RUE DU FOUR, RICHEBOURG
52;IMP GRAND COUR, RICHEBOURG
52;RUE DE LA LEVEE DE CESAR, RICHEBOURG
52;PL DE LA MAIRIE, RICHEBOURG
52;RUE DE LA MARE, RICHEBOURG
52;RUE DE LA PETITE MARE, RICHEBOURG
52;RUE DE LA PRAIERE, RICHEBOURG
52;RUE DE LA RAULE, RICHEBOURG
52;RUE DE LA VIEILLE VOIE, RICHEBOURG
52;RUE DE LA VOIE DE CHAUMONT, RICHEBOURG
52;RUE VOIE DE COUR L'EVEQUE, RICHEBOURG
52;RUE DE LA VOIE DE GIEY, RICHEBOURG
52;LOT LA FOUCHERE, RIMAUCOURT
52;HLM LES ANEMONES, RIMAUCOURT
52;HLM LES BOUTONS D OR, RIMAUCOURT
52;LOT LA PETITE CHAMPAGNE, RIMAUCOURT
52;RTE NATIONALE 74, RIMAUCOURT
52;RUE DE L ABREUVOIR, RIMAUCOURT
52;RUE DES ACACIAS, RIMAUCOURT
52;RUE BEL AIR, RIMAUCOURT
52;RUE DES BOULEAUX, RIMAUCOURT
52;IMP DES BOUVREUILS, RIMAUCOURT
52;RUE DU CENTRE, RIMAUCOURT
52;RUE DES CERISIERS, RIMAUCOURT
52;RUE DE LA CHARME, RIMAUCOURT
52;RUE DE CHALVRAINES, RIMAUCOURT
52;RUE DE CHATEAU D EAU, RIMAUCOURT
52;RUE DE LA COTE HENARD, RIMAUCOURT
52;RUE DE LA COTE SAINT PIERRE, RIMAUCOURT
52;PL DECRES, RIMAUCOURT
52;RUE DROITE, RIMAUCOURT
52;RUE DES ERABLES, RIMAUCOURT
52;RUE DE LA GARE, RIMAUCOURT
52;IMP DES FAUVETTES, RIMAUCOURT
52;CHE DE LA FORET, RIMAUCOURT
52;PL DU FOURNEAU, RIMAUCOURT
52;RUE DU GENERAL LECLERC, RIMAUCOURT
52;RLE DES GLYCINES, RIMAUCOURT
52;IMP HACQUIN, RIMAUCOURT
52;IMP DES HIRONDELLES, RIMAUCOURT
52;RUE DU HUIT MAI, RIMAUCOURT
52;RUE JEAN MOULIN, RIMAUCOURT
52;RTE DE JOINVILLE, RIMAUCOURT
52;RUE JULES FERRY, RIMAUCOURT
52;PL DU 14 JUILLET, RIMAUCOURT
52;PL DE LA LIBERTE, RIMAUCOURT
52;PL DE LA MAIRIE, RIMAUCOURT
52;IMP DES MESANGES, RIMAUCOURT
52;RTE NATIONALE 74, RIMAUCOURT
52;RUE DE NEUFCHATEAU, RIMAUCOURT
52;RTE DE NOGENT, RIMAUCOURT
52;RUE DES OISEAUX, RIMAUCOURT
52;RUE DU ONZE NOVEMBRE, RIMAUCOURT
52;RUE DE LA PETITE CHAMPAGNE, RIMAUCOURT
52;RUE DU PRIEURE, RIMAUCOURT
52;RTE PRINCIPALE, RIMAUCOURT
52;IMP DES ROITELETS, RIMAUCOURT
52;IMP DES ROSSIGNOLS, RIMAUCOURT
52;RUE SAINTE COLOMBE, RIMAUCOURT
52;IMP DE LA SCIERIE, RIMAUCOURT
52;RUE VERDELET, RIMAUCOURT
52;RUE DE VERDUN, RIMAUCOURT
52;IMP DES VERGERS, RIMAUCOURT
52;CHE DES VIGNES, RIMAUCOURT
52;RUE DES AMARONS, RIVIERES-LE-BOIS
52;RTE DE LA CRAA, RIVIERES-LE-BOIS
52;RUE DU 10 JUIN 1488, RIVIERES-LE-BOIS
52;IMP DE LA FONTAINE, RIVIERES-LE-BOIS
52;RUE JEAN SERRE, RIVIERES-LE-BOIS
52;RUE DU LAVOIR, RIVIERES-LE-BOIS
52;RUE DE LA PERRIERE, RIVIERES-LE-BOIS
52;FRM DE LA CHARMOILLE, RIVIERE LES FOSSES
52;HAM DE PRESSANT, RIVIERE LES FOSSES
52;RTE DE BOUSSENOIS, RIVIERE LES FOSSES
52;RUE DES CHARRIERES, RIVIERE LES FOSSES
52;RUE DE CHEVILLE, RIVIERE LES FOSSES
52;SEN DES ESSARTS, RIVIERE LES FOSSES
52;RUE DU GALLOT, RIVIERE LES FOSSES
52;RUE DU GAUCHOT, RIVIERE LES FOSSES
52;CHE DE LA GOULETTE, RIVIERE LES FOSSES
52;RUE DE LA HOUTTE, RIVIERE LES FOSSES
52;RUE NEUVE, RIVIERE LES FOSSES
52;RUE DES PRINCEY, RIVIERE LES FOSSES
52;CHE DU VERNOIS, RIVIERE LES FOSSES
52;ROC LA ROCADE, RIVIERE LES FOSSES
52;RUE DES ROCHES, RIVIERE LES FOSSES
52;CHE DE VAUBAS, RIVIERE LES FOSSES
52;RUE DE VERNOIS, RIVIERE LES FOSSES
52;RUE DU CHEMIN NEUF, RIZAUCOURT-BUCHEY
52;CHE DES CHENEVIERES, RIZAUCOURT-BUCHEY
52;RUE CHEMIN DES VIGNES, RIZAUCOURT-BUCHEY
52;RUE HAUTE, RIZAUCOURT-BUCHEY
52;RUE DE LA HAUTE FONTAINE, RIZAUCOURT-BUCHEY
52;PL DE LA MAIRIE, RIZAUCOURT-BUCHEY
52;RLE DE LA MAIRIE, RIZAUCOURT-BUCHEY
52;RUE DE PICHOT, RIZAUCOURT-BUCHEY
52;RUE DE LA RUELLE, RIZAUCOURT-BUCHEY
52;RUE DU RUISSEAU, RIZAUCOURT-BUCHEY
52;RUE DE SAULCY, RIZAUCOURT-BUCHEY
52;IMP DU SOLEIL COUCHANT, RIZAUCOURT-BUCHEY
52;RUE DU TILLEUL, RIZAUCOURT-BUCHEY
52;RUE DE LA VERRERIE, RIZAUCOURT-BUCHEY
52;RUE DE VOGON, RIZAUCOURT-BUCHEY
52;RUE DE L'AUBEPINE, RIZAUCOURT-BUCHEY
52;RUE DU JUIN PRE, RIZAUCOURT-BUCHEY
52;RUE DU MOULIN A VENT, RIZAUCOURT-BUCHEY
52;RUE DES REUX, RIZAUCOURT-BUCHEY
52;RUE SAINTE COLOMBE, RIZAUCOURT-BUCHEY
52;RUE DE BUSSON, ROCHEFORT-SUR-LA-COTE
52;RTE DE CHANTRAINES, ROCHEFORT-SUR-LA-COTE
52;RUE DE CHANTRAINES, ROCHEFORT-SUR-LA-COTE
52;RUE DE LA COTOTTE, ROCHEFORT-SUR-LA-COTE
52;RUE DU DESSUS DE LA ROCHE, ROCHEFORT-SUR-LA-COTE
52;RUE DES FOURCHES, ROCHEFORT-SUR-LA-COTE
52;RUE GRANDE RUE, ROCHEFORT-SUR-LA-COTE
52;IMP DE LA ROCHE, ROCHEFORT-SUR-LA-COTE
52;RUE DE LA ROCHE, ROCHEFORT-SUR-LA-COTE
52;RUE DES SIMONS, ROCHEFORT-SUR-LA-COTE
52;LOT LE MEJEAN 1, ROCHES-SUR-MARNE
52;LOT LE MEJEAN 2, ROCHES-SUR-MARNE
52;LOT LE VERDELOT, ROCHES-SUR-MARNE
52;RUE AUGUSTE PESCHAUD, ROCHES-SUR-MARNE
52;RUE HENRI POUILLY, ROCHES-SUR-MARNE
52;RUE HENRI URBAIN, ROCHES-SUR-MARNE
52;RUE DE LA LIBERTE, ROCHES-SUR-MARNE
52;RUE DU MAL LECLERC, ROCHES-SUR-MARNE
52;RUE DE LA MARNE, ROCHES-SUR-MARNE
52;RLE MARTIN, ROCHES-SUR-MARNE
52;RUE DU MEJEAN, ROCHES-SUR-MARNE
52;RTE NATIONALE, ROCHES-SUR-MARNE
52;IMP PESCHAUD, ROCHES-SUR-MARNE
52;RUE DES PRESSOIRS, ROCHES-SUR-MARNE
52;RLE RICHARD, ROCHES-SUR-MARNE
52;RUE DU VERDELOT, ROCHES-SUR-MARNE
52;CR DU VERDELOT, ROCHES-SUR-MARNE
52;CHE DES CARRIERES, ROCHES-SUR-MARNE
52;CHE DU GRAND BAN, ROCHES-SUR-MARNE
52;CHE DU PETIT PONT, ROCHES-SUR-MARNE
52;CHE FERNAND RODARY, ROCHES-SUR-MARNE
52;RLE DE L EGLISE, ROCHES-SUR-MARNE
52;LOT DU VAL D AUJON, ROCHETAILLEE
52;RUE BASSE, ROCHETAILLEE
52;RUE DE BOURGOGNE, ROCHETAILLEE
52;RUE DU CHAPITRE, ROCHETAILLEE
52;RUE DES CORVEES, ROCHETAILLEE
52;RUE DE DIJON, ROCHETAILLEE
52;RUE DE L EGLISE, ROCHETAILLEE
52;PL DES HALLES, ROCHETAILLEE
52;RTE DE LONGEAU, ROCHETAILLEE
52;PL DE LA MAIRIE, ROCHETAILLEE
52;RUE LOT DU VAL D AUJON, ROCHETAILLEE
52;RUE DU MOULIN, ROCHETAILLEE
52;RUE DE L OUTRE, ROCHETAILLEE
52;RUE PRINCIPALE, ROCHETAILLEE
52;RTE DE VOISINES, ROCHETAILLEE
52;CHE DE LA ROCHE, ROCHETAILLEE
52;CHE DES ROUELLES, ROCHETAILLEE
52;LOT SAPRR, ROLAMPONT
52;CHE STRAT DU FORT DE ST M, ROLAMPONT
52;RUE DES ACCACIAS, ROLAMPONT
52;RUE D ALSACE, ROLAMPONT
52;IMP DE L'AYE, ROLAMPONT
52;RUE DE LA BARRE, ROLAMPONT
52;RUE BASSE, ROLAMPONT
52;RUE DE LA BERGERIE, ROLAMPONT
52;RUE BERNARD, ROLAMPONT
52;RUE DE CHAMPAGNE, ROLAMPONT
52;RTE DE CHANGEY, ROLAMPONT
52;RUE DES CHARMILLES, ROLAMPONT
52;RUE DU COIN, ROLAMPONT
52;RUE ROBERT COLLIN, ROLAMPONT
52;RUE DE LA COUDRE, ROLAMPONT
52;RUE JOSEPH CRESSOT, ROLAMPONT
52;RUE DE LA CROIX, ROLAMPONT
52;RUE DES DOCTEURS MARTIN, ROLAMPONT
52;RUE EDMOND LECLERC, ROLAMPONT
52;RUE DE L'EGLISE, ROLAMPONT
52;RUE DES ESPARGIS, ROLAMPONT
52;RUE DE LA FECHE, ROLAMPONT
52;RLE DE LA FECHE, ROLAMPONT
52;RUE DE LA FILATURE, ROLAMPONT
52;RUE DE LA FONTAINE, ROLAMPONT
52;AV DE LA GARE, ROLAMPONT
52;RUE DU GENERAL DE GAULLE, ROLAMPONT
52;RUE DU GOUTTEAU, ROLAMPONT
52;RUE GRANDE RUELLE, ROLAMPONT
52;RUE HENRI DURNE, ROLAMPONT
52;RUE DU 8 MAI, ROLAMPONT
52;RUE JEAN MOULIN, ROLAMPONT
52;CHE DU JEU DE QUILLES, ROLAMPONT
52;RUE DE LORRAINE, ROLAMPONT
52;PL DE LA MAIRIE, ROLAMPONT
52;RUE DE LA MAIRIE, ROLAMPONT
52;RUE DE LA MAIRIE A CHARMOILLES, ROLAMPONT
52;RTE DE MARAC, ROLAMPONT
52;RUE MAL DE LATTRE DE TASSIGNY, ROLAMPONT
52;RUE DE LA MARNE, ROLAMPONT
52;RUE DU MENNELET, ROLAMPONT
52;RUE DU MONSEL, ROLAMPONT
52;RUE DES NOISETIERS, ROLAMPONT
52;CHE DIT DU MOULIN A VENT, ROLAMPONT
52;RUE DE L'OSERAIE, ROLAMPONT
52;RUE DU PARADIS, ROLAMPONT
52;RUE DES PLATANES, ROLAMPONT
52;RUE DE LA POMMERAIE, ROLAMPONT
52;RUE DU PRIEURE, ROLAMPONT
52;RUE PRODHON, ROLAMPONT
52;RUE DU PUITS, ROLAMPONT
52;RUE JEAN ROBINET, ROLAMPONT
52;RUE DU RUAU, ROLAMPONT
52;RUE DU RUPT, ROLAMPONT
52;RTE DE SAINT MENGE, ROLAMPONT
52;RUE DE SAINT LOUP, ROLAMPONT
52;RUE DE LA SABOTERIE, ROLAMPONT
52;RUE DES TILLEULS, ROLAMPONT
52;RUE DU TROT MATELIN, ROLAMPONT
52;AV DE VERDUN, ROLAMPONT
52;RUE DES VIGNES, ROLAMPONT
52;CHE DE LA VIGNEULE, ROLAMPONT
52;RTE DE VILLIERS, ROLAMPONT
52;RUE DES VOIES DESSOUS, ROLAMPONT
52;RUE DE LA VOIE PROPRE, ROLAMPONT
52;RUE VOIE TRAVERSE, ROLAMPONT
52;RUE DU VOISIN, ROLAMPONT
52;LOT LA BELLE HERBE, ROMAIN-SUR-MEUSE
52;RUE DU CHATEAU, ROMAIN-SUR-MEUSE
52;RUE DES CISELIERS, ROMAIN-SUR-MEUSE
52;RUE DE LA FORET, ROMAIN-SUR-MEUSE
52;GR GRANDE RUE, ROMAIN-SUR-MEUSE
52;PL DE LA MAIRIE, ROMAIN-SUR-MEUSE
52;RUE DE LA MAIRIE, ROMAIN-SUR-MEUSE
52;RUE DU MOULIN DE DONA, ROMAIN-SUR-MEUSE
52;RUE DU MOULIN, ROMAIN-SUR-MEUSE
52;IMP DES ROCHES, ROMAIN-SUR-MEUSE
52;IMP DES ROCHOTTES, ROMAIN-SUR-MEUSE
52;RUE DES VIGNES, ROMAIN-SUR-MEUSE
52;RUE DE CERISIERES, ROUECOURT
52;RUE DE L EGLISE, ROUECOURT
52;RUE DU MOULIN, ROUECOURT
52;RUE PRINCIPALE, ROUECOURT
52;RUE TOMBOIS, ROUECOURT
52;RTE D AUBERIVE, ROUELLES
52;RUE DES COMMELLES, ROUELLES
52;RUE DE L'EGLISE, ROUELLES
52;GR GRAND RUE, ROUELLES
52;RTE DE VITRY, ROUELLES
52;RUE DU CARNOT, ROUGEUX
52;SEN DU CARNOT, ROUGEUX
52;RUE CHAMP DU MOULIN, ROUGEUX
52;CHE DE LA COTE AUX FOINS, ROUGEUX
52;RUE AUX FEES, ROUGEUX
52;RUE HAIE DE LANGRES, ROUGEUX
52;CHE DE LA HAIE DE LA ROCHE, ROUGEUX
52;RUE DES LAVANDIERES, ROUGEUX
52;RUE DE LA MAIRIE, ROUGEUX
52;RUE DE LA VIEILLE COTE, ROUGEUX
52;RUE DES ABEILLES, ROUVRES SUR AUBE
52;RUE DE L'ALAMBIC, ROUVRES SUR AUBE
52;RTE D AUBEPIERRE, ROUVRES SUR AUBE
52;RUE DE L EGLISE, ROUVRES SUR AUBE
52;RUE DU CHATEAU, ROUVRES SUR AUBE
52;RUE DU CHATELOT, ROUVRES SUR AUBE
52;RUE DE LA CHAUX, ROUVRES SUR AUBE
52;GR GRANDE RUE, ROUVRES SUR AUBE
52;RUE HAUTE, ROUVRES SUR AUBE
52;PL DE LA MAIRIE, ROUVRES SUR AUBE
52;IMP DU PIED D'ANE, ROUVRES SUR AUBE
52;RUE DU PONT, ROUVRES SUR AUBE
52;CAR DE LA POSTE, ROUVRES SUR AUBE
52;RUE DU PRE COURCELLE, ROUVRES SUR AUBE
52;RUE DU STADE, ROUVRES SUR AUBE
52;RUE DU TERREAU, ROUVRES SUR AUBE
52;RUE DE VOLURA, ROUVRES SUR AUBE
52;LOT DE LA ROCHE, ROUVROY-SUR-MARNE
52;LOT DE LA COURTE ROIE, ROUVROY-SUR-MARNE
52;ZONE ARTISANALE, ROUVROY-SUR-MARNE
52;LOT DU LECHOT, ROUVROY-SUR-MARNE
52;RUE DU CHATEAU, ROUVROY-SUR-MARNE
52;RUE COMBE BAUDREUIL, ROUVROY-SUR-MARNE
52;CHE DE L'ECLUSE, ROUVROY-SUR-MARNE
52;RUE DE L'EGLISE, ROUVROY-SUR-MARNE
52;CHE DES ELLIGREES, ROUVROY-SUR-MARNE
52;RUE DE LA GRAVIERE, ROUVROY-SUR-MARNE
52;CHE DE JEANBEROY, ROUVROY-SUR-MARNE
52;RLE DU LAVOIR, ROUVROY-SUR-MARNE
52;RUE DE LA FETE, ROUVROY-SUR-MARNE
52;RUE DU LOT CHAMPS LAGRANGE, ROUVROY-SUR-MARNE
52;RUE DU LOT DE LA COURTE ROIE, ROUVROY-SUR-MARNE
52;RUE DU LOT DE LA ROCHE, ROUVROY-SUR-MARNE
52;RUE DES MARRONNIERS, ROUVROY-SUR-MARNE
52;RUE DU MOULIN, ROUVROY-SUR-MARNE
52;CHE DU PORT, ROUVROY-SUR-MARNE
52;RUE DES TILLEULS, ROUVROY-SUR-MARNE
52;LOT DU CHATEAU, RUPT
52;LOT LA CROIX FERMEE, RUPT
52;CHE D'AVRIL, RUPT
52;RUE DE L'EGLISE, RUPT
52;RTE DE FERRIERES, RUPT
52;RUE DE LA FONTAINE, RUPT
52;RTE DE JOINVILLE, RUPT
52;RUE DU MOULIN, RUPT
52;RUE DES PLANTES, RUPT
52;RUE DU SENTIER D'AVIOT, RUPT
52;CHE DE GELIGNE, RUPT
52;RUE SOUS GELIGNE, RUPT
52;RTE DE RUPT, RUPT
52;RUE DU CHATEAU, RUPT
52;IMP DES HIRONDELLES, RUPT
52;CHE DU HONVAL, RUPT
52;RUE DU CHATEAU, SAILLY
52;RUE DE LA FONTAINE, SAILLY
52;RUE DU TARNIER, SAILLY
52;RUE DU TILLEUL, SAILLY
52;RUE DE LA TUILERIE, SAILLY
52;RUE SAINT MAURICE, SAILLY
52;RTE NATIONALE 74, SAINT-BLIN
52;RUE DU BOIS CHARERAT, SAINT-BLIN
52;RUE DES CERISIERS, SAINT-BLIN
52;RTE DE CHALVRAINES, SAINT-BLIN
52;RUE DE LA CHERVAU, SAINT-BLIN
52;RUE DE COCHONVILLE, SAINT-BLIN
52;RUE DES CRETS, SAINT-BLIN
52;RUE DE L EGLISE, SAINT-BLIN
52;AV DU GENERAL LECLERC, SAINT-BLIN
52;RUE DE L HOTEL DE VILLE, SAINT-BLIN
52;RUE D HUMBERVILLE, SAINT-BLIN
52;AV DE LA LIBERATION, SAINT-BLIN
52;RUE DES LONGUES ROIES, SAINT-BLIN
52;PL DU MONUMENT, SAINT-BLIN
52;N NATIONALE, SAINT-BLIN
52;RUE DU PETIT BOIS, SAINT-BLIN
52;RUE DES POMMIERS, SAINT-BLIN
52;RUE DES ROISES, SAINT-BLIN
52;IMP SAINT HUBERT, SAINT-BLIN
52;RUE DE SAINT HUBERT, SAINT-BLIN
52;RUE DU TENNIS, SAINT-BLIN
52;RUE DE LA TRAVERSE, SAINT-BLIN
52;RUE DES VERGERS, SAINT-BLIN
52;RUE DE LA VOIE ROBERT, SAINT-BLIN
52;RUE DE VRECOURT, SAINT-BLIN
52;CHE DE L'ECHELET, SAINT-BROINGT-LE-BOIS
52;RTE DE LA PLATRIERE, SAINT-BROINGT-LE-BOIS
52;RUE RENTE GABRIELLE, SAINT-BROINGT-LE-BOIS
52;RUE SAINT BENIGNE, SAINT-BROINGT-LE-BOIS
52;RUE DE LA SEIGNIERE, SAINT-BROINGT-LE-BOIS
52;CHE DU TROUOT, SAINT-BROINGT-LE-BOIS
52;LOT DE BORGEAILLE, SAINT-BROINGT-LES-FOSSES
52;LOT DU MOULIN A VENT, SAINT-BROINGT-LES-FOSSES
52;RUE DES BAILLIS, SAINT-BROINGT-LES-FOSSES
52;RUE DE LA BERGERIE, SAINT-BROINGT-LES-FOSSES
52;RTE DU CHEMIN NEUF, SAINT-BROINGT-LES-FOSSES
52;CHEM DE LA CRAATZ, SAINT-BROINGT-LES-FOSSES
52;CHEM DES CRAYS, SAINT-BROINGT-LES-FOSSES
52;RLE DE L EGLISE, SAINT-BROINGT-LES-FOSSES
52;PL DE LA FONTAINE, SAINT-BROINGT-LES-FOSSES
52;CHEM DES GORGES, SAINT-BROINGT-LES-FOSSES
52;CHEM DE LA GRANDE CHARRIERE, SAINT-BROINGT-LES-FOSSES
52;PL DU LAVOIR, SAINT-BROINGT-LES-FOSSES
52;CHE DU MOULIN, SAINT-BROINGT-LES-FOSSES
52;RUE ORANGE, SAINT-BROINGT-LES-FOSSES
52;IMP DE PENAUX, SAINT-BROINGT-LES-FOSSES
52;SEN DE LA PETITE COTE, SAINT-BROINGT-LES-FOSSES
52;RUE DE LA PETITE ROUTE, SAINT-BROINGT-LES-FOSSES
52;RUE DU PONT, SAINT-BROINGT-LES-FOSSES
52;RUE DU PUITS, SAINT-BROINGT-LES-FOSSES
52;RUE ROIDEAU, SAINT-BROINGT-LES-FOSSES
52;RUE DE LA ROILOTTE, SAINT-BROINGT-LES-FOSSES
52;SEN DU TERTRE, SAINT-BROINGT-LES-FOSSES
52;RUE DE LA TOUR, SAINT-BROINGT-LES-FOSSES
52;CHE DU VERNOIS, SAINT-BROINGT-LES-FOSSES
52;RUE DE BEAUREGARD, SAINT-CIERGUES
52;CHE DU BERGER, SAINT-CIERGUES
52;CHE DE BUET, SAINT-CIERGUES
52;IMP DES CABANDES, SAINT-CIERGUES
52;RTE DU CHATEAU D'EAU, SAINT-CIERGUES
52;RUE DU CLOS, SAINT-CIERGUES
52;IMP DES COMELLES, SAINT-CIERGUES
52;IMP DU COTEAU, SAINT-CIERGUES
52;RUE DE L'EGLISE, SAINT-CIERGUES
52;RUE DE LA GRANDE FONTAINE, SAINT-CIERGUES
52;RUE DU LAC, SAINT-CIERGUES
52;RTE DE LANGRES, SAINT-CIERGUES
52;RUE DE LA MAIRIE, SAINT-CIERGUES
52;RTE DU MORGON, SAINT-CIERGUES
52;CHE DU MOULIN, SAINT-CIERGUES
52;RUE DU MURET, SAINT-CIERGUES
52;RUE DES ORMES, SAINT-CIERGUES
52;RTE DE PERRANCEY, SAINT-CIERGUES
52;CHE DES ROCHES, SAINT-CIERGUES
52;RUE DES ROISES, SAINT-CIERGUES
52;RUE SAINT CYR, SAINT-CIERGUES
52;RUE SAINTE JULITTE, SAINT-CIERGUES
52;IMP DES SOURCES, SAINT-CIERGUES
52;RUE DE TACHENAIRE, SAINT-CIERGUES
52;CHE DU TIALEVE, SAINT-CIERGUES
52;RUE DE LA VERONNE, SAINT-CIERGUES
52;RUE DES VIGNES, SAINT-CIERGUES
52;CHE DE VIRELOUP, SAINT-CIERGUES
52;QUA DES BALCONS, SAINT-DIZIER
52;QUA DU CRASSIER, SAINT-DIZIER
52;QUA ENTRE DEUX EAUX, SAINT-DIZIER
52;QUA DES FOURS A COKE, SAINT-DIZIER
52;CITE DE LA MARNE, SAINT-DIZIER
52;QUA DE LA MARNE, SAINT-DIZIER
52;QUA DE LA PLAINE, SAINT-DIZIER
52;QUA DES SOEURS, SAINT-DIZIER
52;LOT DES CASTORS, SAINT-DIZIER
52;LOT LESPRIT, SAINT-DIZIER
52;CHE DE L ABBAYE, SAINT-DIZIER
52;RUE DE L ABBE CORNU, SAINT-DIZIER
52;RUE DES AGNES, SAINT-DIZIER
52;RUE DES ABEILLES, SAINT-DIZIER
52;RUE ALBERT SCHWEITZER, SAINT-DIZIER
52;PL DES ALCIDE, SAINT-DIZIER
52;RUE ALBERT THOMAS, SAINT-DIZIER
52;CR DIT ANCIEN CHE D'HALLIGNIC, SAINT-DIZIER
52;RUE ALFRED DE MUSSET, SAINT-DIZIER
52;RUE DES ALOUETTES, SAINT-DIZIER
52;RUE D ALSACE, SAINT-DIZIER
52;AV D ALSACE LORRAINE, SAINT-DIZIER
52;IMP D ALSACE LORRAINE, SAINT-DIZIER
52;RUE ANATOLE FRANCE, SAINT-DIZIER
52;CHE D ANCERVILLE, SAINT-DIZIER
52;RUE DES ANDRE, SAINT-DIZIER
52;RTE D'ANCERVILLE, SAINT-DIZIER
52;RUE L ANCIEN PORT DE LA MARNE, SAINT-DIZIER
52;RUE ANDRE BARBAUX, SAINT-DIZIER
52;RUE ANDRE CHENIER, SAINT-DIZIER
52;RUE ANDRE GIGANDET, SAINT-DIZIER
52;PL ANDRE MALRAUX, SAINT-DIZIER
52;CHE DE L ARGENTE LIGNE, SAINT-DIZIER
52;RUE ANDRE THEURIET, SAINT-DIZIER
52;RUE ANDRE THEURIET PROLONGEE, SAINT-DIZIER
52;PL ARISTIDE BRIAND, SAINT-DIZIER
52;RUE ARISTIDE MAILLOL, SAINT-DIZIER
52;RUE DE L ARQUEBUSE, SAINT-DIZIER
52;ALL D ARTOIS, SAINT-DIZIER
52;RUE AUGUSTE RENOIR, SAINT-DIZIER
52;RUE AUGUSTE RODIN, SAINT-DIZIER
52;RUE DE L AUNE, SAINT-DIZIER
52;RUE DE L AUNE CIT BAYARD, SAINT-DIZIER
52;RTE DE BAR LE DUC, SAINT-DIZIER
52;RUE DE LA BATELLERIE, SAINT-DIZIER
52;AV DE BELLE FORET SUR MARNE, SAINT-DIZIER
52;PL BECQUEY, SAINT-DIZIER
52;RUE DE L'ABBE GRUET, SAINT-DIZIER
52;RPT DES BAS FOURNEAUX, SAINT-DIZIER
52;RUE DE LA BENIVALLE, SAINT-DIZIER
52;AV BENOIT FRACHON, SAINT-DIZIER
52;ALL DE LA BERNARDINE, SAINT-DIZIER
52;RUE DE LA BERNARDINE, SAINT-DIZIER
52;RUE BERTHELOT, SAINT-DIZIER
52;RUE DE BEURJANT, SAINT-DIZIER
52;CR DU BIEZ DE L'ETRE, SAINT-DIZIER
52;MAIL BLAISE PASCAL, SAINT-DIZIER
52;RUE DES BLEUETS, SAINT-DIZIER
52;RUE DU BOIS DU ROI, SAINT-DIZIER
52;RUE DU BOCARDAGE, SAINT-DIZIER
52;RUE DU BOIS, SAINT-DIZIER
52;CHE DES BONNETTES, SAINT-DIZIER
52;RUE BONNOR, SAINT-DIZIER
52;RUE BORIS VIAN, SAINT-DIZIER
52;RUE DE BOURGOGNE, SAINT-DIZIER
52;RUE DES BRAGARDS, SAINT-DIZIER
52;RUE DU BRIGADIER ALBERT, SAINT-DIZIER
52;CHE DES BUTTES, SAINT-DIZIER
52;RUE BUFFON, SAINT-DIZIER
52;RUE CAMILLE CLAUDEL, SAINT-DIZIER
52;IMP CAMILLE DESMOULINS, SAINT-DIZIER
52;RUE CAMILLE SAINT SAENS, SAINT-DIZIER
52;RUE CAMILLE FLAMMARION, SAINT-DIZIER
52;RUE DU CANARD SAUVAGE, SAINT-DIZIER
52;RUE DU CANAL DE LA FORGE, SAINT-DIZIER
52;RUE DU CANAL MARNE SAONE, SAINT-DIZIER
52;ALL CAMILLE FLAMMARION, SAINT-DIZIER
52;RUE DU CAPITAINE EON, SAINT-DIZIER
52;RUE DES CAPUCINS, SAINT-DIZIER
52;RUE DES CARPIERES, SAINT-DIZIER
52;RUE DES CHARDONNERETS, SAINT-DIZIER
52;RUE CATEL, SAINT-DIZIER
52;ALL DE LA CHAINERIE, SAINT-DIZIER
52;RUE DE CHAMPAGNE, SAINT-DIZIER
52;RUE DE LA CHAINERIE, SAINT-DIZIER
52;RUE CHARLES GOUNOD, SAINT-DIZIER
52;RUE CHARLES LUCOT, SAINT-DIZIER
52;RUE CHARLES ADOLPHE DRIOUT, SAINT-DIZIER
52;RUE CHARLES QUINT, SAINT-DIZIER
52;PL CHARLIE CHAPLIN, SAINT-DIZIER
52;RLE CHARLOT, SAINT-DIZIER
52;AV DU CHENE SAINT AMAND, SAINT-DIZIER
52;ALL DU CHATEAU RENARD, SAINT-DIZIER
52;RUE DU CHATEAU RENARD, SAINT-DIZIER
52;RUE DES CHEVREUILS, SAINT-DIZIER
52;RUE DES CIGALES, SAINT-DIZIER
52;RTE FORESTIERE DES CHOMEURS, SAINT-DIZIER
52;CHE DU CIMETIERE DE GIGNY, SAINT-DIZIER
52;CD 2, SAINT-DIZIER
52;ALL CLAUDE MONET, SAINT-DIZIER
52;CR DIT DE CLEFMONT, SAINT-DIZIER
52;SEN DE CLEFMONT, SAINT-DIZIER
52;RUE DES CLEFMONTS, SAINT-DIZIER
52;CR DIT DU CLOS LAPIERRE, SAINT-DIZIER
52;CHE DU CLOS LAPIERRE, SAINT-DIZIER
52;CHE DU CLOSMORTIER, SAINT-DIZIER
52;CHE DU CLOSOT, SAINT-DIZIER
52;CHE DU CLOS SAINT JEAN, SAINT-DIZIER
52;RUE DES COCCINELLES, SAINT-DIZIER
52;RUE COLETTE, SAINT-DIZIER
52;RUE DES COLIBRIS, SAINT-DIZIER
52;BD DU COLONEL ENTREVAN, SAINT-DIZIER
52;PAS DU COLONEL RAYNAL, SAINT-DIZIER
52;RUE DU COLONEL RAYNAL, SAINT-DIZIER
52;RUE DES COQUELICOTS, SAINT-DIZIER
52;AV DE LA CORNEE RENARD, SAINT-DIZIER
52;RUE DE LA COMMUNE DE PARIS, SAINT-DIZIER
52;RUE CORNEILLE, SAINT-DIZIER
52;ALL DE CORSE, SAINT-DIZIER
52;RUE COSTES ET BELLONTE, SAINT-DIZIER
52;RUE DU COUCHY, SAINT-DIZIER
52;RUE DES CRIQUETS, SAINT-DIZIER
52;RUE CROIX COLBERT, SAINT-DIZIER
52;SEN DE LA CROIX COLBERT, SAINT-DIZIER
52;CHE DE LA CROIX MAUGERY, SAINT-DIZIER
52;RUE DU CUGNOT, SAINT-DIZIER
52;ALL DANIELLE CASANOVA, SAINT-DIZIER
52;RUE DANTON, SAINT-DIZIER
52;RUE DARIUS MILHAUD, SAINT-DIZIER
52;AV DES DEUX PIGEONS, SAINT-DIZIER
52;IMP DEVANT L ECOLE, SAINT-DIZIER
52;CD N 111, SAINT-DIZIER
52;N 4 DEVIATION, SAINT-DIZIER
52;RLE DU DIABLE, SAINT-DIZIER
52;RUE DIDEROT, SAINT-DIZIER
52;RUE 19 3 62 CESSEZ LE FEU EN A, SAINT-DIZIER
52;CR DIT CHEMIN DE DESSERTE, SAINT-DIZIER
52;RUE DU DOCTEUR CHARDIN, SAINT-DIZIER
52;RUE DOCTEUR DESPRES, SAINT-DIZIER
52;RUE DOCTEUR MOUGEOT, SAINT-DIZIER
52;RUE DE L ECOLE, SAINT-DIZIER
52;RUE DE L'ECHEVIN BAUDESSON, SAINT-DIZIER
52;AV EDGARD PISANI, SAINT-DIZIER
52;RUE DES ECUYERS, SAINT-DIZIER
52;RUE EDOUARD CHAMBRE, SAINT-DIZIER
52;RUE ELSA TRIOLET, SAINT-DIZIER
52;RUE EMILE GIROS, SAINT-DIZIER
52;CHE DE L EGLANTINE, SAINT-DIZIER
52;PL EMILE MAUGUET, SAINT-DIZIER
52;RUE EMILE MAUGUET, SAINT-DIZIER
52;PL EMILE ZOLA, SAINT-DIZIER
52;RUE EMILE ZOLA, SAINT-DIZIER
52;RUE DE L EPINOTTE, SAINT-DIZIER
52;ALL ERNEST RENAN, SAINT-DIZIER
52;PL ERNEST RENAN, SAINT-DIZIER
52;RUE ERNEST RENAN, SAINT-DIZIER
52;RUE DE L ETANCHE, SAINT-DIZIER
52;CHE DE L ETANG ROZET, SAINT-DIZIER
52;AV DES ETATS UNIS, SAINT-DIZIER
52;ALL DES ETURBEES, SAINT-DIZIER
52;RUE DES ETURBEES, SAINT-DIZIER
52;RUE DES ETOILES, SAINT-DIZIER
52;CR DE LA FAVARDE, SAINT-DIZIER
52;RUE DE LA FAVARDE, SAINT-DIZIER
52;PL DE L EUROPE, SAINT-DIZIER
52;RUE FERDINAND BUISSON, SAINT-DIZIER
52;ALL DE FLANDRE, SAINT-DIZIER
52;ALL DE LA FOSSE CADET, SAINT-DIZIER
52;RUE DE LA FOSSE CADET, SAINT-DIZIER
52;RUE DU FORT CARRE, SAINT-DIZIER
52;IMP DES FOURMIS, SAINT-DIZIER
52;ALL DE FRANCHE COMTE, SAINT-DIZIER
52;RUE FRANCOIS 1 ER, SAINT-DIZIER
52;RUE DES FRANCOISE, SAINT-DIZIER
52;RUE FRANCOIS RUDE, SAINT-DIZIER
52;RUE FRANZ LISZT, SAINT-DIZIER
52;RUE GAMBETTA, SAINT-DIZIER
52;RUE GASTON BACHELARD, SAINT-DIZIER
52;PL DU GENERAL DE GAULLE, SAINT-DIZIER
52;AV DU GENERAL GIRAUD, SAINT-DIZIER
52;PL DU MARECHAL LECLERC, SAINT-DIZIER
52;IMP DU GENERAL MAISTRE, SAINT-DIZIER
52;RUE DU GENERAL MAISTRE, SAINT-DIZIER
52;AV DU GENERAL SARRAIL, SAINT-DIZIER
52;RUE GEORGE SAND, SAINT-DIZIER
52;SQ GEORGES BRASSENS, SAINT-DIZIER
52;SEN DE LA GRANDE PIECE, SAINT-DIZIER
52;IMP DU GRAND CHANTIER, SAINT-DIZIER
52;RUE GODARD JEANSON, SAINT-DIZIER
52;RUE GRANDE RUE, SAINT-DIZIER
52;RUE DES GREVES, SAINT-DIZIER
52;SEN DES GREVES, SAINT-DIZIER
52;CHE DES GREVES, SAINT-DIZIER
52;RUE GASTON PLANTE, SAINT-DIZIER
52;ALL GERMAIN PIN, SAINT-DIZIER
52;RUE GODARD BRULLIARD, SAINT-DIZIER
52;RUE GRIGNON, SAINT-DIZIER
52;RUE DES GRILLONS, SAINT-DIZIER
52;RUE GUY CHANFRAULT, SAINT-DIZIER
52;RUE GUSTAVE COURBET, SAINT-DIZIER
52;ALL GUSTAVE EIFFEL, SAINT-DIZIER
52;RUE GUY DE BOURBON, SAINT-DIZIER
52;RUE DES HAUTS FOSSES, SAINT-DIZIER
52;RUE DES HENRI, SAINT-DIZIER
52;PL HENRI BARBUSSE, SAINT-DIZIER
52;RUE HENRI MATISSE, SAINT-DIZIER
52;RUE HENRI IV, SAINT-DIZIER
52;RUE HENRI QUERUEL, SAINT-DIZIER
52;BD HENRI DUNANT, SAINT-DIZIER
52;RUE HENRY BORDEAUX, SAINT-DIZIER
52;RUE DES HIRONDELLES, SAINT-DIZIER
52;CAR HENRI ROLLIN, SAINT-DIZIER
52;RUE HECTOR GUIMARD, SAINT-DIZIER
52;RUE DE HOERICOURT, SAINT-DIZIER
52;RUE HUBERT FISBACQ, SAINT-DIZIER
52;CHE DE L HORIZON, SAINT-DIZIER
52;PL DU HUIT MAI 1945, SAINT-DIZIER
52;RUE DES IRIS, SAINT-DIZIER
52;IMP DES JACQUES, SAINT-DIZIER
52;AV JACQUES MONOD, SAINT-DIZIER
52;CHE DU JARDINOT, SAINT-DIZIER
52;RLE DES JARDINS, SAINT-DIZIER
52;RUE JEAN CAMUS, SAINT-DIZIER
52;RUE JEAN BUAT, SAINT-DIZIER
52;RUE JEAN CASSOU, SAINT-DIZIER
52;RUE JEAN DE LA FONTAINE, SAINT-DIZIER
52;ALL JEAN FRANCOIS LESCUYER, SAINT-DIZIER
52;RUE JEAN JACQUES ROUSSEAU, SAINT-DIZIER
52;PL JEAN JAURES, SAINT-DIZIER
52;RUE JEAN JAURES, SAINT-DIZIER
52;RUE DES JEAN LOUIS, SAINT-DIZIER
52;RUE JEAN JAURES CITES BAYARD, SAINT-DIZIER
52;RUE ESPACE JEAN MEFFERT, SAINT-DIZIER
52;RUE JEAN LURCAT, SAINT-DIZIER
52;ALL JEAN MOULIN, SAINT-DIZIER
52;AV JEAN PIERRE TIMBAUD, SAINT-DIZIER
52;RUE JEAN PHILIPPE RAMEAU, SAINT-DIZIER
52;RUE JEAN MARIE LEHN, SAINT-DIZIER
52;RUE JEAN VILAR, SAINT-DIZIER
52;RUE JEANNE D ARC, SAINT-DIZIER
52;RTE DE JOINVILLE, SAINT-DIZIER
52;RUE DES JONQUILLES, SAINT-DIZIER
52;IMP DES JULES, SAINT-DIZIER
52;RUE DES JULIETTE, SAINT-DIZIER
52;IMP DE JUPITER, SAINT-DIZIER
52;RUE JULES GUESDE, SAINT-DIZIER
52;RUE JULES RENARD, SAINT-DIZIER
52;RUE JULES VALLES, SAINT-DIZIER
52;RUE JUDITH RESNIK, SAINT-DIZIER
52;RUE JUMERET, SAINT-DIZIER
52;RUE DES LACHATS, SAINT-DIZIER
52;RUE LALANDE, SAINT-DIZIER
52;RUE LAMARTINE, SAINT-DIZIER
52;RUE DES LAMINEURS, SAINT-DIZIER
52;ALL DES LAMINOIRS, SAINT-DIZIER
52;CR DIT LATERAL, SAINT-DIZIER
