58;RTE DE MATRAY, ST-ANDRE-EN-MORVAN
58;IMP DES MESANGES, ST-ANDRE-EN-MORVAN
58;CHE DE MEULOT, ST-ANDRE-EN-MORVAN
58;RTE DE MONTAT, ST-ANDRE-EN-MORVAN
58;RTE DE MORLIN, ST-ANDRE-EN-MORVAN
58;CHE DE LA NESLE, ST-ANDRE-EN-MORVAN
58;CHE DES ORGES, ST-ANDRE-EN-MORVAN
58;CHE DU PRE AUX PORTES, ST-ANDRE-EN-MORVAN
58;COUR DU PRE NONCLE, ST-ANDRE-EN-MORVAN
58;PL ROBERT MELE, ST-ANDRE-EN-MORVAN
58;COUR DE LA SAVENEE, ST-ANDRE-EN-MORVAN
58;RTE DE ST ANDRE, ST-ANDRE-EN-MORVAN
58;CHE DES TEURLEES, ST-ANDRE-EN-MORVAN
58;RTE DE TILLEUL, ST-ANDRE-EN-MORVAN
58;CHE DU TOT, ST-ANDRE-EN-MORVAN
58;RTE D'USY, ST-ANDRE-EN-MORVAN
58;CHE DE VAULEVELLE, ST-ANDRE-EN-MORVAN
58;CHE DE VEZELAY, ST-ANDRE-EN-MORVAN
58;CHE DE LA VIGNE, ST-ANDRE-EN-MORVAN
58;RUE DES CANES, ST-AUBIN-DES-CHAUMES
58;RUE DE LA COTE, ST-AUBIN-DES-CHAUMES
58;CHEM DE LA GARDE, ST-AUBIN-DES-CHAUMES
58;RUE J-B JOURDAN, ST-AUBIN-DES-CHAUMES
58;RUE DU PAVE, ST-AUBIN-DES-CHAUMES
58;RUE POITRAT, ST-AUBIN-DES-CHAUMES
58;CHEM DE ST ROCH, ST-AUBIN-DES-CHAUMES
58;RUE DU QUARRE, ST-AUBIN-DES-CHAUMES
58;RUE DES TOURS, ST-AUBIN-DES-CHAUMES
58;RUE DE LA VALLEE, ST-AUBIN-DES-CHAUMES
58;RUE DU VIEUX PAVE, ST-AUBIN-DES-CHAUMES
58;CHE DE L'ARBORETUM, ST-AUBIN-LES-FORGES
58;CHE DU BATTEUR, ST-AUBIN-LES-FORGES
58;RTE DE BEAUMONT, ST-AUBIN-LES-FORGES
58;RTE DE LA BERTRANGE, ST-AUBIN-LES-FORGES
58;CHE DU BOIS, ST-AUBIN-LES-FORGES
58;CHE DU BOUCARD, ST-AUBIN-LES-FORGES
58;RTE DES BRULEES, ST-AUBIN-LES-FORGES
58;CHE DES CHAGNATS, ST-AUBIN-LES-FORGES
58;RTE DE CHAMILLY, ST-AUBIN-LES-FORGES
58;CHE DES CHANOINES, ST-AUBIN-LES-FORGES
58;RUE DES CHARRONS, ST-AUBIN-LES-FORGES
58;RTE DU CHATEAU, ST-AUBIN-LES-FORGES
58;RTE DU CHENE BABAUD, ST-AUBIN-LES-FORGES
58;RUE DU COLOMBIER, ST-AUBIN-LES-FORGES
58;CHE DU COLOMBIER, ST-AUBIN-LES-FORGES
58;CHE DE LA COMMARDERIE, ST-AUBIN-LES-FORGES
58;RUE DES COMTES, ST-AUBIN-LES-FORGES
58;RUE DES CREMELLES, ST-AUBIN-LES-FORGES
58;RUE DU CROT, ST-AUBIN-LES-FORGES
58;CHE DU CROT CANARD, ST-AUBIN-LES-FORGES
58;CHE DES DOLINES, ST-AUBIN-LES-FORGES
58;CHE DES DOUNES, ST-AUBIN-LES-FORGES
58;CHE DE LA DOUE, ST-AUBIN-LES-FORGES
58;RUE DE L'ECOLE, ST-AUBIN-LES-FORGES
58;CHE DES ECOLIERS, ST-AUBIN-LES-FORGES
58;CHE DES FONTAINES, ST-AUBIN-LES-FORGES
58;RTE DE LA FORET, ST-AUBIN-LES-FORGES
58;PL DE FORGEBAS, ST-AUBIN-LES-FORGES
58;RUE DE FRASNAY, ST-AUBIN-LES-FORGES
58;CHE DE LA GAGNEPINERIE, ST-AUBIN-LES-FORGES
58;IMP DU GUE, ST-AUBIN-LES-FORGES
58;RTE DE GUERIGNY, ST-AUBIN-LES-FORGES
58;RTE DE LA CHARITE, ST-AUBIN-LES-FORGES
58;IMP DES LAVANDIERES, ST-AUBIN-LES-FORGES
58;RUE DU LAVOIR, ST-AUBIN-LES-FORGES
58;PL DE LA LIBERTE, ST-AUBIN-LES-FORGES
58;CHE DU LOUP, ST-AUBIN-LES-FORGES
58;IMP DE LA VIEILLE MANILLE, ST-AUBIN-LES-FORGES
58;RTE DE LA MERLINERIE, ST-AUBIN-LES-FORGES
58;RTE DE LA MIRANDOLE, ST-AUBIN-LES-FORGES
58;CHE DU MONTEGUILLON, ST-AUBIN-LES-FORGES
58;IMP DE MONTIVERT, ST-AUBIN-LES-FORGES
58;IMP DES MURAILLES, ST-AUBIN-LES-FORGES
58;CHE DES PECHATS, ST-AUBIN-LES-FORGES
58;RTE DE LA PINAUDERIE, ST-AUBIN-LES-FORGES
58;RTE DE POISEUX, ST-AUBIN-LES-FORGES
58;CHE DES PRES, ST-AUBIN-LES-FORGES
58;CHE DE LA ROCHE, ST-AUBIN-LES-FORGES
58;RTE DE SICHAMPS, ST-AUBIN-LES-FORGES
58;CHE DE LA SOURCE, ST-AUBIN-LES-FORGES
58;RTE DE THOU, ST-AUBIN-LES-FORGES
58;RUE DE LA TUILERIE, ST-AUBIN-LES-FORGES
58;RTE DES GRANDES VALLEES, ST-AUBIN-LES-FORGES
58;RTE DES PETITES VALLEES, ST-AUBIN-LES-FORGES
58;RUE DES VERGERS, ST-AUBIN-LES-FORGES
58;RTE DE VINGEUX, ST-AUBIN-LES-FORGES
58;RUE DE LA BADELLE, SAINT-BENIN-D AZY
58;RUE BAUDIN, SAINT-BENIN-D AZY
58;CHE DE BELLEVUE, SAINT-BENIN-D AZY
58;RUE DU BOIS, SAINT-BENIN-D AZY
58;CHE DU BOIS DES HATES, SAINT-BENIN-D AZY
58;IMP DU BOIS DIOT, SAINT-BENIN-D AZY
58;CHE DE LA BUISSONNERIE, SAINT-BENIN-D AZY
58;RUE DES BROSSES, SAINT-BENIN-D AZY
58;RUE DES BRIOTS, SAINT-BENIN-D AZY
58;RUE DE CASTIGNIERE, SAINT-BENIN-D AZY
58;RUE CLAUDE MONTARON, SAINT-BENIN-D AZY
58;RTE DE CIZELY, SAINT-BENIN-D AZY
58;CHE DU CHAMP MARTIN, SAINT-BENIN-D AZY
58;IMP DES CHAMPS MARION, SAINT-BENIN-D AZY
58;CHE DU CHANGIN, SAINT-BENIN-D AZY
58;CHE DES CHASSIGNOLES, SAINT-BENIN-D AZY
58;RUE DES BARBOULOTTES, SAINT-BENIN-D AZY
58;RTE DE CERCY-LA-TOUR, SAINT-BENIN-D AZY
58;RUE DE CLOCHER, SAINT-BENIN-D AZY
58;CHE DE LA COUR CHARIOT, SAINT-BENIN-D AZY
58;RUE GILBERT CLAIR, SAINT-BENIN-D AZY
58;CHE DE LA CROIX, SAINT-BENIN-D AZY
58;RUE DES CINQ SOURCES, SAINT-BENIN-D AZY
58;RUE DE LA FONTAINE, SAINT-BENIN-D AZY
58;RUE DU DOCTEUR FRANCK BERNARD, SAINT-BENIN-D AZY
58;RUE FRANCOIS MITTERRAND, SAINT-BENIN-D AZY
58;IMP DU FOUR BANAL, SAINT-BENIN-D AZY
58;RUE FRANCOIS ARCHER, SAINT-BENIN-D AZY
58;PL DE LA GAIETE, SAINT-BENIN-D AZY
58;AV GAMBETTA, SAINT-BENIN-D AZY
58;AV DE LA GARE, SAINT-BENIN-D AZY
58;RUE HELIOS, SAINT-BENIN-D AZY
58;RUE HENRI BARBUSSE, SAINT-BENIN-D AZY
58;RUE DE L HUILERIE, SAINT-BENIN-D AZY
58;CHE DE L'IXEURE, SAINT-BENIN-D AZY
58;RUE JACQUES DE SAINT PHALLE, SAINT-BENIN-D AZY
58;PL JEAN BION, SAINT-BENIN-D AZY
58;RTE D IMPHY, SAINT-BENIN-D AZY
58;RUE JEAN FOURASTIE, SAINT-BENIN-D AZY
58;RUE MARCEL DARCHEVILLE, SAINT-BENIN-D AZY
58;RUE MARTIN DES AMOGNES, SAINT-BENIN-D AZY
58;RUE DU LAVOIR, SAINT-BENIN-D AZY
58;SQ DE LA LIBERTE, SAINT-BENIN-D AZY
58;CHE DES MERATS, SAINT-BENIN-D AZY
58;RUE DU MONT BERT, SAINT-BENIN-D AZY
58;RTE DE MONTGOUBLIN, SAINT-BENIN-D AZY
58;RUE DE LA PRINCESSE DE CROY, SAINT-BENIN-D AZY
58;RUE DU MONTSAVAULT, SAINT-BENIN-D AZY
58;RUE DU MOULIN, SAINT-BENIN-D AZY
58;RUE LE PONT DE PAILLOT, SAINT-BENIN-D AZY
58;CHE DU PUITS, SAINT-BENIN-D AZY
58;RUE DU 4 SEPTEMBRE, SAINT-BENIN-D AZY
58;PL DE LA REPUBLIQUE, SAINT-BENIN-D AZY
58;RTE DE SAINT FIRMIN, SAINT-BENIN-D AZY
58;RTE DE SAUVRY, SAINT-BENIN-D AZY
58;CHE DES SOURCES, SAINT-BENIN-D AZY
58;RUE THIERS, SAINT-BENIN-D AZY
58;RUE VICTOR FREBAULT, SAINT-BENIN-D AZY
58;RUE VICTOR HUGO, SAINT-BENIN-D AZY
58;RUE DU LOT HELIOS, SAINT-BENIN-D AZY
58;RUE DU LOT DE MAGEREUIL, SAINT-BENIN-D AZY
58;RUE DE MAGEREUIL, SAINT-BENIN-D AZY
58;PL PAUL DOUMER, SAINT-BENIN-D AZY
58;IMP DU CHAMP DE FOIRE, SAINT-BENIN-D AZY
58;RUE PIERRE PETIT, SAINT-BENIN-D AZY
58;CHE DE LA MARE ABEL, ST BONNOT
58;RTE D'ALLIGNY, ST-BRISSON
58;RTE D'AUTUN, ST-BRISSON
58;RTE D'AVALLON, ST-BRISSON
58;CHE D'ECHEINTRE MEULET, ST-BRISSON
58;CHE DE CHAMP NERRE, ST-BRISSON
58;RTE DE DUN, ST-BRISSON
58;CHE DE L'ECHEINTRE D'ARRET, ST-BRISSON
58;CHE DE L'ECHEINTRE DES ANGES, ST-BRISSON
58;IMP DE L'ETANG, ST-BRISSON
58;CHE DE LA CORNE DES CHAUMES, ST-BRISSON
58;RTE DE LA FAYE, ST-BRISSON
58;IMP DE LA FONTAINE, ST-BRISSON
58;CHE DE LA FORGE, ST-BRISSON
58;CHE DE LA VIE GROS CHENE, ST-BRISSON
58;RTE DE SAULIEU, ST-BRISSON
58;CHE DES BARDEVAUX, ST-BRISSON
58;CHE DES BOIS DE LA COUPE, ST-BRISSON
58;RTE DES BRUYERES, ST-BRISSON
58;CHE DES CHAMPS DERRIERE, ST-BRISSON
58;RTE DES CLOISEAUX, ST-BRISSON
58;CHE DES ETOULES, ST-BRISSON
58;CHE DES GEAIS, ST-BRISSON
58;CHE DES HETRES, ST-BRISSON
58;IMP DES NOISETIERS, ST-BRISSON
58;CHE DES PETITES ROBES, ST-BRISSON
58;IMP DES POITEREINES, ST-BRISSON
58;RTE DES PRES DU REUX, ST-BRISSON
58;CHE DES PRES GUIOTS, ST-BRISSON
58;CHE DES RONCENETS, ST-BRISSON
58;CHE DES VERNIS, ST-BRISSON
58;CHE DU CARRE ROUGE, ST-BRISSON
58;CHE DU CHAGNY, ST-BRISSON
58;CHE DU CHAMP PIGNOLET, ST-BRISSON
58;CHE DU CHATEAU D'EAU, ST-BRISSON
58;CHE DU FURIOT, ST-BRISSON
58;CHE DU LAVOIR, ST-BRISSON
58;CHE DU MOULIN, ST-BRISSON
58;RTE DU PRE DESSOUS, ST-BRISSON
58;CHE DU PUITS, ST-BRISSON
58;CHE DU THEURAIS, ST-BRISSON
58;IMP DU VERGER, ST-BRISSON
58;CHE DU VIEUX CHATEAU, ST-BRISSON
58;PL DU 19 MARS 1962, ST-BRISSON
58;RUE SIMON ANDRE, ST-BRISSON
58;RTE DE L'ACOTIN, SAINTE COLOMBE DES BOIS
58;CHE DE BELLARY, SAINTE COLOMBE DES BOIS
58;RTE DE CHAMPCELEE, SAINTE COLOMBE DES BOIS
58;RTE DES CHAMPS VAUDREY, SAINTE COLOMBE DES BOIS
58;RTE DE CHATEAUNEUF, SAINTE COLOMBE DES BOIS
58;PL DE L'EGLISE, SAINTE COLOMBE DES BOIS
58;RTE DE L'EPINE, SAINTE COLOMBE DES BOIS
58;RTE DES ETANGS, SAINTE COLOMBE DES BOIS
58;RUE DE LA FORGE, SAINTE COLOMBE DES BOIS
58;RTE DE JAMARDS, SAINTE COLOMBE DES BOIS
58;RUE DU LAVOIR, SAINTE COLOMBE DES BOIS
58;RUE DE LA MAIRIE, SAINTE COLOMBE DES BOIS
58;RTE DE LA MARNIERE, SAINTE COLOMBE DES BOIS
58;RUE DE LA SOURCE, SAINTE COLOMBE DES BOIS
58;RTE DE LA COUDRAYE, ST-DIDIER
58;PL EGLISE, ST-DIDIER
58;RUE DE L EGLISE, ST-DIDIER
58;RTE DE LA GARE, ST-DIDIER
58;CHE DE HALAGE, ST-DIDIER
58;RUE PIERRE SERVEAU, ST-DIDIER
58;RUE DU PIGNON, ST-DIDIER
58;RUE DU PUITS, ST-DIDIER
58;RUE DE LA RIVIERE, ST-DIDIER
58;RUE DE LA ROCHE, ST-DIDIER
58;RUE DE LA TOUR CURIOT, ST-DIDIER
58;RUE DES ACACIAS, SAINT ELOI
58;RUE DE L AUBEPINE, SAINT ELOI
58;RUE D AUBETERRE, SAINT ELOI
58;IMP 1ERE IMP DES BLEUETS, SAINT ELOI
58;IMP 2EME IMP DES BLEUETS, SAINT ELOI
58;RUE DES BLEUETS, SAINT ELOI
58;CHEM DU BOIS BOUCHOT, SAINT ELOI
58;RTE DE BOURGOGNE, SAINT ELOI
58;RTE DE CHALUZY, SAINT ELOI
58;RUE DES CHAPELLERIES, SAINT ELOI
58;RUE DU CHAMP DES FEMMES, SAINT ELOI
58;RTE DE CHATEAU CHINON, SAINT ELOI
58;IMP DES CHENES, SAINT ELOI
58;RUE DU CHOLET, SAINT ELOI
58;RTE DE COULANGES, SAINT ELOI
58;RUE COURTIN, SAINT ELOI
58;RUE DU CRAQUELIN, SAINT ELOI
58;RUE DES CYCLAMENS, SAINT ELOI
58;RUE DU DESERT, SAINT ELOI
58;RUE GEORGES DUFAUD, SAINT ELOI
58;RUE DES EGLANTINES, SAINT ELOI
58;RUE DES FORGERONS, SAINT ELOI
58;RUE DES FOUGERES, SAINT ELOI
58;IMP DES FOUGERES, SAINT ELOI
58;RUE DE LA GARE, SAINT ELOI
58;RUE DE LA GARENNE, SAINT ELOI
58;RUE DE LA GRENOUILLERE, SAINT ELOI
58;IMP DU GUIPASSE, SAINT ELOI
58;CHE DE GUIPASSE, SAINT ELOI
58;RUE DU HAMEAU  D' AUBETERRE, SAINT ELOI
58;RUE DES HORTENSIAS, SAINT ELOI
58;IMP DES JARDINS, SAINT ELOI
58;IMP DE LA JARRYE, SAINT ELOI
58;RUE DES JEUNES POUSSES, SAINT ELOI
58;RUE DES LILAS, SAINT ELOI
58;RUE DES MARGUERITES, SAINT ELOI
58;RUE DE L ORANGERIE, SAINT ELOI
58;RUE DES PAPILLONS, SAINT ELOI
58;IMP DES ORMES, SAINT ELOI
58;RUE DE LA PETITE PERRIERE, SAINT ELOI
58;IMP DE LA PETITE PERRIERE, SAINT ELOI
58;RUE DE LA POSTE, SAINT ELOI
58;RUE DES PLATANES, SAINT ELOI
58;IMP DES PRAILLONS, SAINT ELOI
58;RUE DE REMERON, SAINT ELOI
58;IMP DE LA SABLIERE, SAINT ELOI
58;RUE SAINT FIACRE, SAINT ELOI
58;RTE DE TRANGY, SAINT ELOI
58;IMP DES VARENNES, SAINT ELOI
58;RUE DE VENILLE, SAINT ELOI
58;IMP SAINT FIACRE, SAINT ELOI
58;RUE DE CHALUZY, SAINT ELOI
58;RUE DES TAILLES, SAINT ELOI
58;RUE CHEM RURAL DU BOUCHOT, SAINT ELOI
58;PL DE L EGLISE, SAINT ELOI
58;RUE DES MAROLLES, SAINT ELOI
58;RUE DE LA PERRIERE, SAINT ELOI
58;RUE DU VILLAGE GUIPASSE, SAINT ELOI
58;IMP CHAMP DE LA CAVE, SAINT ELOI
58;RUE D'HARLOT, SAINT ELOI
58;RUE DE BEAUREGARD, SAINT ELOI
58;CHE DE GRANGEBAULT, SAINT ELOI
58;RTE DE L'AUTOROUTE, SAINT ELOI
58;IMP DE LA BARATTE, SAINT ELOI
58;CHE DE LA GRAND'COUR, SAINT ELOI
58;CHE DE LA MAISON ROUGE, SAINT ELOI
58;RTE DE LA ZONE INDUSTRIELLE, SAINT ELOI
58;CHE DES BORDS DE LOIRE, SAINT ELOI
58;CHE DES BRIOTTES, SAINT ELOI
58;RUE DES CRETS DE FORGES, SAINT ELOI
58;RUE DES TERRES BLANCHES, SAINT ELOI
58;CHE DU CORBIER, SAINT ELOI
58;RUE DU PAVILLON, SAINT ELOI
58;CHE DU VIEUX CHATEAU, SAINT ELOI
58;RUE PETITE RUE DES SABLONS, SAINT ELOI
58;RUE DE L'ARPENT, ST-FIRMIN
58;CHE DES FEUILLATS, ST-FIRMIN
58;RTE DES FONTAINES, ST-FIRMIN
58;RUE DE L'HUILERIE, ST-FIRMIN
58;RTE DU LAVOIR, ST-FIRMIN
58;PL LOUIS SIMONET, ST-FIRMIN
58;IMP DU MOULIN, ST-FIRMIN
58;RUE DES PUITS, ST-FIRMIN
58;CHE SAINTE CATHERINE, ST-FIRMIN
58;RTE DU TACOT, ST-FIRMIN
58;RUE DES VIGNES, ST-FIRMIN
58;RTE DE L'YXEURRE, ST-FIRMIN
58;RTE D'AVRIL, SAINT-GERMAIN-CHASSENAY
58;RTE DE DECIZE, SAINT-GERMAIN-CHASSENAY
58;RTE DE DORNES, SAINT-GERMAIN-CHASSENAY
58;RTE DE TOURY LURCY, SAINT-GERMAIN-CHASSENAY
58;RTE DE BEAUVOIR, SAINT-GERMAIN-CHASSENAY
58;CHE DE BIZY, SAINT-GERMAIN-CHASSENAY
58;CHE DE CRECY, SAINT-GERMAIN-CHASSENAY
58;RUE DE LA GARENNE, SAINT-GERMAIN-CHASSENAY
58;RTE DE MOULINS, SAINT-GERMAIN-CHASSENAY
58;RTE DE NEUVILLE, SAINT-GERMAIN-CHASSENAY
58;RTE DE ST LOUP, SAINT-GERMAIN-CHASSENAY
58;RUE DES CHARMES, SAINT-GERMAIN-CHASSENAY
58;RUE DES DECHARTS, SAINT-GERMAIN-CHASSENAY
58;CHE DE LA VALLEE, SAINT-GERMAIN-CHASSENAY
58;ZA DE CHALIGNY, ST-HILAIRE-EN-MORVAN
58;CHE D'ARGOULAIS, ST-HILAIRE-EN-MORVAN
58;RTE DE BOST, ST-HILAIRE-EN-MORVAN
58;CHE DE BOURGNEUF, ST-HILAIRE-EN-MORVAN
58;RTE DE CHALIGNY, ST-HILAIRE-EN-MORVAN
58;CHE DE CHAMPIGNY, ST-HILAIRE-EN-MORVAN
58;RTE DE DOMMARTIN, ST-HILAIRE-EN-MORVAN
58;CHE DE L'HUIS AU ROY, ST-HILAIRE-EN-MORVAN
58;RTE DE L'HUIS BOULARD, ST-HILAIRE-EN-MORVAN
58;CHE DE L'HUIS BREE, ST-HILAIRE-EN-MORVAN
58;CHE DE L'HUIS GUILLOT, ST-HILAIRE-EN-MORVAN
58;CHE DE L'HUIS PREAU, ST-HILAIRE-EN-MORVAN
58;RTE DE LA CREUSE, ST-HILAIRE-EN-MORVAN
58;RTE DE LA CROIX DE LA PELOTTE, ST-HILAIRE-EN-MORVAN
58;RTE DE LA FONTAINE DES GUEUX, ST-HILAIRE-EN-MORVAN
58;RTE DE LA FOSSE, ST-HILAIRE-EN-MORVAN
58;RTE DE LA QUEUDRE, ST-HILAIRE-EN-MORVAN
58;RTE DE LA STELE, ST-HILAIRE-EN-MORVAN
58;RTE DE LA TRANCHEE ROUGE, ST-HILAIRE-EN-MORVAN
58;CHE DE LA VERSENNE, ST-HILAIRE-EN-MORVAN
58;CHE DE LA VOLOTTE, ST-HILAIRE-EN-MORVAN
58;RTE DE LORMES, ST-HILAIRE-EN-MORVAN
58;CHE DE MOULINETTE, ST-HILAIRE-EN-MORVAN
58;RTE DE MOULINS-ENGILBERT, ST-HILAIRE-EN-MORVAN
58;RTE DE NEVERS, ST-HILAIRE-EN-MORVAN
58;RTE DE SAINT-LEGER-DE-FOUGERET, ST-HILAIRE-EN-MORVAN
58;CHE DES CHEVANNES, ST-HILAIRE-EN-MORVAN
58;CHE DES COURCELLES, ST-HILAIRE-EN-MORVAN
58;RTE DES RAFFINS, ST-HILAIRE-EN-MORVAN
58;CHE DES RUES, ST-HILAIRE-EN-MORVAN
58;CHE DU CHAMP BLANC, ST-HILAIRE-EN-MORVAN
58;CHE DU CHATEAU D'ARGOULAIS, ST-HILAIRE-EN-MORVAN
58;CHE DU CHATEAU DE MOUASSE, ST-HILAIRE-EN-MORVAN
58;CHE DU DOMAINE DE LA FOSSE, ST-HILAIRE-EN-MORVAN
58;CHE DU MOULIN D'ATRUY, ST-HILAIRE-EN-MORVAN
58;RTE DU PRE PONSON, ST-HILAIRE-EN-MORVAN
58;IMP DU PRESBYTERE, ST-HILAIRE-EN-MORVAN
58;RTE DU VEYNON, ST-HILAIRE-EN-MORVAN
58;IMP DE LA CROIX, ST HILAIRE FONTAINE
58;CHE DE BREUX, ST HILAIRE FONTAINE
58;CHE DE LA CRESSONNE, ST HILAIRE FONTAINE
58;RUE LOTISSEM CHAMP DE LA BARRE, ST HILAIRE FONTAINE
58;RTE DE CERCY LA TOUR, ST HILAIRE FONTAINE
58;IMP DE L EGLISE, ST HILAIRE FONTAINE
58;PL DE L EGLISE, ST HILAIRE FONTAINE
58;RTE DE GANNAY, ST HILAIRE FONTAINE
58;RTE DE GENEVE, ST HILAIRE FONTAINE
58;CHE DE GILLETTE, ST HILAIRE FONTAINE
58;CHE JAUNE, ST HILAIRE FONTAINE
58;CHE DE LA LEVEE DE LA LOIRE, ST HILAIRE FONTAINE
58;RTE DE LA MAIRIE, ST HILAIRE FONTAINE
58;CHE DE LA MONTEE, ST HILAIRE FONTAINE
58;RTE DE MONTAMBERT, ST HILAIRE FONTAINE
58;CHE DU CHAMP MEUNIER, ST HILAIRE FONTAINE
58;RUE DE NOLAY, ST HILAIRE FONTAINE
58;RTE DE LA NOCLE MAULAIX, ST HILAIRE FONTAINE
58;CHE DU PETIT BOIS, ST HILAIRE FONTAINE
58;IMP DU PETIT BOIS, ST HILAIRE FONTAINE
58;RTE DES ROSES, ST HILAIRE FONTAINE
58;CHE DU MOULIN AU LOUP, ST HILAIRE FONTAINE
58;RTE DE THAREAU, ST HILAIRE FONTAINE
58;RTE DE TINGEAT, ST HILAIRE FONTAINE
58;RUE DU DOCTEUR CHARPIN, SAINT HONORE LES BAINS
58;RUE DE LA BEAUME VIGNOT, SAINT HONORE LES BAINS
58;ALL DU BOIS DE L HATE, SAINT HONORE LES BAINS
58;RUE DES CAVES, SAINT HONORE LES BAINS
58;ALL DE LA CHAPELLE, SAINT HONORE LES BAINS
58;RUE CHARLEUF, SAINT HONORE LES BAINS
58;RUE DE LA CHAUME, SAINT HONORE LES BAINS
58;RUE DU CHEMIN FERRE, SAINT HONORE LES BAINS
58;AV CLAUDE DELLYS, SAINT HONORE LES BAINS
58;ALL DE LA CRESSONNIERE, SAINT HONORE LES BAINS
58;AV DU DOC SEGARD, SAINT HONORE LES BAINS
58;RUE DES ROSIERS, SAINT HONORE LES BAINS
58;RUE DE L EGLISE, SAINT HONORE LES BAINS
58;RUE EUGENE BOYER, SAINT HONORE LES BAINS
58;AV EUGENE COLLIN, SAINT HONORE LES BAINS
58;ALL FELICIE MUSSET, SAINT HONORE LES BAINS
58;PL FIRMIN BAZOT, SAINT HONORE LES BAINS
58;RUE DES FOURNEAUX, SAINT HONORE LES BAINS
58;RUE DE LA FRENAIE, SAINT HONORE LES BAINS
58;ALL DES GARENNES, SAINT HONORE LES BAINS
58;AV DU GEN D ESPEUILLES, SAINT HONORE LES BAINS
58;RUE DE L HATE, SAINT HONORE LES BAINS
58;RUE HENRI RENAUD, SAINT HONORE LES BAINS
58;RUE JACQUES POULET, SAINT HONORE LES BAINS
58;AV JEAN MERMOZ, SAINT HONORE LES BAINS
58;RUE JOSEPH DURIAUX, SAINT HONORE LES BAINS
58;ALL DES LOGES DE VANDENESSE, SAINT HONORE LES BAINS
58;ALL DE MONTHEBAULT, SAINT HONORE LES BAINS
58;AV DE REMILLY, SAINT HONORE LES BAINS
58;RTE DES RESERVOIRS, SAINT HONORE LES BAINS
58;IMP DU TRESOR, SAINT HONORE LES BAINS
58;RUE DU VIEUX MARCHE, SAINT HONORE LES BAINS
58;RTE DE VILLAPOURCON, SAINT HONORE LES BAINS
58;RUE DE L ETANG HONORE, SAINT HONORE LES BAINS
58;ALL DES PINS, SAINT HONORE LES BAINS
58;RUE BOUCHER, SAINT LAURENT
58;RUE DU CHARRON, SAINT LAURENT
58;RUE DU CIMETIERE, SAINT LAURENT
58;PL ANDRE COULON, SAINT LAURENT
58;RTE DE DONZY, SAINT LAURENT
58;IMP DU FOURNIL, SAINT LAURENT
58;ALL DE LA FRATERNITE, SAINT LAURENT
58;RTE DE GARCHY, SAINT LAURENT
58;RUE GATEAU, SAINT LAURENT
58;CHE DU GUE, SAINT LAURENT
58;RUE DU GUE, SAINT LAURENT
58;PL DE LA MAIRIE, SAINT LAURENT
58;CHE DE LA MARE, SAINT LAURENT
58;RTE DE POUILLY, SAINT LAURENT
58;RUE DU PUITS, SAINT LAURENT
58;RTE DE SANCERRE, SAINT LAURENT
58;CHE DE LA TERRE ROUGE, SAINT LAURENT
58;RUE DU TONNELIER, SAINT LAURENT
58;CHE DES VIGNES, SAINT LAURENT
58;RUE DES VIGNES, SAINT LAURENT
58;RTE DE VILLIERS, SAINT LAURENT
58;RES DE L'ETANG, ST-LEGER-DES-VIGNES
58;RES DES PINSONS, ST-LEGER-DES-VIGNES
58;RUE DE L'AZENAN, ST-LEGER-DES-VIGNES
58;IMP ANAPURNA, ST-LEGER-DES-VIGNES
58;RUE DU BARRAGE, ST-LEGER-DES-VIGNES
58;RUE DE BEAUCIRDIEU, ST-LEGER-DES-VIGNES
58;RUE DU BOIS BOURGEOT, ST-LEGER-DES-VIGNES
58;IMP DE LA BUTTE, ST-LEGER-DES-VIGNES
58;RUE DU CHAMP DU BOIS, ST-LEGER-DES-VIGNES
58;RUE DU CHAMP DU PUITS, ST-LEGER-DES-VIGNES
58;RUE DU CHAMP ROUGE, ST-LEGER-DES-VIGNES
58;RUE DE LA CHARBONNIERE, ST-LEGER-DES-VIGNES
58;RUE DE CHAUMONT, ST-LEGER-DES-VIGNES
58;IMP CLAMORIN, ST-LEGER-DES-VIGNES
58;RUE CLAMORIN, ST-LEGER-DES-VIGNES
58;IMP DE LA COLONNE, ST-LEGER-DES-VIGNES
58;RUE DE LA COLONNE, ST-LEGER-DES-VIGNES
58;IMP DU COTEAU, ST-LEGER-DES-VIGNES
58;RUE DE LA CROIX DU PAVE, ST-LEGER-DES-VIGNES
58;PL DES ECOLES, ST-LEGER-DES-VIGNES
58;RUE DES ECOLES, ST-LEGER-DES-VIGNES
58;RUE DE L'ETANG, ST-LEGER-DES-VIGNES
58;RUE DE LA FONTAINE, ST-LEGER-DES-VIGNES
58;IMP DE LA GUEDINE, ST-LEGER-DES-VIGNES
58;RUE DE LA GUEDINE, ST-LEGER-DES-VIGNES
58;RUE DU HUIT MAI, ST-LEGER-DES-VIGNES
58;IMP DE LA LOGE, ST-LEGER-DES-VIGNES
58;RUE DE LA LOGE, ST-LEGER-DES-VIGNES
58;RUE DE LA LOIRE, ST-LEGER-DES-VIGNES
58;RUE LOTISSEMENT BEAUCIRDIEU, ST-LEGER-DES-VIGNES
58;RTE DE LA MACHINE, ST-LEGER-DES-VIGNES
58;RTE NATIONALE, ST-LEGER-DES-VIGNES
58;RUE DES NIDS, ST-LEGER-DES-VIGNES
58;PL DU ONZE NOVEMBRE, ST-LEGER-DES-VIGNES
58;CHE DE L'OREE DU BOIS, ST-LEGER-DES-VIGNES
58;RUE DE LA PAIX, ST-LEGER-DES-VIGNES
58;RUE DES PECHEURS, ST-LEGER-DES-VIGNES
58;RUE DU PETIT PONT, ST-LEGER-DES-VIGNES
58;CHE DES PLATRIERS, ST-LEGER-DES-VIGNES
58;RUE DES PLATRIERS, ST-LEGER-DES-VIGNES
58;RUE DU PRE, ST-LEGER-DES-VIGNES
58;CHEM DES DEUX PRES, ST-LEGER-DES-VIGNES
58;RUE DES RAIMBAULTS, ST-LEGER-DES-VIGNES
58;RUE DU REPOS, ST-LEGER-DES-VIGNES
58;IMP DE LA RESIDENCE DE L'ETANG, ST-LEGER-DES-VIGNES
58;RUE DE LA RESIDENCE DE L'ETANG, ST-LEGER-DES-VIGNES
58;IMP DU RIO, ST-LEGER-DES-VIGNES
58;RUE DU RIO, ST-LEGER-DES-VIGNES
58;RUE DE LA ROCHE, ST-LEGER-DES-VIGNES
58;RUE DE LA SABLIERE, ST-LEGER-DES-VIGNES
58;RUE SIRNELLE, ST-LEGER-DES-VIGNES
58;RUE DES SORBIERS, ST-LEGER-DES-VIGNES
58;IMP DU SOUVENIR, ST-LEGER-DES-VIGNES
58;RUE DU SOUVENIR, ST-LEGER-DES-VIGNES
58;RUE DES VALETTES, ST-LEGER-DES-VIGNES
58;RUE DE LA VERRERIE, ST-LEGER-DES-VIGNES
58;RUE DE LA VIEILLE EGLISE, ST-LEGER-DES-VIGNES
58;RUE DES VIGNES, ST-LEGER-DES-VIGNES
58;RUE DE LA VIGNONNERIE, ST-LEGER-DES-VIGNES
58;RUE DU VILLAGE, ST-LEGER-DES-VIGNES
58;CHEM L'ABBE, SAINT-LOUP-DES-BOIS
58;CHEM DES ABEILLES, SAINT-LOUP-DES-BOIS
58;RTE DES ARTISANS, SAINT-LOUP-DES-BOIS
58;RUE DE L'AUBUE, SAINT-LOUP-DES-BOIS
58;RTE DE L'AUBIE, SAINT-LOUP-DES-BOIS
58;CHEM DES BUISSONS, SAINT-LOUP-DES-BOIS
58;RUE DU CARREAU, SAINT-LOUP-DES-BOIS
58;RTE DE LA CARRIERE, SAINT-LOUP-DES-BOIS
58;RTE DU CHAMP DES HATES, SAINT-LOUP-DES-BOIS
58;RUE DU CHAMP VENEAU, SAINT-LOUP-DES-BOIS
58;CHEM DES CHAMPARTS, SAINT-LOUP-DES-BOIS
58;RUE DU CHARRON, SAINT-LOUP-DES-BOIS
58;RUE DU CHATEAU D'EAU, SAINT-LOUP-DES-BOIS
58;RUE DES COUTEAUX, SAINT-LOUP-DES-BOIS
58;CHEM DE LA CROIX, SAINT-LOUP-DES-BOIS
58;RTE DE LA CROIX SAINT JACQUES, SAINT-LOUP-DES-BOIS
58;RTE DU CROT JAUNE, SAINT-LOUP-DES-BOIS
58;RTE DES CROTS, SAINT-LOUP-DES-BOIS
58;RTE DE LA DETORBE, SAINT-LOUP-DES-BOIS
58;PLA DE L'EGLISE, SAINT-LOUP-DES-BOIS
58;RUE DU FACTEUR, SAINT-LOUP-DES-BOIS
58;RUE DES FERMIERS, SAINT-LOUP-DES-BOIS
58;RUE DU GARDE VIGNES, SAINT-LOUP-DES-BOIS
58;IMP DE LA GARE, SAINT-LOUP-DES-BOIS
58;CHEM DE LA GENETIERE, SAINT-LOUP-DES-BOIS
58;IMP DES GRANDS CHAMPS, SAINT-LOUP-DES-BOIS
58;RTE DU GRAND FOSSE, SAINT-LOUP-DES-BOIS
58;PLA DU GRAND PUITS, SAINT-LOUP-DES-BOIS
58;RUE DU LAVOIR, SAINT-LOUP-DES-BOIS
58;RUE DU MAITRE DE FORGES, SAINT-LOUP-DES-BOIS
58;RUE DU MARRONNIER, SAINT-LOUP-DES-BOIS
58;RUE DU MENUISIER, SAINT-LOUP-DES-BOIS
58;CHEM DE LA MESSE, SAINT-LOUP-DES-BOIS
58;RTE DU MUGUET, SAINT-LOUP-DES-BOIS
58;CHEM DU PARADIS, SAINT-LOUP-DES-BOIS
58;RUE DU PETIT BOIS, SAINT-LOUP-DES-BOIS
58;CHEM DU PETIT REGUIN, SAINT-LOUP-DES-BOIS
58;CHEM DES PRES MEUNIER, SAINT-LOUP-DES-BOIS
58;RUE DU SABOTIER, SAINT-LOUP-DES-BOIS
58;IMP DE LA SOURCE, SAINT-LOUP-DES-BOIS
58;RTE DU TACOT, SAINT-LOUP-DES-BOIS
58;IMP DU TILLEUL, SAINT-LOUP-DES-BOIS
58;CHEM DU TRIEUR, SAINT-LOUP-DES-BOIS
58;CHEM DES VERNES, SAINT-LOUP-DES-BOIS
58;IMP DE LA VINEE, SAINT-LOUP-DES-BOIS
58;CHEM VIGNES, SAINT-LOUP-DES-BOIS
58;RUE ABBAYE DE BOURRAS, SAINT MALO EN DONZIOIS
58;RTE DES BRULIES, SAINT MALO EN DONZIOIS
58;RTE DE CHAMPLEMY, SAINT MALO EN DONZIOIS
58;RTE DE LA CHAUME, SAINT MALO EN DONZIOIS
58;CHE COLONEL ROCHE, SAINT MALO EN DONZIOIS
58;RTE DU DOMAINE NEUF, SAINT MALO EN DONZIOIS
58;CHE DE L'ETANG, SAINT MALO EN DONZIOIS
58;IMP DE LA FORET, SAINT MALO EN DONZIOIS
58;RUE DES GARDES, SAINT MALO EN DONZIOIS
58;RUE JULES PEROT, SAINT MALO EN DONZIOIS
58;PL DU LAVOIR, SAINT MALO EN DONZIOIS
58;RUE LOUIS PAUTRAT, SAINT MALO EN DONZIOIS
58;CHE DU LOUP, SAINT MALO EN DONZIOIS
58;RTE LUCIE AUBRAC, SAINT MALO EN DONZIOIS
58;RTE DE LA MANGEOIRE, SAINT MALO EN DONZIOIS
58;RTE DE MENOU, SAINT MALO EN DONZIOIS
58;RUE DES METAIRIES, SAINT MALO EN DONZIOIS
58;RUE DU MOULIN A VENT, SAINT MALO EN DONZIOIS
58;RTE NATIONALE, SAINT MALO EN DONZIOIS
58;CHE PERE LAPIN, SAINT MALO EN DONZIOIS
58;RUE POIRIER, SAINT MALO EN DONZIOIS
58;IMP POIRIER, SAINT MALO EN DONZIOIS
58;RUE DES PRES, SAINT MALO EN DONZIOIS
58;RUE DU PUITS, SAINT MALO EN DONZIOIS
58;IMP DU PUITS, SAINT MALO EN DONZIOIS
58;RUE RAYMOND AUBRAC, SAINT MALO EN DONZIOIS
58;COUR DU RUISSEAU, SAINT MALO EN DONZIOIS
58;RUE DE LA VALLEE, SAINT MALO EN DONZIOIS
58;RUE DES VERGERS, SAINT MALO EN DONZIOIS
58;RUE DES BOIS, STE MARIE
58;RUE DU CHAMBON, STE MARIE
58;PL DE L'EGLISE, STE MARIE
58;RUE DE L'EGLISE, STE MARIE
58;RTE DE GIVERDY, STE MARIE
58;CHE DES GRANDS CHAMPS, STE MARIE
58;IMP DU HAMEAU ST MARTIN, STE MARIE
58;RUE DU HAMEAU ST MARTIN, STE MARIE
58;RTE DE JAILLY, STE MARIE
58;RUE DU LAVOIR DES CANTILLONS, STE MARIE
58;CHE DU MANOIR, STE MARIE
58;RTE DU MONT, STE MARIE
58;CHE DE LA RESSE, STE MARIE
58;PAS DE LA RUE DES BOIS, STE MARIE
58;RTE DE ST FRANCHY, STE MARIE
58;RTE DE ST MARTIN, STE MARIE
58;RTE DES AMOGNES, ST-MARTIN-D HEUILLE
58;CHE DES BALLETS, ST-MARTIN-D HEUILLE
58;CHE DES BARONS, ST-MARTIN-D HEUILLE
58;RTE DU BAS D'HEUILLE, ST-MARTIN-D HEUILLE
58;CHE DES BERGERIES, ST-MARTIN-D HEUILLE
58;CHE DE LA BESACERIE, ST-MARTIN-D HEUILLE
58;IMP DU BOIS, ST-MARTIN-D HEUILLE
58;RUE DES BORDES, ST-MARTIN-D HEUILLE
58;RUE DU CHAMP DES PIERRES, ST-MARTIN-D HEUILLE
58;RUE DE LA CHAUME, ST-MARTIN-D HEUILLE
58;RUE DES CRAPAUDS, ST-MARTIN-D HEUILLE
58;RUE DU CROT MOREAU, ST-MARTIN-D HEUILLE
58;RUE DU CROT MORNAY, ST-MARTIN-D HEUILLE
58;CHE DES ECOLIERS, ST-MARTIN-D HEUILLE
58;RUE DE L'ETANG ET DU MOULIN, ST-MARTIN-D HEUILLE
58;RUE DES FONTAINES, ST-MARTIN-D HEUILLE
58;IMP DE LA GARENNE, ST-MARTIN-D HEUILLE
58;RUE DE LA GRIPPE, ST-MARTIN-D HEUILLE
58;IMP DU GROS CHENE, ST-MARTIN-D HEUILLE
58;RTE DU GUE D'HEUILLON, ST-MARTIN-D HEUILLE
58;RUE DU GUIDON, ST-MARTIN-D HEUILLE
58;IMP DE LA JONCIERE, ST-MARTIN-D HEUILLE
58;RUE DE LA JONCIERE, ST-MARTIN-D HEUILLE
58;IMP DE MAUBUISSON, ST-MARTIN-D HEUILLE
58;RTE DE MONTMIENS, ST-MARTIN-D HEUILLE
58;RTE DE NEVERS, ST-MARTIN-D HEUILLE
58;RUE DE LA PACAUDERIE, ST-MARTIN-D HEUILLE
58;RUE DU PETIT BAS D'HEUILLE, ST-MARTIN-D HEUILLE
58;CHE DE LA PIOTERIE, ST-MARTIN-D HEUILLE
58;CHE DES RATILLY, ST-MARTIN-D HEUILLE
58;RTE DES VANNES, ST-MARTIN-D HEUILLE
58;RUE DU POTEAU DE SAUVAGE, ST-MARTIN-D HEUILLE
58;BER BERGES, ST-MARTIN-DU-PUY
58;VC CHAMP GRANGE, ST-MARTIN-DU-PUY
58;RUE DES CARMES, ST-MARTIN-DU-PUY
58;RUE PIERRE BERNACHOT, ST-MARTIN-DU-PUY
58;RTE D'AVALLON, ST-MARTIN-DU-PUY
58;CHEM DE VESIGNEUX, ST-MARTIN-DU-PUY
58;CHEM DE BERGES, ST-MARTIN-DU-PUY
58;CHEM DE VESIGNEUX A MARIGNY L E, ST-MARTIN-DU-PUY
58;CHEM DE ST MARTIN DE HAUT A RD, ST-MARTIN-DU-PUY
58;CHEM DE ST MARTIN LE BAS, ST-MARTIN-DU-PUY
58;CHEM DE SENEUX, ST-MARTIN-DU-PUY
58;CHEM DE ROUY A BERGES, ST-MARTIN-DU-PUY
58;CHEM DE RINCIEUX AU RUISSEAU DE, ST-MARTIN-DU-PUY
58;CHEM DE LA RUEE JAUNE, ST-MARTIN-DU-PUY
58;CHEM DE LA CHAUME, ST-MARTIN-DU-PUY
58;CHEM DE RINCIEUX A SENEUX, ST-MARTIN-DU-PUY
58;TRA DE ST MARTIN LE BAS, ST-MARTIN-DU-PUY
58;CHEM DES PRES DU PONT, ST-MARTIN-DU-PUY
58;CHEM DE L HUIS DERION, ST-MARTIN-DU-PUY
58;CHEM DE LA VERNEE, ST-MARTIN-DU-PUY
58;CHEM DE L OUCHE BILLAUD, ST-MARTIN-DU-PUY
58;CHEM DE CHAMPEREAU, ST-MARTIN-DU-PUY
58;CHEM DE PORCMIGNON, ST-MARTIN-DU-PUY
58;CHEM DE LA FONTAINE, ST-MARTIN-DU-PUY
58;CHEM DU LAVOIR DE ST MARTIN LE, ST-MARTIN-DU-PUY
58;CHEM DES BOUTS, ST-MARTIN-DU-PUY
58;CHEM DE LA SCIERIE, ST-MARTIN-DU-PUY
58;CHEM DU BOIS DES BREULS, ST-MARTIN-DU-PUY
58;RUE DE L EGLISE, ST-MARTIN-DU-PUY
58;CHEM LA PLACE DU CHAMP DE FOIRE, ST-MARTIN-DU-PUY
58;CHEM DE L OUCHE DU SOSIET, ST-MARTIN-DU-PUY
58;CHEM DE PLAINEFAS A CHALAUX, ST-MARTIN-DU-PUY
58;CHEM DE LA BOURBEE, ST-MARTIN-DU-PUY
58;CHEM DU HAMEAU DE PLAINEFAS, ST-MARTIN-DU-PUY
