58;RUE DE LA CURE, LUTHENAY-UXELOUP
58;RTE DE DORNES, LUTHENAY-UXELOUP
58;PL DE L EGLISE, LUTHENAY-UXELOUP
58;IMP LA FONDMORIN, LUTHENAY-UXELOUP
58;RUE DES LOGES, LUTHENAY-UXELOUP
58;RUE PATOUILLOUSE, LUTHENAY-UXELOUP
58;RUE DES PEUPLIERS, LUTHENAY-UXELOUP
58;IMP DES RIAUX, LUTHENAY-UXELOUP
58;IMP DE LA RINCHE, LUTHENAY-UXELOUP
58;RUE DES RONDES, LUTHENAY-UXELOUP
58;RUE DES SORBIERS, LUTHENAY-UXELOUP
58;IMP DE LA VARENNE, LUTHENAY-UXELOUP
58;IMP DU VIEUX BOIS, LUTHENAY-UXELOUP
58;HLM RUE DU CHAMP BARON, LUZY
58;HLM DU CHP DE FOIRE, LUZY
58;HLM DE LAFOND, LUZY
58;HLM DES LOGES RUE LEDRU ROLLIN, LUZY
58;HLM DU MATRAIT, LUZY
58;RUE DE L ABREUVOIR, LUZY
58;IMP DE L'ALENE, LUZY
58;PL ANDRIOT GUERIN, LUZY
58;RTE D AUTUN, LUZY
58;IMP PRIVEE DES BAGELLES, LUZY
58;RUE DES BAGELLES, LUZY
58;RUE DES BARRIERES, LUZY
58;RTE DE BIBRACTE, LUZY
58;CHEM DES BRULES, LUZY
58;CHEM DES CAMPAGNES, LUZY
58;RUE DES CANNES, LUZY
58;RUE CASSE COU, LUZY
58;ALL DES CERISIERS, LUZY
58;RUE DU CHP BARON, LUZY
58;PL DU CHP DE FOIRE, LUZY
58;PL CHANZY, LUZY
58;RTE DE CHARBONNAT, LUZY
58;CHEM DES CHARMES, LUZY
58;RUE DU CHEM DE RONDE, LUZY
58;PL DU COLOMBIER, LUZY
58;RUE DU COMMERCE, LUZY
58;RUE DE LA CORNE AUX LIEVRES, LUZY
58;RUE DES COUPES, LUZY
58;RUE DE LA CROIX, LUZY
58;RUE DIDEROT, LUZY
58;RUE DU 19 MARS 1962, LUZY
58;AV DU DOC ALAIN BENOIST, LUZY
58;AV DU DOC BRAMARD, LUZY
58;AV DU DOC DOLLET, LUZY
58;RUE DES DROITS DE L'HOMME, LUZY
58;RUE DUVIVIER, LUZY
58;RUE ERNEST RENAN, LUZY
58;RLE DE L'ETANG, LUZY
58;PASS DE L'ETANG, LUZY
58;RUE DE L ETANG CASSE, LUZY
58;IMP DE FONTAINE BLANCHE, LUZY
58;RUE DE LA FONTAINE, LUZY
58;RUE DE FONTAINE BLANCHE, LUZY
58;RUE DES FOSSES, LUZY
58;RTE DE FOURS, LUZY
58;RUE DES GALERIES, LUZY
58;IMP DU GAZ, LUZY
58;CHEM DU HAUT DES BRULES, LUZY
58;AV DE LA GARE, LUZY
58;RUE GRAILLET, LUZY
58;CHEM DU GROS FOYARD, LUZY
58;RUE DU GUE, LUZY
58;AV HOCHE, LUZY
58;PL DU 8 MAI 1945, LUZY
58;RUE JACQUES PREVERT, LUZY
58;RUE JEAN JACQUES ROUSSEAU, LUZY
58;RUE KLEBER, LUZY
58;RUE LABOUTIERE, LUZY
58;RUE LAFAYETTE, LUZY
58;RUE LAFOND, LUZY
58;RUE LAMARTINE, LUZY
58;RUE LEDRU ROLLIN, LUZY
58;RTE DES LOGES, LUZY
58;PL DU MAQUIS LOUIS, LUZY
58;AV MARCEAU, LUZY
58;IMP PRIVEE DU MATRAIT, LUZY
58;RUE DU MATRAIT, LUZY
58;RUE DE LA MONTEE, LUZY
58;PL DU 11 NOVEMBRE 1918, LUZY
58;RUE DES PALIS, LUZY
58;RUE DE PALLUAU, LUZY
58;RUE DE LA PERRIERE, LUZY
58;RUE DE PONT, LUZY
58;RUE DE PREMAUDE, LUZY
58;RUE DES PRES GRAILLETS, LUZY
58;PASS DE LA PROMENADE, LUZY
58;RUE DES REMPARTS, LUZY
58;RUE DE LA REPUBLIQUE, LUZY
58;RTE DE SAINT HONORE, LUZY
58;RUE ST ANDRE, LUZY
58;RTE DE TOULON SUR ARROUX, LUZY
58;RUE DE LA VESVRE, LUZY
58;RUE VICTOR HUGO, LUZY
58;RUE DU VIEUX CHATEAU, LUZY
58;RUE DU VIEUX PONT, LUZY
58;RUE DU VILLAGE DE PREMAUDE, LUZY
58;RUE VOLTAIRE, LUZY
58;CHEM DES ZONES D ACTIVITE, LUZY
58;RUE LOT DES FOURNEAUX, LUZY
58;RTE DE BOURBON-LANCY, LUZY
58;RTE DE BUSSIERE, LUZY
58;RTE DE L'ETANG DU LEVANT, LUZY
58;PL DE L'HOTEL DE VILLE, LUZY
58;CHE DE LA CHAIZE, LUZY
58;RTE DE LA CROIX GUICHARD, LUZY
58;CHE DE LA FERME DE MAZILLE, LUZY
58;RTE DE LA GAGERE, LUZY
58;RTE DE LA GOUTTE DU BRANLE, LUZY
58;CHE DE LA MANOEUVRERIE, LUZY
58;RTE DE MANGY, LUZY
58;RTE DE MONTARMIN, LUZY
58;RTE DE MONTEUILLON, LUZY
58;CHE DE MORAGNE, LUZY
58;RTE DE NEVERS, LUZY
58;RTE DE TREZILLON, LUZY
58;IMP DES ANCIENS ABATTOIRS, LUZY
58;RTE DES ARDILLYS, LUZY
58;RTE DES AVENIERES, LUZY
58;CHE DES BAUDINS, LUZY
58;RTE DES BOIS DE LUZY, LUZY
58;RTE DES BONNOTS, LUZY
58;CHE DES BRUGERES, LUZY
58;RTE DES COUTHIONS, LUZY
58;CHE DES GUITTARDS, LUZY
58;RUE DES MOINDROTS, LUZY
58;CHE DES RELAIS, LUZY
58;RTE DU BOIS CHAVRY, LUZY
58;RUE DU MOULIN, LUZY
58;CHE DU VIGNOT, LUZY
58;CRS GAMBETTA, LUZY
58;CHE DES CHAMPS PRIX, LUZY
58;CHE DU BOIS MOINE, LUZY
58;RUE D AGLAN, LA MACHINE
58;RUE ALPHONSE DAUDET, LA MACHINE
58;IMP AMBROISE PARE, LA MACHINE
58;RUE ANATOLE FRANCE, LA MACHINE
58;RUE ARAGO, LA MACHINE
58;RUE BASSE, LA MACHINE
58;RUE DU BOIS DES SOEURS, LA MACHINE
58;RUE DES BONNETS, LA MACHINE
58;RUE CAMILLE PELLETAN, LA MACHINE
58;RUE DES CASERNES NEUVES, LA MACHINE
58;RUE BERTHE FOUCHERE, LA MACHINE
58;RUE DES CASERNES VIEILLES, LA MACHINE
58;RUE DE CEINTURE, LA MACHINE
58;RUE DES CENDRIERS, LA MACHINE
58;RUE DE LA CHAPELLE, LA MACHINE
58;RUE CLEMENCE BONDE, LA MACHINE
58;RUE COLETTE, LA MACHINE
58;RUE DES COUPES, LA MACHINE
58;RUE DU CURE, LA MACHINE
58;IMP DANIEL MICHEL, LA MACHINE
58;RUE DANIEL MICHEL, LA MACHINE
58;RUE DE DECIZE, LA MACHINE
58;PL DU 18 JUIN 1940, LA MACHINE
58;RUE DU 19 MARS 1962, LA MACHINE
58;RUE DOC SCHWEITZER, LA MACHINE
58;RUE EDISON, LA MACHINE
58;RUE EMILE ZOLA, LA MACHINE
58;RUE EDMOND GMERECK, LA MACHINE
58;RUE FREDERIC CHOPIN, LA MACHINE
58;RUE FREDERIC MISTRAL, LA MACHINE
58;RUE DES FRERES LUMIERE, LA MACHINE
58;RUE DES FROMAGEOTS, LA MACHINE
58;PL DES FUSILLES, LA MACHINE
58;RUE GAUGUIN, LA MACHINE
58;RUE DE LA GENDARMERIE, LA MACHINE
58;RUE GEORGES BIZET, LA MACHINE
58;RUE GEORGE SAND, LA MACHINE
58;RUE GUSTAVE EIFFEL, LA MACHINE
58;RUE GUSTAVE GRILLAS, LA MACHINE
58;RUE HAUTE, LA MACHINE
58;RUE DE LA HAUTE MEULE, LA MACHINE
58;RUE HECTOR BERLIOZ, LA MACHINE
58;RUE HENRI BARBUSSE, LA MACHINE
58;IMP HENRI DUNANT, LA MACHINE
58;RUE HENRI DUNANT, LA MACHINE
58;AV JEAN BAPTISTE MACHECOURT, LA MACHINE
58;RUE JEAN JACQUES ROUSSEAU, LA MACHINE
58;IMP JEAN JAURES, LA MACHINE
58;RUE JEAN JAURES, LA MACHINE
58;RUE JEAN MOULIN, LA MACHINE
58;RUE DES JUDETS, LA MACHINE
58;RUE JULES PRAVIEUX, LA MACHINE
58;RUE JULES RENARD, LA MACHINE
58;PL LAENNEC, LA MACHINE
58;RUE LAMARTINE, LA MACHINE
58;RUE LOUIS BLANC, LA MACHINE
58;RUE LOUIS HENRI ROBLIN, LA MACHINE
58;RUE LOUIS LANOISELEE, LA MACHINE
58;RUE LOUIS PERGAUD, LA MACHINE
58;IMP MACHECOURT, LA MACHINE
58;RUE MARCEL DESCHAUMES, LA MACHINE
58;RUE LOUIS MATTIEU POUSSEREAU, LA MACHINE
58;RUE DES MARIZYS, LA MACHINE
58;RUE DE MAUFOND, LA MACHINE
58;RUE MAURICE NIOT, LA MACHINE
58;RUE MAURICE PERCEAU, LA MACHINE
58;RUE MICHEL RONDET, LA MACHINE
58;RUE MOLIERE, LA MACHINE
58;RUE MONTAIGNE, LA MACHINE
58;RUE DU MOULIN, LA MACHINE
58;RUE DU MOULIN A VENT, LA MACHINE
58;RUE PABLO PICASSO, LA MACHINE
58;RUE PASTEUR, LA MACHINE
58;RUE PAUL ET AUGUSTE COUTURE, LA MACHINE
58;RUE PAUL VAILLANT COUTURIER, LA MACHINE
58;IMP PAUL VAILLANT COUTURIER, LA MACHINE
58;RUE PIERRE CURIE, LA MACHINE
58;RUE PROSPER MERIMEE, LA MACHINE
58;RUE DU PUITS DE LA HAUTE MEULE, LA MACHINE
58;RUE DU PUITS HENRI PAUL, LA MACHINE
58;RUE DE PREMERY, LA MACHINE
58;RUE DU PUITS HENRY, LA MACHINE
58;RUE DU PUITS VELLERET, LA MACHINE
58;RUE RAOUL FOLLEREAU, LA MACHINE
58;RUE RENE PAGE, LA MACHINE
58;RUE RENOIR, LA MACHINE
58;AV DE LA REPUBLIQUE, LA MACHINE
58;RUE DES RIBLETS, LA MACHINE
58;RUE DE LA ROBILLARDERIE, LA MACHINE
58;RUE ROGER SALENGRO, LA MACHINE
58;RUE ROMAIN ROLLAND, LA MACHINE
58;RUE DE LA SAINTE, LA MACHINE
58;RUE SALVADOR ALLENDE, LA MACHINE
58;RUE SERGENT BOUVET, LA MACHINE
58;RUE DE THIANGES, LA MACHINE
58;RUE DU TUNNEL, LA MACHINE
58;RUE DE VARSOVIE, LA MACHINE
58;RUE VERLAINE, LA MACHINE
58;RUE VERNELIER, LA MACHINE
58;PL DE LA VICTOIRE, LA MACHINE
58;RUE VICTOR HUGO, LA MACHINE
58;PL VOLTAIRE, LA MACHINE
58;RUE DES ZAGOTS, LA MACHINE
58;RUE MARGUERITE DURAS, LA MACHINE
58;RES LES FEUILLANTINES, MAGNY COURS
58;RUE JEAN BEHRA, MAGNY COURS
58;RUE DE BEL AIR, MAGNY COURS
58;CHEM DU BOURG, MAGNY COURS
58;RUE DES CHALETS DU SOLEIL, MAGNY COURS
58;RUE DU CHAMP DE MAGNY, MAGNY COURS
58;CHEM DU CHAMP DES CRAIES, MAGNY COURS
58;RUE DE LA CHAUME CONTANT, MAGNY COURS
58;PL DE LA CHAUME DE MARS, MAGNY COURS
58;RUE DE LA CHAUME DE MARS, MAGNY COURS
58;RUE AUX CHIENS, MAGNY COURS
58;RUE DES CLOUS, MAGNY COURS
58;IMP DE COURS SOUS MAGNY, MAGNY COURS
58;RUE DES CRAIES, MAGNY COURS
58;RUE DU CROT DE LA BOUINE, MAGNY COURS
58;RUE DU CURIOT, MAGNY COURS
58;RUE DES ECOLES, MAGNY COURS
58;PL DE L'EGLISE, MAGNY COURS
58;RUE DE L'ENFER, MAGNY COURS
58;RUE ESTORIL, MAGNY COURS
58;RUE DES FONTENILLES, MAGNY COURS
58;PL DE LA FORGE, MAGNY COURS
58;RUE DU FOURNIL, MAGNY COURS
58;RUE DES GAYERES, MAGNY COURS
58;RUE DES GRAVIERES, MAGNY COURS
58;VEN DES GRAVIERES, MAGNY COURS
58;RUE DES JARDINS, MAGNY COURS
58;IMP JEANNOT, MAGNY COURS
58;IMP DE L'HUGAT, MAGNY COURS
58;RUE DU LAVOIR, MAGNY COURS
58;RUE DE LOUCET, MAGNY COURS
58;IMP DU PAIN BENIT, MAGNY COURS
58;RUE DE PARIS, MAGNY COURS
58;RUE DES PARSONNIERS, MAGNY COURS
58;RUE DU PRE AU SAINT, MAGNY COURS
58;RUE DU PRE MORAND, MAGNY COURS
58;CHEM DU PUITS, MAGNY COURS
58;RUE DU RELAIS DE LA POSTE, MAGNY COURS
58;RTE DE SAINCAIZE, MAGNY COURS
58;RUE AU SAINT, MAGNY COURS
58;RUE SAINT VINCENT, MAGNY COURS
58;RUE AYRTON SENNA, MAGNY COURS
58;RUE DU SOUFFLET, MAGNY COURS
58;RUE DU VIEUX MAGNY, MAGNY COURS
58;RUE DU VILLAGE, MAGNY COURS
58;RUE DES YOLES, MAGNY COURS
58;IMP DU PRE MORAND 1, MAGNY COURS
58;IMP DU PRE MORAND 2, MAGNY COURS
58;RTE DE LORMES, LA MAISON DIEU
58;RUE DE CARROUGE, LA MAISON DIEU
58;RTE DE CHAMOUX, LA MAISON DIEU
58;RUE DES CROTS BLANCS, LA MAISON DIEU
58;RTE DE FORBET, LA MAISON DIEU
58;RUE DU LAVOIR, LA MAISON DIEU
58;RTE DE METZ LE COMTE, LA MAISON DIEU
58;RUE SOUS LES MURS, LA MAISON DIEU
58;RUE DE LA POTERNE, LA MAISON DIEU
58;RTE DE SENOSSE, LA MAISON DIEU
58;RUE DE LA TEURLEE, LA MAISON DIEU
58;RUE DE LA TREILLE, LA MAISON DIEU
58;RUE DES VIGNES VIERGES, LA MAISON DIEU
58;RUE DU CARROUGE, LA MARCHE
58;RUE DU CHAMP POULARD, LA MARCHE
58;RUE DU COIN, LA MARCHE
58;RUE CREUSE, LA MARCHE
58;RUE DES CROTS JAUNES, LA MARCHE
58;RUE DES DEUX DUCHES, LA MARCHE
58;RUE DE L EGLISE, LA MARCHE
58;RUE DES FORGERONS, LA MARCHE
58;RUE DES GACHATS, LA MARCHE
58;RUE DE LA GARE, LA MARCHE
58;RUE DE LA GRANDE POTERNE, LA MARCHE
58;RTE DE GUERIGNY, LA MARCHE
58;CHEM DE HALAGE, LA MARCHE
58;RUE DE LA LOIRE, LA MARCHE
58;RUE MOLLET GOUSSE, LA MARCHE
58;CHEM DU MOULIN A VENT, LA MARCHE
58;CHEM NEUF, LA MARCHE
58;CHEM DU PAVILLON, LA MARCHE
58;RUE DE LA PETITE POTERNE, LA MARCHE
58;CHE DES PIERRES, LA MARCHE
58;CHEM DE LA PLANCHE, LA MARCHE
58;CHEM DES PLANTES DE LA RIVIERE, LA MARCHE
58;SEN DE LA POSTE, LA MARCHE
58;RTE DE RAVEAU, LA MARCHE
58;RUE DES ROSIERS, LA MARCHE
58;RUE ST EXUPERY, LA MARCHE
58;RTE DE TRONSANGES, LA MARCHE
58;CHEM DES VIEUX CRIS, LA MARCHE
58;CHEM DES VIGNES CHAMPS, LA MARCHE
58;RUE DE LA BERGERIE, MARCY
58;RUE DU BOIS PRIEUR, MARCY
58;RUE CASSE COU, MARCY
58;RUE DES CAUMERELLES, MARCY
58;RUE CHAUX, MARCY
58;RTE DE CHEVANNES, MARCY
58;RTE DE COEURS, MARCY
58;RTE DE CORVOL, MARCY
58;RUE DE LA CROIX GRILLOT, MARCY
58;RUE DESREAUX, MARCY
58;RUE DE LA DISTILLERIE, MARCY
58;RUE DES DONGES, MARCY
58;RUE DU FLUTEUX, MARCY
58;RUE DE LA FONTAINE, MARCY
58;RUE DE LA FONTAINE DE COEURS, MARCY
58;RUE FRANCOIS ROSSIGNOL, MARCY
58;CHE DES GADINES, MARCY
58;IMP DE LA GALANDE, MARCY
58;RUE DES GENIEVRES, MARCY
58;GR GRANDE RUE, MARCY
58;CHE DU HART, MARCY
58;RUE DU HAUT, MARCY
58;RUE DE L'HUILERIE, MARCY
58;RUE JACQUIN, MARCY
58;RUE DE LA MAIRIE, MARCY
58;RUE DES MARTINS, MARCY
58;CHE DE LA MESSE, MARCY
58;CHE DU MONTAUBIN, MARCY
58;RUE DU MONTAUBIN, MARCY
58;RUE MOUSSOT, MARCY
58;RUE DES PROMENADES, MARCY
58;RUE DES PUITS CHAILLOT, MARCY
58;RUE ROMAIN BARON, MARCY
58;RUE DE LA ROUBELAINE, MARCY
58;RUE SAINT SULPICE, MARCY
58;RUE SOURCE DES THOMAS, MARCY
58;RUE THOMAS, MARCY
58;RUE DU VIEUX CHATEAU, MARCY
58;LOT LES POMMERATS, MARIGNY-L EGLISE
58;CHE DE L'ABREUVOIR, MARIGNY-L EGLISE
58;RTE DU BARRAGE CHAUME HUIS BOB, MARIGNY-L EGLISE
58;RTE DU BARRAGE QUEUZON, MARIGNY-L EGLISE
58;RTE DE BRASSY LE BOURG, MARIGNY-L EGLISE
58;RTE DE BRASSY MAZIGNIEN BUSSET, MARIGNY-L EGLISE
58;CHE DES BOUCHONS, MARIGNY-L EGLISE
58;CHE DU BRIOU, MARIGNY-L EGLISE
58;CHE DES CARRONS, MARIGNY-L EGLISE
58;RTE DE CHALAUX L'HUIS BARGEOT, MARIGNY-L EGLISE
58;PL DE L'EGLISE, MARIGNY-L EGLISE
58;RTE DE CHALAUX PONT DE QUEUZON, MARIGNY-L EGLISE
58;RTE DE CHASTELLUX L'HUIS BOBIN, MARIGNY-L EGLISE
58;RTE DE CHASTELLUX QUEUZON, MARIGNY-L EGLISE
58;RTE DE CHASTELLUX LAURET, MARIGNY-L EGLISE
58;CHE DE LA CHAUME, MARIGNY-L EGLISE
58;CHE DU CHEF DE GARE, MARIGNY-L EGLISE
58;CHE DU CLOISEAU, MARIGNY-L EGLISE
58;CHE DE COUAN, MARIGNY-L EGLISE
58;RTE DE COUTOLLE, MARIGNY-L EGLISE
58;RUE DU CRESCENT, MARIGNY-L EGLISE
58;CHE DE LA CURE, MARIGNY-L EGLISE
58;CHE DE DESSOUS, MARIGNY-L EGLISE
58;CHE DU 18 JUILLET 1944, MARIGNY-L EGLISE
58;CHE DE LA FERME, MARIGNY-L EGLISE
58;CHE DE LA FONTAINE, MARIGNY-L EGLISE
58;CHE DE LA FORET, MARIGNY-L EGLISE
58;RUE DES FUMEES, MARIGNY-L EGLISE
58;CHE DES GEAIS, MARIGNY-L EGLISE
58;IMP DU GRAND PRE, MARIGNY-L EGLISE
58;RTE DES GRANGES, MARIGNY-L EGLISE
58;CHE DES ILES, MARIGNY-L EGLISE
58;RUE DE LA, MARIGNY-L EGLISE
58;CHE DU LAC, MARIGNY-L EGLISE
58;RTE DE MALIGNIEN, MARIGNY-L EGLISE
58;RTE DU LAC PONT DE QUEUZON, MARIGNY-L EGLISE
58;CHE DU LARE, MARIGNY-L EGLISE
58;CHE DU LAVOIR, MARIGNY-L EGLISE
58;CHE DE LA LOIRE, MARIGNY-L EGLISE
58;RTE DE LORMES, MARIGNY-L EGLISE
58;CHE DE MENNEMOIS, MARIGNY-L EGLISE
58;CHE DE LA MESSE, MARIGNY-L EGLISE
58;CHE DU MINEUR, MARIGNY-L EGLISE
58;RTE DE MONT, MARIGNY-L EGLISE
58;CHE DU MOULIN CROTTEFOU, MARIGNY-L EGLISE
58;CHE DU MOULIN MONTGAUDIER, MARIGNY-L EGLISE
58;RTE DES MOULINS, MARIGNY-L EGLISE
58;CHE DE MOULOIS, MARIGNY-L EGLISE
58;CHE PARIZOT, MARIGNY-L EGLISE
58;CHE DES PARTS, MARIGNY-L EGLISE
58;IMP DE LA PASSERELLE, MARIGNY-L EGLISE
58;CHE DU PONT, MARIGNY-L EGLISE
58;RUE DU PONT, MARIGNY-L EGLISE
58;CHE DES PRES, MARIGNY-L EGLISE
58;IMP DU PUITS, MARIGNY-L EGLISE
58;RTE DE QUARRE CROTTEFOU, MARIGNY-L EGLISE
58;RTE DE QUARRE LE BOURG, MARIGNY-L EGLISE
58;RTE DE RAILLY, MARIGNY-L EGLISE
58;CHE DES RETRAITES, MARIGNY-L EGLISE
58;RTE DE SAINT GERMAIN, MARIGNY-L EGLISE
58;CHE DU TARTRE, MARIGNY-L EGLISE
58;CHE DU THEURIAT, MARIGNY-L EGLISE
58;RTE DE TRONCOIS, MARIGNY-L EGLISE
58;CHE DE LA VELLE, MARIGNY-L EGLISE
58;RTE DE LA VERDIERE, MARIGNY-L EGLISE
58;RTE DE VEZIGNIEUX, MARIGNY-L EGLISE
58;RTE DU LAC LE MONT, MARIGNY-L EGLISE
58;CHE DE BANNERIOT, MARS-SUR-ALLIER
58;CHE DU BOIS MILLIEN, MARS-SUR-ALLIER
58;CHE DE BRUZEAU, MARS-SUR-ALLIER
58;CHE DE BUY, MARS-SUR-ALLIER
58;CHE DU CHAILLOUX, MARS-SUR-ALLIER
58;CHE DU CHAMP PAGENOT, MARS-SUR-ALLIER
58;CHE DE CHEVANNES, MARS-SUR-ALLIER
58;RTE DE L EGLISE, MARS-SUR-ALLIER
58;RTE DE DHERE, MARS-SUR-ALLIER
58;CHE DE L ISLE, MARS-SUR-ALLIER
58;CHE DE MARE, MARS-SUR-ALLIER
58;RTE DE MOIRY, MARS-SUR-ALLIER
58;CHE DE MURTIAU, MARS-SUR-ALLIER
58;CHE D OLIVEAU, MARS-SUR-ALLIER
58;RTE DE SAINCAIZE, MARS-SUR-ALLIER
58;CHE DE SAINT LEGER, MARS-SUR-ALLIER
58;CHE DE LA SAULAIE, MARS-SUR-ALLIER
58;CHE DES TRACES, MARS-SUR-ALLIER
58;CHE DU TREMBLE, MARS-SUR-ALLIER
58;RTE DU VEURDRE, MARS-SUR-ALLIER
58;RES LA CROISADE, MARIGNY SUR YONNE
58;HAM DE CHAZEL, MARIGNY SUR YONNE
58;ECL DES MORTES, MARIGNY SUR YONNE
58;ECL N 29, MARIGNY SUR YONNE
58;ECL N 30, MARIGNY SUR YONNE
58;RUE BERNET, MARIGNY SUR YONNE
58;RUE DE LA CAILLE, MARIGNY SUR YONNE
58;RUE DES BOUCLATS, MARIGNY SUR YONNE
58;RUE DU DOMAINE, MARIGNY SUR YONNE
58;RUE DES CHAMPS BARJOT, MARIGNY SUR YONNE
58;RUE DES EFFRAIES, MARIGNY SUR YONNE
58;RUE DU CIMETIERE, MARIGNY SUR YONNE
58;RUE DE LA FONTAINE, MARIGNY SUR YONNE
58;RUE DE LA FONTAINE DU LOUP, MARIGNY SUR YONNE
58;RUE DES GANETTES, MARIGNY SUR YONNE
58;RUE DU GRAND FOUROT, MARIGNY SUR YONNE
58;RUE DES GRANDES VIGNES, MARIGNY SUR YONNE
58;RUE DE LA GRIOTTE, MARIGNY SUR YONNE
58;RUE JEAN BAPTISTE RIGAUD, MARIGNY SUR YONNE
58;PL DE LA MAIRIE, MARIGNY SUR YONNE
58;RUE DU MOULIN, MARIGNY SUR YONNE
58;RUE MOYAU, MARIGNY SUR YONNE
58;RUE DU NOYAU, MARIGNY SUR YONNE
58;CHE DES PENDEES, MARIGNY SUR YONNE
58;CHE DES PLANTES, MARIGNY SUR YONNE
58;RUE SAINT LEGER, MARIGNY SUR YONNE
58;RUE DU THUREAU, MARIGNY SUR YONNE
58;CHE DES VIGNES, MARIGNY SUR YONNE
58;RUE DU VILLAGE, MARIGNY SUR YONNE
58;RUE DES ACACIAS, MARZY
58;RUE ALFRED SAGLIO, MARZY
58;RUE D AUGUI, MARZY
58;RUE BARREAU, MARZY
58;RUE DU BOIS GUITTON, MARZY
58;CHE DES BORDES, MARZY
58;RUE DU BOIS VILLIAUX, MARZY
58;RUE BOUZITAT, MARZY
58;IMP DE BUSSEROLLES, MARZY
58;RTE DE BUSSEROLLES, MARZY
58;IMP DU CAILLAT, MARZY
58;RUE CARREAU, MARZY
58;RUE DE LA CABANE, MARZY
58;RUE DES CARRIERES, MARZY
58;RUE DE LA CAYUELLE, MARZY
58;RUE DU CHAMP CABANE, MARZY
58;CHE DES CHANDONS, MARZY
58;RUE DES CHARRONS, MARZY
58;RUE CHARTIER, MARZY
58;AV DU CHASNAY, MARZY
58;RUE DE LA CHAUME DES DRUS, MARZY
58;RUE DE LA CHAUME DU POIRIER, MARZY
58;RUE AUX CHEVAUX, MARZY
58;RUE DES CHEVRES, MARZY
58;RUE DU CLOS DES HIRONDELLES, MARZY
58;RUE DU CLOS DES ROCHES, MARZY
58;RTE DE CORCELLES, MARZY
58;RUE DES COUTERIAUX, MARZY
58;RUE COTE DE CONFLANS, MARZY
58;RUE DU CRAPAUD, MARZY
58;RUE DE LA CROIX MORIN, MARZY
58;RUE DE LA CROIX SAINT ETIENNE, MARZY
58;RUE DU CROT, MARZY
58;RUE AUX CROTTES, MARZY
58;CHE DES DEMEURES, MARZY
58;AV DUFAUD, MARZY
58;PL DE L EGLISE, MARZY
58;RUE DES EGOULEAUX, MARZY
58;PL EMILE MARTIN, MARZY
58;IMP DE L ETANG, MARZY
58;RUE DE LA FOLIE, MARZY
58;RUE DE LA FONTAINE, MARZY
58;CHE DE FONTENILLE, MARZY
58;RUE DES FORGERONS GALLOIS, MARZY
58;RTE DE FOURCHAMBAULT, MARZY
58;RUE DES GRANDS CHAMPS, MARZY
58;RUE DU HAUT DE CORCELLES, MARZY
58;IMP DES HIRONDELLES, MARZY
58;RUE DES JARDINS, MARZY
58;IMP DES LAURIERS, MARZY
58;PL LE MALLIER, MARZY
58;RUE DE LOIRE, MARZY
58;IMP DES LUMIERES, MARZY
58;CHEM DU MAGNY, MARZY
58;RUE DES MAGNY, MARZY
58;CHE DE MARCE, MARZY
58;RTE DE MARCE, MARZY
58;IMP MATHIEU, MARZY
58;RUE DES MESANGES, MARZY
58;IMP DU MIDI, MARZY
58;RUE DU MIDI, MARZY
58;RUE M L JOBINOT, MARZY
58;IMP DES MOMBOIS, MARZY
58;CHE DU MONCEAU, MARZY
58;RUE DES MOUREZ, MARZY
58;RTE DE NEVERS, MARZY
58;RUE DU ONZE NOVEMBRE, MARZY
58;RTE DU PANORAMA, MARZY
58;IMP DES PAQUERETTES, MARZY
58;CHE DES PATUREAUX, MARZY
58;RUE DES PATUREAUX, MARZY
58;IMP DES PERDRIX, MARZY
58;CHE DES PETITS PRES, MARZY
58;RUE DE LA PETROQUE, MARZY
58;RUE DES PRETS, MARZY
58;RUE DE LA VIGNE SACREE, MARZY
58;RUE PRINCIPALE, MARZY
58;RUE DU RENARD, MARZY
58;RUE DU RIOT, MARZY
58;RUE DES ROLLANGES, MARZY
58;RUE DE LA ROUESSE, MARZY
58;IMP DE ROUGEON, MARZY
58;RUE DE ROUGEON, MARZY
58;RTE DE SAINT BAUDIERE, MARZY
58;IMP DU SAULE, MARZY
58;RUE DE LA SIMONNERIE, MARZY
58;RTE DE TAZIERES, MARZY
58;RUE DE LA TUILERIE, MARZY
58;IMP DE LA TUILERIE, MARZY
58;CHE DU VERNAY, MARZY
58;ALL DES VIGNES DU CLOS, MARZY
58;IMP DES BELLES BARBES, MARZY
58;IMP DES VIOLETTES, MARZY
58;IMP BELLEVUE, MARZY
58;IMP DU SERPOLET, MARZY
58;IMP DU BOIS VILLIAUX, MARZY
58;CHE DE L'ABREUVOIR, MENESTREAU
58;CHE DES BERTAUDERIES, MENESTREAU
58;CHE DE BOUILLANT, MENESTREAU
58;IMP DU BOURG, MENESTREAU
58;CHE DE CHENET, MENESTREAU
58;RTE DU CIMETIERE, MENESTREAU
58;RTE DES CITERNES, MENESTREAU
58;RTE DE COULOUTRE, MENESTREAU
58;RTE DE LA CROIX BONTEMPS, MENESTREAU
58;RTE CROIX BONTEMPS   VILLIERS, MENESTREAU
58;RTE CROIX SAVIGNAT, MENESTREAU
58;RTE DU CUL DU LOUP, MENESTREAU
58;RUE DE L'EGLISE, MENESTREAU
58;RTE D'ENTRAINS, MENESTREAU
58;RTE DES ETANGS, MENESTREAU
58;IMP DE LA FONTAINE, MENESTREAU
58;CHE DES GUERITES, MENESTREAU
58;RTE DE MENESTREAU, MENESTREAU
58;RTE DE MENOU, MENESTREAU
58;RTE DU MINERAI, MENESTREAU
58;PL DU MONUMENT, MENESTREAU
58;IMP DU PUITS, MENESTREAU
58;CHE DES VIGNES, MENESTREAU
58;CHE DES VIGNES DE CRY, MENESTREAU
58;RTE DE VILLIERS, MENESTREAU
58;RTE DE VRILLON, MENESTREAU
58;CHE DES BARDINS, MENOU
58;RUE DU CHATELET, MENOU
58;CHE DES COIGNETS, MENOU
58;RUE DE LA CROIX, MENOU
58;RUE DU CROT DU LAC, MENOU
58;RUE DES ECOLES, MENOU
58;CHE DES ECOURIEUX, MENOU
58;RUE DE LA MARE, MENOU
58;IMP DES MARNIERES, MENOU
58;RUE DE MENESTREAU, MENOU
58;CHE DES MINIERES, MENOU
58;CHE DE LA MONARDERIE, MENOU
58;RUE DES MOUILLERES, MENOU
58;RUE DU MOULIN, MENOU
58;IMP DU PETIT CHAUFFOUR, MENOU
58;RUE DU PRESBYTERE, MENOU
58;GR GRANDE RUE, MENOU
58;RUE ST SIMEON, MENOU
58;RUE DES TUILLERIES, MENOU
58;RTE D ANTIBES, MESVES SUR LOIRE
58;RUE BASSE, MESVES SUR LOIRE
58;PL BOURDIER, MESVES SUR LOIRE
58;PL CARROU, MESVES SUR LOIRE
58;RUE DU CARROUX, MESVES SUR LOIRE
58;RUE DES CHARMILLES, MESVES SUR LOIRE
58;RUE DE CHARRANT, MESVES SUR LOIRE
58;RUE DU CHATEAU DE MOURON, MESVES SUR LOIRE
58;RUE DU CIMETIERE, MESVES SUR LOIRE
58;RUE DU CLOITRE, MESVES SUR LOIRE
58;RUE DU CROT DES PIERRES, MESVES SUR LOIRE
58;RUE DE L ECHO, MESVES SUR LOIRE
58;RUE DES ECOLES, MESVES SUR LOIRE
58;RUE DE L ETANG, MESVES SUR LOIRE
58;AV DE LA GARE, MESVES SUR LOIRE
58;CHE DE L ILE DU BAS, MESVES SUR LOIRE
58;RUE DE LOIRE, MESVES SUR LOIRE
58;RUE MAUBOIS, MESVES SUR LOIRE
58;RUE DU MAZOU, MESVES SUR LOIRE
58;RTE NATIONALE 7, MESVES SUR LOIRE
58;RUE DE NEUVILLE, MESVES SUR LOIRE
58;RUE DU PARCON, MESVES SUR LOIRE
58;CHEM DU BOIS DAVID, MESVES SUR LOIRE
58;RUE DES PERRIERS, MESVES SUR LOIRE
58;RUE DU POELON, MESVES SUR LOIRE
58;RUE DE POUILLY, MESVES SUR LOIRE
58;RUE DES RIGOULEAU, MESVES SUR LOIRE
58;RUE DES SABLES, MESVES SUR LOIRE
58;RUE DE LA VALLEE DE CHARRANT, MESVES SUR LOIRE
58;RTE DE L'ARMANCE, METZ-LE-COMTE
58;RUE DES BIGUES, METZ-LE-COMTE
58;RUE BOUDARD, METZ-LE-COMTE
58;PL DE LA CHAPELLE, METZ-LE-COMTE
58;RUE DE LA CHAPELLE, METZ-LE-COMTE
58;RUE DE CHATEAURENAULT, METZ-LE-COMTE
58;RUE DES CHEVRES, METZ-LE-COMTE
58;RUE DU COLOMBIER, METZ-LE-COMTE
58;RTE DE LA FORET, METZ-LE-COMTE
58;CHE DES FOSSES, METZ-LE-COMTE
58;RUE DES FOSSES, METZ-LE-COMTE
58;RTE DE LORMES, METZ-LE-COMTE
58;PL DE LA MAIRIE, METZ-LE-COMTE
58;RUE MARTIN, METZ-LE-COMTE
58;RUE MILLIEN, METZ-LE-COMTE
58;RUE NARCY, METZ-LE-COMTE
58;RUE PITOIS, METZ-LE-COMTE
58;CHE DE SERIN, METZ-LE-COMTE
58;RTE DE TANNAY, METZ-LE-COMTE
58;RTE DE TEIGNY, METZ-LE-COMTE
58;RTE DE VEZELAY, METZ-LE-COMTE
58;RUE DES VIGNES DU FOUR, METZ-LE-COMTE
58;RUE DU CIMETIERE, MHERE
58;RTE DE BRASSY, MHERE
58;RTE DE CHATEAU-CHINON, MHERE
58;CHE DE HUARD, MHERE
58;IMP DE L'ABREUVOIR, MHERE
58;RLE DE L'ARC, MHERE
58;COUR DE L'ECOLE, MHERE
58;RUE DE LA BOUNE YAU, MHERE
58;RUE DE LA CHAPELLE, MHERE
58;RUE DE LA CHAUME, MHERE
58;IMP DE LA COMME, MHERE
58;CHE DE LA CROIX, MHERE
58;RTE DE LA CROIX MILAN, MHERE
58;RLE DE LA FEUILLE, MHERE
58;IMP DE LA FORET, MHERE
58;RUE DE LA GOULOTTE, MHERE
58;IMP DE LA MONNAIE, MHERE
58;IMP DE LA TANNERIE, MHERE
58;RUE DE LA TASSINAIRE, MHERE
58;RUE DE LA TOUR, MHERE
58;IMP DE LA VIGNE, MHERE
58;RTE DE LINIERES, MHERE
58;RTE DE MARIGNY, MHERE
58;RTE DE PRELOUIS, MHERE
58;RTE DE VAUCLAIX, MHERE
58;RUE DES BARRES, MHERE
58;IMP DES BAYOLLES, MHERE
58;CHE DES BORDELETS, MHERE
58;IMP DES BOURGEOIS, MHERE
58;IMP DES CARRIOTS, MHERE
58;IMP DES CHAMPS, MHERE
58;CHE DES CHAMPS DESSUS, MHERE
58;RUE DES CHAUMES, MHERE
58;RUE DES CREUSETS, MHERE
58;RUE DES ILES, MHERE
58;RUE DES MELOISES, MHERE
58;RLE DES MONTAGNES, MHERE
58;IMP DES OUCHES, MHERE
58;RUE DES OUCHES, MHERE
58;RUE DES PATIS, MHERE
58;RUE DES PRES, MHERE
58;RUE DU BANQUET, MHERE
58;IMP DU BIEF, MHERE
58;IMP DU BRANCHOT, MHERE
58;RUE DU CART, MHERE
58;RUE DU CHAMP ROUSSOT, MHERE
58;IMP DU CORDONNIER, MHERE
58;IMP DU CRAU, MHERE
58;RUE DU GRAND NABOT, MHERE
58;RTE DU LAC, MHERE
58;RUE DU LAVOIR, MHERE
58;RUE DU MERLE, MHERE
58;IMP DU MEUNIER, MHERE
58;RTE DU MOULIN, MHERE
58;IMP DU NOYER, MHERE
58;RUE DU PARADIS, MHERE
58;RTE DU PETIT LAC, MHERE
58;RUE DU PETIT NABOT, MHERE
58;RUE DU PLATEAU, MHERE
58;VOIE ROMAINE, MHERE
58;PL SAINT GERMAIN, MHERE
58;LOT COMMUNAL DE LA GARE, MILLAY
58;RTE BUISSONNIERE, MILLAY
58;IMP CHEZ BEROT, MILLAY
58;RTE D'AUTUN, MILLAY
58;RTE DE BIBRACTE, MILLAY
58;IMP DE CHAMPOUX, MILLAY
58;RTE DE CHAMPREVAULT, MILLAY
58;RTE DE CHEVRETTE, MILLAY
58;IMP DE COMMANDIN, MILLAY
58;RTE DE CREUZILLE, MILLAY
58;RTE DE DONE, MILLAY
58;CHE DE FOUGERES, MILLAY
58;RTE DE L'ETANG DU GAT, MILLAY
58;RTE DE LA BOUTRILLE, MILLAY
58;CHE DE LA CREUSE, MILLAY
58;RUE DE LA CROIX, MILLAY
58;RUE DE LA FOULQUIERE, MILLAY
58;RTE DE LA GARDE, MILLAY
58;RUE DE LA GARE, MILLAY
58;RUE DE LA MONTAGNE, MILLAY
58;RTE DE LA PIERRE SAINT MAURICE, MILLAY
58;RUE DE LA TANNERIE, MILLAY
58;IMP DE LA VALLEE, MILLAY
58;IMP DE LA VIGNE, MILLAY
58;RUE DE LA VIGNE, MILLAY
58;CHE DE LANOISELEE, MILLAY
58;RTE DE LAVAULT, MILLAY
58;RTE DE MAGNY, MILLAY
58;RTE DE MONTSAUTON, MILLAY
58;RUE DE PENSE NEUVE, MILLAY
58;RTE DE SOUS MONTBIGNON, MILLAY
58;CHE DES BRULES, MILLAY
58;RTE DES BUIS, MILLAY
58;CHE DES CHAMPS ROUSSEAU, MILLAY
58;IMP DES COQUELICOTS, MILLAY
58;RUE DES CREVATS, MILLAY
58;IMP DES DREILLOTS, MILLAY
58;RTE DES GENETTES, MILLAY
58;RTE DES RIMBAULTS, MILLAY
58;IMP DES SAGES, MILLAY
58;AV DES TILLEULS, MILLAY
58;CHE DES VERNES, MILLAY
58;RTE DU BOIS DE VELLE, MILLAY
58;IMP DU BOIS RENARD, MILLAY
58;IMP DU BOURG, MILLAY
58;CHE DU BOUSSET, MILLAY
58;RTE DU CARRAGE, MILLAY
58;CHE DU CHAMP D'ARRET, MILLAY
58;RUE DU CHAMP JOLY, MILLAY
58;IMP DU COLONEL, MILLAY
58;IMP DU DOMAINE DE L'ETANG, MILLAY
58;RTE DU GRAND MARIE, MILLAY
58;IMP DU GRAND MONTIGNY, MILLAY
58;RUE DU LAVOIR, MILLAY
58;RTE DU MONTPRON, MILLAY
58;RTE DU PETIT MARIE, MILLAY
58;IMP DU PLONGEON, MILLAY
58;RUE DU THEUREAU, MILLAY
58;RUE DU VERGER, MILLAY
58;CHE FERRE MONTIGNY, MILLAY
58;IMP LA MELOISE, MILLAY
58;IMP SAINT ROCH, MILLAY
58;RUE DE L ABREUVOIR, MONCEAUX-LE-COMTE
58;PL ANDRE GROSJEAN, MONCEAUX-LE-COMTE
58;RUE DE LA BOUCHERIE, MONCEAUX-LE-COMTE
58;RLE DES BOUES, MONCEAUX-LE-COMTE
58;RLE CANET, MONCEAUX-LE-COMTE
58;RUE CARNOT, MONCEAUX-LE-COMTE
58;PL DU CHAMP DE FOIRE, MONCEAUX-LE-COMTE
58;RUE DU CHAMP DE FOIRE, MONCEAUX-LE-COMTE
58;RUE DU CHATEAU, MONCEAUX-LE-COMTE
58;RTE DE CLAMECY, MONCEAUX-LE-COMTE
58;RUE COLON DE MONTFORT, MONCEAUX-LE-COMTE
58;RUE DU COMMERCE, MONCEAUX-LE-COMTE
58;CHE DE LA CROIX ROUGE, MONCEAUX-LE-COMTE
58;RUE DERRIERE, MONCEAUX-LE-COMTE
58;PAS DE L ECOLE, MONCEAUX-LE-COMTE
58;RUE EDOUARD GROSJEAN, MONCEAUX-LE-COMTE
58;RUE DE L EGLISE, MONCEAUX-LE-COMTE
58;RLE DE L EGLISE, MONCEAUX-LE-COMTE
58;PL DE L EGLISE, MONCEAUX-LE-COMTE
58;RUE DE LA MAIRIE, MONCEAUX-LE-COMTE
58;PL DE LA MAIRIE, MONCEAUX-LE-COMTE
58;RUE MEURSON, MONCEAUX-LE-COMTE
58;RUE MOIREAU, MONCEAUX-LE-COMTE
58;QUAI DU MOULIN, MONCEAUX-LE-COMTE
58;RUE DE LA NOURRICE, MONCEAUX-LE-COMTE
58;RLE DU PAVE, MONCEAUX-LE-COMTE
58;RUE DU PETIT MONSIEUR, MONCEAUX-LE-COMTE
58;RUE DU PONT, MONCEAUX-LE-COMTE
58;RLE DES PRES, MONCEAUX-LE-COMTE
58;RUE DU PRESBYTERE, MONCEAUX-LE-COMTE
