58;RUE DE LA CHAPELLE, ACHUN
58;RTE DE BLIN, ACHUN
58;CHE DE CHAVANCE, ACHUN
58;CHE DE LA BASSE-COUR, ACHUN
58;CHE DE LA BOUCLE, ACHUN
58;RTE DE LA FORET, ACHUN
58;RTE DE MARRE, ACHUN
58;RTE DE PAIN, ACHUN
58;RTE DE VARIGNY, ACHUN
58;RTE DES BLES D'OR, ACHUN
58;CHE DES CHAUMES, ACHUN
58;CHE DES ECLUSES, ACHUN
58;RTE DES FLEURS, ACHUN
58;RUE DES GUILLAUMES, ACHUN
58;CHE DES NIARDS, ACHUN
58;CHE DES OUCHES, ACHUN
58;IMP DES VARENNES, ACHUN
58;RTE DU CANAL, ACHUN
58;CHE DU CHAMP ROND, ACHUN
58;RTE DU COUDRAY, ACHUN
58;CHE DU LAVOIR, ACHUN
58;CHE DU PETIT ROCHE, ACHUN
58;RTE ROSA BONHEUR, ACHUN
58;PL SAINT LAURENT, ACHUN
58;LOT LE CHAMP TILLOT, ALLIGNY COSNE
58;RTE DES BARBEZANS, ALLIGNY COSNE
58;RTE DE BOUHY, ALLIGNY COSNE
58;RUE DE LA BOURRE GAUDRY, ALLIGNY COSNE
58;RUE DE LA BROSSE, ALLIGNY COSNE
58;RTE DE LA BUZARDERIE, ALLIGNY COSNE
58;CHE DES CAPIJOLETTES, ALLIGNY COSNE
58;RTE DES CAPIJOLETTES, ALLIGNY COSNE
58;CHEM DES CHAMPS DIEUX, ALLIGNY COSNE
58;RUE DES CHAMPS DIEUX, ALLIGNY COSNE
58;RUE DES CHAMPS DU ROUSSIOT, ALLIGNY COSNE
58;IMP DU CHAMP TILLOT, ALLIGNY COSNE
58;RUE DU CHAMP TILLOT, ALLIGNY COSNE
58;RTE DE COSNE, ALLIGNY COSNE
58;RUE CREUSE, ALLIGNY COSNE
58;RTE DE DAMPIERRE, ALLIGNY COSNE
58;RTE DE DONZY, ALLIGNY COSNE
58;IMP DE LA RTE DE DONZY, ALLIGNY COSNE
58;RTE DE LA DUCROTTE, ALLIGNY COSNE
58;RTE DU FORT CHABROL, ALLIGNY COSNE
58;RUE DE LA GARE, ALLIGNY COSNE
58;RUE DU GRAND DESERT, ALLIGNY COSNE
58;IMP DES GRANDS CHAMPS, ALLIGNY COSNE
58;RUE DES GRANDS CHAMPS, ALLIGNY COSNE
58;CHEM DU LAVOIR, ALLIGNY COSNE
58;RUE DE NAVRAU, ALLIGNY COSNE
58;CHEM DES PETITES VALLEES, ALLIGNY COSNE
58;RUE PIERRE DOUDEAU, ALLIGNY COSNE
58;RUE DE LA PLANCHE, ALLIGNY COSNE
58;RUE DU STADE, ALLIGNY COSNE
58;RTE DE ST AMAND, ALLIGNY COSNE
58;RTE DE ST VERAIN, ALLIGNY COSNE
58;IMP DE VILLEROT, ALLIGNY COSNE
58;RUE DE VILLEROT, ALLIGNY COSNE
58;RUE JEAN GENET, ALLIGNY-EN-MORVAN
58;DOM DE BOUTEUILLE, ALLUY
58;ZA DU BOIS DE SEIGNE, ALLUY
58;RUE D'AIGUILLY, ALLUY
58;RUE D'ARON, ALLUY
58;RUE DE BEUGNON, ALLUY
58;RUE DE BOUCHOT, ALLUY
58;RUE DE BRINAY, ALLUY
58;RTE DE CERCY, ALLUY
58;RTE DE CHATILLON, ALLUY
58;RUE DE COEUILLON, ALLUY
58;RUE DE GROND, ALLUY
58;RUE DE L'ABREUVOIR, ALLUY
58;RUE DE L'HATE DES FILLES, ALLUY
58;RUE DE LA BOULAINE, ALLUY
58;RUE DE LA CLOUGEOTTE, ALLUY
58;RUE DE LA CREUZOTTE, ALLUY
58;RUE DE LA FORET, ALLUY
58;RTE DE LA GARENNE, ALLUY
58;RUE DE LA JUSTICE, ALLUY
58;RUE DE LA MONIOTTE, ALLUY
58;RUE DE MARIJOT, ALLUY
58;RUE DE MEULOT, ALLUY
58;RUE DE PERRANGES, ALLUY
58;RUE DE PONTSEUIL, ALLUY
58;RTE DE SAINT-SAULGE, ALLUY
58;RTE DE TINTURY, ALLUY
58;RUE DE TOUTEILLE, ALLUY
58;RUE DES BARBAUX, ALLUY
58;RUE DES BOUMOTTES, ALLUY
58;RUE DES COUEES, ALLUY
58;RUE DES CROUX, ALLUY
58;RUE DES ENFANTS, ALLUY
58;RUE DES HEUMES, ALLUY
58;RUE DES HEURTRAS, ALLUY
58;RUE DES JONCS, ALLUY
58;RUE DES OUFROTS, ALLUY
58;RUE DES PATUREAUX, ALLUY
58;RUE DES PATURES NOIRES, ALLUY
58;RUE DES PELOUSES, ALLUY
58;RUE DES PIVOINES, ALLUY
58;RUE DES PRAIRIES, ALLUY
58;IMP DES PRES SEIGNOT, ALLUY
58;RUE DES SAPINS, ALLUY
58;RUE DES TESSONGES, ALLUY
58;RUE DU CANAL, ALLUY
58;RUE DU CHAMP BILY, ALLUY
58;RUE DU CHATEAU, ALLUY
58;RUE DU CLOS BLEU, ALLUY
58;RUE DU COUVENT, ALLUY
58;RUE DU CROT MATHE, ALLUY
58;RUE DU FOND DE GRILLOT, ALLUY
58;RUE DU GOUTY, ALLUY
58;RTE DU PALAIS, ALLUY
58;RUE DU POIRIER, ALLUY
58;RUE DU PRESBYTERE, ALLUY
58;RUE DU RELAIS POSTE, ALLUY
58;RUE DU REPOS, ALLUY
58;RUE DU TREMBOULIN, ALLUY
58;RUE FLEURIE, ALLUY
58;RUE L'HUY MORLOT, ALLUY
58;RTE SAINT LAURENT, ALLUY
58;PL SAINT-PAUL, ALLUY
58;PRV SAINT-PIERRE, ALLUY
58;RUE VIEILLE, ALLUY
58;RUE DE L'AMOUR, AMAZY
58;RTE D'ASNOIS, AMAZY
58;RUE BERTHAULT, AMAZY
58;RUE DE LA CHAPELLE, AMAZY
58;RTE DE CLAMECY, AMAZY
58;RTE DE CREUX, AMAZY
58;CHE DES FOSSES, AMAZY
58;RUE DES FOSSES, AMAZY
58;GR GRANDE RUE, AMAZY
58;RUE GRILLOT, AMAZY
58;RUE RENE GUILERAND, AMAZY
58;CHE DES JARDINS, AMAZY
58;PL DE LA MAIRIE, AMAZY
58;RUE DE LA PORTE DESSOUS, AMAZY
58;RUE DE LA POTERNE, AMAZY
58;RUE DU PUITS DE L'ANE, AMAZY
58;RTE DE TANNEAU, AMAZY
58;RTE TANNAY, AMAZY
58;RUE DU BOURG, ANLEZY
58;RUE DES CHATS, ANLEZY
58;RUE DES ECOLES, ANLEZY
58;PL DE L'EGLISE, ANLEZY
58;RUE DE L'ESCARGOT, ANLEZY
58;RTE DE FERTREVE, ANLEZY
58;RUE DU PUITS, ANLEZY
58;RUE DU STADE, ANLEZY
58;IMP DE L'ARTISTE, ANLEZY
58;RTE DE ROUY, ANLEZY
58;RTE DE FAVERELLES, ANNAY
58;PL ANNA PARDIEU, ANNAY
58;IMP BEL'AIR, ANNAY
58;RTE DE L'ECORSIN, ANNAY
58;RUE DE L'EGLISE, ANNAY
58;RTE DE LA BELLE POULE, ANNAY
58;RTE DE LA CHAMPIGNONNERIE, ANNAY
58;RTE DE LA CROIX DU CHATELET, ANNAY
58;RUE DE LA MAIRIE, ANNAY
58;IMP DE LA MARE, ANNAY
58;RTE DE LA METAIRIE DE GATINE, ANNAY
58;CHE DE LA METAIRIE HOUARD, ANNAY
58;RTE DE LA MONTAGNE, ANNAY
58;RTE DE LA PIERRE AIGUE, ANNAY
58;RUE DE LA POINCONNERIE, ANNAY
58;RTE DE LA VIEVRE, ANNAY
58;IMP DE LA VRILLE, ANNAY
58;IMP DE PEGASE, ANNAY
58;RTE DE PLAMERAS, ANNAY
58;RTE DE RUISSES, ANNAY
58;RTE DE SERMAIZE, ANNAY
58;CHE DES BRUNEAUX, ANNAY
58;RTE DES CHAMPS LANDY, ANNAY
58;IMP DES CHATS, ANNAY
58;RTE DES FORTUNES, ANNAY
58;RTE DES FROSSARDS, ANNAY
58;CHE DES GRANDS PICARDS, ANNAY
58;RTE DES MAISONS JUGES, ANNAY
58;IMP DES MARTINETS, ANNAY
58;IMP DES MESANGES, ANNAY
58;RTE DES NISSONS, ANNAY
58;RTE DES OUDOTS, ANNAY
58;IMP DES POMMIERS, ANNAY
58;RTE DES RIBEAUX, ANNAY
58;CHE DES RONDEAUX, ANNAY
58;RTE DES THEBONDONS, ANNAY
58;RTE DES VALLOTS, ANNAY
58;IMP DU BOIS DU JARRIER, ANNAY
58;IMP DU CHAMP DU MOULIN, ANNAY
58;RTE DU CHATEAU, ANNAY
58;RTE DU CHATELET, ANNAY
58;RTE DU CONGAILLARD, ANNAY
58;RTE DU CROT SAULOY, ANNAY
58;SEN DU CROT SAULOY, ANNAY
58;CHE DU FIGUIER, ANNAY
58;CHE DU MOULIN ECORCE, ANNAY
58;IMP DU NOYER, ANNAY
58;IMP DU PATIS, ANNAY
58;RTE DU PATIS, ANNAY
58;IMP LES BERTOIS, ANNAY
58;CHE LES GRANDS CHAMPS, ANNAY
58;CHE LES PETITS COCUS, ANNAY
58;IMP MARCEL GENTY, ANNAY
58;CHT DES EPINGLES, ANTHIEN
58;IMP D'ECHON, ANTHIEN
58;RUE DE L'AUXOIS, ANTHIEN
58;RUE DE L'EGLISE, ANTHIEN
58;RUE DE L'HUILERIE, ANTHIEN
58;RUE DE LA BEAUME, ANTHIEN
58;RUE DE LA CORVEE, ANTHIEN
58;RUE DE LA COY, ANTHIEN
58;RUE DE LA LOUVETTE, ANTHIEN
58;RUE DE LA MAIRIE, ANTHIEN
58;RUE DE LA MARE, ANTHIEN
58;RUE DE LA MESSE, ANTHIEN
58;IMP DE LA RIVIERE, ANTHIEN
58;IMP DE MONTBOLIN, ANTHIEN
58;PL DES ACACIAS, ANTHIEN
58;IMP DES BARREES, ANTHIEN
58;IMP DES BROSSES, ANTHIEN
58;RUE DES HAUTS DE SANCY, ANTHIEN
58;IMP DES JARDINS, ANTHIEN
58;RUE DES LIMES, ANTHIEN
58;RUE DES PLANTES, ANTHIEN
58;IMP DES QUARTS, ANTHIEN
58;IMP DES VIGNES, ANTHIEN
58;RUE DU CALVAIRE, ANTHIEN
58;RUE DU CHATEAU, ANTHIEN
58;IMP DU CLOS BONNET, ANTHIEN
58;RUE DU CROT NOIR, ANTHIEN
58;RUE DU GUE MASSOT, ANTHIEN
58;IMP DU LAVOIR CHASSEIGNE, ANTHIEN
58;RUE DU LAVOIR, ANTHIEN
58;RUE DU PUITS COURTOT, ANTHIEN
58;RUE LES MIGNODONS, ANTHIEN
58;RUE MOREAU, ANTHIEN
58;IMP PARRUE, ANTHIEN
58;IMP DU LAVOIR BOURG, ANTHIEN
58;RUE DES ACACIAS, ARBOURSE
58;COUR DES ANCIENS COMMERCES, ARBOURSE
58;COUR DES CAMINS, ARBOURSE
58;RTE DE CHATEAUNEUF, ARBOURSE
58;RUE DES CHENEVIERES, ARBOURSE
58;ALL DE LA CROIX, ARBOURSE
58;ALL DU CROT DE L'ORME, ARBOURSE
58;COUR DU GRAND CHAMP, ARBOURSE
58;ALL DU LAVOIR ST JACQUES, ARBOURSE
58;RUE DU LAVOIR ST JACQUES, ARBOURSE
58;RUE DE LA MARE, ARBOURSE
58;RUE DES OUCHES, ARBOURSE
58;COUR DES PIES, ARBOURSE
58;CHE DES PROMENEURS, ARBOURSE
58;RUE DES PUITS, ARBOURSE
58;IMP DES TREMBLES, ARBOURSE
58;RTE DES TUILERIES, ARBOURSE
58;RTE DES VALLEES, ARBOURSE
58;RTE DE LA VENDOME, ARBOURSE
58;IMP DES BOULETS, ARLEUF
58;RUE DES BRUYERES, ARLEUF
58;IMP DES CHARMILLES, ARLEUF
58;RUE DU CHATEAU, ARLEUF
58;RTE DU CHATELET, ARLEUF
58;RTE DU CHATZ, ARLEUF
58;RTE CHAUVEAUX, ARLEUF
58;RUE FERNAND DUSSERT, ARLEUF
58;RUE DE L'EGLISE, ARLEUF
58;RUE DE LA FONTAINE ORA, ARLEUF
58;RUE DU DOCTEUR GARDET, ARLEUF
58;RUE LAZARE GIRARD, ARLEUF
58;RTE DU HAUT FOLIN, ARLEUF
58;RTE DU HAUT MORVAN, ARLEUF
58;RUE DE LANCRAY, ARLEUF
58;IMP DE LA PROIE, ARLEUF
58;ALL DE SOMBREFFE, ARLEUF
58;RTE D AVALLON, ARMES
58;RTE BUISSONNIERE, ARMES
58;RUE CLAUDE TILLIER, ARMES
58;RUE CORNELIUS, ARMES
58;RUE DE LA CREUE, ARMES
58;RUE CREUSE, ARMES
58;RUE DE L EGLISE, ARMES
58;PL DE LA FONTAINE, ARMES
58;RTE NATIONALE, ARMES
58;ALL PAUL NICOLAS, ARMES
58;RUE DES PRES, ARMES
58;RUE DU PRESBYTERE, ARMES
58;RUE DE LA TORGEE, ARMES
58;RUE VALLEE DE LA FORGE, ARMES
58;RUE DU VEAU, ARMES
58;PL DE LA BASCULE, ARQUIAN
58;RUE DE LA BASCULE, ARQUIAN
58;RTE DE LA BASSERIE, ARQUIAN
58;PL JEAN CARRIES, ARQUIAN
58;RTE DE LA CELLE, ARQUIAN
58;RTE DU CHATEAU, ARQUIAN
58;RUE DES DEUX PONTS, ARQUIAN
58;RUE DES ECHELLES, ARQUIAN
58;CHEM DE L ERMITAGE, ARQUIAN
58;RTE DE LAVAU, ARQUIAN
58;RUE DU MOULIN, ARQUIAN
58;RTE DE NEUVY, ARQUIAN
58;RTE DE ST AMAND, ARQUIAN
58;RTE DE ST VERAIN, ARQUIAN
58;RUE SOBIESKY, ARQUIAN
58;RTE DES VALLOTS, ARQUIAN
58;RUE DE LA MAIRIE, ARZEMBOUY
58;RUE DE L ABREUVOIR, ASNAN
58;RUE CHATEAURENAUD, ASNAN
58;RUE DU COQ, ASNAN
58;RUE D EGYPTE, ASNAN
58;RUE DE LA FONTAINE, ASNAN
58;RUE DE GERMENAY, ASNAN
58;RUE DE GRENOIS, ASNAN
58;PL DU GUEUR, ASNAN
58;RUE D HUBANS, ASNAN
58;PL SAINT JEAN, ASNAN
58;RUE SOUS MONTGUE, ASNAN
58;RUE DE TANNAY, ASNAN
58;RUE DES AMOURETTES, ASNOIS
58;RLE DE LA PETITE ARGENTINE, ASNOIS
58;RUE DES BONS ENFANTS, ASNOIS
58;RUE DE BREVES, ASNOIS
58;CHE DES CHARMILLES, ASNOIS
58;RUE DU CHARRON, ASNOIS
58;PL DU CHATEAU, ASNOIS
58;RUE DU CHATEAU, ASNOIS
58;CHE DES GRANDES CHENEVIERES, ASNOIS
58;CHE DE SAINTE CHRISTINE, ASNOIS
58;RUE DES CRYS, ASNOIS
58;RUE DES DAMES, ASNOIS
58;RUE DE L'EGLISE, ASNOIS
58;AV DE LA GARE, ASNOIS
58;RUE DE L'INSTITUTEUR, ASNOIS
58;PL DU JEU DE QUILLES, ASNOIS
58;RUE DU LAVOIR, ASNOIS
58;RUE DE SAINT LOUP, ASNOIS
58;RUE DU MOULIN, ASNOIS
58;RUE NEUVE, ASNOIS
58;IMP DU PORTAIL, ASNOIS
58;RUE TOURNANTE, ASNOIS
58;RUE TRAVERSIERE, ASNOIS
58;RTE DES BRUYERES DE CRECY, AVRIL-SUR-LOIRE
58;RTE DE COSSAYE, AVRIL-SUR-LOIRE
58;CHE DES FEUILLETS, AVRIL-SUR-LOIRE
58;CHE DU GRAND DOMAINE, AVRIL-SUR-LOIRE
58;PL DE LA MAIRIE, AVRIL-SUR-LOIRE
58;CHE DE MUSSY, AVRIL-SUR-LOIRE
58;RTE DE ST GERMAIN, AVRIL-SUR-LOIRE
58;CHE DU VERNOUX, AVRIL-SUR-LOIRE
58;RTE DE CHANTENAY, AZY-LE-VIF
58;PL DE L EGLISE, AZY-LE-VIF
58;RUE DE LA NOUE, AZY-LE-VIF
58;RTE DE SAINT PARIZE, AZY-LE-VIF
58;RTE DE SAINT PIERRE, AZY-LE-VIF
58;RUE DE L'ABBE GOULOT, BAZOCHES
58;CHE DE LA BERGERIE, BAZOCHES
58;CHE DU BOIS, BAZOCHES
58;RUE BOULOT, BAZOCHES
58;RUE CALAIS, BAZOCHES
58;RUE CARNOT, BAZOCHES
58;RUE DU CHAMPETRE, BAZOCHES
58;RTE DU CHATEAU, BAZOCHES
58;RUE DE LA CHAUME, BAZOCHES
58;RUE DE LA COPERIE, BAZOCHES
58;RTE DE CORBIGNY, BAZOCHES
58;RUE DU CROQUELET, BAZOCHES
58;RTE DU DOMAINE DE L'ARMANCE, BAZOCHES
58;RTE DU DOMAINE DE ROUSSEAU, BAZOCHES
58;RTE DU DOMAINE DE VAUBAN, BAZOCHES
58;RUE D'ECOSSE, BAZOCHES
58;RTE D'EMPURY, BAZOCHES
58;RUE DE LA FLORE, BAZOCHES
58;IMP DE LA FONTAINE, BAZOCHES
58;RUE DU FOURNEAU, BAZOCHES
58;RUE DE L'HUIS GUENIN RENAULT, BAZOCHES
58;RTE DE LORMES, BAZOCHES
58;PL DE LA MAIRIE, BAZOCHES
58;CHE DE LA MESSE, BAZOCHES
58;RUE DE MONTJOUME, BAZOCHES
58;CHE DE NEUFFONTAINES, BAZOCHES
58;CHE DE L'OISEAU, BAZOCHES
58;RUE DU PUITS, BAZOCHES
58;VOIE ROMAINE, BAZOCHES
58;RUE ROULOT, BAZOCHES
58;RUE DES RUEES, BAZOCHES
58;PL SAINT HILAIRE, BAZOCHES
58;CHE DE SAINT ROCH, BAZOCHES
58;RTE DES VIEILLES VIGNES, BAZOCHES
58;RTE DES VIEILLES VIGNES, BAZOCHES
58;RTE DE VILLARS, BAZOCHES
58;HAM LA BRETONNIERE, BAZOLLES
58;HAM BUSSIERE, BAZOLLES
58;HAM LE CHARDONNERET, BAZOLLES
58;HAM LA GROSSAS, BAZOLLES
58;HAM MOUGNY, BAZOLLES
58;HAM LES QUARTIERS, BAZOLLES
58;HAM SELINS, BAZOLLES
58;RTE D'ACHUN, BAZOLLES
58;PL ANDRE CORNU, BAZOLLES
58;CHE DU BOIS DES TROCHES, BAZOLLES
58;RUE DU BOURG, BAZOLLES
58;RUE DU CANAL, BAZOLLES
58;IMP DES CHAGNOTS, BAZOLLES
58;RTE DU CHAMP TOURNET, BAZOLLES
58;IMP DU CHAMP TOURNET, BAZOLLES
58;RUE DU CHATEAU, BAZOLLES
58;CHE DE LA CHAUME, BAZOLLES
58;PL DE L'EGLISE, BAZOLLES
58;RTE DE L'ETANG, BAZOLLES
58;RUE DES EVRAINS, BAZOLLES
58;RTE DU GRAND JAILLY, BAZOLLES
58;RTE DU GRAND MEURE, BAZOLLES
58;RTE DE JAILLY, BAZOLLES
58;IMP DES LOBES, BAZOLLES
58;RTE DU PETIT JAILLY, BAZOLLES
58;CHE DE LA PETITE VENDEE, BAZOLLES
58;IMP DE LA PLANCHOTTE, BAZOLLES
58;RTE DU PRE DE LA FONTAINE, BAZOLLES
58;RTE DE RIGNY, BAZOLLES
58;IMP DES TILLEULS, BAZOLLES
58;RTE DE DRUY, BEARD
58;RUE DE LA FONTAINE BONNE DAME, BEARD
58;RTE DE LOIRE, BEARD
58;RTE DEPARTEMENTALE 981, BEARD
58;RTE DE LA REPINERIE, BEARD
58;RUE DU SOMBRE, BEARD
58;RTE DES USAGES, BEARD
58;RUE DE L'ABREUVOIR, BEAULIEU
58;CHEM DU CIMETIERE, BEAULIEU
58;CHEM DES CLOUDS, BEAULIEU
58;PL DE L'EGLISE, BEAULIEU
58;IMP DU FER A CHEVAL, BEAULIEU
58;COUR AUX POULAINS, BEAULIEU
58;RUE DE LA RENARDE, BEAULIEU
58;RUE SAINT PHALLE, BEAULIEU
58;PL DU CALVAIRE, BEAULIEU
58;RUE DE LA CROIX BOISEE, BEAULIEU
58;IMP DES DIMES, BEAULIEU
58;CHE DE L'ETANG, BEAULIEU
58;RUE DE HERY, BEAULIEU
58;RUE DU LAVOIR, BEAULIEU
58;RUE DES PRES, BEAULIEU
58;RTE DE REUGNY, BEAULIEU
58;RUE DE LA CHAPELLE, BEAULIEU
58;RUE DES FORGES, BEAULIEU
58;RUE DES OUCHES, BEAULIEU
58;RUE DES VERGERS, BEAULIEU
58;RUE DES TISSERANDS, BEAULIEU
58;RUE DES VIGNERONS, BEAULIEU
58;RUE ACHILLE MILLIEN, BEAUMONT-LA-FERRIERE
58;RTE COMTE DE SAINT VALLIER, BEAUMONT-SARDOLLES
58;PL DE L'ABBE BONNARD, BEAUMONT-SARDOLLES
58;RTE DE L'ANCIENNE ECOLE, BEAUMONT-SARDOLLES
58;RUE DE LA CHAPELLE, BEAUMONT-SARDOLLES
58;IMP DE LA CHAUME PINET, BEAUMONT-SARDOLLES
58;RTE DE LA JEANNE, BEAUMONT-SARDOLLES
58;RUE DE LA LIBERTE, BEAUMONT-SARDOLLES
58;RTE DE LA SARDOLLES, BEAUMONT-SARDOLLES
58;RTE DE LA SOURCE BLEUE, BEAUMONT-SARDOLLES
58;IMP DE MERY, BEAUMONT-SARDOLLES
58;RTE DU CALVAIRE, BEAUMONT-SARDOLLES
58;RUE DU LAVOIR, BEAUMONT-SARDOLLES
58;RTE DU MARQUIS DE CASTELLANE, BEAUMONT-SARDOLLES
58;IMP DU MOULIN, BEAUMONT-SARDOLLES
58;IMP LOUIS DE FELIGONDE, BEAUMONT-SARDOLLES
58;IMP VICTOR DUVIVIER, BEAUMONT-SARDOLLES
58;RTE DE BRINON, BEUVRON
58;RTE DE CLAMECY, BEUVRON
58;CHE DE L'EGLISE, BEUVRON
58;RTE DE LA ROCHE, BEUVRON
58;RUE DE LA TUILERIE, BEUVRON
58;RTE DE MHERS, BEUVRON
58;RTE DE PARIGNY, BEUVRON
58;RUE DE SIROP, BEUVRON
58;RTE DE VILLIERS, BEUVRON
58;IMP DES CHAILLOUX, BEUVRON
58;RUE DES CHAMPS CAGNOTS, BEUVRON
58;CHE DES ECOLIERS, BEUVRON
58;RUE DES VEAUX POREAUX, BEUVRON
58;IMP DU BIEF, BEUVRON
58;IMP DU BOURBASSON, BEUVRON
58;RUE DU MOULIN CORNU, BEUVRON
58;IMP DU PRESBYTERE, BEUVRON
58;PL DU PUITS, BEUVRON
58;RUE SAINT POTENTIEN, BEUVRON
58;DOM BLEU, BILLY-CHEVANNES
58;RTE DE CHATILLON, BILLY-CHEVANNES
58;RTE DE CRIENS, BILLY-CHEVANNES
58;ALL DE DUMPHLUN, BILLY-CHEVANNES
58;RUE DE L'EGLISE, BILLY-CHEVANNES
58;RUE DE LA MARE, BILLY-CHEVANNES
58;IMP DE LA SOURCE, BILLY-CHEVANNES
58;RUE DE NANTEUIL, BILLY-CHEVANNES
58;RTE DE PATRY, BILLY-CHEVANNES
58;RTE DE PLAYNE, BILLY-CHEVANNES
58;CHE DE VAUGREMOT, BILLY-CHEVANNES
58;IMP DES CHAUMES, BILLY-CHEVANNES
58;RUE DES ECOLIERS, BILLY-CHEVANNES
58;RUE DES GRANDS CHAMPS, BILLY-CHEVANNES
58;IMP DES LAGNEAUX, BILLY-CHEVANNES
58;ALL DES NOYERS, BILLY-CHEVANNES
58;CHE DU BOIS CHATEAU, BILLY-CHEVANNES
58;IMP DU BOURGUERAULT, BILLY-CHEVANNES
58;RUE DU COLOMBIER, BILLY-CHEVANNES
58;IMP DU LAVOIR, BILLY-CHEVANNES
58;IMP DU MOULIN A VENT, BILLY-CHEVANNES
58;RUE DU VERGER, BILLY-CHEVANNES
58;RUE GAUTHE, BILLY-CHEVANNES
58;RUE GOURDIN, BILLY-CHEVANNES
58;RUE ROBERT GUENY, BILLY-CHEVANNES
58;RUE DE L'ANCIEN TILLEUL, BILLY-SUR-OISY
58;IMP DU BOEUF COURONNE, BILLY-SUR-OISY
58;RUE DE LA BRECHE, BILLY-SUR-OISY
58;RUE DU CHAMP BONNOTTE, BILLY-SUR-OISY
58;RUE DES CHARMILLES, BILLY-SUR-OISY
58;RTE DE CHARMOIS, BILLY-SUR-OISY
58;RUE DU CHATEAU D'EAU, BILLY-SUR-OISY
58;CHE DE LA CITERNE, BILLY-SUR-OISY
58;RTE DE CLAMECY, BILLY-SUR-OISY
58;RUE DU COLOMBIER, BILLY-SUR-OISY
58;RTE DE CORVOL, BILLY-SUR-OISY
58;RUE DES COURS, BILLY-SUR-OISY
58;CHEM DU CROT RICHARD, BILLY-SUR-OISY
58;RUE DERRIERE L'EGLISE, BILLY-SUR-OISY
58;RUE DE DERRIERE LES MURS, BILLY-SUR-OISY
58;RUE DES DEUX PINS, BILLY-SUR-OISY
58;RTE DE DRUYES, BILLY-SUR-OISY
58;PL DE L EGLISE, BILLY-SUR-OISY
58;RTE D ENTRAINS, BILLY-SUR-OISY
58;RTE D'ETAIS, BILLY-SUR-OISY
58;RUE DU FAUBOURG SAINT DIDIER, BILLY-SUR-OISY
58;RTE DE FERRIERE, BILLY-SUR-OISY
58;RUE DES FOSSES, BILLY-SUR-OISY
58;AV DE LA GARE, BILLY-SUR-OISY
58;GR GRANDE RUE, BILLY-SUR-OISY
58;RUE DU GREZ, BILLY-SUR-OISY
58;RUE DU LAVOIR, BILLY-SUR-OISY
58;RTE DE OISY, BILLY-SUR-OISY
58;PL DU PILORI, BILLY-SUR-OISY
58;RUE DE LA PORTE DE BILLY, BILLY-SUR-OISY
58;PL DU POTEAU, BILLY-SUR-OISY
58;RUE ROYALE, BILLY-SUR-OISY
58;CHE DE SOUS LES COUTRONS, BILLY-SUR-OISY
58;RTE DE TRUCY, BILLY-SUR-OISY
58;RUE DES VERGERS, BILLY-SUR-OISY
58;RUE DES VIAUDES, BILLY-SUR-OISY
58;RUE VIEILLE, BILLY-SUR-OISY
58;IMP RUE VIEILLE, BILLY-SUR-OISY
58;RUE DU VIVIER, BILLY-SUR-OISY
58;LOT DU CHAMP DE LA CROIX, BITRY
58;RTE DE LA BERGEATTERIE, BITRY
58;RTE DE COSNE, BITRY
58;RTE DE DAMPIERRE, BITRY
58;RTE DE ST AMAND, BITRY
58;RUE DE VILLOURS, BITRY
58;RTE DE CHANTEMERLE, BITRY
58;RTE DE CIEZ, BITRY
58;RUE DE L'EGLISE, BITRY
58;RTE DE LA CHAPELLE, BITRY
58;CHE DE LA COUR AUX MOINES, BITRY
58;RTE DE LA GARENNE, BITRY
58;IMP DE LA GRANDE OUCHE, BITRY
58;RTE DE LA TUILERIE, BITRY
58;ALL DE LA VILLEON, BITRY
58;CHE DE MAISON-FORT, BITRY
58;RUE DE MALICORNE D'EN HAUT, BITRY
58;IMP DE MONTAPEINE, BITRY
58;RTE DE SAINT VERAIN, BITRY
58;RTE DE SALVARD, BITRY
58;RUE DES BEAUCHATS, BITRY
58;CHE DES BRUYERES, BITRY
58;RTE DES CHABOUREAUX, BITRY
58;IMP DES CHAMPS DE VILLIERS, BITRY
58;CHE DES GRANDS CHAMPS, BITRY
58;CHE DES HALLES, BITRY
58;CHE DES LAVOIRS, BITRY
58;RUE DES MALLONS, BITRY
58;IMP DES MARTIGNONS, BITRY
58;CHE DES MAUDINETS, BITRY
58;IMP DES PETITES VIGNES, BITRY
58;RTE DES ROIS, BITRY
58;CHE DU BOIS-PENSUE, BITRY
58;RTE DU BUISSON, BITRY
58;RTE DU CHAMP DU BOIS, BITRY
58;CHE DU COLOMBIER, BITRY
58;CHE DU DESERT, BITRY
58;IMP DU POIRIER CROTILLON, BITRY
58;RUE DU PUITS, BITRY
58;CHE DU RAMOIS, BITRY
58;RTE DU TACOT, BITRY
58;DOM D'AGLAND, BONA
58;FRM LA BOURDILLERIE, BONA
58;DOM DU CHAILLOU, BONA
58;IMP DES ACACIAS, BONA
58;CHE D'AZY, BONA
58;RUE DU CHAMP DE LA VIGNE, BONA
58;IMP DES CHAMPS, BONA
58;RUE DES CINQ SEIGNEURS, BONA
58;IMP COURS PRIEUR, BONA
58;RUE DE LA CROIX, BONA
58;RUE DES ECUREUILS, BONA
58;RUE DE L'EGLISE, BONA
58;RTE DE L'ETANG, BONA
58;RTE DE LA FEUILLOUSE, BONA
58;IMP DES FLEURS, BONA
58;RUE DE LA FORET, BONA
58;RTE DE LA GARE, BONA
58;RTE DE GIVERDY, BONA
58;RUE DES GRANDS COURS, BONA
58;RUE DU LAVOIR, BONA
58;IMP DU LAVOIR, BONA
58;RTE DE LA MACHINE, BONA
58;IMP AU MIENS, BONA
58;RTE DES MONTEES, BONA
58;CHE DU MOULIN, BONA
58;RTE DE NEVERS, BONA
58;RUE DE LA PLEUCHOTTE, BONA
58;RUE DU PONT, BONA
58;RTE DE PREMERY, BONA
58;RUE DU PUITS, BONA
58;RUE DES SOURCES, BONA
58;RUE DES VALLEES DU CHATEAU, BONA
58;CHE DE LA VIEILLE ROUTE, BONA
58;CHE DES VIGNES, BONA
58;HAM LES BARATHONS, BOUHY
58;HAM BOIS VAUGERIN, BOUHY
58;HAM BOIS PILLE, BOUHY
58;HAM LES BOULINS, BOUHY
58;HAM LA BROSSE, BOUHY
58;HAM CESSEIGNE, BOUHY
58;HAM LA CHARMEE, BOUHY
58;HAM LES CLAUDES, BOUHY
58;HAM LES COGNEES, BOUHY
58;HAM COSME, BOUHY
58;HAM LA COURGIRAULT, BOUHY
58;HAM LES DESRUEZ, BOUHY
58;HAM LA FAS, BOUHY
58;HAM LE FESLOT, BOUHY
58;HAM LA FORET, BOUHY
58;HAM FORGES, BOUHY
58;HAM GRATTECHIEN, BOUHY
58;HAM LES MARLOTS, BOUHY
58;HAM LES MARQUIS, BOUHY
58;HAM LES MONTAGNES, BOUHY
58;HAM RAVIERE, BOUHY
58;HAM LES SAUJOTS, BOUHY
58;HAM VAUVRILLE, BOUHY
58;HAM VILLAUDOUX, BOUHY
58;HAM VILLESAUGE, BOUHY
58;RUE DE BROT, BOUHY
58;RUE LE TERTRE, BOUHY
58;RUE DU CROT BARBET, BOUHY
58;RUE DES FONTAINES, BOUHY
58;RUE DE LA FORTERRE, BOUHY
58;CHEM DE LA GROSSE BORNE, BOUHY
58;ALL DES MARRONNIERS, BOUHY
58;CHEM DU MOULIN, BOUHY
58;RUE DE LA PUISAYE, BOUHY
58;RTE DE ST AMAND, BOUHY
58;RUE DU CHAMP DE FOIRE, BOUHY
58;CHEM DES VIGNES, BOUHY
58;CHE D'EN DESSOUS, BRASSY
58;RUE D'EN DESSUS, BRASSY
58;RTE DE CHEVOLESSES, BRASSY
58;RTE DE FONTAINE FROIDE, BRASSY
58;RUE DE GOUVAULT, BRASSY
58;RTE DE L'ETANG POITREAU, BRASSY
58;RTE DE L'HAUT DU PEUY, BRASSY
58;IMP DE L'HUIS DES BROSSES, BRASSY
58;IMP DE L'HUIS NAUDIN, BRASSY
58;RTE DE L'HUIS TRUCHOT, BRASSY
58;RTE DE LA FEE, BRASSY
58;RTE DE LA GRAND BORNE, BRASSY
58;RTE DE LA LAUME, BRASSY
58;RTE DE LA RIBAUDELLE, BRASSY
58;RTE DE LA VOIE ROMAINE, BRASSY
58;IMP DE LAVAULT, BRASSY
58;IMP DE MONTCHIGNON, BRASSY
58;RTE DE MONTEGUS, BRASSY
58;RTE DE SAULIEU, BRASSY
58;RTE DE VERFEUILLE, BRASSY
58;RUE DE VIELFOU, BRASSY
58;RTE DES BOIS BERAULT, BRASSY
58;IMP DES CHAISES, BRASSY
58;CHE DES CHAMPS JEUNES, BRASSY
58;IMP DES CHASSOIS, BRASSY
58;RUE DES ECOLIERS, BRASSY
58;RUE DES HIRONDELLES, BRASSY
58;RTE DES PECHEURS, BRASSY
58;RUE DES PLECHIES, BRASSY
58;IMP DES SOURCES, BRASSY
58;RTE DES TILLEULS, BRASSY
58;IMP DES VERNOIS, BRASSY
58;RTE DU BLANCHOT, BRASSY
58;RTE DU BOIS JETEE, BRASSY
58;IMP DU CHATEAU DE VELOTTE, BRASSY
58;RTE DU MONT RECOU, BRASSY
58;RTE DU MOULIN TALA, BRASSY
58;RUE DU POINT DE VUE, BRASSY
58;IMP DU PRE DE FRANCE, BRASSY
58;RUE DU PRE DES SOYES, BRASSY
58;RUE DU RACCOURCI, BRASSY
58;RTE DU RUISSEAU DE LA CHAUME, BRASSY
58;RLE DU SOUTERRAIN, BRASSY
58;RTE DU TULIPIER, BRASSY
58;RUE DU VANERIOUX, BRASSY
58;RUE SAINT GERVAIS, BRASSY
58;CHE DU BROUILLARD, BREUGNON
58;RUE DES BALAIS, BREUGNON
58;CHE DU BAS, BREUGNON
58;RUE DU BAS DES COTES, BREUGNON
58;RUE DU BOURG, BREUGNON
58;PL DU CHAMP DE FOIRE, BREUGNON
58;RUE DE LA COLLINE, BREUGNON
58;RUE DE LA COTE AU LOUP, BREUGNON
58;RTE DE LA GARENNE, BREUGNON
58;RUE DU LAVOIR, BREUGNON
58;IMP DES NOELS, BREUGNON
58;RUE DES ORMES, BREUGNON
58;RUE DU PRESSOIR, BREUGNON
58;RUE DU PUITS, BREUGNON
58;RUE DU 24 JUIN 1844, BREUGNON
58;RES DU PARC, BREVES
58;RTE DE L ARMANCE, BREVES
58;RUE COLAS BREUGNON, BREVES
58;RTE DE BREVES, BREVES
58;RTE BUISSONNIERE, BREVES
58;RUE DES CHAMPS, BREVES
58;ALL DU CHATEAU, BREVES
58;RUE DES CHENEVIERES, BREVES
58;RUE ALAIN COLAS, BREVES
58;CHE DES DAMES, BREVES
58;RUE JEAN DESBARRES, BREVES
58;RTE DE DORNECY, BREVES
58;RUE DE DORNECY, BREVES
58;RUE DES FONTAINES, BREVES
58;RUE DES FORGES, BREVES
58;CHE DES ITALIENS, BREVES
58;RUE DU LAVOIR, BREVES
58;PL DE LA LIBERTE, BREVES
58;PL DE LA MAIRIE, BREVES
58;RUE DE LA MAIRIE, BREVES
58;RUE DE MONTAIGU, BREVES
58;RTE DU MORVAN, BREVES
58;RUE DU PARC, BREVES
58;RUE DE LA PLANTE, BREVES
58;RUE DU PORTAIL, BREVES
58;RUE ROMAIN ROLLAND, BREVES
58;RTE DE SARDY LES FORGES, BREVES
58;RUE ST VINCENT, BREVES
58;RUE STE EUGENIE, BREVES
58;RUE DE LA TEURLEE, BREVES
58;RUE TRAVERSIERE, BREVES
58;RUE DES TULIPES, BREVES
58;RUE DES VIGNES, BREVES
58;RTE DE VILLIERS, BREVES
58;RUE DES VIOLETTES, BREVES
58;LOT DES RIAUX, BRINON SUR BEUVRON
58;LOT DE TROYES LA VILLE, BRINON SUR BEUVRON
58;CHE DE LA BERGAUDIERE, BRINON SUR BEUVRON
58;COUR DU BOIS ROND, BRINON SUR BEUVRON
58;RUE DE BOULASSET, BRINON SUR BEUVRON
58;RUE DU CHATEAU, BRINON SUR BEUVRON
58;RUE DE CHATEAU BARON, BRINON SUR BEUVRON
58;RTE DE CLAMECY, BRINON SUR BEUVRON
58;RUE DU COLOMBIER, BRINON SUR BEUVRON
58;RUE COMMANDANT VICTOR GUERREAU, BRINON SUR BEUVRON
58;CHE DE LA CROIX, BRINON SUR BEUVRON
58;RUE DOCTEUR ALBERT REGNAULT, BRINON SUR BEUVRON
58;RUE DE L'EGLISE, BRINON SUR BEUVRON
58;RUE DE LA FORGE, BRINON SUR BEUVRON
58;PL JEAN BAPTISTE DURBISE, BRINON SUR BEUVRON
58;RUE DU LAVOIR, BRINON SUR BEUVRON
58;RUE LIEUTENANT ROBERT CHEZEAU, BRINON SUR BEUVRON
58;ALL LOUIS DE JAUCOURT, BRINON SUR BEUVRON
58;RUE DU PERE CASTOR, BRINON SUR BEUVRON
58;IMP DES PETITS CHAILLOUX, BRINON SUR BEUVRON
58;RTE DE ST REVERIEN, BRINON SUR BEUVRON
58;RUE DE TROYES LA VILLE, BRINON SUR BEUVRON
58;RUE DE VEAUPOULE, BRINON SUR BEUVRON
58;CHEM DU BOIS DAVID, BULCY
58;RTE DU CAMP AMERICAIN, BULCY
58;IMP DES CARRIERS, BULCY
58;CHEM DES CHAMPS DONZY, BULCY
58;ALL DES CHAMPS DU FAUBOURG, BULCY
58;ALL DU CHATEAU D'EAU, BULCY
58;RTE DE GARCHY, BULCY
58;ALL DE LA GRANGE A DIME, BULCY
58;ALL HYDE DE NEUVILLE, BULCY
58;RTE DU LAVOIR, BULCY
58;CHE DE LA MONTAIN, BULCY
58;COUR PLANCHETTE, BULCY
58;RUE DES PUITS, BULCY
58;RUE DE LA REVENUE, BULCY
58;RUE DE LA ROSELIERE, BULCY
58;COUR DES TROIS ALLEES, BULCY
58;RTE DE LA VALLEE BERTIN, BULCY
58;RUE DE L'EGLISE, BULCY
58;RUE DE MESVES, BULCY
58;COUR MARCHAIS, LA CELLE SUR LOIRE
58;RTE BOIS DE LA GATELLE, LA CELLE SUR LOIRE
58;RUE CESAR, LA CELLE SUR LOIRE
58;RTE D ANNAY, LA CELLE SUR LOIRE
58;RUE D'ARQUIAN, LA CELLE SUR LOIRE
58;RTE DES BARRES, LA CELLE SUR LOIRE
58;CHE DES BERTHELOTS, LA CELLE SUR LOIRE
58;RTE DES BERTHELOTS, LA CELLE SUR LOIRE
58;RTE DES BROCS, LA CELLE SUR LOIRE
58;CHE DES BROSSIERS, LA CELLE SUR LOIRE
58;CHEM DU CARROUE, LA CELLE SUR LOIRE
58;CHEM DES CROTTES TERRES, LA CELLE SUR LOIRE
58;RUE DES ECOLES, LA CELLE SUR LOIRE
58;PL DE L EGLISE, LA CELLE SUR LOIRE
58;RUE D'ENFER, LA CELLE SUR LOIRE
58;RTE DES FROSSARDS, LA CELLE SUR LOIRE
58;RUE JOLIN, LA CELLE SUR LOIRE
58;CHE DU LIEU CENON, LA CELLE SUR LOIRE
58;RUE DE PARIS, LA CELLE SUR LOIRE
58;RTE DU PORT, LA CELLE SUR LOIRE
58;RUE DU PORT, LA CELLE SUR LOIRE
58;CHE DES POTIERS, LA CELLE SUR LOIRE
58;RTE DES ROBARDS, LA CELLE SUR LOIRE
58;CHEM DES SABLES, LA CELLE SUR LOIRE
58;CHE LATERAL, LA CELLE SUR LOIRE
58;RTE NATIONALE 7, LA CELLE SUR LOIRE
58;RTE DES BROSSIERS, LA CELLE SUR LOIRE
58;PL D ALIGRE, CERCY-LA-TOUR
58;QUAI ANTOINE LACHARME, CERCY-LA-TOUR
58;CHEM DES ARBELATS, CERCY-LA-TOUR
58;RTE DES ARBELATS, CERCY-LA-TOUR
58;RUE D ARON, CERCY-LA-TOUR
58;IMP DU BOIS CLAIR, CERCY-LA-TOUR
58;RTE DU BOIS CLAIR, CERCY-LA-TOUR
58;RTE DE BRIFFAULT, CERCY-LA-TOUR
58;RUE DES BRUNETTES, CERCY-LA-TOUR
58;RUE DE BOURGOGNE, CERCY-LA-TOUR
58;RUE DU CALVAIRE, CERCY-LA-TOUR
58;CHE DES CHAMPS DE CODDES, CERCY-LA-TOUR
58;PL DU CHAMP DE FOIRE, CERCY-LA-TOUR
58;RUE DU CHAMP DE LA PORTE, CERCY-LA-TOUR
58;RUE DU CHAMP MORLON, CERCY-LA-TOUR
58;RTE DU CHATEAU, CERCY-LA-TOUR
58;RUE DE CHATILLON, CERCY-LA-TOUR
58;RUE CHAUDE, CERCY-LA-TOUR
58;CHEM DES CHENES, CERCY-LA-TOUR
58;RUE DES CHETIFS CHAMPS, CERCY-LA-TOUR
58;CHE DU CHEVRELET, CERCY-LA-TOUR
58;RUE DU CIMETIERE, CERCY-LA-TOUR
58;RUE DES CLAIRS LOGIS, CERCY-LA-TOUR
58;RTE DE CODDES, CERCY-LA-TOUR
58;RUE DES COTTINSETS, CERCY-LA-TOUR
58;RTE DE LA COUSEE, CERCY-LA-TOUR
58;CHE DES CROTS FAVES, CERCY-LA-TOUR
58;RTE DE DECIZE, CERCY-LA-TOUR
58;RUE DU 19 MARS 1962, CERCY-LA-TOUR
