58;RUE AU LOUP, CORBIGNY
58;RUE DE LA MADELEINE, CORBIGNY
58;PL DE LA MAIRIE, CORBIGNY
58;IMP DE LA MAIRIE, CORBIGNY
58;RTE DE MARCILLY, CORBIGNY
58;RUE DE LA MORGAGNE, CORBIGNY
58;CHE DU MOULIN, CORBIGNY
58;CHE DU MOULIN DE MARCY, CORBIGNY
58;QUAI DU PETIT FORT, CORBIGNY
58;RUE DU PETIT FORT, CORBIGNY
58;RUE DU PICHOUX, CORBIGNY
58;CHE DU PICHOUX, CORBIGNY
58;CHE DU PRE AUX 3 CORNES, CORBIGNY
58;RUE DE PRECY, CORBIGNY
58;RUE DU PRESBYTERE, CORBIGNY
58;QUAI DES PROMENADES, CORBIGNY
58;RUE DE LA PROMENADE, CORBIGNY
58;RUE DES RELIGIEUSES, CORBIGNY
58;RUE DES ROSES, CORBIGNY
58;GR GRANDE RUE, CORBIGNY
58;CHE DE SARRE, CORBIGNY
58;RUE DU SAULET, CORBIGNY
58;AV ST JEAN, CORBIGNY
58;PL ST JEAN, CORBIGNY
58;PL ST LOUIS, CORBIGNY
58;RTE DE ST SAULGE, CORBIGNY
58;RUE DU TACOT, CORBIGNY
58;RUE DES TEPINS, CORBIGNY
58;IMP DES THIRIOUX, CORBIGNY
58;PL DU TILLEUL, CORBIGNY
58;QUAI DE LA TOUR, CORBIGNY
58;RUE TRAVERSIERE, CORBIGNY
58;SQ DE VERDUN, CORBIGNY
58;RTE DE VEZELAY, CORBIGNY
58;RUE DE VEZELAY, CORBIGNY
58;RTE DES VIGNES, CORBIGNY
58;RUE DE LA SCIERIE, CORBIGNY
58;RUE DE CHAZEUIL, CORVOL D EMBERNARD
58;RTE DE CHEVANNES, CORVOL D EMBERNARD
58;RUE SAINT GENGOULT, CORVOL D EMBERNARD
58;RUE DE LA MAIRIE, CORVOL D EMBERNARD
58;RUE DU COURTIL, CORVOL D EMBERNARD
58;RUE DU CANARD, CORVOL D EMBERNARD
58;IMP DES MIGNONS, CORVOL D EMBERNARD
58;IMP DE LA YOURTE, CORVOL D EMBERNARD
58;IMP DE FONTENEILLE, CORVOL D EMBERNARD
58;RTE DE CHAMPEAU, CORVOL D EMBERNARD
58;RUE DE LA FORGE, CORVOL D EMBERNARD
58;HAM LES BAUDIONS, CORVOL L ORGUEILLEUX
58;LOT LES BAUMES, CORVOL L ORGUEILLEUX
58;HAM LE FERRY, CORVOL L ORGUEILLEUX
58;HAM DORDRES LE GRAND PERTHUIS, CORVOL L ORGUEILLEUX
58;HAM DORDRES GRANDES VALLEES, CORVOL L ORGUEILLEUX
58;HAM LA LEZARDERIE, CORVOL L ORGUEILLEUX
58;HAM LA PETARDERIE, CORVOL L ORGUEILLEUX
58;HAM LE PETIT SAUZAY, CORVOL L ORGUEILLEUX
58;HAM ROUSSY, CORVOL L ORGUEILLEUX
58;HAM SAINT GEORGES, CORVOL L ORGUEILLEUX
58;HAM SAINT MARC, CORVOL L ORGUEILLEUX
58;HAM SAUZAY, CORVOL L ORGUEILLEUX
58;RTE DE LA CHAPELLE, CORVOL L ORGUEILLEUX
58;RUE DE LA CHATELLERIE, CORVOL L ORGUEILLEUX
58;RUE CLAUDE DAVIGNON, CORVOL L ORGUEILLEUX
58;RUE DES COURS, CORVOL L ORGUEILLEUX
58;CHE DES DAVIDS, CORVOL L ORGUEILLEUX
58;RUE DE DERRIERE LES MURS, CORVOL L ORGUEILLEUX
58;RUE DU 19 MARS 1962, CORVOL L ORGUEILLEUX
58;PL DE L EGLISE, CORVOL L ORGUEILLEUX
58;RTE D'ENTRAINS, CORVOL L ORGUEILLEUX
58;RUE D ENFER, CORVOL L ORGUEILLEUX
58;RTE D'ETAIS, CORVOL L ORGUEILLEUX
58;RUE DES FOSSES, CORVOL L ORGUEILLEUX
58;RUE DU FBG DES POTS, CORVOL L ORGUEILLEUX
58;RUE DE LA FONTAINE, CORVOL L ORGUEILLEUX
58;GR GRANDE RUE, CORVOL L ORGUEILLEUX
58;RUE JULES BEGUE, CORVOL L ORGUEILLEUX
58;RUE JULES RAME, CORVOL L ORGUEILLEUX
58;RUE DU LAVOIR, CORVOL L ORGUEILLEUX
58;RUE DU LION D OR, CORVOL L ORGUEILLEUX
58;RTE DE MENOU, CORVOL L ORGUEILLEUX
58;CHE DU MOULIN, CORVOL L ORGUEILLEUX
58;RUE DU MOULIN JOSSEREAU, CORVOL L ORGUEILLEUX
58;RUE DES PRES, CORVOL L ORGUEILLEUX
58;RUE DE LA RAGONNERIE, CORVOL L ORGUEILLEUX
58;FG ST MAURICE, CORVOL L ORGUEILLEUX
58;RTE DE TRUCY, CORVOL L ORGUEILLEUX
58;HLM AVE DU 85 EME, COSNE COURS SUR LOIRE
58;HLM AVE DE VERDUN, COSNE COURS SUR LOIRE
58;MAIS DE RETRAITE, COSNE COURS SUR LOIRE
58;CITE PAPONOT RUE S CARNOT, COSNE COURS SUR LOIRE
58;RES DES VIGNES, COSNE COURS SUR LOIRE
58;IMP DES ACACIAS, COSNE COURS SUR LOIRE
58;RUE ADOLPHE ROBERT, COSNE COURS SUR LOIRE
58;RTE DE L'AERODROME, COSNE COURS SUR LOIRE
58;RUE AGATHE, COSNE COURS SUR LOIRE
58;ALL DES AGNOLINS, COSNE COURS SUR LOIRE
58;RUE ALAIN MIMOUN, COSNE COURS SUR LOIRE
58;ALL ALBERT SCHWEITZER, COSNE COURS SUR LOIRE
58;RUE ALBERT SCHWEITZER, COSNE COURS SUR LOIRE
58;RTE D'ALLIGNY, COSNE COURS SUR LOIRE
58;RUE ALPHONSE BAUDIN, COSNE COURS SUR LOIRE
58;SQ ALPHONSE BAUDIN, COSNE COURS SUR LOIRE
58;RUE DES AMERICAINS, COSNE COURS SUR LOIRE
58;RUE AMIRAL DE BOISSOUDY, COSNE COURS SUR LOIRE
58;ALL DES AMOGNES, COSNE COURS SUR LOIRE
58;RUE DES AMOGNES, COSNE COURS SUR LOIRE
58;PAS AMPERE, COSNE COURS SUR LOIRE
58;RUE ANATOLE FRANCE, COSNE COURS SUR LOIRE
58;IMP DE L ANNONCIADE, COSNE COURS SUR LOIRE
58;RUE DES ARDILLES, COSNE COURS SUR LOIRE
58;RUE DES ARDOISIERS, COSNE COURS SUR LOIRE
58;ALL DES ARTISANS, COSNE COURS SUR LOIRE
58;CHE DES AUGERONS, COSNE COURS SUR LOIRE
58;PL DE BAD EMS, COSNE COURS SUR LOIRE
58;RUE BARDOUX, COSNE COURS SUR LOIRE
58;ALL BEETHOVEN, COSNE COURS SUR LOIRE
58;IMP DE LA BELLERY, COSNE COURS SUR LOIRE
58;RTE DE BELLEVUE, COSNE COURS SUR LOIRE
58;RUE BERNOT, COSNE COURS SUR LOIRE
58;ALL DU BERRY, COSNE COURS SUR LOIRE
58;RUE DU BERRY, COSNE COURS SUR LOIRE
58;RTE DE BOHEME, COSNE COURS SUR LOIRE
58;RUE DES BOIS, COSNE COURS SUR LOIRE
58;CHE RURAL DU BOIS PLAIDE, COSNE COURS SUR LOIRE
58;CHEM DE L'OUCHE BONHOMME, COSNE COURS SUR LOIRE
58;IMP DU BOUCHERY, COSNE COURS SUR LOIRE
58;ALL DU BOUCHERY, COSNE COURS SUR LOIRE
58;RUE DU BOURBONNAIS, COSNE COURS SUR LOIRE
58;RUE DU BOURG, COSNE COURS SUR LOIRE
58;PL DE BOURGIRAULT, COSNE COURS SUR LOIRE
58;ALL DES BOULEAUX, COSNE COURS SUR LOIRE
58;CHE DE BOURDOISEAU, COSNE COURS SUR LOIRE
58;RUE DU BOURGIRAULT, COSNE COURS SUR LOIRE
58;RUE DE BOURGOGNE, COSNE COURS SUR LOIRE
58;CHE DES BRAULTS, COSNE COURS SUR LOIRE
58;RTE DES BRAULTS, COSNE COURS SUR LOIRE
58;ALL DES BRECHATS, COSNE COURS SUR LOIRE
58;RTE DES BRECHATS, COSNE COURS SUR LOIRE
58;RTE DES BREUX, COSNE COURS SUR LOIRE
58;ALL BREUZIN, COSNE COURS SUR LOIRE
58;RUE BUCHET DESFORGES, COSNE COURS SUR LOIRE
58;CHE DE LA CABOUE, COSNE COURS SUR LOIRE
58;RTE DU CARRE CHARBONNIER, COSNE COURS SUR LOIRE
58;RUE CAUMEAU, COSNE COURS SUR LOIRE
58;CHEM DES CARRIERES, COSNE COURS SUR LOIRE
58;ALL DES CEDRES, COSNE COURS SUR LOIRE
58;RTE DES CARRIERES, COSNE COURS SUR LOIRE
58;RUE DES CEDRES, COSNE COURS SUR LOIRE
58;CHE DES CHAMPS BAILLY, COSNE COURS SUR LOIRE
58;CHE DU CHAMP BLANC, COSNE COURS SUR LOIRE
58;RUE DES CHAMPS DE MAISON ROUGE, COSNE COURS SUR LOIRE
58;CHE DU CHAMP DES POULES, COSNE COURS SUR LOIRE
58;RTE DES CHAMPS MINIES, COSNE COURS SUR LOIRE
58;RUE DE CHANTERELLES, COSNE COURS SUR LOIRE
58;RUE DES CHAPELAINS, COSNE COURS SUR LOIRE
58;CHE DE LA CHAPELLE STE BRIGITT, COSNE COURS SUR LOIRE
58;RUE CHARLES FLOQUET, COSNE COURS SUR LOIRE
58;IMP DES CHARMES, COSNE COURS SUR LOIRE
58;RTE DES CHARMES, COSNE COURS SUR LOIRE
58;PL DU CHAT, COSNE COURS SUR LOIRE
58;RUE DU CHATEAU D EAU, COSNE COURS SUR LOIRE
58;RUE DU CHATEAU DES ROCHES, COSNE COURS SUR LOIRE
58;RUE DE CHAUDRON, COSNE COURS SUR LOIRE
58;RUE DE LA CHAUME, COSNE COURS SUR LOIRE
58;RUE DES CHAUMES, COSNE COURS SUR LOIRE
58;CHE DE LA CHAUMETTE, COSNE COURS SUR LOIRE
58;PL DE LA CHAUSSADE, COSNE COURS SUR LOIRE
58;CHE DE CHAUVIAU, COSNE COURS SUR LOIRE
58;RUE DU CHEMIN DE FER, COSNE COURS SUR LOIRE
58;CHE DE CHETIF BOIS, COSNE COURS SUR LOIRE
58;RTE DE CHETIF BOIS, COSNE COURS SUR LOIRE
58;RUE CHOLLET, COSNE COURS SUR LOIRE
58;PL FREDERIC CHOPIN, COSNE COURS SUR LOIRE
58;ALL DU PUITS CHOTARD, COSNE COURS SUR LOIRE
58;ALL DU CIMETIERE ST JACQUES, COSNE COURS SUR LOIRE
58;RUE DU CIMETIERE, COSNE COURS SUR LOIRE
58;RUE DU CIMETIERE DE COURS, COSNE COURS SUR LOIRE
58;RLE CITE CAISSE D EPARGNE, COSNE COURS SUR LOIRE
58;RUE CLAUDE TILLIER, COSNE COURS SUR LOIRE
58;CHEM DES COLOMBES, COSNE COURS SUR LOIRE
58;RUE DU COL FABIEN, COSNE COURS SUR LOIRE
58;RUE COL RABIER, COSNE COURS SUR LOIRE
58;RUE DU COL RABIER ECOLE SUD, COSNE COURS SUR LOIRE
58;IMP COLETTE, COSNE COURS SUR LOIRE
58;RUE COLETTE, COSNE COURS SUR LOIRE
58;RUE DU COMMERCE, COSNE COURS SUR LOIRE
58;RUE DU COMMISSAIRE BENEVISE, COSNE COURS SUR LOIRE
58;IMP DES COQUES, COSNE COURS SUR LOIRE
58;CHE DE CORBILLONE, COSNE COURS SUR LOIRE
58;RUE LE CORBUSIER, COSNE COURS SUR LOIRE
58;RUE DES CORDELIERS, COSNE COURS SUR LOIRE
58;ALL DES CORTILLATS, COSNE COURS SUR LOIRE
58;RTE DE LA COTE AUX MERLES, COSNE COURS SUR LOIRE
58;CRS DES FORGES, COSNE COURS SUR LOIRE
58;CHE LES COURLUS, COSNE COURS SUR LOIRE
58;CHE DE COURS, COSNE COURS SUR LOIRE
58;RTE DE COURS, COSNE COURS SUR LOIRE
58;CHEM DE LA COUTURIERE, COSNE COURS SUR LOIRE
58;CHE DES CROTS BLOTS, COSNE COURS SUR LOIRE
58;CHE DES CROTS JAUNES, COSNE COURS SUR LOIRE
58;RUE CROIX JANVIER, COSNE COURS SUR LOIRE
58;CHE DES CRIOTS, COSNE COURS SUR LOIRE
58;IMP DES CROTS JAUNES, COSNE COURS SUR LOIRE
58;RUE DU DAHOMEY, COSNE COURS SUR LOIRE
58;CHE DES DAUDINS, COSNE COURS SUR LOIRE
58;RTE DES DAUDINS, COSNE COURS SUR LOIRE
58;PL DAUPHINE, COSNE COURS SUR LOIRE
58;RUE DU 19 MARS 1962, COSNE COURS SUR LOIRE
58;PL DU 19 MARS 1962, COSNE COURS SUR LOIRE
58;IMP DU DONJON, COSNE COURS SUR LOIRE
58;RUE DU DONJON, COSNE COURS SUR LOIRE
58;RUE DE DONZY, COSNE COURS SUR LOIRE
58;RLE DORIDAINE, COSNE COURS SUR LOIRE
58;RUE DUGUET, COSNE COURS SUR LOIRE
58;RUE HENRI DUNANT, COSNE COURS SUR LOIRE
58;IMP DE L ECHELLE, COSNE COURS SUR LOIRE
58;RUE DE L ECHELLE, COSNE COURS SUR LOIRE
58;RUE DE L'ECOLE, COSNE COURS SUR LOIRE
58;RUE DES ECOLES, COSNE COURS SUR LOIRE
58;RUE EDITH PIAF, COSNE COURS SUR LOIRE
58;RUE EDME LAVARENNE, COSNE COURS SUR LOIRE
58;ALL D EGLANTINE, COSNE COURS SUR LOIRE
58;PL DE L EGLISE, COSNE COURS SUR LOIRE
58;RUE DE L EGLISE, COSNE COURS SUR LOIRE
58;PAS EMILE COMBES, COSNE COURS SUR LOIRE
58;RUE EMILE COMBES, COSNE COURS SUR LOIRE
58;RUE EMILE DESCHANEL, COSNE COURS SUR LOIRE
58;ALL DES ENTREPRENEURS, COSNE COURS SUR LOIRE
58;RPT DES ENTREPRENEURS, COSNE COURS SUR LOIRE
58;RUE DES ERABLES, COSNE COURS SUR LOIRE
58;RUE DE L EST, COSNE COURS SUR LOIRE
58;RTE DE L'ETANG DES GRANGES, COSNE COURS SUR LOIRE
58;RUE EUGENE PELLETAN, COSNE COURS SUR LOIRE
58;RUE EUGENE PERREAU, COSNE COURS SUR LOIRE
58;RUE EUGENE PERREAU PROLONGEE, COSNE COURS SUR LOIRE
58;PL DE L EUROPE, COSNE COURS SUR LOIRE
58;RUE DE LA FEDERATION, COSNE COURS SUR LOIRE
58;ALL DE LA FERME, COSNE COURS SUR LOIRE
58;RUE FERNAND PETIT, COSNE COURS SUR LOIRE
58;RUE DES FERRONNIERS, COSNE COURS SUR LOIRE
58;IMP DES FILOIRS, COSNE COURS SUR LOIRE
58;RUE DES FILOIRS, COSNE COURS SUR LOIRE
58;IMP DES FLEURS, COSNE COURS SUR LOIRE
58;RTE DES FOINGS, COSNE COURS SUR LOIRE
58;PL FOLATRE, COSNE COURS SUR LOIRE
58;PTR PETITE RUE FOLATRE, COSNE COURS SUR LOIRE
58;RUE FOLATRE, COSNE COURS SUR LOIRE
58;RUE DES FONDEURS, COSNE COURS SUR LOIRE
58;RTE DE LA FONTAINE DE L'ORME, COSNE COURS SUR LOIRE
58;RUE DE LA FONTAINE MORIN, COSNE COURS SUR LOIRE
58;RUE DES FORGES, COSNE COURS SUR LOIRE
58;RUE DES FORGERONS, COSNE COURS SUR LOIRE
58;CHE DES FOUGERES, COSNE COURS SUR LOIRE
58;RUE DU FOUR, COSNE COURS SUR LOIRE
58;RUE DE LA FONTAINE ST LAURENT, COSNE COURS SUR LOIRE
58;RUE FRANC NOHAIN, COSNE COURS SUR LOIRE
58;RUE FREDERIC BEAULIEU, COSNE COURS SUR LOIRE
58;RUE DES FRERES GAMBON, COSNE COURS SUR LOIRE
58;RLE DES FRERES GAMBON, COSNE COURS SUR LOIRE
58;RUE DES FRERES LUMIERE, COSNE COURS SUR LOIRE
58;RUE DES GABARRIERS, COSNE COURS SUR LOIRE
58;RUE GAMBETTA, COSNE COURS SUR LOIRE
58;RUE GAMBON, COSNE COURS SUR LOIRE
58;SQ GAMBON, COSNE COURS SUR LOIRE
58;CHE DE LA GARE, COSNE COURS SUR LOIRE
58;PL DE LA GARE, COSNE COURS SUR LOIRE
58;RUE DU GATEFER, COSNE COURS SUR LOIRE
58;ALL DU GATINAIS, COSNE COURS SUR LOIRE
58;CHE DES GATINES, COSNE COURS SUR LOIRE
58;RTE DES GATINES, COSNE COURS SUR LOIRE
58;RTE DES GAUDRYS, COSNE COURS SUR LOIRE
58;PL DES GAUDRYS, COSNE COURS SUR LOIRE
58;CHEM DES GAUDRYS, COSNE COURS SUR LOIRE
58;RTE DES GAUTHIERS, COSNE COURS SUR LOIRE
58;RUE GAY LUSSAC, COSNE COURS SUR LOIRE
58;RUE GAL BINOT, COSNE COURS SUR LOIRE
58;RUE GAL BINOT LOT BINOT, COSNE COURS SUR LOIRE
58;RUE GEN DE GAULLE, COSNE COURS SUR LOIRE
58;BD GEORGES CLEMENCEAU, COSNE COURS SUR LOIRE
58;PL GEORGES CLEMENCEAU, COSNE COURS SUR LOIRE
58;RUE GEORGE SAND, COSNE COURS SUR LOIRE
58;ALL DU GIENNOIS, COSNE COURS SUR LOIRE
58;CHE DU GRAND BUISSON, COSNE COURS SUR LOIRE
58;CR DU GRAND CHAMP, COSNE COURS SUR LOIRE
58;ALL DES GRANDS CHAMPS, COSNE COURS SUR LOIRE
58;PL DE LA GRANDE FONTAINE, COSNE COURS SUR LOIRE
58;RUE DES GRANDS JARDINS, COSNE COURS SUR LOIRE
58;CITE DU GROS ORME, COSNE COURS SUR LOIRE
58;RUE DU GROS ORME, COSNE COURS SUR LOIRE
58;IMP DU GUERLURET, COSNE COURS SUR LOIRE
58;RUE DES GUERINS, COSNE COURS SUR LOIRE
58;CHEM DES HIRONDELLES, COSNE COURS SUR LOIRE
58;ALL DES HETRES, COSNE COURS SUR LOIRE
58;RUE DES HETRES, COSNE COURS SUR LOIRE
58;PL HONORE DE BALZAC, COSNE COURS SUR LOIRE
58;RUE HONORE DE BALZAC, COSNE COURS SUR LOIRE
58;RUE DU 8 MAI, COSNE COURS SUR LOIRE
58;RUE DE L INSPECTEUR VILNAT, COSNE COURS SUR LOIRE
58;RUE JACQUES BREL, COSNE COURS SUR LOIRE
58;PL DR HUYGHUES DES ETAGES, COSNE COURS SUR LOIRE
58;RUE JACQUES MARTEL, COSNE COURS SUR LOIRE
58;RUE DES JARDINS, COSNE COURS SUR LOIRE
58;RUE JEAN CARRIES, COSNE COURS SUR LOIRE
58;IMP JEAN D OR, COSNE COURS SUR LOIRE
58;RUE JEAN JAURES, COSNE COURS SUR LOIRE
58;RUE JEAN MONNET, COSNE COURS SUR LOIRE
58;RUE JEAN MOULIN, COSNE COURS SUR LOIRE
58;ALL DES JONQUILLES, COSNE COURS SUR LOIRE
58;RUE DES JONQUILLES, COSNE COURS SUR LOIRE
58;RPT DU 17 JUIN 1940, COSNE COURS SUR LOIRE
58;RUE JULES FERRY, COSNE COURS SUR LOIRE
58;PL DU DOCTEUR JULES MOINEAU, COSNE COURS SUR LOIRE
58;QUAI JULES MOINEAU, COSNE COURS SUR LOIRE
58;RUE JULES RENARD, COSNE COURS SUR LOIRE
58;RUE LA FAYETTE, COSNE COURS SUR LOIRE
58;RUE LAMARTINE, COSNE COURS SUR LOIRE
58;CHE DU LAVOIR, COSNE COURS SUR LOIRE
58;IMP DU LAVOIR DES RIV ST AGNAN, COSNE COURS SUR LOIRE
58;RUE LAVOISIER, COSNE COURS SUR LOIRE
58;RUE LEON BLUM, COSNE COURS SUR LOIRE
58;RUE DE LA LIBERTE, COSNE COURS SUR LOIRE
58;IMP DE LA LICOTTE, COSNE COURS SUR LOIRE
58;PL LT COL TULLIER, COSNE COURS SUR LOIRE
58;RUE DES LIMES, COSNE COURS SUR LOIRE
58;RTE DE L'HENRIOT, COSNE COURS SUR LOIRE
58;IMP LOISEAU, COSNE COURS SUR LOIRE
58;RUE LOISEAU, COSNE COURS SUR LOIRE
58;RUE LONGUE EPINE, COSNE COURS SUR LOIRE
58;CHE DE LONGUE EPINE, COSNE COURS SUR LOIRE
58;RUE LOUIS BOILEAU, COSNE COURS SUR LOIRE
58;IMP LOUIS PARIS, COSNE COURS SUR LOIRE
58;RUE LOUIS PARIS, COSNE COURS SUR LOIRE
58;PL DES LOYONS, COSNE COURS SUR LOIRE
58;RTE DU LYONNAIS, COSNE COURS SUR LOIRE
58;ALL DU MACONNAIS, COSNE COURS SUR LOIRE
58;RUE DU MACONNAIS, COSNE COURS SUR LOIRE
58;IMP DE LA MADELEINE, COSNE COURS SUR LOIRE
58;PL DE LA MADELEINE, COSNE COURS SUR LOIRE
58;RUE DE LA MAIN DE FER, COSNE COURS SUR LOIRE
58;PAS MARCEL CHEVRIN, COSNE COURS SUR LOIRE
58;RUE MARCELLIN BERTHELOT, COSNE COURS SUR LOIRE
58;RLE MARCELIN BERTHELOT, COSNE COURS SUR LOIRE
58;RUE DU MARDRON, COSNE COURS SUR LOIRE
58;RPT DE LA MARE, COSNE COURS SUR LOIRE
58;PL MARECHAL FOCH, COSNE COURS SUR LOIRE
58;QUAI MARECHAL JOFFRE, COSNE COURS SUR LOIRE
58;RUE DU MARECHAL JUIN, COSNE COURS SUR LOIRE
58;RUE MARECHAL LECLERC, COSNE COURS SUR LOIRE
58;MAIL DES MARINIERS, COSNE COURS SUR LOIRE
58;RUE DES MARINIERS, COSNE COURS SUR LOIRE
58;RTE DES MARNES, COSNE COURS SUR LOIRE
58;PL DES MARRONNIERS, COSNE COURS SUR LOIRE
58;RUE MARTIN LUTHER KING, COSNE COURS SUR LOIRE
58;RUE MENDES FRANCE, COSNE COURS SUR LOIRE
58;CHE DES MERISIERS, COSNE COURS SUR LOIRE
58;IMP DES MESANGES, COSNE COURS SUR LOIRE
58;PL DES MILLOTS, COSNE COURS SUR LOIRE
58;RTE DES MILLOTS, COSNE COURS SUR LOIRE
58;RUE DES MINOTIERS, COSNE COURS SUR LOIRE
58;RTE DES MOLLETS, COSNE COURS SUR LOIRE
58;CHE DES MOLLETS, COSNE COURS SUR LOIRE
58;RUE DE LA MONTAGNE JAUNE, COSNE COURS SUR LOIRE
58;ALL DE MONTCHEVREAU, COSNE COURS SUR LOIRE
58;RUE DE MONTCHEVREAU, COSNE COURS SUR LOIRE
58;CHE DES MOROQUES, COSNE COURS SUR LOIRE
58;RUE DES MOROQUES, COSNE COURS SUR LOIRE
58;RPT MONTE CASSINO, COSNE COURS SUR LOIRE
58;ALL DU MORVAN, COSNE COURS SUR LOIRE
58;CHE DES MOUILLES, COSNE COURS SUR LOIRE
58;CHE DES MOYES, COSNE COURS SUR LOIRE
58;PAS DES MULETS, COSNE COURS SUR LOIRE
58;RUE DES MULETS, COSNE COURS SUR LOIRE
58;RUE DU MUR DES FUSILLES, COSNE COURS SUR LOIRE
58;RTE DE MYENNES, COSNE COURS SUR LOIRE
58;IMP NELSON MANDELA, COSNE COURS SUR LOIRE
58;RTE DE NEVERS, COSNE COURS SUR LOIRE
58;RUE DU NIVERNAIS, COSNE COURS SUR LOIRE
58;RUE DU NOYER D AMOUR, COSNE COURS SUR LOIRE
58;ALL DE L ORLEANAIS, COSNE COURS SUR LOIRE
58;RUE DE L ORLEANAIS, COSNE COURS SUR LOIRE
58;CHE DE L'OUCHE BONHOMME, COSNE COURS SUR LOIRE
58;AV DE LA PAIX, COSNE COURS SUR LOIRE
58;RUE DE LA PAIX, COSNE COURS SUR LOIRE
58;CITE PAPONOT, COSNE COURS SUR LOIRE
58;RUE DE LA CITE PAPONOT, COSNE COURS SUR LOIRE
58;ALL DU PARC, COSNE COURS SUR LOIRE
58;CHE DU PARADIS, COSNE COURS SUR LOIRE
58;CHE DU PARIS LYON MEDITERRANEE, COSNE COURS SUR LOIRE
58;IMP PASTEUR, COSNE COURS SUR LOIRE
58;PL PASTEUR, COSNE COURS SUR LOIRE
58;RUE PASTEUR, COSNE COURS SUR LOIRE
58;RTE DU PATY DE COURS, COSNE COURS SUR LOIRE
58;RUE DU PATIS DE NANTES, COSNE COURS SUR LOIRE
58;RUE NVLE DU PATIS DE NANTES, COSNE COURS SUR LOIRE
58;CHE DES PATUREAUX, COSNE COURS SUR LOIRE
58;RTE DES PATUREAUX, COSNE COURS SUR LOIRE
58;RUE PAUL BERT, COSNE COURS SUR LOIRE
58;RLE PAUL BERT, COSNE COURS SUR LOIRE
58;PL DE LA PECHERIE, COSNE COURS SUR LOIRE
58;IMP DES PEUPLIERS, COSNE COURS SUR LOIRE
58;PL PIERRE ET MARIE CURIE, COSNE COURS SUR LOIRE
58;RUE PIERRE ET MARIE CURIE, COSNE COURS SUR LOIRE
58;BD PIERRE DE COUBERTIN, COSNE COURS SUR LOIRE
58;RUE PIERRE DE COUBERTIN, COSNE COURS SUR LOIRE
58;CHE DES PIERRES, COSNE COURS SUR LOIRE
58;ALL DES PIVOTINS, COSNE COURS SUR LOIRE
58;CHE DE PLANTENOIX, COSNE COURS SUR LOIRE
58;RUE DE PLANTENOIX, COSNE COURS SUR LOIRE
58;RUE DE PLANTENOIX SIDEN, COSNE COURS SUR LOIRE
58;RUE DU PONCEAU, COSNE COURS SUR LOIRE
58;RLE DU PONCEAU, COSNE COURS SUR LOIRE
58;RUE DU PONT DE COURS, COSNE COURS SUR LOIRE
58;CHE DU PONT MIDOU, COSNE COURS SUR LOIRE
58;RUE DE PREDELLE, COSNE COURS SUR LOIRE
58;IMP DE PRESLE, COSNE COURS SUR LOIRE
58;CHE DE PRESLES, COSNE COURS SUR LOIRE
58;RUE DES PRES FLEURIS, COSNE COURS SUR LOIRE
58;RTE DES PRES NEROT, COSNE COURS SUR LOIRE
58;IMP DU PRIEURE, COSNE COURS SUR LOIRE
58;RUE DE PROVENCE, COSNE COURS SUR LOIRE
58;ALL DES PRUNUS, COSNE COURS SUR LOIRE
58;RUE DE LA PUISAYE, COSNE COURS SUR LOIRE
58;RUE DES PUITS, COSNE COURS SUR LOIRE
58;AV DU 14 JUILLET, COSNE COURS SUR LOIRE
58;RUE DU 14 JUILLET, COSNE COURS SUR LOIRE
58;RUE DES 4 FILS DOUMER, COSNE COURS SUR LOIRE
58;CHE DES QUATRE NOYERS, COSNE COURS SUR LOIRE
58;IMP DES 4 NOYERS, COSNE COURS SUR LOIRE
58;AV DU 85 EME, COSNE COURS SUR LOIRE
58;IMP DES REMPARTS, COSNE COURS SUR LOIRE
58;BD DE LA REPUBLIQUE, COSNE COURS SUR LOIRE
58;PL DE LA RESISTANCE, COSNE COURS SUR LOIRE
58;CHE DU RIO MERLIN, COSNE COURS SUR LOIRE
58;IMP RIVIERES SAINT AGNAN, COSNE COURS SUR LOIRE
58;RUE RIVIERES SAINT AGNAN, COSNE COURS SUR LOIRE
58;IMP RIVIERES ST JACQUES, COSNE COURS SUR LOIRE
58;RUE DES RIVIERES ST JACQUES, COSNE COURS SUR LOIRE
58;RUE DE LA ROBARDERIE, COSNE COURS SUR LOIRE
58;RUE ROBERT NABERIS, COSNE COURS SUR LOIRE
58;RUE ROL TANGUY, COSNE COURS SUR LOIRE
58;RUE ROMAIN ROLLAND, COSNE COURS SUR LOIRE
58;RUE ROMAINE, COSNE COURS SUR LOIRE
58;RUE ROSA PARKS, COSNE COURS SUR LOIRE
58;RTE DE SANCERRE, COSNE COURS SUR LOIRE
58;CHE DE LA RUE, COSNE COURS SUR LOIRE
58;PAS DE LA RUE, COSNE COURS SUR LOIRE
58;ALL DU RUISSEAU, COSNE COURS SUR LOIRE
58;RUE DU RUISSEAU LES SABLES, COSNE COURS SUR LOIRE
58;CHE DES SABLES, COSNE COURS SUR LOIRE
58;RUE DES SABLES, COSNE COURS SUR LOIRE
58;RUE SADI CARNOT, COSNE COURS SUR LOIRE
58;PL SAINT AGNAN, COSNE COURS SUR LOIRE
58;PAS SAINT AGNAN, COSNE COURS SUR LOIRE
58;RUE SAINT AGNAN, COSNE COURS SUR LOIRE
58;RLE SAINT AGNAN, COSNE COURS SUR LOIRE
58;CHE DE SAINT AMAND, COSNE COURS SUR LOIRE
58;RTE DE SAINT AMAND, COSNE COURS SUR LOIRE
58;ALL SAINT EXUPERY, COSNE COURS SUR LOIRE
58;RUE ST FIRMIN, COSNE COURS SUR LOIRE
58;RUE SAINT JACQUES, COSNE COURS SUR LOIRE
58;RUE ST LAZARE, COSNE COURS SUR LOIRE
58;MAIL SAINT LAURENT, COSNE COURS SUR LOIRE
58;RUE ST LAURENT, COSNE COURS SUR LOIRE
58;RUE DE SAINT LOUP, COSNE COURS SUR LOIRE
58;RTE DE SAINT LOUP, COSNE COURS SUR LOIRE
58;IMP SAINT PAUL, COSNE COURS SUR LOIRE
58;RUE DE SAINT PERE, COSNE COURS SUR LOIRE
58;IMP SAINT PIERRE, COSNE COURS SUR LOIRE
58;RUE SAINTE ANNE, COSNE COURS SUR LOIRE
58;PL SAINTE BRIGITTE, COSNE COURS SUR LOIRE
58;RTE DES SAJOTS, COSNE COURS SUR LOIRE
58;RUE DU SANCERROIS, COSNE COURS SUR LOIRE
58;IMP DU SANITAS, COSNE COURS SUR LOIRE
58;QUAI DU SANITAS, COSNE COURS SUR LOIRE
58;PL DU QUAI DU SANITAS, COSNE COURS SUR LOIRE
58;RUE DU QUAI DU SANITAS, COSNE COURS SUR LOIRE
58;RUE DU SANITAS, COSNE COURS SUR LOIRE
58;ALL DES SAULES, COSNE COURS SUR LOIRE
58;RUE DE LA SENTE, COSNE COURS SUR LOIRE
58;ALL SIMONE RENAUD DARRAS, COSNE COURS SUR LOIRE
58;RUE SOLAIRE, COSNE COURS SUR LOIRE
58;ALL DE LA SOLOGNE, COSNE COURS SUR LOIRE
58;ALL DE LA SOURCE, COSNE COURS SUR LOIRE
58;RUE DU STADE, COSNE COURS SUR LOIRE
58;CHE DU TACOT, COSNE COURS SUR LOIRE
58;RTE DU TACOT, COSNE COURS SUR LOIRE
58;ALL DE LA TERRE ROUGE, COSNE COURS SUR LOIRE
58;PL THEME, COSNE COURS SUR LOIRE
58;RUE THEME, COSNE COURS SUR LOIRE
58;ALL THOUVENOT, COSNE COURS SUR LOIRE
58;CHEM DES TIROIRS, COSNE COURS SUR LOIRE
58;CHE TOURISTIQUE, COSNE COURS SUR LOIRE
58;RUE TRAVERSIERE, COSNE COURS SUR LOIRE
58;ALL DU TREMBLAT, COSNE COURS SUR LOIRE
58;IMP DES TREMBLES, COSNE COURS SUR LOIRE
58;RUE DU TRESORIER, COSNE COURS SUR LOIRE
58;RUE DES 3 PONTS, COSNE COURS SUR LOIRE
58;ALL DES 3 PONTS, COSNE COURS SUR LOIRE
58;CHE DE LA VALLEE GALLARD, COSNE COURS SUR LOIRE
58;IMP DE VEAUGUES, COSNE COURS SUR LOIRE
58;RUE DE VEAUGUES, COSNE COURS SUR LOIRE
58;AV DE VERDUN, COSNE COURS SUR LOIRE
58;ALL DES VERGNES, COSNE COURS SUR LOIRE
58;ALL VERTE, COSNE COURS SUR LOIRE
58;RUE VICTOR HUGO, COSNE COURS SUR LOIRE
58;RUE VIEILLE ROUTE, COSNE COURS SUR LOIRE
58;ALL DE VIGNELLE, COSNE COURS SUR LOIRE
58;RUE DE VIGNELLE, COSNE COURS SUR LOIRE
58;RUE DES VIGNES, COSNE COURS SUR LOIRE
58;CHEM DES VIGNES STE BRIGITTE, COSNE COURS SUR LOIRE
58;RLE DE LA VILLE, COSNE COURS SUR LOIRE
58;RTE DE VILLEBERNE, COSNE COURS SUR LOIRE
58;RTE DE VILLECHAUD, COSNE COURS SUR LOIRE
58;RUE DE VILLECHAUD, COSNE COURS SUR LOIRE
58;RTE DE LA VILLEFROIDE, COSNE COURS SUR LOIRE
58;RTE DE VILLEGEAI, COSNE COURS SUR LOIRE
58;VC RUES DE VILLEPREVOIR, COSNE COURS SUR LOIRE
58;RTE DE VILLEPREVOIR, COSNE COURS SUR LOIRE
58;RTE DE VILLORGET, COSNE COURS SUR LOIRE
58;RUE DES VIOLETTES, COSNE COURS SUR LOIRE
58;RUE WALDECK ROUSSEAU, COSNE COURS SUR LOIRE
58;RTE DE LA CHAPELLE, COSSAYE
58;RUE DE CHENET, COSSAYE
58;RTE DE CREJEUX, COSSAYE
58;CHE DES CROTS MAILLOTS, COSSAYE
58;RTE DE DECIZE, COSSAYE
58;RUE DU DESERT, COSSAYE
58;RTE DE DORNES, COSSAYE
58;RUE DE L'EGLISE, COSSAYE
58;RTE DES FEUILLATS, COSSAYE
58;RUE DE LA JAQUETTE, COSSAYE
58;RTE DE LAMENAY, COSSAYE
58;RTE DE LUCENAY, COSSAYE
58;RTE DES MOUROUX, COSSAYE
58;CHEM DES OUILLERES, COSSAYE
58;CHEM DE LA PRAIRIE, COSSAYE
58;IMP DES ACACIAS, COULANGES LES NEVERS
58;RUE DES ALLEES, COULANGES LES NEVERS
58;IMP DES AULNES, COULANGES LES NEVERS
58;RUE BAILLY, COULANGES LES NEVERS
58;CHE DE BEAUREGARD, COULANGES LES NEVERS
58;BD DE BEAUREGARD, COULANGES LES NEVERS
58;RUE DE LA BONDE, COULANGES LES NEVERS
58;RUE DES BRUYERES, COULANGES LES NEVERS
58;IMP DE LA BONDE, COULANGES LES NEVERS
58;RUE DES CHAMPS BLANCS, COULANGES LES NEVERS
58;RUE DU CHAMP MARTIN, COULANGES LES NEVERS
58;RUE DES CHAMPS HARDIS, COULANGES LES NEVERS
58;RUE CHARLES BAUDELAIRE, COULANGES LES NEVERS
58;RUE DES CHAUMOTTES, COULANGES LES NEVERS
58;IMP 1ERE IMP DES CHAUMOTTES, COULANGES LES NEVERS
58;IMP 2EME IMP DES CHAUMOTTES, COULANGES LES NEVERS
58;CHE DU CHENE, COULANGES LES NEVERS
58;IMP CITES GAULIER, COULANGES LES NEVERS
58;RUE CLAUDE DEBUSSY, COULANGES LES NEVERS
58;RUE CLAUDE MONET, COULANGES LES NEVERS
58;IMP DU CLOS DE LA PIQUE, COULANGES LES NEVERS
58;IMP DU CLOS MARTIN, COULANGES LES NEVERS
58;RUE DU COLOMBIER, COULANGES LES NEVERS
58;IMP DESCARTES, COULANGES LES NEVERS
58;IMP DIDEROT, COULANGES LES NEVERS
58;RUE DU 19 MARS 1962, COULANGES LES NEVERS
58;RUE DOCTEUR MICHEL GAULIER, COULANGES LES NEVERS
58;ALL DES EGLANTINES, COULANGES LES NEVERS
58;IMP DE L'ETANG, COULANGES LES NEVERS
58;RUE DES FILLES, COULANGES LES NEVERS
58;IMP FLAUBERT, COULANGES LES NEVERS
58;RUE DE LA FONTAINE, COULANGES LES NEVERS
58;RUE DE FORGENEUVE, COULANGES LES NEVERS
58;RUE GEN DE GAULLE, COULANGES LES NEVERS
58;IMP GEORGES BLANCHARD, COULANGES LES NEVERS
58;IMP GEORGE SAND, COULANGES LES NEVERS
58;RUE GEORGE SAND, COULANGES LES NEVERS
58;RUE DES GRANDS PRES, COULANGES LES NEVERS
58;RUE DES HATEES, COULANGES LES NEVERS
58;RUE HAROUN TAZIEFF, COULANGES LES NEVERS
58;RUE DE L HERMITAGE, COULANGES LES NEVERS
58;ALL HAROUN TAZIEFF, COULANGES LES NEVERS
58;RUE HENRI DUNANT, COULANGES LES NEVERS
58;AV DU HUIT MAI 1945, COULANGES LES NEVERS
58;RUE JACQUES PREVERT, COULANGES LES NEVERS
58;IMP DES JARDINS D'INES, COULANGES LES NEVERS
58;AV JEAN JAURES, COULANGES LES NEVERS
58;RUE JEAN MERMOZ, COULANGES LES NEVERS
58;RUE JEAN MOULIN, COULANGES LES NEVERS
58;IMP JEAN PAUL SARTRE, COULANGES LES NEVERS
58;RUE JEAN ROSTAND, COULANGES LES NEVERS
58;IMP JOLIOT CURIE, COULANGES LES NEVERS
58;RUE JULES RENARD, COULANGES LES NEVERS
58;IMP LAENNEC, COULANGES LES NEVERS
58;IMP DES LILAS, COULANGES LES NEVERS
58;IMP LAVOISIER, COULANGES LES NEVERS
58;IMP LOUIS DUVIVIER, COULANGES LES NEVERS
58;RUE LOUISE MICHEL, COULANGES LES NEVERS
58;CHE AU LOUP, COULANGES LES NEVERS
58;IMP DU LOUP, COULANGES LES NEVERS
58;RUE MARECHAL LECLERC, COULANGES LES NEVERS
58;RUE DES MARGUERITES, COULANGES LES NEVERS
58;ALL DU MOULIN, COULANGES LES NEVERS
58;CHE DU MOULIN A VENT, COULANGES LES NEVERS
58;RUE DU MOULIN A VENT, COULANGES LES NEVERS
58;IMP DU MOULIN MEULOT, COULANGES LES NEVERS
58;N ROUTE NATIONALE, COULANGES LES NEVERS
58;RUE DE LA NOIERIE, COULANGES LES NEVERS
58;RUE DU ONZE NOVEMBRE 1918, COULANGES LES NEVERS
58;RUE DES PARTIES, COULANGES LES NEVERS
58;RUE PASTEUR, COULANGES LES NEVERS
58;IMP DES PERRIERES, COULANGES LES NEVERS
58;RUE DES PERRIERES, COULANGES LES NEVERS
58;RUE DU PETIT CANAL, COULANGES LES NEVERS
58;RUE DES PETITES BRUYERES, COULANGES LES NEVERS
58;RUE DE LA PIQUE, COULANGES LES NEVERS
58;RUE PIERRE MENDES FRANCE, COULANGES LES NEVERS
58;ALL PIERRE DE COUBERTIN, COULANGES LES NEVERS
