64;RUE DES ACACIAS, ORTHEZ
64;RUE DES AIGRETTES, ORTHEZ
64;RUE DES AIGUILLETIERS, ORTHEZ
64;AV ADOLPHE DETCHEBARNE, ORTHEZ
64;RUE ALBERT CAMUS, ORTHEZ
64;RUE ALFRED DE VIGNY, ORTHEZ
64;RUE DE L AMITIE, ORTHEZ
64;PL ANDRE MALRAUX, ORTHEZ
64;AV D AQUITAINE, ORTHEZ
64;RUE ARISTIDE BRIAND, ORTHEZ
64;IMP DE L ARLAS, ORTHEZ
64;RUE DE L ARLAS, ORTHEZ
64;PL D ARMES, ORTHEZ
64;IMP PCE D ARMES, ORTHEZ
64;RUE ARNAUD DE SALETTE, ORTHEZ
64;CHE DE L ARRIEC, ORTHEZ
64;IMP D ASPE, ORTHEZ
64;RUE D ASPE, ORTHEZ
64;RUE DE L AUBISQUE, ORTHEZ
64;CHEM D AUBOUE, ORTHEZ
64;CHE D AUDIOS, ORTHEZ
64;RUE AUGER DE SUBERCAZE, ORTHEZ
64;RUE DES BAINS, ORTHEZ
64;IMP DES BAINS, ORTHEZ
64;CHE DE BARATONS, ORTHEZ
64;CHE DE BAURE, ORTHEZ
64;RUE BARON DE LAHONTAN, ORTHEZ
64;CHE BARATOU, ORTHEZ
64;RUE BAYARD, ORTHEZ
64;RTE DE BAYONNE, ORTHEZ
64;RUE DU BEARN, ORTHEZ
64;AV BEL AIR, ORTHEZ
64;IMP BEL AIR, ORTHEZ
64;RUE BELLEVUE, ORTHEZ
64;RUE PIERRE BEREGOVOY, ORTHEZ
64;RUE BERGERAU, ORTHEZ
64;CHE LAS BIASSOTTES, ORTHEZ
64;AV DU REGIMENT DE BIGORRE, ORTHEZ
64;CHE DU BIGNAU, ORTHEZ
64;RUE DE BILLERE, ORTHEZ
64;RTE DE BIRON, ORTHEZ
64;RUE LEON BLUM, ORTHEZ
64;RUE BOILEAU, ORTHEZ
64;IMP DU BOIS, ORTHEZ
64;RUE DU BONHEUR, ORTHEZ
64;PASS BONNECAZE, ORTHEZ
64;CHE DE BONNUT, ORTHEZ
64;RTE DE BORDEAUX, ORTHEZ
64;RUE DU BOURIALAA, ORTHEZ
64;RUE BOURG VIEUX, ORTHEZ
64;IMP DES BOUVREUILS, ORTHEZ
64;PL DES BOUVREUILS, ORTHEZ
64;RUE DES BOUVREUILS, ORTHEZ
64;CHE DE BRANA, ORTHEZ
64;PL BROSSERS, ORTHEZ
64;CR DE BROUCA, ORTHEZ
64;CHE DE CAMBLONG, ORTHEZ
64;CHE CAMBRESI, ORTHEZ
64;RUE DES CAMELIAS, ORTHEZ
64;CHE CAMETOT, ORTHEZ
64;RUE DES CAPUCINS, ORTHEZ
64;RUE DU CAMPING, ORTHEZ
64;CHE CARPASSE, ORTHEZ
64;ALL CASALOT, ORTHEZ
64;RUE DES CASCADES, ORTHEZ
64;CHE CASSIAOU, ORTHEZ
64;CHE CAZALA, ORTHEZ
64;CHE CAZALET, ORTHEZ
64;CHE DE LA CERISETTE, ORTHEZ
64;CD 947, ORTHEZ
64;RUE DES CEDRES, ORTHEZ
64;RUE DES CERISIERS, ORTHEZ
64;IMP DES CHAMPS, ORTHEZ
64;BD CHARLES DE GAULLE, ORTHEZ
64;IMP DES CHENES, ORTHEZ
64;CHE DU CHATEAU DE BAURE, ORTHEZ
64;IMP CLOS SAINT PAUL, ORTHEZ
64;CHE DES COTES, ORTHEZ
64;AV CORPS FRANC POMMIES, ORTHEZ
64;RUE DES COURTILLES, ORTHEZ
64;CHE DE COURTILLES, ORTHEZ
64;IMP DES COURTILLES, ORTHEZ
64;IMP COUSTET, ORTHEZ
64;RUE CRAVERIE, ORTHEZ
64;IMP CUBURY, ORTHEZ
64;CHE DE DANGLADE, ORTHEZ
64;AV DANIEL ARGOTE, ORTHEZ
64;IMP DANIEL LAFORE, ORTHEZ
64;RUE DANIEL LAFORE, ORTHEZ
64;RTE DE DAX, ORTHEZ
64;CHS DE DAX, ORTHEZ
64;AV MAL DE LATTRE DE TASSIGNY, ORTHEZ
64;RUE DU DIX NEUF MARS, ORTHEZ
64;RUE DU GENERAL DUCOURNAU, ORTHEZ
64;PL DE DEPART, ORTHEZ
64;IMP DESPAGNOU, ORTHEZ
64;AV DU DOCTEUR DHERS, ORTHEZ
64;CAMI DEU CAM, ORTHEZ
64;CHE DE DUC, ORTHEZ
64;IMP DE L ECORCHERIE, ORTHEZ
64;PL DES ECUREUILS, ORTHEZ
64;RUE DES ECUREUILS, ORTHEZ
64;RUE DES EDELWEISS, ORTHEZ
64;RUE EDMOND ROSTAND, ORTHEZ
64;RUE EMILE ZOLA, ORTHEZ
64;CHE ESLAYAS, ORTHEZ
64;RUE FELIX PECAUT, ORTHEZ
64;PL FEDERICO GARCIA LORCA, ORTHEZ
64;CHE DE FAUQUHIE, ORTHEZ
64;SQ FERNANDO PESSOA, ORTHEZ
64;CHE EGNES, ORTHEZ
64;CHE DUGUINE, ORTHEZ
64;PL DU FOIRAIL, ORTHEZ
64;RUE LA FONTAINE, ORTHEZ
64;AV FRANCIS JAMMES, ORTHEZ
64;RPT FRANCOIS MITTERRAND, ORTHEZ
64;AV FRANCOIS MITTERRAND, ORTHEZ
64;RUE FREDERIC MISTRAL, ORTHEZ
64;RUE DES FRERES RECLUS, ORTHEZ
64;RUE FROISSART, ORTHEZ
64;CHE GALOUBET, ORTHEZ
64;AV DE LA GARE, ORTHEZ
64;CHE DE GARLEPPES, ORTHEZ
64;RUE GASCOIN, ORTHEZ
64;SQ GASTON FEBUS, ORTHEZ
64;PROM GASTON FEBUS, ORTHEZ
64;RUE GASTON PLANTE, ORTHEZ
64;PRV GASTON VII, ORTHEZ
64;RUE DU GAVE, ORTHEZ
64;RUE DU GENERAL FOY, ORTHEZ
64;PL GEORGES BRASSENS, ORTHEZ
64;AV GEORGES MOUTET, ORTHEZ
64;RUE DES GLYCINES, ORTHEZ
64;RUE DU GOUNDET, ORTHEZ
64;RUE DU GREC, ORTHEZ
64;IMP DES HARBIOUS, ORTHEZ
64;CHE DE HAUROU, ORTHEZ
64;CHE DE GUILLARREMOUN, ORTHEZ
64;RUE GUANILLE, ORTHEZ
64;CHE DU HAOU, ORTHEZ
64;CHE DES HARBIOUS, ORTHEZ
64;PL HENRI NOGARET, ORTHEZ
64;RUE HENRI NOGARET, ORTHEZ
64;AV HENRI IV, ORTHEZ
64;AV HENRI GERMAIN EDELSBOURG, ORTHEZ
64;RUE DE L HORLOGE, ORTHEZ
64;CHE DE HOUN, ORTHEZ
64;CHE DE HOURCADE, ORTHEZ
64;AV DU HUIT MAI, ORTHEZ
64;RTE IMPERIALE, ORTHEZ
64;CHEM DE JACOB, ORTHEZ
64;RUE DES JACOBINS, ORTHEZ
64;RUE DES JARDINS, ORTHEZ
64;RUE JEAN JAURES, ORTHEZ
64;IMP JEAN MOULIN, ORTHEZ
64;RUE JEAN MOULIN, ORTHEZ
64;IMP JULES FERRY, ORTHEZ
64;RUE JEAN VIVANT, ORTHEZ
64;CHE JERTOU, ORTHEZ
64;CHE LAHERRERE, ORTHEZ
64;RUE JULES FERRY, ORTHEZ
64;CHE DU LAA, ORTHEZ
64;PL JOSEPH LABEYRIE, ORTHEZ
64;RUE JEANNE D ALBRET, ORTHEZ
64;RUE DE LABESTAA, ORTHEZ
64;RUE LA CARRERE, ORTHEZ
64;CHE LACAZETTE, ORTHEZ
64;RUE LAFONTAINE, ORTHEZ
64;IMP LAHOUN, ORTHEZ
64;CHE DE LAMARQUE, ORTHEZ
64;RUE LAMARTINE, ORTHEZ
64;CHE DE LAMOURET, ORTHEZ
64;CHE DE LAHITTE, ORTHEZ
64;CHE LATEOULEROTTE, ORTHEZ
64;RUE LAPEYRERE, ORTHEZ
64;CHE LARRIEIGT, ORTHEZ
64;CHE DE LAQUEYRE, ORTHEZ
64;CHEM DE LARTE, ORTHEZ
64;CHE LATERAL A LA VOIE FERREE, ORTHEZ
64;RUE LARRIQUE, ORTHEZ
64;PL PIERRE LAUGA, ORTHEZ
64;RUE DES LAURIERS, ORTHEZ
64;CHE LASLANNES, ORTHEZ
64;CHE DE LASSALLE, ORTHEZ
64;RUE LEON BERARD, ORTHEZ
64;CHE LARROQUE, ORTHEZ
64;RUE JEAN MARIE LHOSTE, ORTHEZ
64;CHE DE LALAGUE, ORTHEZ
64;CHE LAMAYSOUETTE, ORTHEZ
64;RUE DES LILAS, ORTHEZ
64;IMP DES LISERONS, ORTHEZ
64;RUE DE LOUIS, ORTHEZ
64;RUE LOUIS ARAGON, ORTHEZ
64;RUE LOUIS BARTHOU, ORTHEZ
64;PL LOUIS BATCAVE, ORTHEZ
64;ALL LOUNQUE, ORTHEZ
64;ALL LOUIS VICTOR GABRIAC, ORTHEZ
64;RUE ALBERT LUPIET, ORTHEZ
64;CHE LAPOUBLE, ORTHEZ
64;CHE LABORDE, ORTHEZ
64;CHE LATEOULERE, ORTHEZ
64;CHE CHEMIN LALANNE, ORTHEZ
64;RUE MADAME, ORTHEZ
64;RUE DES MAGNOLIAS, ORTHEZ
64;AV DE MAGRET, ORTHEZ
64;CHE DE MAGRET, ORTHEZ
64;IMP MAGRET, ORTHEZ
64;IMP IMPASSE NADAR, ORTHEZ
64;RUE DE MANNES, ORTHEZ
64;PL MARCADIEU, ORTHEZ
64;RUE MARCEL PAGNOL, ORTHEZ
64;BD MAL LECLERC, ORTHEZ
64;CHE DE MARLY, ORTHEZ
64;CHE DES MARMONTS, ORTHEZ
64;CHE DE MEILLON, ORTHEZ
64;CHE DE MARSAOU, ORTHEZ
64;CHEM MAYOURAOU, ORTHEZ
64;CHE MATACHOT, ORTHEZ
64;RUE MATACHOT, ORTHEZ
64;AV PIERRE MENDES FRANCE, ORTHEZ
64;RTE DE MAULEON, ORTHEZ
64;RUE MAURICE UTRILLO, ORTHEZ
64;RUE MERMOZ, ORTHEZ
64;CHE DE MESPLE, ORTHEZ
64;RUE MIMONCE, ORTHEZ
64;CHEM DE MELLION, ORTHEZ
64;RUE DES MIMOSAS, ORTHEZ
64;IMP DE MELLION, ORTHEZ
64;RUE MOLIERE, ORTHEZ
64;RUE DES MARMONTS, ORTHEZ
64;RUE MONCADE, ORTHEZ
64;CHE MONGUILHOT, ORTHEZ
64;AV MONTALIBET, ORTHEZ
64;RUE CLOS MONTALIBET, ORTHEZ
64;CHE MONTAUT, ORTHEZ
64;PL JEAN MOULIN, ORTHEZ
64;RUE DU MOULIN, ORTHEZ
64;CHE DU MOULIN DE RONTUN, ORTHEZ
64;CHE DE MOURET, ORTHEZ
64;RUE MOUSQUES, ORTHEZ
64;AV DE LA MOUTETE, ORTHEZ
64;PL DE LA MOUTETE, ORTHEZ
64;IMP MUSSET, ORTHEZ
64;N 117, ORTHEZ
64;RUE NARDEAU, ORTHEZ
64;CHE DE NAUDE, ORTHEZ
64;AV DE NAVARRE, ORTHEZ
64;RTE DE NAVARRENX, ORTHEZ
64;VC N 10 DITE D'ESLAYAS, ORTHEZ
64;IMP DU PRINCE NOIR, ORTHEZ
64;PL DE L'OCTROI, ORTHEZ
64;RUE DE L OFFICIAU, ORTHEZ
64;PL DU 11 NOVEMBRE 1918, ORTHEZ
64;RUE DU COL D OSQUICH, ORTHEZ
64;IMP D OSSAU, ORTHEZ
64;CHE DU PACHERA, ORTHEZ
64;RUE DE LA PAIX, ORTHEZ
64;RUE DU PARC, ORTHEZ
64;RUE DU PASSELYS, ORTHEZ
64;CHE DES PASSEURS DE LA LIBERTE, ORTHEZ
64;RUE PASTEUR, ORTHEZ
64;RTE DE PAU, ORTHEZ
64;RUE MARCEL PAUL, ORTHEZ
64;RUE PAUL BAILLERES, ORTHEZ
64;IMP PAUL JEAN TOULET, ORTHEZ
64;RUE PE DE COSTE, ORTHEZ
64;IMP PERGUILHEM, ORTHEZ
64;AV DU PESQUE, ORTHEZ
64;RUE DES PEUPLIERS, ORTHEZ
64;CHE DE PEYRET, ORTHEZ
64;CHE PIARROT, ORTHEZ
64;RUE DU PIC D ANIE, ORTHEZ
64;RUE PIERRE BENOIT, ORTHEZ
64;RUE PIERRE LASSERRE, ORTHEZ
64;IMP PIERRE LOTI, ORTHEZ
64;RUE PIERRE LOTI, ORTHEZ
64;CHE DE PIERROT, ORTHEZ
64;CHE DU PIFFRE, ORTHEZ
64;RUE DU PIFFRE, ORTHEZ
64;CHE DES PINS, ORTHEZ
64;PL PLACOTTE, ORTHEZ
64;AV ADRIEN PLANTE, ORTHEZ
64;BD DES POMMES, ORTHEZ
64;CHE DU PONTET, ORTHEZ
64;AV DU PONT NEUF, ORTHEZ
64;RUE DU PONT VIEUX, ORTHEZ
64;RPT DU PORTUGAL, ORTHEZ
64;RUE DU POURTALET, ORTHEZ
64;CHE DE POURTAOU, ORTHEZ
64;PL DE LA POUSTELLE, ORTHEZ
64;AV DU PDT KENNEDY, ORTHEZ
64;RUE DES PRIMEVERES, ORTHEZ
64;RUE GUILHAUME PROVENCAL, ORTHEZ
64;AV DE PROVENCE, ORTHEZ
64;CR DU PUITS, ORTHEZ
64;RUE DU PUITS DES JACOBINS, ORTHEZ
64;AUT 64 LA PYRENEENNE, ORTHEZ
64;AV DES PYRENEES, ORTHEZ
64;CR DE ROUMANY, ORTHEZ
64;RUE RACINE, ORTHEZ
64;CHE DE RABASTEIX, ORTHEZ
64;CHE DE RANCES, ORTHEZ
64;RUE RANCES, ORTHEZ
64;RUE DES REMPARTS, ORTHEZ
64;RUE ROARIE, ORTHEZ
64;IMP DE RONCEVAUX, ORTHEZ
64;CHE DE RONTU, ORTHEZ
64;IMP SABLAR, ORTHEZ
64;RUE SAINT EXUPERY, ORTHEZ
64;RUE SAINT CRICQ, ORTHEZ
64;RUE SAINT GILLES, ORTHEZ
64;PL SAINT PIERRE, ORTHEZ
64;RUE SAINT PIERRE, ORTHEZ
64;IMP SAINTE BARBE, ORTHEZ
64;CHE SAINTE SUZANNE, ORTHEZ
64;RTE DE SALLES MONGISCARD, ORTHEZ
64;RUE SELKIRK, ORTHEZ
64;RTE DE SAUVETERRE, ORTHEZ
64;CR DE SIMON, ORTHEZ
64;RUE DU SOMPORT, ORTHEZ
64;CR DE SORDE, ORTHEZ
64;RUE DU SOULOR, ORTHEZ
64;RUE DES SOURCES, ORTHEZ
64;RUE DU SOUVENIR FRANCAIS, ORTHEZ
64;IMP DU STADE, ORTHEZ
64;COTE DU STADE, ORTHEZ
64;RUE DU STADE, ORTHEZ
64;IMP SUAU DE LA CROIX, ORTHEZ
64;RUE SULLY, ORTHEZ
64;CHE DE TACHE, ORTHEZ
64;CHE DES TARANELLES, ORTHEZ
64;CHE DE LA TEOULERE, ORTHEZ
64;CHE DE TERRE BLANQUE, ORTHEZ
64;CHE DE TESTABI, ORTHEZ
64;AV DES TILLEULS, ORTHEZ
64;CHE DE TOUZAA, ORTHEZ
64;CHE DE TRIMORD, ORTHEZ
64;CHE DES TOUYAS, ORTHEZ
64;CHE DE TRIANA, ORTHEZ
64;RUE DE LA TRINITE, ORTHEZ
64;IMP TRINITE, ORTHEZ
64;IMP DU TROUILH, ORTHEZ
64;RUE DES TULIPES, ORTHEZ
64;CHEM DE TURY, ORTHEZ
64;RUE VERLAINE, ORTHEZ
64;RUE DU VIADUC, ORTHEZ
64;RUE VICTOR HUGO, ORTHEZ
64;RUE VIDAL, ORTHEZ
64;RTE VIEILLE DE CASTETARBE, ORTHEZ
64;CHE DU VIEUX MOULIN, ORTHEZ
64;IMP DES VIOLETTES, ORTHEZ
64;RUE DES VIOLETTES, ORTHEZ
64;IMP VIVES, ORTHEZ
64;RUE XAVIER DARGET, ORTHEZ
64;CHE DE L'ECOLE, ORTHEZ
64;CHE DE L'EGLISE, ORTHEZ
64;RPT D'ESPAGNE, ORTHEZ
64;CHE DE PLATE, ORTHEZ
64;PONT DE L'EUROPE, ORTHEZ
64;CHE LACROUTZ, ORTHEZ
64;RUE HENRIETTE LASSERRE, ORTHEZ
64;LOT DARREJUZOU, OS MARSILLON
64;LOT TOULOUSE, OS MARSILLON
64;RUE DE LA BARTHE, OS MARSILLON
64;RUE DE LA CARRERE, OS MARSILLON
64;CAMI DOU COR, OS MARSILLON
64;RUE DE LA COURNERE, OS MARSILLON
64;RUE DU COURNEROT, OS MARSILLON
64;IMP DES CRETES, OS MARSILLON
64;RTE DES CRETES, OS MARSILLON
64;IMP DE LA FONTAINE, OS MARSILLON
64;CHE DE GABARRAS, OS MARSILLON
64;RUE DU GAVE, OS MARSILLON
64;CHE DE LA GEYRE, OS MARSILLON
64;RUE LABARTHE, OS MARSILLON
64;CHE DE LAS MANOBRES, OS MARSILLON
64;CHE D ANGELUETA, OSSAS-SUHARE
64;RUE D ARROTZ, OSSAS-SUHARE
64;RUE DU BATZOKI, OSSAS-SUHARE
64;RTE DE CAMOU, OSSAS-SUHARE
64;RUE DE L EGLISE, OSSAS-SUHARE
64;RTE ELGABURU, OSSAS-SUHARE
64;CHE ETXEBERRALTEA, OSSAS-SUHARE
64;CHE ETXEBERRIGARAI, OSSAS-SUHARE
64;CHE GOIHENETXEA, OSSAS-SUHARE
64;CHE HARIXTOIGIBELA, OSSAS-SUHARE
64;RTE DE HIRIONDO, OSSAS-SUHARE
64;RUE IRAGOREN, OSSAS-SUHARE
64;CHE KARRIKALTEA, OSSAS-SUHARE
64;RTE LANDA, OSSAS-SUHARE
64;PL DE LA MAIRIE, OSSAS-SUHARE
64;CHE MENDIONDO, OSSAS-SUHARE
64;CHE DU MOULIN, OSSAS-SUHARE
64;CHE OTHATZE, OSSAS-SUHARE
64;RTE DE SUHARE, OSSAS-SUHARE
64;CHE TEILLEGIALTEA, OSSAS-SUHARE
64;RUE URUSKIA, OSSAS-SUHARE
64;LOT VAL D'ASPE, OSSE EN ASPE
64;CHE DE L ABATCH, OSSE EN ASPE
64;CHE D'ARREGLE, OSSE EN ASPE
64;CHE D ASSUC, OSSE EN ASPE
64;RTE DE BEDOUS, OSSE EN ASPE
64;CHE DE BOUILLERCE, OSSE EN ASPE
64;CHE DU BUGALA, OSSE EN ASPE
64;CHE DU CAP DE LA BIELLE, OSSE EN ASPE
64;PAS DU CASTETH, OSSE EN ASPE
64;RUE DU CASTETH, OSSE EN ASPE
64;CHE DU CIMETIERE, OSSE EN ASPE
64;RTE DU COL DE BOUEZOU, OSSE EN ASPE
64;CHE DE COULOUMIES, OSSE EN ASPE
64;CHE DU COUSSAU, OSSE EN ASPE
64;IMP CORNATA, OSSE EN ASPE
64;RTE DEPARTEMENTALE N 442, OSSE EN ASPE
64;PL DE L EGLISE, OSSE EN ASPE
64;RTE D ESPAGNE, OSSE EN ASPE
64;CHE DE L ESPOUNE, OSSE EN ASPE
64;CHE D ESTERE, OSSE EN ASPE
64;PL DE LA FONTAINE D'EN HAUT, OSSE EN ASPE
64;RUE DE LA FONTAINE, OSSE EN ASPE
64;PL DE GAYROSSE, OSSE EN ASPE
64;RUE D EN HAUT, OSSE EN ASPE
64;RLE DU HAUT, OSSE EN ASPE
64;RTE DU COL D'HOURATATE, OSSE EN ASPE
64;CHE D IPERE, OSSE EN ASPE
64;CHE DES JARDINS, OSSE EN ASPE
64;IMP LACOUDURE, OSSE EN ASPE
64;CHE DE LENGOUST, OSSE EN ASPE
64;IMP DU LARRICQ, OSSE EN ASPE
64;CHE DU LAVOIR, OSSE EN ASPE
64;RUE DE LA MAIRIE, OSSE EN ASPE
64;RUE DE MARIE BLANQUE, OSSE EN ASPE
64;CHE DU MONT, OSSE EN ASPE
64;IMP DU MOULIN, OSSE EN ASPE
64;CR DU PONT SUZON, OSSE EN ASPE
64;CHE DE PROUDOUQUI, OSSE EN ASPE
64;RUE DU SAILLET, OSSE EN ASPE
64;RUE DU TEMPLE, OSSE EN ASPE
64;RUE DU TORON DERA VIGA, OSSE EN ASPE
64;CHE DE LA TOUR, OSSE EN ASPE
64;RUE DU TOUROUM DE LA BIGUE, OSSE EN ASPE
64;RUE DU VAL D ASPE, OSSE EN ASPE
64;IMP DU VERGER, OSSE EN ASPE
64;RTE DU BOIS, OSSENX
64;RUE CAMOU, OSSENX
64;RTE DE CASTETBON, OSSENX
64;PL DE L EGLISE, OSSENX
64;RUE DU GAVE, OSSENX
64;RUE LACOSTES, OSSENX
64;RUE LASBIES, OSSENX
64;RUE DU LAVOIR, OSSENX
64;IMP PYRENEES, OSSENX
64;RTE DES AUGAS, OSSERAIN-RIVAREYTE
64;RTE DES BARTHES, OSSERAIN-RIVAREYTE
64;CHE DU BEDAT, OSSERAIN-RIVAREYTE
64;IMP BELLEVUE, OSSERAIN-RIVAREYTE
64;IMP DE BERGERAS, OSSERAIN-RIVAREYTE
64;IMP DE BROUQUET, OSSERAIN-RIVAREYTE
64;CHE DE CABANE, OSSERAIN-RIVAREYTE
64;CHE DE CABILLE, OSSERAIN-RIVAREYTE
64;IMP DE LA CAMPAGNE, OSSERAIN-RIVAREYTE
64;CHE DE CLAIRE, OSSERAIN-RIVAREYTE
64;RTE DE CLERMOUN, OSSERAIN-RIVAREYTE
64;RUE DE COMPOSTELLE, OSSERAIN-RIVAREYTE
64;IMP DES ECOLIERS, OSSERAIN-RIVAREYTE
64;RUE DE L EGLISE, OSSERAIN-RIVAREYTE
64;IMP EZKIA, OSSERAIN-RIVAREYTE
64;CHE DE LA GARDE BARRIERE, OSSERAIN-RIVAREYTE
64;IMP DU HERAS, OSSERAIN-RIVAREYTE
64;RUE DE L HOPITAL, OSSERAIN-RIVAREYTE
64;IMP DU LOIREN, OSSERAIN-RIVAREYTE
64;IMP MARLAC, OSSERAIN-RIVAREYTE
64;IMP DE LA MINOTERIE, OSSERAIN-RIVAREYTE
64;CHE DE MIQUEU, OSSERAIN-RIVAREYTE
64;CHE DE MONTALIBET, OSSERAIN-RIVAREYTE
64;RTE DE LA NAVARRE, OSSERAIN-RIVAREYTE
64;RTE D OSSERAIN, OSSERAIN-RIVAREYTE
64;RTE DE PARENTIES, OSSERAIN-RIVAREYTE
64;CHE DU PEHAU, OSSERAIN-RIVAREYTE
64;RTE DE SAINT-FELIX, OSSERAIN-RIVAREYTE
64;RTE DE SAINT-PALAIS, OSSERAIN-RIVAREYTE
64;RTE DU SAISON, OSSERAIN-RIVAREYTE
64;RTE DE LA SOULE, OSSERAIN-RIVAREYTE
64;CHE DE SUSMIEN, OSSERAIN-RIVAREYTE
64;VC 49 DU ACHALAMENDY, OSSES
64;VC 35 DE AHAICE, OSSES
64;VC 42 DE ANCHIA, OSSES
64;VC 9 DE ANDRESENIA, OSSES
64;VC 53 DE ANSARAMENDY, OSSES
64;VC 24 DE ARBEL, OSSES
64;VC 11 DE ARTHE, OSSES
64;VC 56 DE BARRANDEGUIA, OSSES
64;VC 3 DE BETRINIA, OSSES
64;VC 28 DE BIDEGAINA, OSSES
64;VC 21 DE BISAUHURIA, OSSES
64;VC 31 DE BORDA-CELHAY, OSSES
64;VC 52 DE BORDDA, OSSES
64;VC 45 DE BORDEGUIA, OSSES
64;VC 10 DU BOURG, OSSES
64;VC 22 DE CELHAY, OSSES
64;VC 44 DE CHANTXOENIA, OSSES
64;VC 46 DE LA CHAPELLE, OSSES
64;VC 2 DE CHARABOIL, OSSES
64;VC 12 DU CHATEAU D'EAU, OSSES
64;VC 4 DE CHEMETONIA, OSSES
64;VC 61 DE COMPASENIA, OSSES
64;RTE DEPARTEMENTALE 8, OSSES
64;RTE DEPARTEMENTALE 918, OSSES
64;VC 47 DU LOT ESPIL, OSSES
64;VC 14 DE ETCHAHARIA, OSSES
64;VC 15 DE ETCHARNIA, OSSES
64;VC 20 DE EYHARA, OSSES
64;VC 58 DE GANCHALIA, OSSES
64;VC 29 DE GARROKO-EYHARA, OSSES
64;VC 6 DE GASTENANIA, OSSES
64;VC 30 DE GOXA-LEKU, OSSES
64;VC 36 DE GUERECHITENIA, OSSES
64;VC 1 DE HARBERGA, OSSES
64;VC 37 DE HARRUNDUYA, OSSES
64;VC 59 DE HEGUIGORRIKO-BORDA, OSSES
64;VC 64 DE INDA-BORDA, OSSES
64;VC 23 DE IRIBERRY, OSSES
64;VC 48 DE IROCHETA, OSSES
64;VC 27 DE ITHURALDE, OSSES
64;VC 57 DE JESUSENIA, OSSES
64;VC 8 DE KADET-BORDA, OSSES
64;VC 25 DE LANDABURIA, OSSES
64;VC 16 DE LASARTE, OSSES
64;VC 39 DE MARTICOTEN-BORDA, OSSES
64;VC 54 DE MARTINGASTENIA, OSSES
64;VC 33 DE MENDICOAGUE, OSSES
64;VC 26 DE MENDIGUILIA, OSSES
64;VC 17 DE MENDITARREN BIDEA, OSSES
64;VC 40 DE MOTCHONDOENIA, OSSES
64;VC 13 DE MOUCHICO, OSSES
64;VC 34 DE MOURGIA, OSSES
64;VC 63 DE MUGONDOA, OSSES
64;VC 18 DU MUR A GAUCHE, OSSES
64;VC 32 DU LOT OTHALEPO, OSSES
64;VC 43 DU OXOTEIA, OSSES
64;VC 5 DE PORTOLOA, OSSES
64;VC 55 DE PREMOBERRIA, OSSES
64;VC 51 DE SAGORRIA, OSSES
64;VC 41 DE SARDILUTCIA, OSSES
64;VC 62 DE TIPIAN-BORDA, OSSES
64;VC 19 DE UHARSAN, OSSES
64;VC 7 DE UNHAIA, OSSES
64;VC 50 DE URUSPURU, OSSES
64;VC 65 DE XARABOIL, OSSES
64;VC 38 DE YONKOENIA, OSSES
64;VC 60 DE YONKO-HANDIA, OSSES
64;IMP LOUIS ET JULIETTE BARRERE, OUILLON
64;CHE LAS BIGUES, OUILLON
64;CAMI DE LAS BORDE, OUILLON
64;CHE DE SOUM DOU BOS, OUILLON
64;CHE DE CAPSUS, OUILLON
64;CHE DES CHENES, OUILLON
64;CHE DES ECOLIERS, OUILLON
64;CHE DE GUICHOT, OUILLON
64;CAMI DE LA LANNE, OUILLON
64;CHE LAS LANNES, OUILLON
64;CHE DE LANSAMAN, OUILLON
64;CHE AU-DELA DU LUY, OUILLON
64;CHE DE LA MOULERE, OUILLON
64;VC CAMI DOUS MOULIAS, OUILLON
64;CHE DE PEBORDE, OUILLON
64;CAMI DOUS PEYRES, OUILLON
64;CHE DES PINS, OUILLON
64;CHE DES POUBELLES, OUILLON
64;CAMI DOUS SARRAILHS, OUILLON
64;LOT BORDENAVE, OUSSE
64;CLOS D ANGLAS, OUSSE
64;LOT LA CHENAIE, OUSSE
64;LOT LA CHENAIE 2, OUSSE
64;LOT COTTAGES DE L OUSSE, OUSSE
64;LOT DES PYRENEES, OUSSE
64;LOT LE GABIZOS, OUSSE
64;LOT CLOS LA HOUN, OUSSE
64;LOT CLOS SAINT JULIEN, OUSSE
64;LOT MADELEINE, OUSSE
64;LOT PRIMEVERES, OUSSE
64;LOT LA QUINDA, OUSSE
64;CLOS RUSSEL, OUSSE
64;CLOS DU VERGER, OUSSE
64;LOT HAUTE PLAINE, OUSSE
64;LOT CLOS LES CHARMILLES, OUSSE
64;LOT CLOS LES BERGES DE L OUSSE, OUSSE
64;LOT ROGER 2, OUSSE
64;LOT DOMAINE DES PYRENEES 2, OUSSE
64;LOT CLOS DES CERISIERS, OUSSE
64;CLOS SAINT FRANCOIS, OUSSE
64;LOT CLOS SAINT MICHEL, OUSSE
64;LOT DU LANOT, OUSSE
64;LOT LE CLOS DES MOULINS, OUSSE
64;LOT CLOS PLEIN SUD, OUSSE
64;RUE LES COTTAGES DE L OUSSE, OUSSE
64;IMP DES AUGAS, OUSSE
64;RUE DES AUGAS, OUSSE
64;RUE DOU BARTHOUIL, OUSSE
64;CHE DE BEAUMONT, OUSSE
64;IMP BERGES DE L OUSSE, OUSSE
64;IMP BERNADETS, OUSSE
64;CHE LOU BEROY CAMI, OUSSE
64;CHE DE BIARCE, OUSSE
64;RUE LOU BILATGE, OUSSE
64;CHE CAMBUS, OUSSE
64;CHE LOU CAMI DE HER, OUSSE
64;CHE CAMPAGNE D OUSSE, OUSSE
64;RUE DU CANAL, OUSSE
64;CHE CAPBAT, OUSSE
64;CHE CAPSUS, OUSSE
64;IMP CAPSUS, OUSSE
64;IMP DES CERISIERS, OUSSE
64;ALL DES CHAMPS, OUSSE
64;IMP DES CHARMILLES, OUSSE
64;CR DES CHATAIGNERAIES, OUSSE
64;CHE DE LA CHATAIGNERAIE, OUSSE
64;IMP DE LA CHATAIGNERAIE, OUSSE
64;RUE DES CHENES, OUSSE
64;IMP DES CHEVREFEUILLES, OUSSE
64;IMP DES CHEVREUILS, OUSSE
64;IMP CLOS DU VERGER, OUSSE
64;IMP CLOS DE L'OUSSE, OUSSE
64;CHE SOUM DE COSTE, OUSSE
64;PL DE L ECOLE, OUSSE
64;RUE DES ECOLES, OUSSE
64;RUE DE L EGLISE, OUSSE
64;CHE DE L ESPOUNE, OUSSE
64;IMP HAUTE PLAINE, OUSSE
64;CHE HENRI IV, OUSSE
64;AV DES JONQUILLES, OUSSE
64;IMP LABOURDETTE, OUSSE
64;IMP LAFOI, OUSSE
64;CHE LANOT, OUSSE
64;RUE DU LANOT, OUSSE
64;CHE LASMUGUES, OUSSE
64;IMP LASMUGUES, OUSSE
64;RUE DES LAURIERS, OUSSE
64;CHE DE LESPONNE, OUSSE
64;CHE LOUBOUET, OUSSE
64;PL DE LA MAIRIE, OUSSE
64;CHE MAUHOURAT, OUSSE
64;RTE DE MORLAAS, OUSSE
64;IMP DU MOULIN, OUSSE
64;AV DES MOULINS, OUSSE
64;RUE DES MYOSOTIS, OUSSE
64;IMP DE L OUSSE, OUSSE
64;IMP DES PARTOLES, OUSSE
64;RTE DE PAU, OUSSE
64;CHE DE LA PLAINE, OUSSE
64;RUE DE LA PLANE, OUSSE
64;CHE DU PLATEAU, OUSSE
64;AV DES PYRENEES, OUSSE
64;PL DES PYRENEES, OUSSE
64;CHE LA QUINDA, OUSSE
64;RUE DU SOULOR, OUSSE
64;RTE DE TARBES, OUSSE
64;PL DES TILLEULS, OUSSE
64;IMP DU VERT GALANT, OUSSE
64;IMP DES VIOLETTES, OUSSE
64;CHE DE BERIE, OZENX MONTESTRUCQ
64;CHE DE BOURDIEU, OZENX MONTESTRUCQ
64;RUE LE BOURG, OZENX MONTESTRUCQ
64;CHE DE CAPDECOSTE, OZENX MONTESTRUCQ
64;CHE LA CARRERE, OZENX MONTESTRUCQ
64;CHE DE COYLA, OZENX MONTESTRUCQ
64;CHE DE DUNE, OZENX MONTESTRUCQ
64;CHE DE GLAUDIN, OZENX MONTESTRUCQ
64;CHE HAURIC, OZENX MONTESTRUCQ
64;CHE D IBARCQ, OZENX MONTESTRUCQ
64;CHE DE LABARRAQUETTE, OZENX MONTESTRUCQ
64;CHE LABIROUNEZE, OZENX MONTESTRUCQ
64;CHE LACARRERE, OZENX MONTESTRUCQ
64;CHE DE LACROUTS, OZENX MONTESTRUCQ
64;CHE LAHEUGUERE, OZENX MONTESTRUCQ
64;CHE DE LAHITAOU, OZENX MONTESTRUCQ
64;CHE DE LALANNE, OZENX MONTESTRUCQ
64;CHE DE LARROQUE, OZENX MONTESTRUCQ
64;CHE LASSERADE, OZENX MONTESTRUCQ
64;CHE LAVIGNE, OZENX MONTESTRUCQ
64;CHE DE LHOSTEBIELH, OZENX MONTESTRUCQ
64;CHE DES MARGES, OZENX MONTESTRUCQ
64;RTE DE MONTESTRUCQ, OZENX MONTESTRUCQ
64;CHE DE MONTESQUIEU, OZENX MONTESTRUCQ
64;CHE DU MOULIN, OZENX MONTESTRUCQ
64;RTE DE NARP, OZENX MONTESTRUCQ
64;CHE DE SAENZ, OZENX MONTESTRUCQ
64;RTE DE SAUVETERRE, OZENX MONTESTRUCQ
64;CHE DE SERRES, OZENX MONTESTRUCQ
64;CHE DE TOUMAZOU, OZENX MONTESTRUCQ
64;CHE TOUYAROU, OZENX MONTESTRUCQ
64;CHE DE TUYAS, OZENX MONTESTRUCQ
64;CHE D AGERREA, PAGOLLE
64;CHE D AGREHONIA, PAGOLLE
64;CHE D AIZAGERREA, PAGOLLE
64;RTE D ARHANSUS, PAGOLLE
64;RTE D ARLEGIA, PAGOLLE
64;CHE D ARRASIPEA, PAGOLLE
64;RTE D ARTZALARRONDOA, PAGOLLE
64;CHE D AZTAILLUA, PAGOLLE
64;CHE DE BETRANEA, PAGOLLE
64;CHE DE BIDARTEA, PAGOLLE
64;RTE DE BORDAGARAIA, PAGOLLE
64;CHE D EIHERA, PAGOLLE
64;CHE D EIHERAZAINTEGIA, PAGOLLE
64;CHE D EKHILARRONDOA, PAGOLLE
64;CHE D ELIXONDOBORDA, PAGOLLE
64;PL ELIZATIA, PAGOLLE
64;CHE D ENAUTENEA, PAGOLLE
64;CHE D ERREKARTEA, PAGOLLE
64;CHE D ETHENE, PAGOLLE
64;CHE D ETXEBERRIBORDA, PAGOLLE
64;CHE D ETXEBERRIA, PAGOLLE
64;CHE D ETXEGOIHENEA, PAGOLLE
64;CHE D ETXEPAREA, PAGOLLE
64;CHE DE GOIHENETXEA, PAGOLLE
64;RTE DE HEGILUZTOIA, PAGOLLE
64;CHE D IDIARBERRIA, PAGOLLE
64;CHE D IDIARBORDA, PAGOLLE
64;CHE D IZPAXURI, PAGOLLE
64;CHE D IPHARREA, PAGOLLE
64;CHE D IRIBARNEA, PAGOLLE
64;CHE D IXUREGIA, PAGOLLE
64;CHE D URUNTZIA, PAGOLLE
64;RTE DE JUXUE, PAGOLLE
64;CHE DE KHARRIKABORDA, PAGOLLE
64;CHE DE KURUTXETA, PAGOLLE
64;RTE DE LAMBARRE, PAGOLLE
64;CHE DE LARREGARAIA, PAGOLLE
64;CHE DE LARRONDOA, PAGOLLE
64;RTE DE MERKHAPIDEA, PAGOLLE
64;CHE DE METHOLA, PAGOLLE
64;CHE DE MORDOIA, PAGOLLE
64;RTE DE MUSCULDY, PAGOLLE
64;CHE D OIHAMOTOA, PAGOLLE
64;CHE D OIHANBURUA, PAGOLLE
64;CHE DE PATRASEA, PAGOLLE
64;CHE DE PIERRETEGIA, PAGOLLE
64;RTE DE PUTTUNBORDA, PAGOLLE
64;RTE DE PUTUNTEGIA, PAGOLLE
64;CHE DU RELAIS XAZPI, PAGOLLE
64;CHE DE SAGARDOIA, PAGOLLE
64;CHE DE SAHALBURUA, PAGOLLE
64;RTE DE SALABERRIA, PAGOLLE
64;CHE DE SALABERRIOIHANA, PAGOLLE
64;CHE DE TRISTENTENIA, PAGOLLE
64;CHE DE SEMEATEGIA, PAGOLLE
64;RTE DE TAKILEA, PAGOLLE
64;CHE DE TEILAGORRIA, PAGOLLE
64;RTE DE UHART MIXE, PAGOLLE
64;CHE DE XABALETA, PAGOLLE
64;CHE DE XAZPITEGIA, PAGOLLE
64;LOT LAPERE, PARBAYSE
64;CHE D'ABOS, PARBAYSE
64;CHE D' ANDOINGTS, PARBAYSE
64;RTE D'ARBUS, PARBAYSE
64;CHE LA CABANE, PARBAYSE
64;COTE LA COSTE BIELHE, PARBAYSE
64;CHE DEUS ESQUIOTS, PARBAYSE
64;CHE FOUERTOU, PARBAYSE
64;CHE LALIERE, PARBAYSE
64;CHE DE LA LEZE, PARBAYSE
64;PL DE LA MAIRIE, PARBAYSE
64;RTE DE MONEIN, PARBAYSE
64;PL MIEY DE NOUSTE, PARBAYSE
64;CHE DES SOURCES, PARBAYSE
64;CHE DE TOURRET, PARBAYSE
64;CHE DES TOUYAS, PARBAYSE
64;CHE DES VIGNES, PARBAYSE
64;LOT BARRERE, PARDIES
64;LOT BERGERAS, PARDIES
64;LOT DES PYRENEES, PARDIES
64;CITE SCIPAM, PARDIES
64;RTE D'ABOS, PARDIES
64;AV DES ACACIAS, PARDIES
64;IMP DES ACACIAS, PARDIES
64;ALL DE L'AMITIE, PARDIES
64;IMP DU PIC D ANSABERE, PARDIES
64;IMP DU PIC D ARLAS, PARDIES
64;RTE D'ARTIX, PARDIES
64;CHE DES AYGUETTES, PARDIES
64;RUE DES AYGUETTES, PARDIES
64;RUE DES BARATS, PARDIES
64;CHE DU BATEAU, PARDIES
64;ALL BEAU SOLEIL, PARDIES
64;IMP BIDACHE, PARDIES
64;RUE BIDACHE, PARDIES
64;RUE DU BOIS, PARDIES
64;AV CAMOUS, PARDIES
64;RUE CAMOUTS, PARDIES
64;PL DE CARRENO, PARDIES
64;RUE CARREROT, PARDIES
64;RUE CAUNEILLE, PARDIES
64;RUE CHARLES DE BORDEU, PARDIES
64;RUE CHARLES LACOSTE, PARDIES
64;RUE CHARLES MOUREU, PARDIES
64;ALL DES CHENES, PARDIES
64;CD 2, PARDIES
64;CD 33, PARDIES
64;PL DE L'EGLISE, PARDIES
64;RUE D'ESPOILLE, PARDIES
64;RUE DE FRIQUET, PARDIES
64;RUE DU FRONTON, PARDIES
64;RUE DU GAVE, PARDIES
64;RUE HENRI IV, PARDIES
64;RUE HOURCADE, PARDIES
64;AV DU LAC, PARDIES
64;RUE LA CAMPAGNETTE, PARDIES
64;CHE LACROUTS, PARDIES
64;RUE DE LAMARQUE, PARDIES
64;ALL DES LAURIERS, PARDIES
64;RUE DES LILAS, PARDIES
64;CHE DE LOUNGAGNE, PARDIES
64;AV DU MARCADIEU, PARDIES
64;PL DU MARCADIEU, PARDIES
64;IMP BERGERAS, PARDIES
64;RUE DE MAUNAS, PARDIES
64;RUE DU MIDI, PARDIES
64;AV DU MOULIN, PARDIES
64;RUE DU MUGUET, PARDIES
64;IMP DU PIC D ORHY, PARDIES
64;RUE D'OSSAU, PARDIES
64;RUE PARDIERES, PARDIES
64;RUE DU PIC D'ANIE, PARDIES
64;ALL DES PIONNIERS, PARDIES
64;AV DU PONT DE PIERRE, PARDIES
64;RUE DE PROVENCE, PARDIES
64;RUE DES PYRENEES, PARDIES
64;RUE DE SEMPE, PARDIES
64;AV DU STADE, PARDIES
64;IMP DES TROENES, PARDIES
64;AV DES TROENES, PARDIES
64;LOT BERGE, PARDIES PIETAT
64;LOT DES BARTHOTES, PARDIES PIETAT
64;LOT DE LANUSSE, PARDIES PIETAT
64;LOT L OREE DU BOIS, PARDIES PIETAT
64;IMP BARBE, PARDIES PIETAT
64;IMP DES BARTHES, PARDIES PIETAT
64;CHE DES BARTHES, PARDIES PIETAT
64;IMP LES BARTHOTES, PARDIES PIETAT
64;CHE DE BATCUZERE, PARDIES PIETAT
64;CHE DU BEDAT, PARDIES PIETAT
64;IMP DU BEDAT, PARDIES PIETAT
64;RUE DE BERGEROU, PARDIES PIETAT
64;CHE BONNECAZE, PARDIES PIETAT
64;RUE CAPDEBAT, PARDIES PIETAT
64;RUE CAPDESSUS, PARDIES PIETAT
64;CHE DE CARRIQUE, PARDIES PIETAT
64;RUE DARRE DEU CASTET, PARDIES PIETAT
64;RUE DARRE NOUGUES, PARDIES PIETAT
64;RUE DE L'EGLISE, PARDIES PIETAT
64;IMP DU GABIZOS, PARDIES PIETAT
64;IMP GASSEDAT, PARDIES PIETAT
64;IMP DU GEST, PARDIES PIETAT
64;CHE DE LA HOUN DE BREQUE, PARDIES PIETAT
64;CHE DE LABARTHE, PARDIES PIETAT
64;CHE DE LARROUNDADE, PARDIES PIETAT
64;RUE DU LAVOIR, PARDIES PIETAT
64;RUE MAUBEC, PARDIES PIETAT
64;RTE MAULEON A NAY, PARDIES PIETAT
64;IMP L OREE DU BOIS, PARDIES PIETAT
64;VOIE D OSSAU, PARDIES PIETAT
64;IMP D OSSAU, PARDIES PIETAT
64;CHE DU PETIT LUZ, PARDIES PIETAT
64;RTE DE PIETAT, PARDIES PIETAT
64;CHE DE LA PLAINE, PARDIES PIETAT
64;IMP DE LA PLAINE, PARDIES PIETAT
64;IMP DES PYRENEES, PARDIES PIETAT
64;IMP SAINT ANTOINE, PARDIES PIETAT
64;ALL DU SANCTUAIRE, PARDIES PIETAT
64;RUE DU TAILLEUR, PARDIES PIETAT
64;LOT ETCHEBIGAT, PAU
64;RES DE FRANCE, PAU
64;LOT BROUTIN, PAU
64;LOT INDUSNOR, PAU
64;LOT LOU CAZALA, PAU
64;LOT HAM DE L HIPPODROME, PAU
64;LOT DOM DES LILAS, PAU
64;LOT L ARRIOU, PAU
64;LOT MARIGAL, PAU
64;LOT LE BOUSCAT, PAU
64;LOT LA CHENAIE, PAU
64;LOT LE CLOS DES DRUIDES, PAU
64;LOT LE CLOS SAINT JACQUES, PAU
64;LOT LOU PRAT, PAU
64;LOT PUCHEU, PAU
64;LOT HAM INDUSNORD, PAU
64;LOT HAM LARRIBAUDIERE, PAU
64;LOT DOM DE TRESPOEY, PAU
64;LOT LES JARDINS DE NAVARRE, PAU
64;LOT LE CLOS ROUSSILLE, PAU
64;LOT LE CLOS DE MEON, PAU
64;CLOS HENRI IV, PAU
64;LOT PARC DE HAUTERIVE, PAU
64;LOT PARC DES LILAS, PAU
64;DOM DE SERS, PAU
64;LOT LE TURF, PAU
64;LOT VERTE VALLEE, PAU
64;LOT LES JARDINS DU BEARN, PAU
64;LOT LES JARDINS DU BON PASTEUR, PAU
