64;CHE D ARUNTZ, BIRIATOU
64;CHE DU CHATEAU D EAU, BIRIATOU
64;CHE DE CHOURIENBORDA, BIRIATOU
64;CHE DE COURLECOU, BIRIATOU
64;CHE EGUR-TTIKI, BIRIATOU
64;CHE ERRAMUNTEGUI, BIRIATOU
64;CHE DE LA FORET, BIRIATOU
64;CHE DE GARLATZ, BIRIATOU
64;CHE DE GAZTELU-ZAHAR, BIRIATOU
64;CHE DE GAZTAGNALDEA, BIRIATOU
64;CHE D HITOKIA, BIRIATOU
64;CHE D IPARAGUER, BIRIATOU
64;CHE LARRETCHEKOBORDA, BIRIATOU
64;CHE DE LIZARLAN, BIRIATOU
64;CHE DE MARITXU, BIRIATOU
64;CHE DE MARTINGOBAITA, BIRIATOU
64;CHE DE MARTINARONTZENIA, BIRIATOU
64;CHE DE MOULINTEGUI, BIRIATOU
64;CR DE ONDIBAR, BIRIATOU
64;CHE DE POSTENBORDA, BIRIATOU
64;CHE DE PREOTCHOBAITA, BIRIATOU
64;RTE RD 258, BIRIATOU
64;RTE RD 811, BIRIATOU
64;CHE DE L ANNEAU DU BOURG, BIRIATOU
64;CHE DE BAKEA, BIRIATOU
64;CHE DE BIDE HEGO-ALDE, BIRIATOU
64;CHE DU CHATEAU, BIRIATOU
64;CHE DE ONBORXILO, BIRIATOU
64;CHE DE ZALAPIO, BIRIATOU
64;LOT MISCHLER, BIRON
64;LOT DE LA PLAINE, BIRON
64;LOT HIA DE PERE, BIRON
64;LOT LAHITTETTE, BIRON
64;LOT LAS BARTHES, BIRON
64;ALL DE L'INNOVATION, BIRON
64;RUE DES AIGRETTES, BIRON
64;RTE DE BRASSALAY, BIRON
64;CHE DE CASTAGNA, BIRON
64;RUE DES CHEVREUILS, BIRON
64;RUE DES COLVERTS, BIRON
64;RUE DES COMMERCES, BIRON
64;RUE DES COURLIS, BIRON
64;CHE CRAMPOT, BIRON
64;CHE DE LA GRAVIERE, BIRON
64;CHE HIA DE PERE, BIRON
64;CHE LABARTETTE, BIRON
64;IMP LABIELLE, BIRON
64;CHE LABIELLE, BIRON
64;CHE LABORDE, BIRON
64;IMP LABORDE, BIRON
64;IMP LACAMPAGNE, BIRON
64;RUE LA CARRERE, BIRON
64;RUE LA CARRIBE, BIRON
64;RUE LAHITTETTE, BIRON
64;CHE LARROUYAT, BIRON
64;CHE LAS BARTHES, BIRON
64;ENC LAS COURREYES, BIRON
64;CHE LAVIGNE, BIRON
64;IMP LESCOURRE, BIRON
64;PL DES MARAIS, BIRON
64;CHE DU MOULIE, BIRON
64;CHE DU MOULIN, BIRON
64;IMP PATOCQ, BIRON
64;PAS PLAINE DES BOIS, BIRON
64;RUE DES PLUVIERS, BIRON
64;CHE DU POEY, BIRON
64;AUT 64 LA PYRENEENNE, BIRON
64;RPT DES PYRENEES, BIRON
64;CHE DE LA SALIGUE, BIRON
64;RUE DES SARCELLES, BIRON
64;IMP SOUPERNE, BIRON
64;CHE DE LA TEULERE, BIRON
64;CHE DU TOUYAA, BIRON
64;LOT BEAUSOLEIL, BIZANOS
64;CLOS CANTE L'OUSSE, BIZANOS
64;LOT CLOS DE L'ARRIU, BIZANOS
64;LOT LES COUSTE, BIZANOS
64;LOT DOMAINE DES 2 RIVES, BIZANOS
64;LOT LES FOUGERES, BIZANOS
64;LOT LE HONDAIS, BIZANOS
64;LOT LE HAMEAU, BIZANOS
64;LOT LAS PACHERES, BIZANOS
64;LOT LAGARDE, BIZANOS
64;LOT LES LAURIERES, BIZANOS
64;LOT LES LAVANDIERES, BIZANOS
64;LOT LOLIBE, BIZANOS
64;LOT CENTRE COMMERCIAL PARA, BIZANOS
64;LOT CLOS MAIBER, BIZANOS
64;LOT LE PARC SAINT ANDRE, BIZANOS
64;LOT PUCHEU PLANTE, BIZANOS
64;LOT PRAT, BIZANOS
64;LOT CLOS ST BENOIT, BIZANOS
64;LOT DOMAINE DE SANSARRICQ, BIZANOS
64;LOT CLOS SANSARRICQ, BIZANOS
64;LOT LES SAPINS, BIZANOS
64;LOT SQUARE BELLEVUE, BIZANOS
64;LOT DU STADE, BIZANOS
64;LOT TARDAN, BIZANOS
64;ZA ZONE D ACTIVITE DU PLATEAU, BIZANOS
64;LOT LE JARDIN LOUIS-ELISE, BIZANOS
64;LOT BIGOT, BIZANOS
64;AV DU BATAILLON DE JOINVILLE, BIZANOS
64;RUE ADRIEN CAMY PEYRET, BIZANOS
64;AV ALBERT 1ER, BIZANOS
64;AV ALFRED NOBEL, BIZANOS
64;RUE DE L'ANETO, BIZANOS
64;RUE DE L ARAGON, BIZANOS
64;RUE DE L ARRAYADE, BIZANOS
64;ALL DE L'ARRIU, BIZANOS
64;RUE D ASPIN, BIZANOS
64;RUE DE L'AUBISQUE, BIZANOS
64;ALL DES AUGAS, BIZANOS
64;RUE DE L'AVENIR, BIZANOS
64;BD DE L AVIATION, BIZANOS
64;RUE DU BALAITOUS, BIZANOS
64;AV DU BEARN, BIZANOS
64;AV BEAU SITE, BIZANOS
64;AV BEAU SOLEIL, BIZANOS
64;SQ BELLEVUE, BIZANOS
64;RUE BETH SOUREILH, BIZANOS
64;RUE DU BOIS, BIZANOS
64;IMP DU BOIS, BIZANOS
64;CHE DES CAMBETS, BIZANOS
64;ALL DES CAMBETS, BIZANOS
64;RUE DE LA CENDREE, BIZANOS
64;N 117, BIZANOS
64;ALL DES CERISIERS, BIZANOS
64;IMP DE LA CHATAIGNERAIE, BIZANOS
64;ALL DE LA CHENAIE, BIZANOS
64;AV DES CIMES, BIZANOS
64;BD DU CDT RENE MOUCHOTTE, BIZANOS
64;RUE DE LA CONCORDE, BIZANOS
64;ALL CONSTANCE BONACIEUX, BIZANOS
64;AV DU CORPS FRANC POMMIES, BIZANOS
64;CHE DE COURTIADE, BIZANOS
64;ALL DES DIGUES, BIZANOS
64;ALL DES EAUX VIVES, BIZANOS
64;ALL DES ERABLES, BIZANOS
64;AV DE L'EUROPE, BIZANOS
64;IMP DE LA FONTAINE, BIZANOS
64;ALL DES FOUGERES, BIZANOS
64;RUE DES FRERES COUSTE, BIZANOS
64;IMP GALLIENI, BIZANOS
64;AV DU STADE D'EAUX VIVES, BIZANOS
64;RUE GALLIENI, BIZANOS
64;PL GAMBETTA, BIZANOS
64;ALL DE GASCOGNE, BIZANOS
64;RUE DU GAVE, BIZANOS
64;PL GENERAL DE GAULLE, BIZANOS
64;RUE GEORGES CLEMENCEAU, BIZANOS
64;ALL DU HAMEAU, BIZANOS
64;ALL DU HEDAS, BIZANOS
64;CHE HENRI IV, BIZANOS
64;ALL DES HIRONDELLES, BIZANOS
64;ALL DE HONDAIS, BIZANOS
64;CHE DU HOURAT, BIZANOS
64;RUE DU HUIT MAI 1945, BIZANOS
64;RTE D IDRON, BIZANOS
64;RUE DU LABADIE, BIZANOS
64;ALL DU LABADIE, BIZANOS
64;CHE LABORDE, BIZANOS
64;RUE LAMARTINE, BIZANOS
64;PL DE LATTRE DE TASSIGNY, BIZANOS
64;CHE LARRIBAU, BIZANOS
64;RUE DES LAURIERES, BIZANOS
64;AV DES LAVANDIERES, BIZANOS
64;IMP DES LAVANDIERES, BIZANOS
64;CHE LA HIADERE, BIZANOS
64;AV LEON HEID, BIZANOS
64;RUE DE LA MAIRIE, BIZANOS
64;IMP MARECHAL FOCH, BIZANOS
64;RUE DU MARECHAL FOCH, BIZANOS
64;PL MARECHAL JOFFRE, BIZANOS
64;RUE MARECHAL LECLERC, BIZANOS
64;AV DE LA MARNE, BIZANOS
64;IMP DE LA MARNE, BIZANOS
64;IMP MATACHOT, BIZANOS
64;RUE DU MILLENAIRE, BIZANOS
64;RTE DE MORLAAS, BIZANOS
64;CLOS DE NAVARRE, BIZANOS
64;RUE OLIVIER MESSIAEN, BIZANOS
64;RUE D OSSAU, BIZANOS
64;ALL DE L OUSSE, BIZANOS
64;RUE DE L OUSSE, BIZANOS
64;RUE DU PANORAMA, BIZANOS
64;ALL DU PARK LODGE, BIZANOS
64;RUE PASTEUR, BIZANOS
64;RUE PASTEUR PROLONGEE, BIZANOS
64;RUE DU PIC DU MIDI, BIZANOS
64;ALL PIERRE DE RONSARD, BIZANOS
64;AV DES PYRENEES, BIZANOS
64;IMP RENE OLIVIER, BIZANOS
64;RUE RENE OLIVIER, BIZANOS
64;AV DE LA REPUBLIQUE, BIZANOS
64;RUE DES DEUX RIVES, BIZANOS
64;RUE ROBERT AGEST, BIZANOS
64;RUE SAINT BASIL'S, BIZANOS
64;CLOS SAINT BENOIT, BIZANOS
64;AV DE SAINT LEON, BIZANOS
64;ALL SANSARRICQ, BIZANOS
64;CLOS SANSARRICQ, BIZANOS
64;ALL DES SAPINS, BIZANOS
64;AV SORRENTO, BIZANOS
64;RUE DU STADE, BIZANOS
64;ALL SULLY, BIZANOS
64;RUE SULLY, BIZANOS
64;IMP DU TANAT, BIZANOS
64;RTE DE TARBES, BIZANOS
64;IMP DE VERDUN, BIZANOS
64;RUE DE VERDUN, BIZANOS
64;PL DE LA VICTOIRE, BIZANOS
64;RUE DE LA VICTOIRE, BIZANOS
64;RUE VICTOR HUGO, BIZANOS
64;CHE DES VIGNES, BIZANOS
64;AV DE L'YSER, BIZANOS
64;RUE DE L'YSER, BIZANOS
64;CLOS DES ADONIS, BOEIL BEZING
64;CLOS DES CAMELIAS, BOEIL BEZING
64;LOT LE BALAITOUS, BOEIL BEZING
64;LOT LE BEARN, BOEIL BEZING
64;LOT BERNATA, BOEIL BEZING
64;LOT LES CAPUCINES, BOEIL BEZING
64;CLOS CHRISTIAN CHICOTTE, BOEIL BEZING
64;LOT COUTURE, BOEIL BEZING
64;LOT DARRE LA GARE, BOEIL BEZING
64;LOT DOYA, BOEIL BEZING
64;LOT FOURGUETTE, BOEIL BEZING
64;LOT LE GABIZOS, BOEIL BEZING
64;CLOS DES JONQUILLES, BOEIL BEZING
64;LOT LARRIBEAU, BOEIL BEZING
64;CLOS DES MAGNOLIAS, BOEIL BEZING
64;CLOS DES MYOSOTIS, BOEIL BEZING
64;LOT DU PIC DU MIDI, BOEIL BEZING
64;LOT LES PLATANES, BOEIL BEZING
64;LOT LE PRE DU ROY, BOEIL BEZING
64;LOT ROUSSEAU, BOEIL BEZING
64;LOT LE VIGNEMALE, BOEIL BEZING
64;RUE D ANGAIS, BOEIL BEZING
64;RUE DU BALAITOUS, BOEIL BEZING
64;CHE CAMIN DE BANDA, BOEIL BEZING
64;RUE BASSE NAVARRE, BOEIL BEZING
64;RUE DE BAUDREIX, BOEIL BEZING
64;CHE DIT DE BEUSTE, BOEIL BEZING
64;RTE DE BEUSTE, BOEIL BEZING
64;RUE DU BOIS, BOEIL BEZING
64;CHE CAMIN DE LAS BORDES, BOEIL BEZING
64;CHEM DES CAMPANULES, BOEIL BEZING
64;IMP CAPSUS, BOEIL BEZING
64;RUE DES CAPUCINES, BOEIL BEZING
64;CHEM CAMIN DE CARDEDE, BOEIL BEZING
64;RUE DU CHATEAU, BOEIL BEZING
64;RUE DES COTEAUX, BOEIL BEZING
64;RUE JEAN DARTEZ, BOEIL BEZING
64;RUE DES JONQUILLES, BOEIL BEZING
64;RUE DE L EGLISE, BOEIL BEZING
64;RUE CARL EINSTEIN, BOEIL BEZING
64;CHE D EXPLOITATION N 15, BOEIL BEZING
64;VOIE DU LOT FOURGUETTE, BOEIL BEZING
64;RUE DU GABIZOS, BOEIL BEZING
64;RUE DE LA GARE BEZING ANGAIS, BOEIL BEZING
64;RUE DU GAVE, BOEIL BEZING
64;CHE DES GENTIANES, BOEIL BEZING
64;RUE DU HAMEAU, BOEIL BEZING
64;RUE HENRI IV, BOEIL BEZING
64;RUE LE LAGOIN, BOEIL BEZING
64;CHE DE LAGOS, BOEIL BEZING
64;VC DITE LATERALE, BOEIL BEZING
64;RUE LE LAVOIR, BOEIL BEZING
64;RUE DES LAURIERS, BOEIL BEZING
64;RUE DES LILAS, BOEIL BEZING
64;RUE DES MAGNOLIAS, BOEIL BEZING
64;RUE DU MARECHAL FERRANT, BOEIL BEZING
64;RUE DES MARGUERITES, BOEIL BEZING
64;CAMI DE MIGNOU, BOEIL BEZING
64;RUE DU MOULIN, BOEIL BEZING
64;CAMI DE NAY, BOEIL BEZING
64;RUE DE LA PASSERELLE, BOEIL BEZING
64;IMP DU PIC DU MIDI, BOEIL BEZING
64;RUE DU PIC DU MIDI, BOEIL BEZING
64;VOIE DU LOT DU PIC DU MIDI, BOEIL BEZING
64;IMP DE LA PLAINE, BOEIL BEZING
64;CHEM CAMIN PONSAA, BOEIL BEZING
64;RUE DU PONT DE PIERRE, BOEIL BEZING
64;RUE DES PRAIRIES, BOEIL BEZING
64;RUE DES PYRENEES, BOEIL BEZING
64;IMP D'AU REY, BOEIL BEZING
64;VOIE DU LOT ROUSSEAU, BOEIL BEZING
64;CHEM CAMIN DE SANTIAGO, BOEIL BEZING
64;RUE DU TEMPLE, BOEIL BEZING
64;RUE DES TROIS FERMES, BOEIL BEZING
64;RUE DES TULIPES, BOEIL BEZING
64;CHEM DES SILOS, BOEIL BEZING
64;IMP DE LA VALLEE D OSSAU, BOEIL BEZING
64;CHE D AGARRAMENDI, BONLOC
64;CHE DU BOIS D IBARRIA, BONLOC
64;CHE DE LA FORGE, BONLOC
64;CHE DE GELARITEGIA, BONLOC
64;CHE DE HARANEA, BONLOC
64;CHE D INTXAURMENDI, BONLOC
64;CHE DE MENDIA, BONLOC
64;CHE DE MIZPIRA, BONLOC
64;CHE DU MOULIN, BONLOC
64;CHE DE SERORATEGIA, BONLOC
64;CHE DE LA TANNERIE, BONLOC
64;CHE DE XIMUNENEA, BONLOC
64;CHE D ELIZABEHEREA, BONLOC
64;CHE D IBARREA, BONLOC
64;CHE D UHALDEA, BONLOC
64;CHE DE BOLATEKO ERREKA, BONLOC
64;CHE D URBEROA, BONLOC
64;CHE DE GANBURRIA, BONLOC
64;CHE DE KORNUENEA, BONLOC
64;CHE DE LA JOYEUSE, BONLOC
64;CHE DE LA VIGNE, BONLOC
64;CHE DE MENDILARREA, BONLOC
64;CHE DE MENTABERRIA, BONLOC
64;CHE DE XETRETEGIA, BONLOC
64;CHE DU PRESBYTERE, BONLOC
64;IMP DE CHENES, BONLOC
64;PL DU FRONTON, BONLOC
64;RTE D AYHERRE, BONLOC
64;RTE D ETXEPAREA, BONLOC
64;RTE DE HASPARREN, BONLOC
64;RTE DE MENDIONDE, BONLOC
64;RTE DE SAINT ESTEBEN, BONLOC
64;RUE DE L EGLISE, BONLOC
64;RTE D'AMOU, BONNUT
64;RTE D'ARSAGUE, BONNUT
64;VC DE BARADE, BONNUT
64;CHE DE BAROU, BONNUT
64;CHE DE BOUHUDE, BONNUT
64;RTE DU BOURG, BONNUT
64;VC DE CABOILLES, BONNUT
64;CHE DE CAZAOUS, BONNUT
64;CHE DE COURNE, BONNUT
64;CHE DE COUSTASSE, BONNUT
64;VC DE CREPOU, BONNUT
64;VC DARRE LOU BOURG, BONNUT
64;VC DE DROUILHE, BONNUT
64;CHE DE GABARRA, BONNUT
64;CHE DE GAUCH, BONNUT
64;CHE DE GAYOU, BONNUT
64;VC DE LABARTHE, BONNUT
64;VC DE LACOSTE, BONNUT
64;VC DE LACROUTS, BONNUT
64;CHE DE LAGIERE, BONNUT
64;CHE DE LAHOUN, BONNUT
64;CHE DE LALANNE, BONNUT
64;CHE DE LALOTGE, BONNUT
64;CHE DE LAMAGNA, BONNUT
64;RTE DES LANDES, BONNUT
64;CHE DE LANESCOU, BONNUT
64;CHE DE MANES, BONNUT
64;VC DE MARCADIOU, BONNUT
64;CHE DE MAYSOU, BONNUT
64;VC DE MENAUT, BONNUT
64;CHE DE MOUNTARGOU, BONNUT
64;RTE D'ORTHEZ, BONNUT
64;CHE DE PEDEBOSCQ, BONNUT
64;CHE DE PELETACH, BONNUT
64;CHE DE POUNDICQ, BONNUT
64;VC DE RANQUINE, BONNUT
64;VC DE LA REDOUTE, BONNUT
64;RTE DE SAINT BOES, BONNUT
64;CHE DE SAINTE MARIE, BONNUT
64;VC DE THEN, BONNUT
64;VC DE YERTOU, BONNUT
64;LOT DE BELONCE, BORCE
64;PIST DES ATEIX, BORCE
64;RTE D'AUBISE, BORCE
64;RTE D'AYRIRE, BORCE
64;RTE DU BARALET, BORCE
64;PAS BARAT D'ARROS, BORCE
64;RTE DE BELONCE, BORCE
64;RTE DU BERAT DU BAS, BORCE
64;RTE DU BERAT DU HAUT, BORCE
64;CHE DE BERGEROT, BORCE
64;PIST DU BIALA, BORCE
64;CHE DE BOUSSOUM, BORCE
64;RTE DE CAMBETS, BORCE
64;CHE DU CAMP D'ATHOOS, BORCE
64;CHE DE CARRALOT, BORCE
64;RUE DE LA CARRERE, BORCE
64;IMP CLAIR MATIN, BORCE
64;IMP COMPLEXE SPORTIF, BORCE
64;CHE DARRE LASSIERE, BORCE
64;PIST DETS CLOUTETS, BORCE
64;RTE DE L'EGLISE, BORCE
64;RTE FORESTIERE D'ESPELUNGUERE, BORCE
64;RTE DE GARE DES FORGES D'ABEL, BORCE
64;CHE DE LAMOTHE, BORCE
64;PIST DE LAYERS, BORCE
64;RTE DE MARRASSAA, BORCE
64;VOIE DE LA MATELE, BORCE
64;CHE DE LA MOULE, BORCE
64;RTE N134 E7, BORCE
64;CHE SABATERE, BORCE
64;RTE DE SAINT LAURENT, BORCE
64;CHE DE SAYERCE, BORCE
64;RTE DU THEZY, BORCE
64;CHE DU TROUN DE GOURYETTE, BORCE
64;LOT ARMONT, BORDERES
64;LOT BUZY SIMON, BORDERES
64;LOT DE L EGLISE, BORDERES
64;LOT CAPBAT, BORDERES
64;LOT DE L EPEAUTRE, BORDERES
64;LOT LE GABIZOS, BORDERES
64;LOT LACROUTS, BORDERES
64;LOT LE MILIEU, BORDERES
64;LOT LE MOULIN, BORDERES
64;LOT PIBOURRET, BORDERES
64;LOT POUTS, BORDERES
64;LOT DE LA PLAINE, BORDERES
64;LOT LES PYRENEES 2, BORDERES
64;LOT LES PYRENEES 3, BORDERES
64;LOT TECLINE, BORDERES
64;LOT LE SOULOR, BORDERES
64;LOT SUZETTE, BORDERES
64;LOT VIGNAU LOUSTAU, BORDERES
64;LOT CLAIRIERE DES IRIS, BORDERES
64;LOT LES PALOMBES, BORDERES
64;CHE DES ARTIGOTS, BORDERES
64;RUE DES ARTIGOTTES, BORDERES
64;IMP LAS BATS, BORDERES
64;RUE DU BOIS, BORDERES
64;IMP DU BUSQUET, BORDERES
64;IMP CAPBAT, BORDERES
64;RUE DE CAPBAT, BORDERES
64;IMP DE LA FABRIQUE, BORDERES
64;RUE HOUN DE LA MOULE, BORDERES
64;IMP DU LAGOIN, BORDERES
64;PL DE LA MAIRIE, BORDERES
64;CHE DU MEUNIER, BORDERES
64;CHE DU MILIEU, BORDERES
64;RTE DE  MIREPEIX, BORDERES
64;RUE DE LA MOULE, BORDERES
64;RUE DES MOULINS, BORDERES
64;RUE DE NAY, BORDERES
64;RUE PESQUITOU, BORDERES
64;RUE DU PIC D'OSSAU, BORDERES
64;CHE DE LA PLAINE, BORDERES
64;RUE DU PRE DU ROY, BORDERES
64;IMP PRE DU ROY, BORDERES
64;IMP DES PYRENEES, BORDERES
64;RUE TRAVERSIERE, BORDERES
64;RUE TREBESSE, BORDERES
64;RUE DU VIGNEMALE, BORDERES
64;LOT DES AGUDES, BORDES
64;LOT LE BALAITOUS, BORDES
64;LOT BELLA VISTA, BORDES
64;LOT DU BOIS, BORDES
64;LOT CLOS DES CAMELIAS, BORDES
64;LOT DU CENTRE 2, BORDES
64;LOT LES AZALEES, BORDES
64;LOT CAP O SUD, BORDES
64;ZA PARC ACTIVITE CLEMENT ADER, BORDES
64;ZA CLEMENT ADER II, BORDES
64;LOT LE CLOS HENRI IV, BORDES
64;LOT DOMAINE DES PRAIRIES I, BORDES
64;LOT DOMAINE DES PRAIRIES II, BORDES
64;CLOS DE L ENTRE DEUX, BORDES
64;LOT LANNETTE VERGEZ, BORDES
64;LOT LAS ARTIGAS IV, BORDES
64;LOT DOMENJOLLE JOSEPH, BORDES
64;LOT LE GABIZOS, BORDES
64;LOT CAMBEILH, BORDES
64;LOT DES GRANGES, BORDES
64;LOT LEOPOLD, BORDES
64;LOT DE L OSSAU, BORDES
64;LOT CLOS DES JONQUILLES, BORDES
64;LOT PIC DU LURIEN, BORDES
64;LOT DES 3B, BORDES
64;LOT LOTISSEMENT DU MONTAIGU, BORDES
64;LOT DU VISCOS, BORDES
64;RUE DE L'AERODROME, BORDES
64;RUE DES AGUDAS, BORDES
64;RUE ALIENOR D'AQUITAINE, BORDES
64;IMP ALIENOR D AQUITAINE, BORDES
64;CAMI DE LAS ARTIGAS, BORDES
64;RUE DE L'ARTOUSTE, BORDES
64;IMP D' ASPIN, BORDES
64;RUE D'ASPIN, BORDES
64;RUE DE L'AUBISQUE, BORDES
64;RUE DU BALAITOUS, BORDES
64;RUE DU BANIU, BORDES
64;CAMI DEUS BARTHOTS, BORDES
64;AV DU BEARN, BORDES
64;IMP BELLEVUE, BORDES
64;IMP D AYOUS, BORDES
64;RUE BERNADOTTE, BORDES
64;CHE DE BERNES, BORDES
64;CHE DE BEZING, BORDES
64;IMP DE LA BIGORRE, BORDES
64;AV DE LA BIGORRE, BORDES
64;RUE DU BOIS, BORDES
64;RUE DU CABALIROS, BORDES
64;IMP CAP-SUS, BORDES
64;IMP DU CASTERAR, BORDES
64;RUE DU CASTERAR, BORDES
64;IMP DES CHATAIGNERAIES, BORDES
64;RUE CLEMENT ADER, BORDES
64;CAMI DARRE  MIRASSOU, BORDES
64;RUE DE L'EGALITE, BORDES
64;PL DE L'EGLISE, BORDES
64;IMP DE L'ESTIBETTE, BORDES
64;RUE DU FER A CHEVAL, BORDES
64;RUE FREDERIC MISTRAL, BORDES
64;RUE DES FRERES WRIGHT, BORDES
64;RUE DU GABIZOS, BORDES
64;AV DE GASCOGNE, BORDES
64;AV GASTON FEBUS, BORDES
64;RUE DU GAVARRES, BORDES
64;IMP DU GAVARRES, BORDES
64;RUE DU GAVE, BORDES
64;RUE DES GRANGES, BORDES
64;RUE HENRI IV, BORDES
64;RUE DE LA HONT DE LABAT, BORDES
64;RUE D IRATY, BORDES
64;RUE JACQUELINE AURIOL, BORDES
64;IMP JEAN LANNETTE, BORDES
64;PL JEAN NOUGUES, BORDES
64;RUE JEANNE D'ALBRET, BORDES
64;AV JOSEPH SZYDLOWSKI, BORDES
64;CHE LATERAL, BORDES
64;RUE DE LOURDES, BORDES
64;RUE DU MARCOT, BORDES
64;RUE MARGUERITE DE NAVARRE, BORDES
64;RUE MARYSE BASTIE, BORDES
64;RUE MERILLON, BORDES
64;RUE DU MONT, BORDES
64;IMP MOURA, BORDES
64;RUE DE L OSSAU, BORDES
64;RUE PASTEUR, BORDES
64;RUE DU PIC DU GER, BORDES
64;RUE PIERRE LATECOERE, BORDES
64;RUE DU PIC D ANEOU, BORDES
64;RUE DU PIC D ANIE, BORDES
64;RUE DU PIC D ANSABERE, BORDES
64;RUE DU PIC DE NEOUVIELLE, BORDES
64;RUE DU PIC D ARLAS, BORDES
64;RUE DU PIC DE SESQUES, BORDES
64;RUE DU PIC D ORHY, BORDES
64;RUE DU PIC D ANETO, BORDES
64;ALL DU PIC DES TAILLADES, BORDES
64;RUE DU PIC DU LURIEN, BORDES
64;RUE DE LA PLAINE, BORDES
64;RUE DES PRAIRIES, BORDES
64;CAMI DEUS PRATS, BORDES
64;RUE DU PRE DU ROI, BORDES
64;RUE DES PYRENEES, BORDES
64;RUE DE LA REPUBLIQUE, BORDES
64;RUE SIMIN PALAY, BORDES
64;RUE SONIA METON, BORDES
64;RUE DU STADE, BORDES
64;IMP DU STADE, BORDES
64;IMP SULLY, BORDES
64;RUE TURBOMECA, BORDES
64;LOT DE LA FONTAINE, BOSDARROS
64;LOT CLOS DE LABOURYE, BOSDARROS
64;QUA NARBOUT, BOSDARROS
64;QUA DU NEEZ, BOSDARROS
64;QUA DES PINDATS, BOSDARROS
64;LOT LES PYRENEES, BOSDARROS
64;LOT TREBESSOT, BOSDARROS
64;QUA DU VIEUX MOULIN, BOSDARROS
64;ALL DES ALBIZIAS, BOSDARROS
64;CHE DE BARBE, BOSDARROS
64;CHE DE BENACQ, BOSDARROS
64;CHE DE LA BILA, BOSDARROS
64;CHE DU BOIS, BOSDARROS
64;CHE DE BRUGES, BOSDARROS
64;CHE DE CAZET, BOSDARROS
64;ALL DES ECUREUILS, BOSDARROS
64;ALL DES ERABLES, BOSDARROS
64;CHE JAMBLANC, BOSDARROS
64;RTE DE GAN, BOSDARROS
64;CHE DE HAUT, BOSDARROS
64;CHE DE LABAU, BOSDARROS
64;CHE LABINDALESTE, BOSDARROS
64;CHE LARROUDE, BOSDARROS
64;CHE LESQUERRE, BOSDARROS
64;RUE MAUBEC, BOSDARROS
64;CHE MAUBEC, BOSDARROS
64;CHE DU MERCE, BOSDARROS
64;IMP NADAU, BOSDARROS
64;RTE DE NAY, BOSDARROS
64;CHE D'OSSAU, BOSDARROS
64;CHE DE PEES, BOSDARROS
64;CHE PEHOURTICQ, BOSDARROS
64;IMP PEHOURTICQ, BOSDARROS
64;RUE PIERRE BIDAU, BOSDARROS
64;RTE DE PIETAT, BOSDARROS
64;IMP DES PINDATS, BOSDARROS
64;RTE DES PINDATS, BOSDARROS
64;CHE DE PRIM, BOSDARROS
64;CHE RAPATOUT, BOSDARROS
64;CHE DE REBENACQ, BOSDARROS
64;RTE DE REBENACQ, BOSDARROS
64;COTE DU REY, BOSDARROS
64;RTE DE RONTIGNON, BOSDARROS
64;CHE DE SAINTE COLOME, BOSDARROS
64;CHE SERROT, BOSDARROS
64;CHE DE TREBESSOT, BOSDARROS
64;CHE DU VIEUX MOULIN, BOSDARROS
64;RTE DU VILLAGE, BOSDARROS
64;LOT LES ARTIGAUX, BOUCAU
64;LOT LE VIGO, BOUCAU
64;LOT L AVENIR, BOUCAU
64;LOT CAMPET, BOUCAU
64;LOT CAZAURAN, BOUCAU
64;LOT DARRIBE ROUGE, BOUCAU
64;LOT DOUS QUOUATES, BOUCAU
64;HLM HUREOUS, BOUCAU
64;LOT DU HUREOUS, BOUCAU
64;LOT IBORRA, BOUCAU
64;LOT LAVIGNE, BOUCAU
64;LOT DE MATIGNON, BOUCAU
64;LOT DE MONTESPAN, BOUCAU
64;LOT MOTUT, BOUCAU
64;LOT PASTOU, BOUCAU
64;LOT DE PETCHOU, BOUCAU
64;LOT PETIT DUBOIS, BOUCAU
64;LOT PETIT-MONT, BOUCAU
64;LOT LA PINEDE, BOUCAU
64;RES PICHEPAOU, BOUCAU
64;LOT DES QUATRE VENTS, BOUCAU
64;LOT DU ROND POINT, BOUCAU
64;LOT LE VAL DES PRES, BOUCAU
64;LOT LES VIGNES, BOUCAU
64;HLM DE VIGO, BOUCAU
64;LOT CHARMILOU, BOUCAU
64;CHE DE FER BORDEAUX IRUN, BOUCAU
64;RUIS DE COUSTE, BOUCAU
64;RUIS DU HUREOUS, BOUCAU
64;RUIS DE LISSONDE, BOUCAU
64;RUIS DU MOULIN, BOUCAU
64;ALL DES ACACIAS, BOUCAU
64;RPT SALVADOR ALLENDE, BOUCAU
64;IMP DES ALTHEAS, BOUCAU
64;RUE ANDRE DUBOY, BOUCAU
64;IMP ALBERT CAMUS, BOUCAU
64;RUE DE L ABATTOIR, BOUCAU
64;PAS D ANTHIO, BOUCAU
64;IMP DES ALBIZZIAS, BOUCAU
64;ALL DE L APOLLO, BOUCAU
64;ALL DE L AVENIR, BOUCAU
64;QUAI DE L ADOUR, BOUCAU
64;RUE ALBERT MORA, BOUCAU
64;ALL DES ALOUETTES, BOUCAU
64;ALL DES ARBOUSIERS, BOUCAU
64;RUE DE L AQUILON, BOUCAU
64;RUE DES BAINS DOUCHES, BOUCAU
64;ALL DES ARTIGAUTS, BOUCAU
64;CHE D AOUTS TAILHATS, BOUCAU
64;CHE DU PETIT ARREY, BOUCAU
64;CHE DU PETIT AREY, BOUCAU
64;RUE LUCIE AUBRAC, BOUCAU
64;ALL DE L AYGAS, BOUCAU
64;ALL AUGUSTE RENOIR, BOUCAU
64;IMP DES BAMBOUS, BOUCAU
64;RUE DU BARTHASSOT, BOUCAU
64;IMP DU BARTHASSOT, BOUCAU
64;QUAI DU BAZE, BOUCAU
64;ALL DU PARC BELLEVUE, BOUCAU
64;IMP BELLEVUE, BOUCAU
64;RUE BELLEVUE, BOUCAU
64;IMP J. BERGERES, BOUCAU
64;ALL DU BELVEDERE, BOUCAU
64;CHE DE BERNADIC, BOUCAU
64;IMP DES BOSQUETS, BOUCAU
64;ALL DU BOUCHONNIER, BOUCAU
64;ALL BOTANIQUE, BOUCAU
64;ALL DU BROCQ, BOUCAU
64;CHE BROUSSUSSE, BOUCAU
64;CHE DE CAMBRAC, BOUCAU
64;CHE DES CAMELIAS, BOUCAU
64;IMP DES CAMELIAS, BOUCAU
64;IMP CAMPET, BOUCAU
64;CHE DU CANAL, BOUCAU
64;RUE DE CANDITTE, BOUCAU
64;IMP DES CANARIS, BOUCAU
64;ALL DES CERISIERS, BOUCAU
64;ALL DES CHAMPS, BOUCAU
64;RUE DES CHASSEURS, BOUCAU
64;CHE DU CHATEAU MATIGNON, BOUCAU
64;ALL DE CHARMILOU, BOUCAU
64;IMP CHATEAUBRIAND, BOUCAU
64;ALL DE MATIGNON, BOUCAU
64;AV CHAPELLE DES FORGES, BOUCAU
64;ALL DES CHATAIGNIERS, BOUCAU
64;IMP DU CHATEAU D EAU, BOUCAU
64;ALL DES CHENES LIEGES, BOUCAU
64;ALL DES CHENES, BOUCAU
64;RUE DE LA CITE, BOUCAU
64;IMP CHIC A CHIC, BOUCAU
64;IMP DU COLONEL FABIEN, BOUCAU
64;PL DU COLONEL FABIEN, BOUCAU
64;ALL DES COTEAUX, BOUCAU
64;ALL LA CROIX, BOUCAU
64;IMP DES CYPRES, BOUCAU
64;CHE DELAUR, BOUCAU
64;RUE DU 19 MARS 1962, BOUCAU
64;QUAI DE LA DOUANE, BOUCAU
64;CHE DUBOY, BOUCAU
64;RUE JOSEPH DUPRAT, BOUCAU
64;CHE DE L ECOLE, BOUCAU
64;ALL DES ECUREUILS, BOUCAU
64;PL J.B ELICHONDO, BOUCAU
64;IMP DE L EGLISE, BOUCAU
64;ALL DES EMBRUNS, BOUCAU
64;ALL DES ESQUIROUS, BOUCAU
64;RUE DE LA FABRIQUE, BOUCAU
64;IMP DE LA FABRIQUE, BOUCAU
64;IMP LA FONT DU PIN, BOUCAU
64;RUE ETIENNE LANDABOURE, BOUCAU
64;AV LOUIS DE FOIX, BOUCAU
64;IMP DES FUSAINS, BOUCAU
64;ALL DE LA FONTAINE, BOUCAU
64;AV JULES FERRY, BOUCAU
64;ALL DES FOUGERES, BOUCAU
64;RUE DE LA GARE, BOUCAU
64;CHE DE LA GARGALE, BOUCAU
64;AV CHARLES DE GAULLE, BOUCAU
64;RUE DES GEMMEURS, BOUCAU
64;RUE DE LA GENDARMERIE, BOUCAU
64;IMP DES GENETS, BOUCAU
64;RUE GEORGES LASSALLE, BOUCAU
64;RUE GEORGES POLITZER, BOUCAU
64;CHE DE GRASINCAOU, BOUCAU
64;CHE DE  HAOUCAS, BOUCAU
64;RUE HENRI GARCIA, BOUCAU
64;ALL DES HETRES, BOUCAU
64;IMP DE HONTEYRES, BOUCAU
64;PAS DE HONTEYRES, BOUCAU
64;IMP DES HORTENSIAS, BOUCAU
64;ALL DU MOULIN DE HUREOUS, BOUCAU
64;IMP IENA, BOUCAU
64;IMP JACQUES PREVERT, BOUCAU
64;RUE DES JARDINS, BOUCAU
64;RUE JEAN MOULIN, BOUCAU
64;IMP J B BATAILLE, BOUCAU
64;RUE JEAN BAPTISTE CASTAINGS, BOUCAU
64;IMP JEAN BAPTISTE CASTAINGS, BOUCAU
64;RUE J P THIMBAUD, BOUCAU
64;CHE DE JOUANDIC, BOUCAU
64;IMP LABOUYRIE, BOUCAU
64;RUE JOSEPH ST ANDRE, BOUCAU
64;RUE PIERRE LACOUTURE, BOUCAU
64;ALL DE LA FONTAINE, BOUCAU
64;CHE DE LABOULITTE, BOUCAU
64;ALL DE LAHILLADE, BOUCAU
64;CHE DE LA CLAOU, BOUCAU
64;IMP ROGER LAJOUANE, BOUCAU
64;ALL DES LAURIERS, BOUCAU
64;PAS GUY LAVIGNASSE, BOUCAU
64;ALL DU GRAND LARTIGUE, BOUCAU
64;ALL ABBE ARMAND LEGRAND, BOUCAU
64;IMP LE PROYE, BOUCAU
64;ALL DES LIEGES, BOUCAU
64;RUE LOUIS ARAGON, BOUCAU
64;CHE DE LOUSTAOU, BOUCAU
64;IMP DE LOUSTAOU, BOUCAU
64;CHE DE LISSONDE, BOUCAU
64;IMP DES LILAS, BOUCAU
64;CHE DE LOBIT, BOUCAU
64;ALL PIERRE LOUSSE, BOUCAU
64;IMP AUGUSTE MAGES, BOUCAU
64;SQ DU 8 MAI 1945, BOUCAU
64;RPT CLAUDIUS MAGNIN, BOUCAU
64;IMP DES MAGNOLIAS, BOUCAU
64;IMP MARLADOT, BOUCAU
64;RPT MARGUERITE DURAS, BOUCAU
64;RUE DE MATIGNON, BOUCAU
64;RUE MAURICE PERSE, BOUCAU
64;SQ MAX DORMOY, BOUCAU
64;IMP DES MERISIERS, BOUCAU
64;ALL DES MESANGES, BOUCAU
64;IMP CLOS MILLET, BOUCAU
64;RUE DES MIMOSAS, BOUCAU
64;CHE DU PETIT MONT, BOUCAU
64;TRA DE MONTESPAN, BOUCAU
64;RUE DE MONTESPAN, BOUCAU
64;CHE MONTESTRUC, BOUCAU
64;RUE DE MONTILLA, BOUCAU
64;CHE LA GARGALE DE MONTESTRUCQ, BOUCAU
64;CHE MOULIN D ESBOUCQ, BOUCAU
64;ALL DE MOUSSEROLLES, BOUCAU
64;IMP MOUSTACHE, BOUCAU
64;ALL DES MURIERS, BOUCAU
64;RTE NATIONALE 10, BOUCAU
64;IMP DES OLIVIERS, BOUCAU
64;RUE DU ONZE NOVEMBRE, BOUCAU
64;RUE DE L'OREE DU BOIS, BOUCAU
64;CHE DE PACHIOU, BOUCAU
64;SQ PABLO NERUDA, BOUCAU
64;RUE DU CHANOINE JEAN PAMBRUN, BOUCAU
64;IMP PALEUTES, BOUCAU
64;RUE PABLO PICASSO, BOUCAU
64;IMP DES PALMIERS, BOUCAU
64;RUE DU PASTOU, BOUCAU
64;RUE PAUL BARSALERE, BOUCAU
64;RUE PAUL BIREMONT, BOUCAU
64;RUE PAUL CAZAURANG, BOUCAU
64;IMP PAUL ELUARD, BOUCAU
64;CHE DE PECLAIR, BOUCAU
64;PL MANOLO PEREZ, BOUCAU
64;PL GABRIEL PERI, BOUCAU
64;IMP PERY, BOUCAU
64;ALL DU PETCHOS, BOUCAU
64;CHE DU PETCHOU, BOUCAU
64;ALL DU PETCHOU, BOUCAU
64;ALL DU PETIT DUBOY, BOUCAU
64;ALL DU PETIT LARTIGUE, BOUCAU
64;IMP DU PETIT NANOT, BOUCAU
64;RUE DU PETIT NANOT, BOUCAU
64;ALL DE PICHEPAOU, BOUCAU
64;IMP DES PIGNES, BOUCAU
64;PAS DES PINSONS, BOUCAU
64;ALL DES PINS, BOUCAU
64;RUE DE LA PINEDE, BOUCAU
64;IMP PIERRE LESGOURGUES, BOUCAU
64;COTE DU PITARRE, BOUCAU
64;CHEM DU PITARRE, BOUCAU
64;IMP DU PITARRE, BOUCAU
64;IMP PIQUESSARY, BOUCAU
64;ALL DES PLATANES, BOUCAU
64;CHE DU PONT NEUF, BOUCAU
64;RUE DU PORT, BOUCAU
64;PORT DE LA CALE, BOUCAU
64;ALL DES POTIERS, BOUCAU
64;RUE DE LA POSTE, BOUCAU
64;PAS DE LA POSTE, BOUCAU
64;PL DE LA POSTE, BOUCAU
64;RUE DES PYRENEES, BOUCAU
64;ALL DOUS QUOUATES, BOUCAU
64;RUE DES QUATRE VENTS, BOUCAU
64;RUE RAOUL BRAMARIE, BOUCAU
64;RUE RAYMOND ET MARCEL GLIZE, BOUCAU
64;RUE RENE DUVERT, BOUCAU
64;ALL ROLAND BIERGE, BOUCAU
64;RUE DE ROMATET, BOUCAU
64;ALL DU ROND POINT, BOUCAU
64;RPT DE LACLAU, BOUCAU
64;RPT DES JARDINS, BOUCAU
64;ALL DES ROSIERS, BOUCAU
64;ALL DE LA SABLERE, BOUCAU
64;CHE DE SABOUA, BOUCAU
64;VC PNT SAINT BERNARD, BOUCAU
64;QUAI SAINT BERNARD, BOUCAU
64;RUE SAINT CHARLES, BOUCAU
64;RUE SAINT GOBAIN, BOUCAU
64;QUAI DE SAINT GOBAIN, BOUCAU
64;CHE DE SAINT - GOBAIN, BOUCAU
64;TRA DE SAINT - GOBAIN, BOUCAU
64;ALL GEORGE SAND, BOUCAU
64;ALL DES SAULES, BOUCAU
64;RUE HUBERT SANZ, BOUCAU
64;IMP DU STADE, BOUCAU
64;CHE DE LA SCIERIE, BOUCAU
64;PL PIERRE SEMARD, BOUCAU
64;RUE SEVERIN LATAPPY, BOUCAU
64;ALL SIMONE DE BEAUVOIR, BOUCAU
64;RUE DES SOURCES, BOUCAU
64;IMP DES TAMARIS, BOUCAU
64;CHE DE TAILHAT, BOUCAU
64;IMP LES TERRASSES DE L ADOUR, BOUCAU
64;IMP JEAN PIERRE THIMBAUD, BOUCAU
64;RUE ALBERT THOMAS, BOUCAU
64;IMP DES THUYAS, BOUCAU
64;ALL DES TILLEULS, BOUCAU
64;CHE DES TORILLATS, BOUCAU
64;CHE DE LA TOUR, BOUCAU
64;IMP DES TOURTERELLES, BOUCAU
64;CHE DE TRAVERSE, BOUCAU
64;RUE ELSA TRIOLLET, BOUCAU
64;SQ DU TROSSOAT, BOUCAU
64;RUE DE LA PETITE TUILERIE, BOUCAU
64;ALL DU VAL DES PRES, BOUCAU
64;ALL DU VALLON, BOUCAU
64;RUE VICTOR HUGO, BOUCAU
64;ALL DES VIGNES, BOUCAU
64;IMP DES AMANDIERS, BOUCAU
64;IMP DES AZALEES, BOUCAU
64;IMP BAROUMES, BOUCAU
64;IMP BASCAZAUX, BOUCAU
64;IMP BEAULIEU, BOUCAU
64;CHE DU BOIS GUILHOU, BOUCAU
64;IMP DES CHEVREUILS, BOUCAU
64;CHE DE CHINE, BOUCAU
64;ALL DE LA CLAIRIERE DU NANOT, BOUCAU
64;CHE DES CYPRES CHAUVES, BOUCAU
64;BD JACQUES DUCLOS, BOUCAU
64;IMP DE LA FAIENCE, BOUCAU
64;IMP DE L'HERMITAGE, BOUCAU
64;IMP JACQUOTTES, BOUCAU
64;CHE DE LA LEBE, BOUCAU
64;IMP DES MERLES, BOUCAU
64;IMP ALFRED DE MUSSET, BOUCAU
64;IMP PECLERE, BOUCAU
64;CHE DU PEY, BOUCAU
64;PAS DES RIVES DE L'ADOUR, BOUCAU
64;IMP DES SITTELLES, BOUCAU
64;IMP PAUL VERLAINE, BOUCAU
64;IMP DES CRESSONNIERES, BOUCAU
64;ALL LE TUC, BOUCAU
64;ALL DU VAL DES BOIS, BOUCAU
64;IMP DES PIBALES, BOUCAU
