64;RUE DE L EGLISE, LACARRE
64;CHE DE LA CARRIERE, LACARRE
64;CHE DE LOHIGORRIA, LACARRE
64;RTE DE SAINT-JEAN-PIED-DE-PORT, LACARRE
64;CHE DE MUNOA, LACARRE
64;RTE DE SAINT-PALAIS, LACARRE
64;RUE DU CHATEAU, LACARRE
64;RUE DU CIMETIERE, LACARRE
64;CHE DE MENDIZOLA, LACARRE
64;LOT DU MARLAT, LACOMMANDE
64;CHE BALENGOU, LACOMMANDE
64;CHE BARROT, LACOMMANDE
64;RUE DU BEARN, LACOMMANDE
64;CHE BERNATOUSE, LACOMMANDE
64;CHE BROUQUA, LACOMMANDE
64;RTE DE LA COMMANDERIE, LACOMMANDE
64;RUE DE L EGLISE, LACOMMANDE
64;CHE LABOURDENNE, LACOMMANDE
64;RTE DE LASSEUBE, LACOMMANDE
64;IMP DU MARLAT, LACOMMANDE
64;RTE DE MONEIN, LACOMMANDE
64;CHE DE PELEGRY, LACOMMANDE
64;PAS DES PELERINS, LACOMMANDE
64;CHE DU PONT D AS, LACOMMANDE
64;CHE DES PYRENEES, LACOMMANDE
64;CHE DE SAINT JACQUES, LACOMMANDE
64;CHE SAINT PAUL, LACOMMANDE
64;CHE DES VIGNES, LACOMMANDE
64;LOT DU BIALE, LACQ
64;LOT INDUSLACQ, LACQ
64;LOT MARIAU, LACQ
64;CHE DE L'AGLE, LACQ
64;COTE DE L AROUET, LACQ
64;RTE D AUDEJOS, LACQ
64;CHE DE BALLAGUE, LACQ
64;CHE DE LAS BAQUES, LACQ
64;CHE BIRECANTOU, LACQ
64;CHE DU BOIS, LACQ
64;CHE DU BOIS D HERM, LACQ
64;CHE DE BOUE, LACQ
64;CHE DE LA CABANE AU LOUP, LACQ
64;RTE DE CAGNES, LACQ
64;CHE DU CAP DOU BOSC, LACQ
64;CHE CATALOGNE, LACQ
64;IMP CHONNEAUX, LACQ
64;ALL LE CORBUSIER, LACQ
64;CHE DU COUSTIN, LACQ
64;CHE DE LA CROIX, LACQ
64;CHE DES DEMOISELLES, LACQ
64;CHE DEPARTEMENTAL NO 31, LACQ
64;CHE DEPARTEMENTAL NO 263, LACQ
64;CHE DE L'EGLISE, LACQ
64;CHE DE LA FONTAINE, LACQ
64;CHE DE GUILHARE, LACQ
64;CHE DE GUIROT, LACQ
64;RTE D HERM, LACQ
64;CHE JOUANHAU, LACQ
64;RTE DE LACQ, LACQ
64;CHE LANTUEJOULS, LACQ
64;CHE DES LAVOIRS, LACQ
64;CHE DE MANUGUET, LACQ
64;CHE DE MARIAU, LACQ
64;CHE DE MONTANER, LACQ
64;CHE DU MOULIN, LACQ
64;RTE DEPARTEMENTALE 817, LACQ
64;CHE DE PANACAU, LACQ
64;PL DU PARVIS DE L HISTOIRE, LACQ
64;CHE DE PEYROULAT, LACQ
64;CHE DE PICOT, LACQ
64;CHE DE LA PIERRE SAINT-FAUST, LACQ
64;AUT 64 LA PYRENEENNE, LACQ
64;CHE SAINTE GERMAINE, LACQ
64;CHE DE SAMADET, LACQ
64;IMP DE SANT QUINTI, LACQ
64;PL SANT QUINTI, LACQ
64;RTE DE SAUTIE, LACQ
64;CHE DE TERRES NABES, LACQ
64;RTE DES TORCHES, LACQ
64;IMP DU TREFLE, LACQ
64;IMP DES VIGNES, LACQ
64;LOT DE LA COLLINE, LAGOR
64;RTE D ABIDOS, LAGOR
64;RUE DES ACACIAS, LAGOR
64;ALL DES ANEMONES, LAGOR
64;CHE D ARIET, LAGOR
64;CHE ARRIBERE, LAGOR
64;CHE BACQUE LOUSTAU, LAGOR
64;CHE BALAYE, LAGOR
64;CHE BALEN, LAGOR
64;CHE BAZANS, LAGOR
64;CHE BELLEVUE, LAGOR
64;CHE BENZY, LAGOR
64;CHE BERLI, LAGOR
64;CHE BERNADET, LAGOR
64;CHE BERTRAND LUCHETTIA, LAGOR
64;IMP DES BLEUETS, LAGOR
64;CHE BODENNEC, LAGOR
64;CHE BOY LASSABLERE, LAGOR
64;CHE BROUCA MARCASUZAA, LAGOR
64;IMP DES CAMELIAS, LAGOR
64;CHE CAMES, LAGOR
64;RUE DES CEDRES, LAGOR
64;CHE DE CETTE, LAGOR
64;CHE CHITOU, LAGOR
64;CHE CHOUC VIGUIER, LAGOR
64;CHE DE LA COLLINE, LAGOR
64;IMP DES COQUELICOTS, LAGOR
64;RTE DES CRETES, LAGOR
64;CHE CROHARE, LAGOR
64;PL DU 19 MARS 1962, LAGOR
64;CHE DUFAU, LAGOR
64;RUE DES ECOLES, LAGOR
64;CHE DES ECUREUILS, LAGOR
64;IMP DES EGLANTINES, LAGOR
64;CHE ENDRIMONS, LAGOR
64;CHE DU GAVE, LAGOR
64;RUE DES GLYCINES, LAGOR
64;ALL DES JONQUILLES, LAGOR
64;CHE LACOUME, LAGOR
64;RTE DE LAGOR, LAGOR
64;CHE LATAPY, LAGOR
64;RUE DES LAURIERS, LAGOR
64;RTE LENDOSTE, LAGOR
64;RUE DES LILAS, LAGOR
64;CHE LONNE, LAGOR
64;CHE LUCBEREILH, LAGOR
64;IMP DES LYS, LAGOR
64;RTE DE MASLACQ, LAGOR
64;CHE MESPLEDE, LAGOR
64;RUE DES MIMOSAS, LAGOR
64;CHE MIRASSOU, LAGOR
64;CHE DU MOULIN, LAGOR
64;RTE DE MOURENX, LAGOR
64;CHE PEDEGNEIN, LAGOR
64;PL DE LA POSTE, LAGOR
64;IMP DES PRES, LAGOR
64;ALL DES PRIMEVERES, LAGOR
64;RUE PRINCIPALE, LAGOR
64;IMP DES ROSIERS, LAGOR
64;CHE DES RUCHES, LAGOR
64;CHE SABATTE, LAGOR
64;CHE SAINT MARTIN, LAGOR
64;CHE SAUBADE, LAGOR
64;RTE DE SAUVELADE, LAGOR
64;RTE DES SONDES, LAGOR
64;CHE DU STADE, LAGOR
64;CHE TAUZY, LAGOR
64;CHE TERRE ROUY, LAGOR
64;IMP DES TULIPES, LAGOR
64;RTE DE VIELLESEGURE, LAGOR
64;CHE DES VIGNES, LAGOR
64;LOT ARAGNOUS, LAGOS
64;LOT LE GABIZOS, LAGOS
64;LOT PEYRELONGUE, LAGOS
64;LOT DES PYRENEES, LAGOS
64;LOT TREMES, LAGOS
64;LOT VOISIN, LAGOS
64;RUE DES ARAGNOUS, LAGOS
64;RUE DU BOIS, LAGOS
64;IMP DU CAMP DE CROUTX, LAGOS
64;IMP DES CAROLINS, LAGOS
64;RUE CARREROT, LAGOS
64;RUE CEYREZATS, LAGOS
64;CHE DE L ECLUSE, LAGOS
64;RUE DE L EGLISE, LAGOS
64;IMP DU GABIZOS, LAGOS
64;RUE DU LAGOIN, LAGOS
64;RTE DE MIREPEIX, LAGOS
64;RUE DU MOULIN, LAGOS
64;RTE DE NAY, LAGOS
64;CHE PEYRELONGUE, LAGOS
64;IMP PEYRELONGUE, LAGOS
64;AV DU PIC DU MIDI, LAGOS
64;RUE DU PONT VIEUX, LAGOS
64;IMP DU POURTALET, LAGOS
64;IMP DES PRES, LAGOS
64;IMP DES PYRENEES, LAGOS
64;RUE DU SOULOR, LAGOS
64;RES ADIXKIDEREKIN, LAHONCE
64;LOT OYHANTO, LAHONCE
64;LOT URDE BASA, LAHONCE
64;LOT DU BOIS DE LA VIERGE, LAHONCE
64;LOT IRIGOIN, LAHONCE
64;LOT ROMATET, LAHONCE
64;LOT LANDABOURE, LAHONCE
64;LOT ORDOQUY, LAHONCE
64;LOT L OREE DU BOIS, LAHONCE
64;LOT BIELLA, LAHONCE
64;RES ERDIKO EGOITZA II, LAHONCE
64;LOT LES VERGERS II, LAHONCE
64;LOT BIDEGAIN, LAHONCE
64;LOT ETCHELECOU, LAHONCE
64;LOT NAHIA, LAHONCE
64;LOT HAMEAU DE ZAZARTA, LAHONCE
64;RUE DE L'ABBAYE, LAHONCE
64;AV DE L'ABBAYE, LAHONCE
64;CHE DE L AIGUETTE, LAHONCE
64;CHE ARROCA, LAHONCE
64;CHE BARANDEGUY, LAHONCE
64;CHE DES BARTHES, LAHONCE
64;RTE DE BRISCOUS, LAHONCE
64;PL DE L ECOLE, LAHONCE
64;CHE DU CIMETIERE, LAHONCE
64;CHE D ETCHECHOURY, LAHONCE
64;CLOS DORIA DOREA, LAHONCE
64;CHE ELISSALDIA, LAHONCE
64;VC N 11 DITE DE LA FONTAINE, LAHONCE
64;CHE IBARBIDE, LAHONCE
64;CHE D INCAHOLA, LAHONCE
64;CHEM DE KURRUTZ, LAHONCE
64;CHE LAHARRAGUE, LAHONCE
64;CHE LANDABOURE, LAHONCE
64;CHE DE LEKU EDER, LAHONCE
64;CHE MENDIBIL, LAHONCE
64;CHE PEDEGAIN, LAHONCE
64;CHE RECART, LAHONCE
64;CHE SALLABERRY, LAHONCE
64;RTE D URCUIT, LAHONCE
64;RTE DE L'ADOUR, LAHONCE
64;ALL AGUERRE, LAHONCE
64;ALL DES ALBIZIAS, LAHONCE
64;RUE DE L'ANCIENNE ECOLE, LAHONCE
64;CHE D'ARGELAS, LAHONCE
64;IMP ARTECH, LAHONCE
64;CHE ARTIGAUX, LAHONCE
64;IMP BARANDEGUY, LAHONCE
64;RTE DES BARTHES, LAHONCE
64;RUE BERGE, LAHONCE
64;IMP BIELLA, LAHONCE
64;CHE BIROUETA, LAHONCE
64;ALL BIZI BERRIA, LAHONCE
64;RUE DU BOIS DE LA VIERGE, LAHONCE
64;ALL DES CARRIERES, LAHONCE
64;CHE DE LA CHAPELLE, LAHONCE
64;ALL DES CHENES, LAHONCE
64;IMP CHIC A CHIC, LAHONCE
64;RUE CONDISTEGUY, LAHONCE
64;CHE CONSTANTIN, LAHONCE
64;ALL DU COUVENT, LAHONCE
64;ALL DOREA, LAHONCE
64;ALL DE L'ECOLE, LAHONCE
64;CHE ELISSALDE, LAHONCE
64;CHE ELIZALDIA, LAHONCE
64;IMP ETCHELECU, LAHONCE
64;ALL ERDIKO EGOITZA, LAHONCE
64;CHE ETCHECHOURY, LAHONCE
64;IMP ETCHELECOU, LAHONCE
64;RUE ETCHELECOU, LAHONCE
64;CHE ETCHOYHAN, LAHONCE
64;RUE DE LA FONTAINE, LAHONCE
64;ALL DU FOUR A CHAUX, LAHONCE
64;ALL DES FRENES, LAHONCE
64;RUE GAILLAT, LAHONCE
64;RTE DE LA GARE, LAHONCE
64;ALL HAITZALDEAN, LAHONCE
64;RUE DU HAMEAU DOREA, LAHONCE
64;ALL HARAN, LAHONCE
64;CHE HARRIAGUE, LAHONCE
64;ALL HASTOY, LAHONCE
64;ALL HIRIBERRY, LAHONCE
64;IMP IBARBOURE, LAHONCE
64;IMP IBARRARTEA, LAHONCE
64;CHEM DE L'ILE, LAHONCE
64;IMP IMBIDIA, LAHONCE
64;ALL INCAHOL, LAHONCE
64;ALL IRIGOIN, LAHONCE
64;CHE ISTIART, LAHONCE
64;ALL KANTALDI, LAHONCE
64;CHE KURUTZ, LAHONCE
64;CHE DU LAC ARBEOU, LAHONCE
64;PL LOUIS LAFFARGUE, LAHONCE
64;CHE LANABERE, LAHONCE
64;RUE LANES, LAHONCE
64;IMP LARRAMENDY, LAHONCE
64;CHE LARREBOURE, LAHONCE
64;IMP DE LA FORET, LAHONCE
64;IMP LAU ETXEAK, LAHONCE
64;CHE LAXALDE, LAHONCE
64;ALL LECOUEDER, LAHONCE
64;ALL DES LILAS, LAHONCE
64;ALL DES MAGNOLIAS, LAHONCE
64;RUE MAYZOUNAVE, LAHONCE
64;RUE MENDIXKA, LAHONCE
64;CHE MENTA, LAHONCE
64;CHE MENTABERRY, LAHONCE
64;ALL DES MIMOSAS, LAHONCE
64;RTE DE MOUGUERRE, LAHONCE
64;IMP NACAY, LAHONCE
64;CHE NAHIA, LAHONCE
64;CHE NAPAS, LAHONCE
64;ALL DE L'OREE DU BOIS, LAHONCE
64;CHE OSPIAS, LAHONCE
64;CHE OTHAQUY, LAHONCE
64;RUE OYHANTO, LAHONCE
64;IMP PEDEGAIN, LAHONCE
64;ALL DU PETIT BOIS, LAHONCE
64;CHE PILAS, LAHONCE
64;ALL DES PINS, LAHONCE
64;CHE PLACEOU, LAHONCE
64;ALL DES POMMIERS, LAHONCE
64;CHE PONTA, LAHONCE
64;CHE POUTON, LAHONCE
64;CHE POUYANNE, LAHONCE
64;RUE DU PRESSOIR, LAHONCE
64;ALL PRINTANIA, LAHONCE
64;RTE RECART, LAHONCE
64;IMP RECART, LAHONCE
64;CHE DU RESERVOIR D'EAU, LAHONCE
64;ALL ROMATET, LAHONCE
64;CHE DU RUISSEAU ARTECH, LAHONCE
64;CHE SABALET, LAHONCE
64;RTE SALLABERRY, LAHONCE
64;CHE SAUBADRET, LAHONCE
64;ALL DE LA TREILLE, LAHONCE
64;CHE URDE BASA, LAHONCE
64;CHE VENELLE, LAHONCE
64;ALL DES VERGERS, LAHONCE
64;ALL DES VERGNES, LAHONCE
64;RUE DES VIGNES, LAHONCE
64;ALL ZAZARTA, LAHONCE
64;LOT ARRIOU D ABET, LAHONTAN
64;LOT DEU BASQUE, LAHONTAN
64;RTE D ABET, LAHONTAN
64;ALL DES ACACIAS, LAHONTAN
64;CHE D ARNAUBAIGT, LAHONTAN
64;CHE DE BALESTE, LAHONTAN
64;ALL DEU BASQUE, LAHONTAN
64;RTE DE BELLOCQ, LAHONTAN
64;RUE DU BOIS, LAHONTAN
64;RTE DE CARRESSE, LAHONTAN
64;RTE DE COSTELONGUE, LAHONTAN
64;RUE DU COUD DE PEYRET, LAHONTAN
64;ALL CROUTS DE PEYRE, LAHONTAN
64;CHE DE DARRE AUX BARATS, LAHONTAN
64;PL DE L EGLISE, LAHONTAN
64;RUE DU GAVE, LAHONTAN
64;RTE DE HABAS, LAHONTAN
64;IMP JEAN MAYE, LAHONTAN
64;RTE DE LABIGALETTE, LAHONTAN
64;RUE DE LARREGOUDE, LAHONTAN
64;CHE DE LENDEMADINE, LAHONTAN
64;RTE DE LENDEMADINE, LAHONTAN
64;CHE DE LESCA, LAHONTAN
64;PL DE LA MAIRIE, LAHONTAN
64;RUE DE LA MAIRIE, LAHONTAN
64;CHE DE MARPOUYOO, LAHONTAN
64;CHE DU PASSAGE, LAHONTAN
64;CHE DU PAVILLON, LAHONTAN
64;CHE DE PEDAMOUS, LAHONTAN
64;ALL PLEIN CHAMPS, LAHONTAN
64;CHE DE POEYDEBASQUE, LAHONTAN
64;CHE DU PORT DE PEYRE, LAHONTAN
64;CHE DE RAUZEDE, LAHONTAN
64;CHE DE LA RIBERE BASSE, LAHONTAN
64;RTE DE SAINT CRICQ, LAHONTAN
64;RTE DE SERRE CAUTE, LAHONTAN
64;CHE DOUS TILHS, LAHONTAN
64;QUA BERBA, LAHOURCADE
64;LOT COMMUNAL LE CASTEROT, LAHOURCADE
64;QUA LARGELISE, LAHOURCADE
64;QUA LASSABAIGT, LAHOURCADE
64;QUA MANOS, LAHOURCADE
64;LOT HAURAT, LAHOURCADE
64;CHE DE BAGNAT, LAHOURCADE
64;CHE DE BARBE, LAHOURCADE
64;CHE DE BARRERE, LAHOURCADE
64;CHE DE BENEBEN, LAHOURCADE
64;CHE DE BERBA, LAHOURCADE
64;CHE DE BERNEDE, LAHOURCADE
64;CHE DU BOIS, LAHOURCADE
64;CHE DE CAPDEPONT, LAHOURCADE
64;RTE DE CARDESSE, LAHOURCADE
64;CHE DE CASABONNE, LAHOURCADE
64;CHE DE CASTEROT, LAHOURCADE
64;D 110 HAUTS LAHOURCADE, LAHOURCADE
64;CHE DE CHIQUET, LAHOURCADE
64;PL DE L'EGLISE, LAHOURCADE
64;CHE DE GASTON, LAHOURCADE
64;CHE DU GROUPE SCOLAIRE, LAHOURCADE
64;CHE DE HAURAT, LAHOURCADE
64;CHE DE HOO, LAHOURCADE
64;CHE DE LACOUME, LAHOURCADE
64;CHE DE LAFFITTE, LAHOURCADE
64;CHE DE LAHITTE, LAHOURCADE
64;CHE DE LALANNE, LAHOURCADE
64;IMP LARGELISE, LAHOURCADE
64;CHE DE LIHOUR, LAHOURCADE
64;CHE DE LUCQ DE BEARN, LAHOURCADE
64;RTE DE LUCQ DE BEARN, LAHOURCADE
64;CHE DU LUZOUE, LAHOURCADE
64;CHE DE MALEGARIE, LAHOURCADE
64;CHE DE MAUBECQ, LAHOURCADE
64;RTE DE MONEIN, LAHOURCADE
64;IMP MOULIA MANOS, LAHOURCADE
64;RTE DE MOURENX, LAHOURCADE
64;CHE DE NAUDE, LAHOURCADE
64;RTE DE NAVARRENX, LAHOURCADE
64;RTE DE NOGUERES, LAHOURCADE
64;CHE DE PEDESERGOS, LAHOURCADE
64;CHE DE PEMOULIE/ LASSABAIGT, LAHOURCADE
64;CHE DE POURTAU, LAHOURCADE
64;CHE DE SICABAIGT, LAHOURCADE
64;CHE DE SUBERBIE, LAHOURCADE
64;CHE DE VERGEZ, LAHOURCADE
64;CHE DE TROUILHET, LAHOURCADE
64;CHE DE TUYA, LAHOURCADE
64;RTE DE VIELLESEGURE, LAHOURCADE
64;RTE DE BUROSSE, LALONGUE
64;CHE DE CABE, LALONGUE
64;CHE DES CASSOULETS, LALONGUE
64;CHE DE CULAY, LALONGUE
64;RTE DE GAYON, LALONGUE
64;CHE DU HAYET, LALONGUE
64;CHE DE HOURCET, LALONGUE
64;COTE DE LANNECAUBE, LALONGUE
64;CHE DE LARRIBERETTE, LALONGUE
64;CHE DU LAVOIR, LALONGUE
64;COTE DE LAYANE, LALONGUE
64;CHE DE LOUINE, LALONGUE
64;CHE DE LUSSON, LALONGUE
64;COTE DE MARTY, LALONGUE
64;RTE DE MEILLAC, LALONGUE
64;CHE DE MENYETTE, LALONGUE
64;CHE DE MILHET, LALONGUE
64;CHE DE MONCAUBET, LALONGUE
64;COTE DE NABERES, LALONGUE
64;CHE PENOUGUE, LALONGUE
64;RTE DE SIMACOURBE, LALONGUE
64;RTE DE VIALER, LALONGUE
64;LOT MONCLA, LALONQUETTE
64;LOT LES TAUZIAS, LALONQUETTE
64;CHE DE L'ANCIEN PRESBYTERE, LALONQUETTE
64;CHE BARAT, LALONQUETTE
64;CHE BERUCQ, LALONQUETTE
64;RTE DE BORDEAUX, LALONQUETTE
64;CHE BORDENAVE, LALONQUETTE
64;CHE CASSOURET, LALONQUETTE
64;CHE DE LA CROIX, LALONQUETTE
64;PL DE L'EGLISE, LALONQUETTE
64;RTE DE L'EGLISE, LALONQUETTE
64;CHE DU GABAS, LALONQUETTE
64;RTE DE GARLEDE, LALONQUETTE
64;CHE LABARRERE, LALONQUETTE
64;RTE DE LANUSSE, LALONQUETTE
64;CHE LARIOU, LALONQUETTE
64;CHE LARRIBERE, LALONQUETTE
64;COTE DE LAUGA, LALONQUETTE
64;PL DE LA MAIRIE, LALONQUETTE
64;COTE DE MENICHE, LALONQUETTE
64;IMP MONCLA, LALONQUETTE
64;CHE MONCLA, LALONQUETTE
64;CHE DU TAUZIA, LALONQUETTE
64;IMP DU TAUZIA, LALONQUETTE
64;RTE DE THEZE, LALONQUETTE
64;CHE TISNE, LALONQUETTE
64;CHE DE L'ANGELIQUE, LAMAYOU
64;COTE DE BARES, LAMAYOU
64;CHE BAYARD, LAMAYOU
64;CHE DE BEZIAU, LAMAYOU
64;CHE DES BOSQUETS, LAMAYOU
64;CHE DE CABARRE, LAMAYOU
64;RTE DE CAIXON, LAMAYOU
64;CHE DE CANDAUS, LAMAYOU
64;CHE DE CASTEIDE, LAMAYOU
64;RTE DE CASTERA, LAMAYOU
64;CHE DE CASTERAT, LAMAYOU
64;CHE DU CAYROU, LAMAYOU
64;CHE DES CERISATES, LAMAYOU
64;CHE DE LA CHAPELLE, LAMAYOU
64;CHE DES CHASSEURS, LAMAYOU
64;CHE DU CHENE, LAMAYOU
64;CHE CHISNE, LAMAYOU
64;CHE DE LA CHOUROTTE, LAMAYOU
64;CHE DU COUPE FEU, LAMAYOU
64;RTE DEPARTEMENTALE 7, LAMAYOU
64;RTE DEPARTEMENTALE 202, LAMAYOU
64;RTE DEPARTEMENTALE 407, LAMAYOU
64;CHE DE L'EGLISE, LAMAYOU
64;CHE DE GARANAU, LAMAYOU
64;CHE GENTIEU, LAMAYOU
64;CHE DE LA JUSTICE, LAMAYOU
64;CHE DE LABATUT, LAMAYOU
64;CHE DE LACCARRERE, LAMAYOU
64;CHE LAFONTA, LAMAYOU
64;CHE DE LANNOTTE, LAMAYOU
64;CHE DE LARRIBERE, LAMAYOU
64;CHE DE LASPLASSES, LAMAYOU
64;CHE DE LEMBEYE, LAMAYOU
64;CHE DE LA MAIRIE, LAMAYOU
64;RTE DES MARGALIDES, LAMAYOU
64;CHE DE MARIET, LAMAYOU
64;CHE DE MONGASTON, LAMAYOU
64;RTE DE PAU, LAMAYOU
64;CHE DE PEY, LAMAYOU
64;CHE DE PEYRAUBE, LAMAYOU
64;RTE DE PONTIACQ, LAMAYOU
64;CHE DE ROUGE, LAMAYOU
64;CHE DE SAMONZER, LAMAYOU
64;CHE DE SAMONZET, LAMAYOU
64;CHE DE LA SARRETTE, LAMAYOU
64;CHE DE SEREE, LAMAYOU
64;CHE DE LA SOUTZEDE, LAMAYOU
64;CHE DE TAUZIA, LAMAYOU
64;CHE TIRADIS DE CAPBAT, LAMAYOU
64;CHE DE TOUTET, LAMAYOU
64;CHE DE TRENOU, LAMAYOU
64;CHE DE VIELLEPINTE, LAMAYOU
64;CHE VIGNAU, LAMAYOU
64;QUA DE BARLANES, LANNE EN BARETOUS
64;LOT DU BONELOU, LANNE EN BARETOUS
64;LOT LA PASTORALE, LANNE EN BARETOUS
64;LOT SABARRE 2, LANNE EN BARETOUS
64;CHE AICOBERRY, LANNE EN BARETOUS
64;CHE ARGUIBELLE, LANNE EN BARETOUS
64;CHE AROSTEGUY, LANNE EN BARETOUS
64;CHE AUGUSTINE, LANNE EN BARETOUS
64;CHE AYDAPUS, LANNE EN BARETOUS
64;CHE AYDUCQ, LANNE EN BARETOUS
64;CHE BARATS, LANNE EN BARETOUS
64;RTE DE BARCUS, LANNE EN BARETOUS
64;RTE DE BARLANES, LANNE EN BARETOUS
64;CHE DU MOULIN DU BAS, LANNE EN BARETOUS
64;CHE /COL DE BAST, LANNE EN BARETOUS
64;CHE BAST, LANNE EN BARETOUS
64;CHE DE LA BERGERIE, LANNE EN BARETOUS
64;CHE BERNAT, LANNE EN BARETOUS
64;CHE BOUCAU, LANNE EN BARETOUS
64;CHE BOUELOU, LANNE EN BARETOUS
64;CHE BROUCA, LANNE EN BARETOUS
64;CHE CACAILLOU, LANNE EN BARETOUS
64;CHE CALANGUET, LANNE EN BARETOUS
64;CHE CAMBOT, LANNE EN BARETOUS
64;CHE LA CANDALOTTE, LANNE EN BARETOUS
64;CHE CARASSOU, LANNE EN BARETOUS
64;CHE /CARRERE, LANNE EN BARETOUS
64;CHE CASABONE, LANNE EN BARETOUS
64;CHE CASAUX, LANNE EN BARETOUS
64;CHE CASTAGNE, LANNE EN BARETOUS
64;IMP DU CHATEAU, LANNE EN BARETOUS
64;CHE /CHIN, LANNE EN BARETOUS
64;CHE CHOY, LANNE EN BARETOUS
64;CHE CICAUBE, LANNE EN BARETOUS
64;CHE COUSTIE, LANNE EN BARETOUS
64;CHE DU COL D EDRE, LANNE EN BARETOUS
64;CHE DE L EGLISE, LANNE EN BARETOUS
64;CHE ESCARY, LANNE EN BARETOUS
64;CHE ESPARTITE, LANNE EN BARETOUS
64;CHE GABARTE, LANNE EN BARETOUS
64;CHE DOMECQ DE HAUT, LANNE EN BARETOUS
64;CHE HIADEDERA, LANNE EN BARETOUS
64;CHE HOUNDATE, LANNE EN BARETOUS
64;RTE D ISSARBE, LANNE EN BARETOUS
64;CHE LABAIGT, LANNE EN BARETOUS
64;CHE LACOUME, LANNE EN BARETOUS
64;CHE LAGRUE, LANNE EN BARETOUS
64;CHE LAGURNE, LANNE EN BARETOUS
64;CHE LARDIEG, LANNE EN BARETOUS
64;CHE LARROUY, LANNE EN BARETOUS
64;CHE LARTIGUE, LANNE EN BARETOUS
64;CHE LERIDE, LANNE EN BARETOUS
64;CHE LOUBET, LANNE EN BARETOUS
64;CHE DE LA MARTINIQUE, LANNE EN BARETOUS
64;RUE MATACHOT, LANNE EN BARETOUS
64;CHE MAUNAS, LANNE EN BARETOUS
64;CHE MENDIONDO, LANNE EN BARETOUS
64;CHE MIRANDE, LANNE EN BARETOUS
64;CHE MIRASSOU, LANNE EN BARETOUS
64;CHE MONTEBIDO, LANNE EN BARETOUS
64;CHE NINOU, LANNE EN BARETOUS
64;CHE NOUQUE, LANNE EN BARETOUS
64;CHE ORIERIE, LANNE EN BARETOUS
64;CHE PACHEU, LANNE EN BARETOUS
64;CHE DES PALOMBIERES, LANNE EN BARETOUS
64;CHE LA PAPETERIE, LANNE EN BARETOUS
64;RUE DE LA PASTORALE, LANNE EN BARETOUS
64;CHE PLASENCE, LANNE EN BARETOUS
64;RUE DES PYRENEES, LANNE EN BARETOUS
64;CHE REGEN, LANNE EN BARETOUS
64;CHE DU RELAIS, LANNE EN BARETOUS
64;CHE ROUY, LANNE EN BARETOUS
64;CHE SAGOUSPE, LANNE EN BARETOUS
64;CHE SALLEFRANQUE, LANNE EN BARETOUS
64;CHE SERGU, LANNE EN BARETOUS
64;CHE SERILLERE, LANNE EN BARETOUS
64;CHE TABAY, LANNE EN BARETOUS
64;CHE TALOU, LANNE EN BARETOUS
64;RTE DE TARDETS, LANNE EN BARETOUS
64;RUE DU TRAM, LANNE EN BARETOUS
64;CHE TUCOO, LANNE EN BARETOUS
64;ALL BERDIER, LANNECAUBE
64;CHE DE BIGORRE, LANNECAUBE
64;CHE BOURGUINAT, LANNECAUBE
64;COTE DU CASSOU, LANNECAUBE
64;CHE DE CASTAGNET, LANNECAUBE
64;CHE DES CASSOULETS, LANNECAUBE
64;CHE DE CAZALEZ, LANNECAUBE
64;RTE DE COSLEDAA, LANNECAUBE
64;CHE DAUGAS, LANNECAUBE
64;CHE DERIDET, LANNECAUBE
64;CHE DE L ECOLE, LANNECAUBE
64;CHE DE L EGLISE, LANNECAUBE
64;CHE D ESLOUS, LANNECAUBE
64;RTE DE GARLIN, LANNECAUBE
64;CHE GUILHEM, LANNECAUBE
64;CHE HAYET, LANNECAUBE
64;CHE LABURTHE, LANNECAUBE
64;COTE DE LALONGUE, LANNECAUBE
64;CHE DE LASSERRE, LANNECAUBE
64;CHE DE LICOS, LANNECAUBE
64;COTE DE LOUMAGNE, LANNECAUBE
64;CHE DU LOUP, LANNECAUBE
64;COTE DE MEILLAC, LANNECAUBE
64;CHE MENDOUSSE, LANNECAUBE
64;COTE DE MENDOUSSE, LANNECAUBE
64;RTE DE MONASSUT, LANNECAUBE
64;CHE PELES, LANNECAUBE
64;CHE PLAA, LANNECAUBE
64;CHE RIBEHART, LANNECAUBE
64;CHE ROCA, LANNECAUBE
64;CHE SOUBIROU, LANNECAUBE
64;CHE DE L ARRIOU DE LABASSE, LANNEPLAA
64;ALL BARAILLOT, LANNEPLAA
64;CHE DU BEDAT, LANNEPLAA
64;CHE DE BERDUCQ, LANNEPLAA
64;CHE DU BOSCQ, LANNEPLAA
64;CHE DE BOUNOBRE, LANNEPLAA
64;RUE DU BOURG, LANNEPLAA
64;ALL DE CAMBRAN, LANNEPLAA
64;CHE CAMDEBORDE, LANNEPLAA
64;CHE CASSIAOU, LANNEPLAA
64;ALL DES CHATAIGNIERS, LANNEPLAA
64;ALL DE CHERIAN, LANNEPLAA
64;ALL DE CLAYRAC, LANNEPLAA
64;CHE DE COUYET, LANNEPLAA
64;CHE DES CRETES, LANNEPLAA
64;CHE DES ECOLIERS, LANNEPLAA
64;PL DE L'EGLISE, LANNEPLAA
64;CHE DE GARLEPE, LANNEPLAA
64;CHE DE GOEYTES, LANNEPLAA
64;CHE DE LABIELLE, LANNEPLAA
64;CHE DE LACABANNE, LANNEPLAA
64;CHE DE MATHUS, LANNEPLAA
64;CHE DU MOULIN DE CANDAU, LANNEPLAA
64;CHE DES NOISETIERS, LANNEPLAA
64;ALL PEYROULOU, LANNEPLAA
64;ALL DE PONDICQ, LANNEPLAA
64;ALL DE POUNDIC, LANNEPLAA
64;ALL DE POURRERE, LANNEPLAA
64;ALL DES PROMENEURS, LANNEPLAA
64;RTE DES PYRENEES, LANNEPLAA
64;CHE DE RIBANTOU, LANNEPLAA
64;CHE DU ROY, LANNEPLAA
64;CHE DE SAINT JACQUES, LANNEPLAA
64;RTE DE SAINTE SUZANNE, LANNEPLAA
64;RTE DE SAUVETERRE, LANNEPLAA
64;ALL DE SERYENS, LANNEPLAA
64;CHE DE LA SOURCE DE GRECHEZ, LANNEPLAA
64;RTE DU TUS, LANNEPLAA
64;CHE D AGERREA, LANTABAT
64;CHE D ARHANTZETA, LANTABAT
64;CHE D ARROZBIDEA, LANTABAT
64;CHE D ARZUBIA, LANTABAT
64;CHE D AZKONGAINEA, LANTABAT
64;CHE D ELGARTIA, LANTABAT
64;CHE D ERRECARTIA, LANTABAT
64;CHE D ERREKALDIA, LANTABAT
64;CHE D ESPONDA, LANTABAT
64;CHE D ETCHARTIA, LANTABAT
64;CHE D ETXARNEBORDA, LANTABAT
64;CHE D ETXEBERRIKOBORDA, LANTABAT
64;CHE D ETXEBESTIA, LANTABAT
64;CHE D ETXEGOINIA, LANTABAT
64;CHE D ETXEXURIA, LANTABAT
64;CHE D INTSUSARRIA, LANTABAT
64;CHE D INTXANBORDA, LANTABAT
64;CHE D ITHURBURIA, LANTABAT
64;CHE D OLHABERRIA, LANTABAT
64;CHE D BEHAMENDIA, LANTABAT
64;CHE DE BEHAUNE, LANTABAT
64;CHE DE BORDATIA, LANTABAT
64;CHE DE DENDALETXIA, LANTABAT
64;CHE DE DONAPETRIA, LANTABAT
64;CHE DE GAZTELUZAHAR, LANTABAT
64;CHE DE GOYENETXEA, LANTABAT
64;CHE DE HARRIBELTZA, LANTABAT
64;CHE DE KUKUBERRI, LANTABAT
64;CHE DE KURUTZALDIA, LANTABAT
64;CHE DE LANDAIA, LANTABAT
64;CHE DE LANDAXOKO, LANTABAT
64;CHE DE LANDETXEBERRIA, LANTABAT
64;CHE DE LARRALDIA, LANTABAT
64;CHE DE MENDIONDOA, LANTABAT
64;CHE DE MUNHOA, LANTABAT
64;CHE DE PAGADOIA, LANTABAT
64;CHE DE PERPINA, LANTABAT
64;CHE DE SAINT ETIENNE, LANTABAT
64;CHE DE SAINT MARTIN, LANTABAT
64;CHE DE SEPURIA, LANTABAT
64;CHE DE ZAPATENDEIA, LANTABAT
64;CHE DU COL DES AUBEPINES, LANTABAT
64;PL BEHAUNE, LANTABAT
64;RTE D ASCOMBEGUY, LANTABAT
64;RTE D IPHARLATZE, LANTABAT
64;RTE DE LANTABAT, LANTABAT
64;RTE DE LAPARTZALE, LANTABAT
64;RTE DE SAINT PALAIS, LANTABAT
64;RTE DES PALOMBIERES, LANTABAT
64;RTE DE MAULEON RD918, LARCEVEAU-ARROS-CIBITS
64;RTE DE ST PALAIS RD933, LARCEVEAU-ARROS-CIBITS
64;VC VC1, LARCEVEAU-ARROS-CIBITS
64;VC VC2, LARCEVEAU-ARROS-CIBITS
64;VC VC3, LARCEVEAU-ARROS-CIBITS
64;VC VC4, LARCEVEAU-ARROS-CIBITS
64;VC VC5, LARCEVEAU-ARROS-CIBITS
64;VC VC6, LARCEVEAU-ARROS-CIBITS
64;VC VC7, LARCEVEAU-ARROS-CIBITS
64;VC VC8, LARCEVEAU-ARROS-CIBITS
64;VC VC9, LARCEVEAU-ARROS-CIBITS
64;VC VC10, LARCEVEAU-ARROS-CIBITS
64;VC VC11, LARCEVEAU-ARROS-CIBITS
64;VC VC12, LARCEVEAU-ARROS-CIBITS
64;VC VC13, LARCEVEAU-ARROS-CIBITS
64;VC VC14, LARCEVEAU-ARROS-CIBITS
64;VC VC15, LARCEVEAU-ARROS-CIBITS
64;VC VC16, LARCEVEAU-ARROS-CIBITS
64;VC VC17, LARCEVEAU-ARROS-CIBITS
64;VC VC18, LARCEVEAU-ARROS-CIBITS
64;VC VC19, LARCEVEAU-ARROS-CIBITS
64;VC VC20, LARCEVEAU-ARROS-CIBITS
64;VC VC21, LARCEVEAU-ARROS-CIBITS
64;VC VC22, LARCEVEAU-ARROS-CIBITS
64;VC VC23, LARCEVEAU-ARROS-CIBITS
64;VC VC24, LARCEVEAU-ARROS-CIBITS
64;VC VC25, LARCEVEAU-ARROS-CIBITS
64;VC VC26, LARCEVEAU-ARROS-CIBITS
64;VC VC27, LARCEVEAU-ARROS-CIBITS
64;VC VC28, LARCEVEAU-ARROS-CIBITS
64;VC VC29, LARCEVEAU-ARROS-CIBITS
64;VC VC30, LARCEVEAU-ARROS-CIBITS
64;VC VC31, LARCEVEAU-ARROS-CIBITS
64;VC VC32, LARCEVEAU-ARROS-CIBITS
64;VC VC33, LARCEVEAU-ARROS-CIBITS
64;VC VC34, LARCEVEAU-ARROS-CIBITS
64;VC VC35, LARCEVEAU-ARROS-CIBITS
64;VC VC36, LARCEVEAU-ARROS-CIBITS
64;VC VC37, LARCEVEAU-ARROS-CIBITS
64;VC VC38, LARCEVEAU-ARROS-CIBITS
64;LOT BURGAU, LAROIN
64;LOT BERETTE, LAROIN
64;LOT CASSOU MASSOU, LAROIN
64;LOT CLOS GUILHEMBAQUE, LAROIN
64;LOT DORGANS MONTEL, LAROIN
64;LOT JAVIERRE, LAROIN
64;LOT LARRIEU, LAROIN
64;LOT LARROZE, LAROIN
64;LOT LE REGAIN, LAROIN
64;LOT MOULY, LAROIN
64;CHE CASSOU MASSOU, LAROIN
64;CHE DEPARTEMENTAL N 2, LAROIN
64;CHE LAMARQUE, LAROIN
64;COTE D'AGUT, LAROIN
64;CHE DES ARRIBEUS, LAROIN
64;RTE ARTIGUELOUVE, LAROIN
64;RUE DE L ARTISANAT, LAROIN
64;CHE BAREILLE, LAROIN
64;CHE BARRERE, LAROIN
64;CHE BARRICABE, LAROIN
64;CHE BATPRIBETTE, LAROIN
64;CHE BERETTE, LAROIN
64;CHE DE BERGE, LAROIN
64;CHE DU BOIS ROMPU, LAROIN
64;CHE DU CASTELLA, LAROIN
64;IMP CIBOULETTE, LAROIN
64;RTE DE LA CHAPELLE DE ROUSSE, LAROIN
64;CHE DU COUDAY, LAROIN
64;SEN DU CHOURRUT, LAROIN
64;CHE COURALIS, LAROIN
64;CHE DES CRETES, LAROIN
64;CD 2, LAROIN
64;CD 217, LAROIN
64;IMP DURAN, LAROIN
64;CHE DURAN, LAROIN
64;CHE ECOLES, LAROIN
64;CHE DES FAITES, LAROIN
64;COTE GUIROYE, LAROIN
64;CHE HALET, LAROIN
64;CHE JAVIERE, LAROIN
64;RTE DE JURANCON, LAROIN
64;CHE LARRIEU, LAROIN
64;PAS MAROT COTE LAGIERE, LAROIN
64;SEN LAS HIES, LAROIN
64;CHE LARROZE, LAROIN
64;CHE MAUBECQ, LAROIN
64;COTE MERCE, LAROIN
64;IMP MIRAGOU, LAROIN
64;CHE DE L'OREE DU BOIS, LAROIN
64;CHE LAS PASSADES, LAROIN
64;CHE DE LA PASSERELLE, LAROIN
64;CHE PELIBAT, LAROIN
64;CHE PEYROUNET, LAROIN
64;CHE PINAU, LAROIN
64;RUE PRINCIPALE, LAROIN
64;CHE DU QUAI DES RAFTS, LAROIN
64;CHE LE REGAIN, LAROIN
64;RLE LA RUELLE, LAROIN
64;RTE DE SAINT FAUST, LAROIN
64;CHE SOUIX, LAROIN
64;CHE DE SOUCH, LAROIN
64;CHE DU STADE, LAROIN
64;CHE TOUJAROT, LAROIN
64;CHE VIGNAU, LAROIN
64;LOT FAGALDE, LARRESSORE
64;LOT HERRI ONDO, LARRESSORE
64;RES DU PETIT SEMINAIRE, LARRESSORE
64;RES SOROGAINA, LARRESSORE
64;CHE BORDA BERRIA, LARRESSORE
64;CHE DES CRETES, LARRESSORE
64;CHE ERRETANGA, LARRESSORE
64;CHE ERRETOR BIDEA, LARRESSORE
64;CHE DE HABANTZA, LARRESSORE
64;RTE D HALSOU, LARRESSORE
64;CHE PELEMBORDA, LARRESSORE
64;CHE SORHONDO, LARRESSORE
64;AV DOCTEUR ALEXANDRE CAMINO, LARRESSORE
64;CHE PELENBORDA LAN EREMUKO, LARRESSORE
64;PCH PELENBORDA LAN EREMUKO, LARRESSORE
64;RTE D'ARZACQ, LARREULE
64;CHE DE BERDAY, LARREULE
64;CHE DE BIGET, LARREULE
64;CHE DE BIGNOTTES, LARREULE
64;RTE DE BOUILLON, LARREULE
64;RUE LE BOURG, LARREULE
64;CHE DE BRANA, LARREULE
64;RTE DE L'EGLISE, LARREULE
64;RTE DE FICHOUS, LARREULE
64;CHE DE LA LANDE, LARREULE
64;RTE DE LARREULE, LARREULE
64;CHE DE LESQUIBES, LARREULE
64;RTE DE MAZEROLLES, LARREULE
64;RTE DE MOMAS, LARREULE
64;CHE DU MOULIN, LARREULE
64;CHE DE NEBOUT, LARREULE
64;RTE D'UZAN, LARREULE
64;CHE D'AGUERRIA, LARRIBAR-SORHAPURU
64;CHE D'ALDABIA, LARRIBAR-SORHAPURU
64;CHE D'ALCUQUE, LARRIBAR-SORHAPURU
64;CHE D'AMETZA, LARRIBAR-SORHAPURU
64;CHE D'AROZTEGIA, LARRIBAR-SORHAPURU
64;CHE D'ETXEGOINIA, LARRIBAR-SORHAPURU
64;CHE D'EZTINBORDA, LARRIBAR-SORHAPURU
64;CHE D'IHIZTARRIA, LARRIBAR-SORHAPURU
64;CHE D'IRATZABALIA, LARRIBAR-SORHAPURU
64;CHE D'IRATZEMENDI, LARRIBAR-SORHAPURU
64;CHE D'ITHURRALDIA, LARRIBAR-SORHAPURU
64;CHE D'OTSOBITEGIA, LARRIBAR-SORHAPURU
64;CHE D'UHALDEBORDA, LARRIBAR-SORHAPURU
64;CHE DE BIDEGORRIA, LARRIBAR-SORHAPURU
64;CHE DE BUGNIA, LARRIBAR-SORHAPURU
64;CHE DE BULAGNIA, LARRIBAR-SORHAPURU
64;CHE DE CHOTILENIA, LARRIBAR-SORHAPURU
64;CHE DE COUSINIA, LARRIBAR-SORHAPURU
64;CHE DE GARATIA, LARRIBAR-SORHAPURU
64;CHE DE HAITZAGOITIA, LARRIBAR-SORHAPURU
64;CHE DE KULUTEGIA, LARRIBAR-SORHAPURU
64;CHE DE LANDERRETXEA, LARRIBAR-SORHAPURU
64;CHE DE MALDAGAITA, LARRIBAR-SORHAPURU
64;CHE DE SAINT CRIQUENIA, LARRIBAR-SORHAPURU
64;CHE DE MENDIKOA, LARRIBAR-SORHAPURU
64;CHE DE PIKASARRIA, LARRIBAR-SORHAPURU
64;CHE DE PIKATZEA, LARRIBAR-SORHAPURU
64;CHE DE XALDIBURRIA, LARRIBAR-SORHAPURU
64;CHE DU MOULIN D'UHART, LARRIBAR-SORHAPURU
64;RTE DE KINKIL, LARRIBAR-SORHAPURU
64;RTE DE LARRAIDIA, LARRIBAR-SORHAPURU
64;RTE DE LARRIBAR, LARRIBAR-SORHAPURU
64;RTE DE LOHITZUN, LARRIBAR-SORHAPURU
64;RTE DE LUKUA, LARRIBAR-SORHAPURU
64;RTE DE MAULEBIDE, LARRIBAR-SORHAPURU
64;RTE DE SAINT JEAN PIED DE PORT, LARRIBAR-SORHAPURU
64;RTE DE SORHAPURU, LARRIBAR-SORHAPURU
64;LOT LE BAROU, LARUNS
64;LOT BELLEVUE, LARUNS
64;LOT BIGORRE, LARUNS
64;LOT BOY, LARUNS
64;LOT CASABONNE, LARUNS
64;LOT CAUHAPE, LARUNS
