64;CHE DES BAGNES, AAST
64;IMP BERDOT, AAST
64;CHE DE BERDOT, AAST
64;CHE DU BOIS, AAST
64;CHE DE LAS BORDES, AAST
64;IMP CAZAUBOU, AAST
64;IMP DES CHAMPS ALIZES, AAST
64;CHE DE LA COUSTETE, AAST
64;CHE DE CUHOURCQS, AAST
64;CHE DEOUS CUYALAS, AAST
64;CHE DABAN FRANCE, AAST
64;CHE DABAN FRESCQ, AAST
64;CHE DEOU BOSCQ, AAST
64;CHE DE L'EGLISE, AAST
64;RTE DE GARDERES, AAST
64;RTE DE GER, AAST
64;CHE DE GOUAILLOT, AAST
64;IMP GUILHAS, AAST
64;CHE DE GUILLAS, AAST
64;CHE DE LANNEDARRE, AAST
64;IMP LASBORDES, AAST
64;CHE LESCLOUPE, AAST
64;PL DE LA MAIRIE, AAST
64;IMP DU MOULIN, AAST
64;CHE DEOUS OUMBRES, AAST
64;CHE DE PEBAYET, AAST
64;IMP PETIT LOUET, AAST
64;RTE DE PONSON DESSUS, AAST
64;CHE DE POUBLAN, AAST
64;RTE DE SERON, AAST
64;IMP TOULOU, AAST
64;CHE DE YACOULOU, AAST
64;CHE DU BOURG, ABERE
64;CHE CASSAGNET, ABERE
64;CHE DU CUTOUR, ABERE
64;CHE DE L EGLISE, ABERE
64;CHE DE FOURSANS, ABERE
64;CHE DU GARROS, ABERE
64;CHE DE LA LANDE, ABERE
64;CHE DE LAPOUDGE, ABERE
64;CHE DE LASGRABES, ABERE
64;CHE DU MOULIN, ABERE
64;CHE DE LA TEULERE, ABERE
64;CHE DE TOUR, ABERE
64;RTE DE VIC, ABERE
64;RUE BASTIA, ABIDOS
64;RUE BERNACHEYRE, ABIDOS
64;CHE DE LA CARRIOU, ABIDOS
64;RUE DE LA CASSIERE, ABIDOS
64;RUE CHALOSSE, ABIDOS
64;RUE DE L'EGLISE, ABIDOS
64;RUE GALOS, ABIDOS
64;RUE GAVE BAISE, ABIDOS
64;RTE LAGOR, ABIDOS
64;RUE JEAN BAPTISTE LARTIA, ABIDOS
64;RUE MIALOS, ABIDOS
64;RUE DU MOULIN, ABIDOS
64;CAMI DE LA NAOU, ABIDOS
64;CHE DE PLAISANCE, ABIDOS
64;RUE PRINCIPALE DE LAGOR, ABIDOS
64;RUE RAOUL VERGEZ, ABIDOS
64;RUE DU STADE, ABIDOS
64;RUE DE L ARPIOU, ABITAIN
64;CHE D AUNES, ABITAIN
64;CHE DE BARAT DE CARRERE, ABITAIN
64;CHE DE BENES, ABITAIN
64;CHE DE LA BORDENAVE, ABITAIN
64;CHE DE DUPONT, ABITAIN
64;RTE D ESCOS, ABITAIN
64;CHE D ETCHEBEST, ABITAIN
64;CHE LATERAL, ABITAIN
64;CHE DE LAUHIRE, ABITAIN
64;CHE DE LUCA, ABITAIN
64;IMP MIRASSOU, ABITAIN
64;D 936, ABITAIN
64;CHE DES PALOMBIERES, ABITAIN
64;CHE DE PEYRE, ABITAIN
64;IMP PICAMILH, ABITAIN
64;IMP DE LA RAME, ABITAIN
64;CHE DE REYEN, ABITAIN
64;CHE DE LA RIBERE, ABITAIN
64;RTE DE SAINT MARTIN, ABITAIN
64;RUE DU VILLAGE, ABITAIN
64;LOT LES BROUQUETS, ABOS
64;ZONE INDUSTRIELLE D ABOS, ABOS
64;LOT PUYOO, ABOS
64;LOT DES PYRENEES, ABOS
64;RTE D ARBUS, ABOS
64;RUE BAGNERES, ABOS
64;IMP BERGERON, ABOS
64;RTE DE BESINGRAND, ABOS
64;RTE DU BOIS, ABOS
64;AV CHARLES DE BORDEU, ABOS
64;IMP BORDEU, ABOS
64;IMP BROUQUETS, ABOS
64;RUE DU CENTRE, ABOS
64;RUE LA COURNERE, ABOS
64;IMP DE LA COURNERE, ABOS
64;RUE CRABEROU, ABOS
64;IMP DIM, ABOS
64;RUE DE L EGLISE, ABOS
64;RUE FORCADE, ABOS
64;IMP FORCADE, ABOS
64;CHE DE GASSAN, ABOS
64;IMP GUILHAMELOU, ABOS
64;RTE DE LA GRAVIERE, ABOS
64;IMP HAUT, ABOS
64;RUE HAUT, ABOS
64;CHE DES HOSSES, ABOS
64;PL DE LA MAIRIE, ABOS
64;RUE MATACHOT, ABOS
64;RTE DE MONEIN, ABOS
64;RTE DE PARBAYSE, ABOS
64;RTE DE PARDIES, ABOS
64;IMP PASSETTE, ABOS
64;RTE DE PAU, ABOS
64;RUE PONDIQUE, ABOS
64;PL DU PRAT, ABOS
64;RUE PRAT, ABOS
64;RUE DES PYRENEES, ABOS
64;RUE RAYMOND SEDZE, ABOS
64;CHE DU SOUBAC, ABOS
64;RTE DE TARSACQ, ABOS
64;LOT ESPIATE, ACCOUS
64;LOT D ISEYE, ACCOUS
64;VC D ARRECHAU, ACCOUS
64;VC D AULET, ACCOUS
64;RUE DE BAIX, ACCOUS
64;RUE BEGARIE, ACCOUS
64;CHE DE LA CARRERASSE, ACCOUS
64;RUE CENTRALE, ACCOUS
64;RUE COSTE MARIOU, ACCOUS
64;RUE DARRE CHICHETTE, ACCOUS
64;RUE DARRE LAURENS, ACCOUS
64;VC D ESPLATE, ACCOUS
64;RUE ESQUERRE, ACCOUS
64;RUE FONTAINE PELOY, ACCOUS
64;RUE DU FOUR CANDAU, ACCOUS
64;CHE DE GARCET, ACCOUS
64;RUE DE HAUT, ACCOUS
64;RUE LABEGUERE, ACCOUS
64;RUE MADRILH, ACCOUS
64;PL DE LA MAIRIE, ACCOUS
64;RUE MATACHOT, ACCOUS
64;RUE DU MOULIN, ACCOUS
64;N 134, ACCOUS
64;RUE DU POUEY, ACCOUS
64;VC DU SAILLET, ACCOUS
64;RUE TRANICOT, ACCOUS
64;RUE TROUSSILH, ACCOUS
64;RTE D'AOULET, ACCOUS
64;RUE D'AOULET, ACCOUS
64;PL D'ARAPOUP, ACCOUS
64;IMP D'ARAPOUP, ACCOUS
64;CHE D'ARBEILLAT, ACCOUS
64;RTE DES ARCATS, ACCOUS
64;CHE D'ARRECHAU, ACCOUS
64;CHE ARRIGAU, ACCOUS
64;RTE D'AUMET, ACCOUS
64;PASS DE BAIX, ACCOUS
64;RTE DE BEDOUS RD 637, ACCOUS
64;IMP DU BERGON, ACCOUS
64;CHE DE BERGUERIE, ACCOUS
64;CHE DE LA BERTHE, ACCOUS
64;CHE DE LA BORDE SUZA, ACCOUS
64;CHE BOUHABEN CAZALA, ACCOUS
64;CHE DE BROUCAS, ACCOUS
64;CHE DES CABANES, ACCOUS
64;CHE CAMPAGNET, ACCOUS
64;CHE DE CANTALOUP, ACCOUS
64;CHE CAPIROO, ACCOUS
64;RUE SENTIER ET CARRERROU, ACCOUS
64;CHE DE CAUDERAS, ACCOUS
64;CHE CAZETOU DE HAUT, ACCOUS
64;RUE DE LA CHAPELLE, ACCOUS
64;RTE LA CHAPELLE ST CHRISTAU, ACCOUS
64;CHE DE LA COLLINE DESPOURRINS, ACCOUS
64;CHE DE LA COSTE, ACCOUS
64;CHE COSTE DE LARROUY, ACCOUS
64;CHE DE LA COTE DE CASTILLOU, ACCOUS
64;RUE DE LA COUDURETTE, ACCOUS
64;CHE COUDUROT, ACCOUS
64;CHE DEBAT LESPOUNE, ACCOUS
64;RTE DEPARTEMENTALE 834, ACCOUS
64;RUE ESPIATE, ACCOUS
64;RTE DE L'ESPIATE RD 637, ACCOUS
64;IMP DE FRANCHOU, ACCOUS
64;IMP FUZIER, ACCOUS
64;CHE DE LA GARDE BARRIERE, ACCOUS
64;CHE DE LA GARE, ACCOUS
64;IMP ICHAU, ACCOUS
64;RUE DE L'ISEYE, ACCOUS
64;PL D'ISEYE, ACCOUS
64;RTE DE JOUERS, ACCOUS
64;RTE DE LABADIE, ACCOUS
64;CHE LABOURDETTE, ACCOUS
64;CHE LANNE DET MIEY, ACCOUS
64;CHE DE LAPALUE, ACCOUS
64;CHE LAPASSATET, ACCOUS
64;RTE DE LHERS, ACCOUS
64;RTE DE LHERS RD 339, ACCOUS
64;CHE DU MOULIN, ACCOUS
64;CHE DE LA NABE, ACCOUS
64;CHE DE PETRABE, ACCOUS
64;CHE DU PONT DE PIERRE, ACCOUS
64;CHE RACHOU, ACCOUS
64;CHE DU SAILLET, ACCOUS
64;RUE DU SAILLET, ACCOUS
64;RTE DE SAINT GILOUA, ACCOUS
64;CHE DE SOUDIOUS, ACCOUS
64;SEN DE SOUDIOUS, ACCOUS
64;CHE DE TICOULET, ACCOUS
64;CHE DES TOURETTES, ACCOUS
64;IMP TOYAL, ACCOUS
64;CHE TRESIMAN, ACCOUS
64;RUE DES VIGNES, ACCOUS
64;LOT BIOCLIMATIQUE, AGNOS
64;LOT LE CLOS DE LA GLORIETTE, AGNOS
64;LOT LES COLOMBES, AGNOS
64;LOT DE L'OLIVIER, AGNOS
64;LOT LE PAS D ASPE, AGNOS
64;LOT HAMEAU DU BINET, AGNOS
64;LOT RESIDENCES DE LA PLAINE, AGNOS
64;LOT LE SOUM DE SEGU, AGNOS
64;LOT RESIDENCE DE BACCARAU, AGNOS
64;LOT LE TERMY 3, AGNOS
64;LOT LE TERMY 4, AGNOS
64;LOT ZA DES PYRENEES, AGNOS
64;LOT LE VAL D ASPE, AGNOS
64;RUE D'AGNOS, AGNOS
64;RUE D ARLET, AGNOS
64;CHE DE BACCARAU, AGNOS
64;IMP DU CAMP DE CESAR, AGNOS
64;RUE DE BACHAGUES, AGNOS
64;RUE DU BINET, AGNOS
64;PL DES BRUYERES, AGNOS
64;CHE DE BUGANGUE, AGNOS
64;IMP CAMP DE CESAR, AGNOS
64;RUE DU CAMP DE CESAR, AGNOS
64;CHE DE LA CAMPAGNE, AGNOS
64;PL DES CHARDONS, AGNOS
64;RUE DU CHATEAU, AGNOS
64;IMP DU CHENE, AGNOS
64;IMP DE LA COLLINE, AGNOS
64;CHE DE LA COLLINE, AGNOS
64;RUE DES COQUELICOTS, AGNOS
64;RUE DES EDELWEISS, AGNOS
64;CHE DARRE BERGER, AGNOS
64;CHE DE LABAIG, AGNOS
64;RUE DE L EGALITE, AGNOS
64;RUE DES EGLANTINES, AGNOS
64;RUE DES GENTIANES, AGNOS
64;IMP DES GENTIANES, AGNOS
64;CHE DE GOUADAIN, AGNOS
64;RUE DE LA GLORIETTE, AGNOS
64;IMP DE LA GLORIETTE, AGNOS
64;RUE DES IRIS, AGNOS
64;RUE DE LOU PARIS, AGNOS
64;IMP DES LYS, AGNOS
64;IMP LOU PARIS, AGNOS
64;CHE DE MIRANDE, AGNOS
64;RUE DE LA PLAINE DE GERS, AGNOS
64;RUE DU PLOUTS, AGNOS
64;RUE DES PYRENEES, AGNOS
64;RUE DU TERMY, AGNOS
64;CHE DE SERRESCASTET, AGNOS
64;RUE DES VIOLETTES, AGNOS
64;CHE SENTIN, AGNOS
64;RUE SOUM DE SEGU, AGNOS
64;CHE D AHATSABERROA, AHAXE-ALCIETTE-BASCASSAN
64;CHE D ALCIETTE, AHAXE-ALCIETTE-BASCASSAN
64;CHE D ERREKALDIA, AHAXE-ALCIETTE-BASCASSAN
64;CHE D ERROMATEIA, AHAXE-ALCIETTE-BASCASSAN
64;CHE D ETXARTIA, AHAXE-ALCIETTE-BASCASSAN
64;CHE D IRIBERRIA, AHAXE-ALCIETTE-BASCASSAN
64;CHE D IRIGARAIA, AHAXE-ALCIETTE-BASCASSAN
64;CHE D OIHANONDOA, AHAXE-ALCIETTE-BASCASSAN
64;CHE D UHAITZIA, AHAXE-ALCIETTE-BASCASSAN
64;RTE D IRATY, AHAXE-ALCIETTE-BASCASSAN
64;CHE D URRUTIA, AHAXE-ALCIETTE-BASCASSAN
64;CHE DE BASTIDA, AHAXE-ALCIETTE-BASCASSAN
64;CHE DE BIDARTIA, AHAXE-ALCIETTE-BASCASSAN
64;CHE DE BIXKARREA, AHAXE-ALCIETTE-BASCASSAN
64;CHE DE FABRIKA, AHAXE-ALCIETTE-BASCASSAN
64;CHE DE GAINEKO BORDA, AHAXE-ALCIETTE-BASCASSAN
64;CHE DE GARATAMENDI, AHAXE-ALCIETTE-BASCASSAN
64;CHE DE GAZTELIA, AHAXE-ALCIETTE-BASCASSAN
64;CHE DE JETERIA, AHAXE-ALCIETTE-BASCASSAN
64;CHE DE LIBIETA, AHAXE-ALCIETTE-BASCASSAN
64;CHE DE MENDIONDOA, AHAXE-ALCIETTE-BASCASSAN
64;CHE DE MINDURRIA, AHAXE-ALCIETTE-BASCASSAN
64;CHE DE MIXELENIA, AHAXE-ALCIETTE-BASCASSAN
64;CHE DE MOTXAENIA, AHAXE-ALCIETTE-BASCASSAN
64;CHE DE MUNHOA, AHAXE-ALCIETTE-BASCASSAN
64;CHE DE TAMUNDEIA, AHAXE-ALCIETTE-BASCASSAN
64;CHE DE XILINTXABIDEA, AHAXE-ALCIETTE-BASCASSAN
64;RTE D AHATSA XILO, AHAXE-ALCIETTE-BASCASSAN
64;RTE D AINCILLE, AHAXE-ALCIETTE-BASCASSAN
64;RTE D IRATI, AHAXE-ALCIETTE-BASCASSAN
64;RTE DE BASCASSAN, AHAXE-ALCIETTE-BASCASSAN
64;RTE DE L EGLISE, AHAXE-ALCIETTE-BASCASSAN
64;RTE DE LATARCE, AHAXE-ALCIETTE-BASCASSAN
64;RTE DE SAINT-JEAN-LE-VIE, AHAXE-ALCIETTE-BASCASSAN
64;LOT ELIZ ALDEA, AHETZE
64;LOT ERROTA ZAHAR, AHETZE
64;LOT LOUVRADOUX, AHETZE
64;LOT PEILLE, AHETZE
64;LOT PLAZAKO LANDA, AHETZE
64;LOT SOLORZANO, AHETZE
64;RES BASARRI, AHETZE
64;RES ETXAHUN, AHETZE
64;RES OTXALDE, AHETZE
64;RES UZTAPIDE, AHETZE
64;RES XALBADOR, AHETZE
64;RES XAMPUN, AHETZE
64;CHE ADAMENEA, AHETZE
64;CHE D'AGERREA, AHETZE
64;CHE ALTURAN, AHETZE
64;CHE AMIZOLA, AHETZE
64;CHE D'ARRAKOTENEA, AHETZE
64;CHE D'ARROBIA, AHETZE
64;CHE APEZAIN LANDA, AHETZE
64;RTE D'ARBONNE, AHETZE
64;CHE D'ATXOTA, AHETZE
64;CHE DE BASOA, AHETZE
64;CHE DE BETRITTOENEA, AHETZE
64;RTE DE BIDART, AHETZE
64;CHE BELARDIA, AHETZE
64;CHE DE BERNATENEA, AHETZE
64;CHE BERROUETA, AHETZE
64;CHE DE BIDEGARAYA, AHETZE
64;CHE DE BIDEXKA, AHETZE
64;CHE DE BIPERRENBORDA, AHETZE
64;CHE ELIZ ALDEA, AHETZE
64;CHE DE DOMINTXENEA, AHETZE
64;CHE DE DORREA, AHETZE
64;RTE ETCHE CHURRIA, AHETZE
64;CHE D'ERROTA, AHETZE
64;CHE D'ERROTA XAHAR, AHETZE
64;CHE DE FRANTSAENEA, AHETZE
64;CHE D'HARRETXEA, AHETZE
64;CHE D'HARRIETA, AHETZE
64;CHE D'ITURBIDEA, AHETZE
64;CHE DE LAHARRAGA, AHETZE
64;CHE DE LARRALDEA, AHETZE
64;CHE DE LARREKOINA, AHETZE
64;CHE DE LARRUNTA, AHETZE
64;CHE DE MARIATTOENEA, AHETZE
64;CHE DE MULIENEA, AHETZE
64;CHE OLHAINA, AHETZE
64;CHE LARRE LUZEA, AHETZE
64;CHE OLHAENEA, AHETZE
64;CHE D'ORGENBIDEA, AHETZE
64;CHE OSO, AHETZE
64;CHE D'OSTALERIA, AHETZE
64;CHE D'OSTALERIAKOBORDA, AHETZE
64;CHE DE PENDIXA, AHETZE
64;CHE D'OSTALAPEA, AHETZE
64;CHE PLAZAKO LANDA, AHETZE
64;CHE SASKOENEA, AHETZE
64;CHE PAULOENEA, AHETZE
64;CHE D'UHARTEA, AHETZE
64;CHE D'UHAZALDEA, AHETZE
64;CHE D'URONEA, AHETZE
64;CHE DE XIMIKOENEA, AHETZE
64;CHE DE XIMIKORENBORDA, AHETZE
64;CHE D'ESKOLA, AHETZE
64;CHE D'ETXEHERRIA, AHETZE
64;RUE HERRIKO BIHOTZA, AHETZE
64;CHE D'ITURBIDENBORDA, AHETZE
64;CHE D'ITURRALDEA, AHETZE
64;CHE DE JOANETAENEA, AHETZE
64;CHE DE KALLARDOENEA, AHETZE
64;CHE DE MARIHARTENEA, AHETZE
64;CHE DE MARTIKOTENIA, AHETZE
64;PL MATTIN TRECU, AHETZE
64;CHE DE MERLATUA, AHETZE
64;CHE D'OLHANGO BIDEA, AHETZE
64;CHE D'ERROTAXAHARRA, AHETZE
64;CHE GAZTELU BERRIA, AHETZE
64;CHE HAIZE TOKI, AHETZE
64;CHE HAROZTEGIA, AHETZE
64;CHE MENDI ALDE, AHETZE
64;CHE ECHCORTERIA, AHETZE
64;PL DES BERTSULARI, AHETZE
64;CHE DES CHENES, AHETZE
64;CHE HERRIXKA, AHETZE
64;LOT CNRO, AICIRITS CAMOU SUHAST
64;LOT GUILLEMET, AICIRITS CAMOU SUHAST
64;LOT JOUANTHO, AICIRITS CAMOU SUHAST
64;QUA LAMERENS, AICIRITS CAMOU SUHAST
64;LOT LASSABE, AICIRITS CAMOU SUHAST
64;LOT P. HOURCADETTE, AICIRITS CAMOU SUHAST
64;LOT TTARGA, AICIRITS CAMOU SUHAST
64;RTE D AICIRITS, AICIRITS CAMOU SUHAST
64;RTE DE L EGLISE, AICIRITS CAMOU SUHAST
64;AV THEODORE D'ARTHEZ, AICIRITS CAMOU SUHAST
64;RTE DEPARTEMENTALE 11, AICIRITS CAMOU SUHAST
64;RTE DEPARTEMENTALE 29, AICIRITS CAMOU SUHAST
64;RTE DEPARTEMENTALE 529, AICIRITS CAMOU SUHAST
64;RTE DEPARTEMENTALE 933, AICIRITS CAMOU SUHAST
64;RTE D'ARBERATS, AICIRITS CAMOU SUHAST
64;RTE D'ARBOUET, AICIRITS CAMOU SUHAST
64;RTE D'AYERGUY, AICIRITS CAMOU SUHAST
64;IMP BIAK, AICIRITS CAMOU SUHAST
64;IMP BORDABERRY, AICIRITS CAMOU SUHAST
64;RTE DE BORDABERRY, AICIRITS CAMOU SUHAST
64;ALL DE CHOURY, AICIRITS CAMOU SUHAST
64;RTE DES ECOLES, AICIRITS CAMOU SUHAST
64;RTE DE L'EGLISE SUHAST, AICIRITS CAMOU SUHAST
64;RTE ELGARTEMIX, AICIRITS CAMOU SUHAST
64;IMP EMEKI, AICIRITS CAMOU SUHAST
64;IMP ERREKARTIA, AICIRITS CAMOU SUHAST
64;RTE ESPERANTZA, AICIRITS CAMOU SUHAST
64;RTE D'ESQUILAMBORDE, AICIRITS CAMOU SUHAST
64;RTE ETCHARTIA, AICIRITS CAMOU SUHAST
64;RUE ETXE GOXOAK, AICIRITS CAMOU SUHAST
64;RTE DE EYHERACHAR, AICIRITS CAMOU SUHAST
64;RTE JEAN DE LA GARDE, AICIRITS CAMOU SUHAST
64;ALL GOXOKI, AICIRITS CAMOU SUHAST
64;CHE DU GUE, AICIRITS CAMOU SUHAST
64;RUE HAIZPE, AICIRITS CAMOU SUHAST
64;RTE D'IHITZAGUE, AICIRITS CAMOU SUHAST
64;IMP IRIBARNIA, AICIRITS CAMOU SUHAST
64;RTE DE JAUBERRIA, AICIRITS CAMOU SUHAST
64;RTE LARARTIA, AICIRITS CAMOU SUHAST
64;RTE DE LARRABURIA, AICIRITS CAMOU SUHAST
64;RTE DE LARRAMENDIA, AICIRITS CAMOU SUHAST
64;RTE MENDIBURIA, AICIRITS CAMOU SUHAST
64;RTE DE MOCOROA, AICIRITS CAMOU SUHAST
64;CHE CROIX DE MOKOROA, AICIRITS CAMOU SUHAST
64;RTE DU MOULIN, AICIRITS CAMOU SUHAST
64;ALL PARADIS, AICIRITS CAMOU SUHAST
64;CHE DE PECHOUNARTIA, AICIRITS CAMOU SUHAST
64;RTE PERIGNOA, AICIRITS CAMOU SUHAST
64;RTE DE RECALDE, AICIRITS CAMOU SUHAST
64;ALL DU ROND POINT, AICIRITS CAMOU SUHAST
64;RTE DE SALHA, AICIRITS CAMOU SUHAST
64;ALL SALLE POLYVALENTE, AICIRITS CAMOU SUHAST
64;RTE DE SUHAST, AICIRITS CAMOU SUHAST
64;IMP POINTE DE TTARGA, AICIRITS CAMOU SUHAST
64;IMP TRISTANTENIA, AICIRITS CAMOU SUHAST
64;CHE D ADINEKO, AINCILLE
64;CHE D AHARRE, AINCILLE
64;CHE D AINTZILZARRI, AINCILLE
64;CHE D ANTSAHARRIA, AINCILLE
64;CHE DE ARANTZIA, AINCILLE
64;CHE D ARROSAGARAI, AINCILLE
64;RTE DE BERRO, AINCILLE
64;RTE DE BURALDIA, AINCILLE
64;RTE DE ITURXILO, AINCILLE
64;CHE DE JELOSALDIA, AINCILLE
64;RTE DE LASPAR, AINCILLE
64;RTE DE MALDARRO, AINCILLE
64;RTE DE ORDANGUNE, AINCILLE
64;RTE DE PAGOLA, AINCILLE
64;RTE DE PLAZA, AINCILLE
64;RTE DE SORTAGA, AINCILLE
64;CHE DE SOTALDA, AINCILLE
64;RTE DE ZAHABI, AINCILLE
64;CHE D ABENSE, AINHARP
64;CHE D AGUERREBERRIA, AINHARP
64;CHE D AGUERREBBERRIBORDA, AINHARP
64;CHE D ARANCO, AINHARP
64;CHE D ARGUAGUE, AINHARP
64;CHE D EIHERABIDIA, AINHARP
64;CHE D EIHERAGARAIA, AINHARP
64;CHE D ELHORRIBERRIA, AINHARP
64;CHE D ETXEBESTENBODA, AINHARP
64;CHE D OYHERCQ, AINHARP
64;CHE D UTHURRIETA, AINHARP
64;CHE DE BAGADOIA, AINHARP
64;CHE DE BENTA, AINHARP
64;CHE DE BORDAGARAIBERRIA, AINHARP
64;CHE DE GANEKO EIHERA, AINHARP
64;CHE GANEKO ELGIA, AINHARP
64;CHE DE HARIXTANBURIA, AINHARP
64;CHE DE JAIGUBERRIA, AINHARP
64;CHE DE KABANA, AINHARP
64;CHE DE KAKOA, AINHARP
64;CHE DE L ECOLE, AINHARP
64;CHE DE L EGLISE, AINHARP
64;CHE DE LANBA XILO, AINHARP
64;CHE DE LAPHITZAGA, AINHARP
64;CHE LEIZIAGA, AINHARP
64;CHE DE LOHITZUN, AINHARP
64;CHE DE MINAKIA, AINHARP
64;CHE DE PALAZENIA, AINHARP
64;CHE DE PEKETXIA, AINHARP
64;CHE DE SALABERRIA, AINHARP
64;CHE DE XALUTEGIA, AINHARP
64;IMP DE LEIZIAGAMENDI, AINHARP
64;RTE D ESPES, AINHARP
64;RTE DE LAMBARRE, AINHARP
64;RTE DE MAULEON, AINHARP
64;RTE DE SAINT PALAIS, AINHARP
64;RUE DU BOURG, AINHARP
64;RUE DU FRONTON, AINHARP
64;CHE D AHATSAMENDI, AINHICE-MONGELOS
64;CHE D AINHIZEMENDI, AINHICE-MONGELOS
64;CHE D ARTIKEITE, AINHICE-MONGELOS
64;CHE D AZERIA, AINHICE-MONGELOS
64;CHE DE BIDARTEA, AINHICE-MONGELOS
64;IMP DU BOVIDUC, AINHICE-MONGELOS
64;CHE DE DUKATENEA, AINHICE-MONGELOS
64;CHE D ERDOIZEA, AINHICE-MONGELOS
64;CHE D ERDOIZETXEBERRIA, AINHICE-MONGELOS
64;CHE D ERREKARTIA, AINHICE-MONGELOS
64;CHE D ETXEBESTEA, AINHICE-MONGELOS
64;CHE DE GALBARIOA, AINHICE-MONGELOS
64;RTE DE GAMARTHE, AINHICE-MONGELOS
64;CHE DE HARROBIA, AINHICE-MONGELOS
64;RTE DE HASPARREN, AINHICE-MONGELOS
64;CHE D IDIARTEKO BORDA, AINHICE-MONGELOS
64;CHE D IDIONDOA, AINHICE-MONGELOS
64;CHE D IDIONDOKO BORDA, AINHICE-MONGELOS
64;CHE D IRAXILO, AINHICE-MONGELOS
64;CHE D IRAZABALEA, AINHICE-MONGELOS
64;CHE D IREIA, AINHICE-MONGELOS
64;CHE D ITHURRALDEA, AINHICE-MONGELOS
64;CHE DE L EGLISE, AINHICE-MONGELOS
64;CHE DE LARRALDEA, AINHICE-MONGELOS
64;CHE DE LARRAMENDIA, AINHICE-MONGELOS
64;RTE DE LATZETHURRIA, AINHICE-MONGELOS
64;CHE DE MARTIRENA, AINHICE-MONGELOS
64;PL DE MONGELOS, AINHICE-MONGELOS
64;RUE DE MONGELOS, AINHICE-MONGELOS
64;IMP DE MUNHOA, AINHICE-MONGELOS
64;CHE D ORKAITZEA, AINHICE-MONGELOS
64;RTE DE SAINT PALAIS, AINHICE-MONGELOS
64;CHE DE SALABERRIA, AINHICE-MONGELOS
64;CHE DE SATERREKA, AINHICE-MONGELOS
64;LOT LARRALDE, AINHOA
64;CHE AMUNTSAINETIK-ARMAIARAKO, AINHOA
64;CHE ARMAIAETXEBERRIA-BARKOXKO, AINHOA
64;PL DE LA MAIRIE, ALDUDES
64;ZA ALEGERA, AMENDEUIX-ONEIX
64;LOT CNRO, AMENDEUIX-ONEIX
64;LOT LASSABE, AMENDEUIX-ONEIX
64;LOT PIERRE HOURCADTTE, AMENDEUIX-ONEIX
64;LOT TARGA, AMENDEUIX-ONEIX
64;RTE DE L EGLISE, AMENDEUIX-ONEIX
64;RTE D AGINDOIA, AMENDEUIX-ONEIX
64;RTE D ARLA, AMENDEUIX-ONEIX
64;RTE D ARROTZETXEA, AMENDEUIX-ONEIX
64;RTE DE BIDEKURUTXEA, AMENDEUIX-ONEIX
64;IMP BIXTA EDER, AMENDEUIX-ONEIX
64;IMP BORDABERRIA, AMENDEUIX-ONEIX
64;RTE D ERREKALDIA, AMENDEUIX-ONEIX
64;RTE D ETXETOA, AMENDEUIX-ONEIX
64;RTE DE GABAT, AMENDEUIX-ONEIX
64;RTE DE GAPELO, AMENDEUIX-ONEIX
64;IMP IMPASSE GARAIALDE, AMENDEUIX-ONEIX
64;COTE DE GARRIS, AMENDEUIX-ONEIX
64;RTE DE GARRIS, AMENDEUIX-ONEIX
64;RTE DE GILENTEGIA, AMENDEUIX-ONEIX
64;IMP HARITZPEA, AMENDEUIX-ONEIX
64;IMP HEGOAN, AMENDEUIX-ONEIX
64;RTE DE HIRIBERRI, AMENDEUIX-ONEIX
64;RTE DE KANDELENEA, AMENDEUIX-ONEIX
64;RTE DE KAPUNTEGIA, AMENDEUIX-ONEIX
64;RTE DE LANDAZAHARRIA, AMENDEUIX-ONEIX
64;RTE DE LARRASKA, AMENDEUIX-ONEIX
64;IMP LARREGOIENEA, AMENDEUIX-ONEIX
64;RTE DE LEKU IDOR, AMENDEUIX-ONEIX
64;RTE DE LA MAIRIE, AMENDEUIX-ONEIX
64;RTE DES MOULINS, AMENDEUIX-ONEIX
64;COTE D ONEIX, AMENDEUIX-ONEIX
64;RTE DE PEKOBERHOA, AMENDEUIX-ONEIX
64;RTE DE PIKAKOSTA, AMENDEUIX-ONEIX
64;PAS LA ROMAINE, AMENDEUIX-ONEIX
64;RTE DE SABRENIA, AMENDEUIX-ONEIX
64;CHE DE SAINT-CRICQ, AMENDEUIX-ONEIX
64;RTE SAINT-MICHEL-GARICOITS, AMENDEUIX-ONEIX
64;RTE DU SOMMET, AMENDEUIX-ONEIX
64;RTE DE SUMBERRAUTE, AMENDEUIX-ONEIX
64;RTE DE ZANPARLO, AMENDEUIX-ONEIX
64;LOT BEAUX SITES, ANDOINS
64;LOT CASTET, ANDOINS
64;LOT CORISANDE D 'ANDOINS 1, ANDOINS
64;LOT CORISANDE D'ANDOINS 2, ANDOINS
64;LOT LA COSTE DE CAMY, ANDOINS
64;RTE D ARTIGUELOUTAN, ANDOINS
64;CR 28 DOUS ABERAS, ANDOINS
64;CR 2 DOUS AUGAS, ANDOINS
64;CR 7 DE BAPTISTE, ANDOINS
64;CR 31 DE BARADAT, ANDOINS
64;ALL BARONNE DE LESCUN, ANDOINS
64;RUE BELLEVUE, ANDOINS
64;CR 5 DOU BIALA, ANDOINS
64;RTE DU BIALA, ANDOINS
64;CHE BORDE DE CAMUS, ANDOINS
64;CR 16 DOU BOSCQ, ANDOINS
64;CR 13 DOU BURCQ, ANDOINS
64;CHE DE CAM, ANDOINS
64;CR 22 CAPS DE CAMIS, ANDOINS
64;CR 4 DE CANTOU, ANDOINS
64;CR 20 DE CASIMIR, ANDOINS
64;SEN DES CHENES, ANDOINS
64;RUE DES CHASSEURS, ANDOINS
64;CHE CHINETTE, ANDOINS
64;ALL COMTESSE DE GUICHE, ANDOINS
64;RUE CORISANDE, ANDOINS
64;ALL COMTESSE DE LOUVIGNY, ANDOINS
64;RUE COSTE DE CAMI, ANDOINS
64;CR 17 DOU COURBET, ANDOINS
64;CHE COUSTET, ANDOINS
64;IMP DE COUSTET, ANDOINS
64;RUE DUCHESSE DE GRAMONT, ANDOINS
64;ALL DES ECOLES, ANDOINS
64;RUE DE L EGLISE, ANDOINS
64;RTE D ESPECHEDE, ANDOINS
64;CR 24 DE LA FONTAINE DE DURAN, ANDOINS
64;CR 25 DE FONTAINE DE CASTET, ANDOINS
64;ALL DE LA FONTAINE DE DURAN, ANDOINS
64;CR 10 DE FRANCE, ANDOINS
64;CR 27 DU GOUAPALU, ANDOINS
64;CR 12 DE LAS GRABES, ANDOINS
64;RUE HAUDEBAT, ANDOINS
64;CR 15 DOU HIALE, ANDOINS
64;CR 14 DE LA HIELLO, ANDOINS
64;CR 1 DE LA HITAOU, ANDOINS
64;ALL DE LA HOUN, ANDOINS
64;CHE JOUANDOU, ANDOINS
64;CR 9 DE JOUAN, ANDOINS
64;CHE DE LAHITAU, ANDOINS
64;RUE DES LANOTS, ANDOINS
64;CR 3 DE LARROUTURE, ANDOINS
64;CR 8 DE LAULHE, ANDOINS
64;CR 23 DE LIMENDOUS, ANDOINS
64;RTE DE LIMENDOUS, ANDOINS
64;CHE DU LUY DE BEARN, ANDOINS
64;ALL MARQUEDEBAT, ANDOINS
64;RUE MARQUEDEHORE, ANDOINS
64;IMP DE MOURA, ANDOINS
64;CR 19 DOU MEJE DOU BOSCQ, ANDOINS
64;SEN MOUROUZAA, ANDOINS
64;CR 29 DOUS MILHOCS, ANDOINS
64;CR 26 DE MOURA, ANDOINS
64;RUE DU MOULIN, ANDOINS
64;RUE NOUSTE HENRIC, ANDOINS
64;IMP NOUSTE HENRIC, ANDOINS
64;RTE DE NOUSTY, ANDOINS
64;RTE D OUILLON, ANDOINS
64;RUE DU PANORAMA, ANDOINS
64;CHE PARRET, ANDOINS
64;CR 32 DE L OREE DES BOIS, ANDOINS
64;RUE PE DOU BOSCQ, ANDOINS
64;CR 30 DE PICH, ANDOINS
64;CR 21 DOU PLAA, ANDOINS
64;CR 6 DOUS PLEYTEYATS, ANDOINS
64;RUE DES PRES DE JULIE, ANDOINS
64;AUT 64 LA PYRENEENNE, ANDOINS
64;CHE DOUS PUYAUS, ANDOINS
64;RUE DES PYRENEES, ANDOINS
64;IMP DES PYRENEES, ANDOINS
64;RUE DE LA RINGAOU, ANDOINS
64;IMP DE LA RINGAOU, ANDOINS
64;RTE DE SENDETS, ANDOINS
64;RTE DE SERRES MORLAAS, ANDOINS
64;CR 18 DOUS SITES, ANDOINS
64;RUE DES SOURCES, ANDOINS
64;SEN DES THUYAS, ANDOINS
64;RUE DES TOURTERELLES, ANDOINS
64;RUE DU TREYTET, ANDOINS
64;IMP DU TREYTET, ANDOINS
64;IMP DES LANOTS, ANDOINS
64;IMP CORISANDE, ANDOINS
64;RTE DE BACHOUE, ANDREIN
64;RTE DE L'EGLISE, ANDREIN
64;RTE DE BOUILLOU, ANDREIN
64;RTE DE BURGARONNE, ANDREIN
64;RTE DE CASAMAYOU, ANDREIN
64;RTE DEPARTEMENTALE 23, ANDREIN
64;RTE DEPARTEMENTALE 27, ANDREIN
64;RTE DE LOUSTAOU, ANDREIN
64;RTE D ORRIULE, ANDREIN
64;LOT DU BEARN, ANGAIS
64;LOT BERTRUC CAMY, ANGAIS
64;LOT LA CHATAIGNERAIE, ANGAIS
64;LOT LAS CLABADES II, ANGAIS
64;LOT LES ISARDS, ANGAIS
64;LOT MADELAND, ANGAIS
64;LOT DU NEOUVIELLE, ANGAIS
64;LOT OSSAU, ANGAIS
64;LOT PEDEFLOUS, ANGAIS
64;LOT PIERRE BORDENAVE, ANGAIS
64;LOT DU PIC DU MIDI, ANGAIS
64;LOT LE PRE DU ROY, ANGAIS
64;LOT TUROUNET, ANGAIS
64;VC CAMY DE LAS BASCHES, ANGAIS
64;RUE DU BALAITOUS, ANGAIS
64;VC DU BOIS, ANGAIS
64;RUE DU BOIS, ANGAIS
64;RUE BONNECAZE, ANGAIS
64;IMP DES COURNALES, ANGAIS
64;RUE CARREROT DES LIERRES, ANGAIS
64;VC CARREROT DE SAINT JEAN, ANGAIS
64;RUE DU CENTRE, ANGAIS
64;RUE DE LA CHATAIGNERAIE, ANGAIS
64;IMP DU DARRE MOUNICOT, ANGAIS
64;RUE DES ECOLES, ANGAIS
64;RUE LAS CLABADES, ANGAIS
64;RUE DU GABIZOS, ANGAIS
64;RUE DE LA GARE, ANGAIS
64;RUE HENRI IV, ANGAIS
64;RUE DES ISARDS, ANGAIS
64;RUE DU LAC, ANGAIS
64;IMP LAHAILLE, ANGAIS
64;RUE DU LAVOIR, ANGAIS
64;RUE MADELAND, ANGAIS
64;RUE DES MARRONNIERS, ANGAIS
64;CAMI MEDA, ANGAIS
64;RUE D OSSAU, ANGAIS
64;RUE BERTRUC CAMY, ANGAIS
64;RUE COURNALES, ANGAIS
64;IMP DES PYRENEES, ANGAIS
64;IMP DES PAYSANS, ANGAIS
64;RUE DES PAYSANS, ANGAIS
64;RUE DU PIC DU MIDI, ANGAIS
64;RUE DES PINS, ANGAIS
64;RUE DE LA PLAINE, ANGAIS
64;RUE PORTE NEUVE, ANGAIS
64;PL DU PRAT, ANGAIS
64;RUE DU PRE DU ROY, ANGAIS
64;RUE DES PYRENEES, ANGAIS
64;RUE DU VIGNEMALE, ANGAIS
64;RUE DES COLIBRIS, ANGAIS
64;RES ANGLET URGENCE, ANGLET
64;RES ARGHITZEA, ANGLET
64;DOM D ARITXAGUE, ANGLET
64;RES ARROUM, ANGLET
64;RES BERNAIN, ANGLET
64;RES BAYEMBIA, ANGLET
64;LOT CLOS DE MAIGNON, ANGLET
64;RES BERTAL, ANGLET
64;RES LE BOSQUET, ANGLET
64;RES BREGUET, ANGLET
64;LOT LES CATALPAS, ANGLET
64;RES DU CENTRE, ANGLET
64;RES CHASSIN, ANGLET
64;RES LES CHENES, ANGLET
64;RES CLOS SAINT JEAN, ANGLET
64;CITE DES FAUVETTES, ANGLET
64;RES EDERRA, ANGLET
64;RES DES FLEURS, ANGLET
64;RES LES FLEURISTES, ANGLET
64;RES GILALDO, ANGLET
64;RES GRAVILLE, ANGLET
64;RES GORAKI, ANGLET
64;RES MAR, ANGLET
64;RES JOUANETOTTE, ANGLET
64;RES LOURY, ANGLET
64;LOT MONTBRUN, ANGLET
64;RES IDUSKIAN, ANGLET
64;RES JARDINS D ARCADIE, ANGLET
64;LOT KENT RUBBER, ANGLET
64;RES NUMA, ANGLET
64;CITE TIVOLI, ANGLET
64;RES LES SAPINS, ANGLET
64;RES LES TAMARIS, ANGLET
64;RES DES TROIS BOUQUETS, ANGLET
64;LOT HONDRITZ DE HAUT SUTAR, ANGLET
64;LOT LE GUICHON SUTAR, ANGLET
64;RES L UNION, ANGLET
64;CTRE COMMERCIAL BAB 2, ANGLET
64;RES VENISE, ANGLET
64;RES VERT PRE, ANGLET
64;LOT ANGLET VILLAGE, ANGLET
64;HAM HAMEAU DES CYPRES, ANGLET
64;ALL DES ABELIAS, ANGLET
64;ALL DES ABEILLES, ANGLET
64;RUE DES ACACIAS, ANGLET
64;ALL DES ACANTHES, ANGLET
64;AV DE L ADOUR, ANGLET
64;ALL DE L ABBE LARTIGAU, ANGLET
64;ALL DES AEROCLUBS, ANGLET
64;ALL D AGUILERA, ANGLET
64;AV DES AJONCS, ANGLET
64;RUE ALBERT LE BARILLIER, ANGLET
64;ALL ALBERTO THIEBAUT, ANGLET
64;PARC ALBERTE MAITE, ANGLET
64;RUE ALBERTE MAITE, ANGLET
64;ALL DES ALBIZZIAS, ANGLET
64;RUE D ALEXANDRE, ANGLET
64;ALL PETIT ALEXANDRE, ANGLET
64;ALL DES ALIZES, ANGLET
64;ALL DES ALOUETTES, ANGLET
64;ALL DES ALTHEAS, ANGLET
64;ALL ALTAIR, ANGLET
64;RUE AMEDEE DUFOURG, ANGLET
64;ALL DE L AMITIE, ANGLET
64;IMP AMITIE, ANGLET
64;RUE ANDRE BROUSSE, ANGLET
64;ALL DE LA AOUYE, ANGLET
64;ALL ANDROMEDE, ANGLET
64;RUE APOLLON, ANGLET
64;IMP DE L ARAN, ANGLET
64;ALL DES ARBAILLES, ANGLET
64;AV DES ARBOUSIERS, ANGLET
64;IMP DE L ARBEROUE, ANGLET
64;SQ DES FAUVETTES, ANGLET
64;SQ MARQUIS DE LA PORTILLA, ANGLET
64;ALL DE BIGUEYRIE, ANGLET
64;RTE D ARCANGUES, ANGLET
64;RUE D ARCANGUES, ANGLET
64;IMP DE ARGUDIN, ANGLET
64;RUE D ARDENAGUE, ANGLET
64;ALL D ARIOUS, ANGLET
64;ALL ARISTIDE BRIAND, ANGLET
64;RTE D ARITXAGUE, ANGLET
64;QUAI ARMAND GOMMES, ANGLET
64;ALL D ARNAGA, ANGLET
64;RUE D ARREMOUN, ANGLET
64;ALL DE L ARRAYO, ANGLET
64;ALL DES ARROQUES, ANGLET
64;ALL DES ARUMS, ANGLET
64;ALL DE ARTZAMENDY, ANGLET
64;ALL DES ARTISANS, ANGLET
64;ALL D ATCHINECHE, ANGLET
64;RUE DE L ATLANTIQUE, ANGLET
64;ALL DES AUBEPINES, ANGLET
64;RUE D AUGERON, ANGLET
64;RUE AUGUSTE GUIMONT, ANGLET
64;ALL JACQUELINE AURIOL, ANGLET
64;ALL DE L AVENIR, ANGLET
64;ALL ARTEMIS, ANGLET
64;RTE DE L AVIATION, ANGLET
64;ALL DE L AYMADE, ANGLET
64;BD DU BAB, ANGLET
64;RUE DE BAHINOS, ANGLET
64;ALL DE BACQUEYRISSE, ANGLET
64;CHE DE LA BALLASTIERE, ANGLET
64;PROM PROMENADE DE LA BARRE, ANGLET
64;ALL DE BARIBELLI, ANGLET
64;RUE DES BARTHES, ANGLET
64;CHE DES BARTHES, ANGLET
64;RUE DE BASCOT, ANGLET
64;RUE DES BASQUES, ANGLET
64;ALL DU BASSIN, ANGLET
64;RTE DE BASSUSSARRY, ANGLET
64;ALL DU BASTAN, ANGLET
64;RUE MARYSE BASTIE, ANGLET
64;ALL DE LA BASTIDE, ANGLET
64;AV DE BAYONNE, ANGLET
64;ALL BAUDELAIRE, ANGLET
64;RUE DE BEAULIEU, ANGLET
64;IMP DE BECHU, ANGLET
64;PL DE LA BECASSE, ANGLET
64;AV DE LA BECASSE, ANGLET
64;RUE DES BEGONIAS, ANGLET
64;ALL BELHARRA, ANGLET
64;RPT JEAN BERTIN, ANGLET
64;AV BELLE MARION, ANGLET
64;RUE MAURICE BELLONTE, ANGLET
64;RUE BELLEVUE, ANGLET
64;RUE DES BERGERONNETTES, ANGLET
64;AV DE BIARRITZ, ANGLET
64;ALL BIDEXKA, ANGLET
64;ALL BERRAUTE, ANGLET
64;ALL DE BELLEVUE, ANGLET
64;ALL DE BIRAMBEOU, ANGLET
64;RUE DE BITACHON, ANGLET
64;ALL DES BLEUETS, ANGLET
64;CHE DU BOIS, ANGLET
64;AV DU BOIS BELIN, ANGLET
64;RUE DU BOIS BELIN, ANGLET
64;ALL DES BOIS DE FLORENCE, ANGLET
64;ALL DU SOUS BOIS, ANGLET
64;QUAI BLANCPIGNON, ANGLET
64;RUE DU BON, ANGLET
64;ALL DE BORDENAVE, ANGLET
64;RTE DE BORDES, ANGLET
64;RUE DE BOSSUT, ANGLET
64;AV DU BOSQUET, ANGLET
64;ALL DE LA BOUCHONNERIE, ANGLET
